,title_raw,title_text,title_latex,body_raw,body_text,body_latex,tags
0,Derivative: $e^x$. [duplicate],Derivative: . [duplicate],e^x,"This question already has answers here : Using the Limit definition to find the derivative of $e^x$ (7 answers) Closed 9 years ago . How do you differentiate $e^x$? I looked on many sites, including similar questions here but most answers seemed circular. The only known definition of $e$ to be used in this proof is  $$ e=\lim_{n \to\infty} \left(1+\frac{1}n \right)^n $$ What I did is: $$ \begin{align*} (e^x)' &=\lim_{h\to0}\frac{e^{x+h}-e^x}h \\ &= e^x\lim_{h\to0}\frac{e^{h}-1}h \end{align*} $$ But I don't know how to go on, I know  $\lim_{h\to0}\frac{e^{h}-1}h=1$ but I don't know how to prove it, I can't use the $e^x$ taylor expansion as that would imply diferentiating $e^x$. Edit: I also can't use the derivative of $\ln(x)$.","This question already has answers here : Using the Limit definition to find the derivative of $e^x$ (7 answers) Closed 9 years ago . How do you differentiate $e^x$? I looked on many sites, including similar questions here but most answers seemed circular. The only known definition of $e$ to be used in this proof is  $$ e=\lim_{n \to\infty} \left(1+\frac{1}n \right)^n $$ What I did is: $$ \begin{align*} (e^x)' &=\lim_{h\to0}\frac{e^{x+h}-e^x}h \\ &= e^x\lim_{h\to0}\frac{e^{h}-1}h \end{align*} $$ But I don't know how to go on, I know  $\lim_{h\to0}\frac{e^{h}-1}h=1$ but I don't know how to prove it, I can't use the $e^x$ taylor expansion as that would imply diferentiating $e^x$. Edit: I also can't use the derivative of $\ln(x)$.",,"['calculus', 'limits', 'derivatives']"
1,Value of this definite integral $\int_{0}^{\infty} \frac{ \ln(x)}{x^2+2x+4} dx $,Value of this definite integral,\int_{0}^{\infty} \frac{ \ln(x)}{x^2+2x+4} dx ,So I came across this question on brilliant.org and didn't know how to go about it: $$\int_{0}^{\infty} \frac{ \ln(x)}{x^2+2x+4} dx $$ I tried to complete the squares in the denominator and then use a trigonometric substitution (with tan) but I didn't get anything beyond that. How do I do it? Do we need to differentiate under the integral sign here?,So I came across this question on brilliant.org and didn't know how to go about it: $$\int_{0}^{\infty} \frac{ \ln(x)}{x^2+2x+4} dx $$ I tried to complete the squares in the denominator and then use a trigonometric substitution (with tan) but I didn't get anything beyond that. How do I do it? Do we need to differentiate under the integral sign here?,,"['calculus', 'integration', 'definite-integrals']"
2,Showing $x^3$ is not uniformly continuous on $\mathbb{R}$,Showing  is not uniformly continuous on,x^3 \mathbb{R},"Referring to the original source http://math.stanford.edu/~ksound/Math171S10/Hw8Sol_171.pdf Prove that $f(x) = x^3$ is not uniformly continuous on $\Bbb R$. I want to use a more elementary method, no mention of metric spaces. Their selection of $\delta$ confuses me, so I am want to present a more ""elementary"" method. I am unsure if it is correct. Here I picked $|a| > \dfrac{\epsilon}{3\delta}$ and $x > a - \delta$ Thus $$\begin{align} |x^3 - a^3| &= |x - a||x^2 + ax + a^2| \\&>|x^2+ax +a^2| \\&> |(a-\delta)^2+a(a - \delta) + a^2|\\&=|3a^2-3a\delta+\delta^2| \\&> 3\delta|a| \end{align}$$","Referring to the original source http://math.stanford.edu/~ksound/Math171S10/Hw8Sol_171.pdf Prove that $f(x) = x^3$ is not uniformly continuous on $\Bbb R$. I want to use a more elementary method, no mention of metric spaces. Their selection of $\delta$ confuses me, so I am want to present a more ""elementary"" method. I am unsure if it is correct. Here I picked $|a| > \dfrac{\epsilon}{3\delta}$ and $x > a - \delta$ Thus $$\begin{align} |x^3 - a^3| &= |x - a||x^2 + ax + a^2| \\&>|x^2+ax +a^2| \\&> |(a-\delta)^2+a(a - \delta) + a^2|\\&=|3a^2-3a\delta+\delta^2| \\&> 3\delta|a| \end{align}$$",,"['calculus', 'uniform-continuity']"
3,How can I calculate the limit of exponential divided by factorial? [duplicate],How can I calculate the limit of exponential divided by factorial? [duplicate],,"This question already has answers here : Prove that $\lim \limits_{n \to \infty} \frac{x^n}{n!} = 0$, $x \in \Bbb R$. (15 answers) Closed 10 years ago . I suspect this limit is 0, but how can I prove it? $$\lim_{n \to +\infty} \frac{2^{n}}{n!}$$","This question already has answers here : Prove that $\lim \limits_{n \to \infty} \frac{x^n}{n!} = 0$, $x \in \Bbb R$. (15 answers) Closed 10 years ago . I suspect this limit is 0, but how can I prove it? $$\lim_{n \to +\infty} \frac{2^{n}}{n!}$$",,"['calculus', 'limits', 'factorial']"
4,Evaluate the definite integral $\int_0^{2\pi}\arctan\left((a\cos x + b\sin x)^2\right)dx$,Evaluate the definite integral,\int_0^{2\pi}\arctan\left((a\cos x + b\sin x)^2\right)dx,"Writing: Integrate[ArcTan[(a Cos[x] + b Sin[x])^2], {x, 0, 2 Pi}, Assumptions -> a^2 + b^2 > 0] $$\int_0^{2\pi}\arctan\left((a\cos x + b\sin x)^2\right)dx,$$ where $a $ and $b $ are real numbers. I get: 2 Pi ArcTan[Sqrt[1/2 (-1 + Sqrt[1 + (a^2 + b^2)^2])]] $$2\pi\arctan\sqrt{\frac{\sqrt{1 + (a^2 + b^2)^2}-1}2} $$ How to derive this result on paper?","Writing: Integrate[ArcTan[(a Cos[x] + b Sin[x])^2], {x, 0, 2 Pi}, Assumptions -> a^2 + b^2 > 0] where and are real numbers. I get: 2 Pi ArcTan[Sqrt[1/2 (-1 + Sqrt[1 + (a^2 + b^2)^2])]] How to derive this result on paper?","\int_0^{2\pi}\arctan\left((a\cos x + b\sin x)^2\right)dx, a  b  2\pi\arctan\sqrt{\frac{\sqrt{1 + (a^2 + b^2)^2}-1}2} ","['calculus', 'integration', 'definite-integrals']"
5,Evaluate $\int_0^\infty{\frac{\ln x \sin x}{x}dx}$,Evaluate,\int_0^\infty{\frac{\ln x \sin x}{x}dx},"Evaluate$$\int_0^\infty{\frac{\ln x \sin x}{x}dx}$$ I don't know where to start with this integral. Mathematica shows that $-\frac{\gamma\pi}2$ is the answer, so I don't think that it is easy to be solved.","Evaluate$$\int_0^\infty{\frac{\ln x \sin x}{x}dx}$$ I don't know where to start with this integral. Mathematica shows that $-\frac{\gamma\pi}2$ is the answer, so I don't think that it is easy to be solved.",,"['calculus', 'integration', 'definite-integrals', 'improper-integrals']"
6,Show an integration equality without using $\int\frac{\mathrm dx}{x}=\ln|x|+c$,Show an integration equality without using,\int\frac{\mathrm dx}{x}=\ln|x|+c,Show that $$\int_{1}^{t_1t_2}\frac{\mathrm{d} x}{x}=\int_1^{t_1}\frac{\mathrm{d} x}{x}+\int_1^{t_2}\frac{\mathrm{d} x}{x}$$ without using $$\int\frac{\mathrm{d} x}{x}=\ln|x|+c.$$,Show that $$\int_{1}^{t_1t_2}\frac{\mathrm{d} x}{x}=\int_1^{t_1}\frac{\mathrm{d} x}{x}+\int_1^{t_2}\frac{\mathrm{d} x}{x}$$ without using $$\int\frac{\mathrm{d} x}{x}=\ln|x|+c.$$,,['calculus']
7,Show the series $\sum (2^{1/n}-1)$ diverges,Show the series  diverges,\sum (2^{1/n}-1),How to show that the series $$ \sum_{n=1}^\infty (\sqrt[n]{2}-1)$$ diverges ?,How to show that the series $$ \sum_{n=1}^\infty (\sqrt[n]{2}-1)$$ diverges ?,,"['calculus', 'sequences-and-series']"
8,How to find the sum of an alternating series?,How to find the sum of an alternating series?,,"Find whether the series diverges and its sum:   $$\sum_{n = 1}^\infty (-1)^{n+1} \frac{3}{5^n}.$$ I found that the series converges using the Alternating Series test because the absolute value of each $n$ decreases while the value of $n$ increases. Then I took the limit as $x$ approaches infinity of $3/5^x$ which is $0$. But I am not sure how to go about finding the sum at this point. This is a practice exam, so the solution is more important then the actual answer.","Find whether the series diverges and its sum:   $$\sum_{n = 1}^\infty (-1)^{n+1} \frac{3}{5^n}.$$ I found that the series converges using the Alternating Series test because the absolute value of each $n$ decreases while the value of $n$ increases. Then I took the limit as $x$ approaches infinity of $3/5^x$ which is $0$. But I am not sure how to go about finding the sum at this point. This is a practice exam, so the solution is more important then the actual answer.",,['calculus']
9,Derivative of product of three functions: product rule,Derivative of product of three functions: product rule,,"I am trying to find the derivative of $f(x)= xe^x \csc x$, and I am not too sure how to even start. Is it two terms or three? $xe^x$ and $\csc x$ or is it $x$, $e^x$ and $\csc x$? I can't get a proper answer either way. With two terms I get $xe^x(-\csc x\cot x) + \csc x(e^x)$.","I am trying to find the derivative of $f(x)= xe^x \csc x$, and I am not too sure how to even start. Is it two terms or three? $xe^x$ and $\csc x$ or is it $x$, $e^x$ and $\csc x$? I can't get a proper answer either way. With two terms I get $xe^x(-\csc x\cot x) + \csc x(e^x)$.",,[]
10,Prove $\sum_{n=0}^\infty(-1)^n \frac{\Gamma\left(\frac{n+2}{2}\right)}{\Gamma\left(\frac{n+3}{2}\right)}=\frac{1}{\sqrt{\pi}}(\pi-2)$,Prove,\sum_{n=0}^\infty(-1)^n \frac{\Gamma\left(\frac{n+2}{2}\right)}{\Gamma\left(\frac{n+3}{2}\right)}=\frac{1}{\sqrt{\pi}}(\pi-2),"I am trying to evaluate this sum: $$\sum_{n=0}^\infty(-1)^n \frac{\Gamma\left(\frac{n+2}{2}\right)}{\Gamma\left(\frac{n+3}{2}\right)}$$ Wolfram alpha is not able to get a closed form, but the approximation it gives resembles the value of $$\frac{1}{\sqrt{\pi}}(\pi-2)$$ and this can be proved using an integral and interchanging it with the sum. However, I am looking for a proof that doesn't require the use of integrals , if it exists. By the way, this is just a special case of the most general $$\sum_{n=0}^\infty(-1)^n \frac{\Gamma\left(\frac{n+a+1}{2}\right)}{\Gamma\left(\frac{n+a+2}{2}\right)}=\frac{2^{a-1}}{\sqrt\pi}\frac{a\Gamma^2\left(\frac{a}{2}\right)-2\Gamma^2\left(\frac{a+1}{2}\right)}  {\Gamma(a)}$$ I wasn't able to prove this result, in any way, so If someone knows a proof to this or the previous result I'd like to read it. EDIT: Thank you all for your solutions. Now in order to try to solve the general $a$ sum, consider that it is sufficient to evaluate the following integral: $$\int_0^{\frac{\pi}{2}}\frac{\cos^a(x)}{1+\cos(x)}dx$$ Just expand $\frac{1}{1+\cos(x)}$ as a geometric series and then use Wallis integral to convince yourself of this fact. I didn't include this fact before because I didn't want solutions that rely on this integral, since it seems much more doable then the sum, but now I feel it can help to get a full proof that otherwise would be very tough. I tried to evaluate the integral and got the infamous series, so if you have any ideas...","I am trying to evaluate this sum: Wolfram alpha is not able to get a closed form, but the approximation it gives resembles the value of and this can be proved using an integral and interchanging it with the sum. However, I am looking for a proof that doesn't require the use of integrals , if it exists. By the way, this is just a special case of the most general I wasn't able to prove this result, in any way, so If someone knows a proof to this or the previous result I'd like to read it. EDIT: Thank you all for your solutions. Now in order to try to solve the general sum, consider that it is sufficient to evaluate the following integral: Just expand as a geometric series and then use Wallis integral to convince yourself of this fact. I didn't include this fact before because I didn't want solutions that rely on this integral, since it seems much more doable then the sum, but now I feel it can help to get a full proof that otherwise would be very tough. I tried to evaluate the integral and got the infamous series, so if you have any ideas...",\sum_{n=0}^\infty(-1)^n \frac{\Gamma\left(\frac{n+2}{2}\right)}{\Gamma\left(\frac{n+3}{2}\right)} \frac{1}{\sqrt{\pi}}(\pi-2) \sum_{n=0}^\infty(-1)^n \frac{\Gamma\left(\frac{n+a+1}{2}\right)}{\Gamma\left(\frac{n+a+2}{2}\right)}=\frac{2^{a-1}}{\sqrt\pi}\frac{a\Gamma^2\left(\frac{a}{2}\right)-2\Gamma^2\left(\frac{a+1}{2}\right)}  {\Gamma(a)} a \int_0^{\frac{\pi}{2}}\frac{\cos^a(x)}{1+\cos(x)}dx \frac{1}{1+\cos(x)},"['calculus', 'integration', 'sequences-and-series', 'definite-integrals', 'gamma-function']"
11,Compute $\int_0^{\pi/2}\frac{\cos{x}}{2-\sin{2x}}dx$,Compute,\int_0^{\pi/2}\frac{\cos{x}}{2-\sin{2x}}dx,"How can I evaluate the following integral? $$I=\int_0^{\pi/2}\frac{\cos{x}}{2-\sin{2x}}dx$$ I tried it with Wolfram Alpha, it gave me a numerical solution: $0.785398$. Although I immediately know that it is equal to $\pi /4$, I fail to obtain the answer with pen and paper. I tried to use substitution $u=\tan{x}$, but I failed because the upper limit of the integral is $\pi/2$ and $\tan{\pi/2}$ is undefined. So how are we going to evaluate this integral? Thanks.","How can I evaluate the following integral? $$I=\int_0^{\pi/2}\frac{\cos{x}}{2-\sin{2x}}dx$$ I tried it with Wolfram Alpha, it gave me a numerical solution: $0.785398$. Although I immediately know that it is equal to $\pi /4$, I fail to obtain the answer with pen and paper. I tried to use substitution $u=\tan{x}$, but I failed because the upper limit of the integral is $\pi/2$ and $\tan{\pi/2}$ is undefined. So how are we going to evaluate this integral? Thanks.",,"['calculus', 'integration', 'trigonometry', 'pi']"
12,"Quadratic Formula, nature of roots with Trigonometric Functions","Quadratic Formula, nature of roots with Trigonometric Functions",,"The original problem: If $0\le a,b\le 3$ and the equation $$x^2+4+3\cos(ax+b)=2x$$ has at least one real solution, then find the value of $a+b$ $$$$ At first, on rearranging, I got the following expression: $$x^2-2x+(4+3\cos(ax+b))=0$$ I thought this was a quadratic in $x$, and thus from the quadratic formula(and that at least one real root exists), $D\ge 0$ ie $$4-4(4+\cos(ax+b))\ge 0$$  $$$$ However I'm not really sure about this. I've treated $\cos(ax+b)$ as a constant term even though the argument of the cosine includes $x$: the variable in which the quadratic expression is. $$$$Under these circumstances, is it correct to use $3\cos(ax+b)$ as a constant? If not, how could I use the quadratic formula to find values of $x$ satisfying $$x^2-2x+(4+3\cos(ax+b))=0$$ Many thanks in anticipation!","The original problem: If $0\le a,b\le 3$ and the equation $$x^2+4+3\cos(ax+b)=2x$$ has at least one real solution, then find the value of $a+b$ $$$$ At first, on rearranging, I got the following expression: $$x^2-2x+(4+3\cos(ax+b))=0$$ I thought this was a quadratic in $x$, and thus from the quadratic formula(and that at least one real root exists), $D\ge 0$ ie $$4-4(4+\cos(ax+b))\ge 0$$  $$$$ However I'm not really sure about this. I've treated $\cos(ax+b)$ as a constant term even though the argument of the cosine includes $x$: the variable in which the quadratic expression is. $$$$Under these circumstances, is it correct to use $3\cos(ax+b)$ as a constant? If not, how could I use the quadratic formula to find values of $x$ satisfying $$x^2-2x+(4+3\cos(ax+b))=0$$ Many thanks in anticipation!",,"['calculus', 'algebra-precalculus', 'geometry', 'trigonometry', 'quadratics']"
13,Plotting $f(x) = \sin(x)+\cos(x)$ by converting it to another form,Plotting  by converting it to another form,f(x) = \sin(x)+\cos(x),Are there any trigonometric identity that can make $f(x) = \sin(x)+\cos(x)$ easier to plot? I have no idea how it becomes a sin graph shape in the end.,Are there any trigonometric identity that can make easier to plot? I have no idea how it becomes a sin graph shape in the end.,f(x) = \sin(x)+\cos(x),"['calculus', 'algebra-precalculus', 'trigonometry', 'graphing-functions']"
14,An example of an infinitely differentiable function with compact support,An example of an infinitely differentiable function with compact support,,"Could anyone give me a function infinitely differentiable on the real line and having a compact support? And the function must be nonnegative and normalized, i.e. the integration of the function on the real line must be one. I tried to think of one myself, but it seems trickier than expected.","Could anyone give me a function infinitely differentiable on the real line and having a compact support? And the function must be nonnegative and normalized, i.e. the integration of the function on the real line must be one. I tried to think of one myself, but it seems trickier than expected.",,['calculus']
15,Pretty Simple Integral,Pretty Simple Integral,,"I am trying to find the following indefinite integral: $$ \int \sqrt{x^2+x^4}dx $$ At first, it seems like an easy u-substitution after we factor out an $x^2$ from the square root, but when we do that we are making the implicit assumption that $x \in \mathbb{R}^+$ or zero. Would the correct way be to do the two cases, when x is positive and x is negative, or is there a way to step around that assumption and arrive at one answer for both?","I am trying to find the following indefinite integral: $$ \int \sqrt{x^2+x^4}dx $$ At first, it seems like an easy u-substitution after we factor out an $x^2$ from the square root, but when we do that we are making the implicit assumption that $x \in \mathbb{R}^+$ or zero. Would the correct way be to do the two cases, when x is positive and x is negative, or is there a way to step around that assumption and arrive at one answer for both?",,"['calculus', 'integration']"
16,What is the quickest way to show that the integral equals zero?,What is the quickest way to show that the integral equals zero?,,Let $a=x_0<\ldots<x_n=b$ be equidistant sampling points with $n$ being an even number. How can one show that $$\int_a^b \prod_{k=0}^n(x-x_k) \ \text{d}x=0$$ in a fast way? I showed it by proving that $\prod_{k=0}^n(x-x_k)$ is an odd function w.r.t. $\frac{a+b}{2}$ and then substituting to shift the boundaries of integration. This was quite tedious and I thought maybe there is a quick and smart argument to show it's zero.,Let $a=x_0<\ldots<x_n=b$ be equidistant sampling points with $n$ being an even number. How can one show that $$\int_a^b \prod_{k=0}^n(x-x_k) \ \text{d}x=0$$ in a fast way? I showed it by proving that $\prod_{k=0}^n(x-x_k)$ is an odd function w.r.t. $\frac{a+b}{2}$ and then substituting to shift the boundaries of integration. This was quite tedious and I thought maybe there is a quick and smart argument to show it's zero.,,"['calculus', 'integration']"
17,Question about Euler's approach to find $\sum_{n=1}^\infty\frac1{n^2}=\frac{\pi^2}6$,Question about Euler's approach to find,\sum_{n=1}^\infty\frac1{n^2}=\frac{\pi^2}6,"For a freshman calculus project, I used Euler's approach to find $\sum_{n=1}^\infty\frac1{n^2}=\frac{\pi^2}6$, and noted from Wikipedia's explanation that the infinite product representation of $\frac{\sin x}x=\prod_{n=1}^\infty(1-\frac{x^2}{n^2\pi^2})$ is unjustified without Weierstrass' factorization theorem. I'm finding it very difficult to follow the article about Weierstrass' theorem. Can someone explain to me what's unjustified about Euler's infinite product representation? Since $\frac{\sin(x)}x$ has a Taylor polynomial representation, and I think all polynomials have roots (in the set of complex numbers), shouldn't it also have a infinite product of roots representation? Can someone explain to me what Weierstrass' theorem does to justify Euler's representation, and if it's within the ability of a freshman calculus student, can someone show me a proof that is more accessible that the ones I've found by Googling? Thanks for your time. This is a very interesting problem and very different from the ones I'm used to doing in my calculus class.","For a freshman calculus project, I used Euler's approach to find $\sum_{n=1}^\infty\frac1{n^2}=\frac{\pi^2}6$, and noted from Wikipedia's explanation that the infinite product representation of $\frac{\sin x}x=\prod_{n=1}^\infty(1-\frac{x^2}{n^2\pi^2})$ is unjustified without Weierstrass' factorization theorem. I'm finding it very difficult to follow the article about Weierstrass' theorem. Can someone explain to me what's unjustified about Euler's infinite product representation? Since $\frac{\sin(x)}x$ has a Taylor polynomial representation, and I think all polynomials have roots (in the set of complex numbers), shouldn't it also have a infinite product of roots representation? Can someone explain to me what Weierstrass' theorem does to justify Euler's representation, and if it's within the ability of a freshman calculus student, can someone show me a proof that is more accessible that the ones I've found by Googling? Thanks for your time. This is a very interesting problem and very different from the ones I'm used to doing in my calculus class.",,"['calculus', 'sequences-and-series', 'summation', 'riemann-zeta', 'products']"
18,Solve without using L'H么pital's rule?,Solve without using L'H么pital's rule?,,Is it possible to solve this without using L'H么pital's rule? $$ \lim_{x\to 0} \Big(\frac{3x+1}{x}-\frac{1}{\sin x}\Big) $$ I tried to solve it but I got stuck at the $\frac{1}{\sin x}$ part. $$ =\lim_{x\to 0}\frac{3+x^{-1}}{1}-\lim_{x\to 0}\frac{1}{\sin x} $$ since $\lim_{x\to 0}\frac{1}{\sin x}$  does not exist.,Is it possible to solve this without using L'H么pital's rule? $$ \lim_{x\to 0} \Big(\frac{3x+1}{x}-\frac{1}{\sin x}\Big) $$ I tried to solve it but I got stuck at the $\frac{1}{\sin x}$ part. $$ =\lim_{x\to 0}\frac{3+x^{-1}}{1}-\lim_{x\to 0}\frac{1}{\sin x} $$ since $\lim_{x\to 0}\frac{1}{\sin x}$  does not exist.,,['calculus']
19,Integral: $\int_{0}^{1}\frac{\arctan^{2}\left(x\right)}{x}dx$,Integral:,\int_{0}^{1}\frac{\arctan^{2}\left(x\right)}{x}dx,"Context : While working on a contour integral for fun, I stumbled upon the following integral: $$\int_{0}^{1}\frac{\arctan^{2}\left(x\right)}{x}dx.$$ I typed it into WolframAlpha and got that it equals $$\frac{1}{8}(4\pi C - 7\zeta{(3)}),$$ where $C$ denotes Catalan's Constant and $\zeta{(3)}$ denotes Apery's Constant. Attempt : Let's call the original integral $I$ . At first, I tried IBP, then letting $x = \tan{(\theta)}$ , then IBP again like this: $$ \eqalign{ I &= -2\int_{0}^{1}\frac{\arctan\left(x\right)\ln\left(x\right)}{1+x^{2}}dx \cr &= -2\int_{0}^{\frac{\pi}{4}}x\ln\left(\tan\left(x\right)\right)dx \cr &= 2\int_{0}^{\frac{\pi}{4}}\frac{x^{2}}{\sin\left(2x\right)}dx. } $$ At that point, I decided I was using IBP an unnecessary amount of times and figured there has to be a nicer solution. I also tried differentiating with respect to a parameter $a$ and defining $$J(a) = -2\int_{0}^{1}\frac{\arctan\left(x\right)\ln\left(ax\right)}{1+x^{2}}dx,$$ but I ended up circling back to where I started after doing a lot of grunt work. I also tried $$ -2\int_{0}^{\frac{\pi}{4}}x\ln\left(\tan\left(x\right)\right)dx = -2\int_{0}^{\frac{\pi}{4}}x\ln\left(\sin\left(x\right)\right)dx+2\int_{0}^{\frac{\pi}{4}}x\ln\left(\cos\left(x\right)\right)dx$$ and using Taylor Series and complex definitions of $\sin{(x)}$ and $\cos{(x)}$ , but I was getting a mess. Question : Does anyone know a nice way of solving the given integral? If it's not a pretty solution, it's fine. Any hints and help are appreciated.","Context : While working on a contour integral for fun, I stumbled upon the following integral: I typed it into WolframAlpha and got that it equals where denotes Catalan's Constant and denotes Apery's Constant. Attempt : Let's call the original integral . At first, I tried IBP, then letting , then IBP again like this: At that point, I decided I was using IBP an unnecessary amount of times and figured there has to be a nicer solution. I also tried differentiating with respect to a parameter and defining but I ended up circling back to where I started after doing a lot of grunt work. I also tried and using Taylor Series and complex definitions of and , but I was getting a mess. Question : Does anyone know a nice way of solving the given integral? If it's not a pretty solution, it's fine. Any hints and help are appreciated.","\int_{0}^{1}\frac{\arctan^{2}\left(x\right)}{x}dx. \frac{1}{8}(4\pi C - 7\zeta{(3)}), C \zeta{(3)} I x = \tan{(\theta)} 
\eqalign{
I &= -2\int_{0}^{1}\frac{\arctan\left(x\right)\ln\left(x\right)}{1+x^{2}}dx \cr
&= -2\int_{0}^{\frac{\pi}{4}}x\ln\left(\tan\left(x\right)\right)dx \cr
&= 2\int_{0}^{\frac{\pi}{4}}\frac{x^{2}}{\sin\left(2x\right)}dx.
}
 a J(a) = -2\int_{0}^{1}\frac{\arctan\left(x\right)\ln\left(ax\right)}{1+x^{2}}dx,  -2\int_{0}^{\frac{\pi}{4}}x\ln\left(\tan\left(x\right)\right)dx = -2\int_{0}^{\frac{\pi}{4}}x\ln\left(\sin\left(x\right)\right)dx+2\int_{0}^{\frac{\pi}{4}}x\ln\left(\cos\left(x\right)\right)dx \sin{(x)} \cos{(x)}","['calculus', 'integration', 'definite-integrals']"
