,title_raw,title_text,title_latex,body_raw,body_text,body_latex,tags
20,"What does it mean when you use the ""d"" in a derivative as a variable? [duplicate]","What does it mean when you use the ""d"" in a derivative as a variable? [duplicate]",,"This question already has answers here : Notation of the second derivative - Where does the $d$ go? [duplicate] (5 answers) Closed 3 years ago . It's been over 15 years since I last did anything with calculus at school, and I've forgotten most things, so please be gentle with your answers. :) One thing that has always bugged me when getting into more advanced stuff was that the derivative simbols are suddenly manipulated in a way that doesn't make sense to me. For example, let's take the simple equation $$y=12x^2+24x+45$$ An alternative notation for the same thing would be: $$f(x)=12x^2+24x+45$$ Here we merely substituted $y$ for $f(x)$ . It means the same thing. If memory serves me right, when we take the first derivative of this function, we have three ways we can write it: $$y'=24x+24$$ $$f'(x)=24x+24$$ $$\frac{dy}{dx}=24x+24$$ Now, it's this third notation that I'm talking about here. To my understanding the $\frac{dy}{dx}$ doesn't really mean anything by itself. It's just another way to specify that we're talking about a derivative of a function, just like the $'$ in the other two notations. But then sometimes I come across an equation like this : $$m\frac{\text{d}^2\mathbf{r}}{\text{d}t^2} = \frac{kqq'}{|\mathbf{r}|^2},$$ And here suddenly the $d$ is being treated like a variable, not to mention the $t$ and... And if memory serves me right, I've seen ever more extreme examples where the fraction $\frac{dy}{dx}$ itself is taken apart and each of the components used as a variable. I think this was popular back in university when I was talking course on differential equations. Barely passed that, half of it didn't make sense, and this was a large part of the reason why. I don't remember why I never asked my teacher about it back then. So... what does it mean when we start to break the $\frac{dy}{dx}$ apart?","This question already has answers here : Notation of the second derivative - Where does the $d$ go? [duplicate] (5 answers) Closed 3 years ago . It's been over 15 years since I last did anything with calculus at school, and I've forgotten most things, so please be gentle with your answers. :) One thing that has always bugged me when getting into more advanced stuff was that the derivative simbols are suddenly manipulated in a way that doesn't make sense to me. For example, let's take the simple equation An alternative notation for the same thing would be: Here we merely substituted for . It means the same thing. If memory serves me right, when we take the first derivative of this function, we have three ways we can write it: Now, it's this third notation that I'm talking about here. To my understanding the doesn't really mean anything by itself. It's just another way to specify that we're talking about a derivative of a function, just like the in the other two notations. But then sometimes I come across an equation like this : And here suddenly the is being treated like a variable, not to mention the and... And if memory serves me right, I've seen ever more extreme examples where the fraction itself is taken apart and each of the components used as a variable. I think this was popular back in university when I was talking course on differential equations. Barely passed that, half of it didn't make sense, and this was a large part of the reason why. I don't remember why I never asked my teacher about it back then. So... what does it mean when we start to break the apart?","y=12x^2+24x+45 f(x)=12x^2+24x+45 y f(x) y'=24x+24 f'(x)=24x+24 \frac{dy}{dx}=24x+24 \frac{dy}{dx} ' m\frac{\text{d}^2\mathbf{r}}{\text{d}t^2} = \frac{kqq'}{|\mathbf{r}|^2}, d t \frac{dy}{dx} \frac{dy}{dx}","['calculus', 'notation']"
21,Feynman's trick to evaluate the integral $\int\limits_{0}^{2\pi}\sin^{8}(x)dx$ [closed],Feynman's trick to evaluate the integral  [closed],\int\limits_{0}^{2\pi}\sin^{8}(x)dx,"Closed. This question does not meet Mathematics Stack Exchange guidelines . It is not currently accepting answers. Please provide additional context , which ideally explains why the question is relevant to you and our  community. Some forms of context include: background and motivation, relevant definitions, source, possible strategies, your current progress, why the question is interesting or important, etc. Closed 2 years ago . Improve this question I would like to evaluate the following integral using differentiation under the integral sign. $$\int\limits_{0}^{2\pi}\sin^{8}(x)dx$$ Unfortunately, I can't come up with a proper choice for a function with a parameter. $\sin^{8}(ax)$ won't work out, neither will $\sin^{a}(x)$ ... So maybe someone could give me a hint to make an appropriate choice of that function. Thanks!","Closed. This question does not meet Mathematics Stack Exchange guidelines . It is not currently accepting answers. Please provide additional context , which ideally explains why the question is relevant to you and our  community. Some forms of context include: background and motivation, relevant definitions, source, possible strategies, your current progress, why the question is interesting or important, etc. Closed 2 years ago . Improve this question I would like to evaluate the following integral using differentiation under the integral sign. Unfortunately, I can't come up with a proper choice for a function with a parameter. won't work out, neither will ... So maybe someone could give me a hint to make an appropriate choice of that function. Thanks!",\int\limits_{0}^{2\pi}\sin^{8}(x)dx \sin^{8}(ax) \sin^{a}(x),"['calculus', 'integration', 'definite-integrals', 'leibniz-integral-rule']"
22,Perfect understanding of Riemann Sums,Perfect understanding of Riemann Sums,,"I am not sure  I have completely and properly understood Riemann sums. Given a sum like: $$S_n = \displaystyle\sum_{r=1}^n \dfrac{r^4+ r^3n +r^2n^2 +2n^4}{n^5}$$ After dividing by $n^4$ we will get several $r/n$ s, how is it that they represent $x$ when we take the $\lim_{n\to \infty}S_n$ ? What would be the width of the Riemann sum? Someone told me that the width is one but then when we take $\lim_{n \to \infty}$ , the width becomes $\frac{1}{n} = dx$ ? How is that? How do we actually graph them? I tried plotting them on Desmos but in vain. So I would like to receive a proper answer on Riemann sums, preferably with neat graphs covering the following aspects: Left and Right Riemann sums Limit of Riemann sum Graphing Riemann sums Intricacies like $r/n$ represents $x$ and $1/n$ represents $dx$ Other things that might be useful to future readers and me.","I am not sure  I have completely and properly understood Riemann sums. Given a sum like: After dividing by we will get several s, how is it that they represent when we take the ? What would be the width of the Riemann sum? Someone told me that the width is one but then when we take , the width becomes ? How is that? How do we actually graph them? I tried plotting them on Desmos but in vain. So I would like to receive a proper answer on Riemann sums, preferably with neat graphs covering the following aspects: Left and Right Riemann sums Limit of Riemann sum Graphing Riemann sums Intricacies like represents and represents Other things that might be useful to future readers and me.",S_n = \displaystyle\sum_{r=1}^n \dfrac{r^4+ r^3n +r^2n^2 +2n^4}{n^5} n^4 r/n x \lim_{n\to \infty}S_n \lim_{n \to \infty} \frac{1}{n} = dx r/n x 1/n dx,"['calculus', 'integration', 'riemann-sum']"
23,Integral $\int_1^3 \frac{\log x}{x^2+3}dx$,Integral,\int_1^3 \frac{\log x}{x^2+3}dx,I stumbled upon this integral $$I=\int_1^3 \frac{\log x}{x^2+3}dx$$ Since the answer given by Wolfram-Alpha is $I=\frac{\pi \log 3}{12\sqrt3}$ I tried to work near the bounds of the integral because as a indefinite integral it will involve some polylogarythms which I want to avoid. But not a single substitution  like $x=\frac{1}{y}$ or $x-2=u$ gave any better look to this integral. And when integrated by parts I feel like it got worse. Could you perhaps help me on this?,I stumbled upon this integral $$I=\int_1^3 \frac{\log x}{x^2+3}dx$$ Since the answer given by Wolfram-Alpha is $I=\frac{\pi \log 3}{12\sqrt3}$ I tried to work near the bounds of the integral because as a indefinite integral it will involve some polylogarythms which I want to avoid. But not a single substitution  like $x=\frac{1}{y}$ or $x-2=u$ gave any better look to this integral. And when integrated by parts I feel like it got worse. Could you perhaps help me on this?,,"['calculus', 'integration', 'definite-integrals']"
24,Complex Definite Integral: $\int _0^1\frac{dx}{\left(1+\sqrt{x}\right)^4}$,Complex Definite Integral:,\int _0^1\frac{dx}{\left(1+\sqrt{x}\right)^4},"Compute the following definite integral: $$\int _0^1\frac{dx}{\left(1+\sqrt{x}\right)^4}$$ This is what I did: $$\int _0^1\frac{1}{\left(1+\sqrt{x}\right)^4} \, dx$$ $$u = \sqrt{x}$$ $$\frac{du}{dx}=\frac{1}{2}x^{-\frac{1}{2}} \, dx$$ $$du = \frac{1}{2\sqrt{x}} \, dx$$ And after this I just got stuck. How exactly am I supposed to write $du$ in terms of the initial integral? I can't double it and nor can I leave it as is because of the $+1$. Am I supposed to make $u = 1 + \sqrt{x}$ instead or is there a way to do it with the current $du$? Any help?","Compute the following definite integral: $$\int _0^1\frac{dx}{\left(1+\sqrt{x}\right)^4}$$ This is what I did: $$\int _0^1\frac{1}{\left(1+\sqrt{x}\right)^4} \, dx$$ $$u = \sqrt{x}$$ $$\frac{du}{dx}=\frac{1}{2}x^{-\frac{1}{2}} \, dx$$ $$du = \frac{1}{2\sqrt{x}} \, dx$$ And after this I just got stuck. How exactly am I supposed to write $du$ in terms of the initial integral? I can't double it and nor can I leave it as is because of the $+1$. Am I supposed to make $u = 1 + \sqrt{x}$ instead or is there a way to do it with the current $du$? Any help?",,"['calculus', 'integration', 'definite-integrals']"
25,Evaluate the infinite product $\prod_{n=1}^{\infty} \left(1-\frac{2}{(2n+1)^2}\right)$,Evaluate the infinite product,\prod_{n=1}^{\infty} \left(1-\frac{2}{(2n+1)^2}\right),$$\prod_{n=1}^{\infty} \left(1-\frac{2}{(2n+1)^2}\right)$$ I've seen some similar questions asked. But this one is different from all these. Euler product does not apply. One cannot simply factorize $\left(1-\frac{2}{(2n+1)^2}\right)$ since the $\sqrt{2}$ on top will prevent terms from cancelling. Any help will be appreciated! Note: we are expected to solve this in 2 mins.,$$\prod_{n=1}^{\infty} \left(1-\frac{2}{(2n+1)^2}\right)$$ I've seen some similar questions asked. But this one is different from all these. Euler product does not apply. One cannot simply factorize $\left(1-\frac{2}{(2n+1)^2}\right)$ since the $\sqrt{2}$ on top will prevent terms from cancelling. Any help will be appreciated! Note: we are expected to solve this in 2 mins.,,"['calculus', 'combinatorics', 'infinite-product']"
26,Fractional Order Derivative,Fractional Order Derivative,,"A friend and I were talking about derivatives, and he asked an interesting question. Since both of us have not taken our calculus courses yet, neither of us were sure of the answer. His question has two parts: 1. can you have a fractional order derivative i.e. could you have $\frac{d^ny(x)}{dx^n}$ where, for example, $n=\frac{1}{2}$? And, 2. can you have a variable as the order of a derivative i.e. $\frac{d^ny(x)}{dx^n}$ where n=some variable? I have doubts as to whether either are even possible, but I decided to post the qestion to find out for sure.","A friend and I were talking about derivatives, and he asked an interesting question. Since both of us have not taken our calculus courses yet, neither of us were sure of the answer. His question has two parts: 1. can you have a fractional order derivative i.e. could you have $\frac{d^ny(x)}{dx^n}$ where, for example, $n=\frac{1}{2}$? And, 2. can you have a variable as the order of a derivative i.e. $\frac{d^ny(x)}{dx^n}$ where n=some variable? I have doubts as to whether either are even possible, but I decided to post the qestion to find out for sure.",,"['calculus', 'analysis', 'derivatives', 'fractional-calculus', 'fractional-differential-equations']"
27,Find a limit without l'Hospital: $\lim_{x\to -\infty}\left(\frac{\ln(2^x + 1)}{\ln(3^x+ 1)}\right)$,Find a limit without l'Hospital:,\lim_{x\to -\infty}\left(\frac{\ln(2^x + 1)}{\ln(3^x+ 1)}\right),Find $\displaystyle \lim_{x\to -\infty}\left(\frac{\ln(2^x + 1)}{\ln(3^x+ 1)}\right)$. $\displaystyle \lim_{x\to -\infty}\left(\frac{\ln(2^x + 1)}{\ln(3^x+ 1)}\right)$ =   $\displaystyle \lim_{x\to -\infty}\left(\frac{\ln2^x + \ln(1+\frac{1}{2^x})}{\ln3^x + \ln(1+\frac{1}{3^x})}\right)$ =   $\displaystyle \lim_{x\to -\infty}\left(\frac{\ln2^x + \frac{1}{2^x}\ln(1+\frac{1}{2^x})^{2^{x}}}{\ln3^x + \frac{1}{3^x}\ln(1+\frac{1}{3^x})^{3^{x}}}\right)$ = $\cdots$ This method is not working.,Find $\displaystyle \lim_{x\to -\infty}\left(\frac{\ln(2^x + 1)}{\ln(3^x+ 1)}\right)$. $\displaystyle \lim_{x\to -\infty}\left(\frac{\ln(2^x + 1)}{\ln(3^x+ 1)}\right)$ =   $\displaystyle \lim_{x\to -\infty}\left(\frac{\ln2^x + \ln(1+\frac{1}{2^x})}{\ln3^x + \ln(1+\frac{1}{3^x})}\right)$ =   $\displaystyle \lim_{x\to -\infty}\left(\frac{\ln2^x + \frac{1}{2^x}\ln(1+\frac{1}{2^x})^{2^{x}}}{\ln3^x + \frac{1}{3^x}\ln(1+\frac{1}{3^x})^{3^{x}}}\right)$ = $\cdots$ This method is not working.,,"['calculus', 'limits', 'limits-without-lhopital']"
28,"Show that, for all $n > 1: \frac{1}{n + 1} < \log(1 + \frac1n) < \frac1n.$ [duplicate]","Show that, for all  [duplicate]",n > 1: \frac{1}{n + 1} < \log(1 + \frac1n) < \frac1n.,"This question already has answers here : Showing $\frac{x}{1+x}<\log(1+x)<x$ for all $x>0$ using the mean value theorem [duplicate] (5 answers) Closed 6 years ago . I'm learning calculus, specifically derivatives and applications of MVT, and need help with the following exercice: Show that, for all $n > 1$ $$\frac{1}{n + 1} < \log(1 + \frac1n) < \frac1n.$$ I tried to follow the below steps in order to prove the RHS inequality: Proving that $f < g$ on $I$ from $a$ to $b$: Step $1$. Prove that $f' < g'$ on $\operatorname{Int}(I)$. Step $2$. Show that $f(a) \leq g(a)$ or that $f(a^+) \leq g(a^+)$ Following the above steps, let $f(x) = \log(1 + \frac1x)$ and $g(x) = \frac1x$, for all $x > 1$. One has $$f'(x) =  -\frac{1}{x^2 + x} \quad \text{and} \quad g'(x) = -\frac{1}{x^2}.$$ We note that, for every $x > 1$, $f'(x) > g'(x)$. Moreover, $f(1^+) = \log(2) < 1 = g(1^+).$ My problem is that I got the wrong inequality sign in Step $1$ . Looking at the solution in my textbook, the author suggests using the MVT but I don't know how to apply it in this case.","This question already has answers here : Showing $\frac{x}{1+x}<\log(1+x)<x$ for all $x>0$ using the mean value theorem [duplicate] (5 answers) Closed 6 years ago . I'm learning calculus, specifically derivatives and applications of MVT, and need help with the following exercice: Show that, for all $n > 1$ $$\frac{1}{n + 1} < \log(1 + \frac1n) < \frac1n.$$ I tried to follow the below steps in order to prove the RHS inequality: Proving that $f < g$ on $I$ from $a$ to $b$: Step $1$. Prove that $f' < g'$ on $\operatorname{Int}(I)$. Step $2$. Show that $f(a) \leq g(a)$ or that $f(a^+) \leq g(a^+)$ Following the above steps, let $f(x) = \log(1 + \frac1x)$ and $g(x) = \frac1x$, for all $x > 1$. One has $$f'(x) =  -\frac{1}{x^2 + x} \quad \text{and} \quad g'(x) = -\frac{1}{x^2}.$$ We note that, for every $x > 1$, $f'(x) > g'(x)$. Moreover, $f(1^+) = \log(2) < 1 = g(1^+).$ My problem is that I got the wrong inequality sign in Step $1$ . Looking at the solution in my textbook, the author suggests using the MVT but I don't know how to apply it in this case.",,"['calculus', 'derivatives', 'inequality', 'logarithms']"
29,Solutions to $\frac1{\lfloor x\rfloor}+\frac1{\lfloor 2x\rfloor}=\{x\}+\frac13$,Solutions to,\frac1{\lfloor x\rfloor}+\frac1{\lfloor 2x\rfloor}=\{x\}+\frac13,"Find all solutions to $$\dfrac{1}{\lfloor x\rfloor}+\dfrac{1}{\lfloor 2x\rfloor}=\{x\}+\dfrac{1}{3}$$ $$$$ Unfortunately I have no idea as to how to go about this. On rearranging, I got $$3\lfloor 2x\rfloor = 3\lfloor x\rfloor\{x\}-2\lfloor x\rfloor$$ I'm not sure about what to do with the $3\lfloor 2x\rfloor $ term; I'd prefer to resolve it in terms of $\lfloor x\rfloor $ but am not able to. All that struck me was using the identity for $\lfloor nx\rfloor, n\in \Bbb Z$. However on first glance, it did not strike me as particularly useful.$$$$ I would be grateful for any help. Many thanks!","Find all solutions to $$\dfrac{1}{\lfloor x\rfloor}+\dfrac{1}{\lfloor 2x\rfloor}=\{x\}+\dfrac{1}{3}$$ $$$$ Unfortunately I have no idea as to how to go about this. On rearranging, I got $$3\lfloor 2x\rfloor = 3\lfloor x\rfloor\{x\}-2\lfloor x\rfloor$$ I'm not sure about what to do with the $3\lfloor 2x\rfloor $ term; I'd prefer to resolve it in terms of $\lfloor x\rfloor $ but am not able to. All that struck me was using the identity for $\lfloor nx\rfloor, n\in \Bbb Z$. However on first glance, it did not strike me as particularly useful.$$$$ I would be grateful for any help. Many thanks!",,"['calculus', 'number-theory', 'functions', 'ceiling-and-floor-functions']"
30,Negation of the Definition of Limit of a Function,Negation of the Definition of Limit of a Function,,"Question Suppose we are dealing with real valued functions $f(x)$ of one real variable $x$. We say that the limit of $f(x)$ at point $a$ exists and equals to $L$ if and only if $$\exists L:\left( {\forall \varepsilon  > 0,\exists \delta  > 0:\left( {\forall x,0 < \left| {x - a} \right| < \delta  \implies \left| {f(x) - L} \right| < \varepsilon } \right)} \right)$$ and show this by the symbolism $$\mathop {\lim f(x)}\limits_{x \to a}  = L$$ Now, what do we say when we want to state that the limit of function $f(x)$ does not exist at $a$? In fact, what is the negation of the above statement? I am interested to obtain the negation with a step by step approach using tautologies in logic . To be specific, I want to start from $$\neg \left[ {\exists L:\left( {\forall \varepsilon  > 0,\exists \delta  > 0:\left( {\forall x,0 < \left| {x - a} \right| < \delta  \implies \left| {f(x) - L} \right| < \varepsilon } \right)} \right)} \right]$$ and then go through it to get the final form of negation (See the example below). My Thought I just wrote down the two following negations without going through a step by step approach. $$\forall L,\exists \varepsilon  > 0:\left( {\forall \delta  > 0,\exists x:0 < \left| {x - a} \right| < \delta  \implies \left| {f(x) - L} \right| \ge \varepsilon } \right)$$ or $$\nexists L:\left( {\forall \varepsilon  > 0,\exists \delta  > 0:\left( {\forall x,0 < \left| {x - a} \right| < \delta  \implies \left| {f(x) - L} \right| < \varepsilon } \right)} \right)$$ I want to know weather these are true or not. Example I will give an example of what I mean by a step by step approach. Consider the following statement $${P}\implies R$$ I want to take a step by step approach to obtain the negation of the above statement. Here is what they usually do in logic \begin{align} \, \neg \left( {P \implies R} \right) &\iff \neg \left( {\neg P \vee R} \right) & \text{Conditional  Disjunction} \\ \qquad \qquad \quad &\iff \neg \neg P \wedge \neg R & \text{Demorgan's  Law} \\ \qquad \qquad \quad &\iff P \wedge \neg R & \text{Double  Negation} \end{align}","Question Suppose we are dealing with real valued functions $f(x)$ of one real variable $x$. We say that the limit of $f(x)$ at point $a$ exists and equals to $L$ if and only if $$\exists L:\left( {\forall \varepsilon  > 0,\exists \delta  > 0:\left( {\forall x,0 < \left| {x - a} \right| < \delta  \implies \left| {f(x) - L} \right| < \varepsilon } \right)} \right)$$ and show this by the symbolism $$\mathop {\lim f(x)}\limits_{x \to a}  = L$$ Now, what do we say when we want to state that the limit of function $f(x)$ does not exist at $a$? In fact, what is the negation of the above statement? I am interested to obtain the negation with a step by step approach using tautologies in logic . To be specific, I want to start from $$\neg \left[ {\exists L:\left( {\forall \varepsilon  > 0,\exists \delta  > 0:\left( {\forall x,0 < \left| {x - a} \right| < \delta  \implies \left| {f(x) - L} \right| < \varepsilon } \right)} \right)} \right]$$ and then go through it to get the final form of negation (See the example below). My Thought I just wrote down the two following negations without going through a step by step approach. $$\forall L,\exists \varepsilon  > 0:\left( {\forall \delta  > 0,\exists x:0 < \left| {x - a} \right| < \delta  \implies \left| {f(x) - L} \right| \ge \varepsilon } \right)$$ or $$\nexists L:\left( {\forall \varepsilon  > 0,\exists \delta  > 0:\left( {\forall x,0 < \left| {x - a} \right| < \delta  \implies \left| {f(x) - L} \right| < \varepsilon } \right)} \right)$$ I want to know weather these are true or not. Example I will give an example of what I mean by a step by step approach. Consider the following statement $${P}\implies R$$ I want to take a step by step approach to obtain the negation of the above statement. Here is what they usually do in logic \begin{align} \, \neg \left( {P \implies R} \right) &\iff \neg \left( {\neg P \vee R} \right) & \text{Conditional  Disjunction} \\ \qquad \qquad \quad &\iff \neg \neg P \wedge \neg R & \text{Demorgan's  Law} \\ \qquad \qquad \quad &\iff P \wedge \neg R & \text{Double  Negation} \end{align}",,"['calculus', 'analysis', 'limits', 'logic', 'epsilon-delta']"
31,"Splitting out $(1-x^4)$, what is this called so I can read more about it?","Splitting out , what is this called so I can read more about it?",(1-x^4),"In my calculus homework I came across a much faster* solution for one of the problems I was working on by looking at how WebAssign (online homework website) solves similar problems: $$\lim \limits_{x \to 1} \dfrac{x(1-x^4)}{(x - 1)} = \lim \limits_{x \to 1} \dfrac{x(1-x)(1+x+x^2+x^3)}{x-1}$$ What is going on here, does this transformation have a name? * this is from the problem: $$y = x - x^5$$ with the point, $P(1 , 0)$, where I couldn't find a way to solve using $$\lim \limits_{x \to a} \dfrac{f(x) - f(a)}{(x - a)}$$ so I used $$\lim \limits_{h \to 0} \dfrac{f(x + h) - f(x)}{h}$$ which required me to build a big polynomial and factor out one of the h variable)","In my calculus homework I came across a much faster* solution for one of the problems I was working on by looking at how WebAssign (online homework website) solves similar problems: $$\lim \limits_{x \to 1} \dfrac{x(1-x^4)}{(x - 1)} = \lim \limits_{x \to 1} \dfrac{x(1-x)(1+x+x^2+x^3)}{x-1}$$ What is going on here, does this transformation have a name? * this is from the problem: $$y = x - x^5$$ with the point, $P(1 , 0)$, where I couldn't find a way to solve using $$\lim \limits_{x \to a} \dfrac{f(x) - f(a)}{(x - a)}$$ so I used $$\lim \limits_{h \to 0} \dfrac{f(x + h) - f(x)}{h}$$ which required me to build a big polynomial and factor out one of the h variable)",,"['calculus', 'algebra-precalculus']"
32,Maclaurin Series of $\frac{1}{e^x -1}$,Maclaurin Series of,\frac{1}{e^x -1},"I want to find the MacLaurin Series for the function $f(x) = \frac{1}{e^x -1}$. But when I compute the first derivative of $f(x)$: $$ \frac{d}{dx}\frac{1}{e^x -1} = -\frac{e^x}{(e^x-1)^2} $$ A the point $x=0$, I get an indeterminate expansion: $$ f'(0)=-\frac{e^0}{(e^0-1)^2} $$ So how can I compute the series for this function $f(x)$?","I want to find the MacLaurin Series for the function $f(x) = \frac{1}{e^x -1}$. But when I compute the first derivative of $f(x)$: $$ \frac{d}{dx}\frac{1}{e^x -1} = -\frac{e^x}{(e^x-1)^2} $$ A the point $x=0$, I get an indeterminate expansion: $$ f'(0)=-\frac{e^0}{(e^0-1)^2} $$ So how can I compute the series for this function $f(x)$?",,"['calculus', 'power-series']"
33,Orthogonality of sine and cosine integrals.,Orthogonality of sine and cosine integrals.,,"How to prove that $$ \int_{t_0}^{t_0+T} \sin(m\omega t)\sin(n\omega t)\,\mathrm{d}t$$  will equal to $0$ when $m\ne n$ and $\frac{T}{2}$ when $m=n\ne 0$? Besides $$ \int_{t_0}^{t_0+T} \cos(m\omega t)\cos(n\omega t)\,\mathrm{d}t$$ will equal to $0$ when $m\ne n$ and $\frac{T}{2}$ when $m=n\ne 0$ and $T$ when $m=n=0$?","How to prove that $$ \int_{t_0}^{t_0+T} \sin(m\omega t)\sin(n\omega t)\,\mathrm{d}t$$  will equal to $0$ when $m\ne n$ and $\frac{T}{2}$ when $m=n\ne 0$? Besides $$ \int_{t_0}^{t_0+T} \cos(m\omega t)\cos(n\omega t)\,\mathrm{d}t$$ will equal to $0$ when $m\ne n$ and $\frac{T}{2}$ when $m=n\ne 0$ and $T$ when $m=n=0$?",,"['calculus', 'integration', 'definite-integrals']"
