,title_raw,title_text,title_latex,body_raw,body_text,body_latex,tags
66,$f(x+1)-f(x)=f'(x)$: prove $f(x)$ linear function [closed],: prove  linear function [closed],f(x+1)-f(x)=f'(x) f(x),"Closed. This question is off-topic . It is not currently accepting answers. This question is missing context or other details : Please improve the question by providing additional context, which ideally includes your thoughts on the problem and any attempts you have made to solve it. This information helps others identify where you have difficulties and helps them write answers appropriate to your experience level. Closed 5 years ago . Improve this question If I have a differentiable function $f:\mathbb{R}\to\mathbb{R}$ satisfies $f(x+1)-f(x)=f'(x)$ and $\lim_{x\to\infty}f'(x)=A$. Can I show $f(x)=ax+b$?","Closed. This question is off-topic . It is not currently accepting answers. This question is missing context or other details : Please improve the question by providing additional context, which ideally includes your thoughts on the problem and any attempts you have made to solve it. This information helps others identify where you have difficulties and helps them write answers appropriate to your experience level. Closed 5 years ago . Improve this question If I have a differentiable function $f:\mathbb{R}\to\mathbb{R}$ satisfies $f(x+1)-f(x)=f'(x)$ and $\lim_{x\to\infty}f'(x)=A$. Can I show $f(x)=ax+b$?",,"['calculus', 'ordinary-differential-equations']"
67,Show that $\lim_{n \to \infty} \int_0^{\infty} \frac{1}{1+x^n}~dx = 1$,Show that,\lim_{n \to \infty} \int_0^{\infty} \frac{1}{1+x^n}~dx = 1,I need help proving the following limit: $$\lim_{n \to \infty} \int_0^{\infty} \frac{1}{1+x^n}~dx = 1$$ In WolframAlpha I was playing around with the values of the sequence defined by the integral and noticed that the values seem to get arbitrarily close to 1. I guess the difficulty is finding a closed expression for the value of the definite integral.,I need help proving the following limit: $$\lim_{n \to \infty} \int_0^{\infty} \frac{1}{1+x^n}~dx = 1$$ In WolframAlpha I was playing around with the values of the sequence defined by the integral and noticed that the values seem to get arbitrarily close to 1. I guess the difficulty is finding a closed expression for the value of the definite integral.,,"['calculus', 'integration', 'limits', 'convergence-divergence', 'definite-integrals']"
68,Calculus Generalisation,Calculus Generalisation,,"$$ \mbox{How should I integrate}\quad \int_{0}^{\pi/2} \cos^{2011}\left(\,x\,\right)\sin\left(\,2013x\,\right)\,\mathrm{d}x\ ?. $$ I am stuck with the reduction formula which is coming out to be $\left(\,2n + 2\,\right)I_{n} = 1 + nI_{n-1}$. Also can this be generalised for $$ \int_{0}^{\pi/2}\cos^{n}\left(\,x\,\right) \sin\left(\,\left(\,n + 2\,\right)x\,\right)\,\mathrm{d}x $$","$$ \mbox{How should I integrate}\quad \int_{0}^{\pi/2} \cos^{2011}\left(\,x\,\right)\sin\left(\,2013x\,\right)\,\mathrm{d}x\ ?. $$ I am stuck with the reduction formula which is coming out to be $\left(\,2n + 2\,\right)I_{n} = 1 + nI_{n-1}$. Also can this be generalised for $$ \int_{0}^{\pi/2}\cos^{n}\left(\,x\,\right) \sin\left(\,\left(\,n + 2\,\right)x\,\right)\,\mathrm{d}x $$",,['calculus']
69,How to approximate $\sin(x)$ using Pad茅 approximation?,How to approximate  using Pad茅 approximation?,\sin(x),"I need to write a function for $\sin(x)$ using Pad茅 approximation. I found here a formula, but I don't know how to achive this. Thanks in advance.","I need to write a function for $\sin(x)$ using Pad茅 approximation. I found here a formula, but I don't know how to achive this. Thanks in advance.",,"['calculus', 'functions', 'numerical-methods', 'matlab', 'pade-approximation']"
70,"Closed-form of $\int_0^1 x^n \operatorname{li}(x^m)\,dx$",Closed-form of,"\int_0^1 x^n \operatorname{li}(x^m)\,dx","I've conjectured, that for $n\geq0$ and $m\geq1$ integers $$ \int_0^1 x^n \operatorname{li}(x^m)\,dx \stackrel{?}{=} -\frac{1}{n+1}\ln\left(\frac{m+n+1}{m}\right), $$ where $\operatorname{li}$ is the logarithmic integral . Although there is a known antiderivative of $x^n \operatorname{li}(x^m)$, the simplification of the expression seems not trivial. I think there are other ways to evaluate this definite integral problem. How could we prove this identity?","I've conjectured, that for $n\geq0$ and $m\geq1$ integers $$ \int_0^1 x^n \operatorname{li}(x^m)\,dx \stackrel{?}{=} -\frac{1}{n+1}\ln\left(\frac{m+n+1}{m}\right), $$ where $\operatorname{li}$ is the logarithmic integral . Although there is a known antiderivative of $x^n \operatorname{li}(x^m)$, the simplification of the expression seems not trivial. I think there are other ways to evaluate this definite integral problem. How could we prove this identity?",,"['calculus', 'integration', 'definite-integrals', 'logarithms', 'closed-form']"
71,Leibniz rule for improper integral,Leibniz rule for improper integral,,"We know that the Leibniz integral formula $$\frac{d}{dt}\int_{\phi(t)}^{\psi(t)} f(t,s) ds = \int_{\phi(t)}^{\psi(t)} \frac{d}{dt}f(t,s) ds+f(t,\psi(t))\frac{d}{dt}\psi(t) -f(t,\phi(t))\frac{d}{dt}\phi(t).$$ Can we apply this rule for $$\frac{d}{dt}\int_{\phi(t)}^{\infty} f(t,s) ds ?$$","We know that the Leibniz integral formula $$\frac{d}{dt}\int_{\phi(t)}^{\psi(t)} f(t,s) ds = \int_{\phi(t)}^{\psi(t)} \frac{d}{dt}f(t,s) ds+f(t,\psi(t))\frac{d}{dt}\psi(t) -f(t,\phi(t))\frac{d}{dt}\phi(t).$$ Can we apply this rule for $$\frac{d}{dt}\int_{\phi(t)}^{\infty} f(t,s) ds ?$$",,"['calculus', 'integration', 'ordinary-differential-equations', 'improper-integrals', 'leibniz-integral-rule']"
72,"Can every indefinite integral of a discontinuous function be written in a way that ""proves"" something false?","Can every indefinite integral of a discontinuous function be written in a way that ""proves"" something false?",,"I just saw the following fake proof. $$\int \frac1x dx =\int 1\cdot \frac1x dx=x\frac1x+\int x \frac1{x^2} dx = 1+ \int \frac1x dx$$ Which would imply $1=0$, hence the fake proof tag. The explanation given was that there was a discontinuity in the function that we were in essence ""integrating over"", however the integral is indefinite so we are not explicitly integrating over anything (or maybe integrating over everything?). Will any function with a discontinuity be exploitable in this way? Could we actually solve the problem by converting the integral to a definite integral in a region there is no discontinuity? I think the trick used would still work, or am not sure why it would provide a result that make sense.","I just saw the following fake proof. $$\int \frac1x dx =\int 1\cdot \frac1x dx=x\frac1x+\int x \frac1{x^2} dx = 1+ \int \frac1x dx$$ Which would imply $1=0$, hence the fake proof tag. The explanation given was that there was a discontinuity in the function that we were in essence ""integrating over"", however the integral is indefinite so we are not explicitly integrating over anything (or maybe integrating over everything?). Will any function with a discontinuity be exploitable in this way? Could we actually solve the problem by converting the integral to a definite integral in a region there is no discontinuity? I think the trick used would still work, or am not sure why it would provide a result that make sense.",,"['calculus', 'fake-proofs']"
73,"Minimizing the value of this integral $ I \equiv \int_{0}^{\pi/2}\left\vert\,\cos\left(x\right) - kx^{2}\,\right\vert \,{\rm d}x $",Minimizing the value of this integral," I \equiv \int_{0}^{\pi/2}\left\vert\,\cos\left(x\right) - kx^{2}\,\right\vert \,{\rm d}x ","Given the integral $$ I \equiv \int_{0}^{\pi/2}\left\vert\,\cos\left(x\right) - kx^{2}\,\right\vert \,{\rm d}x $$ Find the value of $k$ so that $I$ is minimum. How do I start?","Given the integral $$ I \equiv \int_{0}^{\pi/2}\left\vert\,\cos\left(x\right) - kx^{2}\,\right\vert \,{\rm d}x $$ Find the value of $k$ so that $I$ is minimum. How do I start?",,"['calculus', 'definite-integrals']"
74,U-substitution for integral of 1/(1+e^x)dx. What am I doing wrong?,U-substitution for integral of 1/(1+e^x)dx. What am I doing wrong?,,"Here is my work, with the right answer. I feel like every step is right, but somehow I am getting the wrong answer. How? $$ \int \frac{1}{1+e^z}dz = \int\frac{1}{e^z(\frac{1}{e^z} + 1)}dz   =\int\frac{1}{\frac{1}{e^z} + 1}\frac{1}{e^z}dz $$ subbing $u = \frac{1}{e^z} + 1$, $\frac{du}{dz} = -e^{-z}dz \implies -du = \frac{1}{e^z}dz$ so $$\int \frac{1}{1+e^z}dz = -\int\frac{1}{u}du = -\ln(u) + C = -\ln(e^{-z}+1) + C$$ But the right answer is $z - \ln(1+e^z)+C$","Here is my work, with the right answer. I feel like every step is right, but somehow I am getting the wrong answer. How? $$ \int \frac{1}{1+e^z}dz = \int\frac{1}{e^z(\frac{1}{e^z} + 1)}dz   =\int\frac{1}{\frac{1}{e^z} + 1}\frac{1}{e^z}dz $$ subbing $u = \frac{1}{e^z} + 1$, $\frac{du}{dz} = -e^{-z}dz \implies -du = \frac{1}{e^z}dz$ so $$\int \frac{1}{1+e^z}dz = -\int\frac{1}{u}du = -\ln(u) + C = -\ln(e^{-z}+1) + C$$ But the right answer is $z - \ln(1+e^z)+C$",,"['calculus', 'integration', 'logarithms']"
75,Proving that $\frac{e^x + e^{-x}}2 \le e^{x^2/2}$,Proving that,\frac{e^x + e^{-x}}2 \le e^{x^2/2},"Prove the following inequality:   $$\dfrac{e^x + e^{-x}}2 \le e^{\frac{x^2}{2}}$$ This should be solved using Taylor series. I tried expanding the left to the 5th degree and the right site to the 3rd degree, but it didn't help. Any tips?","Prove the following inequality:   $$\dfrac{e^x + e^{-x}}2 \le e^{\frac{x^2}{2}}$$ This should be solved using Taylor series. I tried expanding the left to the 5th degree and the right site to the 3rd degree, but it didn't help. Any tips?",,"['calculus', 'inequality', 'taylor-expansion', 'exponential-function']"
76,evaluation of limit $\lim_{n\rightarrow \infty}\left(\frac{n!}{n^n}\right)^{\frac{1}{n}}$ [duplicate],evaluation of limit  [duplicate],\lim_{n\rightarrow \infty}\left(\frac{n!}{n^n}\right)^{\frac{1}{n}},"This question already has answers here : Finding the limit of $\frac {n}{\sqrt[n]{n!}}$ (11 answers) Closed 3 years ago . Calculate the value of the limit $$ \lim_{n\rightarrow \infty}\left(\frac{n!}{n^n}\right)^{1/n} $$ Can we solve this without using a Riemann sum method? If so, how?","This question already has answers here : Finding the limit of $\frac {n}{\sqrt[n]{n!}}$ (11 answers) Closed 3 years ago . Calculate the value of the limit $$ \lim_{n\rightarrow \infty}\left(\frac{n!}{n^n}\right)^{1/n} $$ Can we solve this without using a Riemann sum method? If so, how?",,['calculus']
77,Is there a differential limit?,Is there a differential limit?,,"I'm wondering if there's such a concept as a ""differential limit"". Let me give an example because my nomenclature is my own and unofficial, but hopefully indicative of the concept. For some function f(x), there may exist a derivative of that function f'(x) which we call a first order differentiation of f(x). Likewise from f'(x) we could also derive a second order function f''(x). Is there a mathematical concept of the limit of a function as the order of differentiation goes to infinity? I can think of a function that I can take the derivative of an infinite number of times ( albeit without getting a constant value): f(x) = sin(x) The function g(x) = x^2 might have a differential limit of 0. (g'(x) = 2x; g''(x) = 2; g'''(x) = 0 ...) Is there any usefulness to this concept? A topic of study or keyword that discusses this? Any more examples of infinitely derivable functions? Most importantly if this is interesting to anyone other than myself: what is a good resource for learning more?","I'm wondering if there's such a concept as a ""differential limit"". Let me give an example because my nomenclature is my own and unofficial, but hopefully indicative of the concept. For some function f(x), there may exist a derivative of that function f'(x) which we call a first order differentiation of f(x). Likewise from f'(x) we could also derive a second order function f''(x). Is there a mathematical concept of the limit of a function as the order of differentiation goes to infinity? I can think of a function that I can take the derivative of an infinite number of times ( albeit without getting a constant value): f(x) = sin(x) The function g(x) = x^2 might have a differential limit of 0. (g'(x) = 2x; g''(x) = 2; g'''(x) = 0 ...) Is there any usefulness to this concept? A topic of study or keyword that discusses this? Any more examples of infinitely derivable functions? Most importantly if this is interesting to anyone other than myself: what is a good resource for learning more?",,"['calculus', 'limits', 'derivatives']"
78,Integral of an absolute value function,Integral of an absolute value function,,How do I find the definite integral of an absolute value function? For instance: $f(x) = |-2x^3 + 24x|$ from $x=1$ to $x=4$,How do I find the definite integral of an absolute value function? For instance: $f(x) = |-2x^3 + 24x|$ from $x=1$ to $x=4$,,"['calculus', 'integration', 'absolute-value']"
79,"Integrating $\int_0^\pi x^4\cos(nx)\,dx$ using the Feynman trick",Integrating  using the Feynman trick,"\int_0^\pi x^4\cos(nx)\,dx","I should solve the following integral $$\displaystyle\int_0^\pi x^4\cos(nx)\,dx$$ Usually you would integrate 4 times by parts. I was wondering if there is a more direct way, something like the Leibniz rule (aka Feynman trick).","I should solve the following integral Usually you would integrate 4 times by parts. I was wondering if there is a more direct way, something like the Leibniz rule (aka Feynman trick).","\displaystyle\int_0^\pi x^4\cos(nx)\,dx","['calculus', 'integration', 'definite-integrals', 'leibniz-integral-rule']"
80,Integrating $e^x / (e^x - 2)$,Integrating,e^x / (e^x - 2),"Well, I expected this to be a fairly simple task, but in the online portal of my uni it is stated I got zero points for it, although I recall pretty clearly this is exactly what I did. Where is my mistake then? Task: $\int \frac{e^x}{e^x - 2}dx$ First I applied a substitution, as I always find it nice to have just a lone variable below fraction to see possible connections to standard integrals. So I used u = $e^x - 2$. This also requires u' or $\frac{du}{dx}$ which = $e^x$. Rearranging this gives dx = $\frac{du}{e^x}$ which we then insert. So now we have: $\int \frac{u + 2}{u} * \frac{du}{e^x}$ {I am expressing the $e^x$ in numerator with my substitution too, is this good practice? Or should I leave it as just $e^x$ next time? In next step it is seen that it wasn't so smart here, but what about a general rule?} I now see that I can shorten ${e^x}$ if I undo the substitution in the numerator again: $\int \frac{e^x -2 + 2}{u} * \frac{du}{e^x}$ {I now shorten ${e^x}$ by crossing it out in denominator of $\frac{du}{e^x}$ and cross out the whole numerator of $\frac{e^x -2 + 2}{u}$ and replace it with 1. Or would further explanations be needed here?} This leaves: $\int \frac{1}{u}du$ which is a standard integral = ln(u). At last I undo the substitution: u = $e^x -2$ which leaves as our result: ln($e^x -2$) I then add the absolute value due to the behaviour of ln: Final solution: ln($|e^x -2|$) + C","Well, I expected this to be a fairly simple task, but in the online portal of my uni it is stated I got zero points for it, although I recall pretty clearly this is exactly what I did. Where is my mistake then? Task: $\int \frac{e^x}{e^x - 2}dx$ First I applied a substitution, as I always find it nice to have just a lone variable below fraction to see possible connections to standard integrals. So I used u = $e^x - 2$. This also requires u' or $\frac{du}{dx}$ which = $e^x$. Rearranging this gives dx = $\frac{du}{e^x}$ which we then insert. So now we have: $\int \frac{u + 2}{u} * \frac{du}{e^x}$ {I am expressing the $e^x$ in numerator with my substitution too, is this good practice? Or should I leave it as just $e^x$ next time? In next step it is seen that it wasn't so smart here, but what about a general rule?} I now see that I can shorten ${e^x}$ if I undo the substitution in the numerator again: $\int \frac{e^x -2 + 2}{u} * \frac{du}{e^x}$ {I now shorten ${e^x}$ by crossing it out in denominator of $\frac{du}{e^x}$ and cross out the whole numerator of $\frac{e^x -2 + 2}{u}$ and replace it with 1. Or would further explanations be needed here?} This leaves: $\int \frac{1}{u}du$ which is a standard integral = ln(u). At last I undo the substitution: u = $e^x -2$ which leaves as our result: ln($e^x -2$) I then add the absolute value due to the behaviour of ln: Final solution: ln($|e^x -2|$) + C",,"['calculus', 'integration', 'exponential-function']"
81,"Evaluating $\int_0^1 \frac{\ln^m (1+x)\ln^n x}{x}\; dx$ for $m,n\in\mathbb{N}$",Evaluating  for,"\int_0^1 \frac{\ln^m (1+x)\ln^n x}{x}\; dx m,n\in\mathbb{N}","Evaluate $\displaystyle \int\limits_0^1 \dfrac{\ln^m (1+x)\ln^n x}{x}\; dx$ for $m,n\in\mathbb{N}$ I was wondering if the above had some kind of a closed form, here some of the special cases have been discussed but this one is really a fascinating one. I guess there's no general taylor expansion for $\ln^m (1+x)$ and so transforming into a series wouldn't be that easy.","Evaluate $\displaystyle \int\limits_0^1 \dfrac{\ln^m (1+x)\ln^n x}{x}\; dx$ for $m,n\in\mathbb{N}$ I was wondering if the above had some kind of a closed form, here some of the special cases have been discussed but this one is really a fascinating one. I guess there's no general taylor expansion for $\ln^m (1+x)$ and so transforming into a series wouldn't be that easy.",,"['calculus', 'integration', 'definite-integrals', 'summation']"
82,How do we prove that $\int_{0}^{1}\int_{0}^{1}{\left(\ln{x}\ln{y}\right)^s\over 1-xy}dxdy=\Gamma^2(1+s)\zeta(2+2s)$?,How do we prove that ?,\int_{0}^{1}\int_{0}^{1}{\left(\ln{x}\ln{y}\right)^s\over 1-xy}dxdy=\Gamma^2(1+s)\zeta(2+2s),"How do we prove that $$\int_{0}^{1}\int_{0}^{1}{\left(\ln{x}\ln{y}\right)^s\over 1-xy}dxdy=\Gamma^2(1+s)\zeta(2+2s)$$ Integrate with respect to x first, let $s=1$ $$\int_{0}^{1}{\ln{y}\ln{x}\over 1-yx}dx$$ $u=\ln{x}\rightarrow xdu=dx$ $$\ln{y}\int_{0}^{\infty}{u\over y-e^{-u}}du$$ I don't think I am in the right track here, any hints please.","How do we prove that $$\int_{0}^{1}\int_{0}^{1}{\left(\ln{x}\ln{y}\right)^s\over 1-xy}dxdy=\Gamma^2(1+s)\zeta(2+2s)$$ Integrate with respect to x first, let $s=1$ $$\int_{0}^{1}{\ln{y}\ln{x}\over 1-yx}dx$$ $u=\ln{x}\rightarrow xdu=dx$ $$\ln{y}\int_{0}^{\infty}{u\over y-e^{-u}}du$$ I don't think I am in the right track here, any hints please.",,"['calculus', 'integration']"
83,Compute: $\lim\limits_{n\to+\infty}\int\limits_{0}^1 e^{\{nx\}}x^{100}dx$,Compute:,\lim\limits_{n\to+\infty}\int\limits_{0}^1 e^{\{nx\}}x^{100}dx,"Can anyone help to compute this limit, please? $\{nx\}$ denotes the fractional part of $nx$.  Tried to replace $nx$ by another variable and write an entire integral as a sum of integrals: $$\sum\limits_{i=0}^{n-1}\int\limits_{i}^{i+1} $$ but it seems not to work out.","Can anyone help to compute this limit, please? $\{nx\}$ denotes the fractional part of $nx$.  Tried to replace $nx$ by another variable and write an entire integral as a sum of integrals: $$\sum\limits_{i=0}^{n-1}\int\limits_{i}^{i+1} $$ but it seems not to work out.",,"['calculus', 'integration', 'limits']"
84,Is polar coordinates enough to prove that a limit exists,Is polar coordinates enough to prove that a limit exists,,"Somewhat of a basic question but I failed to find an answer or come up with a formal one myself. Suppose I want to find the limit $\lim_{{(x,y)} \to {(0,0)}}f(x,y)$ using spherical coordinates $x:=r\cos \theta$, $y:= r\sin\theta$. Suppose I found that $\lim_{r \to 0} f(r,\theta)$ exists and is equal to $\alpha$ regardless of $\theta$. Did I really cover every possible path? Can we say for sure that the limit is $\alpha$? maybe some other limit exists in another path that we didn't cover. For example, take $\lim_{(x,y) \to (0,0)}\frac{x^2y}{x^2+y^2} = \lim_{r\to 0}\frac{r^3\cos^2\theta \sin \theta}{r^2} = \lim_{r \to 0}r\cos^2 \theta \sin \theta = 0$. I agree that IF the limit exists, it has to be zero. But maybe there is some path we didn't cover and from that path the limit is something else?","Somewhat of a basic question but I failed to find an answer or come up with a formal one myself. Suppose I want to find the limit $\lim_{{(x,y)} \to {(0,0)}}f(x,y)$ using spherical coordinates $x:=r\cos \theta$, $y:= r\sin\theta$. Suppose I found that $\lim_{r \to 0} f(r,\theta)$ exists and is equal to $\alpha$ regardless of $\theta$. Did I really cover every possible path? Can we say for sure that the limit is $\alpha$? maybe some other limit exists in another path that we didn't cover. For example, take $\lim_{(x,y) \to (0,0)}\frac{x^2y}{x^2+y^2} = \lim_{r\to 0}\frac{r^3\cos^2\theta \sin \theta}{r^2} = \lim_{r \to 0}r\cos^2 \theta \sin \theta = 0$. I agree that IF the limit exists, it has to be zero. But maybe there is some path we didn't cover and from that path the limit is something else?",,"['calculus', 'limits', 'multivariable-calculus']"
85,Sophomore's dream: $\int_0^{1} x^{-x} \; dx = \sum_{n=1}^\infty n^{-n}$,Sophomore's dream:,\int_0^{1} x^{-x} \; dx = \sum_{n=1}^\infty n^{-n},"In the solution of the so-called sophomore's dream , one of the key steps is to compute $$\int_0^1 x^n (\log x)^n~\mathrm dx$$ using the change of variables $x = \exp\left(-\frac{u}{n+1}\right)$ to obtain the Gamma function. This substitution to me, looks like it was pulled out of thin air. Can someone help me motivate it? How would I have thought of this substitution?","In the solution of the so-called sophomore's dream , one of the key steps is to compute $$\int_0^1 x^n (\log x)^n~\mathrm dx$$ using the change of variables $x = \exp\left(-\frac{u}{n+1}\right)$ to obtain the Gamma function. This substitution to me, looks like it was pulled out of thin air. Can someone help me motivate it? How would I have thought of this substitution?",,"['calculus', 'integration', 'definite-integrals', 'improper-integrals']"
86,Limit Rule $\lim f(x)^{g(x)}$,Limit Rule,\lim f(x)^{g(x)},"I want to know the following is true : If $$ c,\ d\in {\bf R},\  \lim_{x\rightarrow 0} f(x)=c>0,\ \lim_{x\rightarrow 0} g(x) =d>0$$ then $$ \lim_{x\rightarrow 0} f(x)^{g(x)} = c^d$$ In calculus book such formula cannot be found. Consider the problem : $$\lim_{x\rightarrow 0} (1+\sin\ 4x)^{\cot\ x} $$ To find a limit, we must use ${\rm log}$ and L'Hospital. But some student suggests that $$ \lim_{x\rightarrow 0} (1+\sin\ 4x)^{\frac{1}{\sin\ 4x} \frac{\sin\ 4x}{\sin\ x}\cos\ x}=e^4$$ This argument is clear. But I know that it is informal. Is there a minus point in such way ?","I want to know the following is true : If $$ c,\ d\in {\bf R},\  \lim_{x\rightarrow 0} f(x)=c>0,\ \lim_{x\rightarrow 0} g(x) =d>0$$ then $$ \lim_{x\rightarrow 0} f(x)^{g(x)} = c^d$$ In calculus book such formula cannot be found. Consider the problem : $$\lim_{x\rightarrow 0} (1+\sin\ 4x)^{\cot\ x} $$ To find a limit, we must use ${\rm log}$ and L'Hospital. But some student suggests that $$ \lim_{x\rightarrow 0} (1+\sin\ 4x)^{\frac{1}{\sin\ 4x} \frac{\sin\ 4x}{\sin\ x}\cos\ x}=e^4$$ This argument is clear. But I know that it is informal. Is there a minus point in such way ?",,['calculus']
87,Parametrisation of the surface a torus,Parametrisation of the surface a torus,,"For a calculus question  I need to parameterise the surface of the torus generated by rotating the circle given by $(x-b)^2+z^2=a^2$ around the $z$-axis (with $0<a<b$). I've had a go at this, and have come up with $$\vec{r}(\theta,\phi)=((a\cos\theta+b)\cos\phi, (a\cos\theta+b)\sin\phi, a\sin\theta), ~~ \theta,\phi\in [0,2\pi].$$ I haven't done anything like this for a while now, so I've kind of forgotten how it all goes. So I've tried plotting this on WolframAlpha to see if it's correct, but I can't get it to actually plot a surface defined in this way. I have a copy of Matlab, is there any way I could plot this surface on there to see if it's correct? Basically how can I check if I'm right or not? Failing that, could somebody please just point out if I'm wrong?","For a calculus question  I need to parameterise the surface of the torus generated by rotating the circle given by $(x-b)^2+z^2=a^2$ around the $z$-axis (with $0<a<b$). I've had a go at this, and have come up with $$\vec{r}(\theta,\phi)=((a\cos\theta+b)\cos\phi, (a\cos\theta+b)\sin\phi, a\sin\theta), ~~ \theta,\phi\in [0,2\pi].$$ I haven't done anything like this for a while now, so I've kind of forgotten how it all goes. So I've tried plotting this on WolframAlpha to see if it's correct, but I can't get it to actually plot a surface defined in this way. I have a copy of Matlab, is there any way I could plot this surface on there to see if it's correct? Basically how can I check if I'm right or not? Failing that, could somebody please just point out if I'm wrong?",,"['calculus', 'parametric']"
88,Proving that $\lim_{h\to 0 } \frac{b^{h}-1}{h} = \ln{b}$,Proving that,\lim_{h\to 0 } \frac{b^{h}-1}{h} = \ln{b},Is there a formal proof of this fact without using L'H么pital's rule? I was thinking about using a proof of this fact: $$ \left.\frac{d(e^{x})}{dx}\right|_{x=x_0} = e^{x_0}\lim_{h\to 0} \frac{e^{h}-1}{h} = e^{x_0}\cdot 1=e^{x_0}   $$ that I have to help prove: $$ \lim_{h\to 0} \frac{b^{h}-1}{h} = \ln{b} $$ Is there a succinct proof of this limit? How does one prove this rigorously?,Is there a formal proof of this fact without using L'H么pital's rule? I was thinking about using a proof of this fact: $$ \left.\frac{d(e^{x})}{dx}\right|_{x=x_0} = e^{x_0}\lim_{h\to 0} \frac{e^{h}-1}{h} = e^{x_0}\cdot 1=e^{x_0}   $$ that I have to help prove: $$ \lim_{h\to 0} \frac{b^{h}-1}{h} = \ln{b} $$ Is there a succinct proof of this limit? How does one prove this rigorously?,,"['calculus', 'limits']"
