,title_raw,title_text,title_latex,body_raw,body_text,body_latex,tags
34,Inverse Laplace Transform of $\bar p_D = \frac{K_0(\sqrt[]s r_D)}{sK_0(\sqrt[]s)}$,Inverse Laplace Transform of,\bar p_D = \frac{K_0(\sqrt[]s r_D)}{sK_0(\sqrt[]s)},"I solved the following partial differential equation using Laplace Transform: $\LARGE \frac{1}{r_D}\frac{\partial}{\partial r_D}(r_D\frac{\partial p_D}{\partial r_D})=\frac{\partial p_D}{\partial t_D}$ with following initial and boundary conditions: Initial condition: $p_D(r_D,0) = 0$ Boundary condition 1: $p_D(r_D->\infty, t_D) = 0$ Boundary condition 2: $p_D(r_D=1, t_D) = 1$ I applied Laplace Inverse to the above problem and now I have reached the following step: How do I find Laplace inverse of the following: $\LARGE \bar p_D = \frac{K_0(\sqrt[]s r_D)}{sK_0(\sqrt[]s)}$ I need to prove an equation for which I need this. I tried do it using Mathematica but it is also not helping.","I solved the following partial differential equation using Laplace Transform: $\LARGE \frac{1}{r_D}\frac{\partial}{\partial r_D}(r_D\frac{\partial p_D}{\partial r_D})=\frac{\partial p_D}{\partial t_D}$ with following initial and boundary conditions: Initial condition: $p_D(r_D,0) = 0$ Boundary condition 1: $p_D(r_D->\infty, t_D) = 0$ Boundary condition 2: $p_D(r_D=1, t_D) = 1$ I applied Laplace Inverse to the above problem and now I have reached the following step: How do I find Laplace inverse of the following: $\LARGE \bar p_D = \frac{K_0(\sqrt[]s r_D)}{sK_0(\sqrt[]s)}$ I need to prove an equation for which I need this. I tried do it using Mathematica but it is also not helping.",,"['calculus', 'integration', 'partial-differential-equations', 'laplace-transform', 'contour-integration']"
35,composition of continuous functions,composition of continuous functions,,"I was wondering if a function $f:[a,b]\rightarrow[c,d]$ is continuous, $g:[c,d]\rightarrow\mathbb{R}$ is continuous, does it necessarily imply that $g\circ f$ is continuous? Are there counterexamples? What is the necessary and sufficient condition for $g\circ f$ to be continuous? This is not HWQ. I am just wondering if that is possible.","I was wondering if a function $f:[a,b]\rightarrow[c,d]$ is continuous, $g:[c,d]\rightarrow\mathbb{R}$ is continuous, does it necessarily imply that $g\circ f$ is continuous? Are there counterexamples? What is the necessary and sufficient condition for $g\circ f$ to be continuous? This is not HWQ. I am just wondering if that is possible.",,['calculus']
36,Find the value of $\int_0^1f(x)dx$,Find the value of,\int_0^1f(x)dx,"If $$f(x)=\binom{n}{1}(x-1)^2-\binom{n}{2}(x-2)^2+\cdots+(-1)^{n-1}\binom{n}{n}(x-n)^2$$ Find the value of $$\int_0^1f(x)dx$$ I rewrote this into a compact form. $$\sum_{k=1}^n\binom{n}{k}(x-k)^2(-1)^{k-1}$$ Now, $$\int_0^1\sum_{k=1}^n\binom{n}{k}(x-k)^2(-1)^{k-1}dx$$ $$=\sum_{k=1}^n\binom{n}{k}\frac{(1-k)^3}{3}(-1)^{k-1}-\sum_{k=1}^n\binom{n}{k}\frac{(-k)^3}{3}(-1)^{k-1}$$ $$=\sum_{k=1}^n\binom{n}{k}\frac{(1-k)^3}{3}(-1)^{k-1}+\sum_{k=1}^n\binom{n}{k}\frac{k^3}{3}(-1)^{k-1}$$ After this, I took $\dfrac13$ common and did some simplifications but nothing useful came out. Any help is greatly appreciated.","If Find the value of I rewrote this into a compact form. Now, After this, I took common and did some simplifications but nothing useful came out. Any help is greatly appreciated.",f(x)=\binom{n}{1}(x-1)^2-\binom{n}{2}(x-2)^2+\cdots+(-1)^{n-1}\binom{n}{n}(x-n)^2 \int_0^1f(x)dx \sum_{k=1}^n\binom{n}{k}(x-k)^2(-1)^{k-1} \int_0^1\sum_{k=1}^n\binom{n}{k}(x-k)^2(-1)^{k-1}dx =\sum_{k=1}^n\binom{n}{k}\frac{(1-k)^3}{3}(-1)^{k-1}-\sum_{k=1}^n\binom{n}{k}\frac{(-k)^3}{3}(-1)^{k-1} =\sum_{k=1}^n\binom{n}{k}\frac{(1-k)^3}{3}(-1)^{k-1}+\sum_{k=1}^n\binom{n}{k}\frac{k^3}{3}(-1)^{k-1} \dfrac13,['calculus']
37,Evaluating $\lim_{n \to \infty} \int_{0}^{\pi} \frac{\sin x}{1+\cos ^2(nx)} dx$,Evaluating,\lim_{n \to \infty} \int_{0}^{\pi} \frac{\sin x}{1+\cos ^2(nx)} dx,"Evaluate the limit $$\displaystyle\lim_{n \to \infty} \int_{0}^{\pi} \frac{\sin x}{1+\cos ^2(nx)} dx$$ Using property of definite integral $\int_{0}^{2a} f(x).dx=2\int_{0}^{a} f(x)dx$ ,when $f(2a-x)=f(x)$ I got $$\displaystyle\lim_{n \to \infty} \int_{o}^{\pi} \frac{\sin x}{1+\cos ^2(nx)} dx=2\displaystyle\lim_{n \to \infty} \int_{o}^{\pi/2} \frac{\sin x}{1+\cos ^2(nx)} dx$$ but I cannot proceed after that. Could someone provide me with some hint? Till now I have only done integration in terms of elementary functions. Any hint would be appreciated.","Evaluate the limit Using property of definite integral ,when I got but I cannot proceed after that. Could someone provide me with some hint? Till now I have only done integration in terms of elementary functions. Any hint would be appreciated.",\displaystyle\lim_{n \to \infty} \int_{0}^{\pi} \frac{\sin x}{1+\cos ^2(nx)} dx \int_{0}^{2a} f(x).dx=2\int_{0}^{a} f(x)dx f(2a-x)=f(x) \displaystyle\lim_{n \to \infty} \int_{o}^{\pi} \frac{\sin x}{1+\cos ^2(nx)} dx=2\displaystyle\lim_{n \to \infty} \int_{o}^{\pi/2} \frac{\sin x}{1+\cos ^2(nx)} dx,"['calculus', 'limits', 'definite-integrals']"
38,Integral $ \int_0^\infty \frac{\ln x}{(x+c)(x-1)} dx$,Integral, \int_0^\infty \frac{\ln x}{(x+c)(x-1)} dx,"I've been trying to solve the following integral for days now. $$P = \int_0^\infty \frac{\ln(x)}{(x+c)(x-1)} dx$$ with $c > 0$ . I figured out (numerically, by accident) that if $c = 1$ , then $P = \pi^2/4$ . But why? And more importantly: what's the general solution of $P$ , for given $c$ ? I tried partial fraction expansions, Taylor polynomials for $ln(x)$ and more, but nothing seems to work. I can't even figure out where the $\pi^2/4$ comes from. (Background: for a hobby project I'm building a machine learning algorithm that predicts sports match scores. Somehow the breaking point is this integral, so solving it would get things moving again.)","I've been trying to solve the following integral for days now. with . I figured out (numerically, by accident) that if , then . But why? And more importantly: what's the general solution of , for given ? I tried partial fraction expansions, Taylor polynomials for and more, but nothing seems to work. I can't even figure out where the comes from. (Background: for a hobby project I'm building a machine learning algorithm that predicts sports match scores. Somehow the breaking point is this integral, so solving it would get things moving again.)",P = \int_0^\infty \frac{\ln(x)}{(x+c)(x-1)} dx c > 0 c = 1 P = \pi^2/4 P c ln(x) \pi^2/4,"['calculus', 'integration', 'definite-integrals', 'contest-math', 'improper-integrals']"
39,How does one show that $\int_{-\infty}^{+\infty}{\left(x\over 2+2^{x}+2^{-x}\right)^2}\mathrm dx={\zeta(2)-1\over 3}\cdot{1\over \ln^3(2)}?$,How does one show that,\int_{-\infty}^{+\infty}{\left(x\over 2+2^{x}+2^{-x}\right)^2}\mathrm dx={\zeta(2)-1\over 3}\cdot{1\over \ln^3(2)}?,Motivated by this question due to the comment of @Olivier Oloa. $$\int_{-\infty}^{+\infty}{\left(x\over 2+2^{x}+2^{-x}\right)^2}\mathrm dx={\zeta(\color{red}2)-\color{blue}1\over \color{green}3}\cdot{\color{blue}1\over \ln^\color{green}3(\color{red}2)}\tag1$$ Here is my attempt: $u=2^x\implies du=2^x\ln 2dx$ then $(1)$ becomes $${1\over \ln^3(2)}\int_{0}^{+\infty}{\ln^2(u)\over (2+u+u^{-1})^2}\cdot{\mathrm du\over u}\tag2$$ $e^v=u$ then $(2)$ becomes $${1\over \ln^3(2)}\int_{-\infty}^{+\infty}{v^2\over (2+e^v+e^{-v})^2}\mathrm dv\tag3$$ Not sure what is next step...,Motivated by this question due to the comment of @Olivier Oloa. $$\int_{-\infty}^{+\infty}{\left(x\over 2+2^{x}+2^{-x}\right)^2}\mathrm dx={\zeta(\color{red}2)-\color{blue}1\over \color{green}3}\cdot{\color{blue}1\over \ln^\color{green}3(\color{red}2)}\tag1$$ Here is my attempt: $u=2^x\implies du=2^x\ln 2dx$ then $(1)$ becomes $${1\over \ln^3(2)}\int_{0}^{+\infty}{\ln^2(u)\over (2+u+u^{-1})^2}\cdot{\mathrm du\over u}\tag2$$ $e^v=u$ then $(2)$ becomes $${1\over \ln^3(2)}\int_{-\infty}^{+\infty}{v^2\over (2+e^v+e^{-v})^2}\mathrm dv\tag3$$ Not sure what is next step...,,"['calculus', 'integration', 'definite-integrals']"
40,"Integral $\int_0^{1/2}\arcsin x\cdot\ln^2x\,dx$",Integral,"\int_0^{1/2}\arcsin x\cdot\ln^2x\,dx","I'm interested in this integral $$\int_0^{1/2}\arcsin x\cdot\ln^2x\,dx$$ My idea was to first evaluate $$\int_0^{1/2}\arcsin x\cdot x^a\,dx=\frac{2^{-a}\,\pi-6B_{1/4}\left(\frac{a}{2}+1,\frac{1}{2}\right)}{12\,(a+1)}$$ in terms of the incomplete Beta function, and then find the second derivative at $a=0$, but it ended up with ugly derivatives of hypergeometric functions w.r.t. their parameters for which I did not know how to find a closed form expression. Could you suggest a different way to evaluate this integral?","I'm interested in this integral $$\int_0^{1/2}\arcsin x\cdot\ln^2x\,dx$$ My idea was to first evaluate $$\int_0^{1/2}\arcsin x\cdot x^a\,dx=\frac{2^{-a}\,\pi-6B_{1/4}\left(\frac{a}{2}+1,\frac{1}{2}\right)}{12\,(a+1)}$$ in terms of the incomplete Beta function, and then find the second derivative at $a=0$, but it ended up with ugly derivatives of hypergeometric functions w.r.t. their parameters for which I did not know how to find a closed form expression. Could you suggest a different way to evaluate this integral?",,"['calculus', 'integration', 'trigonometry', 'definite-integrals', 'logarithms']"
41,The numerical relation of the sum of two divergence series,The numerical relation of the sum of two divergence series,,"For these two series: $1 + 2 + 3 + 4 + 5 +...$ $2 + 4 + 6 + 8 + 10 +...$ For each of the two series, since these numbers progress with no end, and the sum increases, it certainly cannot be finite. By this fact it becomes infinite. Hence, this quantity is so large that it is greater than any finite quantity. Thus I think the sum could only be an ""infinite number"", which is greater than any finite or assignable quantity. Moreover, every term of the second series is twice as large as the corresponding term of the first series(1 to 2, and 2 to 4, and n to 2n), it is reasonable to believe that the sum of the second series is twice as large as the first series, i.e. we get two infinite numbers and one is twice as large as the other. so is there something wrong here?","For these two series: $1 + 2 + 3 + 4 + 5 +...$ $2 + 4 + 6 + 8 + 10 +...$ For each of the two series, since these numbers progress with no end, and the sum increases, it certainly cannot be finite. By this fact it becomes infinite. Hence, this quantity is so large that it is greater than any finite quantity. Thus I think the sum could only be an ""infinite number"", which is greater than any finite or assignable quantity. Moreover, every term of the second series is twice as large as the corresponding term of the first series(1 to 2, and 2 to 4, and n to 2n), it is reasonable to believe that the sum of the second series is twice as large as the first series, i.e. we get two infinite numbers and one is twice as large as the other. so is there something wrong here?",,"['calculus', 'sequences-and-series', 'infinity', 'divergent-series']"
42,Sum of the series:$\frac{1}{1\cdot 2}+\frac{1\cdot3}{1\cdot2\cdot3\cdot4}+\cdots$,Sum of the series:,\frac{1}{1\cdot 2}+\frac{1\cdot3}{1\cdot2\cdot3\cdot4}+\cdots,I have a question where i couldn't find any clue. The question is $$\frac{1}{1\cdot 2}+\frac{1\cdot3}{1\cdot2\cdot3\cdot4}+\frac{1\cdot3\cdot5}{1\cdot2\cdot3\cdot4\cdot5\cdot6}+\cdots$$ I could get the general term as $t_n=\frac{1\cdot3\cdot5\cdot7\cdots(2n-1)}{1\cdot2\cdot3\cdot4\cdot5\cdot6\cdots2n}$ I have also tried it to form the sequence in the telescopic form.But couldn't get. Any hint will be appreciated.,I have a question where i couldn't find any clue. The question is $$\frac{1}{1\cdot 2}+\frac{1\cdot3}{1\cdot2\cdot3\cdot4}+\frac{1\cdot3\cdot5}{1\cdot2\cdot3\cdot4\cdot5\cdot6}+\cdots$$ I could get the general term as $t_n=\frac{1\cdot3\cdot5\cdot7\cdots(2n-1)}{1\cdot2\cdot3\cdot4\cdot5\cdot6\cdots2n}$ I have also tried it to form the sequence in the telescopic form.But couldn't get. Any hint will be appreciated.,,"['calculus', 'sequences-and-series']"
43,Evaluate $\int_0^1\frac{x^a-x^{-a}}{x-1}dx$,Evaluate,\int_0^1\frac{x^a-x^{-a}}{x-1}dx,"I have heard that: $$\int_0^1\frac{x^a-x^{-a}}{x-1}dx=\frac1 a-\pi\cot(\pi a)$$ when $-1<a<1$. How would I prove this? That doesn't have an elementary indefinite integral , but the definite integral is quite simple. Someone suggested I use complex analysis to prove it, but I am relatively new to the subject. (I have gotten up to contour integrals, but I'm not sure how to use them to evaluate this particular integral.) I also tried expanding it with a series, but it didn't help.","I have heard that: $$\int_0^1\frac{x^a-x^{-a}}{x-1}dx=\frac1 a-\pi\cot(\pi a)$$ when $-1<a<1$. How would I prove this? That doesn't have an elementary indefinite integral , but the definite integral is quite simple. Someone suggested I use complex analysis to prove it, but I am relatively new to the subject. (I have gotten up to contour integrals, but I'm not sure how to use them to evaluate this particular integral.) I also tried expanding it with a series, but it didn't help.",,"['calculus', 'integration', 'definite-integrals', 'improper-integrals']"
44,Functions $f$ such that $f(x)+f(-x)=f(x)f(-x)$,Functions  such that,f f(x)+f(-x)=f(x)f(-x),"I was looking for examples of real valued functions $f$ such that $f(x)+f(-x)=f(x)f(-x)$. Preferably, I'd like them to be continuous, differentiable, etc. Of course, there are the constant functions $f(x)=0$ and $f(x)=2$. I also showed that $1+b^x$, where $b>0$, is another solution. Are there any other nice ones?","I was looking for examples of real valued functions $f$ such that $f(x)+f(-x)=f(x)f(-x)$. Preferably, I'd like them to be continuous, differentiable, etc. Of course, there are the constant functions $f(x)=0$ and $f(x)=2$. I also showed that $1+b^x$, where $b>0$, is another solution. Are there any other nice ones?",,"['calculus', 'functional-equations']"
45,Finding the limit of $\left( 1-\frac{1}{n} \right)^{n}$,Finding the limit of,\left( 1-\frac{1}{n} \right)^{n},"How would one compute the following limit? $$\lim_{n \to \infty} \left( 1 - \frac{1}{n} \right)^{n}$$ I know $$\lim_{n \to \infty} \left( 1 + \frac{1}{n} \right)^{n} = e$$ but right there is a minus keeping that limit from being used. Another problem I am questioning is finding the limit of $$\frac{n!}{2n}$$ Of course, $\frac{x^n}{n!}$ has zero as a limit but here it is the opposite.","How would one compute the following limit? I know but right there is a minus keeping that limit from being used. Another problem I am questioning is finding the limit of Of course, has zero as a limit but here it is the opposite.",\lim_{n \to \infty} \left( 1 - \frac{1}{n} \right)^{n} \lim_{n \to \infty} \left( 1 + \frac{1}{n} \right)^{n} = e \frac{n!}{2n} \frac{x^n}{n!},"['calculus', 'sequences-and-series', 'limits']"
46,Prove that $\int_0^\infty \frac{\sin^2{(x\sin x)}}{x^2}dx=1$.,Prove that .,\int_0^\infty \frac{\sin^2{(x\sin x)}}{x^2}dx=1,"Let $I=\int_0^\infty \frac{\sin^2{(x\sin x)}}{x^2}dx$ . Prove that $I=1$ . Desmos shows that $\sum\limits_{k=0}^{100}\int_{k\pi}^{(k+1)\pi}\frac{\sin^2(x\sin{x})}{x^2}dx=0.9984\dots$ and $\sum\limits_{k=0}^{10000}\int_{k\pi}^{(k+1)\pi}\frac{\sin^2(x\sin{x})}{x^2}dx=0.999987\dots$ . So I think it's a safe bet that $I=1$ . Context I recently learned that $\int_0^\infty \frac{\sin{(x\sin{x})}}{x^2}dx=\pi/2$ . On a whim, I squared the numerator, and then to my surprise this new integral $\int_0^\infty \frac{\sin^2{(x\sin x)}}{x^2}dx$ seems to also have a closed form - in fact $1$ , the simplest closed form of all. My attempt There are lots of ways to show that $\int_0^\infty\frac{\sin^2 x}{x^2} dx=\pi/2$ . I've been trying to apply these to $I$ . For example I tried to use integration by parts , but the fact that $I$ has sine within sine makes things difficult.","Let . Prove that . Desmos shows that and . So I think it's a safe bet that . Context I recently learned that . On a whim, I squared the numerator, and then to my surprise this new integral seems to also have a closed form - in fact , the simplest closed form of all. My attempt There are lots of ways to show that . I've been trying to apply these to . For example I tried to use integration by parts , but the fact that has sine within sine makes things difficult.",I=\int_0^\infty \frac{\sin^2{(x\sin x)}}{x^2}dx I=1 \sum\limits_{k=0}^{100}\int_{k\pi}^{(k+1)\pi}\frac{\sin^2(x\sin{x})}{x^2}dx=0.9984\dots \sum\limits_{k=0}^{10000}\int_{k\pi}^{(k+1)\pi}\frac{\sin^2(x\sin{x})}{x^2}dx=0.999987\dots I=1 \int_0^\infty \frac{\sin{(x\sin{x})}}{x^2}dx=\pi/2 \int_0^\infty \frac{\sin^2{(x\sin x)}}{x^2}dx 1 \int_0^\infty\frac{\sin^2 x}{x^2} dx=\pi/2 I I,"['calculus', 'integration', 'analysis', 'definite-integrals', 'improper-integrals']"
47,Equality of two elliptic integrals,Equality of two elliptic integrals,,"by wolfram 1 and wolfram 2 It's true that $\displaystyle \int_0^{\frac{\pi}{2}}\int_0^{\frac{\pi}{2}} \frac{2}{\sqrt{1-\sin^2\theta\sin^2\phi}} d\phi d\theta =\int_0^{\frac{\pi}{2}}\int_0^{\frac{\pi}{2}} \frac{1}{\sqrt{\sin\theta\sin\phi}} d\phi d\theta$ ? If yes,  I need  a way to prove the equality of the following two integrals I tried everything  but I am unable to convert  into a standard form so How do I solve this problem. Addition 1: For the second integral $\int_0^{\frac{\pi}{2}}\int_0^{\frac{\pi}{2}} \frac{1}{\sqrt{\sin\theta\sin\phi}} d\phi d\theta =\bigg(\int_0^{\frac{\pi}{2}}\frac{1}{\sqrt{\sin\theta}}d\theta\bigg)^2 $ and we can use that $2 \int^{\frac{\pi}{2}}_{0}\frac{1}{\sqrt{\sin x}} \mathrm dx = \frac{\Gamma(1/2)\Gamma(1/4)}{\Gamma(3/4)} = \frac{\Gamma \left( \frac{1}{4}\right)^2}{\sqrt{2\pi}}$ Addition 2: For the first integral Let $\displaystyle K(k)=\int_0^{\frac{\pi}{2}}\frac{1}{\sqrt{1-k^2\sin^2 t}}dt$ ( Complete Elliptic Integral of the First Kind). we know that $ \displaystyle K(k)=\frac{\pi}{2}\sum_{n=0}^\infty \left(\frac{(2n)!}{2^{2n}(n!)^2}\right)^2k^{2n}$ . Then it's not difficult de show that $\int_0^{\frac{\pi}{2}}\int_0^{\frac{\pi}{2}} \frac{1}{\sqrt{1-\sin^2\theta\sin^2\phi}} d\phi d\theta=(\pi /2 )^2 \sum _{n=0}^{\infty }(\frac{(2n)!}{4^n(n!)^2})^3$ . The egality of the two integrals hold if we can calculte $$\sum _{n=0}^{\infty }(\frac{(2n)!}{4^n(n!)^2})^3$$ Wolfram gives Addition 3: This link gives","by wolfram 1 and wolfram 2 It's true that ? If yes,  I need  a way to prove the equality of the following two integrals I tried everything  but I am unable to convert  into a standard form so How do I solve this problem. Addition 1: For the second integral and we can use that Addition 2: For the first integral Let ( Complete Elliptic Integral of the First Kind). we know that . Then it's not difficult de show that . The egality of the two integrals hold if we can calculte Wolfram gives Addition 3: This link gives",\displaystyle \int_0^{\frac{\pi}{2}}\int_0^{\frac{\pi}{2}} \frac{2}{\sqrt{1-\sin^2\theta\sin^2\phi}} d\phi d\theta =\int_0^{\frac{\pi}{2}}\int_0^{\frac{\pi}{2}} \frac{1}{\sqrt{\sin\theta\sin\phi}} d\phi d\theta \int_0^{\frac{\pi}{2}}\int_0^{\frac{\pi}{2}} \frac{1}{\sqrt{\sin\theta\sin\phi}} d\phi d\theta =\bigg(\int_0^{\frac{\pi}{2}}\frac{1}{\sqrt{\sin\theta}}d\theta\bigg)^2  2 \int^{\frac{\pi}{2}}_{0}\frac{1}{\sqrt{\sin x}} \mathrm dx = \frac{\Gamma(1/2)\Gamma(1/4)}{\Gamma(3/4)} = \frac{\Gamma \left( \frac{1}{4}\right)^2}{\sqrt{2\pi}} \displaystyle K(k)=\int_0^{\frac{\pi}{2}}\frac{1}{\sqrt{1-k^2\sin^2 t}}dt  \displaystyle K(k)=\frac{\pi}{2}\sum_{n=0}^\infty \left(\frac{(2n)!}{2^{2n}(n!)^2}\right)^2k^{2n} \int_0^{\frac{\pi}{2}}\int_0^{\frac{\pi}{2}} \frac{1}{\sqrt{1-\sin^2\theta\sin^2\phi}} d\phi d\theta=(\pi /2 )^2 \sum _{n=0}^{\infty }(\frac{(2n)!}{4^n(n!)^2})^3 \sum _{n=0}^{\infty }(\frac{(2n)!}{4^n(n!)^2})^3,"['calculus', 'integration', 'definite-integrals', 'elliptic-integrals']"
48,"Evaluate the definite integral $\int^{\infty }_{0}\frac{x \,dx}{e^{x} -1}$ using contour integration",Evaluate the definite integral  using contour integration,"\int^{\infty }_{0}\frac{x \,dx}{e^{x} -1}","My friend and I have been trying weeks to evaluate the integral $$\int^{\infty }_{0}\frac{x \,dx}{e^{x} -1} .$$ We have together tried 23 contours, and all have failed. We already know how to solve this with infinite sums (i.e., using the zeta function and the Basel problem), but we can't figure out how to solve it using contour integration methods. We already know the answer is $\frac{\pi^{2}}{6}$ .","My friend and I have been trying weeks to evaluate the integral We have together tried 23 contours, and all have failed. We already know how to solve this with infinite sums (i.e., using the zeta function and the Basel problem), but we can't figure out how to solve it using contour integration methods. We already know the answer is .","\int^{\infty }_{0}\frac{x \,dx}{e^{x} -1} . \frac{\pi^{2}}{6}","['calculus', 'integration', 'definite-integrals', 'improper-integrals', 'contour-integration']"
49,What is the meaning of second derivative?,What is the meaning of second derivative?,,"I looked for various answers and couldn't find anything helpful.What I know is the derivative of a curve at a point is the slope of tangent line drawn to the point.Nowwhat does second derivative mean slope of the slope of line?I know it in terms of velocity,acceleration etc. but it is hard for me to get it in math. For example: The first derivative of $x^3$ is $3x^2$ but why is it not a straight line?In my book,it is written as slope of tangent.Please help regarding all these doubts in simple terms.I'm just in high school","I looked for various answers and couldn't find anything helpful.What I know is the derivative of a curve at a point is the slope of tangent line drawn to the point.Nowwhat does second derivative mean slope of the slope of line?I know it in terms of velocity,acceleration etc. but it is hard for me to get it in math. For example: The first derivative of is but why is it not a straight line?In my book,it is written as slope of tangent.Please help regarding all these doubts in simple terms.I'm just in high school",x^3 3x^2,"['calculus', 'derivatives']"
50,Algebraic expansion of $(1+x)^{1/x}$ is?,Algebraic expansion of  is?,(1+x)^{1/x},i have to solve  $ \lim_{x\to 0} \frac{{(1+x})^{1/x}-e+ex/2}{x^2}$ and in the hint it is advised to use the algebraic expansion of $(1+x)^{1/x}$. Also i know that the algebraic expansion of $(1+x)^{m} = 1+mx+m(m-1){x^2}/2+...$ but this is in the case where m is an integer. So please help me here with the limit.,i have to solve  $ \lim_{x\to 0} \frac{{(1+x})^{1/x}-e+ex/2}{x^2}$ and in the hint it is advised to use the algebraic expansion of $(1+x)^{1/x}$. Also i know that the algebraic expansion of $(1+x)^{m} = 1+mx+m(m-1){x^2}/2+...$ but this is in the case where m is an integer. So please help me here with the limit.,,"['calculus', 'algebra-precalculus', 'limits']"
51,Calculating $\lim_{n\to\infty}\sqrt[n]{ \sqrt[n]{n} - 1 }$,Calculating,\lim_{n\to\infty}\sqrt[n]{ \sqrt[n]{n} - 1 },"I know that $$\lim_{n\to\infty} \sqrt[n]{ \sqrt[n]{n} - 1 } = 1,$$ but I'm unable to prove it. I could easily estimate that it's at most $1$, but my best estimation from below is that the limit is greater than $0$. Doing this from the definition doesn't lead me anywhere either.","I know that $$\lim_{n\to\infty} \sqrt[n]{ \sqrt[n]{n} - 1 } = 1,$$ but I'm unable to prove it. I could easily estimate that it's at most $1$, but my best estimation from below is that the limit is greater than $0$. Doing this from the definition doesn't lead me anywhere either.",,"['calculus', 'sequences-and-series', 'limits', 'radicals']"
52,What IS conditional convergence?,What IS conditional convergence?,,"I've gone through countless websites that promise answering ""What is conditional convergence?"" and instead give me ""This is how you find if something is conditionally convergent"".  While it is all fine and dandy that I know how to find if something is conditional convergence, what actually is it? I've graphed severally conditionally convergent series and they seem to not look much different from other series which have absolute convergence. What is the magic thing that makes something converge conditionally? I'm just confused because I don't understand how something can converge but actually not really all the time.","I've gone through countless websites that promise answering ""What is conditional convergence?"" and instead give me ""This is how you find if something is conditionally convergent"".  While it is all fine and dandy that I know how to find if something is conditional convergence, what actually is it? I've graphed severally conditionally convergent series and they seem to not look much different from other series which have absolute convergence. What is the magic thing that makes something converge conditionally? I'm just confused because I don't understand how something can converge but actually not really all the time.",,"['calculus', 'sequences-and-series', 'convergence-divergence']"
