,title_raw,title_text,title_latex,body_raw,body_text,body_latex,tags
27,PDE with strange Auxiliary Conditions,PDE with strange Auxiliary Conditions,,"I am currently trying to find an $\textit{explicit solution}$ to this question but am getting stuck. So the question reads: Find an explicit solution for the PDE:   $$u_t+u\cdot u_x=0, \>\> u(x,0)=g(x)=\begin{cases} 1 &= \text{ if } x\leq 0\\ 1-x &= \text{ if } 0\leq x \leq 1\\ 0 &= \text{ if } x\geq 1 \end{cases}$$    For all $x$ and $0\leq t\leq 1$. Now, I found the Characteristics: $$\frac{\partial x}{\partial t}=z(t), \>\>\> \frac{\partial z}{\partial t}=0$$ Where $z(t)$ is the term on the RHS of the PDE. Now, setting the initial conditions: $$x(0)=x_0, \>\> z(0)=g(x_0)$$ And the solutions are given by: $$z(t)=g(x_0), \>\>\>\> x(t)=g(x_0)\cdot t +x_0$$ Can I conclude that $u(x,t)=g(x_0)$? This seems a bit too easy, however I know that I can set $u=\frac{x-x_0}{t}$, so would I have to rearrange the solution in terms of $x_0$ for each case?","I am currently trying to find an $\textit{explicit solution}$ to this question but am getting stuck. So the question reads: Find an explicit solution for the PDE:   $$u_t+u\cdot u_x=0, \>\> u(x,0)=g(x)=\begin{cases} 1 &= \text{ if } x\leq 0\\ 1-x &= \text{ if } 0\leq x \leq 1\\ 0 &= \text{ if } x\geq 1 \end{cases}$$    For all $x$ and $0\leq t\leq 1$. Now, I found the Characteristics: $$\frac{\partial x}{\partial t}=z(t), \>\>\> \frac{\partial z}{\partial t}=0$$ Where $z(t)$ is the term on the RHS of the PDE. Now, setting the initial conditions: $$x(0)=x_0, \>\> z(0)=g(x_0)$$ And the solutions are given by: $$z(t)=g(x_0), \>\>\>\> x(t)=g(x_0)\cdot t +x_0$$ Can I conclude that $u(x,t)=g(x_0)$? This seems a bit too easy, however I know that I can set $u=\frac{x-x_0}{t}$, so would I have to rearrange the solution in terms of $x_0$ for each case?",,"['ordinary-differential-equations', 'partial-differential-equations']"
28,Model for spreading of rumors in a class,Model for spreading of rumors in a class,,"We just started learning about differential equations (just first order, ordinary differential equations so far). I have to solve an exercise whose translation is: There is a rumor among the students of this class that this problem   will be on the final exam in June. If there are 70 students enrolled   and the rumor is spreading in proportion to the number of students who   have not yet heard about it, how long will it take for 60 students to  know if by the second day 40 already know about it? Note: it is assumed  that in t = 0 no student knows the rumor. So I've tried to come up with a solution, but I realized that the number of unaware students doesn't come up in it. For starters, I'm working with a function S(t) (number of students who have heard about the rumor depending on how much time, in days, has passed). I followed this logic: The number of students who know about it must be equal to the initial number of aware students (zero) plus $\frac{dS(t)}{dt} t$ (the number of students who find out each day times the days passed). After solving, I get $A(t)=kt$, being $k$ a constant which should equal 20. Did I go wrong somewhere? Thanks in advance!","We just started learning about differential equations (just first order, ordinary differential equations so far). I have to solve an exercise whose translation is: There is a rumor among the students of this class that this problem   will be on the final exam in June. If there are 70 students enrolled   and the rumor is spreading in proportion to the number of students who   have not yet heard about it, how long will it take for 60 students to  know if by the second day 40 already know about it? Note: it is assumed  that in t = 0 no student knows the rumor. So I've tried to come up with a solution, but I realized that the number of unaware students doesn't come up in it. For starters, I'm working with a function S(t) (number of students who have heard about the rumor depending on how much time, in days, has passed). I followed this logic: The number of students who know about it must be equal to the initial number of aware students (zero) plus $\frac{dS(t)}{dt} t$ (the number of students who find out each day times the days passed). After solving, I get $A(t)=kt$, being $k$ a constant which should equal 20. Did I go wrong somewhere? Thanks in advance!",,[]
29,Integral curves,Integral curves,,"Suppose $f$ is a vector field. Let $g$ be an integral curve whose domain contains $[0,\infty)$. Now $\lim (g(t)) =p$ as $t \to \infty$. Then can we say that $f(p)$ is zero?","Suppose $f$ is a vector field. Let $g$ be an integral curve whose domain contains $[0,\infty)$. Now $\lim (g(t)) =p$ as $t \to \infty$. Then can we say that $f(p)$ is zero?",,"['geometry', 'ordinary-differential-equations', 'differential']"
30,Differential equation $\omega'+(1/2)rw=a/r^{n-1}$,Differential equation,\omega'+(1/2)rw=a/r^{n-1},I'm reading about the fundamental solution to heat equation and there's a technical step I don't understand. The text says that if we assume $\omega= \omega(r)$ is a solution to $\omega'+(1/2)rw=a/r^{n-1}$ satisfying $\lim_{r\to\infty} \omega=\lim_{r\to\infty} \omega' =0$ then $a$ must be equal to $0$. I tried to explain it but I don't realize why is it true. Does anyone have a suggestion about how to show it? Thank you.,I'm reading about the fundamental solution to heat equation and there's a technical step I don't understand. The text says that if we assume $\omega= \omega(r)$ is a solution to $\omega'+(1/2)rw=a/r^{n-1}$ satisfying $\lim_{r\to\infty} \omega=\lim_{r\to\infty} \omega' =0$ then $a$ must be equal to $0$. I tried to explain it but I don't realize why is it true. Does anyone have a suggestion about how to show it? Thank you.,,"['calculus', 'ordinary-differential-equations', 'limits']"
31,Euler central differences method,Euler central differences method,,"$$ \frac{\partial y}{\partial t} + c\frac{\partial y}{\partial x} = 0,$$ $$y = cos(x), t=0,$$$$\frac{\partial y}{\partial t}=csin(x), t=0  $$ has a solution $$y=cos(x−ct).$$ I wanted to expand both the derivatives as centered differences. So, in order to expand my derivatives, I did as shown below; $$\frac{y(i+1) - y(i-1)}{2Δt} +c(\frac{y(i+1) - y(i-1)}{2Δx}) = 0$$ $$\frac{y}{Δt} +c(\frac{y}{Δx})= 0$$ Now, I also intend to prove that the algebraic solution is an exact solution of the difference formula if I choose $Δx=cΔt$. How do I achieve this goal?","$$ \frac{\partial y}{\partial t} + c\frac{\partial y}{\partial x} = 0,$$ $$y = cos(x), t=0,$$$$\frac{\partial y}{\partial t}=csin(x), t=0  $$ has a solution $$y=cos(x−ct).$$ I wanted to expand both the derivatives as centered differences. So, in order to expand my derivatives, I did as shown below; $$\frac{y(i+1) - y(i-1)}{2Δt} +c(\frac{y(i+1) - y(i-1)}{2Δx}) = 0$$ $$\frac{y}{Δt} +c(\frac{y}{Δx})= 0$$ Now, I also intend to prove that the algebraic solution is an exact solution of the difference formula if I choose $Δx=cΔt$. How do I achieve this goal?",,"['ordinary-differential-equations', 'numerical-methods']"
32,"A mysterious way for solving ODE of type $P(x,y)dx+Q(x,y)dy=0$ where $P$ and $Q$ are homogenous function of degree $n$",A mysterious way for solving ODE of type  where  and  are homogenous function of degree,"P(x,y)dx+Q(x,y)dy=0 P Q n","Definition: We say $f(x,y)$ is homogenous of degree $n$ if for each $\lambda$, $f(\lambda x, \lambda y)=\lambda^n f(x,y)$ We call a differential equation of form $P(x,y)dx+Q(x,y)dy=0$ homogenous, If $P$ and $Q$ are two homogenous functions of degree $n$. I've read in a book that all of the homogenous ODE's can be solved by these substitutions: $y=vx$ , $dy=vdx+xdv$ Mysteriously, That seems to be working! I have two questions regarding this way of solving homogenous ODE's. $1$) How did they come up with this solution? They could do many other substitutions. Why this one? $2$) Why can we assume that there exists something like $v$ that $y=vx$? Maybe there is not a linear relation between $x$ and $y$! How are we sure? Note: I want to understand this method. That's the point.","Definition: We say $f(x,y)$ is homogenous of degree $n$ if for each $\lambda$, $f(\lambda x, \lambda y)=\lambda^n f(x,y)$ We call a differential equation of form $P(x,y)dx+Q(x,y)dy=0$ homogenous, If $P$ and $Q$ are two homogenous functions of degree $n$. I've read in a book that all of the homogenous ODE's can be solved by these substitutions: $y=vx$ , $dy=vdx+xdv$ Mysteriously, That seems to be working! I have two questions regarding this way of solving homogenous ODE's. $1$) How did they come up with this solution? They could do many other substitutions. Why this one? $2$) Why can we assume that there exists something like $v$ that $y=vx$? Maybe there is not a linear relation between $x$ and $y$! How are we sure? Note: I want to understand this method. That's the point.",,"['ordinary-differential-equations', 'homogeneous-equation']"
33,Trying out Green functions in simple context,Trying out Green functions in simple context,,"I am a physics student, and have had to use Green's function methods prior (in electrodynamics for example), but things were always badly explained. Now I am trying to brush up on things a bit and figured I'd try to solve some very simple ODEs (that can be otherwise integrated). Problem is I am not getting sensible results, and I don't even know how can I incorporate boundary conditions into the problem. Example calculation: Consider the linear ODE $ f'+\alpha f=g $ where $\alpha$ and $g$ are constants. The linear operator is then $$L=\frac{d}{dx}+\alpha,$$ moreover, since this is a translation-invariant operator, we will have $G(x,x')=G(x-x')$. Let's assume initial conditions are given by $f(0)=Q$. Then this equation can be integrated to give $$ f(x)=\left(Q-\frac{g}{\alpha}\right)e^{-\alpha x}+\frac{g}{\alpha}. $$ Now I'll try to solve this ODE using a Green's function method. Let $G(x-x')$ be the Green's function satisfying $$ L_{(x)}G(x-x')=\delta(x-x'), \\ \frac{d}{dx}G(x-x')+\alpha G(x-x')=\delta(x-x'). $$ I have no idea how to proceed, so I'm gonna take a Fourier transform. I have no idea if it is even well defined here or not, but physicists have done worse: $$ G(x-x')=\int G(k)e^{-ik(x-x')}\ dk, \\ \delta(x-x')= \int\frac{1}{2\pi}e^{-ik(x-x')}\ dk.$$ I get the following for Fourier-components: $$ (\alpha-ik)G(k)=\frac{1}{2\pi}, $$ so $$ G(x-x') =\frac{1}{2\pi}\int\frac{1}{\alpha-ik}e^{-ik(x-x')}\ dk.$$ This integral doesn't converge but I don't worry, as $G$ might just be a singular distribution. Instead, we have $$ f(x)=\int G(x-x')g\ dx'=\frac{g}{2\pi}\int dk\frac{1}{\alpha-ik}e^{-ikx}\int dx'e^{ikx'} \\ =g\int dk \frac{1}{\alpha-ik}e^{-ikx}\delta(k)=\frac{g}{\alpha}. $$ This certainly provides a solution of the equation, but not what I want. And I'm not surprised it didn't work, I didn't specify initial/boundary conditions. Probably when I took the Fourier transform, I accidentally gave some bogus boundary conditions, like $f$ should be zero in infinity or something, but I don't know. Question: What went wrong? I assume initial/boundary conditions, but how can I control them? How can I specify what initial/boundary conditions do I want? How do I find Green's function for proper initial/boundary conditions? Was taking the Fourier transform the wrong move there?","I am a physics student, and have had to use Green's function methods prior (in electrodynamics for example), but things were always badly explained. Now I am trying to brush up on things a bit and figured I'd try to solve some very simple ODEs (that can be otherwise integrated). Problem is I am not getting sensible results, and I don't even know how can I incorporate boundary conditions into the problem. Example calculation: Consider the linear ODE $ f'+\alpha f=g $ where $\alpha$ and $g$ are constants. The linear operator is then $$L=\frac{d}{dx}+\alpha,$$ moreover, since this is a translation-invariant operator, we will have $G(x,x')=G(x-x')$. Let's assume initial conditions are given by $f(0)=Q$. Then this equation can be integrated to give $$ f(x)=\left(Q-\frac{g}{\alpha}\right)e^{-\alpha x}+\frac{g}{\alpha}. $$ Now I'll try to solve this ODE using a Green's function method. Let $G(x-x')$ be the Green's function satisfying $$ L_{(x)}G(x-x')=\delta(x-x'), \\ \frac{d}{dx}G(x-x')+\alpha G(x-x')=\delta(x-x'). $$ I have no idea how to proceed, so I'm gonna take a Fourier transform. I have no idea if it is even well defined here or not, but physicists have done worse: $$ G(x-x')=\int G(k)e^{-ik(x-x')}\ dk, \\ \delta(x-x')= \int\frac{1}{2\pi}e^{-ik(x-x')}\ dk.$$ I get the following for Fourier-components: $$ (\alpha-ik)G(k)=\frac{1}{2\pi}, $$ so $$ G(x-x') =\frac{1}{2\pi}\int\frac{1}{\alpha-ik}e^{-ik(x-x')}\ dk.$$ This integral doesn't converge but I don't worry, as $G$ might just be a singular distribution. Instead, we have $$ f(x)=\int G(x-x')g\ dx'=\frac{g}{2\pi}\int dk\frac{1}{\alpha-ik}e^{-ikx}\int dx'e^{ikx'} \\ =g\int dk \frac{1}{\alpha-ik}e^{-ikx}\delta(k)=\frac{g}{\alpha}. $$ This certainly provides a solution of the equation, but not what I want. And I'm not surprised it didn't work, I didn't specify initial/boundary conditions. Probably when I took the Fourier transform, I accidentally gave some bogus boundary conditions, like $f$ should be zero in infinity or something, but I don't know. Question: What went wrong? I assume initial/boundary conditions, but how can I control them? How can I specify what initial/boundary conditions do I want? How do I find Green's function for proper initial/boundary conditions? Was taking the Fourier transform the wrong move there?",,"['ordinary-differential-equations', 'boundary-value-problem', 'greens-function', 'fundamental-solution']"
34,Solving ODE with power series,Solving ODE with power series,,"In some old notes, I found an exercise in which it was asked to solve this ODE, in a neighbourhood of $x_0=1$: $$xy''(x) - 3y(x) = 2x^2$$ I tried to solve it but I'm getting stuck. Let me show you what I tried: $x_0=1$ is an ordinary point the ODE, so the solution should be like $$y(x)=\sum_{n=0}^{+\infty} a_n(x-x_0)^n =\sum_{n=0}^{+\infty} a_n (x-1)^n$$ I computed the derivatives $$y(x)=\sum_{n=0}^{+\infty} a_n (x-1)^n$$ $$y'(x)=\sum_{n=0}^{+\infty} n a_n (x-1)^{n-1}=\sum_{n=1}^{+\infty} n a_n (x-1)^{n-1}$$ $$y''(x)=\sum_{n=0}^{+\infty} n(n-1) a_n (x-1)^{n-2}=\sum_{n=2}^{+\infty} n(n-1) a_n (x-1)^{n-2}$$ And I substituted in the original ODE: $$x \left(\sum_{n=2}^{+\infty} n(n-1) a_n (x-1)^{n-2}\right) -3 \left( \sum_{n=0}^{+\infty} a_n (x-1)^n\right)=0$$ I carried the costants inside the symbols of sum. $$\left(\sum_{n=2}^{+\infty} n(n-1) x a_n (x-1)^{n-2}\right) - \left( \sum_{n=0}^{+\infty} 3a_n (x-1)^n\right)=0$$ The obtained expression has two addenda. In order to keep the same power to each polynomial, I fixed some variables. $$\sum_{n=2}^{+\infty} n(n-1) x a_n (x-1)^{n-2} \implies t:=n-2 \implies \sum_{t=0}^{+\infty} (t+2)(t+1) x a_{t+2} (x-1)^{t} \implies \sum_{n=0}^{+\infty} (n+2)(n+1) x a_{n+2} (x-1)^{n}  $$ $$\sum_{n=0}^{+\infty} 3a_n (x-1)^n \quad \text{no transformation needed}$$ Then I wrote the addenda again: $$\sum_{n=0}^{+\infty} (n+2)(n+1) x a_{n+2} (x-1)^{n} - \sum_{n=0}^{+\infty} 3a_n (x-1)^n = 0$$ Now I checked the bounds of sums, in order to have them common for each sum, and   I noticed that they are already ok. The summation becomes $$\sum_{n=0}^{+\infty} \{(n+2)(n+1) x a_{n+2}  - 3a_n\} (x-1)^n = 0$$ But now, that $x$ in the first addendum is getting me stuck. Can anyone show me how to complete the exercise? Thanks in advance to everyone, even for having read my post.","In some old notes, I found an exercise in which it was asked to solve this ODE, in a neighbourhood of $x_0=1$: $$xy''(x) - 3y(x) = 2x^2$$ I tried to solve it but I'm getting stuck. Let me show you what I tried: $x_0=1$ is an ordinary point the ODE, so the solution should be like $$y(x)=\sum_{n=0}^{+\infty} a_n(x-x_0)^n =\sum_{n=0}^{+\infty} a_n (x-1)^n$$ I computed the derivatives $$y(x)=\sum_{n=0}^{+\infty} a_n (x-1)^n$$ $$y'(x)=\sum_{n=0}^{+\infty} n a_n (x-1)^{n-1}=\sum_{n=1}^{+\infty} n a_n (x-1)^{n-1}$$ $$y''(x)=\sum_{n=0}^{+\infty} n(n-1) a_n (x-1)^{n-2}=\sum_{n=2}^{+\infty} n(n-1) a_n (x-1)^{n-2}$$ And I substituted in the original ODE: $$x \left(\sum_{n=2}^{+\infty} n(n-1) a_n (x-1)^{n-2}\right) -3 \left( \sum_{n=0}^{+\infty} a_n (x-1)^n\right)=0$$ I carried the costants inside the symbols of sum. $$\left(\sum_{n=2}^{+\infty} n(n-1) x a_n (x-1)^{n-2}\right) - \left( \sum_{n=0}^{+\infty} 3a_n (x-1)^n\right)=0$$ The obtained expression has two addenda. In order to keep the same power to each polynomial, I fixed some variables. $$\sum_{n=2}^{+\infty} n(n-1) x a_n (x-1)^{n-2} \implies t:=n-2 \implies \sum_{t=0}^{+\infty} (t+2)(t+1) x a_{t+2} (x-1)^{t} \implies \sum_{n=0}^{+\infty} (n+2)(n+1) x a_{n+2} (x-1)^{n}  $$ $$\sum_{n=0}^{+\infty} 3a_n (x-1)^n \quad \text{no transformation needed}$$ Then I wrote the addenda again: $$\sum_{n=0}^{+\infty} (n+2)(n+1) x a_{n+2} (x-1)^{n} - \sum_{n=0}^{+\infty} 3a_n (x-1)^n = 0$$ Now I checked the bounds of sums, in order to have them common for each sum, and   I noticed that they are already ok. The summation becomes $$\sum_{n=0}^{+\infty} \{(n+2)(n+1) x a_{n+2}  - 3a_n\} (x-1)^n = 0$$ But now, that $x$ in the first addendum is getting me stuck. Can anyone show me how to complete the exercise? Thanks in advance to everyone, even for having read my post.",,"['analysis', 'ordinary-differential-equations', 'summation', 'power-series']"
35,behavior of non-linear differential equation,behavior of non-linear differential equation,,"The non-linear differential equation is defined as following $$\begin{cases}\frac{dx}{dt}=-\frac{1}{t^n}x+\frac{1}{t^m} (t>1)\\ x(1)=x_0 \end{cases}$$ where $n,m$ are positive integers. I want to find all pairs $(n,m)$ such that there exists $\lim_{t\rightarrow \infty}x(t)$. My idea: First I solved the linear differential equation  $$ \frac{dx}{dt}=-\frac{1}{t^n}x $$ If $n=1$, the solution is $x(t)=\frac{A}{t} (A\in \mathbb{R})$ . Regarding $A$ as the function of $t$ I substituted the solution and got $A=-\frac{1}{mt^m}$ and $\lim_{t\rightarrow \infty}x(t)=0$. I am in trouble when $n\geq 2$. Similarly I got  $$ x(t)=A\exp\left(\frac{1}{(n-1)t^{n-1}}\right) $$ as the solution of the above linear equation. Regarding $A$ as the function again, I got  $$ \frac{dA}{dt}=\frac{1}{t^m}\exp\left(-\frac{1}{(n-1)t^{n-1}}\right)$$ But I think this differential equation can't be solved generally. When $\lim_{t\rightarrow \infty}x(t)$ converges? Please give me some advice.","The non-linear differential equation is defined as following $$\begin{cases}\frac{dx}{dt}=-\frac{1}{t^n}x+\frac{1}{t^m} (t>1)\\ x(1)=x_0 \end{cases}$$ where $n,m$ are positive integers. I want to find all pairs $(n,m)$ such that there exists $\lim_{t\rightarrow \infty}x(t)$. My idea: First I solved the linear differential equation  $$ \frac{dx}{dt}=-\frac{1}{t^n}x $$ If $n=1$, the solution is $x(t)=\frac{A}{t} (A\in \mathbb{R})$ . Regarding $A$ as the function of $t$ I substituted the solution and got $A=-\frac{1}{mt^m}$ and $\lim_{t\rightarrow \infty}x(t)=0$. I am in trouble when $n\geq 2$. Similarly I got  $$ x(t)=A\exp\left(\frac{1}{(n-1)t^{n-1}}\right) $$ as the solution of the above linear equation. Regarding $A$ as the function again, I got  $$ \frac{dA}{dt}=\frac{1}{t^m}\exp\left(-\frac{1}{(n-1)t^{n-1}}\right)$$ But I think this differential equation can't be solved generally. When $\lim_{t\rightarrow \infty}x(t)$ converges? Please give me some advice.",,"['real-analysis', 'ordinary-differential-equations']"
36,Do periodic solutions of this system always exist?,Do periodic solutions of this system always exist?,,"Consider the following system of autonomous differential equations on $\mathbb{R}$: $$\frac{d}{dt}x(t)=f(x(t),y(t)) \ \ \ \ \ \text{and} \ \ \ \ \frac{d}{dt}y(t)=g(x(t),y(t)) \ \ \ \ (1)$$ where $f$ and $g$ satisfy local Lipschitz condition on both $x$ and $y$. While I was plotting some graphs modeling some ecological models, such as models of the interaction between populations of predators and preys, I noticed that this type of systems always have a periodic solution , provided it has a global bounded solution. Usually this periodic solution is a steady state (a constant solution). Is there any theorem which states this result? That is, is this theroem correct: Theorem. If $f$ and $g$ are locally Lipschitz with respect to both variables and if $(1)$ has a bounded solution on $t\in[0,\infty)$, then $(1)$  has a periodic solution.","Consider the following system of autonomous differential equations on $\mathbb{R}$: $$\frac{d}{dt}x(t)=f(x(t),y(t)) \ \ \ \ \ \text{and} \ \ \ \ \frac{d}{dt}y(t)=g(x(t),y(t)) \ \ \ \ (1)$$ where $f$ and $g$ satisfy local Lipschitz condition on both $x$ and $y$. While I was plotting some graphs modeling some ecological models, such as models of the interaction between populations of predators and preys, I noticed that this type of systems always have a periodic solution , provided it has a global bounded solution. Usually this periodic solution is a steady state (a constant solution). Is there any theorem which states this result? That is, is this theroem correct: Theorem. If $f$ and $g$ are locally Lipschitz with respect to both variables and if $(1)$ has a bounded solution on $t\in[0,\infty)$, then $(1)$  has a periodic solution.",,"['real-analysis', 'ordinary-differential-equations', 'dynamical-systems', 'periodic-functions']"
37,"Matrix Exponential: Solve $u''+2u'+u=0$ for $u(0)=u_0, u'(0)=u_1$",Matrix Exponential: Solve  for,"u''+2u'+u=0 u(0)=u_0, u'(0)=u_1","I am trying to solve the problem $u''+2u'+u=0$ for $u(0)=u_0, u'(0)=u_1$ using the matrix exponential. I first wrote the linear system as $x'_1=x_2$ and $x'_2=-x_1-2x_2$. I then found $e^{At}= $$ \left[   \begin{array}{ c c }      (t+1)e^{-t} & te^{-t} \\      -te^{-t} & (1-t)e^{-t}   \end{array} \right] $$ $ My book then says that $\vec{x}=e^{A(t-t_0)}x_0$. My question is how do I use this exponential matrix and the initial conditions to find the final answer? Thanks.","I am trying to solve the problem $u''+2u'+u=0$ for $u(0)=u_0, u'(0)=u_1$ using the matrix exponential. I first wrote the linear system as $x'_1=x_2$ and $x'_2=-x_1-2x_2$. I then found $e^{At}= $$ \left[   \begin{array}{ c c }      (t+1)e^{-t} & te^{-t} \\      -te^{-t} & (1-t)e^{-t}   \end{array} \right] $$ $ My book then says that $\vec{x}=e^{A(t-t_0)}x_0$. My question is how do I use this exponential matrix and the initial conditions to find the final answer? Thanks.",,['ordinary-differential-equations']
38,how to solve $y''=-\frac{1}{2y^2}?$ [closed],how to solve  [closed],y''=-\frac{1}{2y^2}?,"Closed. This question is off-topic . It is not currently accepting answers. This question is missing context or other details : Please improve the question by providing additional context, which ideally includes your thoughts on the problem and any attempts you have made to solve it. This information helps others identify where you have difficulties and helps them write answers appropriate to your experience level. Closed 6 years ago . Improve this question i've been learning special kind of second order non-linear ODE,of the form f(y,y') and f(t,y').I came across a question which I'm not able to reach to the solution.Can someone help me with the method...","Closed. This question is off-topic . It is not currently accepting answers. This question is missing context or other details : Please improve the question by providing additional context, which ideally includes your thoughts on the problem and any attempts you have made to solve it. This information helps others identify where you have difficulties and helps them write answers appropriate to your experience level. Closed 6 years ago . Improve this question i've been learning special kind of second order non-linear ODE,of the form f(y,y') and f(t,y').I came across a question which I'm not able to reach to the solution.Can someone help me with the method...",,['ordinary-differential-equations']
39,Problem checking the solution of an ode,Problem checking the solution of an ode,,"I am doing an exercise, which asks to show that given a continuous function $f:[0,\infty)\to \mathbb{R}$, then $$y(x):=\alpha+\int_{0}^x f(t)\sin(x-t) dt$$ is the particular solution of $y''+y=f$ verifying $y(0)=\alpha$ and $y'(0)=0$ What I have It is obvious that $y(0)=\alpha$. Using that $\sin(x-t)=\sin(x)\cos(t)-\cos(x)\sin(t)$, and using differentiation under integral sign, I have $$y'(x)=\cos(x)\int_0^x f(t)\cos(t)dt+\sin(x)\int_0^xf(t)\sin(t)dt$$ and substituting $x=0$ we get $y'(0)=0$. However, here is my problem. When I compute $y''$, and I write $y''+y$, after the cancelations, I get $$y''+y=f+\alpha$$ (That $\alpha$ coming from $y$ doesn't go away). What am I doing wrong here? Thanks!!","I am doing an exercise, which asks to show that given a continuous function $f:[0,\infty)\to \mathbb{R}$, then $$y(x):=\alpha+\int_{0}^x f(t)\sin(x-t) dt$$ is the particular solution of $y''+y=f$ verifying $y(0)=\alpha$ and $y'(0)=0$ What I have It is obvious that $y(0)=\alpha$. Using that $\sin(x-t)=\sin(x)\cos(t)-\cos(x)\sin(t)$, and using differentiation under integral sign, I have $$y'(x)=\cos(x)\int_0^x f(t)\cos(t)dt+\sin(x)\int_0^xf(t)\sin(t)dt$$ and substituting $x=0$ we get $y'(0)=0$. However, here is my problem. When I compute $y''$, and I write $y''+y$, after the cancelations, I get $$y''+y=f+\alpha$$ (That $\alpha$ coming from $y$ doesn't go away). What am I doing wrong here? Thanks!!",,"['real-analysis', 'analysis', 'ordinary-differential-equations', 'definite-integrals']"
