,title_raw,title_text,title_latex,body_raw,body_text,body_latex,tags
56,Summing the totient function $\sum_{k=1}^n \varphi(k)$,Summing the totient function,\sum_{k=1}^n \varphi(k),"I explored some computer science/number theory challenges sites for fun, and they presented the following problem, exactly as follows: Let $$P(n) = \sum_{k=1}^n \varphi(k)$$ Find $P(10^{16})$ I searched for quite a while about this and tried different approaches: Using the formula for $$\varphi(n)= n \cdot \prod_{i=1}^k \frac{p_i-1}{p_i}$$ I tried to calculate each $\varphi(n)$ in range, but this becomes very inefficient for large $n$ . I could get as far as $10^7$ with this approach. Beyond this it just gets too slow. I tried a different one, more direct. Wikipedia and Wolfram Alpha suggest similiar formulas for directly calculating $P(n)$ : $$P(n) = \sum_{k=1}^n \varphi(k)= \frac12 \cdot \biggl (1+ \sum_{k=1}^n\mu (k)\cdot \lfloor {\frac nk} \rfloor^2\biggl)$$ This formula seemed a lot more promising. I tried it and managed to get alot further than $10^7$ but still far from the target. With pre-calculating a sieve of the Moebius function, I could get to a bit less than $10^9$ . My memory was insufficient, and couldn't compute anymore values in a sieve. And even if I could, it still takes a long time and is very far from $10^{16}$ . Here is part of the code that I used for my 2nd approach written in Java: public static BigInteger PhiSummatoryFunction (long limit) {     BigInteger sum = BigInteger.ZERO;     int [] m = MoebiusSieve(limit);     for (int i=1;i<m.length;i++)         sum=sum.add(BigInteger.valueOf((long) (m[i]*Math.floor(limit/i)*Math.floor(limit/i))));     return sum.add(BigInteger.ONE).divide(BigInteger.ONE.add(BigInteger.ONE)); } Where MoebiusSieve is a function that computes the Moebius function values up to a certain limit in a sieve, using an eratosthenes-like method. After understanding and implementing the recursive method suggested in a link provided in the comments: $$P(n) = \frac {n(n+1)}{2} - \sum_{i=2}^\sqrt n P(\lfloor \frac ni \rfloor) - \sum_{j=1}^\sqrt n P(j) \cdot (\lfloor \frac nj \rfloor - \lfloor \frac n{j+1} \rfloor)$$ I can compute values up to $P(10^{11})$ , and with maximum memory allocation, pre-computing as many $\varphi(n)$ as possible and consequently all $P(n)$ that I can for memoization, I can compute $P(10^{12})$ in just over 20 minutes. A major improvement but still a little far from $P(10^{16})$ . It's ok if the computation takes a bit longer, but I fear $P(10^{16})$ would take exponentially longer time, judging by the ""jump"" in computation time between $P(10^{11})$ and $P(10^{12})$ . My memory allows me to ""save"" up to $350,000,000 \space φ(n)$ values OR up to $700,000,000 \space μ(k)$ values. Perhaps there is a way to perform the summation using μ(k) values rather than φ(n)?. All my computations suggest and show that my recursion is the prominent time consumer. This is obvious, but I am sure it takes longer than it should, as pointed out by qwr . So I am posting below the recursion code, with some documentation. It seems to me that this is the right way to do this computation, but my implementation is not optimal. public static BigInteger phiR (long limit, long [] s) // limit is 10^t, s is the sieve of precomputed values of `P(n)`. Can store maximum 350,000,000 values {                                                                                                                                                    if (limit<s.length)                                          return BigInteger.valueOf(s[(int) limit]);     BigInteger sum = BigInteger.valueOf(limit).multiply(BigInteger.valueOf(limit).add(BigInteger.ONE)).divide(BigInteger.valueOf(2)); // this corresponds to the n'th triangular number     BigInteger midsum1=BigInteger.ZERO;     BigInteger midsum2=BigInteger.ZERO;     for (long m=2;m*m<=limit;m++) // computing the first sum, first for changing floor(limit/m) values         midsum1=midsum1.add(phiR((long) Math.floor(limit/m),s));     for (long d=1;d*d<=limit;d++) // computing the second sum         if ((double)d!=Math.floor(limit/d))             midsum2=midsum2.add(BigInteger.valueOf((long) (Math.floor(limit/d)-Math.floor(limit/(d+1)))).multiply(phiR(d,s)));     sum=sum.subtract(midsum1).subtract(midsum2);     return sum; } I was suggested to use dictinaries by qwr , in addition to the array, for big values of $n$ , but I don't know anything about it. Can another improvement be made to make the time frame a day or so?","I explored some computer science/number theory challenges sites for fun, and they presented the following problem, exactly as follows: Let Find I searched for quite a while about this and tried different approaches: Using the formula for I tried to calculate each in range, but this becomes very inefficient for large . I could get as far as with this approach. Beyond this it just gets too slow. I tried a different one, more direct. Wikipedia and Wolfram Alpha suggest similiar formulas for directly calculating : This formula seemed a lot more promising. I tried it and managed to get alot further than but still far from the target. With pre-calculating a sieve of the Moebius function, I could get to a bit less than . My memory was insufficient, and couldn't compute anymore values in a sieve. And even if I could, it still takes a long time and is very far from . Here is part of the code that I used for my 2nd approach written in Java: public static BigInteger PhiSummatoryFunction (long limit) {     BigInteger sum = BigInteger.ZERO;     int [] m = MoebiusSieve(limit);     for (int i=1;i<m.length;i++)         sum=sum.add(BigInteger.valueOf((long) (m[i]*Math.floor(limit/i)*Math.floor(limit/i))));     return sum.add(BigInteger.ONE).divide(BigInteger.ONE.add(BigInteger.ONE)); } Where MoebiusSieve is a function that computes the Moebius function values up to a certain limit in a sieve, using an eratosthenes-like method. After understanding and implementing the recursive method suggested in a link provided in the comments: I can compute values up to , and with maximum memory allocation, pre-computing as many as possible and consequently all that I can for memoization, I can compute in just over 20 minutes. A major improvement but still a little far from . It's ok if the computation takes a bit longer, but I fear would take exponentially longer time, judging by the ""jump"" in computation time between and . My memory allows me to ""save"" up to values OR up to values. Perhaps there is a way to perform the summation using μ(k) values rather than φ(n)?. All my computations suggest and show that my recursion is the prominent time consumer. This is obvious, but I am sure it takes longer than it should, as pointed out by qwr . So I am posting below the recursion code, with some documentation. It seems to me that this is the right way to do this computation, but my implementation is not optimal. public static BigInteger phiR (long limit, long [] s) // limit is 10^t, s is the sieve of precomputed values of `P(n)`. Can store maximum 350,000,000 values {                                                                                                                                                    if (limit<s.length)                                          return BigInteger.valueOf(s[(int) limit]);     BigInteger sum = BigInteger.valueOf(limit).multiply(BigInteger.valueOf(limit).add(BigInteger.ONE)).divide(BigInteger.valueOf(2)); // this corresponds to the n'th triangular number     BigInteger midsum1=BigInteger.ZERO;     BigInteger midsum2=BigInteger.ZERO;     for (long m=2;m*m<=limit;m++) // computing the first sum, first for changing floor(limit/m) values         midsum1=midsum1.add(phiR((long) Math.floor(limit/m),s));     for (long d=1;d*d<=limit;d++) // computing the second sum         if ((double)d!=Math.floor(limit/d))             midsum2=midsum2.add(BigInteger.valueOf((long) (Math.floor(limit/d)-Math.floor(limit/(d+1)))).multiply(phiR(d,s)));     sum=sum.subtract(midsum1).subtract(midsum2);     return sum; } I was suggested to use dictinaries by qwr , in addition to the array, for big values of , but I don't know anything about it. Can another improvement be made to make the time frame a day or so?","P(n) = \sum_{k=1}^n \varphi(k) P(10^{16}) \varphi(n)= n \cdot \prod_{i=1}^k \frac{p_i-1}{p_i} \varphi(n) n 10^7 P(n) P(n) = \sum_{k=1}^n \varphi(k)= \frac12 \cdot \biggl (1+ \sum_{k=1}^n\mu (k)\cdot \lfloor {\frac nk} \rfloor^2\biggl) 10^7 10^9 10^{16} P(n) = \frac {n(n+1)}{2} - \sum_{i=2}^\sqrt n P(\lfloor \frac ni \rfloor) - \sum_{j=1}^\sqrt n P(j) \cdot (\lfloor \frac nj \rfloor - \lfloor \frac n{j+1} \rfloor) P(10^{11}) \varphi(n) P(n) P(10^{12}) P(10^{16}) P(10^{16}) P(10^{11}) P(10^{12}) 350,000,000 \space φ(n) 700,000,000 \space μ(k) n","['number-theory', 'functions', 'computer-science']"
57,Show that an ideal of the ring of integers of a real number field is not principal,Show that an ideal of the ring of integers of a real number field is not principal,,"The number field in question is $K=\mathbb{Q}(\sqrt{82})$ , and the ideal considered is in its ring of integers $R=\mathcal{O}_K=\mathbb{Z}[\sqrt{82}]$ . The ideal is: $\mathfrak{p}=(2,\sqrt{82})_R$ It is a prime ideal (this follows from a theorem on the splitting behaviour of ideals generated by prime integers), and it appears quite naturally in the unique factorisation $\mathfrak{p}^2=(2)_R$ , so we know that $N(\mathfrak{p})=\pm2$ . I want to show that the ideal is not principal. My attempts so far have been to consider the equation $x^2-82y^2=\pm2$ reduced modulo small integers and then arriving at a contradiction, but this has been to no avail. I have therefore resorted to asking the community the following: (1) Is there any general method to proving that an ideal in the ring of integers of a number field is non-principal, or are there general methods for separate cases $\textit{e.g.}$ in the case of a quadratic number field? The case of $K=\mathbb{Q}(\sqrt{d})$ for $d<0$ square-free of course admits fairly simple solution, as it can be easily observed that $x^2-dy^2=c$ for some $c\in K$ has no solutions when this is the case. (2) If the answer to (1) is either that there is no known general method or that any known general method is impracticable, and that in the case of an ideal in the ring of integers of a quadratic number field $K=\mathbb{Q}(\sqrt{d})$ the best one can do is consider equations of the form $x^2-dy^2=c$ modulo small integers, is there any general algorithm or technique that applies here other than some wit and a keen eye? All help would, as always, be highly appreciated.","The number field in question is , and the ideal considered is in its ring of integers . The ideal is: It is a prime ideal (this follows from a theorem on the splitting behaviour of ideals generated by prime integers), and it appears quite naturally in the unique factorisation , so we know that . I want to show that the ideal is not principal. My attempts so far have been to consider the equation reduced modulo small integers and then arriving at a contradiction, but this has been to no avail. I have therefore resorted to asking the community the following: (1) Is there any general method to proving that an ideal in the ring of integers of a number field is non-principal, or are there general methods for separate cases in the case of a quadratic number field? The case of for square-free of course admits fairly simple solution, as it can be easily observed that for some has no solutions when this is the case. (2) If the answer to (1) is either that there is no known general method or that any known general method is impracticable, and that in the case of an ideal in the ring of integers of a quadratic number field the best one can do is consider equations of the form modulo small integers, is there any general algorithm or technique that applies here other than some wit and a keen eye? All help would, as always, be highly appreciated.","K=\mathbb{Q}(\sqrt{82}) R=\mathcal{O}_K=\mathbb{Z}[\sqrt{82}] \mathfrak{p}=(2,\sqrt{82})_R \mathfrak{p}^2=(2)_R N(\mathfrak{p})=\pm2 x^2-82y^2=\pm2 \textit{e.g.} K=\mathbb{Q}(\sqrt{d}) d<0 x^2-dy^2=c c\in K K=\mathbb{Q}(\sqrt{d}) x^2-dy^2=c","['number-theory', 'ring-theory', 'algebraic-number-theory', 'ideals', 'maximal-and-prime-ideals']"
58,$p$ and $6p+1$ both palindrome - primes. Is $(131/787)$ the only example?,and  both palindrome - primes. Is  the only example?,p 6p+1 (131/787),"$131$ is a palindrome prime as well as $787$ , moreover $6\cdot 131+1=787$ . Are there further examples for a palindrome-prime $p$ , such that $6p+1$ is a palindrome-prime as well ? It is clear that $p$ must have an odd number od digits (since $11$ is the only palindrom-prime with an even number of digits) and the leading digit of $p$ must be $1$ , otherwise $6p+1$ has an even number of digits. So, $p$ must have the form $1\cdots 1$ and $6p+1$ must have the form $7\cdots 7$ . Upto $10^{10}$ , no further example exits.","is a palindrome prime as well as , moreover . Are there further examples for a palindrome-prime , such that is a palindrome-prime as well ? It is clear that must have an odd number od digits (since is the only palindrom-prime with an even number of digits) and the leading digit of must be , otherwise has an even number of digits. So, must have the form and must have the form . Upto , no further example exits.",131 787 6\cdot 131+1=787 p 6p+1 p 11 p 1 6p+1 p 1\cdots 1 6p+1 7\cdots 7 10^{10},"['number-theory', 'elementary-number-theory', 'prime-numbers', 'palindrome']"
59,"Show, by computing several values, that there are composite numbers in this sequence.","Show, by computing several values, that there are composite numbers in this sequence.",,"I was checking this number theory exercise: Consider the numbers $2 + 1, 2 · 3 + 1, 2 · 3 · 5 + 1, 2 · 3 · 5 · 7 + 1, · · · $ Show, by computing several values, that there are composite numbers in this sequence. (This shows that in the proof of Euclid’s theorem, these numbers are not necessarily prime, so it is necessary to look at prime factors of these numbers.) Is there a way to show that all numbers are not necessarily prime by a different way than computing several values?","I was checking this number theory exercise: Consider the numbers $2 + 1, 2 · 3 + 1, 2 · 3 · 5 + 1, 2 · 3 · 5 · 7 + 1, · · · $ Show, by computing several values, that there are composite numbers in this sequence. (This shows that in the proof of Euclid’s theorem, these numbers are not necessarily prime, so it is necessary to look at prime factors of these numbers.) Is there a way to show that all numbers are not necessarily prime by a different way than computing several values?",,"['number-theory', 'prime-numbers']"
60,A Classical Introduction to Modern Number Theory (by Ireland and Rosen) Vs Algebraic Number Theory (by Jarvis): Which should I use?,A Classical Introduction to Modern Number Theory (by Ireland and Rosen) Vs Algebraic Number Theory (by Jarvis): Which should I use?,,"I’m a freshman math major student and was looking for some recommendations on number theory books. Just to clarify, I was reading Abstract Algebra: An Introduction by Thomas Hungerford. Although it was my first abstract algebra book, it gave me some background in group and ring theory, modular arithmetic, fields, etc. I was undecided about two books: A Classical Introduction to Modern Number Theory by Ireland and Rosen, and Algebraic Number Theory by Jarvis, but I would like to use only one of them. At first glance, it seemed that the first one is way more rigorous than the second — specially because it says graduate textbooks, not undergraduate textbooks on it — but it turns out that a lot of people said that this is actually not true, and that the algebraic number theory book by Jarvis is more rigorous. Because of that, I would like to hear from you opinions on these two books, and I would really appreciate if you could list the prerequisites for each of them. Do I need to know anything besides the basics of abstract algebra to attack these books? Do I need to know some linear algebra, or some analysis or even calculus to handle it? Moreover, which would be more appropriate — in terms of material covered, clarity and rigor — considering that I have studied abstract algebra using Hungerford's book and that I have a basic (I mean, BASIC) background in elementary number theory? (*) Is there one of them that is more algebraic than the other? Does one of them presents analytic number theory and requires some background in analysis? I also accept recommendations regarding other books, though I'm really looking for opinions on those two books I mentioned. (*) I have never used any number theory book before, but Hungerford's book gave me some insights on elementary number theory, and I have attended some college classes in elementary number theory while on my high school senior year.","I’m a freshman math major student and was looking for some recommendations on number theory books. Just to clarify, I was reading Abstract Algebra: An Introduction by Thomas Hungerford. Although it was my first abstract algebra book, it gave me some background in group and ring theory, modular arithmetic, fields, etc. I was undecided about two books: A Classical Introduction to Modern Number Theory by Ireland and Rosen, and Algebraic Number Theory by Jarvis, but I would like to use only one of them. At first glance, it seemed that the first one is way more rigorous than the second — specially because it says graduate textbooks, not undergraduate textbooks on it — but it turns out that a lot of people said that this is actually not true, and that the algebraic number theory book by Jarvis is more rigorous. Because of that, I would like to hear from you opinions on these two books, and I would really appreciate if you could list the prerequisites for each of them. Do I need to know anything besides the basics of abstract algebra to attack these books? Do I need to know some linear algebra, or some analysis or even calculus to handle it? Moreover, which would be more appropriate — in terms of material covered, clarity and rigor — considering that I have studied abstract algebra using Hungerford's book and that I have a basic (I mean, BASIC) background in elementary number theory? (*) Is there one of them that is more algebraic than the other? Does one of them presents analytic number theory and requires some background in analysis? I also accept recommendations regarding other books, though I'm really looking for opinions on those two books I mentioned. (*) I have never used any number theory book before, but Hungerford's book gave me some insights on elementary number theory, and I have attended some college classes in elementary number theory while on my high school senior year.",,"['number-theory', 'elementary-number-theory']"
61,"If $ab \mid c(c^2-c+1)$ and $c^2+1 \mid a+b$ then prove that $\{a, b\}=\{c, c^2-c+1 \}$",If  and  then prove that,"ab \mid c(c^2-c+1) c^2+1 \mid a+b \{a, b\}=\{c, c^2-c+1 \}","If $ab \mid c(c^2-c+1)$ and $c^2+1 \mid a+b$ then prove that $\{a, b\}=\{c, c^2-c+1 \}$ (equal sets), where $a$, $b$, and $c$ are positive integers. This is math contest problem (I don't know the source). I was struggling to solve this, but I cannot find a way to make it easier. Can you help me? All I did was like this: $$a+b=d(c^2+1)=d(c^2-c+1+c) \\ c(a+b)=dc(c^2-c+1)+dc^2 \\ c(a+b)=deab+dc^2=d(eab+c^2)$$ I suppose this is a quadratic in $c$ and determine its discriminant. But it doesn't make the problem any easier!","If $ab \mid c(c^2-c+1)$ and $c^2+1 \mid a+b$ then prove that $\{a, b\}=\{c, c^2-c+1 \}$ (equal sets), where $a$, $b$, and $c$ are positive integers. This is math contest problem (I don't know the source). I was struggling to solve this, but I cannot find a way to make it easier. Can you help me? All I did was like this: $$a+b=d(c^2+1)=d(c^2-c+1+c) \\ c(a+b)=dc(c^2-c+1)+dc^2 \\ c(a+b)=deab+dc^2=d(eab+c^2)$$ I suppose this is a quadratic in $c$ and determine its discriminant. But it doesn't make the problem any easier!",,"['number-theory', 'elementary-number-theory', 'contest-math', 'diophantine-equations']"
62,Dirichlet's theorem on primes in arithmetic progressions: how to arrive at the result naturally?,Dirichlet's theorem on primes in arithmetic progressions: how to arrive at the result naturally?,,"I've seen the following theorem proved several times in several different ways: Let $a, b$ be relatively prime.  There are infinitely many prime numbers in the sequence $a,a+b,a+2b, ...$ The most difficult part of the argument comes down to showing that if $\chi$ is a nontrivial Dirichlet character, then $L(s,\chi)$ does not vanish at $s = 1$. I have understood the individual details of the arguments.  But I have never felt like I really understand why the result is true. Suppose you temporarily forgot what you knew about $L$-functions, Dirichlet density, Fourier analysis etc.  You know basic number theory and complex analysis.  How would you go about thinking about this problem in such a way as to naturally arrive at the result?  If necessary, you can rediscover L-functions as part of the process, but please justify your discovery with intuition.","I've seen the following theorem proved several times in several different ways: Let $a, b$ be relatively prime.  There are infinitely many prime numbers in the sequence $a,a+b,a+2b, ...$ The most difficult part of the argument comes down to showing that if $\chi$ is a nontrivial Dirichlet character, then $L(s,\chi)$ does not vanish at $s = 1$. I have understood the individual details of the arguments.  But I have never felt like I really understand why the result is true. Suppose you temporarily forgot what you knew about $L$-functions, Dirichlet density, Fourier analysis etc.  You know basic number theory and complex analysis.  How would you go about thinking about this problem in such a way as to naturally arrive at the result?  If necessary, you can rediscover L-functions as part of the process, but please justify your discovery with intuition.",,"['number-theory', 'algebraic-geometry', 'analytic-number-theory']"
63,Classical version and idelic version of class field theory,Classical version and idelic version of class field theory,,"Last semester, I took a course about class field theory and I learned about Artin reciprocity, which gives a map from ideal class group to Galois group,  $$ \left(\frac{L/K}{\cdot}\right):I_{K}\to Gal(L/K), \,\,\,\,\prod_{i=1}^{m}\mathfrak{p}_{i}^{n_{i}}\mapsto \prod_{i=1}^{m}\left(\frac{L/K}{\mathfrak{p}_{i}}\right)^{n_{i}} $$ where $\left(\frac{L/K}{\mathbb{p}_{i}}\right)$ is a Frobenius map corresponds to prime ideal $\mathfrak{p}$. Today, I learned an adelic version of (global) class field theory, which is  $$ \mathbb{A}^{\times}_{F}/\overline{F^{\times}(F_{\infty}^{\times})^{o}} \simeq G_{F}^{ab}$$ where $F$ is number field, $\mathbb{A}_{F}$ is adele over $F$ and $G_{F}^{ab}=Gal(F^{ab}/F)$.  I cannot understand how these two are connected. Could anyone can explain explicit relation between these two things?","Last semester, I took a course about class field theory and I learned about Artin reciprocity, which gives a map from ideal class group to Galois group,  $$ \left(\frac{L/K}{\cdot}\right):I_{K}\to Gal(L/K), \,\,\,\,\prod_{i=1}^{m}\mathfrak{p}_{i}^{n_{i}}\mapsto \prod_{i=1}^{m}\left(\frac{L/K}{\mathfrak{p}_{i}}\right)^{n_{i}} $$ where $\left(\frac{L/K}{\mathbb{p}_{i}}\right)$ is a Frobenius map corresponds to prime ideal $\mathfrak{p}$. Today, I learned an adelic version of (global) class field theory, which is  $$ \mathbb{A}^{\times}_{F}/\overline{F^{\times}(F_{\infty}^{\times})^{o}} \simeq G_{F}^{ab}$$ where $F$ is number field, $\mathbb{A}_{F}$ is adele over $F$ and $G_{F}^{ab}=Gal(F^{ab}/F)$.  I cannot understand how these two are connected. Could anyone can explain explicit relation between these two things?",,"['number-theory', 'class-field-theory']"
