,title_raw,title_text,title_latex,body_raw,body_text,body_latex,tags
0,Riemann Zeta Function Non-Vanishing on the Line $\mathrm{Re} \; z = 1$,Riemann Zeta Function Non-Vanishing on the Line,\mathrm{Re} \; z = 1,"The result quoted in the title is usually a stepping stone in the proof of the prime number theorem and I am familiar with the usual argument for this result. The other day my professor was telling me, however, that the prime number theorem actually implies this result too. He suggested looking at the limit: $$\lim_{\sigma \to 1} (\sigma-1)\int_1^{\infty}\frac{\psi(x)-x}{x^{\sigma+i\tau + 1}} \mathrm{d}x$$ Apparently by assuming the prime number theorem one can show that this limit is zero and from there deduce that $\zeta(1+i\tau) \neq 0$, but I am having difficulty showing either of these. Can someone help fill in the missing details please?","The result quoted in the title is usually a stepping stone in the proof of the prime number theorem and I am familiar with the usual argument for this result. The other day my professor was telling me, however, that the prime number theorem actually implies this result too. He suggested looking at the limit: $$\lim_{\sigma \to 1} (\sigma-1)\int_1^{\infty}\frac{\psi(x)-x}{x^{\sigma+i\tau + 1}} \mathrm{d}x$$ Apparently by assuming the prime number theorem one can show that this limit is zero and from there deduce that $\zeta(1+i\tau) \neq 0$, but I am having difficulty showing either of these. Can someone help fill in the missing details please?",,"['number-theory', 'analytic-number-theory', 'riemann-zeta']"
1,Inequality with four positive integers looking for upper bound,Inequality with four positive integers looking for upper bound,,"Umm. This comes from Diophantine quartic equation in four variables and will finish the most important part if it can be done. Four positive integers $w,x,y,z.$ One equation and two inequalities $$  wxyz = (w+x+y+z)^2,    $$ $$   w \geq x \geq y \geq z \geq 1,     $$ $$   xyz \geq 2(w+x+y+z).    $$ I am hoping for an upper bound. Since i made $w$ biggest, it would be an UPPER BOUND on $w.$ For example, I am running a computer program to find all such quadruples with $w \leq 1000.$ Sample question: is it true that $w \leq 1000?$ This is the method of Hurwitz 1907. I have a pdf. His techniques are almost right for this problem, to the point where i am already convinced that the answer to the question by hardmath comes out the exact same way. EDIT, these imply easily that $$\color{green}{ x+y+z \geq w}.  $$ Could be useful. EDIT:  almost forgot, these are what I believe to be all such quadruples: w  x  y  z     xyz  2(w+x+y+z) 4  4  4  4      64     32 6  6  3  3      52     36 8  5  5  2      50     40 10  10  9  1    90     60 12  6  4  2     48     48    15  10  3  2    60     60    18  9  8  1     72     72    21  14  6  1    84     84    30  24  5  1   120    120","Umm. This comes from Diophantine quartic equation in four variables and will finish the most important part if it can be done. Four positive integers $w,x,y,z.$ One equation and two inequalities $$  wxyz = (w+x+y+z)^2,    $$ $$   w \geq x \geq y \geq z \geq 1,     $$ $$   xyz \geq 2(w+x+y+z).    $$ I am hoping for an upper bound. Since i made $w$ biggest, it would be an UPPER BOUND on $w.$ For example, I am running a computer program to find all such quadruples with $w \leq 1000.$ Sample question: is it true that $w \leq 1000?$ This is the method of Hurwitz 1907. I have a pdf. His techniques are almost right for this problem, to the point where i am already convinced that the answer to the question by hardmath comes out the exact same way. EDIT, these imply easily that $$\color{green}{ x+y+z \geq w}.  $$ Could be useful. EDIT:  almost forgot, these are what I believe to be all such quadruples: w  x  y  z     xyz  2(w+x+y+z) 4  4  4  4      64     32 6  6  3  3      52     36 8  5  5  2      50     40 10  10  9  1    90     60 12  6  4  2     48     48    15  10  3  2    60     60    18  9  8  1     72     72    21  14  6  1    84     84    30  24  5  1   120    120",,"['number-theory', 'inequality', 'diophantine-equations']"
2,"First digits of extremely large numbers (Generalization of ""first digits of Graham's number"")","First digits of extremely large numbers (Generalization of ""first digits of Graham's number"")",,"I found a question about the first digits of Graham's number and would like to generalize it : We want the first n digits of the number $a\uparrow^b c$. Which method is the most effective to do that ? For which magnitude of a,b,c is the calculation feasible ? Is there a hope to calculate at least the first digit of Graham's number ? If the only way to find the first digits is to simply calculate the number, then already $3\uparrow \uparrow \uparrow 3$ would be out of reach. I tried to find out some patterns of the leading digits of powers, but there seems to be no structure. I know, that this question is somewhat broad, nevertheless I hope for some useful hints.","I found a question about the first digits of Graham's number and would like to generalize it : We want the first n digits of the number $a\uparrow^b c$. Which method is the most effective to do that ? For which magnitude of a,b,c is the calculation feasible ? Is there a hope to calculate at least the first digit of Graham's number ? If the only way to find the first digits is to simply calculate the number, then already $3\uparrow \uparrow \uparrow 3$ would be out of reach. I tried to find out some patterns of the leading digits of powers, but there seems to be no structure. I know, that this question is somewhat broad, nevertheless I hope for some useful hints.",,"['number-theory', 'big-numbers', 'decimal-expansion']"
3,Asymptotic formula for almost primes,Asymptotic formula for almost primes,,"I have developed a formula for almost primes which is far more accurate asymptotically than Landau's well known $$\pi_k(n) \sim \left( \frac{n}{\log n} \right) \frac{(\log\log n)^{k-1}}{(k - 1)!}$$ (Landau's is not good for high $n$, whereas the one I have been working on actually gets more accurate the higher $n$ becomes - see here .) Is this of any significance? Just out of interest, I have included some plots up to $n=9$: where actual is green, Landau is blue, & mine is red. (Note: I have changed the scale in each one.)","I have developed a formula for almost primes which is far more accurate asymptotically than Landau's well known $$\pi_k(n) \sim \left( \frac{n}{\log n} \right) \frac{(\log\log n)^{k-1}}{(k - 1)!}$$ (Landau's is not good for high $n$, whereas the one I have been working on actually gets more accurate the higher $n$ becomes - see here .) Is this of any significance? Just out of interest, I have included some plots up to $n=9$: where actual is green, Landau is blue, & mine is red. (Note: I have changed the scale in each one.)",,"['number-theory', 'prime-numbers', 'asymptotics']"
4,What is going on in this degree 8 number field that fails to be a quaternion extension of $\mathbb{Q}$?,What is going on in this degree 8 number field that fails to be a quaternion extension of ?,\mathbb{Q},"This is a soft but very mathematically hands-on question. Hopefully it will be interesting to more than just me. Thanks in advance for your help in thinking clearly about what follows. I have been trying to build a quaternion extension of $\mathbb{Q}$. I have been pursuing an overly optimistic method, which has not quite been working, and I just learned from this MO question that it's impossible for it to work. I would like your help in thinking about the way it is failing; more precisely, the extent to which it is/is not working. I have obtained a family of degree 8 number fields that are not quaternion extensions, and are not even normal, but due to the construction there is (perhaps??) something quaternion-ish about them. I guess my question is really: what is the relationship of $Q_8$ to the galois group of their normal closure? Let $L=\mathbb{Q}(\alpha)$ be a $Q_8$-extension of $\mathbb{Q}$. $L$ has a unique biquadratic subfield $K=\mathbb{Q}(\theta,\psi)$ where $\theta^2,\psi^2\in\mathbb{Q}$, and thus quadratic subfields $\mathbb{Q}(\theta),\mathbb{Q}(\psi),\mathbb{Q}(\theta\psi)$ fixed by $\mathbf{i},\mathbf{j},\mathbf{k}$ respectively. From the MO question linked above I learned that $\theta^2,\psi^2>0$, but before I knew that, I reasoned as follows: $\mathbf{i}$ must fix $\theta$ and reverse the sign of $\psi$, and have order $4$ cyclic action on $\alpha$. $\alpha$ can be taken to be the square root of an element of $K$; then we must have $\mathbf{i}^2(\alpha)=-\alpha$. So, optimistically, suppose $\mathbf{i}(\alpha)= \psi/\alpha$. Then $\mathbf{i}^2(\alpha)=-\psi/(\psi/\alpha)=-\alpha$; this is promising! Suppose likewise that $\mathbf{j}(\alpha)=\theta/\alpha$. Then $\mathbf{k}(\alpha)=\mathbf{ij}(\alpha)=\theta/(\psi/\alpha)=(\theta/\psi)\alpha$, and $$\mathbf{k}^2(\alpha) = \left(\frac{-\theta}{-\psi}\right)\left(\frac{\theta}{\psi}\right)\alpha=-\alpha$$ Thus $\theta^2,\psi^2$ are equal magnitude and opposite sign. This tells us, a propos of the linked MO question, that this optimistic construction cannot actually work. However, bear with me: If all of this were actually working, we would have $\theta/\psi = i$ (up to sign), and thus the conjugates of $\alpha$ would be $$\pm \alpha, \pm i\alpha, \pm \psi/\alpha, \pm i\psi/\alpha$$ A straightforward calculation shows that any polynomial of the form $$f_{\psi^2}(x) = x^8 - 2r x^4 + \psi^4$$ with $r,\psi^2\in\mathbb{Q}$ has these as roots. If we choose $r,\psi^2$ so that $f$ is irreducible, then $\mathbb{Q}[x]/(f)$ is a field of degree 8 over $\mathbb{Q}$, so even if it is not the originally-desired quaternion extension of $\mathbb{Q}$, it is something with a kind of promising-looking bunch of roots. So, consider $L=\mathbb{Q}[x]/(f)$ and let $\alpha$ be the residue of $x$ in this field.  If it were really the desired extension, it would contain $i, \psi$. We can force it to contain either one of these because we have control over the discriminant of $\alpha^4$ since we can control $r,\psi^2$. For example, choosing them so that $r^2+1=\psi^4$, e.g. $r=4/3, \psi^2=5/3$, we get $$\left(\alpha^4-r\right)^2 = (2r\alpha^4-\psi^4) -2r\alpha^4 + r^2 = r^2-\psi^4= -1$$ so that $L\supset \mathbb{Q}(i)$; in fact, $\mathbb{Q}(\alpha^4)=\mathbb{Q}(i)$ because it contains it and is degree $2$. Before I realized that $L$ couldn't possibly be my desired quaternion extension, I was hoping I could put a further fullfillable constraint on $r,\psi^2$ to force it to contain $\psi$; this was of course in vain. However, the search did lead me to realize that $$\left[\alpha^2((\psi^2-2r)+\alpha^4)\right]^2=\alpha^4\left(-4r(\psi^2-r)+2(\psi^2-r)\alpha^4\right)$$ $$=2(\psi^2-r)\left(-2r\alpha^4+\alpha^8\right)=2(r-\psi^2)\psi^4$$ Thus (because $\psi^4$ is a rational square) $L$, in fact $\mathbb{Q}(\alpha^2)$, contains a square root of $2(r-\psi^2)$. I found this square root by searching for elements of $L$ that were invariant under the substitution $\alpha\mapsto i\psi/\alpha$, which I wanted to correspond to $\mathbf{j}$. I was hoping for $\psi$ but instead I got a different rational square root! At any rate, we conclude that $\mathbb{Q}(\alpha^2)\subset L$ contains both $i$ and $\sqrt{2(r-\psi^2)}$. (For example with $r=4/3, \psi^2=5/3$, it contains $\sqrt{-2/3}$, thus $\mathbb{Q}(\sqrt{6})$.) Thus (under the condition $r^2+1=\phi^4$), $\mathbb{Q}(\alpha^2)$ is generically a biquadratic extension of $\mathbb{Q}$, and thus normal. On the other hand, $L$ is not normal, because it can't contain $\psi$ unless it is generated over $\mathbb{Q}$ by $i$, $\psi$, and $\sqrt{2(r-\psi^2)}$, and this is not plausible. On the other hand, $f$ splits in $L(\psi)$, so $L$'s normal closure is a quadratic extension of it. $L$ ought to have one conjugate $L'=\mathbb{Q}(\psi/\alpha)$ corresponding to the fact that $\alpha$ and $\psi/\alpha$ are both roots of $f$ and all other roots of $f$ are obtained from these by multiplying by $i$, which $L$ and thus any conjugate contains. So, we've obained a normal degree 16 extension $L(\psi)$ of $\mathbb{Q}$. I guess my question amounts to, what's the relationship between its Galois group and $Q_8$? (It seems to me that, at least, $Q_8$ should be a subgroup, with $\mathbf{i}$ sending $\psi\mapsto -\psi$, $\alpha\mapsto \psi/\alpha$, and $\mathbf{j}$ fixing $\psi$ and sending $\alpha\mapsto i\psi/\alpha$. Is this right?)","This is a soft but very mathematically hands-on question. Hopefully it will be interesting to more than just me. Thanks in advance for your help in thinking clearly about what follows. I have been trying to build a quaternion extension of $\mathbb{Q}$. I have been pursuing an overly optimistic method, which has not quite been working, and I just learned from this MO question that it's impossible for it to work. I would like your help in thinking about the way it is failing; more precisely, the extent to which it is/is not working. I have obtained a family of degree 8 number fields that are not quaternion extensions, and are not even normal, but due to the construction there is (perhaps??) something quaternion-ish about them. I guess my question is really: what is the relationship of $Q_8$ to the galois group of their normal closure? Let $L=\mathbb{Q}(\alpha)$ be a $Q_8$-extension of $\mathbb{Q}$. $L$ has a unique biquadratic subfield $K=\mathbb{Q}(\theta,\psi)$ where $\theta^2,\psi^2\in\mathbb{Q}$, and thus quadratic subfields $\mathbb{Q}(\theta),\mathbb{Q}(\psi),\mathbb{Q}(\theta\psi)$ fixed by $\mathbf{i},\mathbf{j},\mathbf{k}$ respectively. From the MO question linked above I learned that $\theta^2,\psi^2>0$, but before I knew that, I reasoned as follows: $\mathbf{i}$ must fix $\theta$ and reverse the sign of $\psi$, and have order $4$ cyclic action on $\alpha$. $\alpha$ can be taken to be the square root of an element of $K$; then we must have $\mathbf{i}^2(\alpha)=-\alpha$. So, optimistically, suppose $\mathbf{i}(\alpha)= \psi/\alpha$. Then $\mathbf{i}^2(\alpha)=-\psi/(\psi/\alpha)=-\alpha$; this is promising! Suppose likewise that $\mathbf{j}(\alpha)=\theta/\alpha$. Then $\mathbf{k}(\alpha)=\mathbf{ij}(\alpha)=\theta/(\psi/\alpha)=(\theta/\psi)\alpha$, and $$\mathbf{k}^2(\alpha) = \left(\frac{-\theta}{-\psi}\right)\left(\frac{\theta}{\psi}\right)\alpha=-\alpha$$ Thus $\theta^2,\psi^2$ are equal magnitude and opposite sign. This tells us, a propos of the linked MO question, that this optimistic construction cannot actually work. However, bear with me: If all of this were actually working, we would have $\theta/\psi = i$ (up to sign), and thus the conjugates of $\alpha$ would be $$\pm \alpha, \pm i\alpha, \pm \psi/\alpha, \pm i\psi/\alpha$$ A straightforward calculation shows that any polynomial of the form $$f_{\psi^2}(x) = x^8 - 2r x^4 + \psi^4$$ with $r,\psi^2\in\mathbb{Q}$ has these as roots. If we choose $r,\psi^2$ so that $f$ is irreducible, then $\mathbb{Q}[x]/(f)$ is a field of degree 8 over $\mathbb{Q}$, so even if it is not the originally-desired quaternion extension of $\mathbb{Q}$, it is something with a kind of promising-looking bunch of roots. So, consider $L=\mathbb{Q}[x]/(f)$ and let $\alpha$ be the residue of $x$ in this field.  If it were really the desired extension, it would contain $i, \psi$. We can force it to contain either one of these because we have control over the discriminant of $\alpha^4$ since we can control $r,\psi^2$. For example, choosing them so that $r^2+1=\psi^4$, e.g. $r=4/3, \psi^2=5/3$, we get $$\left(\alpha^4-r\right)^2 = (2r\alpha^4-\psi^4) -2r\alpha^4 + r^2 = r^2-\psi^4= -1$$ so that $L\supset \mathbb{Q}(i)$; in fact, $\mathbb{Q}(\alpha^4)=\mathbb{Q}(i)$ because it contains it and is degree $2$. Before I realized that $L$ couldn't possibly be my desired quaternion extension, I was hoping I could put a further fullfillable constraint on $r,\psi^2$ to force it to contain $\psi$; this was of course in vain. However, the search did lead me to realize that $$\left[\alpha^2((\psi^2-2r)+\alpha^4)\right]^2=\alpha^4\left(-4r(\psi^2-r)+2(\psi^2-r)\alpha^4\right)$$ $$=2(\psi^2-r)\left(-2r\alpha^4+\alpha^8\right)=2(r-\psi^2)\psi^4$$ Thus (because $\psi^4$ is a rational square) $L$, in fact $\mathbb{Q}(\alpha^2)$, contains a square root of $2(r-\psi^2)$. I found this square root by searching for elements of $L$ that were invariant under the substitution $\alpha\mapsto i\psi/\alpha$, which I wanted to correspond to $\mathbf{j}$. I was hoping for $\psi$ but instead I got a different rational square root! At any rate, we conclude that $\mathbb{Q}(\alpha^2)\subset L$ contains both $i$ and $\sqrt{2(r-\psi^2)}$. (For example with $r=4/3, \psi^2=5/3$, it contains $\sqrt{-2/3}$, thus $\mathbb{Q}(\sqrt{6})$.) Thus (under the condition $r^2+1=\phi^4$), $\mathbb{Q}(\alpha^2)$ is generically a biquadratic extension of $\mathbb{Q}$, and thus normal. On the other hand, $L$ is not normal, because it can't contain $\psi$ unless it is generated over $\mathbb{Q}$ by $i$, $\psi$, and $\sqrt{2(r-\psi^2)}$, and this is not plausible. On the other hand, $f$ splits in $L(\psi)$, so $L$'s normal closure is a quadratic extension of it. $L$ ought to have one conjugate $L'=\mathbb{Q}(\psi/\alpha)$ corresponding to the fact that $\alpha$ and $\psi/\alpha$ are both roots of $f$ and all other roots of $f$ are obtained from these by multiplying by $i$, which $L$ and thus any conjugate contains. So, we've obained a normal degree 16 extension $L(\psi)$ of $\mathbb{Q}$. I guess my question amounts to, what's the relationship between its Galois group and $Q_8$? (It seems to me that, at least, $Q_8$ should be a subgroup, with $\mathbf{i}$ sending $\psi\mapsto -\psi$, $\alpha\mapsto \psi/\alpha$, and $\mathbf{j}$ fixing $\psi$ and sending $\alpha\mapsto i\psi/\alpha$. Is this right?)",,"['number-theory', 'soft-question', 'field-theory', 'algebraic-number-theory', 'galois-theory']"
5,Ring class field of $\mathbb{Q}(\sqrt{-19})$,Ring class field of,\mathbb{Q}(\sqrt{-19}),I am looking an explicit form for the ring class field of the order $\mathbb{Z}[\sqrt{-19}]$ in the quadratic field $\mathbb{Q}(\sqrt{-19})$. Does anyone know if there is some and how it is?,I am looking an explicit form for the ring class field of the order $\mathbb{Z}[\sqrt{-19}]$ in the quadratic field $\mathbb{Q}(\sqrt{-19})$. Does anyone know if there is some and how it is?,,"['number-theory', 'algebraic-number-theory', 'class-field-theory']"
