,title_raw,title_text,title_latex,body_raw,body_text,body_latex,tags
15,"Prove $1^r+2^r+.....\equiv 0\pmod p$ , given that p is odd prime and $0<r<p-1$","Prove  , given that p is odd prime and",1^r+2^r+.....\equiv 0\pmod p 0<r<p-1,"An exercise reads as follows: If $p$ is an odd prime and $0<r<p-1$ then prove that $s=1^r+2^r+...(p-1)^r\equiv 0\mod p$ I know one clever way to prove it is to use a primitive root $g$ and write the given sum as: $g^r+g^{2r}+g^{3r} +...+g^{(p-1)r}$ which is a geometric process easy to handle and deduce the result. But I am looking for a more primitive way right now (suppose I know nothing about primitive roots). My thought is: the polynomial $$f=x^{p-1}-1$$ has $p-1$ roots distinct roots in the field $\Bbb{Z_p}$ so one can also write $$f= (x-1)(x-2)(x-3)...(x-(p-1))$$ . By inspection of the coefficients of the 2 equal polynomials we get $t_1=1+2+3+...+(p-1)\equiv0 \mod p$ $t_2=1\cdot 2+1\cdot 3+...+(p-2)\cdot( p-1)\equiv 0 \mod p$ $t_3=1\cdot 2\cdot3+1\cdot 2\cdot4+...+(p-3)\cdot (p-2)\cdot(p-1)\equiv 0\mod p$ and so on .... now suppose $r=2$ then $s=t^2_1 -2t_2$ , where we deduce that $p$ divides $s$ But how in general to compute $s$ by the $t_i$ mentioned above? Is there an algorithm for that? Thanks a lot.","An exercise reads as follows: If is an odd prime and then prove that I know one clever way to prove it is to use a primitive root and write the given sum as: which is a geometric process easy to handle and deduce the result. But I am looking for a more primitive way right now (suppose I know nothing about primitive roots). My thought is: the polynomial has roots distinct roots in the field so one can also write . By inspection of the coefficients of the 2 equal polynomials we get and so on .... now suppose then , where we deduce that divides But how in general to compute by the mentioned above? Is there an algorithm for that? Thanks a lot.",p 0<r<p-1 s=1^r+2^r+...(p-1)^r\equiv 0\mod p g g^r+g^{2r}+g^{3r} +...+g^{(p-1)r} f=x^{p-1}-1 p-1 \Bbb{Z_p} f= (x-1)(x-2)(x-3)...(x-(p-1)) t_1=1+2+3+...+(p-1)\equiv0 \mod p t_2=1\cdot 2+1\cdot 3+...+(p-2)\cdot( p-1)\equiv 0 \mod p t_3=1\cdot 2\cdot3+1\cdot 2\cdot4+...+(p-3)\cdot (p-2)\cdot(p-1)\equiv 0\mod p r=2 s=t^2_1 -2t_2 p s s t_i,"['number-theory', 'elementary-number-theory', 'prime-numbers']"
16,On $x^5+x+1\equiv 0 \mod p$,On,x^5+x+1\equiv 0 \mod p,"Prove that if $x^2 \equiv p \mod{23}$ has no integer solutions then $x^5+x+1\equiv 0 \mod p$ has integer solutions. I found this after I test for the first 10000 prime numbers, but I don't know how to prove this.","Prove that if has no integer solutions then has integer solutions. I found this after I test for the first 10000 prime numbers, but I don't know how to prove this.",x^2 \equiv p \mod{23} x^5+x+1\equiv 0 \mod p,"['number-theory', 'algebraic-number-theory']"
17,Surprising fact about a certain number-theoretic function,Surprising fact about a certain number-theoretic function,,"Ante suggested the following function : For natural number $n$ we can observe the $n$ remainders $b_1,...,b_n$ by writing $n$ as $n=a_k \cdot k+b_k$ for $1 \leq k \leq n$ Because of the familiar division-with-remainder-theorem we have $0 \leq b_k <n$ Now we can study the sum $$r(n)=\sum_{k=1}^{\lfloor \frac{n-1}{2} \rfloor}b_k$$ After playing around with some values with support of Haran and Ante, we noticed that $$r(b)=r(b+1)$$ seems to hold if and only if $b+1$ is a power of $2$ or $3$ , including $2$ and $3$ There is no counterexmple upto $10^4$ ? r={(p)->su=0;for(j=2,(p-1)/2,su=su+lift(Mod(p,j)));su} %94 = (p)->su=0;for(j=2,(p-1)/2,su=su+lift(Mod(p,j)));su ? for(j=1,10^4,if(r(j)==r(j+1),print(j,"" "",factor(j+1)))) 1 Mat([2, 1]) 2 Mat([3, 1]) 3 Mat([2, 2]) 7 Mat([2, 3]) 8 Mat([3, 2]) 15 Mat([2, 4]) 26 Mat([3, 3]) 31 Mat([2, 5]) 63 Mat([2, 6]) 80 Mat([3, 4]) 127 Mat([2, 7]) 242 Mat([3, 5]) 255 Mat([2, 8]) 511 Mat([2, 9]) 728 Mat([3, 6]) 1023 Mat([2, 10]) 2047 Mat([2, 11]) 2186 Mat([3, 7]) 4095 Mat([2, 12]) 6560 Mat([3, 8]) 8191 Mat([2, 13]) ? Is this in fact true, and if yes, why ?","Ante suggested the following function : For natural number we can observe the remainders by writing as for Because of the familiar division-with-remainder-theorem we have Now we can study the sum After playing around with some values with support of Haran and Ante, we noticed that seems to hold if and only if is a power of or , including and There is no counterexmple upto ? r={(p)->su=0;for(j=2,(p-1)/2,su=su+lift(Mod(p,j)));su} %94 = (p)->su=0;for(j=2,(p-1)/2,su=su+lift(Mod(p,j)));su ? for(j=1,10^4,if(r(j)==r(j+1),print(j,"" "",factor(j+1)))) 1 Mat([2, 1]) 2 Mat([3, 1]) 3 Mat([2, 2]) 7 Mat([2, 3]) 8 Mat([3, 2]) 15 Mat([2, 4]) 26 Mat([3, 3]) 31 Mat([2, 5]) 63 Mat([2, 6]) 80 Mat([3, 4]) 127 Mat([2, 7]) 242 Mat([3, 5]) 255 Mat([2, 8]) 511 Mat([2, 9]) 728 Mat([3, 6]) 1023 Mat([2, 10]) 2047 Mat([2, 11]) 2186 Mat([3, 7]) 4095 Mat([2, 12]) 6560 Mat([3, 8]) 8191 Mat([2, 13]) ? Is this in fact true, and if yes, why ?","n n b_1,...,b_n n n=a_k \cdot k+b_k 1 \leq k \leq n 0 \leq b_k <n r(n)=\sum_{k=1}^{\lfloor \frac{n-1}{2} \rfloor}b_k r(b)=r(b+1) b+1 2 3 2 3 10^4","['number-theory', 'elementary-number-theory', 'summation', 'perfect-powers']"
18,"Primitive instances where $c^3|(a^3+b^3)$ with $a,b,c\in\mathbb{N}$",Primitive instances where  with,"c^3|(a^3+b^3) a,b,c\in\mathbb{N}","It is known that by Fermat's Last Theorem there are no solutions to $a^3+b^3=c^3$ for $a,b,c\in\mathbb{N}$ . I wondered about how multiplying the $c^3$ by a constant would change this fact. Accordingly, I have been looking into instances where $c^3|(a^3+b^3)$ for $a,b\in\mathbb{N}$ . In other words, solutions to the Diophantine Equation: $a^3+b^3=dc^3$ where $a,b,$ and $c$ are pairwise co-prime and $a,b,c>0$ Obviously there are some trivial solutions. If $c=1$ , for example, $a$ and $b$ can be any integers, and $d$ can be chosen to simply be $a^3+b^3$ . By requiring that $a,b,$ and $c$ are pairwise co-prime and that $c\not=1$ , we eliminate the trivial solutions, and what remains is of much more interest. For $a,b,c,d\le20$ , there are 5 solutions: $4^3+5^3=7*3^3$ $2^3+7^3=13*3^3$ $1^3+8^3=19*3^3$ $3^3+5^3=19*2^3$ $1^3+19^3=20*7^3$ Under $100$ there are $16$ solutions, as found by Mathematica. My  question about this equation: Has it been studied previously? Are there infinitely many primitive solutions (which it seems like there are)? If so, can they be parametrized?","It is known that by Fermat's Last Theorem there are no solutions to for . I wondered about how multiplying the by a constant would change this fact. Accordingly, I have been looking into instances where for . In other words, solutions to the Diophantine Equation: where and are pairwise co-prime and Obviously there are some trivial solutions. If , for example, and can be any integers, and can be chosen to simply be . By requiring that and are pairwise co-prime and that , we eliminate the trivial solutions, and what remains is of much more interest. For , there are 5 solutions: Under there are solutions, as found by Mathematica. My  question about this equation: Has it been studied previously? Are there infinitely many primitive solutions (which it seems like there are)? If so, can they be parametrized?","a^3+b^3=c^3 a,b,c\in\mathbb{N} c^3 c^3|(a^3+b^3) a,b\in\mathbb{N} a^3+b^3=dc^3 a,b, c a,b,c>0 c=1 a b d a^3+b^3 a,b, c c\not=1 a,b,c,d\le20 4^3+5^3=7*3^3 2^3+7^3=13*3^3 1^3+8^3=19*3^3 3^3+5^3=19*2^3 1^3+19^3=20*7^3 100 16","['number-theory', 'elementary-number-theory', 'diophantine-equations', 'integers', 'cubics']"
19,Does $\sum_{k=1}^n|\cot \sqrt2\pi k|$ tends to $An\ln n$ as $n\to\infty$?,Does  tends to  as ?,\sum_{k=1}^n|\cot \sqrt2\pi k| An\ln n n\to\infty,"Question: How can we prove that $$L(n)=\sum_{k=1}^n\left|\cot \sqrt2\pi k\right|=\Theta(n\log n)$$ as $n\to\infty$ ? Furthermore, if $\sqrt2$ is replaced with a quadratic irrational number, does it still holds? Numerical experiment . By plotting $$\frac1{n\ln n}\sum_{k=1}^n\left|\cot \sqrt2\pi k\right|,$$ we can find that it approximately tends to $0.6$ . (The following graph is added after an edit) Failed attempt of the upper bound . $$L(n)<\sum_{k=1}^nCk=C\frac{n(n+1)}2$$ for some $C$ . It can be easily deduced due to the irrationality measure $2$ of $\sqrt2$ . Failed attempt of the lower bound . Asymptotically, half of the summand is greater than $1$ due to the irrationality of $\sqrt2$ . Therefore, $L(n)>Dn$ for some $D$ when $n$ is large enough.","Question: How can we prove that as ? Furthermore, if is replaced with a quadratic irrational number, does it still holds? Numerical experiment . By plotting we can find that it approximately tends to . (The following graph is added after an edit) Failed attempt of the upper bound . for some . It can be easily deduced due to the irrationality measure of . Failed attempt of the lower bound . Asymptotically, half of the summand is greater than due to the irrationality of . Therefore, for some when is large enough.","L(n)=\sum_{k=1}^n\left|\cot \sqrt2\pi k\right|=\Theta(n\log n) n\to\infty \sqrt2 \frac1{n\ln n}\sum_{k=1}^n\left|\cot \sqrt2\pi k\right|, 0.6 L(n)<\sum_{k=1}^nCk=C\frac{n(n+1)}2 C 2 \sqrt2 1 \sqrt2 L(n)>Dn D n","['number-theory', 'asymptotics', 'diophantine-approximation', 'fractional-part', 'irrationality-measure']"
20,$x^5 + x^4 +1$ to be a perfect square,to be a perfect square,x^5 + x^4 +1,Find all positive integers x such that $x^5 + x^4 +1$ is a perfect square. My progress: factoring gives $(x^3-x+1)(x^2+x+1)$ . The gcd of the factors is 1 or 7 and the first case is easily ruled out. But what if both multipliers are 7 times a square? Any help appreciated.,Find all positive integers x such that is a perfect square. My progress: factoring gives . The gcd of the factors is 1 or 7 and the first case is easily ruled out. But what if both multipliers are 7 times a square? Any help appreciated.,x^5 + x^4 +1 (x^3-x+1)(x^2+x+1),"['number-theory', 'diophantine-equations']"
21,Property of smooth functions on the adeles,Property of smooth functions on the adeles,,"Let $k$ be a number field, $\mathbb A$ the ring of adeles of $k$ , $\mathbb A_f$ the finite adeles, and $\mathbb A_{\infty}$ the infinite adeles. Let $\phi: \mathbb A = \mathbb A_{\infty} \times \mathbb A_f \rightarrow \mathbb C$ be a continuous function which is smooth in the first variable and locally constant in the second variable.  Some authors call such a function smooth . Is it the case that for every $x \in \mathbb A$ , there exists an open neighborhood $U$ of $x$ , and an open compact subgroup $H$ of $\mathbb A_f$ , such that $$\phi(x'+h) = \phi(x')$$ for all $x' \in U, h \in H$ ? This seems to be the claim in an answer to one of my questions on Mathoverflow, which I am trying to understand. My attempt: Lemma 1 : For every $x \in \mathbb A$ , there exists an open compact subgroup $H$ of $\mathbb A_f$ such that $\phi(x+h) = \phi(x)$ for all $h \in H$ . The problem becomes whether in the Lemma we can choose $H$ uniformly for $x'$ in a sufficiently small neighborhood of $x$ . Proof of Lemma 1: Let $x = (x_1,x_2) \in \mathbb A = \mathbb A_{\infty} \times \mathbb A_f$ .  There exists an open neighborhood $V \subset \mathbb A_f$ of $x_2$ such that $$\phi(x_1,y') = \phi(x_1,x_2)$$ for all $y' \in V$ .  Let $H$ be an open compact subgroup of $\mathbb A_f$ which is contained in the neighborhood $V - x_2$ of the identity.  Then for all $h \in H$ , we have $h + x_2 \in V$ , and so $$\phi(x + h) = \phi((x_1,x_2) + (0,h)) = \phi(x_1,x_2+h) = \phi(x_1,x_2) = \phi(x)$$ $\blacksquare$ To prove what I want, I will definitely need to make use of the fact that $\phi$ is continuous.  So far I haven't been successful.","Let be a number field, the ring of adeles of , the finite adeles, and the infinite adeles. Let be a continuous function which is smooth in the first variable and locally constant in the second variable.  Some authors call such a function smooth . Is it the case that for every , there exists an open neighborhood of , and an open compact subgroup of , such that for all ? This seems to be the claim in an answer to one of my questions on Mathoverflow, which I am trying to understand. My attempt: Lemma 1 : For every , there exists an open compact subgroup of such that for all . The problem becomes whether in the Lemma we can choose uniformly for in a sufficiently small neighborhood of . Proof of Lemma 1: Let .  There exists an open neighborhood of such that for all .  Let be an open compact subgroup of which is contained in the neighborhood of the identity.  Then for all , we have , and so To prove what I want, I will definitely need to make use of the fact that is continuous.  So far I haven't been successful.","k \mathbb A k \mathbb A_f \mathbb A_{\infty} \phi: \mathbb A = \mathbb A_{\infty} \times \mathbb A_f \rightarrow \mathbb C x \in \mathbb A U x H \mathbb A_f \phi(x'+h) = \phi(x') x' \in U, h \in H x \in \mathbb A H \mathbb A_f \phi(x+h) = \phi(x) h \in H H x' x x = (x_1,x_2) \in \mathbb A = \mathbb A_{\infty} \times \mathbb A_f V \subset \mathbb A_f x_2 \phi(x_1,y') = \phi(x_1,x_2) y' \in V H \mathbb A_f V - x_2 h \in H h + x_2 \in V \phi(x + h) = \phi((x_1,x_2) + (0,h)) = \phi(x_1,x_2+h) = \phi(x_1,x_2) = \phi(x) \blacksquare \phi","['number-theory', 'algebraic-number-theory', 'topological-groups', 'adeles']"
22,an inverse of the Artin-Hasse exponential?,an inverse of the Artin-Hasse exponential?,,In the p-adic world the Artin-Hasse exponential is the sollowing power series: $$   E_p(x)= \exp \left( \sum_{n=0}^{\infty}\frac{x^{p^n}}{p^n} \right) $$ where $E_p(x)\in 1+x\mathbb{Z}_{(p)}[[x]]$ with radius of convergence $r=1$ . My question is : as the classical exponential it is possibile define a sort of 'logarithm' which invert this series? Thanks for the suggestions!,In the p-adic world the Artin-Hasse exponential is the sollowing power series: where with radius of convergence . My question is : as the classical exponential it is possibile define a sort of 'logarithm' which invert this series? Thanks for the suggestions!,"
  E_p(x)= \exp \left( \sum_{n=0}^{\infty}\frac{x^{p^n}}{p^n} \right)
 E_p(x)\in 1+x\mathbb{Z}_{(p)}[[x]] r=1","['number-theory', 'power-series', 'exponential-function', 'p-adic-number-theory']"
23,Example of a concrete irrationality test,Example of a concrete irrationality test,,"Can you give some example of an irrational number that can be proved to be irrational with this theorem? Theorem . Given $a\in \mathbb{R}$ , if there exists a sequence of integers $u_n,v_n \rightarrow \infty$ such that: $a$ is not equal to any $u_n/v_n$ . The quotien sequences aproximates $a$ in this sense: $$\lim_{n\rightarrow \infty}v_na-u_n=0 $$ then the number $a$ is irrational. The proof is in: https://math.stackexchange.com/q/898420","Can you give some example of an irrational number that can be proved to be irrational with this theorem? Theorem . Given , if there exists a sequence of integers such that: is not equal to any . The quotien sequences aproximates in this sense: then the number is irrational. The proof is in: https://math.stackexchange.com/q/898420","a\in \mathbb{R} u_n,v_n \rightarrow \infty a u_n/v_n a \lim_{n\rightarrow \infty}v_na-u_n=0  a","['number-theory', 'irrational-numbers']"
24,Analogue of complex infinity for quaternions,Analogue of complex infinity for quaternions,,"The complex infinity is defined as a pole on the Riemann sphere, which is the result of the 1-point compactification of the complex plane. Considering that quaternions are an extension of complex numbers, and that unit quaternions are points on the 4D unit sphere, is there any analogue of this for quaternions, like quaternion infinity?","The complex infinity is defined as a pole on the Riemann sphere, which is the result of the 1-point compactification of the complex plane. Considering that quaternions are an extension of complex numbers, and that unit quaternions are points on the 4D unit sphere, is there any analogue of this for quaternions, like quaternion infinity?",,"['number-theory', 'complex-numbers', 'infinity', 'riemann-surfaces', 'quaternions']"
25,Is there/can there be a model-theoretic proof of this theorem of arithmetic ?,Is there/can there be a model-theoretic proof of this theorem of arithmetic ?,,"I read on MO that if an integer $a$ is a square mod $p$ for sufficiently large primes $p$, then $a$ is a square. Now that's a statement that looks awfully like a Lefschetz-principle-type statement; and so I'm wondering whether there'd be a model-theoretic proof. It could start as follow: fix such an $a$;  let $T$ be a theory looking like the theory of rings + $\exists x, (x^2 = 1+...+1)  \land P(x)$ (there are $a$ $1$'s) + for all $p$, $char \neq p$; where $P$ is a nice formula expressing something that looks like ""$x$ is an integer"". One reason this might work is that for instance $\mathbb{N}$ is definable in $(\mathbb{Q},+,\times)$, and so we may expect that such a ""nice"" formula $P$ may exist. With a bit of luck, using compactness would then allow us to conclude. Of course I haven't done much here, I just threw a bunch of ideas but it's mostly because I don't see how to do better for the moment. So my question is : Is there a known model-theoretic proof of this fact? Has one ever been attempted ? Are there number-theoretic obstructions to the existence of such a proof ? (like for instance ""this theorem implies such and such deep theorems that for some reason are essentially number-theoretic"")","I read on MO that if an integer $a$ is a square mod $p$ for sufficiently large primes $p$, then $a$ is a square. Now that's a statement that looks awfully like a Lefschetz-principle-type statement; and so I'm wondering whether there'd be a model-theoretic proof. It could start as follow: fix such an $a$;  let $T$ be a theory looking like the theory of rings + $\exists x, (x^2 = 1+...+1)  \land P(x)$ (there are $a$ $1$'s) + for all $p$, $char \neq p$; where $P$ is a nice formula expressing something that looks like ""$x$ is an integer"". One reason this might work is that for instance $\mathbb{N}$ is definable in $(\mathbb{Q},+,\times)$, and so we may expect that such a ""nice"" formula $P$ may exist. With a bit of luck, using compactness would then allow us to conclude. Of course I haven't done much here, I just threw a bunch of ideas but it's mostly because I don't see how to do better for the moment. So my question is : Is there a known model-theoretic proof of this fact? Has one ever been attempted ? Are there number-theoretic obstructions to the existence of such a proof ? (like for instance ""this theorem implies such and such deep theorems that for some reason are essentially number-theoretic"")",,"['number-theory', 'finite-fields', 'model-theory', 'square-numbers']"
26,Integers and Number-theory,Integers and Number-theory,,The positive integers from $1$ to $n$ (where $n>1$) are arranged in a line such that the sum of any two adjacent numbers is a square. What is the minimum value of $n$?,The positive integers from $1$ to $n$ (where $n>1$) are arranged in a line such that the sum of any two adjacent numbers is a square. What is the minimum value of $n$?,,"['number-theory', 'integers']"
27,"Does every equation involving $+,-,\times,\div,\sqrt{},\mathbb Q$ only have solutions in the algebraic numbers",Does every equation involving  only have solutions in the algebraic numbers,"+,-,\times,\div,\sqrt{},\mathbb Q","Let's say you have an equation $f(x)=0$ where $f:\mathbb R \to \mathbb R$ is composed of $$+,-,\times,\div,\sqrt{},n \in \mathbb Z$$ If $f$ has only finitely many solutions, are all the solutions algebraic? I've tried (structural) induction. The cases $n$, $\div$ and $\times$ are easy. $+$ and $-$ are not. I've been trying to reduce it to a polynomial equation. Problem is that doing $\sqrt{A}=B \implies A=B^2$ makes the RHS more complicated. If the RHS contains sums of square roots then this doesn't make progress. (Maybe I could do more work here?) I don't see how to use the fact the algebraic numbers are closed under the above operations. I've been trying to think of a counterexample.","Let's say you have an equation $f(x)=0$ where $f:\mathbb R \to \mathbb R$ is composed of $$+,-,\times,\div,\sqrt{},n \in \mathbb Z$$ If $f$ has only finitely many solutions, are all the solutions algebraic? I've tried (structural) induction. The cases $n$, $\div$ and $\times$ are easy. $+$ and $-$ are not. I've been trying to reduce it to a polynomial equation. Problem is that doing $\sqrt{A}=B \implies A=B^2$ makes the RHS more complicated. If the RHS contains sums of square roots then this doesn't make progress. (Maybe I could do more work here?) I don't see how to use the fact the algebraic numbers are closed under the above operations. I've been trying to think of a counterexample.",,"['number-theory', 'field-theory']"
28,Prime numbers in Fermat's little theorem,Prime numbers in Fermat's little theorem,,"Consider prime numbers $a$ and $p$. It is known  according to Fermat's little theorem   (FLT) that the congruence $a^{p-1}  \equiv 1 \pmod {p}$  holds for any prime $a$ and $p$. From this we have that there are infinitely many numbers of  form $a^m$ which are congruent to $1$ as any power   $(a^{p-1})^k$ is congruent to $1$ if only $a^{p-1}$ is congruent. The question arises however whether a number $m=p-1$ appearing in FLT is the smallest  number (obviously excluding $a^0=1$) which satifies $a^m  \equiv 1 \pmod {p}$ ? I've made some experimental analysis taking into account powers of $a=2$ and sequence of prime numbers $p=5,7,11,13,17, 19 , \dots$. I will name prime numbers $p$ for which equality above is satisfied when there is no less number $m$ than $p-1$ that $2^m  \equiv 1 \pmod {p}$ proper FLT prime numbers - if it happens that however there is a   number $m<p-1$   when $2^m  \equiv 1 \pmod {p}$ is satisfied I will name such number $p$ improper FLT number  (if there is more official terminology let me know) and number $m$ initial number for the given $p$. Having made calculations I received following numbers $p$ for powers  of two congruent to $ 1 \pmod {p}$: Proper LFT numbers: $5(4),11(10),13(12),19(18),29(28),37(36),53(52),59(58) \dots$ Improper LFT numbers: $7 (3), 17 (8), 23(11), 31(5),41(20),43(14), 47(23)\dots$ Here in brackets smallest exponents $m$ (named as initial numbers) for satysfying formula $2^m \equiv 1 \pmod {p}$ are given.  For example $2^8\equiv 1 \pmod {17}$. Evidently initial numbers    for improper FLT numbers are divisors of $p-1$ what is intuitively expected but  why exactly such value not other ? (see $5$ for $31$, not for example $10$ or see $14$ for $43$ not $7$) it's hard to say. My question: is it any method to discern proper and improper FLT numbers? if we are able to recognize that a given prime number is FLT improper can we also say what is an initial number associated with it?","Consider prime numbers $a$ and $p$. It is known  according to Fermat's little theorem   (FLT) that the congruence $a^{p-1}  \equiv 1 \pmod {p}$  holds for any prime $a$ and $p$. From this we have that there are infinitely many numbers of  form $a^m$ which are congruent to $1$ as any power   $(a^{p-1})^k$ is congruent to $1$ if only $a^{p-1}$ is congruent. The question arises however whether a number $m=p-1$ appearing in FLT is the smallest  number (obviously excluding $a^0=1$) which satifies $a^m  \equiv 1 \pmod {p}$ ? I've made some experimental analysis taking into account powers of $a=2$ and sequence of prime numbers $p=5,7,11,13,17, 19 , \dots$. I will name prime numbers $p$ for which equality above is satisfied when there is no less number $m$ than $p-1$ that $2^m  \equiv 1 \pmod {p}$ proper FLT prime numbers - if it happens that however there is a   number $m<p-1$   when $2^m  \equiv 1 \pmod {p}$ is satisfied I will name such number $p$ improper FLT number  (if there is more official terminology let me know) and number $m$ initial number for the given $p$. Having made calculations I received following numbers $p$ for powers  of two congruent to $ 1 \pmod {p}$: Proper LFT numbers: $5(4),11(10),13(12),19(18),29(28),37(36),53(52),59(58) \dots$ Improper LFT numbers: $7 (3), 17 (8), 23(11), 31(5),41(20),43(14), 47(23)\dots$ Here in brackets smallest exponents $m$ (named as initial numbers) for satysfying formula $2^m \equiv 1 \pmod {p}$ are given.  For example $2^8\equiv 1 \pmod {17}$. Evidently initial numbers    for improper FLT numbers are divisors of $p-1$ what is intuitively expected but  why exactly such value not other ? (see $5$ for $31$, not for example $10$ or see $14$ for $43$ not $7$) it's hard to say. My question: is it any method to discern proper and improper FLT numbers? if we are able to recognize that a given prime number is FLT improper can we also say what is an initial number associated with it?",,"['number-theory', 'elementary-number-theory', 'prime-numbers', 'terminology']"
