,title_raw,title_text,title_latex,body_raw,body_text,body_latex,tags
40,$L^p$ norm convergence implies $L^p$ convergence,norm convergence implies  convergence,L^p L^p,"I've been struggling with the following, and can't seem to determine a good direction to follow: Let $f_n,f\in L^p$ where $f_n\rightarrow f$ almost everywhere and $\infty>p\geq1$. Then $\underset{n\rightarrow \infty}{\lim}\Vert f_n-f\Vert_p=0$ if and only if $\underset{n\rightarrow \infty}{\lim}\Vert f_n\Vert_p=\Vert f\Vert_p$. Assuming that there is $L^p$ convergence it is easy to show that $\Vert f_n\Vert\rightarrow \Vert f\Vert$. However I've been stuck on the other direction, attempting to construct a dominating function (but failing). It seems to me that there should be a simple answer I'm overlooking.","I've been struggling with the following, and can't seem to determine a good direction to follow: Let $f_n,f\in L^p$ where $f_n\rightarrow f$ almost everywhere and $\infty>p\geq1$. Then $\underset{n\rightarrow \infty}{\lim}\Vert f_n-f\Vert_p=0$ if and only if $\underset{n\rightarrow \infty}{\lim}\Vert f_n\Vert_p=\Vert f\Vert_p$. Assuming that there is $L^p$ convergence it is easy to show that $\Vert f_n\Vert\rightarrow \Vert f\Vert$. However I've been stuck on the other direction, attempting to construct a dominating function (but failing). It seems to me that there should be a simple answer I'm overlooking.",,"['real-analysis', 'measure-theory', 'lp-spaces']"
41,"Real Analysis, Folland Proposition 2.11","Real Analysis, Folland Proposition 2.11",,"This proposition was left for the reader to prove: The following implications are valid if and only if the measure $\mu$ is complete: a.) If $f$ is measurable and $f = g$ $\mu$-a.e., then $g$ is measurable. b.) If $f_n$ is measurable for $n\in \mathbb{N}$ and $f_n\rightarrow f$ $\mu$-a.e., then $f$ is measurable. I am not looking for an answer, just need some guidance or hint, I also fail to grasp the concept of the $\mu$ almost everywhere part. Any suggestions is greatly appreciated. attempted proof of b.) $\Rightarrow$ We are given $f_n$ to be measurable for $n\in\mathbb{N}$, and $f_n\rightarrow f$ a.e. From proposition 2.7 we can let $$\hat{f} = \lim_{n\rightarrow \infty}\sup f_n$$ since $f_n$ is stated to be measurable, then $\hat{f}$ is also measurable. Also, since $f_n\rightarrow f$ a.e, we then have $\hat{f} = f$ a.e, so by part (a) $f$ is measurable. $\Leftarrow$ suppose $\mu$ is not complete. Then there exists a measurable set $E$ such that $\mu(E) = 0$ and a set $F\subset E$ such that $F$ is not measurable. Then for (a), note that $1_F$ is not measurable and $1_F = 0$. Similarly, for (b) define $f_n = 0$ for all $n$ and $f = 1_F$","This proposition was left for the reader to prove: The following implications are valid if and only if the measure $\mu$ is complete: a.) If $f$ is measurable and $f = g$ $\mu$-a.e., then $g$ is measurable. b.) If $f_n$ is measurable for $n\in \mathbb{N}$ and $f_n\rightarrow f$ $\mu$-a.e., then $f$ is measurable. I am not looking for an answer, just need some guidance or hint, I also fail to grasp the concept of the $\mu$ almost everywhere part. Any suggestions is greatly appreciated. attempted proof of b.) $\Rightarrow$ We are given $f_n$ to be measurable for $n\in\mathbb{N}$, and $f_n\rightarrow f$ a.e. From proposition 2.7 we can let $$\hat{f} = \lim_{n\rightarrow \infty}\sup f_n$$ since $f_n$ is stated to be measurable, then $\hat{f}$ is also measurable. Also, since $f_n\rightarrow f$ a.e, we then have $\hat{f} = f$ a.e, so by part (a) $f$ is measurable. $\Leftarrow$ suppose $\mu$ is not complete. Then there exists a measurable set $E$ such that $\mu(E) = 0$ and a set $F\subset E$ such that $F$ is not measurable. Then for (a), note that $1_F$ is not measurable and $1_F = 0$. Similarly, for (b) define $f_n = 0$ for all $n$ and $f = 1_F$",,"['real-analysis', 'measure-theory']"
42,Why is the measure of the reals not zero?,Why is the measure of the reals not zero?,,"I have followed the argument that rationals, being countable and ordered, can be covered by a convergent sequence of decreasing intervals. I am trying to understand why the same argument can’t be applied to the reals, on the basis that axiom of choice leads to the well ordering theorem which says that the reals can be well ordered. In that case why can’t I cover the first real with an interval length ½ etc in the same way as the rationals ? I suspect that there aren’t enough natural numbers to complete the process since the reals are uncountable, but can the process not extend into the ordinal ω1. If it does then surely the series ½ + ¼ ... should still sum to 1 ? I’d appreciate any feedback or web reference you could offer to clarify this for me.","I have followed the argument that rationals, being countable and ordered, can be covered by a convergent sequence of decreasing intervals. I am trying to understand why the same argument can’t be applied to the reals, on the basis that axiom of choice leads to the well ordering theorem which says that the reals can be well ordered. In that case why can’t I cover the first real with an interval length ½ etc in the same way as the rationals ? I suspect that there aren’t enough natural numbers to complete the process since the reals are uncountable, but can the process not extend into the ordinal ω1. If it does then surely the series ½ + ¼ ... should still sum to 1 ? I’d appreciate any feedback or web reference you could offer to clarify this for me.",,"['real-analysis', 'measure-theory', 'axiom-of-choice']"
43,Meaning of $ \sup_{n}f_{n}(x)$,Meaning of, \sup_{n}f_{n}(x),"What does $ \sup_{n}f_{n}(x)$ mean? In what sense is one function ""bigger"" than the other? Context: If $\{f_{n}\}_1^{\infty}$ is a sequence of measurable functions, then  $ \sup_{n}f_{n}(x)$ is a measurable function.","What does $ \sup_{n}f_{n}(x)$ mean? In what sense is one function ""bigger"" than the other? Context: If $\{f_{n}\}_1^{\infty}$ is a sequence of measurable functions, then  $ \sup_{n}f_{n}(x)$ is a measurable function.",,"['measure-theory', 'notation']"
44,"Is Lebesgue measure the only measure that is locally finite, strictly positive and translation-invariant on $\mathbb{R}^n$?","Is Lebesgue measure the only measure that is locally finite, strictly positive and translation-invariant on ?",\mathbb{R}^n,"Lebesgue measure on Euclidean space $\mathbb{R}^n$ is locally finite, strictly positive and translation-invariant. Is Lebesgue measure the only such measure on $\mathbb{R}^n$? Thanks!","Lebesgue measure on Euclidean space $\mathbb{R}^n$ is locally finite, strictly positive and translation-invariant. Is Lebesgue measure the only such measure on $\mathbb{R}^n$? Thanks!",,"['real-analysis', 'measure-theory']"
45,Connection of ideas of Measuring to the Measure theory .,Connection of ideas of Measuring to the Measure theory .,,"Consider a point in a line, it has length zero . Consider a line in a plane , it has area zero . Consider a Plane in $\mathbb R^3$  it has $0$ volume . My question is , is there a measure theoretic way of extracting these ideas ? How can i link these ideas with Measure theory ?","Consider a point in a line, it has length zero . Consider a line in a plane , it has area zero . Consider a Plane in $\mathbb R^3$  it has $0$ volume . My question is , is there a measure theoretic way of extracting these ideas ? How can i link these ideas with Measure theory ?",,['measure-theory']
46,The measure$<\varepsilon$ condition in Egoroff's theorem: necessary or not?,The measure condition in Egoroff's theorem: necessary or not?,<\varepsilon,"Here is a statement of Egoroff's Theorem: Egoroff's Theorem. Suppose that $\mu(X) < \infty$, and $f, f_1, f_2, f_3, \ldots$ are all measurable complex-valued functions on $X$ such that $f_n \to f$ almost everywhere. Then for every $\varepsilon > 0$, there exists $E \subseteq X$ such that $\mu(E) < \varepsilon$ and $f_n \to f$ uniformly on $E^c$ (the complement of $E$ in $X$). Is it possible to replace the ""$\mu(E) < \varepsilon$"" condition by ""$\mu(E) = 0$"" in the statement and still have the theorem be true? I suspect that the answer is no, but I am having trouble thinking of an appropriate counterexample.","Here is a statement of Egoroff's Theorem: Egoroff's Theorem. Suppose that $\mu(X) < \infty$, and $f, f_1, f_2, f_3, \ldots$ are all measurable complex-valued functions on $X$ such that $f_n \to f$ almost everywhere. Then for every $\varepsilon > 0$, there exists $E \subseteq X$ such that $\mu(E) < \varepsilon$ and $f_n \to f$ uniformly on $E^c$ (the complement of $E$ in $X$). Is it possible to replace the ""$\mu(E) < \varepsilon$"" condition by ""$\mu(E) = 0$"" in the statement and still have the theorem be true? I suspect that the answer is no, but I am having trouble thinking of an appropriate counterexample.",,['measure-theory']
47,Product of a Lebesgue measurable function with an indicator function is measurable,Product of a Lebesgue measurable function with an indicator function is measurable,,"Let $f:X\rightarrow \overline{\mathbb{R}}$ be $\mathcal{A}$-measurable and let $B\in \mathcal{A}$. I would like to show that $\chi_{B}f $ is $\mathcal{A}$-measurable. I want to find the set $[\chi_{B}f > a ]$ for all $a \in \mathbb{R}$ , how to do that?","Let $f:X\rightarrow \overline{\mathbb{R}}$ be $\mathcal{A}$-measurable and let $B\in \mathcal{A}$. I would like to show that $\chi_{B}f $ is $\mathcal{A}$-measurable. I want to find the set $[\chi_{B}f > a ]$ for all $a \in \mathbb{R}$ , how to do that?",,['measure-theory']
48,measurable functions into a cartesian product,measurable functions into a cartesian product,,"If we have that $X$ and $Y$ are measure spaces and we have measurable functions $f, g: X \to Y$, can one conclude that $f \times g : X \to Y\times Y$ given by $(f\times g)(x) = (f(x), g(x))$ is measurable?","If we have that $X$ and $Y$ are measure spaces and we have measurable functions $f, g: X \to Y$, can one conclude that $f \times g : X \to Y\times Y$ given by $(f\times g)(x) = (f(x), g(x))$ is measurable?",,['measure-theory']
49,"Jordan Measures, Open sets, Closed sets and Semi-closed sets","Jordan Measures, Open sets, Closed sets and Semi-closed sets",,"I cannot understand: $$\bar{\mu} ( \{Q \cap (0,1) \} ) = 1$$ and (cannot understand this one particularly) $$\underline{\mu} ( \{Q \cap (0,1) \} ) = 0$$ where $Q$ is rational numbers, why? I know that the measure for closed set $\mu ([0,1]) = 1$ so I am puzzled with the open set solution. Is $\underline{\mu} ( (0,1) ) = 0$ also? How is the measure with open sets in general? So far the main question, history contains some helper questions but I think this is the lion part of it what I cannot understand. More about Jordan measure here . Related Jordan measure with semi-closed sets here Jordan measure and uncountable sets here","I cannot understand: $$\bar{\mu} ( \{Q \cap (0,1) \} ) = 1$$ and (cannot understand this one particularly) $$\underline{\mu} ( \{Q \cap (0,1) \} ) = 0$$ where $Q$ is rational numbers, why? I know that the measure for closed set $\mu ([0,1]) = 1$ so I am puzzled with the open set solution. Is $\underline{\mu} ( (0,1) ) = 0$ also? How is the measure with open sets in general? So far the main question, history contains some helper questions but I think this is the lion part of it what I cannot understand. More about Jordan measure here . Related Jordan measure with semi-closed sets here Jordan measure and uncountable sets here",,['measure-theory']
50,Why pick this definition of measurability over this almost identical one?,Why pick this definition of measurability over this almost identical one?,,"In our measure theory classes, we are going through the construction of measures from outer measures (any $\sigma$ -additive monotonic function on a power set). In that, the following definition of measurability is thrown at us out of the blue: Given an outer measure $\pi^*$ on a set $X$ , a subset $A\subseteq X$ is called measurable iff for every $E\subseteq X$ , we have $$ \pi^*(E) = \pi^*(E\cap A) + \pi^*(E\setminus A)\text. $$ Now, I could have demanded that for each $E$ , $A$ gets partitioned such that $\pi^*(A) = \pi^*(A\cap E) + \pi^*(A\setminus E)$ . But the above definition instead focuses on the partition of $E$ induced by $A$ . Question: Is there an ""easy"" way to ""see"" why measurability is not defined in this alternate way? Of course, I am not looking for an answer like, ""It makes the proofs work."".","In our measure theory classes, we are going through the construction of measures from outer measures (any -additive monotonic function on a power set). In that, the following definition of measurability is thrown at us out of the blue: Given an outer measure on a set , a subset is called measurable iff for every , we have Now, I could have demanded that for each , gets partitioned such that . But the above definition instead focuses on the partition of induced by . Question: Is there an ""easy"" way to ""see"" why measurability is not defined in this alternate way? Of course, I am not looking for an answer like, ""It makes the proofs work."".","\sigma \pi^* X A\subseteq X E\subseteq X 
\pi^*(E) = \pi^*(E\cap A) + \pi^*(E\setminus A)\text.
 E A \pi^*(A) = \pi^*(A\cap E) + \pi^*(A\setminus E) E A",['measure-theory']
51,Is the Converse of the Radon-Nikodym Theorem true?,Is the Converse of the Radon-Nikodym Theorem true?,,"I'm curious as to whether the converse of the Radon-Nikodym theorem holds: Converse Theorem: let $\mu.\nu$ be measures on $(\Omega,\Sigma)$ such that $$\nu : A\mapsto \int_A f \ d\mu$$ for some measurable function $f$ . Then $\nu\ll\mu$ , and $\mu$ and $\nu$ are $\sigma$ -finite. Proof: the first part is easy, as $$\mu(A) = 0\implies \int_A f \ d\mu = 0.$$ Does the second part, regarding $\sigma$ -finiteness, hold?","I'm curious as to whether the converse of the Radon-Nikodym theorem holds: Converse Theorem: let be measures on such that for some measurable function . Then , and and are -finite. Proof: the first part is easy, as Does the second part, regarding -finiteness, hold?","\mu.\nu (\Omega,\Sigma) \nu : A\mapsto \int_A f \ d\mu f \nu\ll\mu \mu \nu \sigma \mu(A) = 0\implies \int_A f \ d\mu = 0. \sigma","['measure-theory', 'radon-nikodym']"
52,"Lebesgue measurable function and set, $\forall t\in (0,1), $there exists $ E_t \subset E$ such that $\int_{E_t} f(x) dx = t \int_{E} f(x) dx$.","Lebesgue measurable function and set, there exists  such that .","\forall t\in (0,1),   E_t \subset E \int_{E_t} f(x) dx = t \int_{E} f(x) dx","The question is: Let f be Lebesgue measurable on $R$ and $E\subset R$ be measurable so that $0<A=\int _E f(x)dx < \infty$ . Show that for every $t\in (0,1)$ there exists a measurable set $E_t \subset E$ so that $\int_{E_t} f(x) dx = t A$ . My thoughts to solve this question and my question is in step 3: Since $f$ is Lebesgue measurable on $R$ , so $f$ can be approximated by simple functions. So if I can show the result is true for $f(x) = \chi _{B}(x)$ where $\chi _{B}(x)$ is a simple function. Then the result is true for Lebesgue measurable $f$ . Now $\int _{E} \chi _{B}(x) dx = m(E\cap B)= A$ ( $m$ is Lebesgue measure). Now I have to show that there exists a measurable set $E_t \subset E$ such that $m(E_t\cap B)=t \cdot m(E\cap B)= tA$ . To show that $m(E_t\cap B)=t \cdot m(E\cap B)= tA$ , here is the trouble for me if the above steps are correct. After searching posts here, I think I can define a $g(x) = m(E\cap B\cap (-\infty, x))$ . I need to show $g(x)$ is continuous and then that could lead to the conclusion that there will be $t_0$ such that $0<g(t_0) = t \cdot m(E\cap B)<m(E\cap B)$ . I would like to hear about your comments about the above steps and see if there is any error. Thanks!","The question is: Let f be Lebesgue measurable on and be measurable so that . Show that for every there exists a measurable set so that . My thoughts to solve this question and my question is in step 3: Since is Lebesgue measurable on , so can be approximated by simple functions. So if I can show the result is true for where is a simple function. Then the result is true for Lebesgue measurable . Now ( is Lebesgue measure). Now I have to show that there exists a measurable set such that . To show that , here is the trouble for me if the above steps are correct. After searching posts here, I think I can define a . I need to show is continuous and then that could lead to the conclusion that there will be such that . I would like to hear about your comments about the above steps and see if there is any error. Thanks!","R E\subset R 0<A=\int _E f(x)dx < \infty t\in (0,1) E_t \subset E \int_{E_t} f(x) dx = t A f R f f(x) = \chi _{B}(x) \chi _{B}(x) f \int _{E} \chi _{B}(x) dx = m(E\cap B)= A m E_t \subset E m(E_t\cap B)=t \cdot m(E\cap B)= tA m(E_t\cap B)=t \cdot m(E\cap B)= tA g(x) = m(E\cap B\cap (-\infty, x)) g(x) t_0 0<g(t_0) = t \cdot m(E\cap B)<m(E\cap B)","['real-analysis', 'measure-theory', 'lebesgue-measure', 'measurable-functions', 'measurable-sets']"
53,The cardinality of a finite sigma algebra is a power of 2?,The cardinality of a finite sigma algebra is a power of 2?,,"Let $X$ be a finite set. Let $\Sigma \subseteq P(X)$ be a finite sigma algebra on $X$ . I have been able to prove that the cardinality of $\Sigma$ is always an even number: the collection $$ \left\{\left\{Y{,}\ X\setminus Y\right\}:Y\in \Sigma\right\}$$ is a partition of $\Sigma$ . Thus, $$\left|\Sigma\right|=\left|\left\{\left\{Y{,}\ X\setminus Y\right\}:Y\in \Sigma\right\}\right|\cdot\left|\left\{Y{,}\ X\setminus Y\right\}\right|=2\left|\left\{\left\{Y{,}\ X\setminus Y\right\}:Y\in \Sigma\right\}\right|{,}$$ and the cardinality of $\Sigma$ is necessarily an even number. However, there is more: the cardinality of $\Sigma$ is a power of $2$ . This I am unable to prove. What would be an elementary way of showing that fact? I guess that one should construct some collection so that $\Sigma$ is its power set, thus having a cardinality of some power of $2$ .","Let be a finite set. Let be a finite sigma algebra on . I have been able to prove that the cardinality of is always an even number: the collection is a partition of . Thus, and the cardinality of is necessarily an even number. However, there is more: the cardinality of is a power of . This I am unable to prove. What would be an elementary way of showing that fact? I guess that one should construct some collection so that is its power set, thus having a cardinality of some power of .","X \Sigma \subseteq P(X) X \Sigma  \left\{\left\{Y{,}\ X\setminus Y\right\}:Y\in \Sigma\right\} \Sigma \left|\Sigma\right|=\left|\left\{\left\{Y{,}\ X\setminus Y\right\}:Y\in \Sigma\right\}\right|\cdot\left|\left\{Y{,}\ X\setminus Y\right\}\right|=2\left|\left\{\left\{Y{,}\ X\setminus Y\right\}:Y\in \Sigma\right\}\right|{,} \Sigma \Sigma 2 \Sigma 2","['combinatorics', 'measure-theory', 'elementary-set-theory']"
54,"Lebesgue measure of $\{(x,y)\in\mathbb R^2:xy=1\}$",Lebesgue measure of,"\{(x,y)\in\mathbb R^2:xy=1\}","Let $A=\{(x,y)\in\mathbb R^2:xy=1\}$ and $\lambda$ be the Lebesgue measure on $\mathbb R^2$ . Compute $\lambda(A)$ . I think $\lambda(A)=0$ because $A$ is the graph of the function $f(x)=\frac{1}{x}$ and the measure of the graph of a continuous function is  0. Is this true?",Let and be the Lebesgue measure on . Compute . I think because is the graph of the function and the measure of the graph of a continuous function is  0. Is this true?,"A=\{(x,y)\in\mathbb R^2:xy=1\} \lambda \mathbb R^2 \lambda(A) \lambda(A)=0 A f(x)=\frac{1}{x}","['measure-theory', 'lebesgue-measure']"
55,Proof of Theorem $7.13$ in Rudin's RCA,Proof of Theorem  in Rudin's RCA,7.13,"Theorem $7.13$ , Walter Rudin's Real and Complex Analysis . Why does it suffice to prove for the case $\mu\ge 0$ ? $\mu = \mu^+ - \mu^-$ is the Jordan decomposition of $\mu$ , where $\mu^+,\mu^-$ are positive measures. How does the general case follow from $\mu\ge 0$ and the Jordan decomposition? Why is $\overline D\mu$ a Borel function? I see that $\sup_{0<r<1/n} Q_r\mu(x)$ decreases as $n$ increases, and is a lower-semicontinuous function for each $n$ (following the reasoning in Section $7.2$ .). However, I don't see how this implies that $\overline D\mu$ is a Borel function. I also know that any lower-semicontinuous function is Borel, so it'd suffice to prove lower-semicontinuity, if we can. Why is it true that for every $x\in K^c$ , $$(\overline D\mu)(x) = (\overline D\mu_2)(x)$$ Proof attached for reference: Thank you!","Theorem , Walter Rudin's Real and Complex Analysis . Why does it suffice to prove for the case ? is the Jordan decomposition of , where are positive measures. How does the general case follow from and the Jordan decomposition? Why is a Borel function? I see that decreases as increases, and is a lower-semicontinuous function for each (following the reasoning in Section .). However, I don't see how this implies that is a Borel function. I also know that any lower-semicontinuous function is Borel, so it'd suffice to prove lower-semicontinuity, if we can. Why is it true that for every , Proof attached for reference: Thank you!","7.13 \mu\ge 0 \mu = \mu^+ - \mu^- \mu \mu^+,\mu^- \mu\ge 0 \overline D\mu \sup_{0<r<1/n} Q_r\mu(x) n n 7.2 \overline D\mu x\in K^c (\overline D\mu)(x) = (\overline D\mu_2)(x)","['real-analysis', 'measure-theory', 'proof-explanation']"
56,Fourier series of a measurable function,Fourier series of a measurable function,,"Let $f: [0,2\pi] \to \mathbb{R}$ be a bounded Lebesgue measurable function that satisfies $\int_{0}^{2\pi}f(x)\sin( kx) = 0$ and $\int_{0}^{2\pi}f(x)\cos( kx) = 0$ for every $k\in \mathbb{N}$ . It is my guess that this implies $f$ is constant almost everywhere. However, I have much trouble proving it or finding an counter-example.  The only relevant result which I can think of is that the Fourier series of a continuous function $f$ on closed interval converges pointwise almost everywhere to $f$ . So if we make the stronger assumption of $f$ being continuous (instead of just measurable), the statement should be true. I would appreciate any thoughts whether the original guess is indeed true, and if so, how to go about proving it.","Let be a bounded Lebesgue measurable function that satisfies and for every . It is my guess that this implies is constant almost everywhere. However, I have much trouble proving it or finding an counter-example.  The only relevant result which I can think of is that the Fourier series of a continuous function on closed interval converges pointwise almost everywhere to . So if we make the stronger assumption of being continuous (instead of just measurable), the statement should be true. I would appreciate any thoughts whether the original guess is indeed true, and if so, how to go about proving it.","f: [0,2\pi] \to \mathbb{R} \int_{0}^{2\pi}f(x)\sin( kx) = 0 \int_{0}^{2\pi}f(x)\cos( kx) = 0 k\in \mathbb{N} f f f f","['real-analysis', 'measure-theory', 'fourier-analysis']"
57,Is this discrete analogue of Fatou's lemma valid,Is this discrete analogue of Fatou's lemma valid,,"I was curious if this discrete analog of Fatou's lemma is valid: \begin{align} \sum_{j=1}^\infty \liminf_{k \rightarrow\infty} a_j(k) \leq \liminf_{k \rightarrow\infty} \sum_{j=1}^\infty a_j(k) , \end{align} where $a_j(k)$ is a doubly indexed sequence of real numbers. Does it hold in the general real case? What if $a_j(k) \geq 0 $ , does it hold then? Thanks to all helpers.","I was curious if this discrete analog of Fatou's lemma is valid: where is a doubly indexed sequence of real numbers. Does it hold in the general real case? What if , does it hold then? Thanks to all helpers.","\begin{align}
\sum_{j=1}^\infty \liminf_{k \rightarrow\infty} a_j(k) \leq \liminf_{k \rightarrow\infty} \sum_{j=1}^\infty a_j(k) ,
\end{align} a_j(k) a_j(k) \geq 0 ","['sequences-and-series', 'measure-theory', 'lebesgue-integral']"
58,If $f \in L^1$ $\mu(A_n)\to 0$ then $\int_{A_n}f\to 0$,If   then,f \in L^1 \mu(A_n)\to 0 \int_{A_n}f\to 0,"In this quesiton , what happens if $p=1$ ? Does the statement remain true? That is, if $(X,\Sigma,\mu)$ is a measure space, $f\in L^1$ and if $\{A_n\}$ be a sequence in $\Sigma$ such that $\mu(A_n)\to 0$ , is it true that $\int_{A_n}fd\mu\to 0$ ? Following the answer of that question, we'd get $$\left|\int_{A_n} f\, d\mu\right| \le \int_X \chi_{A_n}|f|\, d\mu \le \|\chi_{A_n}\|_{\infty} \|f\|_1.$$ Which is true, but what's next? Do we have that $\|\chi_{A_n}\|_{\infty} \to 0$ when $\mu(A_n)\to 0$ ? How to prove that?","In this quesiton , what happens if ? Does the statement remain true? That is, if is a measure space, and if be a sequence in such that , is it true that ? Following the answer of that question, we'd get Which is true, but what's next? Do we have that when ? How to prove that?","p=1 (X,\Sigma,\mu) f\in L^1 \{A_n\} \Sigma \mu(A_n)\to 0 \int_{A_n}fd\mu\to 0 \left|\int_{A_n} f\, d\mu\right| \le \int_X \chi_{A_n}|f|\, d\mu \le \|\chi_{A_n}\|_{\infty} \|f\|_1. \|\chi_{A_n}\|_{\infty} \to 0 \mu(A_n)\to 0","['integration', 'measure-theory']"
59,A problem on measurability of a function,A problem on measurability of a function,,"let $f$ be a real valued finction.   If for each $k \gt 0, \ f^{-1}((-k,k))$ is a measurable set, then $f$ is a measurable function. Is this statement true? I think it is true but i cannot find a proof.","let be a real valued finction.   If for each is a measurable set, then is a measurable function. Is this statement true? I think it is true but i cannot find a proof.","f k \gt 0, \ f^{-1}((-k,k)) f","['real-analysis', 'measure-theory']"
