,title_raw,title_text,title_latex,body_raw,body_text,body_latex,tags
0,Find range of $\sin x+\cos^{2}x$,Find range of,\sin x+\cos^{2}x,By differentiating and equating to $0$ I know that the maximum must be $5/4$.   The minimum is where I am confused. $-1$ would be logical but I'm not sure if this function can ever be equal to $0$. Answer is apparently $1$ to $5/4$ but I think that is wrong.,By differentiating and equating to $0$ I know that the maximum must be $5/4$.   The minimum is where I am confused. $-1$ would be logical but I'm not sure if this function can ever be equal to $0$. Answer is apparently $1$ to $5/4$ but I think that is wrong.,,"['functions', 'trigonometry']"
1,How do I show algebraically that the period of the tangent function is $\pi$?,How do I show algebraically that the period of the tangent function is ?,\pi,"How do I show that the positive real number $p$ for which $\tan (x+p)=\tan (x)$ is equal to $\pi$? In essence how do I prove the period of the tangent function is $\pi$?  Please bear in mind I am a pre-calculus student, thanks.","How do I show that the positive real number $p$ for which $\tan (x+p)=\tan (x)$ is equal to $\pi$? In essence how do I prove the period of the tangent function is $\pi$?  Please bear in mind I am a pre-calculus student, thanks.",,"['algebra-precalculus', 'functions', 'trigonometry']"
2,Finding the maximum and minimum values of $f(x)=a^x+a^{1/x}$,Finding the maximum and minimum values of,f(x)=a^x+a^{1/x},"Let $f(x)=a^x+a^{1/x}\ (x\gt 0)$ where $a\in\mathbb R$ is a constant. Question 1 : What is the maximum value of $f(x)$ for $0\lt a\lt 1$ ? Question 2 : What is the minimum value of $f(x)$ for $a\gt 1$ ? The followings may be true: Conjecture 1 : For $a=1/2$ , the maximum value of $f(x)$ is $f(1)=1$ . Conjecture 2 : For $0\lt a\lt 1, a\not =1/2$ , $f(x)$ does not have the maximum value. Conjecture 3 : For $a\gt 1$ , the minimum value of $f(x)$ is $f(1)=2a$ . I'm afraid that these may be very easy questions, but to be honest I don't have any good idea to solve them. Can anyone help? Edit 1 : Question 2 has already been solved by Barry Cipra. (Conjecture 3 is true) However, Question 1 has not been solved yet. Edit 2 : I've just been able to prove that the conjecture 1 is true. Also, I found that the conjecture 2 is not true, but I'm not able to answer the question 1 in general.","Let where is a constant. Question 1 : What is the maximum value of for ? Question 2 : What is the minimum value of for ? The followings may be true: Conjecture 1 : For , the maximum value of is . Conjecture 2 : For , does not have the maximum value. Conjecture 3 : For , the minimum value of is . I'm afraid that these may be very easy questions, but to be honest I don't have any good idea to solve them. Can anyone help? Edit 1 : Question 2 has already been solved by Barry Cipra. (Conjecture 3 is true) However, Question 1 has not been solved yet. Edit 2 : I've just been able to prove that the conjecture 1 is true. Also, I found that the conjecture 2 is not true, but I'm not able to answer the question 1 in general.","f(x)=a^x+a^{1/x}\ (x\gt 0) a\in\mathbb R f(x) 0\lt a\lt 1 f(x) a\gt 1 a=1/2 f(x) f(1)=1 0\lt a\lt 1, a\not =1/2 f(x) a\gt 1 f(x) f(1)=2a","['real-analysis', 'functions']"
3,What is the probability that the selected function maps prime numbers to prime numbers?,What is the probability that the selected function maps prime numbers to prime numbers?,,"Let $X = \{1, 2, 3, . . . , 25\}$ . If a student selects a function randomly from the set of all functions from $X$ onto $X$ , then what is the probability that the selected function maps prime numbers to prime numbers ? No idea how to proceed, please guide.","Let . If a student selects a function randomly from the set of all functions from onto , then what is the probability that the selected function maps prime numbers to prime numbers ? No idea how to proceed, please guide.","X = \{1, 2, 3, . . . , 25\} X X","['probability', 'combinatorics', 'functions']"
4,Prove that the function is surjective but not injective,Prove that the function is surjective but not injective,,"I am struggling with this excercise: I want to prove that the function $f: \mathbb{R} \to \mathbb{R}$, defined by $f(x)= x^3 + x^2 - 6x$, is surjective but not injective? I personally would calculate some numbers and show that by these examples that this function cannot be injective. Is this way a correct way to prove this? I appreciate your answer!","I am struggling with this excercise: I want to prove that the function $f: \mathbb{R} \to \mathbb{R}$, defined by $f(x)= x^3 + x^2 - 6x$, is surjective but not injective? I personally would calculate some numbers and show that by these examples that this function cannot be injective. Is this way a correct way to prove this? I appreciate your answer!",,['functions']
5,Equality proof of function $g_N(x) = \sum_{n=-N}^N \frac{1}{x+n}$,Equality proof of function,g_N(x) = \sum_{n=-N}^N \frac{1}{x+n},"I have a function $$ g_N(x) = \sum_{n=-N}^N \frac{1}{x+n} $$ How can I prove that this function is odd, thus $ g_N(-x) = -g_N(x)$ ?","I have a function $$ g_N(x) = \sum_{n=-N}^N \frac{1}{x+n} $$ How can I prove that this function is odd, thus $ g_N(-x) = -g_N(x)$ ?",,"['functions', 'summation']"
6,Algebraically Solve Limit,Algebraically Solve Limit,,$$\lim_{x \to 0} \dfrac{2\sqrt{x+1}-x-2}{x^2}$$ I can solve it using l'Hôpital but just cannot find a way to do it algebraically.,$$\lim_{x \to 0} \dfrac{2\sqrt{x+1}-x-2}{x^2}$$ I can solve it using l'Hôpital but just cannot find a way to do it algebraically.,,"['calculus', 'limits', 'functions']"
7,The count of functions from $X$ to $Y$?,The count of functions from  to ?,X Y,"Let $X$ be a set with $N$ elements, and $Y$ a set with $M$ elements. What is the count of possible functions from $X$ to $Y$? If answer is $M^N$, then why can't it be $N \times M$? That is, why not count for each  $x \in X$, the possible mappings from $x$ to each $y\in Y$?","Let $X$ be a set with $N$ elements, and $Y$ a set with $M$ elements. What is the count of possible functions from $X$ to $Y$? If answer is $M^N$, then why can't it be $N \times M$? That is, why not count for each  $x \in X$, the possible mappings from $x$ to each $y\in Y$?",,"['combinatorics', 'functions']"
8,$\arctan(\frac{x+1}{x-1})$ to power series,to power series,\arctan(\frac{x+1}{x-1}),"EDIT: I just realize that I should start with the derivative of $\arctan(\frac{x+1}{x-1})$ , and keep going from there. So $(\arctan(\frac{x+1}{x-1}))'=\frac{1}{1+x^2}$ , does that mean  this is the same series as $\arctan(x)$ ? -- I want to find an expression for $\arctan(\frac{x+1}{x-1})$ as a power series, with $x_0=0$ , for every $x \ne 1$ . My initial thought was to use the known $\arctan(x)=\sum_{n=0}^\infty \frac{(-1)^n x^{2n+1}}{2n+1}$ , but I don't know how to keep going if I replace $x$ with $\frac{x+1}{x-1}$ . Thanks a lot!","EDIT: I just realize that I should start with the derivative of , and keep going from there. So , does that mean  this is the same series as ? -- I want to find an expression for as a power series, with , for every . My initial thought was to use the known , but I don't know how to keep going if I replace with . Thanks a lot!",\arctan(\frac{x+1}{x-1}) (\arctan(\frac{x+1}{x-1}))'=\frac{1}{1+x^2} \arctan(x) \arctan(\frac{x+1}{x-1}) x_0=0 x \ne 1 \arctan(x)=\sum_{n=0}^\infty \frac{(-1)^n x^{2n+1}}{2n+1} x \frac{x+1}{x-1},"['calculus', 'sequences-and-series', 'functions', 'trigonometry', 'trigonometric-series']"
9,Is $ \arctan(f(x))\leq f(x)$ whenever $|f(x)|<1\ \ \forall x\in\mathbb{R} $?,Is  whenever ?, \arctan(f(x))\leq f(x) |f(x)|<1\ \ \forall x\in\mathbb{R} ,"Is the following always true? $$ \arctan(f(x))\leq f(x),\ \ \text{where}\ \ |f(x)|<1\ \ \forall x\in\mathbb{R} $$ For example, is it correct to say that $$ \arctan\left(\frac{\sin x}{\sqrt{x+1}}\right)\le\frac{\sin x}{\sqrt{x+1}}\ \ \forall x\in\mathbb{R}, $$ since $\arctan t=t-\frac{t^3}{3}+\frac{t^5}{5}-\dots$ , where each term is not greater than the one before? I'm confused because in the example above $\arctan$ 's argument can be negative (i.e., $\sin x$ can be negative).","Is the following always true? For example, is it correct to say that since , where each term is not greater than the one before? I'm confused because in the example above 's argument can be negative (i.e., can be negative).","
\arctan(f(x))\leq f(x),\ \ \text{where}\ \ |f(x)|<1\ \ \forall x\in\mathbb{R}
 
\arctan\left(\frac{\sin x}{\sqrt{x+1}}\right)\le\frac{\sin x}{\sqrt{x+1}}\ \ \forall x\in\mathbb{R},
 \arctan t=t-\frac{t^3}{3}+\frac{t^5}{5}-\dots \arctan \sin x","['calculus', 'functions', 'taylor-expansion']"
10,Is it possible to define a bijection from nonnegative to positive numbers? [duplicate],Is it possible to define a bijection from nonnegative to positive numbers? [duplicate],,"This question already has answers here : How to define a bijection between $(0,1)$ and $(0,1]$? (9 answers) Bijection from (0,1) to [0,1) (2 answers) Closed 3 years ago . Let $\mathbb{R}_{\geq 0}$ be the set of nonnegative numbers and $\mathbb{R}_{>0}$ the set of positive numbers, that is $$ \mathbb{R}_{\geq 0} = \{\,x \geq 0 \mid x \in \mathbb{R} \,\} $$ and $$ \mathbb{R}_{> 0} = \{\,x > 0 \mid x \in \mathbb{R} \,\} $$ Is it possible to define a bijection $f$ between these two sets?","This question already has answers here : How to define a bijection between $(0,1)$ and $(0,1]$? (9 answers) Bijection from (0,1) to [0,1) (2 answers) Closed 3 years ago . Let be the set of nonnegative numbers and the set of positive numbers, that is and Is it possible to define a bijection between these two sets?","\mathbb{R}_{\geq 0} \mathbb{R}_{>0} 
\mathbb{R}_{\geq 0} = \{\,x \geq 0 \mid x \in \mathbb{R} \,\}
 
\mathbb{R}_{> 0} = \{\,x > 0 \mid x \in \mathbb{R} \,\}
 f",[]
11,How do I finish solving $f(x)f(2y)=f(x+4y)$?,How do I finish solving ?,f(x)f(2y)=f(x+4y),"I'm trying to solve this functional equation: $$f(x)f(2y)=f(x+4y)$$ The first thing I tried was to set $x=y=0$ ; then I get: $$f(0)f(0)=f(0)$$ which means that either $f(0)=0$ or we can divide the equation by $f(0)$ and then $f(0)=1$ . Case 1: If $f(0)=0$ then we can try to set $x=0$ . Then; $$f(0)f(2y)=f(4y)$$ $$0=f(4y)$$ Which means that one of the solutions is a constant function $f(x)=0$ Case 2: If $f(0)=1$ . This is where I'm stuck. I tried to set $x=0$ , then I get: $$f(2y)=f(4y)$$ I also tried to set $x=-4y$ . Then I get: $$f(-4y)f(2y)=f(0)=1$$ I think that these two observations could be useful, but I don't know how to continue from here. I have guessed that another solution is $f(x)=1$ but I don't know how to show that there aren't any others as well.","I'm trying to solve this functional equation: The first thing I tried was to set ; then I get: which means that either or we can divide the equation by and then . Case 1: If then we can try to set . Then; Which means that one of the solutions is a constant function Case 2: If . This is where I'm stuck. I tried to set , then I get: I also tried to set . Then I get: I think that these two observations could be useful, but I don't know how to continue from here. I have guessed that another solution is but I don't know how to show that there aren't any others as well.",f(x)f(2y)=f(x+4y) x=y=0 f(0)f(0)=f(0) f(0)=0 f(0) f(0)=1 f(0)=0 x=0 f(0)f(2y)=f(4y) 0=f(4y) f(x)=0 f(0)=1 x=0 f(2y)=f(4y) x=-4y f(-4y)f(2y)=f(0)=1 f(x)=1,"['functions', 'functional-equations']"
12,Determining all $f : \mathbb R \to \mathbb R$ that satisfy $xf(x) - yf(y) = (x-y)f(x+y)$,Determining all  that satisfy,f : \mathbb R \to \mathbb R xf(x) - yf(y) = (x-y)f(x+y),"Determine all $f : \mathbb R \to \mathbb R$ that satisfy $$xf(x) - yf(y) = (x-y)f(x+y) ; \ \forall x , y \in \mathbb R$$ I tried reform the equation to $$f(x) + f(-x) = 2f(0)$$ and $$f(x) + f(3x) = 2f(2x).$$ Also, $f$ is injective if $f$ isn't constant. Can anyone give me some hints please. Thank you very much!","Determine all that satisfy I tried reform the equation to and Also, is injective if isn't constant. Can anyone give me some hints please. Thank you very much!","f : \mathbb R \to \mathbb R xf(x) - yf(y) = (x-y)f(x+y) ; \ \forall x , y \in \mathbb R f(x) + f(-x) = 2f(0) f(x) + f(3x) = 2f(2x). f f","['functions', 'contest-math', 'functional-equations']"
13,Is the graph $y=\frac{x^2}{x}$ continuous?,Is the graph  continuous?,y=\frac{x^2}{x},"I randomly came across the thought today that since dividing by zero is undefined, will the graph $y=\frac{x^2}{x}$ be discontinuous? Or would it be considered reducible and therefore continuous and identical to the graph $y=x$ . Thanks everyone.","I randomly came across the thought today that since dividing by zero is undefined, will the graph be discontinuous? Or would it be considered reducible and therefore continuous and identical to the graph . Thanks everyone.",y=\frac{x^2}{x} y=x,"['calculus', 'functions', 'continuity', 'rational-functions']"
14,Show that $f(x) = x^7 + x^5 + x^3 + x$ is bijective,Show that  is bijective,f(x) = x^7 + x^5 + x^3 + x,"I want to show that the real polynomial function $f: \mathbb R \to \mathbb R, f(x) = x^7 + x^5 + x^3 + x$ is bijective. I want to show this without using the inverse or the derivative. I'm struggling to prove injectivity, because I see no easy way to arrive at $x = y$. What I have so far: Surjective: Because the degree is odd, we have $\lim_{x \to +\infty}(f(x)) = +\infty$ and $\lim_{x \to -\infty}(f(x)) = -\infty$. Because a polynom is continuous, we can apply the IVT to the interval $I = (-\infty,+\infty) = \mathbb R$ so that for every $y \in I$ there is a $x$ such that $f(x) = y$. Injective: Let $f(x) = f(y)$. Then $x^7 + x^5 + x^3 + x = y^7 + y^5 + y^3 + y$. Then ??? , so $x = y$.","I want to show that the real polynomial function $f: \mathbb R \to \mathbb R, f(x) = x^7 + x^5 + x^3 + x$ is bijective. I want to show this without using the inverse or the derivative. I'm struggling to prove injectivity, because I see no easy way to arrive at $x = y$. What I have so far: Surjective: Because the degree is odd, we have $\lim_{x \to +\infty}(f(x)) = +\infty$ and $\lim_{x \to -\infty}(f(x)) = -\infty$. Because a polynom is continuous, we can apply the IVT to the interval $I = (-\infty,+\infty) = \mathbb R$ so that for every $y \in I$ there is a $x$ such that $f(x) = y$. Injective: Let $f(x) = f(y)$. Then $x^7 + x^5 + x^3 + x = y^7 + y^5 + y^3 + y$. Then ??? , so $x = y$.",,"['real-analysis', 'functions', 'polynomials']"
15,Why is function domain of fractions inside radicals not defined for lower values than those found by searching for domain of denominator in fraction?,Why is function domain of fractions inside radicals not defined for lower values than those found by searching for domain of denominator in fraction?,,"Consider function $y = \sqrt{\frac{1-2x}{2x+3}}$. To find the domain of this function we first find the domain of denominator in fraction: $2x+3 \neq 0$ $2x \neq -3$ $x \neq - \frac{3}{2}$ So, the domain of $x$ (for fraction to be valid) is $x \in \left(- \infty, - \frac{3}{2}\right) \cup \left(- \frac{3}{2}, + \infty\right)$. Then we find the domain for whole fraction: $\frac{1-2x}{2x+3} \ge 0$ $1-2x \ge 0$ $-2x \ge -1$ $x \le \frac{1}{2}$ My textbook says that the (real) domain of the whole $y$ function is $x \in \left(- \frac{3}{2}, \frac{1}{2}\right]$. I understand why the function is not defined in values larger than $\frac{1}{2}$ (because condition is $x \le \frac{1}{2}$), but I don't understand why it can't be have values less than $- \frac{3}{2}$ (because condition says only $x \neq - \frac{3}{2}$). I checked the domain of this function and the domain given in the textbook is correct. Function has imaginary values for $x$ values less than $- \frac{3}{2}$ or bigger than $\frac{1}{2}$. It is undefined in $- \frac{3}{2}$. Real values only in $\left(- \frac{3}{2}, \frac{1}{2}\right]$ domain.","Consider function $y = \sqrt{\frac{1-2x}{2x+3}}$. To find the domain of this function we first find the domain of denominator in fraction: $2x+3 \neq 0$ $2x \neq -3$ $x \neq - \frac{3}{2}$ So, the domain of $x$ (for fraction to be valid) is $x \in \left(- \infty, - \frac{3}{2}\right) \cup \left(- \frac{3}{2}, + \infty\right)$. Then we find the domain for whole fraction: $\frac{1-2x}{2x+3} \ge 0$ $1-2x \ge 0$ $-2x \ge -1$ $x \le \frac{1}{2}$ My textbook says that the (real) domain of the whole $y$ function is $x \in \left(- \frac{3}{2}, \frac{1}{2}\right]$. I understand why the function is not defined in values larger than $\frac{1}{2}$ (because condition is $x \le \frac{1}{2}$), but I don't understand why it can't be have values less than $- \frac{3}{2}$ (because condition says only $x \neq - \frac{3}{2}$). I checked the domain of this function and the domain given in the textbook is correct. Function has imaginary values for $x$ values less than $- \frac{3}{2}$ or bigger than $\frac{1}{2}$. It is undefined in $- \frac{3}{2}$. Real values only in $\left(- \frac{3}{2}, \frac{1}{2}\right]$ domain.",,"['algebra-precalculus', 'functions']"
16,IVP implies EVP?,IVP implies EVP?,,"I define Intermediate Value Property (IVP) and Extreme Value Property (EVP) as follows: IVP: If $I$ is an interval, and $f:I\rightarrow\mathbb{R}$, we say that  $f$ has the intermediate value property iff whenever $a<b$ are point's in $I$ and $f(a)\leq c\leq f(b)$, there is a $d\in$  $(a,b)$ such that $f(d)=c$. EVP: If $I$ is an interval, and $f:I\rightarrow\mathbb{R}$, we say that $f$ has the extreme value property iff $f$ has maximum and minimum value, each at least once. That is, $\exists a,b\in I$ such that $f(a)\leq f(x) \leq f(b)$ for all $x\in I$. My question is, does IVP imply EVP? I don't think so, but I still can't find the counter example. Cheers!","I define Intermediate Value Property (IVP) and Extreme Value Property (EVP) as follows: IVP: If $I$ is an interval, and $f:I\rightarrow\mathbb{R}$, we say that  $f$ has the intermediate value property iff whenever $a<b$ are point's in $I$ and $f(a)\leq c\leq f(b)$, there is a $d\in$  $(a,b)$ such that $f(d)=c$. EVP: If $I$ is an interval, and $f:I\rightarrow\mathbb{R}$, we say that $f$ has the extreme value property iff $f$ has maximum and minimum value, each at least once. That is, $\exists a,b\in I$ such that $f(a)\leq f(x) \leq f(b)$ for all $x\in I$. My question is, does IVP imply EVP? I don't think so, but I still can't find the counter example. Cheers!",,"['calculus', 'real-analysis', 'functions']"
17,Is there a general solution to $a^x + b^x =c^x$ for $x\in\mathbb{R}$?,Is there a general solution to  for ?,a^x + b^x =c^x x\in\mathbb{R},"I found this question online: Solve for $x$, given $6^x + 4^x =9^x$. A straighforward but  unsatisfactory estimation can be obtained by graphing the two lines (on Desmos, say) and reading out the result of the intersection. Is there a more beautiful solution to this equation that one can arrive at without a graphing calculator? And is there a general solution to $a^x + b^x =c^x$ for $x\in\mathbb{R}$ and $a, b, c \in\mathbb{N}$?","I found this question online: Solve for $x$, given $6^x + 4^x =9^x$. A straighforward but  unsatisfactory estimation can be obtained by graphing the two lines (on Desmos, say) and reading out the result of the intersection. Is there a more beautiful solution to this equation that one can arrive at without a graphing calculator? And is there a general solution to $a^x + b^x =c^x$ for $x\in\mathbb{R}$ and $a, b, c \in\mathbb{N}$?",,"['functions', 'puzzle']"
18,Uniqueness proof of the left-inverse of a function,Uniqueness proof of the left-inverse of a function,,"I attempted to prove directly that a function cannot have more than one left inverse, by showing that two left inverses of a function $f$, must be the same function. My Proof Let $f: A \to B, g: B \to A, h: B \to A$. Suppose $g$ and $h$ are left-inverses of $f$. Thus $ g \circ f = i_A = h \circ f$. Where $i_A(x) =x$ for all $x \in A$. Therefore we have $g(f(a)) = h(f(a))$ for $a\in A$. Now since $f$ must be injective for $f$ to have a left-inverse, we have $f(a) = f(a) \implies a = a$ for all $a \in A$ and for all $f(a) \in B$ Put $b = f(a)$. Then $g(b) = h(b) \  \ \ \forall b \in B$, and thus $g = h$. $\square$ However based on the answers I saw here: Can a function have more than one left inverse? , it seems that my proof may be incorrect. But which part of my proof is incorrect, I can't seem to find anything wrong with my proof.","I attempted to prove directly that a function cannot have more than one left inverse, by showing that two left inverses of a function $f$, must be the same function. My Proof Let $f: A \to B, g: B \to A, h: B \to A$. Suppose $g$ and $h$ are left-inverses of $f$. Thus $ g \circ f = i_A = h \circ f$. Where $i_A(x) =x$ for all $x \in A$. Therefore we have $g(f(a)) = h(f(a))$ for $a\in A$. Now since $f$ must be injective for $f$ to have a left-inverse, we have $f(a) = f(a) \implies a = a$ for all $a \in A$ and for all $f(a) \in B$ Put $b = f(a)$. Then $g(b) = h(b) \  \ \ \forall b \in B$, and thus $g = h$. $\square$ However based on the answers I saw here: Can a function have more than one left inverse? , it seems that my proof may be incorrect. But which part of my proof is incorrect, I can't seem to find anything wrong with my proof.",,"['functions', 'elementary-set-theory', 'proof-verification', 'proof-writing', 'proof-explanation']"
19,"Find an injective function that maps $\mathbb{R} \to (-\infty, 0]$",Find an injective function that maps,"\mathbb{R} \to (-\infty, 0]","I'm looking for any ideas as to a function which maps $\mathbb{R} \to (-\infty, 0]$. I considered $-|x|$ but realised that is not injective.","I'm looking for any ideas as to a function which maps $\mathbb{R} \to (-\infty, 0]$. I considered $-|x|$ but realised that is not injective.",,['functions']
20,Is torus w. disc removed homotopic to Klein bottle w. disc removed?,Is torus w. disc removed homotopic to Klein bottle w. disc removed?,,"I know that homeomorhic spaces are homotopic, but am not sure if this applies, since I think they are not homeomorphic due to orientability. I know $f$ and $g$ are homotopic if they represent: X$\rightarrow$Y, and there exists Homotopy map: $H: X \times [0,1] \rightarrow Y$, with: $H(x,0)=f(x)$ and $H(x,1)=g(x)$ So $X$ is a torus with 2-disc removed, $Y$ is the Klein bottle with 2-disc removed, but I am not sure how to apply the equation in practice. It would be great if someone could help, and then I can practice more questions.","I know that homeomorhic spaces are homotopic, but am not sure if this applies, since I think they are not homeomorphic due to orientability. I know $f$ and $g$ are homotopic if they represent: X$\rightarrow$Y, and there exists Homotopy map: $H: X \times [0,1] \rightarrow Y$, with: $H(x,0)=f(x)$ and $H(x,1)=g(x)$ So $X$ is a torus with 2-disc removed, $Y$ is the Klein bottle with 2-disc removed, but I am not sure how to apply the equation in practice. It would be great if someone could help, and then I can practice more questions.",,"['general-topology', 'functions', 'algebraic-topology', 'homotopy-theory', 'klein-bottle']"
21,Why this function is continuous and not differentiable at point $x=1$,Why this function is continuous and not differentiable at point,x=1,"I have a function $$f(x) = \begin{cases}x^2+2,& x\leq 1\\x+2 ,& x > 1\end{cases}$$ I have to show that this function is continuous and not differentiable at point $x=1$, but when I look for left and right derivative of my function I get that they are equal. Can anybody have some  other idea?","I have a function $$f(x) = \begin{cases}x^2+2,& x\leq 1\\x+2 ,& x > 1\end{cases}$$ I have to show that this function is continuous and not differentiable at point $x=1$, but when I look for left and right derivative of my function I get that they are equal. Can anybody have some  other idea?",,"['functions', 'derivatives']"
22,$A \subset B \implies f^{-1}(A) \subset f^{-1}(B)$,,A \subset B \implies f^{-1}(A) \subset f^{-1}(B),"Prove: $A \subset B \implies f^{-1}(A) \subset f^{-1}(B)$ I am busy setting up a proof for Real Analysis, and have come to a point where I need to use the above statement. Intuitively, I can draw a sketch of the above statement that quite clearly shows it to be true, but I would rather like to see an actual proof in order to know for certain that it is correct. Can anyone please assist me in doing so?","Prove: I am busy setting up a proof for Real Analysis, and have come to a point where I need to use the above statement. Intuitively, I can draw a sketch of the above statement that quite clearly shows it to be true, but I would rather like to see an actual proof in order to know for certain that it is correct. Can anyone please assist me in doing so?",A \subset B \implies f^{-1}(A) \subset f^{-1}(B),"['functions', 'elementary-set-theory']"
23,Are all smooth functions bounded?,Are all smooth functions bounded?,,"in my book it says that when a function f is smooth, it also means that it is bounded. I understand that a smooth function has contineous derivatives of all orders, but how can we know that the function is bounded only by knowing it is smooth?","in my book it says that when a function f is smooth, it also means that it is bounded. I understand that a smooth function has contineous derivatives of all orders, but how can we know that the function is bounded only by knowing it is smooth?",,"['real-analysis', 'general-topology', 'functions']"
