,title_raw,title_text,title_latex,body_raw,body_text,body_latex,tags
72,Proving two functions are equal,Proving two functions are equal,,"Let $A$ and $B$ be subsets of the set $\Bbb Z$ for all integers, and let $\mathscr F$ denote the set of all functions $f:A\rightarrow B.$ Assume $A = \{1,2,3\}$ and $B=\{1,2,...,n\}$ where $n\ge 2$ is a fixed integer. Define a relation $R$ on $\mathscr F$ by : for any $f,g \in \mathscr F$,  $\;fRg\;$ if and only if $f - g$ is a constant function (i.e. there is a constant $c$ so that $f(x) - g(x) =c$ for all $x\in A$). Let $f_1\in \mathscr F$ be defined by: $f_1(1)=2,f_1(2)=n,f_1(3)=1$. Suppose that  $g \in \mathscr F$ is arbitrary so that $gRf_1$. Prove that $g=f_1$ and thus $[f_1]$ is just $ \{f_1\}$. My work ( not much): so $gRf_1$ means $g - f_1 = c$ $\Rightarrow g = f_1+c.$ To prove $g=f_1$ I need to prove $g\subseteq f_1$ and $f_1\subseteq g$. So  for $g\subseteq f_1$ , let $x\in g$ and I need to prove $x\in f_1$. So I am not sure where to go from here.","Let $A$ and $B$ be subsets of the set $\Bbb Z$ for all integers, and let $\mathscr F$ denote the set of all functions $f:A\rightarrow B.$ Assume $A = \{1,2,3\}$ and $B=\{1,2,...,n\}$ where $n\ge 2$ is a fixed integer. Define a relation $R$ on $\mathscr F$ by : for any $f,g \in \mathscr F$,  $\;fRg\;$ if and only if $f - g$ is a constant function (i.e. there is a constant $c$ so that $f(x) - g(x) =c$ for all $x\in A$). Let $f_1\in \mathscr F$ be defined by: $f_1(1)=2,f_1(2)=n,f_1(3)=1$. Suppose that  $g \in \mathscr F$ is arbitrary so that $gRf_1$. Prove that $g=f_1$ and thus $[f_1]$ is just $ \{f_1\}$. My work ( not much): so $gRf_1$ means $g - f_1 = c$ $\Rightarrow g = f_1+c.$ To prove $g=f_1$ I need to prove $g\subseteq f_1$ and $f_1\subseteq g$. So  for $g\subseteq f_1$ , let $x\in g$ and I need to prove $x\in f_1$. So I am not sure where to go from here.",,"['elementary-set-theory', 'functions', 'equivalence-relations']"
73,"Prove that for $0<x<1$, $\ln(1+x) - \ln(1-x)<2x$","Prove that for ,",0<x<1 \ln(1+x) - \ln(1-x)<2x,"Prove that for $0<x<1$, $\ln(1+x) - \ln(1-x)<2x$ My direction: $\ln(x)$ is differential and continuous at $(0,∞)$, and since $0<x<1$, clearly $[1-x,1+x]\subseteq(0,∞)$ and so $\ln(x)$ is continuous in $[1-x,1+x]$ and differential in $(1-x,1+x)$. So, by Lagrange's theorem, there is a $c$ in $(1-x, 1+x)$, so that: $${{\ln(1+x)-\ln(1-x)}\over{1+x-1+x}}=\ln'(c)$$ $${{\ln(1+x)-\ln(1-x)}\over{2x}}=\ln'(c)$$ $$\ln(1+x)-\ln(1-x)=\ln'(c)2x$$ And here I got stuck... Would appreciate any help.","Prove that for $0<x<1$, $\ln(1+x) - \ln(1-x)<2x$ My direction: $\ln(x)$ is differential and continuous at $(0,∞)$, and since $0<x<1$, clearly $[1-x,1+x]\subseteq(0,∞)$ and so $\ln(x)$ is continuous in $[1-x,1+x]$ and differential in $(1-x,1+x)$. So, by Lagrange's theorem, there is a $c$ in $(1-x, 1+x)$, so that: $${{\ln(1+x)-\ln(1-x)}\over{1+x-1+x}}=\ln'(c)$$ $${{\ln(1+x)-\ln(1-x)}\over{2x}}=\ln'(c)$$ $$\ln(1+x)-\ln(1-x)=\ln'(c)2x$$ And here I got stuck... Would appreciate any help.",,['functions']
74,Find $x$ such that $\arctan(3/2)+\dots=\arctan x$,Find  such that,x \arctan(3/2)+\dots=\arctan x,Find $x$ such that $$\arctan(3/2) + \arctan(5/4) + \arctan(-5/2) + \arctan(-8/3) = \arctan x.$$,Find $x$ such that $$\arctan(3/2) + \arctan(5/4) + \arctan(-5/2) + \arctan(-8/3) = \arctan x.$$,,"['functions', 'problem-solving']"
75,"If $ f(3x-1)= 12x+5$, what is $\ x \circ f(x)$?","If , what is ?", f(3x-1)= 12x+5 \ x \circ f(x),"Here, I am sharing just an example problem which is given in one of my textbooks: $$ \ \large{ f(3x-1)=12x+5 \ , \\ x \circ f(x)= \, ? \  } \ $$ And, on below of the question, the book has shown an example solution for that: $$ \text{Instead of } \ \mathit{x}, \ \text{if we write the inverse function of } \ \mathbf{3x-1} \, \text{;} \\  \large{ f(x)= 12 \times \bigg( \mathbf{ \frac{x+1}{3} } \bigg) +5  \\  f(x)= 4x+4+5 \\  f(x)= 4x+9 } $$  $$ \large{ x \circ f(x)= f(x) =4x+9 \\ } $$ So, why do we need to take the inverse function of that $ \ \large{3x-1} \ $ and make it equal to $ \ \large{ \mathbf{f(x)} } \, $ ? How about writing that equation something like this, which I have tried before to solve the problem: $$ \large{ f(3x-1)= 12x+5 \\ \implies \frac{x-5}{12}= f^{-1}(3x-1) \\  \frac{3x-1-5}{12}= x \\  12x= 3x-6 \\  9x= -6 \\  x= \frac{-6}{9} \\  \implies \frac{-2}{3} }  $$ Could you please, show me my own mistakes and explain some about how should we approach to this kind of problems to solve? Thank you very much!...","Here, I am sharing just an example problem which is given in one of my textbooks: $$ \ \large{ f(3x-1)=12x+5 \ , \\ x \circ f(x)= \, ? \  } \ $$ And, on below of the question, the book has shown an example solution for that: $$ \text{Instead of } \ \mathit{x}, \ \text{if we write the inverse function of } \ \mathbf{3x-1} \, \text{;} \\  \large{ f(x)= 12 \times \bigg( \mathbf{ \frac{x+1}{3} } \bigg) +5  \\  f(x)= 4x+4+5 \\  f(x)= 4x+9 } $$  $$ \large{ x \circ f(x)= f(x) =4x+9 \\ } $$ So, why do we need to take the inverse function of that $ \ \large{3x-1} \ $ and make it equal to $ \ \large{ \mathbf{f(x)} } \, $ ? How about writing that equation something like this, which I have tried before to solve the problem: $$ \large{ f(3x-1)= 12x+5 \\ \implies \frac{x-5}{12}= f^{-1}(3x-1) \\  \frac{3x-1-5}{12}= x \\  12x= 3x-6 \\  9x= -6 \\  x= \frac{-6}{9} \\  \implies \frac{-2}{3} }  $$ Could you please, show me my own mistakes and explain some about how should we approach to this kind of problems to solve? Thank you very much!...",,['functions']
76,Limit with absolute value,Limit with absolute value,,"I found this limit within the Calculus Single Variable book from Thomas. $$ \lim _{x \to -2^-} (x+3) \frac{|x+2|}{(x+2)}$$ This is how I'm trying: First of all, we need to found where the absolute value will apply. $$|x+2|$$ $$x+2=0$$ $$x=-2$$ $$ -3+2<0 $$ $$ -1+2>0 $$ So the function will change of sign in this interval: $$(-\infty, -2)$$ Then I´m trying to solve by substitution but im stuck with the |x+2|, I don't know what to do within the absolute value :(. Thanks.","I found this limit within the Calculus Single Variable book from Thomas. $$ \lim _{x \to -2^-} (x+3) \frac{|x+2|}{(x+2)}$$ This is how I'm trying: First of all, we need to found where the absolute value will apply. $$|x+2|$$ $$x+2=0$$ $$x=-2$$ $$ -3+2<0 $$ $$ -1+2>0 $$ So the function will change of sign in this interval: $$(-\infty, -2)$$ Then I´m trying to solve by substitution but im stuck with the |x+2|, I don't know what to do within the absolute value :(. Thanks.",,"['functions', 'limits', 'absolute-value']"
77,Range of functions on $\mathbb{R}$,Range of functions on,\mathbb{R},"While practicing problems on functions, I am getting a lot of incorrect answers from the given answers. I am a little confused by this as the problems seem simple else I haven't really understood the underlying principles. Can you guys help me figure if my answers are correct? $f:x \rightarrow |x| + |x-2|$ ,My Answer: $[2,\infty)$ ,Given:$[0,\infty)$ $f:x \rightarrow |x+1| + |x-3|$ ,My Answer: $[4,\infty)$ ,Given: $[0,\infty)$ $f:x \rightarrow x + |x-4|$ ,My Answer: $\mathbb{R}$ ,Given: $[4,\infty)$ Thanks for your help.","While practicing problems on functions, I am getting a lot of incorrect answers from the given answers. I am a little confused by this as the problems seem simple else I haven't really understood the underlying principles. Can you guys help me figure if my answers are correct? $f:x \rightarrow |x| + |x-2|$ ,My Answer: $[2,\infty)$ ,Given:$[0,\infty)$ $f:x \rightarrow |x+1| + |x-3|$ ,My Answer: $[4,\infty)$ ,Given: $[0,\infty)$ $f:x \rightarrow x + |x-4|$ ,My Answer: $\mathbb{R}$ ,Given: $[4,\infty)$ Thanks for your help.",,"['algebra-precalculus', 'functions', 'solution-verification', 'absolute-value']"
78,"Solve the functional equation $f (x+y)=f (x)+f (y)+xy (x+y)$, $f$ continuous at $0$","Solve the functional equation ,  continuous at",f (x+y)=f (x)+f (y)+xy (x+y) f 0,"Find all functions $f:\mathbb{R} \to \mathbb{R}$, that are continuous at the point $x=0$ and satisfy: $$f (x+y)=f (x)+f (y)+xy (x+y) \ \ \forall x,y \in \mathbb{R} $$","Find all functions $f:\mathbb{R} \to \mathbb{R}$, that are continuous at the point $x=0$ and satisfy: $$f (x+y)=f (x)+f (y)+xy (x+y) \ \ \forall x,y \in \mathbb{R} $$",,"['functions', 'functional-equations']"
79,Can a function $f$ exist such that $f(x)f(y) = xy + 1$ for positive real $x$ and $y$,Can a function  exist such that  for positive real  and,f f(x)f(y) = xy + 1 x y,"Problem. Can a function $f$ exist such that $f(x)f(y) = xy + 1$ for positive real $x$ and $y$ If not, is there something like a next best thing, perhaps only for integers, finite field, or maybe only for most values rather than all. If something like this can exist it would be huge to get an explicit formula, as it would make computing something much simpler. I sincerely apologize if this is actually trivial or if it's an ill formed question. But I honestly can't think of anything.","Problem. Can a function exist such that for positive real and If not, is there something like a next best thing, perhaps only for integers, finite field, or maybe only for most values rather than all. If something like this can exist it would be huge to get an explicit formula, as it would make computing something much simpler. I sincerely apologize if this is actually trivial or if it's an ill formed question. But I honestly can't think of anything.",f f(x)f(y) = xy + 1 x y,"['functions', 'functional-equations']"
80,Why is $y$ not defined as a function of $x$ in $x=4y^2$?,Why is  not defined as a function of  in ?,y x x=4y^2,"$$x = 4y^2$$ This equation confuses me, how is $y$ not defined as a function of $x$ ? I manipulated the function and it works just fine, but my book says  ""Explain why the given equation does not define $y$ as a function of $x$ ."" $$\frac{x}{4} = y^2 \tag1$$ $$y = \sqrt \frac{x}{4} \tag2$$ $$y = \frac {\sqrt x}{2} \tag3$$","This equation confuses me, how is not defined as a function of ? I manipulated the function and it works just fine, but my book says  ""Explain why the given equation does not define as a function of .""",x = 4y^2 y x y x \frac{x}{4} = y^2 \tag1 y = \sqrt \frac{x}{4} \tag2 y = \frac {\sqrt x}{2} \tag3,['functions']
81,The number of real solutions of the equation $e^x=3x$,The number of real solutions of the equation,e^x=3x,"The number of real solutions of the equation $e^x=3x$ is ______. I have checked the solution in desmos.com the answer is ""2"". But I am not able to solve it I tried using $x=\ln(3x)$ but could not proceed further. As there any general method I could find the number of intersection of the equation $e^x=ax$ where $a>0$","The number of real solutions of the equation is ______. I have checked the solution in desmos.com the answer is ""2"". But I am not able to solve it I tried using but could not proceed further. As there any general method I could find the number of intersection of the equation where",e^x=3x x=\ln(3x) e^x=ax a>0,['functions']
82,How to solve functional equation $f(x^{2}) = \frac{f(x)}{1 + x}$?,How to solve functional equation ?,f(x^{2}) = \frac{f(x)}{1 + x},"I'm trying to solve this task: Find all $f : (-1, 1) \to \mathbb{R}$ continuous at $x = 0$ and satisfying $f(x^{2}) = \frac{f(x)}{1 + x}$ . I tried substituting $x$ with $-1, 0, 1$ , but it doesn't really do anything. I thought that maybe I should use limits here since I know that function is continuous at $x = 0$ , so I also tried to decrease the power: $f(x) = \frac{f(x^{\frac{1}{2}})}{1 + x^{\frac{1}{2}}}$ $f(x^{\frac{1}{2}}) = \frac{f(x^{\frac{1}{4}})}{1 + x^{\frac{1}{4}}}$ $...$ I am not sure what to do next. Could somebody please give a hint? Thanks in advance.","I'm trying to solve this task: Find all continuous at and satisfying . I tried substituting with , but it doesn't really do anything. I thought that maybe I should use limits here since I know that function is continuous at , so I also tried to decrease the power: I am not sure what to do next. Could somebody please give a hint? Thanks in advance.","f : (-1, 1) \to \mathbb{R} x = 0 f(x^{2}) = \frac{f(x)}{1 + x} x -1, 0, 1 x = 0 f(x) = \frac{f(x^{\frac{1}{2}})}{1 + x^{\frac{1}{2}}} f(x^{\frac{1}{2}}) = \frac{f(x^{\frac{1}{4}})}{1 + x^{\frac{1}{4}}} ...","['functions', 'continuity', 'functional-equations']"
83,"What's the domain of $x^{2/6}$? $\mathbb{R}$ or $[0, \infty)$?",What's the domain of ?  or ?,"x^{2/6} \mathbb{R} [0, \infty)","Is domain of $f(x) = x^{1/3}$ same as $f(x) = x^{2/6}$ ? This is a exam problem in pre-calculus which asked us to write domain of $x^{2/6}$ . I think the answer should be $[0, \infty)$ but the teacher said $\mathbb{R}$ . It's equivalent to how to define the domain of $x^{p/q}$ with $p, q \in \mathbb{N}$ ? Method1 (The teacher uses): We need to let $p, q$ coprime, then compute the domain. In this case, the domain should be same. That is $x \in \mathbb{R}$ . Method2 (I use): $x^{p/q} \equiv \left(\sqrt[q]{x}\right)^p \equiv   \sqrt[q]{x^p}$ . Then domain of $f(x) = x^{1/3}$ is $\mathbb{R}$ . For domain of $f(x) = x^{2/6}$ , there is no universal definition for $x < 0$ . $((-1)^2)^{1/6} = 1$ but $((-1)^{1/6})^2$ is not well-defined in $\mathbb{R}$ or multivalued in $\mathbb{C}$ $e^{i (\frac{1}{3}\pi + \frac{2n}{3}\pi)}$ . Therefore, we need to exclude negative number, that is, domain is $[0, \infty)$ . As shown in wiki and proofWiki , it doesn't require to make $p, q$ coprime first. Which one is correct? That is what's the precedece of viewing the symbol $x^{2/6}$ .","Is domain of same as ? This is a exam problem in pre-calculus which asked us to write domain of . I think the answer should be but the teacher said . It's equivalent to how to define the domain of with ? Method1 (The teacher uses): We need to let coprime, then compute the domain. In this case, the domain should be same. That is . Method2 (I use): . Then domain of is . For domain of , there is no universal definition for . but is not well-defined in or multivalued in . Therefore, we need to exclude negative number, that is, domain is . As shown in wiki and proofWiki , it doesn't require to make coprime first. Which one is correct? That is what's the precedece of viewing the symbol .","f(x) = x^{1/3} f(x) = x^{2/6} x^{2/6} [0, \infty) \mathbb{R} x^{p/q} p, q \in \mathbb{N} p, q x \in \mathbb{R} x^{p/q} \equiv \left(\sqrt[q]{x}\right)^p \equiv 
 \sqrt[q]{x^p} f(x) = x^{1/3} \mathbb{R} f(x) = x^{2/6} x < 0 ((-1)^2)^{1/6} = 1 ((-1)^{1/6})^2 \mathbb{R} \mathbb{C} e^{i (\frac{1}{3}\pi + \frac{2n}{3}\pi)} [0, \infty) p, q x^{2/6}","['algebra-precalculus', 'functions']"
84,Range of the trigonometric function $f(x)= \frac{3}{4 - 5\sin(x)}$,Range of the trigonometric function,f(x)= \frac{3}{4 - 5\sin(x)},"I was trying to find the range of the function $$f(x) = \frac{3}{4-5\sin(x)} $$ The first thought that came to mind was: Let's put the minimum and maximum value of $\sin(x)$ as $\{1,-1\}$ accordingly to find maximum and minimum of the function. However, then I got range $[-3,\frac{1}{3}]$ , which was totally wrong when I used a graphing calculator. The true answer is $(-\infty,-3] ∪ [\frac{1}{3}, \infty)  $ Now, I want explaination what I did wrong here. Link for graph","I was trying to find the range of the function The first thought that came to mind was: Let's put the minimum and maximum value of as accordingly to find maximum and minimum of the function. However, then I got range , which was totally wrong when I used a graphing calculator. The true answer is Now, I want explaination what I did wrong here. Link for graph","f(x) = \frac{3}{4-5\sin(x)}  \sin(x) \{1,-1\} [-3,\frac{1}{3}] (-\infty,-3] ∪ [\frac{1}{3}, \infty)  ","['functions', 'trigonometry']"
85,MacLaurin Expansion of $\log(1+x) \cdot e^x$,MacLaurin Expansion of,\log(1+x) \cdot e^x,Could anyone enlighten me on how to go about expanding the following function around $x_0 = 0$ : $$ f(x):= \log(1+x)e^{x} $$ I have tried using Cauchy Product Series and bruteforce computation of the coefficients but I always find myself with a double sum which is difficult to work with when trying to estimate the radius of convergence. As always any comment or answer is welcome and let me know if I can explain myself clearer!,Could anyone enlighten me on how to go about expanding the following function around : I have tried using Cauchy Product Series and bruteforce computation of the coefficients but I always find myself with a double sum which is difficult to work with when trying to estimate the radius of convergence. As always any comment or answer is welcome and let me know if I can explain myself clearer!,"x_0 = 0 
f(x):= \log(1+x)e^{x}
","['real-analysis', 'sequences-and-series', 'functions', 'taylor-expansion']"
86,Solution to $2^x=x!$,Solution to,2^x=x!,"I was trying to solve the equation for $x!=2^x$ , where $x\ge0$ . I plotted it on Desmos and found two solutions for the same. Attaching image for reference. Graph plot of $2^x$ and $x!$ As per the plot, there are two solutions for the equation. But I am only able to derive the solution $x=0$ . (Through observation and guesswork). How can the second solution be derived ( $x\approx3.46$ )? I couldn't figure it out! It looks so simple, yet its quite a bummer actually(at least for me). Can someone please help regarding the same? Thanks in advance!","I was trying to solve the equation for , where . I plotted it on Desmos and found two solutions for the same. Attaching image for reference. Graph plot of and As per the plot, there are two solutions for the equation. But I am only able to derive the solution . (Through observation and guesswork). How can the second solution be derived ( )? I couldn't figure it out! It looks so simple, yet its quite a bummer actually(at least for me). Can someone please help regarding the same? Thanks in advance!",x!=2^x x\ge0 2^x x! x=0 x\approx3.46,"['real-analysis', 'functions', 'factorial']"
87,"For the given function $f(x)=\frac{1}{\sqrt {1+x}} +\frac{1}{\sqrt {1+a}} + \sqrt{\frac{ax}{ax+8}}$, prove that $1<f(x)<2$ for positive a and $x\ge 0$ [closed]","For the given function , prove that  for positive a and  [closed]",f(x)=\frac{1}{\sqrt {1+x}} +\frac{1}{\sqrt {1+a}} + \sqrt{\frac{ax}{ax+8}} 1<f(x)<2 x\ge 0,"Closed. This question does not meet Mathematics Stack Exchange guidelines . It is not currently accepting answers. Please provide additional context , which ideally explains why the question is relevant to you and our  community. Some forms of context include: background and motivation, relevant definitions, source, possible strategies, your current progress, why the question is interesting or important, etc. Closed 3 years ago . Improve this question For the given function $f(x)=\frac{1}{\sqrt {1+x}} +\frac{1}{\sqrt {1+a}} + \sqrt{\frac{ax}{ax+8}}$ , prove that $1<f(x)<2$ for +ve $a$ and $x\ge 0$ I tried the most rudimentary method ie. differentiating wrt x and hoped to get at least 2 solutions for $f’(x)$ , unfortunately I wasn’t able to find a solution for implying function is monotonous . Now whether it’s sis increasing or decreasing still remains a mystery, given that we don’t know what $a$ is. What method can be used to solve this?","Closed. This question does not meet Mathematics Stack Exchange guidelines . It is not currently accepting answers. Please provide additional context , which ideally explains why the question is relevant to you and our  community. Some forms of context include: background and motivation, relevant definitions, source, possible strategies, your current progress, why the question is interesting or important, etc. Closed 3 years ago . Improve this question For the given function , prove that for +ve and I tried the most rudimentary method ie. differentiating wrt x and hoped to get at least 2 solutions for , unfortunately I wasn’t able to find a solution for implying function is monotonous . Now whether it’s sis increasing or decreasing still remains a mystery, given that we don’t know what is. What method can be used to solve this?",f(x)=\frac{1}{\sqrt {1+x}} +\frac{1}{\sqrt {1+a}} + \sqrt{\frac{ax}{ax+8}} 1<f(x)<2 a x\ge 0 f’(x) a,"['calculus', 'functions', 'inequality']"
88,Why is it not sufficient to only check the third condition when verifying equality of functions?,Why is it not sufficient to only check the third condition when verifying equality of functions?,,"I have been told that two functions $f$ and $g$ are equal if and only if the domain and the subset of the cartesian product of the two functions is the same. My question is, given that a function is a special case of a relation, both $f$ and $g$ are sets, why is it not sufficient to just verify if the cartesian product is the same between the two functions?. In other words, doesn't the third condition implies that both domains are equal?","I have been told that two functions and are equal if and only if the domain and the subset of the cartesian product of the two functions is the same. My question is, given that a function is a special case of a relation, both and are sets, why is it not sufficient to just verify if the cartesian product is the same between the two functions?. In other words, doesn't the third condition implies that both domains are equal?",f g f g,['functions']
89,"How to prove that $f: \mathbb{R} \to \mathbb{R}$ is continuous, given that $xy-y^2 \leq f(x)-f(y) \leq x^2-xy$?","How to prove that  is continuous, given that ?",f: \mathbb{R} \to \mathbb{R} xy-y^2 \leq f(x)-f(y) \leq x^2-xy,"Let $f: \mathbb{R} \to \mathbb{R}$ and let $$xy-y^2 \leq f(x)-f(y) \leq x^2-xy$$ I am trying to prove that f is continuous i.e: $$\lim_{x \to x_0}f(x) = f(x_0)$$ To be honest, I barely understand the problem. What I can extract from it is: $$ xy-y^2 \leq x^2-xy \iff \boxed{x^2+y^2 \geq 1} $$ Hence, the inequality holds only $\forall$ outter points of the unit circle, centered at $(0,0)$ . More than that, I can't understand how to show continuity for $f$ , since I don't even know what $f$ is. In order for a function to be continuous the following condition must be satisfied: $$\lim_{x \to x_0} f(x) = f(x_0)$$ Any tips that will help me understand the problem would be greatly appreciated","Let and let I am trying to prove that f is continuous i.e: To be honest, I barely understand the problem. What I can extract from it is: Hence, the inequality holds only outter points of the unit circle, centered at . More than that, I can't understand how to show continuity for , since I don't even know what is. In order for a function to be continuous the following condition must be satisfied: Any tips that will help me understand the problem would be greatly appreciated","f: \mathbb{R} \to \mathbb{R} xy-y^2 \leq f(x)-f(y) \leq x^2-xy \lim_{x \to x_0}f(x) = f(x_0)  xy-y^2 \leq x^2-xy \iff \boxed{x^2+y^2 \geq 1}  \forall (0,0) f f \lim_{x \to x_0} f(x) = f(x_0)","['calculus', 'limits', 'functions', 'continuity', 'limits-without-lhopital']"
90,Prove that $f(x) = \frac{5x^{2}}{1 + x^{2}}$ is bounded,Prove that  is bounded,f(x) = \frac{5x^{2}}{1 + x^{2}},"I have only had experience bounding functions over certain ranges of x, so I am having trouble trying to show it is true for all x. I would appreciate any guidance or tips for these types of problems as I feel  my proof is somewhat trivial and not rigorous. Proof. To show that $\frac{5x^{2}}{1 + x^{2}}$ is bounded we show that there exists an $M \in \mathbb{R}$ such that $$\mid \frac{5x^{2}}{1 + x^{2}} \mid \leq M  \: \text{for all $x \in \mathbb{R}$}$$ As $|5x^{2}|$ is already bounded from above, we seek to bound $|1 + x^{2}|$ from below. Using the triangle inequality, $|1 + x^{2}| \geq |1| + |x^{2}| > |x^{2}|$ . Thus, $M = |\frac{5x^{2}}{x^{2}}| = |5| = 5$ $\square$","I have only had experience bounding functions over certain ranges of x, so I am having trouble trying to show it is true for all x. I would appreciate any guidance or tips for these types of problems as I feel  my proof is somewhat trivial and not rigorous. Proof. To show that is bounded we show that there exists an such that As is already bounded from above, we seek to bound from below. Using the triangle inequality, . Thus,",\frac{5x^{2}}{1 + x^{2}} M \in \mathbb{R} \mid \frac{5x^{2}}{1 + x^{2}} \mid \leq M  \: \text{for all x \in \mathbb{R}} |5x^{2}| |1 + x^{2}| |1 + x^{2}| \geq |1| + |x^{2}| > |x^{2}| M = |\frac{5x^{2}}{x^{2}}| = |5| = 5 \square,['functions']
91,"Let $A=\{1,2,3,...,9\}$ and $f:A \rightarrow A$ is a bijection such that $(fofofo\cdots n$ times) $=f$ but others are not identical to $f$",Let  and  is a bijection such that  times)  but others are not identical to,"A=\{1,2,3,...,9\} f:A \rightarrow A (fofofo\cdots n =f f","Let $\mathrm{A}=\{1,2,3,...,9\}$ and $f:\mathrm{A \rightarrow A}$ is a bijection such that $(fofofo\cdots n$ times) $=f$ but $(fof),(fofof), \cdots, (fofofo\cdots (n-1)$ times) are not identical to $f$ . Then largest value of $n$ is? Answer given- 21 I thought of taking an apt function and getting the answer, but answer seems out of range, any hint?","Let and is a bijection such that times) but times) are not identical to . Then largest value of is? Answer given- 21 I thought of taking an apt function and getting the answer, but answer seems out of range, any hint?","\mathrm{A}=\{1,2,3,...,9\} f:\mathrm{A \rightarrow A} (fofofo\cdots n =f (fof),(fofof), \cdots, (fofofo\cdots (n-1) f n",['functions']
