,title_raw,title_text,title_latex,body_raw,body_text,body_latex,tags
24,Composition of Even and Odd Functions and their Outcome,Composition of Even and Odd Functions and their Outcome,,"Give an example of an even function. Give an example of an odd function. If f(x) is odd and g(x) is even, must f(g(x)) be even? Must g(f(x)) be even? I've tried generic functions like f(x) = x^3 and g(x) = x^2 Both compositions (going f(g(x)) and g(f(x)) yield even results) However, when I use the trig functions, something different happens. f(x) = sin(x) g(x) = cos(x) f(g(x)) = even and g(f(x)) = even. Therefore, can I assume, that the combination of any function (that is not neither odd nor even) will be even?","Give an example of an even function. Give an example of an odd function. If f(x) is odd and g(x) is even, must f(g(x)) be even? Must g(f(x)) be even? I've tried generic functions like f(x) = x^3 and g(x) = x^2 Both compositions (going f(g(x)) and g(f(x)) yield even results) However, when I use the trig functions, something different happens. f(x) = sin(x) g(x) = cos(x) f(g(x)) = even and g(f(x)) = even. Therefore, can I assume, that the combination of any function (that is not neither odd nor even) will be even?",,['functions']
25,Proving functions are injective and surjective,Proving functions are injective and surjective,,"I am having trouble with the following problem: For nonempty sets $A$ and $B$ and functions $f:A \rightarrow B$ and $g:B \rightarrow A$ suppose that $g\circ f=i_A$, the identity function of $A$. Prove that $f$ is injective and $g$ is surjective. Work: Since $g\circ f=i_A$, then $g\circ f:A\rightarrow A$. After this point, I don't know how to proceed.","I am having trouble with the following problem: For nonempty sets $A$ and $B$ and functions $f:A \rightarrow B$ and $g:B \rightarrow A$ suppose that $g\circ f=i_A$, the identity function of $A$. Prove that $f$ is injective and $g$ is surjective. Work: Since $g\circ f=i_A$, then $g\circ f:A\rightarrow A$. After this point, I don't know how to proceed.",,"['functions', 'discrete-mathematics']"
26,Is one form of a function more 'true' than another?,Is one form of a function more 'true' than another?,,"Here's a function: $f(x) = \frac{x^2}{x}$ Now, if we were to look for the $0$ value, we would end up with a division by zero situation. By simplifying it to an equivalent function: $f(x) = x$, this is no longer a problem. Does this mean that the latter function is, in a sense, a more 'true' form of the function? Do both of these forms have the same domain?","Here's a function: $f(x) = \frac{x^2}{x}$ Now, if we were to look for the $0$ value, we would end up with a division by zero situation. By simplifying it to an equivalent function: $f(x) = x$, this is no longer a problem. Does this mean that the latter function is, in a sense, a more 'true' form of the function? Do both of these forms have the same domain?",,[]
27,Functions with the same derivatives [duplicate],Functions with the same derivatives [duplicate],,"This question already has answers here : Prove that $C e^x$ is the only set of functions for which $f(x) = f'(x)$ (9 answers) Closed 10 years ago . Functions with the same derivatives Besides, $f(x)=e^x$,  what other non-zero functions are the same as their derivatives no matter how many times the derivative is taken?","This question already has answers here : Prove that $C e^x$ is the only set of functions for which $f(x) = f'(x)$ (9 answers) Closed 10 years ago . Functions with the same derivatives Besides, $f(x)=e^x$,  what other non-zero functions are the same as their derivatives no matter how many times the derivative is taken?",,"['calculus', 'functions']"
28,In the context of the Unit Circle why is tan$(\theta)$ defined as $\tan(\theta)=\frac{\sin (\theta)}{\cos (\theta)}=\frac{y}{x}$?,In the context of the Unit Circle why is tan defined as ?,(\theta) \tan(\theta)=\frac{\sin (\theta)}{\cos (\theta)}=\frac{y}{x},"I understand why the circular functions $\sin(\theta)=y$ and $\cos(\theta)=x$, but why does $\tan(\theta)=\frac{\sin (\theta)}{\cos (\theta)}=\frac{y}{x}$? Is there any particular reason  why $\tan (\theta)$ is defined as the ratio of $\sin (\theta)$ and $\cos (\theta)$?  Furthermore why does the tangent line specifically touch the Unit Circle at the point $(1,0)$ (presumably this leads on from how $\tan(\theta)$ is defined)?","I understand why the circular functions $\sin(\theta)=y$ and $\cos(\theta)=x$, but why does $\tan(\theta)=\frac{\sin (\theta)}{\cos (\theta)}=\frac{y}{x}$? Is there any particular reason  why $\tan (\theta)$ is defined as the ratio of $\sin (\theta)$ and $\cos (\theta)$?  Furthermore why does the tangent line specifically touch the Unit Circle at the point $(1,0)$ (presumably this leads on from how $\tan(\theta)$ is defined)?",,"['algebra-precalculus', 'functions', 'trigonometry']"
29,How to represent logical operators as functions?,How to represent logical operators as functions?,,"I'm looking for a function that will replicate logical operators. In particular consider the AND operator. Then I am looking for a function z = f(x,y) such that $$x,y,z \in \{0,1\}$$ f(0,0)=0 f(1,0)=0 f(0,1)=0 f(1,1)=1 More importantly I need to generalize over a space where Xi,Yi ∈ {0,1} and I need to do this for other sorts of operators too. (X XOR Y AND Z for example.) So given a vector Xi and a vector Yi I need to be able to generate Zi w","I'm looking for a function that will replicate logical operators. In particular consider the AND operator. Then I am looking for a function z = f(x,y) such that $$x,y,z \in \{0,1\}$$ f(0,0)=0 f(1,0)=0 f(0,1)=0 f(1,1)=1 More importantly I need to generalize over a space where Xi,Yi ∈ {0,1} and I need to do this for other sorts of operators too. (X XOR Y AND Z for example.) So given a vector Xi and a vector Yi I need to be able to generate Zi w",,['functions']
30,Justification for g being a one to one function,Justification for g being a one to one function,,"If $f$ and $f\circ g$ are one to one functions, is $g$ also a one to one function? Justify your answer. I am guessing that $g$ should be a one to one function. So a function $F$ is injective if: $\forall a \forall b(F(a)=F(b) \Rightarrow a=b)$ So since $f$ is injective: $\forall a \forall b(f(a)=f(b) \Rightarrow a=b)$ And $f\circ g$ is also injective: $\forall a \forall b(f \circ g(a)=f \circ g(b) \Rightarrow g(a)=g(b))$ $\forall a \forall b(g(a)=g(b) \Rightarrow a=b)$ Does this show that $g$ must also be injective?","If and are one to one functions, is also a one to one function? Justify your answer. I am guessing that should be a one to one function. So a function is injective if: So since is injective: And is also injective: Does this show that must also be injective?",f f\circ g g g F \forall a \forall b(F(a)=F(b) \Rightarrow a=b) f \forall a \forall b(f(a)=f(b) \Rightarrow a=b) f\circ g \forall a \forall b(f \circ g(a)=f \circ g(b) \Rightarrow g(a)=g(b)) \forall a \forall b(g(a)=g(b) \Rightarrow a=b) g,"['functions', 'discrete-mathematics']"
31,The number of positive integral values taken by $f(x)=(x^3-11^3)^{1/3}$ over natural numbers $x$,The number of positive integral values taken by  over natural numbers,f(x)=(x^3-11^3)^{1/3} x,"For $f:{\Bbb{N}}\to \mathbb R$ , $f(x)=(x^3-11^3)^{1/3}$ , what is the number of positive integral values $f(x)$ can take? The first thing that came into my mind was just simply trial and error but I soon realised that it wasn't going to come handy here.   I thought maybe factoring $$(x^3-11^3)= (x-11)(x^2 + 11x + 121)$$ might give some leads to this but I just couldn't figure something out from this. How do I approach this? I believe there might be some kind of specific theorem or rule that helps to solve these kind of problems that I don't know of, because I just can't figure out how to start in the first place.","For , , what is the number of positive integral values can take? The first thing that came into my mind was just simply trial and error but I soon realised that it wasn't going to come handy here.   I thought maybe factoring might give some leads to this but I just couldn't figure something out from this. How do I approach this? I believe there might be some kind of specific theorem or rule that helps to solve these kind of problems that I don't know of, because I just can't figure out how to start in the first place.",f:{\Bbb{N}}\to \mathbb R f(x)=(x^3-11^3)^{1/3} f(x) (x^3-11^3)= (x-11)(x^2 + 11x + 121),"['number-theory', 'functions']"
32,Injectivity of a function of several variables,Injectivity of a function of several variables,,"Let $f: \Bbb{R}^n \rightarrow \Bbb{R}^n$ be defined as $f(x) = x||x||^2$ for $x \in \Bbb{R}^n$ . I need to prove or disprove the following statement: $f$ is one-one. I think it is a wrong statement as if I take $n = 2$ then determinant of $Df(0) = 0$ which means it is not one-one in any neighbourhood of $(0,0)$ . Hence the given statement is false. But the answer sheet of my book says it is correct. Please confirm",Let be defined as for . I need to prove or disprove the following statement: is one-one. I think it is a wrong statement as if I take then determinant of which means it is not one-one in any neighbourhood of . Hence the given statement is false. But the answer sheet of my book says it is correct. Please confirm,"f: \Bbb{R}^n \rightarrow \Bbb{R}^n f(x) = x||x||^2 x \in \Bbb{R}^n f n = 2 Df(0) = 0 (0,0)","['real-analysis', 'functions', 'derivatives']"
33,Does $\lim_{x\to\infty} f(x) = 1$ imply that $f(x) = 1$ when $x = \infty$?,Does  imply that  when ?,\lim_{x\to\infty} f(x) = 1 f(x) = 1 x = \infty,"If $\lim_{x\to\infty} f(x) = 1$ , then is it correct to state it as $f(x) = 1$ when $x = \infty$ ? Can we define a function in this way, if not why? Also if a limit exists at a point $x$ then does the function always has to be defined for that $x$ with the same value obtained through the limit?","If , then is it correct to state it as when ? Can we define a function in this way, if not why? Also if a limit exists at a point then does the function always has to be defined for that with the same value obtained through the limit?",\lim_{x\to\infty} f(x) = 1 f(x) = 1 x = \infty x x,"['real-analysis', 'limits', 'functions', 'definition']"
34,About the concept bound a function,About the concept bound a function,,"From wikipedia: In mathematics, a function f defined on some set X with real or complex values is called bounded if the set of its values is bounded. In other words, there exists a real number M such that $|f(x)| \leq M, \forall x \in X.$ I have a series of conceptual doubts about this: Does strict inequality need to be considered bounded? In wikipedia says that $\arctan(x)$ is bounded since $|\arctan(x)|<  \frac{\pi}{2}$ , but i want to confirm with mathematicians of MSE. The concept of bounded seems symmetric, i mean, what will happen to functions like $f(x) = \sin(x) + c$ , where $c-1 \leq f(x)\leq c+1$ ? in this case, i cant say that there exist an $M$ such that $|f(x)| \leq M$ , so, this function is considered bounded?","From wikipedia: In mathematics, a function f defined on some set X with real or complex values is called bounded if the set of its values is bounded. In other words, there exists a real number M such that I have a series of conceptual doubts about this: Does strict inequality need to be considered bounded? In wikipedia says that is bounded since , but i want to confirm with mathematicians of MSE. The concept of bounded seems symmetric, i mean, what will happen to functions like , where ? in this case, i cant say that there exist an such that , so, this function is considered bounded?","|f(x)| \leq M, \forall x \in X. \arctan(x) |\arctan(x)|<  \frac{\pi}{2} f(x) = \sin(x) + c c-1 \leq f(x)\leq c+1 M |f(x)| \leq M","['functions', 'upper-lower-bounds']"
35,Exact value of a trigonometric rational,Exact value of a trigonometric rational,,"I want to find the exact value of $$\cfrac{\tan \cfrac{\pi}{5}-\tan\cfrac{\pi}{30}}{1+\tan \cfrac{\pi}{5}\cdot \tan \cfrac{\pi}{30}}$$ I started with $u$ substitution, where $u=\pi/5$ , and therefore $\cfrac u6 =\pi/30$ , allowing me to rewrite the problem as \begin{align*} \cfrac{\tan u - \tan \cfrac u6}{1+\tan u \cdot \tan \cfrac u6} \end{align*} I tried dividing both sides of the rational by trig functions like $\tan u$ or $\cos u/6$ , new definitions (e.g., trig Pythagorean identity for 1), and I tried using a calculator and I would only get decimal values when I'm trying to get the answer $\cfrac{\sqrt3}{3}$","I want to find the exact value of I started with substitution, where , and therefore , allowing me to rewrite the problem as I tried dividing both sides of the rational by trig functions like or , new definitions (e.g., trig Pythagorean identity for 1), and I tried using a calculator and I would only get decimal values when I'm trying to get the answer","\cfrac{\tan \cfrac{\pi}{5}-\tan\cfrac{\pi}{30}}{1+\tan \cfrac{\pi}{5}\cdot \tan \cfrac{\pi}{30}} u u=\pi/5 \cfrac u6 =\pi/30 \begin{align*} \cfrac{\tan u - \tan \cfrac u6}{1+\tan u \cdot \tan \cfrac u6}
\end{align*} \tan u \cos u/6 \cfrac{\sqrt3}{3}","['algebra-precalculus', 'functions', 'trigonometry']"
36,"According to limits there is a horizontal asymptote at y = 0, however the equation has a root at x = 1.","According to limits there is a horizontal asymptote at y = 0, however the equation has a root at x = 1.",,So I have the equation $$f(x)=\frac{(x-1)}{x^2}$$ This clearly has a root when $x=1$ however when considering limits we have the following $$\lim_{x\to\infty}f(x)=0$$ And similarly $$\lim_{x\to-\infty}f(x)=0$$ Which implies there is horizontal asymptote when $f(x)=0$ However this is clearly not the case since the function crosses the $y$ -axis. Have I made a mistake somewhere or is this a case where the definition of horizontal asymptotes doesn't work (or do I have the wrong definition!).,So I have the equation This clearly has a root when however when considering limits we have the following And similarly Which implies there is horizontal asymptote when However this is clearly not the case since the function crosses the -axis. Have I made a mistake somewhere or is this a case where the definition of horizontal asymptotes doesn't work (or do I have the wrong definition!).,f(x)=\frac{(x-1)}{x^2} x=1 \lim_{x\to\infty}f(x)=0 \lim_{x\to-\infty}f(x)=0 f(x)=0 y,"['calculus', 'limits', 'functions']"
37,Is $f(x)=\frac{x^2-1}{x+1}$ continuous at $x^*=-1$?,Is  continuous at ?,f(x)=\frac{x^2-1}{x+1} x^*=-1,"Is $f(x)=\frac{x^2-1}{x+1}$ continuous at $x^*=-1$ ? For $f(x)=\frac{x^2-1}{x+1}$ there exists $\lim\limits_{x\to -1^-}f(x)=-2$ and $\lim\limits_{x\to -1^+}f(x)=-2$ but it is not continuous at $x=-1$ , but that would be a contradiction to the definition of continuity which states that for every function where both $\lim_{x\to x^{*-}}=\lim_{x\to x^{*+}}$ are equal then the function is continuous at the point $x^*$ . What is wrong with my thoughts? (Or do I remember that incorrectly?)","Is continuous at ? For there exists and but it is not continuous at , but that would be a contradiction to the definition of continuity which states that for every function where both are equal then the function is continuous at the point . What is wrong with my thoughts? (Or do I remember that incorrectly?)",f(x)=\frac{x^2-1}{x+1} x^*=-1 f(x)=\frac{x^2-1}{x+1} \lim\limits_{x\to -1^-}f(x)=-2 \lim\limits_{x\to -1^+}f(x)=-2 x=-1 \lim_{x\to x^{*-}}=\lim_{x\to x^{*+}} x^*,"['real-analysis', 'functions', 'continuity']"
38,Function such that $f(f(f(x))) = f(f(x)) \neq f(x)$ [duplicate],Function such that  [duplicate],f(f(f(x))) = f(f(x)) \neq f(x),"This question already has an answer here : Calculus function create [closed] (1 answer) Closed 4 years ago . Give an example of a function $f\colon\Bbb R\rightarrow \Bbb R$ such that $f\circ f\circ f=f\circ f\neq f$ , that is, $f(f(f(x))) = f(f(x))$ on $\Bbb R$ but $f(f(x))\ne f(x)$ for some $x\in\mathbb R$ .","This question already has an answer here : Calculus function create [closed] (1 answer) Closed 4 years ago . Give an example of a function such that , that is, on but for some .",f\colon\Bbb R\rightarrow \Bbb R f\circ f\circ f=f\circ f\neq f f(f(f(x))) = f(f(x)) \Bbb R f(f(x))\ne f(x) x\in\mathbb R,"['functions', 'functional-equations']"
39,Question about a degree 5 polynomial with no rational roots [closed],Question about a degree 5 polynomial with no rational roots [closed],,"Closed. This question does not meet Mathematics Stack Exchange guidelines . It is not currently accepting answers. Please provide additional context , which ideally explains why the question is relevant to you and our  community. Some forms of context include: background and motivation, relevant definitions, source, possible strategies, your current progress, why the question is interesting or important, etc. Closed 4 years ago . Improve this question Is it possible to find a 5th degree polynomial with no rational roots, and at least one irrational root? Edit: the polynomial must only have rational coefficients","Closed. This question does not meet Mathematics Stack Exchange guidelines . It is not currently accepting answers. Please provide additional context , which ideally explains why the question is relevant to you and our  community. Some forms of context include: background and motivation, relevant definitions, source, possible strategies, your current progress, why the question is interesting or important, etc. Closed 4 years ago . Improve this question Is it possible to find a 5th degree polynomial with no rational roots, and at least one irrational root? Edit: the polynomial must only have rational coefficients",,"['functions', 'polynomials']"
40,How to find the definite integral of cube of a function whose definite integral is known?,How to find the definite integral of cube of a function whose definite integral is known?,,"I'm given that the definite integration of some function is equal to $0$ . Now I've to find maximum value of definite integration of cube of same function between same bounds. How to do it? Please explain. I'm writing it in mathematical form. $$\int^1 _0 f(x)=0:-1\le f(x)\le1$$ Find the maximum value of $$\int^1_0 [f(x)]^3$$ Seriously I have no clue to do the question. I tried to draw the graph(experimental) where I kept areas in 1st, 4th quadrants equal so that the integration is zero. Now I'm trying but draw the graph of cubic of same graph. And maximize the area in the first quadrant. I'm thinking about to do it using some graphical calculator and have some visualization of the problem but obviously I have no clue how to do that even. Thanks for solving the question or giving it time.","I'm given that the definite integration of some function is equal to . Now I've to find maximum value of definite integration of cube of same function between same bounds. How to do it? Please explain. I'm writing it in mathematical form. Find the maximum value of Seriously I have no clue to do the question. I tried to draw the graph(experimental) where I kept areas in 1st, 4th quadrants equal so that the integration is zero. Now I'm trying but draw the graph of cubic of same graph. And maximize the area in the first quadrant. I'm thinking about to do it using some graphical calculator and have some visualization of the problem but obviously I have no clue how to do that even. Thanks for solving the question or giving it time.",0 \int^1 _0 f(x)=0:-1\le f(x)\le1 \int^1_0 [f(x)]^3,"['calculus', 'integration', 'functions', 'definite-integrals']"
41,"If $f (t) = |t - 2|$, find $f (-t)$","If , find",f (t) = |t - 2| f (-t),"Why question: If $f (t) = |t − 2|$ , find $f (−t)$ has result: $|t + 2|$ ? I don't understand it.","Why question: If , find has result: ? I don't understand it.",f (t) = |t − 2| f (−t) |t + 2|,"['algebra-precalculus', 'functions', 'absolute-value']"
42,does $f(x)$ defined by $f(x)=f(x^2)$ must be a constant?,does  defined by  must be a constant?,f(x) f(x)=f(x^2),I proved that if $f(x)$ is continuous then it must be a constant.  But I can't disprove or prove it for non-continuous function.,I proved that if is continuous then it must be a constant.  But I can't disprove or prove it for non-continuous function.,f(x),"['real-analysis', 'functions']"
43,Find all functions $f:\mathbb{N}^+\to\mathbb{N}^+$ such that $f\big(f(n)\big)+f(n)=2n$ for every $n\in\mathbb{N}^+$.,Find all functions  such that  for every .,f:\mathbb{N}^+\to\mathbb{N}^+ f\big(f(n)\big)+f(n)=2n n\in\mathbb{N}^+,"Find all functions $f:\mathbb{N}^+\to\mathbb{N}^+$ such that $$f\big(f(n)\big)+f(n)=2n$$ for every $n\in\mathbb{N}^+$ . I think the answer is $f(n)=n$ ,We prove this by induction. ( at last step I can't induction it ） It is true for $n=1$ because Let $f(1)=x\ge 1,$ and let $n=1$ ,we have $$f(x)+x=2\Longrightarrow x=1$$ (2) Suppose it is true for $f(n)=n(n\le k)$ , then for $n=k+1$ ,let $f(n+1)=y$ ,so we have $$f(y)+y=2(k+1)\Longrightarrow f(y)=2(k+1)-y$$ it is easy to have $k+1\le y\le 2k+1$ ,and $$f(f(y))+f(y)=2y\Longrightarrow f(2k+2-y)=2y-f(y)=3y-2(k+1)$$ since $2k+2-y\in [1,k+1]$ ,then I can't it ,can you help? Thanks (if $2k+2-y\in [1,k]$ ,I have done it! bacuase $f(2k+2-y)=2k+2-y$ ,so $y=k+1$ )","Find all functions such that for every . I think the answer is ,We prove this by induction. ( at last step I can't induction it ） It is true for because Let and let ,we have (2) Suppose it is true for , then for ,let ,so we have it is easy to have ,and since ,then I can't it ,can you help? Thanks (if ,I have done it! bacuase ,so )","f:\mathbb{N}^+\to\mathbb{N}^+ f\big(f(n)\big)+f(n)=2n n\in\mathbb{N}^+ f(n)=n n=1 f(1)=x\ge 1, n=1 f(x)+x=2\Longrightarrow x=1 f(n)=n(n\le k) n=k+1 f(n+1)=y f(y)+y=2(k+1)\Longrightarrow f(y)=2(k+1)-y k+1\le y\le 2k+1 f(f(y))+f(y)=2y\Longrightarrow f(2k+2-y)=2y-f(y)=3y-2(k+1) 2k+2-y\in [1,k+1] 2k+2-y\in [1,k] f(2k+2-y)=2k+2-y y=k+1","['functions', 'induction', 'recurrence-relations', 'contest-math', 'functional-equations']"
44,"Is there a bijection $\big\{x:\mathbb{N}\to\{0,1\}:\{i\in\mathbb{N}:x(i)=1\}\text{ is finite}\big\}\to\big\{x:\mathbb{N}\to\{0,1\}\big\}$? [duplicate]",Is there a bijection ? [duplicate],"\big\{x:\mathbb{N}\to\{0,1\}:\{i\in\mathbb{N}:x(i)=1\}\text{ is finite}\big\}\to\big\{x:\mathbb{N}\to\{0,1\}\big\}","This question already has answers here : Is the collection of finite subsets of $\mathbb{Z}$ countable? (4 answers) Neatest proof that set of finite subsets is countable? (13 answers) Show that the set of all finite subsets of $\mathbb{N}$ is countable. (7 answers) Closed 5 years ago . Can we use Cantor's theorem to figure this out? Intuitively the domain seems to be a subset of the codomain, but where do powersets come in? Thanks in advance!","This question already has answers here : Is the collection of finite subsets of $\mathbb{Z}$ countable? (4 answers) Neatest proof that set of finite subsets is countable? (13 answers) Show that the set of all finite subsets of $\mathbb{N}$ is countable. (7 answers) Closed 5 years ago . Can we use Cantor's theorem to figure this out? Intuitively the domain seems to be a subset of the codomain, but where do powersets come in? Thanks in advance!",,"['functions', 'discrete-mathematics', 'elementary-set-theory']"
45,Function For Sine Wave Between Two Exponential Cuves,Function For Sine Wave Between Two Exponential Cuves,,What function could I use to approximate a curve with this plot? The function ideally will involve sine and have its envelope defined by different exponentials of the form $y = ae^{bx}$ and $y = ce^{dx}$.,What function could I use to approximate a curve with this plot? The function ideally will involve sine and have its envelope defined by different exponentials of the form $y = ae^{bx}$ and $y = ce^{dx}$.,,['functions']
