,title_raw,title_text,title_latex,body_raw,body_text,body_latex,tags
46,How to prove that $-x$ is not equal to $x$ just because they yield the same result when in $x^2$,How to prove that  is not equal to  just because they yield the same result when in,-x x x^2,"I know how incredibly stupid this sounds, but bear with me. Let's take any random $x$, say $3$, and any random $-x$, say $-3$. Let's plug it into $x^2$. They will both give the same result! I know this conclusion can't be right, that because of the above, $3 = -3$. But how do we logically prove it wrong? I want to know what is logically flawed about the argument above? I know from the instance above, we can draw 2 conclusions: $x$ is really equals to $-x$. Just because a function gives the same output for 2 separate numbers doesn't mean the 2 numbers are the same. Can you please explain why conclusion 2 is the right one to come to? As an extension, can you please also disprove conclusion 1 above? Why isn't the fact that both provide identical outputs when being plugged into the same function a legitimate reason to say that both inputs are the same? And when is this line of reasoning legitimate; when is it legitimate to say that because both inputs provide the same output, they are the same? Can you explain all this as simply as possible? I'm still a beginner, and will struggle to understand any rigorous mathematical notation without explanation.","I know how incredibly stupid this sounds, but bear with me. Let's take any random $x$, say $3$, and any random $-x$, say $-3$. Let's plug it into $x^2$. They will both give the same result! I know this conclusion can't be right, that because of the above, $3 = -3$. But how do we logically prove it wrong? I want to know what is logically flawed about the argument above? I know from the instance above, we can draw 2 conclusions: $x$ is really equals to $-x$. Just because a function gives the same output for 2 separate numbers doesn't mean the 2 numbers are the same. Can you please explain why conclusion 2 is the right one to come to? As an extension, can you please also disprove conclusion 1 above? Why isn't the fact that both provide identical outputs when being plugged into the same function a legitimate reason to say that both inputs are the same? And when is this line of reasoning legitimate; when is it legitimate to say that because both inputs provide the same output, they are the same? Can you explain all this as simply as possible? I'm still a beginner, and will struggle to understand any rigorous mathematical notation without explanation.",,"['functions', 'proof-explanation', 'fake-proofs']"
47,Are global extrema necessarily local extrema?,Are global extrema necessarily local extrema?,,"Yesterday I asked a question on the existence of local extrema, and have received conflicting comments here . Now from this discussion I'm not sure whether global extrema are necessary local extrema, for a continuous function defined in a metric space. Is this a matter of style / author? or is there a definitive answer? I would appreciate any references too.","Yesterday I asked a question on the existence of local extrema, and have received conflicting comments here . Now from this discussion I'm not sure whether global extrema are necessary local extrema, for a continuous function defined in a metric space. Is this a matter of style / author? or is there a definitive answer? I would appreciate any references too.",,"['calculus', 'real-analysis', 'functions']"
48,What is the difference between $f(x_1) \geq f(x_2)$ and $(f(x_1) > f(x_2))$?,What is the difference between  and ?,f(x_1) \geq f(x_2) (f(x_1) > f(x_2)),I am studying for my math course and I come across this definition. I am really struggling to understand the difference the parentheses make in the inequality. Can somebody please explain and why? Thank you.,I am studying for my math course and I come across this definition. I am really struggling to understand the difference the parentheses make in the inequality. Can somebody please explain and why? Thank you.,,[]
49,"Let $f:\mathbb R \to \mathbb R$ be a function, such as : $3f(x+1)-2f(2-x) = x^2 + 14x - 5$. Find $f(x)$.","Let  be a function, such as : . Find .",f:\mathbb R \to \mathbb R 3f(x+1)-2f(2-x) = x^2 + 14x - 5 f(x),"Let $f:\mathbb R \to \mathbb R$ be a function, such as : $$3f(x+1)-2f(2-x) = x^2 + 14x - 5$$ Find f(x) Attempt : Let $x+1 := y \Leftrightarrow x = y-1$. Then, we get : $$3f(y) - 2f(3-y) = (y-1)^2 + 14(y-1) - 5$$ so I got $f(y)$ in the expression but still have to simplify it further. I also observed that the two arguments of the functions $f$ become equal at : $$y = 3-y \Leftrightarrow y = \frac{1}{2}$$ It should be an easy one since I found it across an Elementary Leaflet but my head has been stuck for now. Any help would be appreciated !","Let $f:\mathbb R \to \mathbb R$ be a function, such as : $$3f(x+1)-2f(2-x) = x^2 + 14x - 5$$ Find f(x) Attempt : Let $x+1 := y \Leftrightarrow x = y-1$. Then, we get : $$3f(y) - 2f(3-y) = (y-1)^2 + 14(y-1) - 5$$ so I got $f(y)$ in the expression but still have to simplify it further. I also observed that the two arguments of the functions $f$ become equal at : $$y = 3-y \Leftrightarrow y = \frac{1}{2}$$ It should be an easy one since I found it across an Elementary Leaflet but my head has been stuck for now. Any help would be appreciated !",,"['calculus', 'functions', 'functional-equations']"
50,Can a graph of a function be rotated 90 degrees and represent the same function?,Can a graph of a function be rotated 90 degrees and represent the same function?,,"I was looking at the following problem: ""If a graph of a function rotated 90 degrees about the origin, then it is not changed. Is there such a function?"" The only one I can think of if is $f(x)=0$ defined on $x=0$. Is it possible to prove that this is the only such function? I understand that due to the rotational symmetry $f(-f(x))=x$ but how do I go from here?","I was looking at the following problem: ""If a graph of a function rotated 90 degrees about the origin, then it is not changed. Is there such a function?"" The only one I can think of if is $f(x)=0$ defined on $x=0$. Is it possible to prove that this is the only such function? I understand that due to the rotational symmetry $f(-f(x))=x$ but how do I go from here?",,['functions']
51,"$f(x)=\frac{x^2 -4}{x-2}$, Can $x=2$ or not? [duplicate]",", Can  or not? [duplicate]",f(x)=\frac{x^2 -4}{x-2} x=2,"This question already has an answer here : Graphing $y = \frac{x^2-4}{x-2}$ (1 answer) Closed 6 years ago . Given: $$f(x)=\frac{x^2-4}{x-2}$$ First thoughts would be than $x\ne 2$ But since $f(x)$ can be simplified to: $$f(x)=x+2$$ It now seems than $x$ can be a solution to $f(x)$. If I graph this function I get the line $f(x)=x+2$, but it that with the point $(2,4)$ not included? My book gives an answer where $x\ne 2$","This question already has an answer here : Graphing $y = \frac{x^2-4}{x-2}$ (1 answer) Closed 6 years ago . Given: $$f(x)=\frac{x^2-4}{x-2}$$ First thoughts would be than $x\ne 2$ But since $f(x)$ can be simplified to: $$f(x)=x+2$$ It now seems than $x$ can be a solution to $f(x)$. If I graph this function I get the line $f(x)=x+2$, but it that with the point $(2,4)$ not included? My book gives an answer where $x\ne 2$",,"['algebra-precalculus', 'functions']"
52,"Finding a Mobius transformation that maps the upper half-plane to the inside of a unit-disk, such that point $i$ is mapped to $0$ and $\infty$ to $-1$","Finding a Mobius transformation that maps the upper half-plane to the inside of a unit-disk, such that point  is mapped to  and  to",i 0 \infty -1,"Finding a Mobius transformation that maps the upper half-plane $\{Im(z)>0\};z \in \mathbb{C}$ to the inside of a unit-disk, such  that point $i$ is mapped to $0$ and $\infty$ to $-1$. Okay, to be clear, I know that a Mobius transformation $w$ is of the form: $$w=\frac{az+b}{cz+d};ad-bc\neq0.$$ I am very aware of what a unit disk is. I have done assignments like finding an mobius transformation that maps some points ($\mathbb{C}$) $a,b,c$ to $d,e,f$. -Where these points were not infinity. But nothing like this problem that I have here? How is this done? I think I just need one more point and know it's picture to be able to figure is out. But how?","Finding a Mobius transformation that maps the upper half-plane $\{Im(z)>0\};z \in \mathbb{C}$ to the inside of a unit-disk, such  that point $i$ is mapped to $0$ and $\infty$ to $-1$. Okay, to be clear, I know that a Mobius transformation $w$ is of the form: $$w=\frac{az+b}{cz+d};ad-bc\neq0.$$ I am very aware of what a unit disk is. I have done assignments like finding an mobius transformation that maps some points ($\mathbb{C}$) $a,b,c$ to $d,e,f$. -Where these points were not infinity. But nothing like this problem that I have here? How is this done? I think I just need one more point and know it's picture to be able to figure is out. But how?",,"['calculus', 'complex-analysis', 'functions', 'mobius-transformation']"
53,"If $p(x)$ is a cubical polynomial with $p(1)=3,p(0)=2,p(-1)=4$, then what is $\int_{-1}^{1} p(x)dx$?","If  is a cubical polynomial with , then what is ?","p(x) p(1)=3,p(0)=2,p(-1)=4 \int_{-1}^{1} p(x)dx","Q.If $p(x)$ is a cubical polynomial with $p(1)=3,p(0)=2,p(-1)=4$ ,Then $\int_{-1}^{1} p(x)dx$ =__? My attempt: Let $p(x)$ be $ax^3+bx^2+cx+d$ $p(0)=d=2$ $p(1)=a+b+c+d=3$ $p(-1)=-a+b-c+d=4$ From them,we get $b=3.5$ , $d=2$ and $a+c=-0.5$ I could not progress any further.","Q.If is a cubical polynomial with ,Then =__? My attempt: Let be From them,we get , and I could not progress any further.","p(x) p(1)=3,p(0)=2,p(-1)=4 \int_{-1}^{1} p(x)dx p(x) ax^3+bx^2+cx+d p(0)=d=2 p(1)=a+b+c+d=3 p(-1)=-a+b-c+d=4 b=3.5 d=2 a+c=-0.5",['integration']
54,Solving $\arcsin\left(2x\sqrt{1-x^2}\right) = 2 \arcsin x$,Solving,\arcsin\left(2x\sqrt{1-x^2}\right) = 2 \arcsin x,"If we have $$\arcsin\left(2x\sqrt{1-x^2}\right) = 2 \arcsin x$$ Then, what will be the set of $x$ for which this equation is true? I tried to solve it by putting $x = \sin a$ or $\cos a$ but got no result. I am totally stuck on how to do it.","If we have Then, what will be the set of for which this equation is true? I tried to solve it by putting or but got no result. I am totally stuck on how to do it.",\arcsin\left(2x\sqrt{1-x^2}\right) = 2 \arcsin x x x = \sin a \cos a,"['functions', 'trigonometry', 'inverse']"
55,A function that is one to one but not onto $\mathbb{Z}$ to $\mathbb{N}$,A function that is one to one but not onto  to,\mathbb{Z} \mathbb{N},"Can someone please tell me if I can have a function that is one to one but not onto $\mathbb{Z}$ to $\mathbb{N}$?  I tried these formulas  \begin{align*} F(x) & = x^2+1\\  F(x) & = x^2 -1 \end{align*}  But it always gives me a function that is onto but not not one to one, and I don't want it to be like this.","Can someone please tell me if I can have a function that is one to one but not onto $\mathbb{Z}$ to $\mathbb{N}$?  I tried these formulas  \begin{align*} F(x) & = x^2+1\\  F(x) & = x^2 -1 \end{align*}  But it always gives me a function that is onto but not not one to one, and I don't want it to be like this.",,['functions']
56,Bijection from $A \rightarrow \varnothing$,Bijection from,A \rightarrow \varnothing,"My thoughts. We need to prove that: 1 $\forall x,y \in A, \text{ if } f(x) = f(y) \rightarrow x = y$ 2 $\forall y \in \varnothing, \exists x \in A,  f(x) = y$. In (1), $f(x) = f(y)$ is false, since neither $f(x)$ nor $f(y)$ have a value, so (1) is vacuously true. Also, $\forall y \in \varnothing, P(x, y)$ is vacuously true. So both statements are true. Admittedly, Does there exist a bijection between empty sets? offers some guidance, but I am unsure whether my rationale for #1 is sound.","My thoughts. We need to prove that: 1 $\forall x,y \in A, \text{ if } f(x) = f(y) \rightarrow x = y$ 2 $\forall y \in \varnothing, \exists x \in A,  f(x) = y$. In (1), $f(x) = f(y)$ is false, since neither $f(x)$ nor $f(y)$ have a value, so (1) is vacuously true. Also, $\forall y \in \varnothing, P(x, y)$ is vacuously true. So both statements are true. Admittedly, Does there exist a bijection between empty sets? offers some guidance, but I am unsure whether my rationale for #1 is sound.",,"['functions', 'elementary-set-theory']"
57,"Suppose a function is expressed by: $f(x)=f(x+1) - f(x-1)$ and $f(16)=20 , f(20)=16$ What is $f(20162016)$?",Suppose a function is expressed by:  and  What is ?,"f(x)=f(x+1) - f(x-1) f(16)=20 , f(20)=16 f(20162016)","Math quiz bee question Suppose a function is expressed by: $$f(x)=f(x+1) + f(x-1)$$   and   $$f(16)=20 , f(20)=16.$$   What is $f(20162016)$? Attempt at solution: $f(17)+f(15)=20$ $f(21)+f(19)=16$ And if I continue it, I can get the values of $f(21)$ and the other integers near it, but how can I get to the value of $f(20162016)$? This question was from a recent national quiz bee in my place, it is only for $30$ seconds. The correct answer that they said was $-36$. Edit 1: As some pointed out, I think I remembered it wrong and the question was: $$f(x)=f(x+1)+f(x-1)$$","Math quiz bee question Suppose a function is expressed by: $$f(x)=f(x+1) + f(x-1)$$   and   $$f(16)=20 , f(20)=16.$$   What is $f(20162016)$? Attempt at solution: $f(17)+f(15)=20$ $f(21)+f(19)=16$ And if I continue it, I can get the values of $f(21)$ and the other integers near it, but how can I get to the value of $f(20162016)$? This question was from a recent national quiz bee in my place, it is only for $30$ seconds. The correct answer that they said was $-36$. Edit 1: As some pointed out, I think I remembered it wrong and the question was: $$f(x)=f(x+1)+f(x-1)$$",,"['functions', 'recreational-mathematics']"
58,Asymptotic expansion of the solution of $f_n(x)=x^5+nx-1=0$,Asymptotic expansion of the solution of,f_n(x)=x^5+nx-1=0,"Let's call $u_n$ the solution (it is unique) of $f_n(x)=x^5+nx-1=0$. I'd like to find an asymptotic expansion of $u_n$ of order two. I found $$u_n=\frac{1}{n}-\frac{1}{n^6}+o(\frac{1}{n^6})$$ The method I used: We have $0 < u_n < 1$, hence $0 < n u_n =1-u_n^5 < 1$ and $\lim\limits_{n \to +\infty} u_n = 0$. Therefore $\lim\limits_{n \to +\infty} u_n^5 = 0$ and $\lim\limits_{n \to +\infty} nu_n = 1$, which provides the first term of the development. I followed with $v_n=u_n-\frac{1}{n}$ to get $(v_n+\frac{1}{n})^5+n v_n=0$. I proved that $0 < 1+ n v_n <1$ and followed to get the second term. Somehow tedious... I there a more systematic approach using calculus?","Let's call $u_n$ the solution (it is unique) of $f_n(x)=x^5+nx-1=0$. I'd like to find an asymptotic expansion of $u_n$ of order two. I found $$u_n=\frac{1}{n}-\frac{1}{n^6}+o(\frac{1}{n^6})$$ The method I used: We have $0 < u_n < 1$, hence $0 < n u_n =1-u_n^5 < 1$ and $\lim\limits_{n \to +\infty} u_n = 0$. Therefore $\lim\limits_{n \to +\infty} u_n^5 = 0$ and $\lim\limits_{n \to +\infty} nu_n = 1$, which provides the first term of the development. I followed with $v_n=u_n-\frac{1}{n}$ to get $(v_n+\frac{1}{n})^5+n v_n=0$. I proved that $0 < 1+ n v_n <1$ and followed to get the second term. Somehow tedious... I there a more systematic approach using calculus?",,"['real-analysis', 'functions', 'asymptotics', 'roots']"
59,Specific integral creating a constant,Specific integral creating a constant,,"Let's say: $${\int_{n}^{n+\frac{1}{n}}f(x) }\space\text {d}x=C$$ I am looking for some function $f$ that would create, for all $n$ values inputted, a constant $C$ to be created. What is $f(x)$? What is the $C$ value? Another way of looking at this problem (I am bad at explanations) $$\int_{2}^{2+\frac{1}{2}}f(x)\space\text{d}x=C$$ $$n=2$$ $$\int_{3}^{3+\frac{1}{3}}f(x)\space\text{d}x=C$$  $$n=3$$ $$\vdots$$  For all values of $n$, a constant comes out. And that constant is $C$. What is the function and the constant? Please non-trivial solutions are preferred.","Let's say: $${\int_{n}^{n+\frac{1}{n}}f(x) }\space\text {d}x=C$$ I am looking for some function $f$ that would create, for all $n$ values inputted, a constant $C$ to be created. What is $f(x)$? What is the $C$ value? Another way of looking at this problem (I am bad at explanations) $$\int_{2}^{2+\frac{1}{2}}f(x)\space\text{d}x=C$$ $$n=2$$ $$\int_{3}^{3+\frac{1}{3}}f(x)\space\text{d}x=C$$  $$n=3$$ $$\vdots$$  For all values of $n$, a constant comes out. And that constant is $C$. What is the function and the constant? Please non-trivial solutions are preferred.",,['functions']
60,$f(f(y)+1)=y+f(1)$ is bijective.,is bijective.,f(f(y)+1)=y+f(1),"Find all functions $f:\mathbb{R}\rightarrow\mathbb{R}$ such that $$f(xf(y)+x)=xy+f(x), \; \forall x,y \in \mathbb{R}.$$ I read a solution in finding this function. It states that setting $x=1$ gives $$f\big(f(y)+1\big)=y+f(1)\,,$$ which means $f$ is bijective. Why does $f\big(f(y)+1\big)=y+f(1)$ imply that $f$ is bijective?",Find all functions such that I read a solution in finding this function. It states that setting gives which means is bijective. Why does imply that is bijective?,"f:\mathbb{R}\rightarrow\mathbb{R} f(xf(y)+x)=xy+f(x), \; \forall x,y \in \mathbb{R}. x=1 f\big(f(y)+1\big)=y+f(1)\,, f f\big(f(y)+1\big)=y+f(1) f","['functions', 'proof-explanation', 'contest-math', 'functional-equations']"
61,Shoud a function be defined for all elements in the domain in order to be surjective/bijective?,Shoud a function be defined for all elements in the domain in order to be surjective/bijective?,,"In other words, the surjection says: for any y in the codomain there should exist x in the domain. Now, do I need for every x in the domain to have an y in the codomain for surjectivity?","In other words, the surjection says: for any y in the codomain there should exist x in the domain. Now, do I need for every x in the domain to have an y in the codomain for surjectivity?",,['functions']
62,I cannot make the mental leap from a vector to a function!,I cannot make the mental leap from a vector to a function!,,"In my linear algebra book, it says that a vector is linearly independent if $\vec V = c1*\vec T_1 + c2*\vec T_2$ And then it goes on to say that $y(t) = c1 * e^{-at} + c2*e^{-bt}$ is linearly independent My mind cannot comprehend how an analogy can be made in this case. Is there a rigorous theorem some where that says a function is an infinite dimensioned vector? Only then can I completely appreciate linear algebra. Thanks","In my linear algebra book, it says that a vector is linearly independent if $\vec V = c1*\vec T_1 + c2*\vec T_2$ And then it goes on to say that $y(t) = c1 * e^{-at} + c2*e^{-bt}$ is linearly independent My mind cannot comprehend how an analogy can be made in this case. Is there a rigorous theorem some where that says a function is an infinite dimensioned vector? Only then can I completely appreciate linear algebra. Thanks",,"['linear-algebra', 'functions', 'vector-spaces']"
63,"Counterexample to if g ◦ f is surjective, then f and g are surjective","Counterexample to if g ◦ f is surjective, then f and g are surjective",,"I want less of an answer and more of an explanation if possible please. I understand I'm looking for a range of either f and g that is NOT surjective(does not cover all the codomain), but that their composition is.","I want less of an answer and more of an explanation if possible please. I understand I'm looking for a range of either f and g that is NOT surjective(does not cover all the codomain), but that their composition is.",,"['functions', 'elementary-set-theory']"
64,How to find the inverse function of $f(x)=\frac{\sinh(\ln(\cosh x))}{\sinh x}$,How to find the inverse function of,f(x)=\frac{\sinh(\ln(\cosh x))}{\sinh x},How to find the inverse function of $f(x)=\frac{\sinh(\ln(\cosh x))}{\sinh x}$? I' ve tried the following: $y=\frac{\sinh(\ln(\cosh x))}{\sinh x}$ . Now I should express $x$ in terms of $y$. Then: $$\sinh^-1 (\sinh x) =x=\sinh ^-1( \frac{\sinh(\ln(\cosh x))}{y})$$ Now I am stuck. How shall I continue and how do I get to the solution?,How to find the inverse function of $f(x)=\frac{\sinh(\ln(\cosh x))}{\sinh x}$? I' ve tried the following: $y=\frac{\sinh(\ln(\cosh x))}{\sinh x}$ . Now I should express $x$ in terms of $y$. Then: $$\sinh^-1 (\sinh x) =x=\sinh ^-1( \frac{\sinh(\ln(\cosh x))}{y})$$ Now I am stuck. How shall I continue and how do I get to the solution?,,"['functions', 'hyperbolic-functions']"
65,How does Wolfram get from the first form to the second alternate form?,How does Wolfram get from the first form to the second alternate form?,,"So, I was trying to compute an integral but I couldn't actually manage getting anywhere with it in its initial form. So, I inserted the function in Wolfram Alpha and I really got a nicer form (second alternate form). But I want to understand how that was done, I really need some help here. Input: $\dfrac{1}{(e^t + 1)(e^t + 2)(e^t + 3)}$ Alternate forms: $\dfrac{1}{11e^t + 6e^{2t} + e^{3t} + 6}\\ -\dfrac{1}{e^t + 2} + \dfrac{1}{2(e^t + 3)} + \dfrac{1}{2(e^t + 1)} $","So, I was trying to compute an integral but I couldn't actually manage getting anywhere with it in its initial form. So, I inserted the function in Wolfram Alpha and I really got a nicer form (second alternate form). But I want to understand how that was done, I really need some help here. Input: $\dfrac{1}{(e^t + 1)(e^t + 2)(e^t + 3)}$ Alternate forms: $\dfrac{1}{11e^t + 6e^{2t} + e^{3t} + 6}\\ -\dfrac{1}{e^t + 2} + \dfrac{1}{2(e^t + 3)} + \dfrac{1}{2(e^t + 1)} $",,"['algebra-precalculus', 'functions', 'partial-fractions']"
66,Find fourth derivative of function,Find fourth derivative of function,,"The function is $\displaystyle{\frac{3x^4}{1-x}}$ and I am trying to find $\displaystyle{\frac{d^4}{dx^4}}$. However, I want to find the solution without using the quotient rule $4$ times in a row. I am unsure of the best alternate method. Any help is much appreciated.","The function is $\displaystyle{\frac{3x^4}{1-x}}$ and I am trying to find $\displaystyle{\frac{d^4}{dx^4}}$. However, I want to find the solution without using the quotient rule $4$ times in a row. I am unsure of the best alternate method. Any help is much appreciated.",,"['functions', 'derivatives']"
67,"$f(x) = \frac {ax+b}{cx+d}$ , bijection $f: \Bbb R \to\Bbb R$?",", bijection ?",f(x) = \frac {ax+b}{cx+d} f: \Bbb R \to\Bbb R,"For which $a,b,c,d \in \Bbb R$ does $f(x) = \frac {ax+b}{cx+d}$ define a bijection $f: \Bbb R \to \Bbb R$? I'm guessing I need a system of equations and I know that $cx + d \ne 0$. Thanks!","For which $a,b,c,d \in \Bbb R$ does $f(x) = \frac {ax+b}{cx+d}$ define a bijection $f: \Bbb R \to \Bbb R$? I'm guessing I need a system of equations and I know that $cx + d \ne 0$. Thanks!",,['functions']
68,How to solve this limit of a function? ($\cos^3x$),How to solve this limit of a function? (),\cos^3x,"So I'm having trouble with the following limit: $$\lim_{x\to0}{\frac{1-\cos^3x}{x\,\sin x}}$$ Sorry to bother again, but I was never good at solving limits. Really, I don't know what to do with that $\cos^3 x$.","So I'm having trouble with the following limit: $$\lim_{x\to0}{\frac{1-\cos^3x}{x\,\sin x}}$$ Sorry to bother again, but I was never good at solving limits. Really, I don't know what to do with that $\cos^3 x$.",,"['limits', 'functions', 'trigonometry']"
69,"Find 1-1 and onto mapping from {0,1}* to the integers","Find 1-1 and onto mapping from {0,1}* to the integers",,"My idea was to essentially use ordering by the length of the string (and for strings with the same length, order them is ascending order) to map a string to a number, numbers that start with a $0$ go to a negative integer and things that start with $1$ to a positive integer. The idea is that if, say, you need to figure out what $f(01)$ is, then this is what you do. $\epsilon = 0.$$ f(0) = -1.$ $f(1) = 1.$ Now take all the 2 length strings $\,00$, $01$, $10$, $11$. $00$ gets mapped to $-2.$ $f(01) = -3.$ $f(10) = 2$ and $f(11) = 3.$ And so on. HOW TO PROVE THIS IS $1-1$ AND ONTO?","My idea was to essentially use ordering by the length of the string (and for strings with the same length, order them is ascending order) to map a string to a number, numbers that start with a $0$ go to a negative integer and things that start with $1$ to a positive integer. The idea is that if, say, you need to figure out what $f(01)$ is, then this is what you do. $\epsilon = 0.$$ f(0) = -1.$ $f(1) = 1.$ Now take all the 2 length strings $\,00$, $01$, $10$, $11$. $00$ gets mapped to $-2.$ $f(01) = -3.$ $f(10) = 2$ and $f(11) = 3.$ And so on. HOW TO PROVE THIS IS $1-1$ AND ONTO?",,['functions']
70,What does $f: A \times A \to A$ mean?,What does  mean?,f: A \times A \to A,What does $f: A \times A \to A$ mean? Can you give some examples please?,What does $f: A \times A \to A$ mean? Can you give some examples please?,,"['functions', 'notation']"
71,When is $f=f^{-1}$ for $f(x)=x^3+14x-14$?,When is  for ?,f=f^{-1} f(x)=x^3+14x-14,"The function $f(x)=x^3+14x−14$ is a monotonically increasing function, hence it is injective (one-to-one), so its inverse function exists and is well defined. How many points of intersection are there between the function $f(x)$ and its inverse $f^{−1}(x)$?","The function $f(x)=x^3+14x−14$ is a monotonically increasing function, hence it is injective (one-to-one), so its inverse function exists and is well defined. How many points of intersection are there between the function $f(x)$ and its inverse $f^{−1}(x)$?",,"['algebra-precalculus', 'functions']"
