,title_raw,title_text,title_latex,body_raw,body_text,body_latex,tags
77,On the definition of the geodesic curvature and its relation to concepts from Riemannian geometry,On the definition of the geodesic curvature and its relation to concepts from Riemannian geometry,,"In the paper that can be found in this link: https://arxiv.org/pdf/1712.00082.pdf there is a definition of the geodesic curvature that I can't quite understand. Here is how this article presents it: Let $\vec{X}(s)$ be a curve on a 2D manifold in $R^3$ which is parametrized by  the arc length $s$ as shown in the following figure. Choose a vector function $\vec{V}(s)$ living in the tangent space at the position $\vec{X}(s)$ and is paralely transported along the curve. Then $k_g=\frac{d\theta}{ds}$, where $\theta$ is the angle between the velocity vector $\vec{T}=\frac{d\vec{X}(s)}{ds}$ and $\vec{V}(s)$, is defined as the geodesic curvature. The paper states that the geodesic curvature $k_g$  reflects the deviation of the curve from the local geodesics. What I don't understand are the following: $1)$ Since $\vec{T}=\frac{d\vec{X}(s)}{ds}$ and $\vec{V}(s)$ are both parallely transported along the curve(former is a velocity vector and later is given), then shouldn't the angle between them remain constant? In Riemannian geometry, when we parallel transport a vector along a curve, its angle with the velocity vector of the curve remain constant. Is it that the author might not use an affine connection that is compatible with the metric, which is the property that an affine connection needs in order to preserve lengths of vectors and angles between vectors during parallel transport? (see for example Do Carmo's Riemannian geometry, p.53 on Riemannian connections) $2)$ How does the geodesic curvature relate to the Riemannian curvature found in Riemannian geometry? Also, is it an intrinsic quantity or an extrinsic one? Finally, how does it generalize to higher-dimensional manifolds that are not embedded in higher-dimensional manifolds?","In the paper that can be found in this link: https://arxiv.org/pdf/1712.00082.pdf there is a definition of the geodesic curvature that I can't quite understand. Here is how this article presents it: Let $\vec{X}(s)$ be a curve on a 2D manifold in $R^3$ which is parametrized by  the arc length $s$ as shown in the following figure. Choose a vector function $\vec{V}(s)$ living in the tangent space at the position $\vec{X}(s)$ and is paralely transported along the curve. Then $k_g=\frac{d\theta}{ds}$, where $\theta$ is the angle between the velocity vector $\vec{T}=\frac{d\vec{X}(s)}{ds}$ and $\vec{V}(s)$, is defined as the geodesic curvature. The paper states that the geodesic curvature $k_g$  reflects the deviation of the curve from the local geodesics. What I don't understand are the following: $1)$ Since $\vec{T}=\frac{d\vec{X}(s)}{ds}$ and $\vec{V}(s)$ are both parallely transported along the curve(former is a velocity vector and later is given), then shouldn't the angle between them remain constant? In Riemannian geometry, when we parallel transport a vector along a curve, its angle with the velocity vector of the curve remain constant. Is it that the author might not use an affine connection that is compatible with the metric, which is the property that an affine connection needs in order to preserve lengths of vectors and angles between vectors during parallel transport? (see for example Do Carmo's Riemannian geometry, p.53 on Riemannian connections) $2)$ How does the geodesic curvature relate to the Riemannian curvature found in Riemannian geometry? Also, is it an intrinsic quantity or an extrinsic one? Finally, how does it generalize to higher-dimensional manifolds that are not embedded in higher-dimensional manifolds?",,"['differential-geometry', 'riemannian-geometry', 'curvature', 'connections']"
78,How does a metric tensor describe geometry on a manifold?,How does a metric tensor describe geometry on a manifold?,,"I’m fairly new to the subject to the area of differential geometry, but as I understand it, the metric tensor $g$ is a tensor field that acts on the tangent space $T_{p}M$ to each point $p$ on a (Riemannian) manifold $M$. Specifically, it is defined as a mapping $g:T_{p}M\times T_{p}M\rightarrow\mathbb{R}$ such that $(v,w)\mapsto g(v,w)$ where $v,w \in T_{p}M$. The metric tensor intuitively gives the inner product of two vectors in a vector space, and thus can be used to determine magnitudes of vectors as well as the angle between intersecting curves tangent to two tangent vectors at a given point. What I’m really unsure about is how the metric actually describes geometry on the manifold $M$? I know that one can choose a set of basis vectors adapted to a given set of coordinates on the manifold, a coordinate basis, such that the metric takes the form $$g=g_{\mu\nu}(x)dx^{\mu}\otimes dx^{\nu}\equiv g_{\mu\nu}(x)dx^{\mu}dx^{\nu}$$ where $g_{\mu\nu}(x)=g\left(\frac{\partial}{\partial x^{\mu}}, \frac{\partial}{\partial x^{\nu}}\right)$. But this just gives the metric tensor at a point. How can one use $g_{\mu\nu}(x)$ in the entire coordinate chart? Or is the point that one evaluates $g_{\mu\nu}(x)$ at each point lying within the domain of the coordinate chart?","I’m fairly new to the subject to the area of differential geometry, but as I understand it, the metric tensor $g$ is a tensor field that acts on the tangent space $T_{p}M$ to each point $p$ on a (Riemannian) manifold $M$. Specifically, it is defined as a mapping $g:T_{p}M\times T_{p}M\rightarrow\mathbb{R}$ such that $(v,w)\mapsto g(v,w)$ where $v,w \in T_{p}M$. The metric tensor intuitively gives the inner product of two vectors in a vector space, and thus can be used to determine magnitudes of vectors as well as the angle between intersecting curves tangent to two tangent vectors at a given point. What I’m really unsure about is how the metric actually describes geometry on the manifold $M$? I know that one can choose a set of basis vectors adapted to a given set of coordinates on the manifold, a coordinate basis, such that the metric takes the form $$g=g_{\mu\nu}(x)dx^{\mu}\otimes dx^{\nu}\equiv g_{\mu\nu}(x)dx^{\mu}dx^{\nu}$$ where $g_{\mu\nu}(x)=g\left(\frac{\partial}{\partial x^{\mu}}, \frac{\partial}{\partial x^{\nu}}\right)$. But this just gives the metric tensor at a point. How can one use $g_{\mu\nu}(x)$ in the entire coordinate chart? Or is the point that one evaluates $g_{\mu\nu}(x)$ at each point lying within the domain of the coordinate chart?",,"['differential-geometry', 'metric-spaces', 'riemannian-geometry']"
79,Advanced beginners textbook on Lie theory from a geometric viewpoint,Advanced beginners textbook on Lie theory from a geometric viewpoint,,"There are several questions resembling this one but none of them are quite the same I believe. I have a background in differential geometry and topology, as well as analysis (locally convex spaces). I have a very basic familiarity with lie groups since they tend to pop out quite a lot in differential geometry. Lately I found out I have a tendency to think about a lot of problems in differential geometry in terms of lie groups. Unfortunately whenever I do that kind of thing i get stuck due to a lack of solid background. I've decided to pick up a serious text on lie theory and fill this gap. I prefer a book that would help me understand the geometry better rather than the algebraic framework. Here is a list of the applications I have in mind for the theory. Recognizing homogeneous spaces, describing them in terms of coset spaces and proving stuff about them using that information. (For example the answer to this MSE question ) Spin geometry and symplectic geometry. G-bundles and gauge theory. Holonomy groups and Riemannian symmetric spaces. Prefarably the book would contain some exercise problems besides the theory.","There are several questions resembling this one but none of them are quite the same I believe. I have a background in differential geometry and topology, as well as analysis (locally convex spaces). I have a very basic familiarity with lie groups since they tend to pop out quite a lot in differential geometry. Lately I found out I have a tendency to think about a lot of problems in differential geometry in terms of lie groups. Unfortunately whenever I do that kind of thing i get stuck due to a lack of solid background. I've decided to pick up a serious text on lie theory and fill this gap. I prefer a book that would help me understand the geometry better rather than the algebraic framework. Here is a list of the applications I have in mind for the theory. Recognizing homogeneous spaces, describing them in terms of coset spaces and proving stuff about them using that information. (For example the answer to this MSE question ) Spin geometry and symplectic geometry. G-bundles and gauge theory. Holonomy groups and Riemannian symmetric spaces. Prefarably the book would contain some exercise problems besides the theory.",,"['differential-geometry', 'representation-theory', 'lie-groups', 'lie-algebras', 'book-recommendation']"
80,Sections of associated bundles,Sections of associated bundles,,"Let $\pi:P\rightarrow M$ be a Principal bundle and $\pi_V:P\times_G F\rightarrow M$ be its associated bundle via the representation $\rho:G\rightarrow GL(V)$. Fact: $\Gamma(P\times_G V)\simeq\{f:P\rightarrow V: f(pg)=\rho(g^{-1})f(p)\}=:A$ I am trying to get a better understanding of this statement. Suppose $f\in A$. We want to show that this $f$ corresponds to a unique $\sigma\in \Gamma(P\times_G V)$. So unless I'm mistaken, given $f$, we want to construct a map $\sigma:M\rightarrow P\times_G V$ such that $\pi_V\circ \sigma=\text{id}$. Based on lecture notes found here , I think the first step in this process is to define the map $F:P\rightarrow P\times_G V$ by $F=[\text{id}\times f]$. Then $F(pg)=[pg,\rho(g^{-1})f(p)]=[p,f(p)]=F(p)$ The lecture notes then say this map 'descends' to a section $\sigma:M\rightarrow P\times_G V$. I am wondering how to construct this 'descent'? Is it done by defining $\sigma=F\circ \pi^{-1}$? Does this make sense? It seems to be 'well defined' since we just take any $x\in M$ to its fiber which is then mapped uniquely to an equivalence class. Just seems a bit dodgy as $\pi^{-1}$ isn't a function per say. Conversely, if $\sigma\in \Gamma(P\times_G V)$, then $\sigma$ 'lifts' to a map $F:P\rightarrow P\times_G V$ and since $\pi_F\circ \sigma=\text{id}$, it follows that $F=\text{id}\times f$. I can't seem to get my head around this explanation of the converse argument and I am hoping someone is able to help me.","Let $\pi:P\rightarrow M$ be a Principal bundle and $\pi_V:P\times_G F\rightarrow M$ be its associated bundle via the representation $\rho:G\rightarrow GL(V)$. Fact: $\Gamma(P\times_G V)\simeq\{f:P\rightarrow V: f(pg)=\rho(g^{-1})f(p)\}=:A$ I am trying to get a better understanding of this statement. Suppose $f\in A$. We want to show that this $f$ corresponds to a unique $\sigma\in \Gamma(P\times_G V)$. So unless I'm mistaken, given $f$, we want to construct a map $\sigma:M\rightarrow P\times_G V$ such that $\pi_V\circ \sigma=\text{id}$. Based on lecture notes found here , I think the first step in this process is to define the map $F:P\rightarrow P\times_G V$ by $F=[\text{id}\times f]$. Then $F(pg)=[pg,\rho(g^{-1})f(p)]=[p,f(p)]=F(p)$ The lecture notes then say this map 'descends' to a section $\sigma:M\rightarrow P\times_G V$. I am wondering how to construct this 'descent'? Is it done by defining $\sigma=F\circ \pi^{-1}$? Does this make sense? It seems to be 'well defined' since we just take any $x\in M$ to its fiber which is then mapped uniquely to an equivalence class. Just seems a bit dodgy as $\pi^{-1}$ isn't a function per say. Conversely, if $\sigma\in \Gamma(P\times_G V)$, then $\sigma$ 'lifts' to a map $F:P\rightarrow P\times_G V$ and since $\pi_F\circ \sigma=\text{id}$, it follows that $F=\text{id}\times f$. I can't seem to get my head around this explanation of the converse argument and I am hoping someone is able to help me.",,"['differential-geometry', 'manifolds', 'lie-groups', 'principal-bundles']"
81,Why is the Riemann curvature tensor the technical expression of curvature?,Why is the Riemann curvature tensor the technical expression of curvature?,,"According to my textbook on general relativity (Sean Carrol's book) and differential geometry, the Reimann curvature tensor is the technical expression of curvature. What makes the tensor so special? Why is the Riemann curvature tensor the technical expression of curvature?","According to my textbook on general relativity (Sean Carrol's book) and differential geometry, the Reimann curvature tensor is the technical expression of curvature. What makes the tensor so special? Why is the Riemann curvature tensor the technical expression of curvature?",,['differential-geometry']
82,Equivalent definitions of vector field,Equivalent definitions of vector field,,"There are two definitions of a vector field on a smooth manifold $M$. A smooth map $V:M \rightarrow TM, \forall p \in M:V(p) \in T_p M$. A linear map $V:C^{\infty}(M) \rightarrow C^{\infty}(M), \forall f,g:V(fg)=fV(g)+gV(f)$ I can't undestand why they are equivalent. We must somehow build $2$ maps and show that their composition is $id$, but i don't have any ideas how. Please help.","There are two definitions of a vector field on a smooth manifold $M$. A smooth map $V:M \rightarrow TM, \forall p \in M:V(p) \in T_p M$. A linear map $V:C^{\infty}(M) \rightarrow C^{\infty}(M), \forall f,g:V(fg)=fV(g)+gV(f)$ I can't undestand why they are equivalent. We must somehow build $2$ maps and show that their composition is $id$, but i don't have any ideas how. Please help.",,"['differential-geometry', 'riemannian-geometry']"
83,On the definition of a geodesic in a metric space,On the definition of a geodesic in a metric space,,"I am interested in the definition of geodesics in metric spaces. A definition which seems reasonable to me is that a geodesic should locally be a distance minimizer. Wikipedia ( http://en.wikipedia.org/wiki/Geodesic#Metric_geometry ) states that this naturally leads one to define a geodesic as a curve $\gamma: I \to M$, with $I\subset \mathbb{R}$ an interval and $M$ a metric space, such that for any $t \in I$ there is a neighbourhood $J$ of $t$ so that for any $t_1, t_2 \in J$ we have $$ d(\gamma(t_1), \gamma(t_2)) = v |t_1 -t_2|, $$ where $v \geq 0$ is any constant. Am I missing something obvious? Why is it that a curve satisfying this formula is locally minimizing the distance between its points? I have no reason to think this is false, but also no intuition as to why this is true. Thank you in advance!","I am interested in the definition of geodesics in metric spaces. A definition which seems reasonable to me is that a geodesic should locally be a distance minimizer. Wikipedia ( http://en.wikipedia.org/wiki/Geodesic#Metric_geometry ) states that this naturally leads one to define a geodesic as a curve $\gamma: I \to M$, with $I\subset \mathbb{R}$ an interval and $M$ a metric space, such that for any $t \in I$ there is a neighbourhood $J$ of $t$ so that for any $t_1, t_2 \in J$ we have $$ d(\gamma(t_1), \gamma(t_2)) = v |t_1 -t_2|, $$ where $v \geq 0$ is any constant. Am I missing something obvious? Why is it that a curve satisfying this formula is locally minimizing the distance between its points? I have no reason to think this is false, but also no intuition as to why this is true. Thank you in advance!",,"['differential-geometry', 'metric-spaces']"
84,Submanifold of a regular value of a manifold with boundary,Submanifold of a regular value of a manifold with boundary,,"Question: Suppose $M$ is a smooth manifold with boundary, $N$ is a smooth manifold, and $F:M\rightarrow N$ is a smooth map. Let $S=F^{-1}(c)$, where $c\in N$ is a regular value of both $F$ and $F\left|_{\partial M}\right. $. Prove that $S$ is a smooth submanifold with boundary in $M$, with $\partial S=S\cap \partial M$. Work: OK so let $n=\dim(N)$ and $m=\dim(M)$ and let $c$ be a   regular value of both $F$ and $F\left|_{\partial M}\right.$. Then there are charts $(U,\phi)$ and $(V,\psi)$ centered at $c$ and $F(c)$ such that $c\in U$ and $F(U)\subset V$. Note that $(U,\phi)$ is a boundary chart for $M$. We have that the function $\widetilde{F}=\psi\circ F\circ\phi^{-1} $ is smooth so there is an open neighborhood $U'$ of $\phi(c)$ such that there is an smooth extension of $G$ of $\widetilde{F}$ on $U'$. Notice that we have that $G^{-1}(c)\cap H^{m}=\widetilde{F}^{-1}(c)\cap U'$. Now this is where I'm stuck, not sure where to go from here any tips?","Question: Suppose $M$ is a smooth manifold with boundary, $N$ is a smooth manifold, and $F:M\rightarrow N$ is a smooth map. Let $S=F^{-1}(c)$, where $c\in N$ is a regular value of both $F$ and $F\left|_{\partial M}\right. $. Prove that $S$ is a smooth submanifold with boundary in $M$, with $\partial S=S\cap \partial M$. Work: OK so let $n=\dim(N)$ and $m=\dim(M)$ and let $c$ be a   regular value of both $F$ and $F\left|_{\partial M}\right.$. Then there are charts $(U,\phi)$ and $(V,\psi)$ centered at $c$ and $F(c)$ such that $c\in U$ and $F(U)\subset V$. Note that $(U,\phi)$ is a boundary chart for $M$. We have that the function $\widetilde{F}=\psi\circ F\circ\phi^{-1} $ is smooth so there is an open neighborhood $U'$ of $\phi(c)$ such that there is an smooth extension of $G$ of $\widetilde{F}$ on $U'$. Notice that we have that $G^{-1}(c)\cap H^{m}=\widetilde{F}^{-1}(c)\cap U'$. Now this is where I'm stuck, not sure where to go from here any tips?",,"['differential-geometry', 'manifolds']"
85,Smooth maps (between manifolds) are continuous (comment in Barrett O'Neill's textbook),Smooth maps (between manifolds) are continuous (comment in Barrett O'Neill's textbook),,"(Needless to say, I'm a total newbie in differential geometry so I apologize if this seems rather too obvious to many of you). As a comment on his definition of smooth mapping, Barrett O'Neill in his Semi-Riemannian Geometry book states that smooth mappings are continuous. I've been thinking how to prove it, to no avail. His definition is: ""A mapping $\phi:M\longrightarrow N$ is smooth provided that for every coordinate system $\xi$ in M and $\eta$ in N the coordinate expression $\eta\circ\phi\circ\xi^{-1}$ is Euclidean smooth (and defined on an open set of $\mathbb{R}^m$ [which I assume to be $\xi(U)$ where $U$ is the domain of $\xi$] )."" In his definition of smooth manifolds the set $M$ has a topology, and the rest I assume you know (atlas, smooth overlap, etc.). Thank you very much.","(Needless to say, I'm a total newbie in differential geometry so I apologize if this seems rather too obvious to many of you). As a comment on his definition of smooth mapping, Barrett O'Neill in his Semi-Riemannian Geometry book states that smooth mappings are continuous. I've been thinking how to prove it, to no avail. His definition is: ""A mapping $\phi:M\longrightarrow N$ is smooth provided that for every coordinate system $\xi$ in M and $\eta$ in N the coordinate expression $\eta\circ\phi\circ\xi^{-1}$ is Euclidean smooth (and defined on an open set of $\mathbb{R}^m$ [which I assume to be $\xi(U)$ where $U$ is the domain of $\xi$] )."" In his definition of smooth manifolds the set $M$ has a topology, and the rest I assume you know (atlas, smooth overlap, etc.). Thank you very much.",,"['differential-geometry', 'manifolds']"
86,Need help with planning self study for learning differential/Riemannian geometry and General Relativity rigorously.,Need help with planning self study for learning differential/Riemannian geometry and General Relativity rigorously.,,"I would like to learn Mathematics for understanding GR, Differential Geometry, Riemannian Geometry and related research papers rigorously . I would like to carve out a clear path to understand these topics by listing out all the necessary prerequisites. I have undergrad Math under my belt such as: Real Analysis, Algebra, Topology and ODEs. I am missing intro to PDEs at this point. I have also created a diagram of the prerequisites in which each bubble represents a subject along with textbooks written in blue. Please take a look at the attached image/file. UG means ""Undergrad"" in the diagram. Specifically, I need help with the following questions: Is my goal (the center bubble) well defined? I know it may not be specific enough yet, but I have tried to list down some topics I am interested in RED color. Have I listed all the subjects? Am I missing any subject? Is Lie Groups worthy of mention here? Or, would it just fit under Algebra ? Is Hyperbolic Geometry worthy of mention here? Is it relevant? How do I learn it? Any textbooks for it? Would anyone please help me break down the following subjects into specific topics that are necessary for my goal: Manifolds, Riemannian Geometry, Real Analysis (grad version), PDEs (grad version), Algebra (grad version).","I would like to learn Mathematics for understanding GR, Differential Geometry, Riemannian Geometry and related research papers rigorously . I would like to carve out a clear path to understand these topics by listing out all the necessary prerequisites. I have undergrad Math under my belt such as: Real Analysis, Algebra, Topology and ODEs. I am missing intro to PDEs at this point. I have also created a diagram of the prerequisites in which each bubble represents a subject along with textbooks written in blue. Please take a look at the attached image/file. UG means ""Undergrad"" in the diagram. Specifically, I need help with the following questions: Is my goal (the center bubble) well defined? I know it may not be specific enough yet, but I have tried to list down some topics I am interested in RED color. Have I listed all the subjects? Am I missing any subject? Is Lie Groups worthy of mention here? Or, would it just fit under Algebra ? Is Hyperbolic Geometry worthy of mention here? Is it relevant? How do I learn it? Any textbooks for it? Would anyone please help me break down the following subjects into specific topics that are necessary for my goal: Manifolds, Riemannian Geometry, Real Analysis (grad version), PDEs (grad version), Algebra (grad version).",,"['differential-geometry', 'reference-request', 'soft-question', 'riemannian-geometry', 'general-relativity']"
