,title_raw,title_text,title_latex,body_raw,body_text,body_latex,tags
44,Does the curvature determine the metric?,Does the curvature determine the metric?,,"Here I asked the question whether the curvature deterined the metric. Since I am unfortunately completely new to Riemannian geometry, I wanted to ask, if somebody could give and explain a concrete example to me , as far as the following is concerned: At the MO page (as cited above) I got the following answer to the question Given a compact Riemannian manifold M, are there two metrics g1 and g2, which are not everywhere flat, such that they are not isometric to one another, but that there is a diffeomorphism which preserves the curvature? If the answer is yes: Can we chose M to be a compact 2-manifold? On the positive side, if $M$ is compact of dimension $\ge 3$ and has nowhere constant sectional curvature, then combination of results of Kulkarni and Yau show that    a diffeomorphism preserving sectional curvature is necessarily an isometry. Concerning 2-dimensional counter-examples: First of all, every surface which admits an open subset where curvature is (nonzero) constant would obviously yield a counter-example. Thus, I will assume now that curvature is nowhere constant. Kulkarni refers to Kreyszig's ""Introduction to Differential Geometry and Riemannian Geometry"", p. 164, for a counter-example attributed to  Stackel and Wangerin. You probably can get the book through interlibrary loan if you are in the US. I looked up the example in Kreyszig's ""Introduction to Differential Geometry and Riemannian Geometry"", p. 164: If we rotate the curve $x_3=\log x_1$ about the $x_3$-axis in space,  we obtain the surface of revolution $X(u_1,u_2)=(u_2\cos(u_1), u_2\sin(u_1),\log(u_2))$, $u_2>0$. This is diffeomorphic to the helicoid $X(u_1,u_2) =(u_2\cos(u_1),u_2\sin(u_1),u_1)$. I think, these manifolds are not compact (but I assumed compactness of the manifold in my question on MO). I don't understand, how to manipulate this example in order to get a compact manifold. Thank you for your help.","Here I asked the question whether the curvature deterined the metric. Since I am unfortunately completely new to Riemannian geometry, I wanted to ask, if somebody could give and explain a concrete example to me , as far as the following is concerned: At the MO page (as cited above) I got the following answer to the question Given a compact Riemannian manifold M, are there two metrics g1 and g2, which are not everywhere flat, such that they are not isometric to one another, but that there is a diffeomorphism which preserves the curvature? If the answer is yes: Can we chose M to be a compact 2-manifold? On the positive side, if $M$ is compact of dimension $\ge 3$ and has nowhere constant sectional curvature, then combination of results of Kulkarni and Yau show that    a diffeomorphism preserving sectional curvature is necessarily an isometry. Concerning 2-dimensional counter-examples: First of all, every surface which admits an open subset where curvature is (nonzero) constant would obviously yield a counter-example. Thus, I will assume now that curvature is nowhere constant. Kulkarni refers to Kreyszig's ""Introduction to Differential Geometry and Riemannian Geometry"", p. 164, for a counter-example attributed to  Stackel and Wangerin. You probably can get the book through interlibrary loan if you are in the US. I looked up the example in Kreyszig's ""Introduction to Differential Geometry and Riemannian Geometry"", p. 164: If we rotate the curve $x_3=\log x_1$ about the $x_3$-axis in space,  we obtain the surface of revolution $X(u_1,u_2)=(u_2\cos(u_1), u_2\sin(u_1),\log(u_2))$, $u_2>0$. This is diffeomorphic to the helicoid $X(u_1,u_2) =(u_2\cos(u_1),u_2\sin(u_1),u_1)$. I think, these manifolds are not compact (but I assumed compactness of the manifold in my question on MO). I don't understand, how to manipulate this example in order to get a compact manifold. Thank you for your help.",,"['differential-geometry', 'riemannian-geometry']"
45,How to Classify $2$-Plane Bundles over $S^2$?,How to Classify -Plane Bundles over ?,2 S^2,"I'm curious how one can classify the bundles over a given manifold. I recently read this paper on classifying $2$-sphere bundles over compact surfaces. A lot of the concepts went over my head since I'm still having trouble doing more ""trivial"" classifications. To get used to harder classifications, I'm hoping to get used to doing easier ones first. Thus, I'm curious how one can classify the $2$-plane bundles over $S^2$. To be honest, I'm not sure how to even approach such a problem.","I'm curious how one can classify the bundles over a given manifold. I recently read this paper on classifying $2$-sphere bundles over compact surfaces. A lot of the concepts went over my head since I'm still having trouble doing more ""trivial"" classifications. To get used to harder classifications, I'm hoping to get used to doing easier ones first. Thus, I'm curious how one can classify the $2$-plane bundles over $S^2$. To be honest, I'm not sure how to even approach such a problem.",,"['differential-geometry', 'low-dimensional-topology', 'geometric-topology']"
46,Differential operators as sections of a vector bundle,Differential operators as sections of a vector bundle,,"Most of the books which need to use differential operators in a hands on way adopt some variation of the following definition (here for simplicity I am avoiding discussion of differential operators between bundles): Defintion 1. A differential operator of order $\leq k$ on a smooth manifold $M$ is an $\mathbb{R}$ -linear map $D:C^{\infty}(M) \to C^{\infty} (M)$ such that in local coordinates it looks like $D f (p)= \sum_{i_1+...+i_n \leq k} A_{i_1 ... i_n}(p) \frac{\partial^{i_1+...+i_n} f}{\partial x_1^{i_1} ...x_n^{i_n}}|_p$ for some smooth functions $A_{i_1 ... i_n}$ . I have been searching for a different definition that  didn't employ coordinates right away, and I found the following definition in the ""Lectures on the geometry of manifolds"" by Liviu Nicolaescu and lecture notes of Misha Verbitsky (which are in Russian), which is, I believe, due to Grothendieck: Definition 2. Define differential operator of order zero to be the multiplication by a smooth function $m_f (g) = f \cdot g$ , or alternatively an operator $D$ such that the commutator $[D, m_g]=D \circ m_g - m_g \circ D$ is zero for any smooth function g. Define inductively differential operator of order $\leq k$ to be an operator $D$ such that $[D, m_g]$ is a differential operator of order $\leq k-1$ for any smooth $g$ . Denote the set of all differential operators of order $\leq k$ by $Diff^k (M)$ . Luviu's book than proves that differential operators are local in the sense that supp $D(f) \subset$ supp $f$ , which means that we can restrict those operators to  open subsets of $M$ , as is usually done to show that differential forms form a sheaf if one starts with top-down approach thinking of differential forms as alternating $C^{\infty}(M)$ multilinear maps of vector fields. This naturally brings me to the first question: Shouldn't the second definition be modified so that a differential operator is a sheaf homomorphism instead of just being a linear map between globally defined functions? Misha later on in his notes shows in a series of exercises, that if one defines the symbol algebra $\oplus S^i := \oplus \frac{Diff^i(M)}{Diff^{i-1}(M)}$ , which is an algebra over $C^{\infty}(M)$ , then it is isomorphic to $Sym^{\bullet} \mathfrak{X}$ - symmetric algebra over the vector fields. Finally he asks the reader to prove that for the case $M=\mathbb{R}^n$ we have an isomorphism of algebras $Diff^k(\mathbb{R}^n) \cong \oplus_{i \leq k} Sym^i \mathfrak{X(\mathbb{R}^n)}$ , which is basically the local form of the first definition. The latter algebra is just the space of global sections of the bundle $\oplus_{i \leq k} Sym^i (T \mathbb{R}^n)$ , which brings me to my second question: Can a differential operator of order $\leq k$ on M be thought of as a global section of some bundle of ""differential operators""? By the usual correspondence, that would imply that differential operators of order $\leq k$ form a locally trivial sheaf of $C^{\infty}(M)$ modules. Misha says that this is indeed the case in the last problem of his problem set, but I can't make a rigorous proof of it and I am asking for a reference where this approach is presented in detail. I am also puzzled by the fact that it is not usually mentioned in most of the references I've looked at that differential operators can be thought of as sections of some bundle, which seems to be very fundamental from a differential-geometric perspective. Moreover, this approach can further be developed into a very elegant treatment of the symbol.","Most of the books which need to use differential operators in a hands on way adopt some variation of the following definition (here for simplicity I am avoiding discussion of differential operators between bundles): Defintion 1. A differential operator of order on a smooth manifold is an -linear map such that in local coordinates it looks like for some smooth functions . I have been searching for a different definition that  didn't employ coordinates right away, and I found the following definition in the ""Lectures on the geometry of manifolds"" by Liviu Nicolaescu and lecture notes of Misha Verbitsky (which are in Russian), which is, I believe, due to Grothendieck: Definition 2. Define differential operator of order zero to be the multiplication by a smooth function , or alternatively an operator such that the commutator is zero for any smooth function g. Define inductively differential operator of order to be an operator such that is a differential operator of order for any smooth . Denote the set of all differential operators of order by . Luviu's book than proves that differential operators are local in the sense that supp supp , which means that we can restrict those operators to  open subsets of , as is usually done to show that differential forms form a sheaf if one starts with top-down approach thinking of differential forms as alternating multilinear maps of vector fields. This naturally brings me to the first question: Shouldn't the second definition be modified so that a differential operator is a sheaf homomorphism instead of just being a linear map between globally defined functions? Misha later on in his notes shows in a series of exercises, that if one defines the symbol algebra , which is an algebra over , then it is isomorphic to - symmetric algebra over the vector fields. Finally he asks the reader to prove that for the case we have an isomorphism of algebras , which is basically the local form of the first definition. The latter algebra is just the space of global sections of the bundle , which brings me to my second question: Can a differential operator of order on M be thought of as a global section of some bundle of ""differential operators""? By the usual correspondence, that would imply that differential operators of order form a locally trivial sheaf of modules. Misha says that this is indeed the case in the last problem of his problem set, but I can't make a rigorous proof of it and I am asking for a reference where this approach is presented in detail. I am also puzzled by the fact that it is not usually mentioned in most of the references I've looked at that differential operators can be thought of as sections of some bundle, which seems to be very fundamental from a differential-geometric perspective. Moreover, this approach can further be developed into a very elegant treatment of the symbol.","\leq k M \mathbb{R} D:C^{\infty}(M) \to C^{\infty} (M) D f (p)= \sum_{i_1+...+i_n \leq k} A_{i_1 ... i_n}(p) \frac{\partial^{i_1+...+i_n} f}{\partial x_1^{i_1} ...x_n^{i_n}}|_p A_{i_1 ... i_n} m_f (g) = f \cdot g D [D, m_g]=D \circ m_g - m_g \circ D \leq k D [D, m_g] \leq k-1 g \leq k Diff^k (M) D(f) \subset f M C^{\infty}(M) \oplus S^i := \oplus \frac{Diff^i(M)}{Diff^{i-1}(M)} C^{\infty}(M) Sym^{\bullet} \mathfrak{X} M=\mathbb{R}^n Diff^k(\mathbb{R}^n) \cong \oplus_{i \leq k} Sym^i \mathfrak{X(\mathbb{R}^n)} \oplus_{i \leq k} Sym^i (T \mathbb{R}^n) \leq k \leq k C^{\infty}(M)","['differential-geometry', 'partial-differential-equations']"
47,Intuition of Chern-Weil theory,Intuition of Chern-Weil theory,,"Let $ P \rightarrow M$ be a $G$-principal bundle. The lie algebra of $G$ is $\frak{g}$ and $P$ has connection form $\omega \in H^1(P,\frak{g})$ and curvature form $\Omega \in H^2(P,\frak{g})$. We consider $I^*(G)$ the set of invariant polynomials of $G$ ie the multilinear functions $f: \frak{g} \times ... \times \frak{g} \rightarrow \mathbb{R}$ satsifying $f(Ad(g)X_1,...,Ad(g)X_k) = f(X_1,...,X_n)$ for all $g \in G$ with $Ad(g) = (R_g)_*$ the map induced on $\frak{g}$ by the right multiplication with an element of $G$. It turns out very surprisingly that 1)the form $f(\Omega)(V_1,...,V_{2k}) = f(\Omega(V_1,V_2),...,\Omega(V_{2k-1},V_{2k}))$ can be projected to a form in $H^{2k}(M)$ is independant of the choice of connection for $P$ and 2) in the case of the $GL(n,\mathbb{K})$-bundle (with $\mathbb{K} = \mathbb{R} $ or $ \mathbb{C}$) associated to a vector bundle this form represents a characteristic class of the bundle. My problem is that I have read proofs of the statements but I do not feel I understand why they are true. In other words, what made Chern and Weil expect that this construction would yeild characteristic classes?","Let $ P \rightarrow M$ be a $G$-principal bundle. The lie algebra of $G$ is $\frak{g}$ and $P$ has connection form $\omega \in H^1(P,\frak{g})$ and curvature form $\Omega \in H^2(P,\frak{g})$. We consider $I^*(G)$ the set of invariant polynomials of $G$ ie the multilinear functions $f: \frak{g} \times ... \times \frak{g} \rightarrow \mathbb{R}$ satsifying $f(Ad(g)X_1,...,Ad(g)X_k) = f(X_1,...,X_n)$ for all $g \in G$ with $Ad(g) = (R_g)_*$ the map induced on $\frak{g}$ by the right multiplication with an element of $G$. It turns out very surprisingly that 1)the form $f(\Omega)(V_1,...,V_{2k}) = f(\Omega(V_1,V_2),...,\Omega(V_{2k-1},V_{2k}))$ can be projected to a form in $H^{2k}(M)$ is independant of the choice of connection for $P$ and 2) in the case of the $GL(n,\mathbb{K})$-bundle (with $\mathbb{K} = \mathbb{R} $ or $ \mathbb{C}$) associated to a vector bundle this form represents a characteristic class of the bundle. My problem is that I have read proofs of the statements but I do not feel I understand why they are true. In other words, what made Chern and Weil expect that this construction would yeild characteristic classes?",,"['differential-geometry', 'algebraic-topology', 'characteristic-classes', 'principal-bundles']"
48,Closed space curves of constant curvature,Closed space curves of constant curvature,,"Which closed space curves of constant curvature are there? Two families spring to mind: circles and closed helices around a torus (both having - in addition - constant torsion) . What other families of curves of constant curvature are there? Are there especially knots of constant curvature? Can - for example - the trefoil knot be realized by a curve of constant curvature? Added : If it were possible to wind a curve around a cylinder, and to bend the cylinder back to itself - while keeping the curvature of the helix constant by appropriate adjustments -, thus forming an eventually arbitrarily knotted torus with a closed helix on it, one could have every knot as a curve of constant curvature. The paper Knots of Constant Curvature might be related to this point of view. It is interesting, but it is not exactly what I am looking for.","Which closed space curves of constant curvature are there? Two families spring to mind: circles and closed helices around a torus (both having - in addition - constant torsion) . What other families of curves of constant curvature are there? Are there especially knots of constant curvature? Can - for example - the trefoil knot be realized by a curve of constant curvature? Added : If it were possible to wind a curve around a cylinder, and to bend the cylinder back to itself - while keeping the curvature of the helix constant by appropriate adjustments -, thus forming an eventually arbitrarily knotted torus with a closed helix on it, one could have every knot as a curve of constant curvature. The paper Knots of Constant Curvature might be related to this point of view. It is interesting, but it is not exactly what I am looking for.",,['differential-geometry']
49,Pushforward of inverse map at the identity?,Pushforward of inverse map at the identity?,,"Let $G$ be a Lie group and $i:G \rightarrow G$ denote the inversion map $i(x) = x^{-1}$ . (Notation: $f_*$ is the pushforward map $F_*:T_pG \rightarrow T_{i(p)}G$ which takes $(F_{*}X)(f)=X(f\circ F)$ and $X$ is a tangent vector, $X\in T_pG$ .) I wish to show that $i_{*}:T_{e}G\rightarrow T_{e}G$ is given by $i_{*}(X)=-X$ As a first step, it is trivial to prove that $i_*$ is an involution as $\mbox{Id}_{*}=(i\circ i)_{*}=i_{*}\circ i_{*}$ but I can't seem to make any further progress. Any help would be appreciated.","Let be a Lie group and denote the inversion map . (Notation: is the pushforward map which takes and is a tangent vector, .) I wish to show that is given by As a first step, it is trivial to prove that is an involution as but I can't seem to make any further progress. Any help would be appreciated.",G i:G \rightarrow G i(x) = x^{-1} f_* F_*:T_pG \rightarrow T_{i(p)}G (F_{*}X)(f)=X(f\circ F) X X\in T_pG i_{*}:T_{e}G\rightarrow T_{e}G i_{*}(X)=-X i_* \mbox{Id}_{*}=(i\circ i)_{*}=i_{*}\circ i_{*},"['differential-geometry', 'lie-groups', 'pushforward']"
50,Topological rings which are manifolds,Topological rings which are manifolds,,"Is the following statement true: ""Every smooth manifold $M$, which is a ring in the category of manifolds, must be diffeomorphic to $\mathbb{R}^n$.""? (Actually, homeomorphic would suffice.) I assume manifolds to be Hausdorff, second-countable and positive-dimensional, to exclude finite rings. I have strong feelings that this must be the case. Is there a ""simple"" proof of it? I know next to nothing about the theory of Lie groups, so any argument using these would have to be simple for me to understand it. On the other hand, I feel quite comfortable with ""standard"" algebraic topology (elementary homotopy theory, homology, cohomology rings and so on...). Edit: I am very sorry for not making this clear the first time, but I assume all manifolds to be without boundary.","Is the following statement true: ""Every smooth manifold $M$, which is a ring in the category of manifolds, must be diffeomorphic to $\mathbb{R}^n$.""? (Actually, homeomorphic would suffice.) I assume manifolds to be Hausdorff, second-countable and positive-dimensional, to exclude finite rings. I have strong feelings that this must be the case. Is there a ""simple"" proof of it? I know next to nothing about the theory of Lie groups, so any argument using these would have to be simple for me to understand it. On the other hand, I feel quite comfortable with ""standard"" algebraic topology (elementary homotopy theory, homology, cohomology rings and so on...). Edit: I am very sorry for not making this clear the first time, but I assume all manifolds to be without boundary.",,"['algebraic-topology', 'differential-geometry', 'topological-groups']"
51,Using Stokes' theorem to define the exterior derivative operator,Using Stokes' theorem to define the exterior derivative operator,,"In the excellent paper ""Differential forms and integration"" by Terence Tao, the author has mentioned that ""... one can view Stokes' theorem as a definition of the derivative operation $\omega\rightarrow d\omega$,  thus differentiation is the adjoint of the boundary operation"". My question is how exactly (rigorously) can one define the exterior derivative via Stokes' theorem? Where can I read about that in detail?","In the excellent paper ""Differential forms and integration"" by Terence Tao, the author has mentioned that ""... one can view Stokes' theorem as a definition of the derivative operation $\omega\rightarrow d\omega$,  thus differentiation is the adjoint of the boundary operation"". My question is how exactly (rigorously) can one define the exterior derivative via Stokes' theorem? Where can I read about that in detail?",,['differential-geometry']
52,Are $T\mathbb{S}^2$ and $\mathbb{S}^2 \times \mathbb{R}^2$ different?,Are  and  different?,T\mathbb{S}^2 \mathbb{S}^2 \times \mathbb{R}^2,"I have seen the claim that $T\mathbb{S}^2$ and $\mathbb{S}^2 \times \mathbb{R}^2$ are not diffeomorphic, but I have only ever seen the proof that they are not isomorphic as vector bundles (which is a cute application of the hairy ball theorem). How would I prove that they are indeed not diffeomorphic (or better, not homeomorphic)?","I have seen the claim that and are not diffeomorphic, but I have only ever seen the proof that they are not isomorphic as vector bundles (which is a cute application of the hairy ball theorem). How would I prove that they are indeed not diffeomorphic (or better, not homeomorphic)?",T\mathbb{S}^2 \mathbb{S}^2 \times \mathbb{R}^2,"['differential-geometry', 'algebraic-topology', 'tangent-bundle']"
53,Taylor's theorem on manifold,Taylor's theorem on manifold,,"Taylor's theorem for real-valued functions on manifolds is straightforward, and doesn't even require anything beyond differential structure. How does Taylor's theorem work for manifold-valued functions? Suppose you have a function $f:\mathbb{R}\to M$, where $M$ is a manifold (i.e., $f$ is a curve on $M$). Is there some notion of a Taylor's theorem on $M$, i.e., a way to write $f(t)$ only in terms of $f$ and its derivatives at $t=0$? I assume at minimum $M$ needs a connection, since otherwise I'm not sure how to even define the second and higher-order derivatives of $f$. With a metric one can define a ""first-order approximation"" of $f$ by $$f(t) \approx \exp_{f(0)} \left[t f'(0)\right]$$ but what would the higher-order approximations look like?","Taylor's theorem for real-valued functions on manifolds is straightforward, and doesn't even require anything beyond differential structure. How does Taylor's theorem work for manifold-valued functions? Suppose you have a function $f:\mathbb{R}\to M$, where $M$ is a manifold (i.e., $f$ is a curve on $M$). Is there some notion of a Taylor's theorem on $M$, i.e., a way to write $f(t)$ only in terms of $f$ and its derivatives at $t=0$? I assume at minimum $M$ needs a connection, since otherwise I'm not sure how to even define the second and higher-order derivatives of $f$. With a metric one can define a ""first-order approximation"" of $f$ by $$f(t) \approx \exp_{f(0)} \left[t f'(0)\right]$$ but what would the higher-order approximations look like?",,"['differential-geometry', 'taylor-expansion']"
54,Parallel Transport - Path independence,Parallel Transport - Path independence,,"I'm trying to solve this problem: Prove that if the parallel transport is path independent, i.e., given two points $p,q \in S$ the parallel transport from $p$ to $q$ is the same, no matter the curve chosen, then the Gaussian curvature of the surface must be zero. What I have is: Given the points $p, q \in S$, Let $\alpha : I \rightarrow S$ and $\beta : I \rightarrow S$ be two curves, which $\alpha(0) = p = \beta(0)$ and $\alpha(t_1) = q = \beta(t_2)$. And $w_{\alpha}(t)$ a parallel vector field along $\alpha$ and $w_{\beta}(t)$ a parallel vector field along $\beta$ such that $w_0 = w_\alpha(0) = w_\beta(0)$. Since parallel transport is the same at point $q$ then, must be $w_\alpha(t_1) = w_\beta(t_2)$. And also we have that $D_{\alpha'(t)}w_\alpha = D_{\beta'(t)}w_\beta = 0$ My idea is to prove that the Christoffel symbols are all zero, and consequently K = 0. Is that the right approach here? I also ask to not use the concepts of Riemannian Manifolds, tensor calculus, if possible. Thank you","I'm trying to solve this problem: Prove that if the parallel transport is path independent, i.e., given two points $p,q \in S$ the parallel transport from $p$ to $q$ is the same, no matter the curve chosen, then the Gaussian curvature of the surface must be zero. What I have is: Given the points $p, q \in S$, Let $\alpha : I \rightarrow S$ and $\beta : I \rightarrow S$ be two curves, which $\alpha(0) = p = \beta(0)$ and $\alpha(t_1) = q = \beta(t_2)$. And $w_{\alpha}(t)$ a parallel vector field along $\alpha$ and $w_{\beta}(t)$ a parallel vector field along $\beta$ such that $w_0 = w_\alpha(0) = w_\beta(0)$. Since parallel transport is the same at point $q$ then, must be $w_\alpha(t_1) = w_\beta(t_2)$. And also we have that $D_{\alpha'(t)}w_\alpha = D_{\beta'(t)}w_\beta = 0$ My idea is to prove that the Christoffel symbols are all zero, and consequently K = 0. Is that the right approach here? I also ask to not use the concepts of Riemannian Manifolds, tensor calculus, if possible. Thank you",,"['differential-geometry', 'surfaces']"
