,title_raw,title_text,title_latex,body_raw,body_text,body_latex,tags
0,Bijective check with matrix,Bijective check with matrix,,My book doesn't cover the criterion for bijective transformations very well. I just want to check my understanding: is this statement true? Let F be a linear transformation. Let A be the matrix that represents that transformation (which means that that $F(v)=Av$ for any vector $v$). We now have that F is bijective iff $\det(A)\not=0$.,My book doesn't cover the criterion for bijective transformations very well. I just want to check my understanding: is this statement true? Let F be a linear transformation. Let A be the matrix that represents that transformation (which means that that $F(v)=Av$ for any vector $v$). We now have that F is bijective iff $\det(A)\not=0$.,,['linear-algebra']
1,Derivative of a map involving the matrix inverse,Derivative of a map involving the matrix inverse,,"I have $f: U\rightarrow \mathbb{R}$, $f(X):=\operatorname{tr}(X^{-1})$, $U$ contains all matrices $X$, which are  positive definite and symmetric. I want to show that $f$ is differentiable on $U$. To do so, I have to figure out  $f(X+tY)=\operatorname{tr}[(X+tY)^{-1}]=\operatorname{tr}[ (X(I-(-t)X^{-1}Y))^{-1}]$ Now it is: $(X(I-(-t)X^{-1}Y))^{-1}=\sum_{i=0}^{\infty}(-t)^{i}(X^{-1}Y)^{i}X^{-1}$. This is the point where I get stuck.  The first term of the series vanishes with $\operatorname{tr}[X]$, when it comes to the derivation. But how can I fix the rest?","I have $f: U\rightarrow \mathbb{R}$, $f(X):=\operatorname{tr}(X^{-1})$, $U$ contains all matrices $X$, which are  positive definite and symmetric. I want to show that $f$ is differentiable on $U$. To do so, I have to figure out  $f(X+tY)=\operatorname{tr}[(X+tY)^{-1}]=\operatorname{tr}[ (X(I-(-t)X^{-1}Y))^{-1}]$ Now it is: $(X(I-(-t)X^{-1}Y))^{-1}=\sum_{i=0}^{\infty}(-t)^{i}(X^{-1}Y)^{i}X^{-1}$. This is the point where I get stuck.  The first term of the series vanishes with $\operatorname{tr}[X]$, when it comes to the derivation. But how can I fix the rest?",,"['linear-algebra', 'derivatives']"
2,Is there a name for a block-diagonal matrix with blocks of the form $\begin{pmatrix} 0 & a \\ -a & 0 \end{pmatrix}$?,Is there a name for a block-diagonal matrix with blocks of the form ?,\begin{pmatrix} 0 & a \\ -a & 0 \end{pmatrix},"Is there a name for a real square matrix of the form $$\begin{pmatrix} 0 & a_1 \\ -a_1 & 0 \\ & & 0 & a_2 \\ & & -a_2 & 0 \\ & & & & \ddots \\ & & & & & 0 & a_k \\ & & & & & -a_k & 0 \end{pmatrix}$$ optionally with one or more additional rows/columns of 0? For example, analogous to the fact that a real symmetric matrix is orthogonally equivalent to a real diagonal matrix, we can show that a real skew-symmetric matrix is orthogonally equivalent to a matrix of the form above.","Is there a name for a real square matrix of the form $$\begin{pmatrix} 0 & a_1 \\ -a_1 & 0 \\ & & 0 & a_2 \\ & & -a_2 & 0 \\ & & & & \ddots \\ & & & & & 0 & a_k \\ & & & & & -a_k & 0 \end{pmatrix}$$ optionally with one or more additional rows/columns of 0? For example, analogous to the fact that a real symmetric matrix is orthogonally equivalent to a real diagonal matrix, we can show that a real skew-symmetric matrix is orthogonally equivalent to a matrix of the form above.",,"['linear-algebra', 'matrices']"
3,In a finite dimensional vector space a positive operator can have infinitely many square roots,In a finite dimensional vector space a positive operator can have infinitely many square roots,,"""In a finite dimensional vector space a identity operator (which is positive) can have infinitely many square roots"". I see only $2 ^ {C(n,2)}$ when dimension is $n (>1)$ by swapping two basis elements. Where am I wrong ?","""In a finite dimensional vector space a identity operator (which is positive) can have infinitely many square roots"". I see only $2 ^ {C(n,2)}$ when dimension is $n (>1)$ by swapping two basis elements. Where am I wrong ?",,['linear-algebra']
4,What is the name for a vector with a single non-zero component?,What is the name for a vector with a single non-zero component?,,"What do you call a vector with a single component, e.g. $[a, 0, ..., 0]$ or $[0, b, 0, ..., 0]$, where $a, b$ are any non-zero number? I'd like the language to differentiate from a vector with many components, e.g. $[a, b, 0, c, 0]$.","What do you call a vector with a single component, e.g. $[a, 0, ..., 0]$ or $[0, b, 0, ..., 0]$, where $a, b$ are any non-zero number? I'd like the language to differentiate from a vector with many components, e.g. $[a, b, 0, c, 0]$.",,"['linear-algebra', 'vector-spaces', 'convention']"
5,Why is $\det(A - \lambda I)$ zero?,Why is  zero?,\det(A - \lambda I),"I was reading over some notes of mine from the Linear Algebra class I took a while ago in order to prepare myself for Computer Graphics course I'll be taking this Fall and I ran across a sentence that I can't quite grasp. It states that Since we have a non-zero vector $x$ in the nullspace of $A - \lambda I$, then $\det(A - \lambda I) = 0$. From reading Wikipedia page on determinants I got that ... the system has a unique solution exactly when the determinant is nonzero; when the determinant is zero there are either no solutions or many solutions. So if we have vector $x$ in the nullspace of $A-\lambda I$, then we have either 0 solutions or many solutions. But I still don't understand why $\det(A - \lambda I)$ has to be equal zero?","I was reading over some notes of mine from the Linear Algebra class I took a while ago in order to prepare myself for Computer Graphics course I'll be taking this Fall and I ran across a sentence that I can't quite grasp. It states that Since we have a non-zero vector $x$ in the nullspace of $A - \lambda I$, then $\det(A - \lambda I) = 0$. From reading Wikipedia page on determinants I got that ... the system has a unique solution exactly when the determinant is nonzero; when the determinant is zero there are either no solutions or many solutions. So if we have vector $x$ in the nullspace of $A-\lambda I$, then we have either 0 solutions or many solutions. But I still don't understand why $\det(A - \lambda I)$ has to be equal zero?",,"['linear-algebra', 'matrices', 'characteristic-polynomial']"
6,Real Symmetric Matrices,Real Symmetric Matrices,,"Let $A$ be a real, symmetric, $n$ x $n$ matrix. Suppose $A^m=I$ for some $m$. Prove $A^2=I$. I think I want to use the symmetric implies diagonalizability...and take powers from there...correct?","Let $A$ be a real, symmetric, $n$ x $n$ matrix. Suppose $A^m=I$ for some $m$. Prove $A^2=I$. I think I want to use the symmetric implies diagonalizability...and take powers from there...correct?",,['linear-algebra']
7,Pseudo inverse of a product of two matrices with different rank,Pseudo inverse of a product of two matrices with different rank,,"Let $V$ be an $n \times n$ symmetric, positive definite matrix (of rank $n$). Let $X$ be an $n \times p$ matrix of rank $p$. Define $A^- = (A^\top A)^{-1} A^\top$ as the pseudo inverse of $A$ when $A$ is of full column rank. Note that $V^- = V^{-1}$ because $V$ is invertible. I'd like to prove that $$ (VX)^- = X^- V^{-1} $$ but the only theorem I know about the pseudo-inverses of products requires that both of the matrices be of the same rank AND that the second matrix has full row rank. (To wit: If $B$ is an $m \times r$ matrix of rank $r$ and $C$ is an $r \times m$  matrix of rank $r$, then $(BC)^- = C^-B^-$.) There is likely something obvious I'm missing. Any clues?","Let $V$ be an $n \times n$ symmetric, positive definite matrix (of rank $n$). Let $X$ be an $n \times p$ matrix of rank $p$. Define $A^- = (A^\top A)^{-1} A^\top$ as the pseudo inverse of $A$ when $A$ is of full column rank. Note that $V^- = V^{-1}$ because $V$ is invertible. I'd like to prove that $$ (VX)^- = X^- V^{-1} $$ but the only theorem I know about the pseudo-inverses of products requires that both of the matrices be of the same rank AND that the second matrix has full row rank. (To wit: If $B$ is an $m \times r$ matrix of rank $r$ and $C$ is an $r \times m$  matrix of rank $r$, then $(BC)^- = C^-B^-$.) There is likely something obvious I'm missing. Any clues?",,"['linear-algebra', 'matrices', 'inverse']"
8,A function from a matrix to its characteristic polynomial.,A function from a matrix to its characteristic polynomial.,,"Maybe it's a known fact, but I would like to know whether the function sending a square matrix of order $n$ to its characteristic polynomial is continuous. If this is true, there are some resources where I can find this? Thanks in advance.","Maybe it's a known fact, but I would like to know whether the function sending a square matrix of order to its characteristic polynomial is continuous. If this is true, there are some resources where I can find this? Thanks in advance.",n,"['linear-algebra', 'abstract-algebra', 'polynomials', 'continuity', 'characteristic-polynomial']"
9,Proving an invertible matrix which is its own inverse has determinant $1$ or $-1$ [duplicate],Proving an invertible matrix which is its own inverse has determinant  or  [duplicate],1 -1,This question already has answers here : Prove that an involutory matrix has eigenvalues $\pm 1$ (6 answers) Closed 5 years ago . Let A be an invertible $n \times n$ matrix whose inverse is itself. Prove that $\det(A)$ is either $1$ or $-1$. I'm really lost in class. I don't even know where to start. Please help.,This question already has answers here : Prove that an involutory matrix has eigenvalues $\pm 1$ (6 answers) Closed 5 years ago . Let A be an invertible $n \times n$ matrix whose inverse is itself. Prove that $\det(A)$ is either $1$ or $-1$. I'm really lost in class. I don't even know where to start. Please help.,,"['linear-algebra', 'matrices', 'determinant', 'involutions']"
10,Finding trace and determinant of linear operator,Finding trace and determinant of linear operator,,"I've got the following question Consider the linear operator of left multiplication by an $m \times m$ matrix $A$ on the vector space of all $m \times m$ matrices. Determine the trace and determinant of this operator. I'm a bit stuck as to how to even begin, I know this is going to involve eigenvalues/vectors and that if $\lambda_1, \lambda_2, ... ,\lambda_m$ are the $m$ roots of the characteristic polynomial of an $m \times m$ matrix $A$, then: $\det(A) = \lambda_1 ... \lambda_m$ and $\text{trace}(A) = \lambda_1 + ... + \lambda_m$ But obviously not all $m \times m$ matrices have $m$ eigenvalues so I'm really stuck on this question. Thanks!","I've got the following question Consider the linear operator of left multiplication by an $m \times m$ matrix $A$ on the vector space of all $m \times m$ matrices. Determine the trace and determinant of this operator. I'm a bit stuck as to how to even begin, I know this is going to involve eigenvalues/vectors and that if $\lambda_1, \lambda_2, ... ,\lambda_m$ are the $m$ roots of the characteristic polynomial of an $m \times m$ matrix $A$, then: $\det(A) = \lambda_1 ... \lambda_m$ and $\text{trace}(A) = \lambda_1 + ... + \lambda_m$ But obviously not all $m \times m$ matrices have $m$ eigenvalues so I'm really stuck on this question. Thanks!",,['linear-algebra']
11,Intuition about Hyperplane,Intuition about Hyperplane,,"I'm having a hard time understanding hyperplane ideas. So, can anyone explain to me how to easily understand what a Hyperplane is ?","I'm having a hard time understanding hyperplane ideas. So, can anyone explain to me how to easily understand what a Hyperplane is ?",,"['linear-algebra', 'geometry', 'matrices', 'intuition']"
12,"Properties of sum of real symmetric, positive semi-definite matrices","Properties of sum of real symmetric, positive semi-definite matrices",,I have two correlation matrices A and B. They are: Real symmetric (with ones on the diagonal) Positive semi-definite (eigenvalues are $\ge 0$) I want to try to prove that the average of these two matrices $C={1\over2}A + {1\over2}B$ still has the same properties. It was a few years since my linear algebra courses and would like some help along the way here. I am assuming it's possible as I have tested it numerically and for my 5000 randomly generated correlation matrices the property holds (at least within machine precision). Grateful for any kind of help!,I have two correlation matrices A and B. They are: Real symmetric (with ones on the diagonal) Positive semi-definite (eigenvalues are $\ge 0$) I want to try to prove that the average of these two matrices $C={1\over2}A + {1\over2}B$ still has the same properties. It was a few years since my linear algebra courses and would like some help along the way here. I am assuming it's possible as I have tested it numerically and for my 5000 randomly generated correlation matrices the property holds (at least within machine precision). Grateful for any kind of help!,,"['linear-algebra', 'numerical-linear-algebra']"
13,Finding range of a linear transformation,Finding range of a linear transformation,,"Define $T: \mathbb{R}^3 \rightarrow \mathbb{R}^2$ by $T(x,y,z) = (2y + z, x-z)$. Find $\mbox{ker}(T)$ and $\mbox{range}(T)$ I could find the kernel easy enough, and ended up getting $\{(-2x, x, -2x) : x \in \mathbb{R}\}$ but I don't really know how the get the range. In this case isn't the range effectively just the set with elements satisfying the equation $T$? I'm not really sure what the question is wanting to be honest. Some help would be great. Thanks","Define $T: \mathbb{R}^3 \rightarrow \mathbb{R}^2$ by $T(x,y,z) = (2y + z, x-z)$. Find $\mbox{ker}(T)$ and $\mbox{range}(T)$ I could find the kernel easy enough, and ended up getting $\{(-2x, x, -2x) : x \in \mathbb{R}\}$ but I don't really know how the get the range. In this case isn't the range effectively just the set with elements satisfying the equation $T$? I'm not really sure what the question is wanting to be honest. Some help would be great. Thanks",,['linear-algebra']
14,Is the identity matrix an elementary matrix?,Is the identity matrix an elementary matrix?,,"My reasoning is yes, as you can switch row i with row i in the matrix... But I'm not sure if it's a ""legal"" elementary operation to switch a row with itself.","My reasoning is yes, as you can switch row i with row i in the matrix... But I'm not sure if it's a ""legal"" elementary operation to switch a row with itself.",,"['linear-algebra', 'matrices']"
15,What's the difference between Jordan and Schur decomposition?,What's the difference between Jordan and Schur decomposition?,,"They both seems to decompose a square matrix into a upper triangular matrix, but what's the fundamental difference between these two decompositions? Thanks!","They both seems to decompose a square matrix into a upper triangular matrix, but what's the fundamental difference between these two decompositions? Thanks!",,"['linear-algebra', 'matrices']"
16,Show that the minimum eigenvalue of a Hermitian matrix $A$ is less than or equal to the smallest diagonal element of $A$,Show that the minimum eigenvalue of a Hermitian matrix  is less than or equal to the smallest diagonal element of,A A,"I have a following question: Let $A \in  C^{n\times n}$ be Hermitian and $\lambda_\min$ be the smallest eigenvalue of $A$ , i.e., $\lambda_\min = \min\{\lambda_1, \ldots, \lambda_n\}$ . Show that $\lambda_{\min} \leq \min_j a_{j}$ . Hint: use the properties of the Rayleigh quotient. I got started with the problem, as follows: Rayleigh quotient, for any vector $x$ , is given as, $$r(x) = \frac{\langle Ax,x\rangle}{\langle x,x\rangle}.$$ If $x$ is an eigenvector, $r(x) = \lambda$ . For a Hermitian matrix, $r(x)\in\mathbb R$ , the eigenvalues are real. Now, a Hermitian matrix can be diagonalized as: $A = UDU^*$ , where U is a unitary matrix of eigenvectors, and $D$ is a diagonal matrix of eigenvalues of $A$ . I am missing the final link, that I need to solve my problem. Thanks.","I have a following question: Let be Hermitian and be the smallest eigenvalue of , i.e., . Show that . Hint: use the properties of the Rayleigh quotient. I got started with the problem, as follows: Rayleigh quotient, for any vector , is given as, If is an eigenvector, . For a Hermitian matrix, , the eigenvalues are real. Now, a Hermitian matrix can be diagonalized as: , where U is a unitary matrix of eigenvectors, and is a diagonal matrix of eigenvalues of . I am missing the final link, that I need to solve my problem. Thanks.","A \in  C^{n\times n} \lambda_\min A \lambda_\min = \min\{\lambda_1, \ldots, \lambda_n\} \lambda_{\min} \leq \min_j a_{j} x r(x) = \frac{\langle Ax,x\rangle}{\langle x,x\rangle}. x r(x) = \lambda r(x)\in\mathbb R A = UDU^* D A","['linear-algebra', 'numerical-linear-algebra']"
17,What does matrix rank $k$ to precision $\epsilon$ mean?,What does matrix rank  to precision  mean?,k \epsilon,"I read this sentence. Suppose that the matrix $A_{ij}$ of dimension $n_i \times n_j$ has rank $k$ to precision $\epsilon$, then there exists a factorization of $A_{ij}$ of the form:   $A_{ij} = L_i S_{ij} R_j + \text{O}(\epsilon)$. I wonder what does matrix rank $k$ to precision $\epsilon$ mean? Thank you.","I read this sentence. Suppose that the matrix $A_{ij}$ of dimension $n_i \times n_j$ has rank $k$ to precision $\epsilon$, then there exists a factorization of $A_{ij}$ of the form:   $A_{ij} = L_i S_{ij} R_j + \text{O}(\epsilon)$. I wonder what does matrix rank $k$ to precision $\epsilon$ mean? Thank you.",,"['linear-algebra', 'numerical-methods']"
18,What is the term for the projection of a vector onto the unit cube?,What is the term for the projection of a vector onto the unit cube?,,"Normalizing a vector sets its magnitude to $1$ and retains its direction. In three dimensions, it projects the vector onto the unit sphere. Is there a term associated with projecting it onto the unit cube (where at least one coordinate is equal to 1), or clamping to the unit cube?","Normalizing a vector sets its magnitude to $1$ and retains its direction. In three dimensions, it projects the vector onto the unit sphere. Is there a term associated with projecting it onto the unit cube (where at least one coordinate is equal to 1), or clamping to the unit cube?",,"['linear-algebra', 'geometry', 'terminology', 'vector-spaces']"
19,Help with commutative property of matrices problem,Help with commutative property of matrices problem,,"Given matrices $A$ and $B$ , where that $AB = A + B$ , prove $AB = BA$ . I keep coming up with AB = AB. It seems like basic algebra, but for the life of me, I'm getting nowhere :/. Someone help please?","Given matrices and , where that , prove . I keep coming up with AB = AB. It seems like basic algebra, but for the life of me, I'm getting nowhere :/. Someone help please?",A B AB = A + B AB = BA,"['linear-algebra', 'matrices']"
20,"Find extra arbitrary two points for a plane, given the normal and a point that lies on the plane","Find extra arbitrary two points for a plane, given the normal and a point that lies on the plane",,"For a plane, I have the normal $n$, and also a point $P$ that lies on the plane. Now, how am I going to find extra arbitrary two points ($P_1$ and $P_2$) for the plane so that these three points $P$, $P_1$ and $P_2$ completely define the plane? The solution here suggests that one assumes a certain $x$ and $y$ to substitute into the plane equation and find the remaining  $z$. But this method is only suitable for hand calculation; it breaks down for plane $z=0$. As such, it is not suitable for computer implementation. I would need an algorithm that is robust and can handle all the cases, any idea how to construct it? There is a similar question here , and the answer suggests me to use  Gram-Schmidt, but I don't see how it can be applied in my case here.","For a plane, I have the normal $n$, and also a point $P$ that lies on the plane. Now, how am I going to find extra arbitrary two points ($P_1$ and $P_2$) for the plane so that these three points $P$, $P_1$ and $P_2$ completely define the plane? The solution here suggests that one assumes a certain $x$ and $y$ to substitute into the plane equation and find the remaining  $z$. But this method is only suitable for hand calculation; it breaks down for plane $z=0$. As such, it is not suitable for computer implementation. I would need an algorithm that is robust and can handle all the cases, any idea how to construct it? There is a similar question here , and the answer suggests me to use  Gram-Schmidt, but I don't see how it can be applied in my case here.",,"['linear-algebra', 'geometry', 'analytic-geometry']"
21,If every eigenvector of $T$ is also an eigenvector of $T^{*}$ then $T$ is a normal operator,If every eigenvector of  is also an eigenvector of  then  is a normal operator,T T^{*} T,"Let $V$ be a finite-dimensional inner product space over $\mathbb{C}$ and $T: V \to V$ a linear transformation. Show that if every eigenvector of $T$ is also an eigenvector of $T^{*}$ then $T$ is a normal. We need to show that $\forall v \in V,\ TT^*v=T^*Tv$. I started by picking $v$ to be an eigenvector of $T$, hence $Tv=\lambda_1 v$, and $T^*v=\lambda_2 v$. Therefore: $$TT^*v=T(\lambda_2 v)=\lambda_2 Tv=\lambda_1 \lambda_2 v=...=T^*Tv$$ But I'm stuck when $v$ is not an eigenvector. (Also, this question is taken from a chapter about Jordan forms, but I can't see how it relates)","Let $V$ be a finite-dimensional inner product space over $\mathbb{C}$ and $T: V \to V$ a linear transformation. Show that if every eigenvector of $T$ is also an eigenvector of $T^{*}$ then $T$ is a normal. We need to show that $\forall v \in V,\ TT^*v=T^*Tv$. I started by picking $v$ to be an eigenvector of $T$, hence $Tv=\lambda_1 v$, and $T^*v=\lambda_2 v$. Therefore: $$TT^*v=T(\lambda_2 v)=\lambda_2 Tv=\lambda_1 \lambda_2 v=...=T^*Tv$$ But I'm stuck when $v$ is not an eigenvector. (Also, this question is taken from a chapter about Jordan forms, but I can't see how it relates)",,['linear-algebra']
22,Logarithm of a Markov Matrix,Logarithm of a Markov Matrix,,"Start with a Markov matrix $\mathbf{M}$, whose elements are all between $0 \le \mathbf{M}_{ij} \le 1$ and each row sums to one. There is a natural connection with this matrix and the rate matrix $\mathbf{W}$ in the Master Equation $$ \mathbf{M} = \exp( t \mathbf{W} ) $$ Here, given $\mathbf{W}$, the calculation of $\mathbf{M}$ is unambiguous with $t$ since the matrix exponential is unique and converges by the Taylor expansion. What about the other direction? $$ t \mathbf{W} = \log( \mathbf{M} ) $$ Do the properties of the Markov matrix guarantee this is unique and that the alternating sum in the log Taylor series converge? Please provide a reference where this is discussed if possible! Motivation (by request) I've been studying the dynamics assoicated with an Ising model type system under single spin-flip Glauber dynamics. Glauber dynamics gives essentially the $\mathbf{W}$ matrix. If one were to observe the system over a finite time, an approximation to $\mathbf{M}$ could be made. I was interested in when it was permissible to convert between the two. In the reference provided by one of the answers the question boils down to: In probabilistic terms a Markov matrix A is embeddable if it   is obtained by taking a snapshot at a particular time of an autonomous finite   state Markov process that develops continuously in time. On the other hand   a Markov matrix might not be embeddable if it describes the annual changes   in a population that has a strongly seasonal breeding pattern; in such cases   one might construct a more elaborate model that incorporates the seasonal   variations. Embeddability may also fail because the matrix entries are not   accurate; in such cases a regularization technique might yield a very similar   Markov matrix that is embeddable;","Start with a Markov matrix $\mathbf{M}$, whose elements are all between $0 \le \mathbf{M}_{ij} \le 1$ and each row sums to one. There is a natural connection with this matrix and the rate matrix $\mathbf{W}$ in the Master Equation $$ \mathbf{M} = \exp( t \mathbf{W} ) $$ Here, given $\mathbf{W}$, the calculation of $\mathbf{M}$ is unambiguous with $t$ since the matrix exponential is unique and converges by the Taylor expansion. What about the other direction? $$ t \mathbf{W} = \log( \mathbf{M} ) $$ Do the properties of the Markov matrix guarantee this is unique and that the alternating sum in the log Taylor series converge? Please provide a reference where this is discussed if possible! Motivation (by request) I've been studying the dynamics assoicated with an Ising model type system under single spin-flip Glauber dynamics. Glauber dynamics gives essentially the $\mathbf{W}$ matrix. If one were to observe the system over a finite time, an approximation to $\mathbf{M}$ could be made. I was interested in when it was permissible to convert between the two. In the reference provided by one of the answers the question boils down to: In probabilistic terms a Markov matrix A is embeddable if it   is obtained by taking a snapshot at a particular time of an autonomous finite   state Markov process that develops continuously in time. On the other hand   a Markov matrix might not be embeddable if it describes the annual changes   in a population that has a strongly seasonal breeding pattern; in such cases   one might construct a more elaborate model that incorporates the seasonal   variations. Embeddability may also fail because the matrix entries are not   accurate; in such cases a regularization technique might yield a very similar   Markov matrix that is embeddable;",,"['linear-algebra', 'stochastic-processes', 'logarithms']"
