,title_raw,title_text,title_latex,body_raw,body_text,body_latex,tags
51,Is the cross product a tensor or pseudotensor?,Is the cross product a tensor or pseudotensor?,,I am confused as to the tensor nature of the cross product. Maybe I'm misunderstanding what I'm reading. But I seem to be getting conflicting messages.,I am confused as to the tensor nature of the cross product. Maybe I'm misunderstanding what I'm reading. But I seem to be getting conflicting messages.,,"['linear-algebra', 'tensors', 'cross-product']"
52,$A+3I$ is nonsingular,is nonsingular,A+3I,"If $A^2=A+2I$, show that $A+3I$ is nonsingular. If $p$ is a polynomial that annihilates A, how does the minimum poly of A and $p$ relate? Can someone help me with this? I’m not quite familiar with annihilating polynomial.","If $A^2=A+2I$, show that $A+3I$ is nonsingular. If $p$ is a polynomial that annihilates A, how does the minimum poly of A and $p$ relate? Can someone help me with this? I’m not quite familiar with annihilating polynomial.",,"['linear-algebra', 'inverse', 'minimal-polynomials']"
53,To find the smallest value of 'k' for the following equation,To find the smallest value of 'k' for the following equation,,"Let $\mathrm a,b$ are positive real numbers such that for $\mathrm a - b = 10$, then the smallest value of the constant $\mathrm k$ for which $\mathrm {\sqrt {x^2 + ax}} - {\sqrt{x^2 + bx}} < k$ for all $\mathrm x>0$, is? I don't get how to approach this problem. Any help would be appreciated.","Let $\mathrm a,b$ are positive real numbers such that for $\mathrm a - b = 10$, then the smallest value of the constant $\mathrm k$ for which $\mathrm {\sqrt {x^2 + ax}} - {\sqrt{x^2 + bx}} < k$ for all $\mathrm x>0$, is? I don't get how to approach this problem. Any help would be appreciated.",,"['linear-algebra', 'functions']"
54,$2n+1$ Subsets whose cardinality is a multiples of 6,Subsets whose cardinality is a multiples of 6,2n+1,"Consider $2n+1$ subsets $S_1,S_2,...,S_{2n+1}$ of $\{ 1,2,...,n\}$. Can anybody show (or provide a counterexample) that if $|S_i|$ is not a multiple of 6 for all $i\in \{ 1,2,...,2n+1\}$, then there are $i\neq j\in \{ 1,2,...,2n+1\}$ such that $|S_i\cap S_j|$ is not a multiple of 6? I found it on a forum without any answers and I believe there are no counterexample. Any help or reference would be appreciated.","Consider $2n+1$ subsets $S_1,S_2,...,S_{2n+1}$ of $\{ 1,2,...,n\}$. Can anybody show (or provide a counterexample) that if $|S_i|$ is not a multiple of 6 for all $i\in \{ 1,2,...,2n+1\}$, then there are $i\neq j\in \{ 1,2,...,2n+1\}$ such that $|S_i\cap S_j|$ is not a multiple of 6? I found it on a forum without any answers and I believe there are no counterexample. Any help or reference would be appreciated.",,"['linear-algebra', 'combinatorics', 'elementary-set-theory', 'reference-request']"
55,What is the 'Algebraic' Dimension of $l^2(\mathbb{N})$?,What is the 'Algebraic' Dimension of ?,l^2(\mathbb{N}),"Let  $l^2(\mathbb{N})$ be the space of all complex sequences that are square-summable. Clearly this is a Hilbert space, and it has a maximal orthonormal system which is equipotent to $\mathbb{N}$. Hence, its 'Hilbert dimension' is $\aleph_0$ (please tell me if other termiology is used). But what is the 'algebraic' dimension of this space? That is, what is the cardinality of its Hamel basis? Is there a way to compute it using only cardinal arithmetic, or does one have to know much more about its algebraic structure? I was reading this article explaining Halmos' counterexample of an inner product space NOT having any complete, orthonormal subset. It is stated there (implicitly, I guess) that the algebraic dimension of $l^2(\mathbb{N})$ is the cardinality of the continuum, but I don't see why that has to be the case; this seems highly non-trivial to me. Could someone please explain this to me?","Let  $l^2(\mathbb{N})$ be the space of all complex sequences that are square-summable. Clearly this is a Hilbert space, and it has a maximal orthonormal system which is equipotent to $\mathbb{N}$. Hence, its 'Hilbert dimension' is $\aleph_0$ (please tell me if other termiology is used). But what is the 'algebraic' dimension of this space? That is, what is the cardinality of its Hamel basis? Is there a way to compute it using only cardinal arithmetic, or does one have to know much more about its algebraic structure? I was reading this article explaining Halmos' counterexample of an inner product space NOT having any complete, orthonormal subset. It is stated there (implicitly, I guess) that the algebraic dimension of $l^2(\mathbb{N})$ is the cardinality of the continuum, but I don't see why that has to be the case; this seems highly non-trivial to me. Could someone please explain this to me?",,"['linear-algebra', 'hilbert-spaces', 'inner-products', 'cardinals']"
56,Relation of trace and determinant,Relation of trace and determinant,,"Let $A$ be a $3\times3$ non-diagonal matrix with $A=A^{-1}$ . Prove that $\det A = \operatorname{tr} A =\pm1$ I have already proved $\det A = \pm1$ , but I have no idea about how to proceed with $\operatorname{tr} A$ . Thank you.","Let be a non-diagonal matrix with . Prove that I have already proved , but I have no idea about how to proceed with . Thank you.",A 3\times3 A=A^{-1} \det A = \operatorname{tr} A =\pm1 \det A = \pm1 \operatorname{tr} A,"['linear-algebra', 'matrices', 'proof-writing', 'determinant', 'trace']"
57,Determinant-free proof that a real $n \times n$ matrix has at least one real eigenvalue when $n$ is odd.,Determinant-free proof that a real  matrix has at least one real eigenvalue when  is odd.,n \times n n,"Is there a determinant-free proof that $\textbf{A} \in \mathbb{R}^{n \times n}$ must have at least one real eigenvalue when $n$ is odd? I have seen a few other definitions of ""the set of eigenvalues"" which do not invoke the determinant, specifically the complement of the resolvent set , or the set of points for which $\lambda\textbf{I}_{n \times n} - \textbf{A}$ is singular.","Is there a determinant-free proof that $\textbf{A} \in \mathbb{R}^{n \times n}$ must have at least one real eigenvalue when $n$ is odd? I have seen a few other definitions of ""the set of eigenvalues"" which do not invoke the determinant, specifically the complement of the resolvent set , or the set of points for which $\lambda\textbf{I}_{n \times n} - \textbf{A}$ is singular.",,"['linear-algebra', 'matrices']"
58,Tensor product and the pure elements,Tensor product and the pure elements,,"From my understanding, one important thing about tensor product is that not all elements are pure elements, that is in $M\otimes N$ not all elements are in the form of $m\otimes n$ ,they are linear combinations of pure elements. My professor mentioned that while doing a problem thinking the tensor product only contains pure elements is a very common mistake. But I don't quite see the importance of this, if we can check some property $P$ for all pure elements, then shouldn't it hold for $M\otimes N$? For example, if $m\otimes n = 0$ for each $m\in M, n\in N$, then $M\otimes N = 0$. Can you give me an example where checking all pure elements is not good enough for $M\otimes N$.","From my understanding, one important thing about tensor product is that not all elements are pure elements, that is in $M\otimes N$ not all elements are in the form of $m\otimes n$ ,they are linear combinations of pure elements. My professor mentioned that while doing a problem thinking the tensor product only contains pure elements is a very common mistake. But I don't quite see the importance of this, if we can check some property $P$ for all pure elements, then shouldn't it hold for $M\otimes N$? For example, if $m\otimes n = 0$ for each $m\in M, n\in N$, then $M\otimes N = 0$. Can you give me an example where checking all pure elements is not good enough for $M\otimes N$.",,"['linear-algebra', 'abstract-algebra', 'tensor-products']"
59,"Prove that $v, Tv, T^2v, ... , T^{m-1}v$ is linearly independent",Prove that  is linearly independent,"v, Tv, T^2v, ... , T^{m-1}v","Suppose $T$ is in $L(V)$ , $m$ is a positive integer, and $v$ in vector space $V$ is such that $(T^{m-1})v \neq 0$ , and $(T^m)v = 0$ . Prove that $[v, Tv, T^2v, ... , T^{m-1}v]$ is linearly independent I get that $(T^j)v \neq 0\ \forall\ j < m$ . Additionally, since $T$ is nilpotent, $V$ has a basis with respect to which the matrix of $T$ has $0$ s on and below the diagonal. However, I'm not sure if these can be used to show linear independence or if they're even relevant to the problem at all. Any help is appreciated!","Suppose is in , is a positive integer, and in vector space is such that , and . Prove that is linearly independent I get that . Additionally, since is nilpotent, has a basis with respect to which the matrix of has s on and below the diagonal. However, I'm not sure if these can be used to show linear independence or if they're even relevant to the problem at all. Any help is appreciated!","T L(V) m v V (T^{m-1})v \neq 0 (T^m)v = 0 [v, Tv, T^2v, ... , T^{m-1}v] (T^j)v \neq 0\ \forall\ j < m T V T 0","['linear-algebra', 'matrices', 'linear-transformations']"
60,complex conjugate of trace of matrices,complex conjugate of trace of matrices,,Is $[Tr(AB)]^{*} = Tr(AB)^{\dagger} = Tr(B^{\dagger}A^{\dagger})$? The second equal sign is trivial but the first equal sign is what I am puzzled about. $*$ means the complex conjugate of a number. $\dagger$ means the complex conjugate of a matrix.,Is $[Tr(AB)]^{*} = Tr(AB)^{\dagger} = Tr(B^{\dagger}A^{\dagger})$? The second equal sign is trivial but the first equal sign is what I am puzzled about. $*$ means the complex conjugate of a number. $\dagger$ means the complex conjugate of a matrix.,,"['linear-algebra', 'matrices']"
61,are there any matrices that act like the identity matrix but are totally different?,are there any matrices that act like the identity matrix but are totally different?,,"Given any matrix $A$ or vector $v$, can you find a matrix $B \neq I$ and also not resembling $I$ (having entries in places other than diagonal) such that $B*A$ and $B*v$ are approximately $A$ and approximately $v$? For me the answer is should obviously be yes.  Also I am aware that $I$ is unique, so the matrix $B$ will never have the same effect as $I$ unless it is equal to $I$ itself.","Given any matrix $A$ or vector $v$, can you find a matrix $B \neq I$ and also not resembling $I$ (having entries in places other than diagonal) such that $B*A$ and $B*v$ are approximately $A$ and approximately $v$? For me the answer is should obviously be yes.  Also I am aware that $I$ is unique, so the matrix $B$ will never have the same effect as $I$ unless it is equal to $I$ itself.",,['linear-algebra']
62,Left/Right Eigenvectors,Left/Right Eigenvectors,,"Let $M$ be a nonsymmetric matrix; suppose the columns of matrix $A$ are the right eigenvectors of $M$ and the rows of matrix $B$ are the left eigenvectors of $M$. In one of the answers to a question on left and right eigenvectors it was claimed that $AB=I$. Is that true, and how would you prove it?","Let $M$ be a nonsymmetric matrix; suppose the columns of matrix $A$ are the right eigenvectors of $M$ and the rows of matrix $B$ are the left eigenvectors of $M$. In one of the answers to a question on left and right eigenvectors it was claimed that $AB=I$. Is that true, and how would you prove it?",,"['linear-algebra', 'matrices', 'eigenvalues-eigenvectors', 'determinant', 'inverse']"
63,Meaning of row space,Meaning of row space,,"I used to think of the row space of an $m \times n$ matrix $A$ as the column space of $A^T$ , and therefore the row vectors are the images of the standard dual basis of $\mathbb{R}^m$ under $A^T$ . But it seems that we can have an interpretation of the row space without introducing the dual space. I think, but am not sure, that the row spaces are those vectors which are 1-1 mapped to vectors in the column space. Is this correct?","I used to think of the row space of an matrix as the column space of , and therefore the row vectors are the images of the standard dual basis of under . But it seems that we can have an interpretation of the row space without introducing the dual space. I think, but am not sure, that the row spaces are those vectors which are 1-1 mapped to vectors in the column space. Is this correct?",m \times n A A^T \mathbb{R}^m A^T,"['linear-algebra', 'matrices', 'vector-spaces']"
64,Find best-fit parabola to the given data,Find best-fit parabola to the given data,,"Find the parabola $At^2+Bt+C$ that best approximates the data set $t= -1,0,1,2,3$ and $b(t) = 5,2,1,2,5$. Would I be using least squares such that $x = (A^TA)^{-1}A^Tb$? Thank you in advance.","Find the parabola $At^2+Bt+C$ that best approximates the data set $t= -1,0,1,2,3$ and $b(t) = 5,2,1,2,5$. Would I be using least squares such that $x = (A^TA)^{-1}A^Tb$? Thank you in advance.",,"['linear-algebra', 'regression', 'least-squares']"
65,"Are $\sin(n\pi x /L)$ a basis of $L^2[0,L]$?",Are  a basis of ?,"\sin(n\pi x /L) L^2[0,L]","I'm studying a book ""Applied linear algebra"" by Sadun. The book deals linear algebra and functional analysis somewhat informally. Here is a quote from the book. I have some questions about the italicized sentences (italicizing is mine, not of the author). What we have done is exhibit three orthogonal bases for the same space ($L^2[0,L]$). One orthogonal basis is the set of functions $\sin(n \pi x/L)$ . A second orthogonal basis is the set of functions $\sin(2n\pi x/L)$ together with the functions $\cos(2n\pi x/L)$. Closely related to the second basis is the third basis $\{\exp(2n\pi xi /L)\}$ with $n$ now ranging from $-\infty$ to $\infty$. These bases are in turn obtained as the eigenfunctions of the three different operators on $L^2[0,L]$. The first operator is $d^2/dx^2$ with Dirichlet boundary conditions, whose eigenvalues are $-n^2\pi^2/L^2$, and whose eigenfunctions are the functions $\sin(n\pi x/L)$ $\cdots$ i) Are $\sin(n\pi x/L)$ really a basis for $L^2[0,L]$? How can a function whose value is nonzero at the boundaries be represented as a linear combination of them? ii) I'm not comfortable with defining an operator with boundary conditions. Are such definitions of an operator with boundary conditions conventional or usual? I think it is more appropriate to define a subspace by the boundary condition and define an operator on the subspace. Then $\sin(n\pi x/L)$ can be a basis for the subspace in which functions vanish at the boundaries. I'm not much familiar with rigorous functional analysis nor linear algebra, but the sentences in the book are somewhat wiered for me.","I'm studying a book ""Applied linear algebra"" by Sadun. The book deals linear algebra and functional analysis somewhat informally. Here is a quote from the book. I have some questions about the italicized sentences (italicizing is mine, not of the author). What we have done is exhibit three orthogonal bases for the same space ($L^2[0,L]$). One orthogonal basis is the set of functions $\sin(n \pi x/L)$ . A second orthogonal basis is the set of functions $\sin(2n\pi x/L)$ together with the functions $\cos(2n\pi x/L)$. Closely related to the second basis is the third basis $\{\exp(2n\pi xi /L)\}$ with $n$ now ranging from $-\infty$ to $\infty$. These bases are in turn obtained as the eigenfunctions of the three different operators on $L^2[0,L]$. The first operator is $d^2/dx^2$ with Dirichlet boundary conditions, whose eigenvalues are $-n^2\pi^2/L^2$, and whose eigenfunctions are the functions $\sin(n\pi x/L)$ $\cdots$ i) Are $\sin(n\pi x/L)$ really a basis for $L^2[0,L]$? How can a function whose value is nonzero at the boundaries be represented as a linear combination of them? ii) I'm not comfortable with defining an operator with boundary conditions. Are such definitions of an operator with boundary conditions conventional or usual? I think it is more appropriate to define a subspace by the boundary condition and define an operator on the subspace. Then $\sin(n\pi x/L)$ can be a basis for the subspace in which functions vanish at the boundaries. I'm not much familiar with rigorous functional analysis nor linear algebra, but the sentences in the book are somewhat wiered for me.",,"['linear-algebra', 'functional-analysis', 'hilbert-spaces', 'self-learning']"
66,Decompose rotation matrix to plane of rotation and angle,Decompose rotation matrix to plane of rotation and angle,,"I would like to decompose an $n$-dimensional orthogonal rotation matrix (restricting to simple rotation with a single plane of rotation) to the two basis vectors of the plane of rotation, and an angle of rotation. The common method is decomposing the rotation matrix to an axis and angle, but this doesn't work in higher dimensions. For example in $\mathbb{R}^3$ given the rotation matrix $R_{xy}=\begin{bmatrix}\cos\theta & -\sin\theta & 0 \\ \sin\theta & \cos\theta & 0 \\ 0 & 0 & 1 \end{bmatrix}$ it's obvious that the plane of rotation is the $xy$-plane spanned by basis vectors $b_0 = (1,0,0)$ and $b_1=(0,1,0)$ and the angle of rotation is $\theta$. However decomposing it mathematically is rather challenging. What is the solution for a general (restricted to a single, but arbitrary plane) rotation matrix in $\mathbb{R}^n$?","I would like to decompose an $n$-dimensional orthogonal rotation matrix (restricting to simple rotation with a single plane of rotation) to the two basis vectors of the plane of rotation, and an angle of rotation. The common method is decomposing the rotation matrix to an axis and angle, but this doesn't work in higher dimensions. For example in $\mathbb{R}^3$ given the rotation matrix $R_{xy}=\begin{bmatrix}\cos\theta & -\sin\theta & 0 \\ \sin\theta & \cos\theta & 0 \\ 0 & 0 & 1 \end{bmatrix}$ it's obvious that the plane of rotation is the $xy$-plane spanned by basis vectors $b_0 = (1,0,0)$ and $b_1=(0,1,0)$ and the angle of rotation is $\theta$. However decomposing it mathematically is rather challenging. What is the solution for a general (restricted to a single, but arbitrary plane) rotation matrix in $\mathbb{R}^n$?",,"['linear-algebra', 'matrices', 'geometry', 'euclidean-geometry', 'rotations']"
67,Making sense of angles in $\mathbb{R^n}$,Making sense of angles in,\mathbb{R^n},"One of the definitions of the dot product of two vectors is the following $$\vec{a} \bullet \vec{b}\ \  \stackrel{\text{def}}{=} \ \ \|\vec{a}\| \,\|\vec{b}\|\cos(\theta)$$ Where $\theta$ denotes the angle between the vectors $\vec{a}$ and $\vec{b}$. But for that angle $\theta$ to 'make sense', both $\vec{a}$ and $\vec{b}$ must lie in the same plane correct? i.e. There must exist some two-dimensional space, e.g. $\mathbb{R^2}$, that both $\vec{a}$ and $\vec{b}$ are an element of. Now we can always find a plane that both $\vec{a}$ and $\vec{b}$ fall in. But now the question arises, are we finding the angle $\theta$ with respect to the plane that they lie in (what I'm trying to say is: Is $\theta$ denoting the angle between $\vec{a}$ and $\vec{b}$ in a plane that they both fall in?), or is it with respect to the basis vectors of of the original vector space that they lie in initially. Here's an example that will hopefully get across what I'm asking: Take $\vec{a}, \vec{b} \in \mathbb{R^4}$. If we can find a plane that both $\vec{a}$ and $\vec{b}$ both lie in, then 'the angle between them' , $\theta$, makes sense. If not then what essentially is being said is $\theta$ is the angle between two vectors in four-dimensional space, and I'm not sure that an angle in $\mathbb{R^4}$ has any sort of meaning. My question then essentially boils down to the following. Are angles only defined (or do they only have meaning) in $\mathbb{R^2}$? If we have two vectors in $\mathbb{R^n}$, is the only way to find the 'angle between them' by first finding a plane (a two-dimensional vector space) that they both lie in, and then solving for the angle with respect to that plane?","One of the definitions of the dot product of two vectors is the following $$\vec{a} \bullet \vec{b}\ \  \stackrel{\text{def}}{=} \ \ \|\vec{a}\| \,\|\vec{b}\|\cos(\theta)$$ Where $\theta$ denotes the angle between the vectors $\vec{a}$ and $\vec{b}$. But for that angle $\theta$ to 'make sense', both $\vec{a}$ and $\vec{b}$ must lie in the same plane correct? i.e. There must exist some two-dimensional space, e.g. $\mathbb{R^2}$, that both $\vec{a}$ and $\vec{b}$ are an element of. Now we can always find a plane that both $\vec{a}$ and $\vec{b}$ fall in. But now the question arises, are we finding the angle $\theta$ with respect to the plane that they lie in (what I'm trying to say is: Is $\theta$ denoting the angle between $\vec{a}$ and $\vec{b}$ in a plane that they both fall in?), or is it with respect to the basis vectors of of the original vector space that they lie in initially. Here's an example that will hopefully get across what I'm asking: Take $\vec{a}, \vec{b} \in \mathbb{R^4}$. If we can find a plane that both $\vec{a}$ and $\vec{b}$ both lie in, then 'the angle between them' , $\theta$, makes sense. If not then what essentially is being said is $\theta$ is the angle between two vectors in four-dimensional space, and I'm not sure that an angle in $\mathbb{R^4}$ has any sort of meaning. My question then essentially boils down to the following. Are angles only defined (or do they only have meaning) in $\mathbb{R^2}$? If we have two vectors in $\mathbb{R^n}$, is the only way to find the 'angle between them' by first finding a plane (a two-dimensional vector space) that they both lie in, and then solving for the angle with respect to that plane?",,"['linear-algebra', 'trigonometry', 'vector-spaces', 'vectors']"
68,Complex ($\mathbb C$) least squares derivation,Complex () least squares derivation,\mathbb C,"I know how to derive the least squares in the real domain. If a tall matrix $A$ and a column vector $b$ are real, then the solution of the least squares problem $Ax = b$ can be derived as: $$\begin{align} \{E(x)\}^2 &= ||Ax - b||^2 \\ &= (Ax-b)^T (Ax-b) \\ &= x^T A^T Ax - x^T A^T b - b^T Ax + b^T b \\ &= x^T A^T Ax - 2 x^T A^T b + b^T b \qquad (\because (Ax)^T b = b^T (Ax)) \end{align}$$ Differentiating both sides with respect to $x$, $$\begin{align} \frac{d \{E(x)\}^2}{dx} &= 2A^T Ax - 2 A^T b \end{align}$$ Setting $\frac{d \{E(x)\}^2}{dx} = 0$ to find when we get the minimum $E(x)$, $$ 2A^T Ax - 2 A^T b = 0 \\ A^T Ax = A^T b \\ x = (A^T A)^{-1} A^T b $$ Now, we turn to the complex-valued situation. Assume $A$ and $b$ are complex, $$\begin{align} \{E(x)\}^2 &= ||Ax - b||^2 \\ &= (Ax-b)^H (Ax-b) \\ &= x^H A^H Ax - x^H A^H b - b^H Ax + b^H b \\ \end{align}$$ Here, I have some problems. First, $x^H A^H b \neq b^H Ax$ unless $(Ax)^H b$ is real. Most of all, I don't know how to differentiate the complex matrices above. How to proceed the derivation? There are plenty of derivations in the real domain in Google, but I couldn't find detailed explanation of the general complex case.","I know how to derive the least squares in the real domain. If a tall matrix $A$ and a column vector $b$ are real, then the solution of the least squares problem $Ax = b$ can be derived as: $$\begin{align} \{E(x)\}^2 &= ||Ax - b||^2 \\ &= (Ax-b)^T (Ax-b) \\ &= x^T A^T Ax - x^T A^T b - b^T Ax + b^T b \\ &= x^T A^T Ax - 2 x^T A^T b + b^T b \qquad (\because (Ax)^T b = b^T (Ax)) \end{align}$$ Differentiating both sides with respect to $x$, $$\begin{align} \frac{d \{E(x)\}^2}{dx} &= 2A^T Ax - 2 A^T b \end{align}$$ Setting $\frac{d \{E(x)\}^2}{dx} = 0$ to find when we get the minimum $E(x)$, $$ 2A^T Ax - 2 A^T b = 0 \\ A^T Ax = A^T b \\ x = (A^T A)^{-1} A^T b $$ Now, we turn to the complex-valued situation. Assume $A$ and $b$ are complex, $$\begin{align} \{E(x)\}^2 &= ||Ax - b||^2 \\ &= (Ax-b)^H (Ax-b) \\ &= x^H A^H Ax - x^H A^H b - b^H Ax + b^H b \\ \end{align}$$ Here, I have some problems. First, $x^H A^H b \neq b^H Ax$ unless $(Ax)^H b$ is real. Most of all, I don't know how to differentiate the complex matrices above. How to proceed the derivation? There are plenty of derivations in the real domain in Google, but I couldn't find detailed explanation of the general complex case.",,"['linear-algebra', 'matrix-calculus', 'least-squares']"
69,Prove that the determinant is a multiple of $17$ without developing it,Prove that the determinant is a multiple of  without developing it,17,"Let, matrix is given as : $$D=\begin{bmatrix} 1 & 1 & 9 \\ 1 & 8 & 7 \\ 1 & 5 & 3\end{bmatrix}$$ Prove that the determinant is a multiple of $17$ without developing it? I saw a resolution by the Jacobi method , but could not apply the methodology in this example.","Let, matrix is given as : $$D=\begin{bmatrix} 1 & 1 & 9 \\ 1 & 8 & 7 \\ 1 & 5 & 3\end{bmatrix}$$ Prove that the determinant is a multiple of $17$ without developing it? I saw a resolution by the Jacobi method , but could not apply the methodology in this example.",,"['linear-algebra', 'matrices', 'divisibility', 'determinant']"
