,title_raw,title_text,title_latex,body_raw,body_text,body_latex,tags
20,Balancing chemical equations - Matrix determinant is zero for specific reaction,Balancing chemical equations - Matrix determinant is zero for specific reaction,,"I am currently working on a program which takes a chemical equation as input and returns the balanced chemical equation instead. It finds the appropiate chemical coefficients with matrix operations, using the formula $x = A^{-1}b$ . I am using JAMA for calculations involving matrices. According to their docs, it calculates $A$ 's inverse using Eigenvalue Decomposition of both symmetric and nonsymmetric square matrices Let's take an example to better visualize this. Suppose the following chemical equation with denoted coefficients for every compound: $aCa(OH)_2 + bH_3PO_4 \rightarrow cCa_3(PO_4)_2 + dH_2O$ The computer creates an equation for every element: $P: b - 2c = 0$ $H: 2a + 3b - 2d = 0$ $Ca: a - 3c = 0$ The last equation needs to be $a = det(A)$ for three reasons. We need a square matrix (and that's why oxygen's equation is omitted) to compute it's inverse and determinant. Secondly, we need to give a numerical value to one of the variables to be able to get a numerical result, and thirdly (as far as I understood because I learned nothing about matrices in school yet) $adj(A)$ is multiplied by $1/det(A)$ to get $A^{-1}$ which causes the computed coefficients to sometimes be non-integer numbers. I am not sure of how or why setting $a$ to $det(A)$ works, neither this is the most efficient way of doing it. $A = \left[\begin{array}{cccc}0&1&-2&0\\2&3&0&-2\\1&0&-3&0\\1&0&0&0\end{array}\right]$ $b = \left[\begin{array}{c}0\\0\\0\\det(A)\end{array}\right]$ After dividing every number to the GCD the computed vector $x$ will be: $x = A^{-1}b = \left[\begin{array}{c}6\\4\\2\\12\end{array}\right]$ = $\left[\begin{array}{c}3\\2\\1\\6\end{array}\right]$ And of course, the balanced chemical equation is $3Ca(OH)_2 + 2H_3PO_4 \rightarrow Ca_3(PO_4)_2 + 6H_2O$ This program works perfectly for even more complex equations: $299H_2SO_4 + 10K_4Fe(CN)_6 + 122KMnO_4 \rightarrow 60CO_2 + 5Fe_2(SO_4)_3 + 188H_2O + 60HNO_3 + 162KHSO_4 + 122MnSO_4$ $9Fe_{36}Si_5 + 836H_3PO_4 + 192K_2Cr_2O_7 \rightarrow 324FePO_4 + 45SiO_2 + 128K_3PO_4 + 384CrPO_4 + 1254H_2O$ However, in the process of testing, I found a chemical equation that produces the following error: java.lang.RuntimeException: Matrix is singular. Let's write everything down: $aB_{10}H_{12}CNH_3 + bNiCl_2 + cNaOH \rightarrow dNa_4(B_{10}H_{10}CNH_2)_2Ni + eNaCl + fH_2O$ $B: 10a - 20d = 0$ $C: a - 2d = 0$ $Na: c - 4d - e = 0$ $H: 15a + c - 24d - 2f = 0$ $Cl: 2b - e = 0$ This time, the code omits the equation for three elements ( $N, Ni, O$ ) because it would result in an overdetermined system and a non-square matrix. $A = \left[\begin{array}{cccccc}10&0&0&-20&0&0\\1&0&0&-2&0&0\\0&0&1&-4&-1&0\\15&0&1&-24&0&-2\\0&2&0&0&-1&0\\1&0&0&0&0&0\end{array}\right]$ This is completely unexpected, both for me and the script. Using a matrix calculator, I found out that $A$ has no inverse: its determinant is zero. I analyzed the matrix and found that $10a - 20d = 0$ and $a - 2d = 0$ are really the same equation. I'm not sure if this has something to do with the matrix being singular. What should I do to make this work? Should I use a different method for finding solutions and representing my system of equations, or do I have to do something specific when $det(A) = 0$ ? I've read a little bit about Gaussian Elimination and LU Decomposition, but I don't seem to understand them very well. In case I have to use another method for solving the system, which one is the most suitable for this script? Also, I would be happy to get some details about it if possible. Keep in mind I'm a beginner in this matrix field. Any help is appreciated!","I am currently working on a program which takes a chemical equation as input and returns the balanced chemical equation instead. It finds the appropiate chemical coefficients with matrix operations, using the formula . I am using JAMA for calculations involving matrices. According to their docs, it calculates 's inverse using Eigenvalue Decomposition of both symmetric and nonsymmetric square matrices Let's take an example to better visualize this. Suppose the following chemical equation with denoted coefficients for every compound: The computer creates an equation for every element: The last equation needs to be for three reasons. We need a square matrix (and that's why oxygen's equation is omitted) to compute it's inverse and determinant. Secondly, we need to give a numerical value to one of the variables to be able to get a numerical result, and thirdly (as far as I understood because I learned nothing about matrices in school yet) is multiplied by to get which causes the computed coefficients to sometimes be non-integer numbers. I am not sure of how or why setting to works, neither this is the most efficient way of doing it. After dividing every number to the GCD the computed vector will be: = And of course, the balanced chemical equation is This program works perfectly for even more complex equations: However, in the process of testing, I found a chemical equation that produces the following error: java.lang.RuntimeException: Matrix is singular. Let's write everything down: This time, the code omits the equation for three elements ( ) because it would result in an overdetermined system and a non-square matrix. This is completely unexpected, both for me and the script. Using a matrix calculator, I found out that has no inverse: its determinant is zero. I analyzed the matrix and found that and are really the same equation. I'm not sure if this has something to do with the matrix being singular. What should I do to make this work? Should I use a different method for finding solutions and representing my system of equations, or do I have to do something specific when ? I've read a little bit about Gaussian Elimination and LU Decomposition, but I don't seem to understand them very well. In case I have to use another method for solving the system, which one is the most suitable for this script? Also, I would be happy to get some details about it if possible. Keep in mind I'm a beginner in this matrix field. Any help is appreciated!","x = A^{-1}b A aCa(OH)_2 + bH_3PO_4 \rightarrow cCa_3(PO_4)_2 + dH_2O P: b - 2c = 0 H: 2a + 3b - 2d = 0 Ca: a - 3c = 0 a = det(A) adj(A) 1/det(A) A^{-1} a det(A) A = \left[\begin{array}{cccc}0&1&-2&0\\2&3&0&-2\\1&0&-3&0\\1&0&0&0\end{array}\right] b = \left[\begin{array}{c}0\\0\\0\\det(A)\end{array}\right] x x = A^{-1}b = \left[\begin{array}{c}6\\4\\2\\12\end{array}\right] \left[\begin{array}{c}3\\2\\1\\6\end{array}\right] 3Ca(OH)_2 + 2H_3PO_4 \rightarrow Ca_3(PO_4)_2 + 6H_2O 299H_2SO_4 + 10K_4Fe(CN)_6 + 122KMnO_4 \rightarrow 60CO_2 + 5Fe_2(SO_4)_3 + 188H_2O + 60HNO_3 + 162KHSO_4 + 122MnSO_4 9Fe_{36}Si_5 + 836H_3PO_4 + 192K_2Cr_2O_7 \rightarrow 324FePO_4 + 45SiO_2 + 128K_3PO_4 + 384CrPO_4 + 1254H_2O aB_{10}H_{12}CNH_3 + bNiCl_2 + cNaOH \rightarrow dNa_4(B_{10}H_{10}CNH_2)_2Ni + eNaCl + fH_2O B: 10a - 20d = 0 C: a - 2d = 0 Na: c - 4d - e = 0 H: 15a + c - 24d - 2f = 0 Cl: 2b - e = 0 N, Ni, O A = \left[\begin{array}{cccccc}10&0&0&-20&0&0\\1&0&0&-2&0&0\\0&0&1&-4&-1&0\\15&0&1&-24&0&-2\\0&2&0&0&-1&0\\1&0&0&0&0&0\end{array}\right] A 10a - 20d = 0 a - 2d = 0 det(A) = 0","['linear-algebra', 'matrices', 'systems-of-equations', 'determinant', 'chemistry']"
21,"If $f$ is continuous and bounded, and $\text{span}\{x \mapsto f(x+k) \mid k \in \Bbb Z\}$ is finite-dimensional, what can we say about $f$?","If  is continuous and bounded, and  is finite-dimensional, what can we say about ?",f \text{span}\{x \mapsto f(x+k) \mid k \in \Bbb Z\} f,"If $f : \Bbb R \to \Bbb R$ is continuous and bounded, and $\text{span}\{x \mapsto f(x+k) \mid k \in \Bbb Z\}$ is finite-dimensional, what can we say about $f$ ? I found this problem difficult (I found examples of functions for which the hypothesis is true like $n$ -periodic functions, where $n \in \Bbb N^*$ , but I am struggling for the reverse implication). Can someone help me solve it and does someone have a reference from where it comes?","If is continuous and bounded, and is finite-dimensional, what can we say about ? I found this problem difficult (I found examples of functions for which the hypothesis is true like -periodic functions, where , but I am struggling for the reverse implication). Can someone help me solve it and does someone have a reference from where it comes?",f : \Bbb R \to \Bbb R \text{span}\{x \mapsto f(x+k) \mid k \in \Bbb Z\} f n n \in \Bbb N^*,"['real-analysis', 'calculus', 'linear-algebra']"
22,"Linear operator T on $ \mathbb{R}^5$. $T^4 \neq 0$, but $T^5 = 0$. What's the rank of $T^2$?","Linear operator T on . , but . What's the rank of ?", \mathbb{R}^5 T^4 \neq 0 T^5 = 0 T^2,"The problem: Linear operator T  on $ \mathbb{R}^5$ . $T^4 \neq 0$ , but $T^5 = 0$ . What's the rank of $T^2$ ? I am learning linear algebra and preparing for a test. For this problem, I am able to show that $range(T^4) \subseteq nullspace(T)$ since there exists $T^4x = y$ , and $T^5x = Ty = 0$ . $y$ is arbitrary and can represent the range of $T^4$ . Then I am stuck. I understand this is a duplicated question but I don't know Jordan canonical form or eigenspaces yet. So I couldn't understand the answer there. Could you help with it using only linear transformation theorems?","The problem: Linear operator T  on . , but . What's the rank of ? I am learning linear algebra and preparing for a test. For this problem, I am able to show that since there exists , and . is arbitrary and can represent the range of . Then I am stuck. I understand this is a duplicated question but I don't know Jordan canonical form or eigenspaces yet. So I couldn't understand the answer there. Could you help with it using only linear transformation theorems?", \mathbb{R}^5 T^4 \neq 0 T^5 = 0 T^2 range(T^4) \subseteq nullspace(T) T^4x = y T^5x = Ty = 0 y T^4,"['linear-algebra', 'linear-transformations']"
23,How to show that any polytope $P$ is spanned by the neighboring edges of any vertex $x$?,How to show that any polytope  is spanned by the neighboring edges of any vertex ?,P x,"Definitions: A subset $P \subset \mathbb R^n$ is a polytope if it is the convex hull of finitely many points. Let $P \subset \mathbb R^n$ be a polytope. A face is a subset $F\subset P$ of the form $$F=\arg\max\{cx : x \in P\}$$ for some $c \in \mathbb R^n$ . The dimension of a face is the dimension of its affine hull. A vertex is a zero dimensional face and an edge a one dimensional face. Two vertices $v, w$ are neighbors if their connecting line $\operatorname{conv}(\{v,w\})$ is an edge. Given a vertex $x$ define $$N(x) = \{y \in P: \text{ $y$ is a vertex neighboring $x$}\}$$ as the set of vertices that are neighbors of $x$ , and define $$E(x) = \{y-x: y \in N(x)\}$$ as the set of edge vectors pointing from $x$ to its neighbors. Question: Let $P \subset \mathbb R^n$ be a polytope and let $x$ be a vertex. Let $$E(x) = \{y-x: \text{ $y$ is a vertex neighboring $x$}\}$$ be the set of vectors that point from $x$ to its neighboring vertices. How can we show that for any $z \in P$ there exist coefficients $\lambda_v\ge 0$ such that $$ z = x + \sum_{v \in E(x)}\lambda_v v$$ The question can also be phrased as: How to show that the conical hull of $P-\{x\}$ , $$K=\operatorname{cone}(P-\{x\}):=\{\sum_{i=1}^k \alpha_i (z_i-x): z_i \in P, \alpha_i\ge0, k =1,2\dots, \}$$ is generated by the edge vectors $E(x)$ ? That is, show that $$K=\{\sum_{y \in N(x)} \alpha_y (y-x): \alpha_i\ge0 \}.$$ See also example and images below. I think Farkas' Lemma should lead to the answer somehow, but so far I've had no success in my proof attempts. Example: Consider $\mathbb R^2$ and let $P$ be the polytope that is the convex hull of the points $(0,0), (0,1), (1,0)$ . If we take the vertex $x=(0,0)$ then $N(x) = \{(0,1), (1,0)\} = E(x)$ and the set of vectors that are nonnegative linear combinations of elements of $E(x)$ is $\mathbb R^2$ . In particular, any $z \in P$ can be expressed as a nonnegative linear combinations of elements of $E(x)$ . Here is an image (the shaded region is the set of points $z = x + \sum_{v \in E(x)}\lambda_v v$ for some nonnegative $\lambda_v$ ): Here are two more images showing the idea for different polytopes: A polytope in $\mathbb R^2$ : A polytope in $\mathbb R^3$ :","Definitions: A subset is a polytope if it is the convex hull of finitely many points. Let be a polytope. A face is a subset of the form for some . The dimension of a face is the dimension of its affine hull. A vertex is a zero dimensional face and an edge a one dimensional face. Two vertices are neighbors if their connecting line is an edge. Given a vertex define as the set of vertices that are neighbors of , and define as the set of edge vectors pointing from to its neighbors. Question: Let be a polytope and let be a vertex. Let be the set of vectors that point from to its neighboring vertices. How can we show that for any there exist coefficients such that The question can also be phrased as: How to show that the conical hull of , is generated by the edge vectors ? That is, show that See also example and images below. I think Farkas' Lemma should lead to the answer somehow, but so far I've had no success in my proof attempts. Example: Consider and let be the polytope that is the convex hull of the points . If we take the vertex then and the set of vectors that are nonnegative linear combinations of elements of is . In particular, any can be expressed as a nonnegative linear combinations of elements of . Here is an image (the shaded region is the set of points for some nonnegative ): Here are two more images showing the idea for different polytopes: A polytope in : A polytope in :","P \subset \mathbb R^n P \subset \mathbb R^n F\subset P F=\arg\max\{cx : x \in P\} c \in \mathbb R^n v, w \operatorname{conv}(\{v,w\}) x N(x) = \{y \in P: \text{ y is a vertex neighboring x}\} x E(x) = \{y-x: y \in N(x)\} x P \subset \mathbb R^n x E(x) = \{y-x: \text{ y is a vertex neighboring x}\} x z \in P \lambda_v\ge 0  z = x + \sum_{v \in E(x)}\lambda_v v P-\{x\} K=\operatorname{cone}(P-\{x\}):=\{\sum_{i=1}^k \alpha_i (z_i-x): z_i \in P, \alpha_i\ge0, k =1,2\dots, \} E(x) K=\{\sum_{y \in N(x)} \alpha_y (y-x): \alpha_i\ge0 \}. \mathbb R^2 P (0,0), (0,1), (1,0) x=(0,0) N(x) = \{(0,1), (1,0)\} = E(x) E(x) \mathbb R^2 z \in P E(x) z = x + \sum_{v \in E(x)}\lambda_v v \lambda_v \mathbb R^2 \mathbb R^3","['linear-algebra', 'geometry', 'discrete-mathematics', 'linear-programming', 'polytopes']"
24,Can the trace of a positive matrix increase under a projection?,Can the trace of a positive matrix increase under a projection?,,"The question is concerned with symmetric matrices $\mathbb{S}_n$ as a real vector space. Let $X$ be a positive semidefinite symmetric matrix, and let $P : \mathbb{S}_n \to \mathcal{V}$ be a projection onto some subspace $\mathcal{V} \subset \mathbb{S}_n$ . Is it always the case that $\mathrm{trace}(P(X)) \leq \mathrm{trace}(X)$ ? I can see this being true when $\mathcal{V}$ has an orthonormal basis $\{A_i\}$ consisting of matrices which are all either trace $0$ or positive and trace $\leq 1$ . But in general I don't know anything about what kind of basis $\mathcal{V}$ would admit. Is it possible to come up with a counterexample?","The question is concerned with symmetric matrices as a real vector space. Let be a positive semidefinite symmetric matrix, and let be a projection onto some subspace . Is it always the case that ? I can see this being true when has an orthonormal basis consisting of matrices which are all either trace or positive and trace . But in general I don't know anything about what kind of basis would admit. Is it possible to come up with a counterexample?",\mathbb{S}_n X P : \mathbb{S}_n \to \mathcal{V} \mathcal{V} \subset \mathbb{S}_n \mathrm{trace}(P(X)) \leq \mathrm{trace}(X) \mathcal{V} \{A_i\} 0 \leq 1 \mathcal{V},"['linear-algebra', 'matrices', 'symmetric-matrices', 'matrix-analysis']"
25,INTUITION: Orthonormal columns implies orthonormal rows [closed],INTUITION: Orthonormal columns implies orthonormal rows [closed],,"Closed . This question is opinion-based . It is not currently accepting answers. Want to improve this question? Update the question so it can be answered with facts and citations by editing this post . Closed 3 years ago . Improve this question I was asked by a student and was stumped upon the very intuition of this statement. I searched on this site and found many proofs but little intuition. For example: Column Vectors orthogonal implies Row Vectors also orthogonal? and Intuition behind row vectors of orthonormal matrix being an orthonormal basis I am open to abstract linear algebra ideas but I don't think they help bring in much intuition. I am hoping for either a geometric intuition , a quick algebraic manipulation on vector components, or an intuitive explanation of the key step in the proof: $A^TA = AA^T = I$ . Edit: many comments went for the last option of the three. However, it was probably the hardest to gain any intuition with this option. I would personally prefer answers exploring the first two options, or something really really special about this last option.","Closed . This question is opinion-based . It is not currently accepting answers. Want to improve this question? Update the question so it can be answered with facts and citations by editing this post . Closed 3 years ago . Improve this question I was asked by a student and was stumped upon the very intuition of this statement. I searched on this site and found many proofs but little intuition. For example: Column Vectors orthogonal implies Row Vectors also orthogonal? and Intuition behind row vectors of orthonormal matrix being an orthonormal basis I am open to abstract linear algebra ideas but I don't think they help bring in much intuition. I am hoping for either a geometric intuition , a quick algebraic manipulation on vector components, or an intuitive explanation of the key step in the proof: . Edit: many comments went for the last option of the three. However, it was probably the hardest to gain any intuition with this option. I would personally prefer answers exploring the first two options, or something really really special about this last option.",A^TA = AA^T = I,"['linear-algebra', 'matrices', 'vector-spaces', 'intuition']"
26,"Prove $D \in \mathcal{L}(\mathcal{P}(\mathbf{R}),\mathcal{P}(\mathbf{R})) : \text{deg}(D(p)) = \text{deg}(p) - 1$ is surjective",Prove  is surjective,"D \in \mathcal{L}(\mathcal{P}(\mathbf{R}),\mathcal{P}(\mathbf{R})) : \text{deg}(D(p)) = \text{deg}(p) - 1","Suppose $D \in \mathcal{L}(\mathcal{P}(\mathbf{R}),\mathcal{P}(\mathbf{R}))$ is such that $\deg(D(p)) = \deg(p) - 1$ for every nonconstant polynomial $p \in \mathcal{P}(\mathbf{R})$ . Prove that $D$ is surjective. I have attempted an answer, however, I think it is incorrect: We can redefine this as a linear map between two finite dimentional vector spaces: $$ D \in \mathcal{L}(\mathcal{P}_m(\mathbf{R}),\mathcal{P}_{m-1}(\mathbf{R})) $$ for $m > 0$ . Let $(1, x, x^2 \ldots, x^{m-1})$ be a basis for $\mathcal{P}_{m-1}$ . We can extend this to a basis of $\mathcal{P}_m$ because $\mathcal{P}_{m-1} \subset \mathcal{P}_m$ : $$(1, x, x^2 \ldots, x^{m-1}, x^m)\text{.}$$ Then define $D$ : \begin{align} D(x^i) &= x^i, i = 0, \ldots, m - 1 \\ D(x^m) &= 0 \end{align} Clearly then, $\text{range}(D) = \mathcal{P}_{m-1}$ , as $(1, x, x^2 \ldots, x^{m-1})$ is a basis for $\text{range}(D)$ . Hence $D$ is surjective. The reason I think this answer is incorrect, is because I have chosen my own definition of $D$ , not proved it for an arbitrary $D$ . However, for similar questions, I often see the answers choose a specific mapping, and I struggle to know when that is acceptable and when it isn't.","Suppose is such that for every nonconstant polynomial . Prove that is surjective. I have attempted an answer, however, I think it is incorrect: We can redefine this as a linear map between two finite dimentional vector spaces: for . Let be a basis for . We can extend this to a basis of because : Then define : Clearly then, , as is a basis for . Hence is surjective. The reason I think this answer is incorrect, is because I have chosen my own definition of , not proved it for an arbitrary . However, for similar questions, I often see the answers choose a specific mapping, and I struggle to know when that is acceptable and when it isn't.","D \in \mathcal{L}(\mathcal{P}(\mathbf{R}),\mathcal{P}(\mathbf{R})) \deg(D(p)) = \deg(p) - 1 p \in \mathcal{P}(\mathbf{R}) D 
D \in \mathcal{L}(\mathcal{P}_m(\mathbf{R}),\mathcal{P}_{m-1}(\mathbf{R}))
 m > 0 (1, x, x^2 \ldots, x^{m-1}) \mathcal{P}_{m-1} \mathcal{P}_m \mathcal{P}_{m-1} \subset \mathcal{P}_m (1, x, x^2 \ldots, x^{m-1}, x^m)\text{.} D \begin{align}
D(x^i) &= x^i, i = 0, \ldots, m - 1 \\
D(x^m) &= 0
\end{align} \text{range}(D) = \mathcal{P}_{m-1} (1, x, x^2 \ldots, x^{m-1}) \text{range}(D) D D D","['linear-algebra', 'linear-transformations']"
27,Prove that commuting matrices over an algebraically closed field are simultaneously triangularizable.,Prove that commuting matrices over an algebraically closed field are simultaneously triangularizable.,,"Given an algebraically closed field $\mathbb K$ and matrices $A, B \in \mathbb K^{n \times n}$ such that $A B = B A$ , show that $A$ and $B$ are simultaneously triangularizable, i.e., show that there exists a matrix $T$ such that $T^{-1} A T$ and $T^{-1} B T$ are both upper triangular.","Given an algebraically closed field and matrices such that , show that and are simultaneously triangularizable, i.e., show that there exists a matrix such that and are both upper triangular.","\mathbb K A, B \in \mathbb K^{n \times n} A B = B A A B T T^{-1} A T T^{-1} B T","['linear-algebra', 'matrices', 'triangularization']"
28,"If for invertible matrices $A$ and $X$, $XAX^{-1}=A^2$ then eigenvalues of $A$ are $n^{th}$ roots of unity.","If for invertible matrices  and ,  then eigenvalues of  are  roots of unity.",A X XAX^{-1}=A^2 A n^{th},"Question: Let $A$ and $X$ be two complex invertible matrices such that $XAX^{-1}=A^2$ . Show that there exists a natural number $n$ such that each eigenvalue of $A$ is an $n^{th}$ root of unity. I can say from here, $\operatorname{det}(A)=1$ and I guess somehow I have to show $A^n=I$ , for some $n$ , which will give the result. But I have no idea how to show it from the fact that $A$ and $A^2$ are similar matrices. Any hint!!","Question: Let and be two complex invertible matrices such that . Show that there exists a natural number such that each eigenvalue of is an root of unity. I can say from here, and I guess somehow I have to show , for some , which will give the result. But I have no idea how to show it from the fact that and are similar matrices. Any hint!!",A X XAX^{-1}=A^2 n A n^{th} \operatorname{det}(A)=1 A^n=I n A A^2,['linear-algebra']
29,Easiest way to prove the Rouché–Capelli theorem,Easiest way to prove the Rouché–Capelli theorem,,"Rouché–Capelli theorem (Kronecker–Capelli theorem/Rouché–Fontené theorem/Rouché–Frobenius theorem/Frobenius theorem) states that for the non-homogeneous system Ax = b, $(i)$ $Ax = b$ has a unique solution if and only if $rank[A] = rank[A|b] = n$ $(ii)$ $Ax = b$ is inconsistent (i.e., no solution exists) if and only if $rank[A] < rank[A|b]$ $(iii)$ $Ax = b$ has infinitely many solutions if and only if $rank[A] = rank[A|b] < n$ How do I derive these conditions ? My Understanding $(i)$ $Ax=b$ has a unique solution $A^{-1}$ exists $\implies \boxed{x=A^{-1}b} \implies |A|\neq 0 \implies rank(A)=n$ If solution exists, then $\vec{A}_1x_1+\vec{A}_2x_2+....+\vec{A}_nx_n=b\implies b$ is a linear combination of the column vectors $\implies rank[A|b]=rank[A]=n$ $(ii)$ $Ax=b$ is inconsistent (i.e., no solution exists) $\boxed{|A|x=(adj A)b\implies |A|=0 \quad\&\quad adj A.b\neq 0}$ $|A|=0\implies rank[A]<n$ Is there a way to prove the last two conditions of the Rouché–Capelli theorem ?","Rouché–Capelli theorem (Kronecker–Capelli theorem/Rouché–Fontené theorem/Rouché–Frobenius theorem/Frobenius theorem) states that for the non-homogeneous system Ax = b, has a unique solution if and only if is inconsistent (i.e., no solution exists) if and only if has infinitely many solutions if and only if How do I derive these conditions ? My Understanding has a unique solution exists If solution exists, then is a linear combination of the column vectors is inconsistent (i.e., no solution exists) Is there a way to prove the last two conditions of the Rouché–Capelli theorem ?","(i) Ax = b rank[A] = rank[A|b] = n (ii) Ax = b rank[A] <
rank[A|b] (iii) Ax = b rank[A] = rank[A|b] < n (i) Ax=b A^{-1} \implies \boxed{x=A^{-1}b} \implies |A|\neq 0 \implies rank(A)=n \vec{A}_1x_1+\vec{A}_2x_2+....+\vec{A}_nx_n=b\implies b \implies rank[A|b]=rank[A]=n (ii) Ax=b \boxed{|A|x=(adj A)b\implies |A|=0 \quad\&\quad adj A.b\neq 0} |A|=0\implies rank[A]<n","['linear-algebra', 'matrix-rank']"
