,title_raw,title_text,title_latex,body_raw,body_text,body_latex,tags
44,What might be the definition of a positively oriented chart in From Calculus to Cohomology?,What might be the definition of a positively oriented chart in From Calculus to Cohomology?,,"My book is From Calculus to Cohomology by Ib Madsen and Jørgen Tornehave. I recently finished most of An Introduction to Manifolds by Loring W. Tu, so based on the preface of From Calculus to Cohomology, I started at Chapter 8. I don't believe I've missed anything since charts are first introduced in Chapter 8. Question : What's a positively oriented chart, first mentioned in Proposition 10.2 , please? Some context : I think this is relevant in answering my other question: Why is there a form with compact support on a connected oriented manifold with integral one but with support contained in a given open proper subset? I think I have to prove either the chart $(U, g: U \to g(U) = U')$ or some restriction $(W, g|_W:W \to g(W))$ , $W$ open in $U$ , is a ""positively oriented chart"" or at least an ""oriented chart"" in order to apply Proposition 10.2 My guesses : The definition of ""oriented chart"" in the book (see also previous definitions of orientation ) is meant to be ""positively oriented chart"" with ""negatively oriented chart"" to be for orientation-reversing. I mean that 1.1. a chart $(U,h:U \to U')$ is an oriented chart if and only if it is a member of an oriented atlas of an oriented smooth $n$ -dimensional manifold, and we sometimes omit $U$ and $U'$ and call $h$ , the coordinate map, an oriented chart (instead of something like ""oriented map"") 1.2 An oriented chart $(U,h:U \to U')$ , or just $h$ , is positively oriented if and only if $h:U \to U'$ is an orientation-preserving diffeomorphism if and only if $\det(D_q(h)) > 0$ if and only if $D_qh: T_qU = T_qM \to T_{h(q)}U' = T_{h(q)} \mathbb R^n$ is an orientation-preserving diffeomorphism of manifolds  (See here and here ) if and only if $D_qh: T_qU = T_qM \to T_{h(q)}U' = T_{h(q)} \mathbb R^n$ is an orientation-preserving vector space isomorphism of tangent spaces In Proposition 10.2 , what is meant by ""positively oriented chart"" is simply ""oriented chart"" if we go with the convention that ""oriented charts"" are ""positively oriented charts"", as originally in the book. I also tried looking up other books: An Introduction to Manifolds by Loring W. Tu: Based on Section 21.5 and Subsection 23.4 , I believe the definition for integration is for a chart in an ""oriented atlas"" of $M$ , where an ""oriented atlas"" is defined one where overlapping charts have positive Jacobian determinant. Thus, ""oriented atlas"" in An Introduction to Manifolds seems to be the same as ""positive atlas"" in From Calculus to Cohomology. Manifolds, Tensor Analysis, and Applications by Ralph Abraham, Jerrold E. Marsden, Tudor Ratiu : It seems a coordinate chart is defined as positively oriented if the coordinate chart's coordinate map has all its differentials to be orientation preserving ( as in vector spaces or as in manifolds, if we still have such equivalence of the 2 notions of orientation preserving ). If this is what is meant, then to clarify, do we, once again, have a notion, namely the notion of positively oriented chart, that is actually rooted in some prerequisite algebra notion ? I'm not sure this is (exactly) what Madsen and Tornehave mean because there is a difference in definition for manifolds. Update : Based on the proof of Theorem 11.9 , which relies on Lemma 11.8 , I think this might be the definition or at least equivalent to, implied by or implies the definition. Introduction to Smooth Manifolds by John M. Lee: It seems the definition is that for an oriented smooth $n$ -manifold $M$ with or without boundary, for a coordinate chart $(U,\varphi) = (U,x^1,...,x^n)$ in the differentiable structure of $M$ (see Tu Subsection 5.3 ), where $x^i=r^i \circ \varphi$ , where $r^1, ..., r^n$ are the standard coordinates on $\mathbb R^n$ , $(U,\varphi)$ is said to be positively oriented if the frame $\{\frac{\partial}{\partial x^1}, ..., \frac{\partial}{\partial x^n}\}$ is positively oriented. I think there's no explicit concept of ""manifold with boundary"" or ""frame"" in From Calculus to Cohomology by Ib Madsen and Jørgen Tornehave so far, and so if we were to adopt this definition, ""if the frame $\{\frac{\partial}{\partial x^1}, ..., \frac{\partial}{\partial x^n}\}$ is positively oriented"" would be translated to ""if each element of the set $\{\frac{\partial}{\partial x^1}|_p, ..., \frac{\partial}{\partial x^n}|_p\}_{p \in M}$ is positively oriented"". Since each element is a basis of the tangent space $T_pM$ , based on Tu Subsection 21.3 (Tu says it was in Subsection 12.5, but I'm not sure that was explicit unless Subsection 12.5 was understood in the context of Proposition 8.9 ), and this is indeed defined after Definition 9.8","My book is From Calculus to Cohomology by Ib Madsen and Jørgen Tornehave. I recently finished most of An Introduction to Manifolds by Loring W. Tu, so based on the preface of From Calculus to Cohomology, I started at Chapter 8. I don't believe I've missed anything since charts are first introduced in Chapter 8. Question : What's a positively oriented chart, first mentioned in Proposition 10.2 , please? Some context : I think this is relevant in answering my other question: Why is there a form with compact support on a connected oriented manifold with integral one but with support contained in a given open proper subset? I think I have to prove either the chart or some restriction , open in , is a ""positively oriented chart"" or at least an ""oriented chart"" in order to apply Proposition 10.2 My guesses : The definition of ""oriented chart"" in the book (see also previous definitions of orientation ) is meant to be ""positively oriented chart"" with ""negatively oriented chart"" to be for orientation-reversing. I mean that 1.1. a chart is an oriented chart if and only if it is a member of an oriented atlas of an oriented smooth -dimensional manifold, and we sometimes omit and and call , the coordinate map, an oriented chart (instead of something like ""oriented map"") 1.2 An oriented chart , or just , is positively oriented if and only if is an orientation-preserving diffeomorphism if and only if if and only if is an orientation-preserving diffeomorphism of manifolds  (See here and here ) if and only if is an orientation-preserving vector space isomorphism of tangent spaces In Proposition 10.2 , what is meant by ""positively oriented chart"" is simply ""oriented chart"" if we go with the convention that ""oriented charts"" are ""positively oriented charts"", as originally in the book. I also tried looking up other books: An Introduction to Manifolds by Loring W. Tu: Based on Section 21.5 and Subsection 23.4 , I believe the definition for integration is for a chart in an ""oriented atlas"" of , where an ""oriented atlas"" is defined one where overlapping charts have positive Jacobian determinant. Thus, ""oriented atlas"" in An Introduction to Manifolds seems to be the same as ""positive atlas"" in From Calculus to Cohomology. Manifolds, Tensor Analysis, and Applications by Ralph Abraham, Jerrold E. Marsden, Tudor Ratiu : It seems a coordinate chart is defined as positively oriented if the coordinate chart's coordinate map has all its differentials to be orientation preserving ( as in vector spaces or as in manifolds, if we still have such equivalence of the 2 notions of orientation preserving ). If this is what is meant, then to clarify, do we, once again, have a notion, namely the notion of positively oriented chart, that is actually rooted in some prerequisite algebra notion ? I'm not sure this is (exactly) what Madsen and Tornehave mean because there is a difference in definition for manifolds. Update : Based on the proof of Theorem 11.9 , which relies on Lemma 11.8 , I think this might be the definition or at least equivalent to, implied by or implies the definition. Introduction to Smooth Manifolds by John M. Lee: It seems the definition is that for an oriented smooth -manifold with or without boundary, for a coordinate chart in the differentiable structure of (see Tu Subsection 5.3 ), where , where are the standard coordinates on , is said to be positively oriented if the frame is positively oriented. I think there's no explicit concept of ""manifold with boundary"" or ""frame"" in From Calculus to Cohomology by Ib Madsen and Jørgen Tornehave so far, and so if we were to adopt this definition, ""if the frame is positively oriented"" would be translated to ""if each element of the set is positively oriented"". Since each element is a basis of the tangent space , based on Tu Subsection 21.3 (Tu says it was in Subsection 12.5, but I'm not sure that was explicit unless Subsection 12.5 was understood in the context of Proposition 8.9 ), and this is indeed defined after Definition 9.8","(U, g: U \to g(U) = U') (W, g|_W:W \to g(W)) W U (U,h:U \to U') n U U' h (U,h:U \to U') h h:U \to U' \det(D_q(h)) > 0 D_qh: T_qU = T_qM \to T_{h(q)}U' = T_{h(q)} \mathbb R^n D_qh: T_qU = T_qM \to T_{h(q)}U' = T_{h(q)} \mathbb R^n M n M (U,\varphi) = (U,x^1,...,x^n) M x^i=r^i \circ \varphi r^1, ..., r^n \mathbb R^n (U,\varphi) \{\frac{\partial}{\partial x^1}, ..., \frac{\partial}{\partial x^n}\} \{\frac{\partial}{\partial x^1}, ..., \frac{\partial}{\partial x^n}\} \{\frac{\partial}{\partial x^1}|_p, ..., \frac{\partial}{\partial x^n}|_p\}_{p \in M} T_pM","['linear-algebra', 'general-topology']"
45,Find a basis $A$ of space $\mathbb R^{4}$ and basis $B$ of space $\mathbb R^{3}$,Find a basis  of space  and basis  of space,A \mathbb R^{4} B \mathbb R^{3},"Let $\varphi: \mathbb R^{4} \rightarrow \mathbb R^{3}$ : $$\varphi(x_{1},x_{2},x_{3},x_{4})=(x_{1}+x_{3}+x_{4},x_{1}+x_{2}+2x_{3}+3x_{4},x_{1}-x_{2}-x_{4})$$ Find a basis $A$ of space $\mathbb R^{4}$ and basis $B$ of space $\mathbb R^{3}$ such that $M(\varphi)^{B}_{A}={\begin{bmatrix}1&0&0&0\\0&1&0&0\\0&0&0&0\end{bmatrix}}$ I think that I know how to do this task. However I really need an assessment if it is correct. My try: $M(\varphi)^{st}_{st}={\begin{bmatrix}1&0&1&1\\1&1&2&3\\1&-1&0&-1\end{bmatrix}}$ After elementary operations on the matrix $M(\varphi)^{st}_{st}$ I have system of equations: $\begin{cases}  x_{1}+x_{3}+x_{4}=0 \\  x_{2}+x_{3}+2x_{4}=0\end{cases}$ So $\ker \varphi=lin\left\{(-1,-1,1,0),(-1,-2,0,1)\right\}$ . This vectors are in a basis $A$ but I need two more vectors. $\dim(\ker\varphi)=2$ so $\dim(im \varphi)=2$ and it can be: $(1,1,1),(0,1,-1)$ (I take $2$ linearly independent vectors from the matrix $M(\varphi)^{st}_{st}$ columns). This vectors are in a basis $B$ . In this moment I have $A=\left\{\alpha_{1}, \alpha_{2},(-1,-1,1,0),(-1,-2,0,1)\right\}$ and $B=\left\{(1,1,1),(0,1,-1),\beta_{3}\right\}$ From $M(\varphi)^{B}_{A}$ I have: $\varphi(\alpha_{1})=1 \cdot \beta_{1}$ $\varphi(\alpha_{2})=1 \cdot \beta_{2}$ $\varphi(\alpha_{3})=0$ $\varphi(\alpha_{4})=0$ That is why: $\varphi(\alpha_{1})=(1,1,1)$ and $\alpha_{1}=(1,0,0,0)$ $\varphi(\alpha_{2})=(0,1,-1)$ and $\alpha_{2}=(0,1,0,0)$ $\beta_{3}$ I can choose anyway because I do not have any dependencies on it. It can be linerly indipendent from other basis vectors, so it can be $\beta=(0,0,1)$ I will be extremely grateful for checking this solution and indicating any errors.","Let : Find a basis of space and basis of space such that I think that I know how to do this task. However I really need an assessment if it is correct. My try: After elementary operations on the matrix I have system of equations: So . This vectors are in a basis but I need two more vectors. so and it can be: (I take linearly independent vectors from the matrix columns). This vectors are in a basis . In this moment I have and From I have: That is why: and and I can choose anyway because I do not have any dependencies on it. It can be linerly indipendent from other basis vectors, so it can be I will be extremely grateful for checking this solution and indicating any errors.","\varphi: \mathbb R^{4} \rightarrow \mathbb R^{3} \varphi(x_{1},x_{2},x_{3},x_{4})=(x_{1}+x_{3}+x_{4},x_{1}+x_{2}+2x_{3}+3x_{4},x_{1}-x_{2}-x_{4}) A \mathbb R^{4} B \mathbb R^{3} M(\varphi)^{B}_{A}={\begin{bmatrix}1&0&0&0\\0&1&0&0\\0&0&0&0\end{bmatrix}} M(\varphi)^{st}_{st}={\begin{bmatrix}1&0&1&1\\1&1&2&3\\1&-1&0&-1\end{bmatrix}} M(\varphi)^{st}_{st} \begin{cases} 
x_{1}+x_{3}+x_{4}=0 \\ 
x_{2}+x_{3}+2x_{4}=0\end{cases} \ker \varphi=lin\left\{(-1,-1,1,0),(-1,-2,0,1)\right\} A \dim(\ker\varphi)=2 \dim(im \varphi)=2 (1,1,1),(0,1,-1) 2 M(\varphi)^{st}_{st} B A=\left\{\alpha_{1}, \alpha_{2},(-1,-1,1,0),(-1,-2,0,1)\right\} B=\left\{(1,1,1),(0,1,-1),\beta_{3}\right\} M(\varphi)^{B}_{A} \varphi(\alpha_{1})=1 \cdot \beta_{1} \varphi(\alpha_{2})=1 \cdot \beta_{2} \varphi(\alpha_{3})=0 \varphi(\alpha_{4})=0 \varphi(\alpha_{1})=(1,1,1) \alpha_{1}=(1,0,0,0) \varphi(\alpha_{2})=(0,1,-1) \alpha_{2}=(0,1,0,0) \beta_{3} \beta=(0,0,1)",['linear-algebra']
46,"If A is a real non-singular square matrix, then there exists a real matrix $B$ such that $e^B$ $=$ $A^2$","If A is a real non-singular square matrix, then there exists a real matrix  such that",B e^B = A^2,"If we consider the matrix exponential map on $M_n(\mathbb R)$ , then what will be the image set of the exponential map? I have seen this . From there I can say that $exp(M_n(\mathbb C))=GL_n(\mathbb C)$ . But what about the set $exp(M_n(\mathbb R))$ ? In the exercise 66 of this link I have $exp(M_n(\mathbb R))\neq GL_n(\mathbb R)$ . Even it says that : If A is a real non-singular square matrix, then there exists a real matrix B such that $e^B=A^2$ How can I prove this statement?  Any help please. Thanks in advance.","If we consider the matrix exponential map on , then what will be the image set of the exponential map? I have seen this . From there I can say that . But what about the set ? In the exercise 66 of this link I have . Even it says that : If A is a real non-singular square matrix, then there exists a real matrix B such that How can I prove this statement?  Any help please. Thanks in advance.",M_n(\mathbb R) exp(M_n(\mathbb C))=GL_n(\mathbb C) exp(M_n(\mathbb R)) exp(M_n(\mathbb R))\neq GL_n(\mathbb R) e^B=A^2,"['linear-algebra', 'matrices', 'group-theory', 'matrix-exponential']"
47,Non-orthogonal invariant subspaces,Non-orthogonal invariant subspaces,,"Let $\Gamma\subset\mathrm O(\Bbb R^n)$ be a finite group of orthogonal matrices. Let $U_1,U_2\subseteq\Bbb R^n$ be two irreducible invariant subspaces w.r.t. $\Gamma$ with $U_1\cap U_2=\{0\}$ , which are not orthogonal to each other, i.e. there are $u_i\in U_i$ with $\langle u_1,u_2\rangle \not=0$ . I was sceptic about the existence of such, but you can find examples here in a previous question of mine. Thinking a bit about such subspaces, I came to the following question: Question: Is it true, that: $\dim U_1=\dim U_2=:d$ . Every other $d$ -dimensional subspace $U\subset U_1\oplus U_2$ with $U\cap U_i=\{0\}$ is an irreducible invariant subspace as well. There are two orthogonal $d$ -dimensional irreducible invariant subspaces $\bar U_1,\bar U_2\subset U_1\oplus U_2$ . Update The second statement is not correct, but should be substituted by a different one. One version was given in the answer of Joppy . I can also think about something like this: every $u\in U_1\oplus U_2\setminus\{0\}$ is contained in exactly one $d$ -dimensional irreducible invariant subspace $U\subset U_1\oplus U_2$ .","Let be a finite group of orthogonal matrices. Let be two irreducible invariant subspaces w.r.t. with , which are not orthogonal to each other, i.e. there are with . I was sceptic about the existence of such, but you can find examples here in a previous question of mine. Thinking a bit about such subspaces, I came to the following question: Question: Is it true, that: . Every other -dimensional subspace with is an irreducible invariant subspace as well. There are two orthogonal -dimensional irreducible invariant subspaces . Update The second statement is not correct, but should be substituted by a different one. One version was given in the answer of Joppy . I can also think about something like this: every is contained in exactly one -dimensional irreducible invariant subspace .","\Gamma\subset\mathrm O(\Bbb R^n) U_1,U_2\subseteq\Bbb R^n \Gamma U_1\cap U_2=\{0\} u_i\in U_i \langle u_1,u_2\rangle \not=0 \dim U_1=\dim U_2=:d d U\subset U_1\oplus U_2 U\cap U_i=\{0\} d \bar U_1,\bar U_2\subset U_1\oplus U_2 u\in U_1\oplus U_2\setminus\{0\} d U\subset U_1\oplus U_2","['linear-algebra', 'matrices', 'group-theory', 'representation-theory', 'invariant-subspace']"
48,"If $V = \text{null}(T-\lambda I) \oplus \text{range}(T-\lambda I)$, then $T$ is diagonalizable?","If , then  is diagonalizable?",V = \text{null}(T-\lambda I) \oplus \text{range}(T-\lambda I) T,"$V$ is a finite-dimensional complex vector space and $T \in L(V)$ ( $L(V)$ is the set of all linear maps from $V$ to itself), and $\lambda$ is arbitrary in $\mathbb{C}$ . I know $T$ is diagonalizable if it has $\text{dim}(V)$ distinct eigenvalues, or if $V$ has a basis consisting of eigenvectors of $T$ . I was thinking it might also have something to do with eigenspaces (there are a few theorems with diagonalizability and eigenspaces in my text), since those specifically handle $\text{null}(T-\lambda I)$ , but then that would leave out the range. I have the definition of an eigenspace, direct sum, diagonalizability, and some conditions equivalent to diagonalizability, i.e. a matrix is diagonalizable if V consists of eigenvectors of T, there exist 1-dimensional subspaces of V that are invariant under T, where V is the direct sum of these 1D subspaces, V is the direct sum of eigenspaces of T corresponding to each eigenvalue, and the dimension of V is the same as the dimension of the sum of these eigenspaces. Also, the book is ""Linear Algebra Done Right"" by Sheldon Axler. I also have that $T$ is diagonalizable if it contains $dim(V)$ distinct eigenvalues.","is a finite-dimensional complex vector space and ( is the set of all linear maps from to itself), and is arbitrary in . I know is diagonalizable if it has distinct eigenvalues, or if has a basis consisting of eigenvectors of . I was thinking it might also have something to do with eigenspaces (there are a few theorems with diagonalizability and eigenspaces in my text), since those specifically handle , but then that would leave out the range. I have the definition of an eigenspace, direct sum, diagonalizability, and some conditions equivalent to diagonalizability, i.e. a matrix is diagonalizable if V consists of eigenvectors of T, there exist 1-dimensional subspaces of V that are invariant under T, where V is the direct sum of these 1D subspaces, V is the direct sum of eigenspaces of T corresponding to each eigenvalue, and the dimension of V is the same as the dimension of the sum of these eigenspaces. Also, the book is ""Linear Algebra Done Right"" by Sheldon Axler. I also have that is diagonalizable if it contains distinct eigenvalues.",V T \in L(V) L(V) V \lambda \mathbb{C} T \text{dim}(V) V T \text{null}(T-\lambda I) T dim(V),"['linear-algebra', 'linear-transformations', 'direct-sum']"
49,How can a function including a sin operation be linearly transformable for any offset?,How can a function including a sin operation be linearly transformable for any offset?,,"In the paper ""Attention is all you need"" the authors have chosen a function to encode the position of a word in a sequence (section 3.5). The following encoding is chosen: $ PE(pos, 2dim) = sin(pos / 10000 ^ {2dim/d_{model}} ) $ For the purposes of this question this function can be simplified to: $ PE(pos) = sin(pos) $ The text states that ""for any fixed offset $k$ , $PE(pos+k)$ can be represented as a linear function of $PE(pos)$ "". This did not seem obvious due to me due to the nonlinearity of the sine function. Other resources like Attention is all you need Explained mention this property but do not go deeper into it. I attempted to use linear regression techniques in Python to derive this, but  was unable to find a fitting linear transform. As $k$ increases and the sine waves resulting from the $PE(pos)$ function get out of sync, the correlation of the transformation and the truth decreases. Did I misapprehend the statement in the paper, or is my code or understanding of the underlying math here faulty?","In the paper ""Attention is all you need"" the authors have chosen a function to encode the position of a word in a sequence (section 3.5). The following encoding is chosen: For the purposes of this question this function can be simplified to: The text states that ""for any fixed offset , can be represented as a linear function of "". This did not seem obvious due to me due to the nonlinearity of the sine function. Other resources like Attention is all you need Explained mention this property but do not go deeper into it. I attempted to use linear regression techniques in Python to derive this, but  was unable to find a fitting linear transform. As increases and the sine waves resulting from the function get out of sync, the correlation of the transformation and the truth decreases. Did I misapprehend the statement in the paper, or is my code or understanding of the underlying math here faulty?"," PE(pos, 2dim) = sin(pos / 10000 ^ {2dim/d_{model}} )   PE(pos) = sin(pos)  k PE(pos+k) PE(pos) k PE(pos)","['linear-algebra', 'geometry', 'linear-transformations', 'nonlinear-analysis']"
50,"If $Q$ is a proper orthogonal transformation matrix, deduce that $\det(1-Q)=0$.","If  is a proper orthogonal transformation matrix, deduce that .",Q \det(1-Q)=0,"Show that if $Q$ is orthogonal transformation matrix, then $Q^t(Q-1)=(1-Q)^t$ . Deduce that if $Q$ is also proper, then $\det(1-Q)=0$ . Hence show that transformation has nonzero vector that has the same components in both coordinate system. I tried to solve this problem.I think I got the first part right, $$Q^t(Q -1)= Q^t  Q- Q^t=1- Q^t=(1- Q)^t$$ The second part, $$-Q ^t(1-Q)=(1-Q)^t$$ $$\det(-Q^t)\det(1-Q)=\det((1-Q)^t$$ $$(-1)^n\det(Q)\det(1-Q)=\det((1-Q)^t)$$ since the orthogonal matrix is proper which means $\det(Q)=1$ and for any matrix, its determinant equals the determinant of its transpose. $$(-1)^n\det(1-Q)=\det(1-Q)$$ So, it's always true for $\det(1-Q)=0$ But that's not what the question asks. I haven't done linear algebra for a while and I am not sure from the concepts I used, so I would be glad if you clarify any mistake I made.","Show that if is orthogonal transformation matrix, then . Deduce that if is also proper, then . Hence show that transformation has nonzero vector that has the same components in both coordinate system. I tried to solve this problem.I think I got the first part right, The second part, since the orthogonal matrix is proper which means and for any matrix, its determinant equals the determinant of its transpose. So, it's always true for But that's not what the question asks. I haven't done linear algebra for a while and I am not sure from the concepts I used, so I would be glad if you clarify any mistake I made.",Q Q^t(Q-1)=(1-Q)^t Q \det(1-Q)=0 Q^t(Q -1)= Q^t  Q- Q^t=1- Q^t=(1- Q)^t -Q ^t(1-Q)=(1-Q)^t \det(-Q^t)\det(1-Q)=\det((1-Q)^t (-1)^n\det(Q)\det(1-Q)=\det((1-Q)^t) \det(Q)=1 (-1)^n\det(1-Q)=\det(1-Q) \det(1-Q)=0,"['linear-algebra', 'orthogonality']"
