,title_raw,title_text,title_latex,body_raw,body_text,body_latex,tags
0,upper bound of a double sequence,upper bound of a double sequence,,"Let $\{ a_{k,m} \}$ be a doublely indexed sequence of positive numbers satisfying: $a_{1,n}\leq \frac{1}{n+1}\quad $ and $\quad a_{k,m} \leq \frac{1}{m+1}(a_{k-1,m+1}+L a_{k-1,m+2})\quad \quad (1)$   , where $L$ is a positive constant and indices $k,m,n$ are non-negative integers. My question is: what is the upper bound for $a_{n,0}$ in terms of n ? I try to find the bound by induction using relation in $(1)$  to reduce the index $n$ in $a_{n,0}$ to $1$, but I'm not able to compute the final representation in terms of $a_{1,k} (k\geq 1)$.","Let $\{ a_{k,m} \}$ be a doublely indexed sequence of positive numbers satisfying: $a_{1,n}\leq \frac{1}{n+1}\quad $ and $\quad a_{k,m} \leq \frac{1}{m+1}(a_{k-1,m+1}+L a_{k-1,m+2})\quad \quad (1)$   , where $L$ is a positive constant and indices $k,m,n$ are non-negative integers. My question is: what is the upper bound for $a_{n,0}$ in terms of n ? I try to find the bound by induction using relation in $(1)$  to reduce the index $n$ in $a_{n,0}$ to $1$, but I'm not able to compute the final representation in terms of $a_{1,k} (k\geq 1)$.",,"['sequences-and-series', 'combinatorics', 'inequality', 'induction']"
1,FRACTRAN for natural numbers,FRACTRAN for natural numbers,,"Is there a simple analogue of FRACTRAN that maps a natural number to a natural number, instead of mapping a list of fractions to a natural number? One could use Gödel encoding to translate FRACTRAN directly to natural numbers only, but such a construction would probably be contrived. Is there a more elegant alternative? I think a generalization of the Collatz function might be a candidate, but what is the simplest example of such a function that is Turing-complete? For example, it is undecideable whether functions of the form $$g(n)=a_in+b_i\qquad n\equiv i \pmod P$$ reach the number 1, for all $g$ and $n$, when iterated repeatedly.","Is there a simple analogue of FRACTRAN that maps a natural number to a natural number, instead of mapping a list of fractions to a natural number? One could use Gödel encoding to translate FRACTRAN directly to natural numbers only, but such a construction would probably be contrived. Is there a more elegant alternative? I think a generalization of the Collatz function might be a candidate, but what is the simplest example of such a function that is Turing-complete? For example, it is undecideable whether functions of the form $$g(n)=a_in+b_i\qquad n\equiv i \pmod P$$ reach the number 1, for all $g$ and $n$, when iterated repeatedly.",,"['sequences-and-series', 'number-theory', 'modular-arithmetic', 'computer-science', 'computability']"
2,Find the value of $\sqrt{4+\sqrt[3]{4+\sqrt[4]{4+\sqrt[5]{4+ ....... }}}}$,Find the value of,\sqrt{4+\sqrt[3]{4+\sqrt[4]{4+\sqrt[5]{4+ ....... }}}},I have tried solving this question. It would be great if someone gives some idea about how to go about solving this question.,I have tried solving this question. It would be great if someone gives some idea about how to go about solving this question.,,['sequences-and-series']
3,How to calculate $\sum_{n=1}^{\infty}\frac{(-1)^{n-1}h_n}{n^3}$ where $h_n=\sum_{k=1}^{n}\frac{1}{2k-1}$?,How to calculate  where ?,\sum_{n=1}^{\infty}\frac{(-1)^{n-1}h_n}{n^3} h_n=\sum_{k=1}^{n}\frac{1}{2k-1},"Well known is the relationship $$\displaystyle\sum_{n=1}^{\infty}\frac{h_n}{n^3}=\operatorname{Li}_4(\frac{1}{2})+\frac{1}{24}\ln^42-\frac{\pi^2}{24}\ln^22+\frac{7}{8}\zeta(3)\ln2-\frac{53\pi^4}{5760}$$   Where$$h_n=\displaystyle\sum_{k=1}^{n}\frac{1}{2k-1}$$  Just consider:  $$\displaystyle\int_0^1\frac{\log\,x}{x}\left[\log\frac{1-x}{1+x}\right]^2dx=-8\sum_{n=1}^{\infty}\frac{h_n}{n^3} \text{ put }\,x=\frac{1-t}{1+t}$$ But how to calculate   $$S=\displaystyle\sum_{n=1}^{\infty}\frac{(-1)^{n-1}h_n}{n^3}$$  We have   $$\displaystyle\int_0^{\pi/4}{x}[\log\,\tan\,x]^2dx=\frac{1}{4}\sum_{n=1}^{\infty}\frac{(-1)^{n-1}h_n}{n^3}$$  But how deduct the integral?","Well known is the relationship $$\displaystyle\sum_{n=1}^{\infty}\frac{h_n}{n^3}=\operatorname{Li}_4(\frac{1}{2})+\frac{1}{24}\ln^42-\frac{\pi^2}{24}\ln^22+\frac{7}{8}\zeta(3)\ln2-\frac{53\pi^4}{5760}$$   Where$$h_n=\displaystyle\sum_{k=1}^{n}\frac{1}{2k-1}$$  Just consider:  $$\displaystyle\int_0^1\frac{\log\,x}{x}\left[\log\frac{1-x}{1+x}\right]^2dx=-8\sum_{n=1}^{\infty}\frac{h_n}{n^3} \text{ put }\,x=\frac{1-t}{1+t}$$ But how to calculate   $$S=\displaystyle\sum_{n=1}^{\infty}\frac{(-1)^{n-1}h_n}{n^3}$$  We have   $$\displaystyle\int_0^{\pi/4}{x}[\log\,\tan\,x]^2dx=\frac{1}{4}\sum_{n=1}^{\infty}\frac{(-1)^{n-1}h_n}{n^3}$$  But how deduct the integral?",,"['sequences-and-series', 'definite-integrals', 'improper-integrals', 'closed-form', 'polylogarithm']"
4,Sum involving zeros of Bessel function,Sum involving zeros of Bessel function,,"I came across the following sum in my work involving the infinite sum of function of zeros of Bessel functions. $$ \displaystyle I_0=\sum_{\ell=2}^{\infty}log\left(\frac{j^2_{\nu,\ell}-j^2_{\nu,1}}{j^2_{\nu,\ell}+j^2_{\nu,1}}\right),$$ where $(j_{\nu,l})$ is the sequence of zeros of the Bessel function of first kind $J_\nu$ with $\nu\geq 1/2$.\ Does anyone have any idea of how to evaluate this in term of the order and fews first zero of the Bessel function ? or at least an exploitable upper bound.","I came across the following sum in my work involving the infinite sum of function of zeros of Bessel functions. $$ \displaystyle I_0=\sum_{\ell=2}^{\infty}log\left(\frac{j^2_{\nu,\ell}-j^2_{\nu,1}}{j^2_{\nu,\ell}+j^2_{\nu,1}}\right),$$ where $(j_{\nu,l})$ is the sequence of zeros of the Bessel function of first kind $J_\nu$ with $\nu\geq 1/2$.\ Does anyone have any idea of how to evaluate this in term of the order and fews first zero of the Bessel function ? or at least an exploitable upper bound.",,"['sequences-and-series', 'special-functions', 'bessel-functions']"
5,Sum over all non-evil numbers,Sum over all non-evil numbers,,"I'm working on the following contest math problem: Define an evil number to be any positive integer that contains the   digit $9$. Show that $$ \sum_{x} \frac{1}{x} < 80 $$ where the sum is over all non-evil positive integers $x$. I'm very confused on where to begin. Initially, I tried to consider this sum as part of the sum of $1/x$ over all positive integers, namely by noting that $$ \sum_{n=1}^{\infty} \frac{1}{n} = \sum_{x} \frac{1}{x} + \sum_{y} \frac{1}{y} $$ where the first summation on the right side is the same as in the problem statement and the second is the sum over all evil numbers. However, I can't seem to find a way to use this since the sum of the left diverges. Could anyone lend a helping hand?","I'm working on the following contest math problem: Define an evil number to be any positive integer that contains the   digit $9$. Show that $$ \sum_{x} \frac{1}{x} < 80 $$ where the sum is over all non-evil positive integers $x$. I'm very confused on where to begin. Initially, I tried to consider this sum as part of the sum of $1/x$ over all positive integers, namely by noting that $$ \sum_{n=1}^{\infty} \frac{1}{n} = \sum_{x} \frac{1}{x} + \sum_{y} \frac{1}{y} $$ where the first summation on the right side is the same as in the problem statement and the second is the sum over all evil numbers. However, I can't seem to find a way to use this since the sum of the left diverges. Could anyone lend a helping hand?",,"['sequences-and-series', 'contest-math']"
6,"Evaluation of $\sum_{m,n=-\infty}^{\infty} (m^2+Pn^2)^{-s}$ where $(m,n)\neq 0$",Evaluation of  where,"\sum_{m,n=-\infty}^{\infty} (m^2+Pn^2)^{-s} (m,n)\neq 0","I was trying to learn about evaluating certain double sums and came across this formula: $$\sum_{\begin{matrix}m,n=-\infty \\ (m,n)\neq (0,0)\end{matrix}}^{\infty} \frac{1}{\left( m^2+Pn^2\right)^{s}}=2^{1-t}\sum_{\mu|P}L_{\pm \mu}(s)L_{\mp 4P/\mu}(s)$$   where $P\equiv 1 \ \ (\text{mod } 4)$ and $t$ is the number of distinct factors of $P$. Also   $$L_{\pm d}(s)= \sum_{n=1}^\infty \left( \frac{\pm d}{n}\right)n^{-s}$$   are the primitive $L$ series modulo $d$. $\left(\frac{k}{n}\right)$ is the Kronecker symbol. I verified this formula numerically for $P=5,9$ and it gave correct results. Can you please help me prove this formula?","I was trying to learn about evaluating certain double sums and came across this formula: $$\sum_{\begin{matrix}m,n=-\infty \\ (m,n)\neq (0,0)\end{matrix}}^{\infty} \frac{1}{\left( m^2+Pn^2\right)^{s}}=2^{1-t}\sum_{\mu|P}L_{\pm \mu}(s)L_{\mp 4P/\mu}(s)$$   where $P\equiv 1 \ \ (\text{mod } 4)$ and $t$ is the number of distinct factors of $P$. Also   $$L_{\pm d}(s)= \sum_{n=1}^\infty \left( \frac{\pm d}{n}\right)n^{-s}$$   are the primitive $L$ series modulo $d$. $\left(\frac{k}{n}\right)$ is the Kronecker symbol. I verified this formula numerically for $P=5,9$ and it gave correct results. Can you please help me prove this formula?",,"['sequences-and-series', 'number-theory', 'l-functions']"
7,Introductory book on series,Introductory book on series,,I'm looking for a good introductory book on sequences and series (mathematics). Do you have any advice?,I'm looking for a good introductory book on sequences and series (mathematics). Do you have any advice?,,"['sequences-and-series', 'reference-request']"
8,Infinite series of Hypergeometric function,Infinite series of Hypergeometric function,,"Any ideas how to find a closed form for the sum given by: $$ \sum^\infty_{n=0} \frac{1}{n!}  \frac{a^n b^{n+m}}{(m+n)^2 \Gamma(m+n)} {}_2F_2 \left(m+n,m+n;m+n+1,m+n+1;-b\right) $$ Given that both $a$ and $b$ are positive real numbers, and $m$ is a nonzero positive integer.","Any ideas how to find a closed form for the sum given by: $$ \sum^\infty_{n=0} \frac{1}{n!}  \frac{a^n b^{n+m}}{(m+n)^2 \Gamma(m+n)} {}_2F_2 \left(m+n,m+n;m+n+1,m+n+1;-b\right) $$ Given that both $a$ and $b$ are positive real numbers, and $m$ is a nonzero positive integer.",,"['sequences-and-series', 'special-functions', 'hypergeometric-function']"
9,Prove that every element of $a_{n+2013}=\frac{a_{n+1}a_{n+2}...a_{n+2012}+1}{a_n}$ is an integer,Prove that every element of  is an integer,a_{n+2013}=\frac{a_{n+1}a_{n+2}...a_{n+2012}+1}{a_n},"Given $\displaystyle a_1=a_2=\cdots=a_{2013}=1$ and $\displaystyle a_{n+2013}=\frac{a_{n+1}a_{n+2}\cdots a_{n+2012}+1}{a_n}$ . Prove that $a_{n+2013}\in\mathbb{N}$ for all $n\in\mathbb{N}$ . I tried to prove it with induction, but failed. Please help. Thank you.","Given and . Prove that for all . I tried to prove it with induction, but failed. Please help. Thank you.",\displaystyle a_1=a_2=\cdots=a_{2013}=1 \displaystyle a_{n+2013}=\frac{a_{n+1}a_{n+2}\cdots a_{n+2012}+1}{a_n} a_{n+2013}\in\mathbb{N} n\in\mathbb{N},"['sequences-and-series', 'recurrence-relations']"
10,Two sums with Fibonacci numbers,Two sums with Fibonacci numbers,,Find closed form formula for sum: $\displaystyle\sum_{n=0}^{+\infty}\sum_{k=0}^{n} \frac{F_{2k}F_{n-k}}{10^n}$ Find closed form formula for sum: $\displaystyle\sum_{k=0}^{n}\frac{F_k}{2^k}$ and its limit with $n\to +\infty$. First association with both problems: generating functions and convolution. But I have been thinking about solution for over a week and still can't manage. Can you help me?,Find closed form formula for sum: $\displaystyle\sum_{n=0}^{+\infty}\sum_{k=0}^{n} \frac{F_{2k}F_{n-k}}{10^n}$ Find closed form formula for sum: $\displaystyle\sum_{k=0}^{n}\frac{F_k}{2^k}$ and its limit with $n\to +\infty$. First association with both problems: generating functions and convolution. But I have been thinking about solution for over a week and still can't manage. Can you help me?,,"['sequences-and-series', 'discrete-mathematics', 'fibonacci-numbers']"
11,A Coincidence concerning 163 and the Monster?,A Coincidence concerning 163 and the Monster?,,"There is a McKay-Thompson series for the Monster group, namely $T_{1A}$, responsible for, $e^{\pi\sqrt{163}} \approx 640320^3 + 744$ Another one ($T_{2A}$) for, $e^{\pi/2\sqrt{232}} \approx 396^4 -104$ And a third one ($T_{3A}$) for, $e^{\pi/3\sqrt{267}} \approx 300^3 + 42$ It turns out, as proven by Conway, Norton, and Atkin, that this family of functions span a linear space of dimension 163 .  I found this so intriguing I had to write an article on it. See, "" The 163 Dimensions of the Moonshine Functions "" The Monster is the largest of the sporadic simple groups, and 163 is the largest d such that $Q(\sqrt{-d})$ has unique factorization. Do you think this is just a coincidence?","There is a McKay-Thompson series for the Monster group, namely $T_{1A}$, responsible for, $e^{\pi\sqrt{163}} \approx 640320^3 + 744$ Another one ($T_{2A}$) for, $e^{\pi/2\sqrt{232}} \approx 396^4 -104$ And a third one ($T_{3A}$) for, $e^{\pi/3\sqrt{267}} \approx 300^3 + 42$ It turns out, as proven by Conway, Norton, and Atkin, that this family of functions span a linear space of dimension 163 .  I found this so intriguing I had to write an article on it. See, "" The 163 Dimensions of the Moonshine Functions "" The Monster is the largest of the sporadic simple groups, and 163 is the largest d such that $Q(\sqrt{-d})$ has unique factorization. Do you think this is just a coincidence?",,"['number-theory', 'group-theory', 'sequences-and-series']"
12,"Diagonal  of the double sequence $(n+1)v_{h,n+1}-(2h+1)v_{h,n}-nv_{h,n-1}=0$",Diagonal  of the double sequence,"(n+1)v_{h,n+1}-(2h+1)v_{h,n}-nv_{h,n-1}=0","Update : it is not possible to reply to this question without additional information. My comment below: ""I have to agree with you that one ""cannot derive (2) from (1) alone"". Now it seems to me that one must consider how the sequences $v_{h,n}^{\prime }$ and $v_{h,n}$ are constructed. That is described in the first part of the paper, but unfortunately it is not easy for me to summarize it. As I understand Apéry transformed repeatidely a continued fraction whose approximants are $\dfrac{u_{h,n}^{\prime }}{u_{h,n}}$, iterating on $h$. The above sequences are $v_{h,n}^{\prime }=\dfrac{u_{h,n}^{\prime }}{h!n!}, v_{h,n}=\dfrac{u_{h,n}}{h!n!}$."" In Irrationalité de Certaines Constantes , Bull. section des sciences du C.T.H.S., n.º3, p.37-53, Roger Apéry derives rational approximations $\dfrac{v_{h,n}^{\prime }}{v_{h,n}}$ for $\ln (1+t)$,  $\zeta (2)$ and $\zeta (3)$, the simplest being the one for the $\ln $. The sequences $v_{h,n}^{\prime }$ and $v_{h,n}$, whose ratio converges to $\ln (2)$, satisfy the recursive relation $$(n+1)v_{h,n+1}-(2h+1)v_{h,n}-nv_{h,n-1}=0.\qquad (1)$$ The diagonal sequences $w_{n}^{\prime }=v_{n,n}^{\prime },w_{n}=v_{n,n}$ satisfy $$(n+1)w_{n+1}-3\left( 2n+1\right) w_{n}-nw_{n-1}=0.\qquad (2)$$ Remarks: The initial conditions for $v_{h,n}^{\prime }$, $v_{h,n}$, $w_{n}^{\prime }$, $w_{n}$ are not indicated in the paper. Recurrences $(1)$ and $(2)$ are the particular case for $t=1$ of, respectively, $$(n+1)v_{h,n+1}-\left( \left( n+1\right) -nt+h\left( 1+t\right) \right) v_{h,n}-ntv_{h,n-1}=0\qquad (\ast)$$ (to simplify the notation the index $h$ was deleted in the original) and $$(n+1)w_{n+1}-\left( 2n+1\right) \left( 2+t\right) w_{n}-nt^{2}w_{n-1}=0.\qquad (\ast\ast)$$ Question : How do you derive $(2)$ from $(1)$? Copy of the mentioned paper","Update : it is not possible to reply to this question without additional information. My comment below: ""I have to agree with you that one ""cannot derive (2) from (1) alone"". Now it seems to me that one must consider how the sequences $v_{h,n}^{\prime }$ and $v_{h,n}$ are constructed. That is described in the first part of the paper, but unfortunately it is not easy for me to summarize it. As I understand Apéry transformed repeatidely a continued fraction whose approximants are $\dfrac{u_{h,n}^{\prime }}{u_{h,n}}$, iterating on $h$. The above sequences are $v_{h,n}^{\prime }=\dfrac{u_{h,n}^{\prime }}{h!n!}, v_{h,n}=\dfrac{u_{h,n}}{h!n!}$."" In Irrationalité de Certaines Constantes , Bull. section des sciences du C.T.H.S., n.º3, p.37-53, Roger Apéry derives rational approximations $\dfrac{v_{h,n}^{\prime }}{v_{h,n}}$ for $\ln (1+t)$,  $\zeta (2)$ and $\zeta (3)$, the simplest being the one for the $\ln $. The sequences $v_{h,n}^{\prime }$ and $v_{h,n}$, whose ratio converges to $\ln (2)$, satisfy the recursive relation $$(n+1)v_{h,n+1}-(2h+1)v_{h,n}-nv_{h,n-1}=0.\qquad (1)$$ The diagonal sequences $w_{n}^{\prime }=v_{n,n}^{\prime },w_{n}=v_{n,n}$ satisfy $$(n+1)w_{n+1}-3\left( 2n+1\right) w_{n}-nw_{n-1}=0.\qquad (2)$$ Remarks: The initial conditions for $v_{h,n}^{\prime }$, $v_{h,n}$, $w_{n}^{\prime }$, $w_{n}$ are not indicated in the paper. Recurrences $(1)$ and $(2)$ are the particular case for $t=1$ of, respectively, $$(n+1)v_{h,n+1}-\left( \left( n+1\right) -nt+h\left( 1+t\right) \right) v_{h,n}-ntv_{h,n-1}=0\qquad (\ast)$$ (to simplify the notation the index $h$ was deleted in the original) and $$(n+1)w_{n+1}-\left( 2n+1\right) \left( 2+t\right) w_{n}-nt^{2}w_{n-1}=0.\qquad (\ast\ast)$$ Question : How do you derive $(2)$ from $(1)$? Copy of the mentioned paper",,"['number-theory', 'sequences-and-series', 'recurrence-relations']"
13,Is $\left\{\sqrt{n}\sin^{\circ n}\left(\dfrac{z}{\sqrt{n}}\right)\right\}$ locally uniformly convergent over $\mathbb{C}-\{y{\rm i}:|y|\ge\sqrt{3}\}$?,Is  locally uniformly convergent over ?,\left\{\sqrt{n}\sin^{\circ n}\left(\dfrac{z}{\sqrt{n}}\right)\right\} \mathbb{C}-\{y{\rm i}:|y|\ge\sqrt{3}\},"Note $\sin^{\circ n}x$ as the $n$ -fold iteration of $\sin x$ . It is shown in this great answer that $$ \lim_{n\to\infty}\sqrt{n}\sin^{\circ n}\left(\dfrac{x}{\sqrt{n}}\right)=\dfrac{\sqrt{3}x}{\sqrt{x^2+3}}, \quad\forall x\in\mathbb{R}. $$ I was wondering about the case where $x\in\mathbb{C}$ . Based on some numerical tests, it seems that this relation holds for all $x\in\mathbb{C}\setminus\{y{\rm i}:|y|\ge\sqrt{3}\}$ (where $\sqrt{z}$ is the principal square root defined over $\mathbb{C}-(-\infty,0]$ ). I would like to conjecture that The function sequence $\left\{\sqrt{n}\sin^{\circ n}\left(\dfrac{z}{\sqrt{n}}\right)\right\}$ is locally uniformly convergent over $\mathbb{C}\setminus\{y{\rm i}:|y|\ge\sqrt{3}\}$ . If this is true, then we know that the limit is holomophic, so it must be $\dfrac{\sqrt{3}z}{\sqrt{z^2+3}}$ by uniqueness of holomorphic functions. I was thinking that to imitate the proof in the answer to the original question, we need to find a uniform bound for $\left\{\sqrt{n}\sin^{\circ k}\left(\dfrac{z}{\sqrt{n}}\right):k\le n\right\}$ , but I have no idea of doing this for complex $z$ . So is this result of convergence correct? Any help appreciated.","Note as the -fold iteration of . It is shown in this great answer that I was wondering about the case where . Based on some numerical tests, it seems that this relation holds for all (where is the principal square root defined over ). I would like to conjecture that The function sequence is locally uniformly convergent over . If this is true, then we know that the limit is holomophic, so it must be by uniqueness of holomorphic functions. I was thinking that to imitate the proof in the answer to the original question, we need to find a uniform bound for , but I have no idea of doing this for complex . So is this result of convergence correct? Any help appreciated.","\sin^{\circ n}x n \sin x 
\lim_{n\to\infty}\sqrt{n}\sin^{\circ n}\left(\dfrac{x}{\sqrt{n}}\right)=\dfrac{\sqrt{3}x}{\sqrt{x^2+3}}, \quad\forall x\in\mathbb{R}.
 x\in\mathbb{C} x\in\mathbb{C}\setminus\{y{\rm i}:|y|\ge\sqrt{3}\} \sqrt{z} \mathbb{C}-(-\infty,0] \left\{\sqrt{n}\sin^{\circ n}\left(\dfrac{z}{\sqrt{n}}\right)\right\} \mathbb{C}\setminus\{y{\rm i}:|y|\ge\sqrt{3}\} \dfrac{\sqrt{3}z}{\sqrt{z^2+3}} \left\{\sqrt{n}\sin^{\circ k}\left(\dfrac{z}{\sqrt{n}}\right):k\le n\right\} z","['sequences-and-series', 'complex-analysis', 'limits', 'analysis', 'sequence-of-function']"
14,$\alpha>0;\ a(n+1)\ $ is the least integer $>a(n)$ such that $\sum_{i=1}^{n+1} a(i) < \alpha.$,is the least integer  such that,\alpha>0;\ a(n+1)\  >a(n) \sum_{i=1}^{n+1} a(i) < \alpha.,"Let $\alpha>0$ be any positive real number and let $k\ $ be any positive integer satisfying $k > \frac{1}{\alpha}\ $ Consider the integer sequence define by: $a(1)=k;\ $ and for $n\geq 1,\ a(n+1)\ $ is the least integer $>a(n)$ such that $\displaystyle\sum_{i=1}^{n+1} \frac{1}{a(i)} < \alpha.$ What is the (asymptotic) growth rate of $a(n)$ ? I would imagine exponential or maybe even along the lines of factorial, but I do not know how to study such sequences, although obviously I am interested in them. It's possible that this has to do with continued fractions, although I have never really understood continued fractions all that well, so I'm not really sure. Thanks in advance.","Let be any positive real number and let be any positive integer satisfying Consider the integer sequence define by: and for is the least integer such that What is the (asymptotic) growth rate of ? I would imagine exponential or maybe even along the lines of factorial, but I do not know how to study such sequences, although obviously I am interested in them. It's possible that this has to do with continued fractions, although I have never really understood continued fractions all that well, so I'm not really sure. Thanks in advance.","\alpha>0 k\  k > \frac{1}{\alpha}\  a(1)=k;\  n\geq 1,\ a(n+1)\  >a(n) \displaystyle\sum_{i=1}^{n+1} \frac{1}{a(i)} < \alpha. a(n)","['sequences-and-series', 'convergence-divergence', 'diophantine-approximation']"
15,Finding infinitely many primes of the form $4k+3$ in a specific sequence,Finding infinitely many primes of the form  in a specific sequence,4k+3,"Question: Let $m$ be a natural number. Show that there exists infinitely many primes $p$ of the form $p=4k+3$ such that $p$ divides at least one integer in the sequence $2^nm+1$ ; $n \in \mathbb{N}$ . My attempt: If $ p \mid 2^nm+1$ for some $n$ , then we have $ m \equiv \frac{-1}{2^n} \pmod{p}$ for some $n$ . This is equivalent to $ m \equiv -2^{n'} \pmod{p}$ for some $n'$ . Hence, if we can show the existence of infinitely many primes of the form $4k+3$ of the sequence $m+2^n$ , then we will be done. But this didn't seem any easier. Also,I realized that if $2$ is a primitive root modulo some $p$ then that $p$ divides some term of the sequence irrespective of $m$ . But overall I couldn't get anything useful.","Question: Let be a natural number. Show that there exists infinitely many primes of the form such that divides at least one integer in the sequence ; . My attempt: If for some , then we have for some . This is equivalent to for some . Hence, if we can show the existence of infinitely many primes of the form of the sequence , then we will be done. But this didn't seem any easier. Also,I realized that if is a primitive root modulo some then that divides some term of the sequence irrespective of . But overall I couldn't get anything useful.",m p p=4k+3 p 2^nm+1 n \in \mathbb{N}  p \mid 2^nm+1 n  m \equiv \frac{-1}{2^n} \pmod{p} n  m \equiv -2^{n'} \pmod{p} n' 4k+3 m+2^n 2 p p m,"['sequences-and-series', 'elementary-number-theory', 'prime-numbers', 'contest-math']"
16,Evaluating $\frac1{3^k}+\frac1{6^k}+\frac1{10^k}+\cdots$,Evaluating,\frac1{3^k}+\frac1{6^k}+\frac1{10^k}+\cdots,"The series $\frac1{3^k}+\frac1{6^k}+\frac1{10^k}+\cdots$ for integers $k>1$ at the triangular numbers can be written as $$\sum_{i=2}^\infty\frac1{\left(\frac{i(i+1)}2\right)^k}=2^k\sum_{i=2}^\infty\frac1{(i(i+1))^k}$$ At first glance, the zeta function may be of use. Partial fractions can be used to evaluate the sum, but only for small values of $k$ since the general formula is $$\frac1{i^k(i+1)^k}=\frac{a_1}i+\frac{a_2}{i^2}+\cdots+\frac{a_k}{i^k}+\frac{b_1}{i+1}+\frac{b_2}{(i+1)^2}+\cdots+\frac{b_k}{(i+1)^k}.$$ Of course, once the expression in the sum is presented as such, $\zeta(\cdot)$ can replace each individual term. However, apart from this tedious method, I do not see a way to get rid of the summation. Is there another way?","The series for integers at the triangular numbers can be written as At first glance, the zeta function may be of use. Partial fractions can be used to evaluate the sum, but only for small values of since the general formula is Of course, once the expression in the sum is presented as such, can replace each individual term. However, apart from this tedious method, I do not see a way to get rid of the summation. Is there another way?",\frac1{3^k}+\frac1{6^k}+\frac1{10^k}+\cdots k>1 \sum_{i=2}^\infty\frac1{\left(\frac{i(i+1)}2\right)^k}=2^k\sum_{i=2}^\infty\frac1{(i(i+1))^k} k \frac1{i^k(i+1)^k}=\frac{a_1}i+\frac{a_2}{i^2}+\cdots+\frac{a_k}{i^k}+\frac{b_1}{i+1}+\frac{b_2}{(i+1)^2}+\cdots+\frac{b_k}{(i+1)^k}. \zeta(\cdot),"['sequences-and-series', 'riemann-zeta']"
