,title_raw,title_text,title_latex,body_raw,body_text,body_latex,tags
78,Language formed by adding symbols to start or end turn by turn,Language formed by adding symbols to start or end turn by turn,,"A word is formed by starting with ""$0$"" and then adding ""$1$"" either to the start or to the end i.e we can form ""$10$"" or ""$01$"". In the next step we add a ""$0$"", again either to the start or to the end. This is continued, alternating the symbol we add. Denote by  $L_n$ the language containing all words of length $n$ that can be formed like this. We can define this recursively: $$L_0 = \{""""\}$$ $$L_n = \{c+w \space | \space w\in L_{n-1}\} \cup \{ w+c \space | \space w\in L_{n-1} \},$$ $$ \text{where } c=""0"" \text{ if } n \text{ is odd and }  c=""1"" \text{ if } n \text{ is even }$$ $$\text{and + means the concatenation of strings.}$$ We get: $L_0 = [""""]$ (the empty string) $L_1 = [""0""]$ $L_2 = [""10"", ""01""]$ $L_3 = [""010"", ""100"", ""001""]$ $L_4 = [""1010"", ""0101"", ""1100"", ""1001"", ""0011""]$ $L_5 = [""01010"", ""10100"", ""00101"", ""01100"", ""11000"", ""01001"", ""10010"", ""00011"", ""00110""]$ $L_6 = [""101010"", ""010101"", ""110100"", ""101001"", ""100101"", ""001011"", ""101100"", ""011001"", ""111000"", ""110001"", ""010011"", ""110010"", ""100011"", ""000111"", ""100110"", ""001101""]$ Denote $a_n = \# L_n$. These start out as  $$[1, 1, 2, 3, 5, 9, 16, 29, 52, 94, 170, 308, 560, 1018, 1856, 3383, 6177, 11279, 20614, 37685, 68926, 126112, 230802, 422557, 773730, 1417222, \dots]$$ Questions: Is there a context free grammar for the language $L=\bigcup L_n$? Is there a formula for $a_n$, or what is their generating function? I noticed that $\frac{a_n}{a_{n-1}}$ seems to approach something like $1.832...$. Is this true and what is this constant? It's like the factor ""how many different words"" each word from $L_{n-1}$ produces to $L_n$ (each produces two, but some of these are same as others).","A word is formed by starting with ""$0$"" and then adding ""$1$"" either to the start or to the end i.e we can form ""$10$"" or ""$01$"". In the next step we add a ""$0$"", again either to the start or to the end. This is continued, alternating the symbol we add. Denote by  $L_n$ the language containing all words of length $n$ that can be formed like this. We can define this recursively: $$L_0 = \{""""\}$$ $$L_n = \{c+w \space | \space w\in L_{n-1}\} \cup \{ w+c \space | \space w\in L_{n-1} \},$$ $$ \text{where } c=""0"" \text{ if } n \text{ is odd and }  c=""1"" \text{ if } n \text{ is even }$$ $$\text{and + means the concatenation of strings.}$$ We get: $L_0 = [""""]$ (the empty string) $L_1 = [""0""]$ $L_2 = [""10"", ""01""]$ $L_3 = [""010"", ""100"", ""001""]$ $L_4 = [""1010"", ""0101"", ""1100"", ""1001"", ""0011""]$ $L_5 = [""01010"", ""10100"", ""00101"", ""01100"", ""11000"", ""01001"", ""10010"", ""00011"", ""00110""]$ $L_6 = [""101010"", ""010101"", ""110100"", ""101001"", ""100101"", ""001011"", ""101100"", ""011001"", ""111000"", ""110001"", ""010011"", ""110010"", ""100011"", ""000111"", ""100110"", ""001101""]$ Denote $a_n = \# L_n$. These start out as  $$[1, 1, 2, 3, 5, 9, 16, 29, 52, 94, 170, 308, 560, 1018, 1856, 3383, 6177, 11279, 20614, 37685, 68926, 126112, 230802, 422557, 773730, 1417222, \dots]$$ Questions: Is there a context free grammar for the language $L=\bigcup L_n$? Is there a formula for $a_n$, or what is their generating function? I noticed that $\frac{a_n}{a_{n-1}}$ seems to approach something like $1.832...$. Is this true and what is this constant? It's like the factor ""how many different words"" each word from $L_{n-1}$ produces to $L_n$ (each produces two, but some of these are same as others).",,"['sequences-and-series', 'combinatorics', 'formal-languages']"
79,Flipping odd number array by two numbers in series.,Flipping odd number array by two numbers in series.,,"Suppose an array of length $n$(odd number) which is composed with only $0$. We start to ‘flip’( or ‘change’) numbers with following rules. [1, 1] → [0, 0] [0, 0] → [1, 1] [1, 0] or [0, 1] : do not change. Change elements sequentially and rotationally(when you reach at the end of the array), and repeat until the array becomes its initial state. For example, if the length of the array is 3, 0   [0 0 0] #start 1   [1 1 0] #first and second element is [0, 0], by rule 2, it became [1, 1] 2   [1 1 0] #third and first element = [0, 1], by rule 3, just pass. 3   [1 1 0] #second and third = [1, 0], pass 4   [0 0 0] #first and second = [1, 1], by rule 1, change it to [0, 0]. After 4 steps, the array repeats its configuration, so, the period is $4$. Another example, $n = 5$ 0   [0 0 0 0 0] 1   [1 1 0 0 0] 2   [1 1 1 1 0] 3   [1 1 1 1 0] 4   [1 0 0 1 0] 5   [1 0 0 1 0] 6   [1 0 0 1 0] 7   [1 0 0 1 0] 8   [1 0 0 1 0] 9   [1 1 1 1 0] 10  [1 1 1 1 0] 11  [0 0 1 1 0] 12  [0 0 0 0 0] The period is $12$. And when $n=7$, 0   [0 0 0 0 0 0 0] 1   [1 1 0 0 0 0 0] 2   [1 1 1 1 0 0 0] 3   [1 1 1 1 1 1 0] 4   [1 1 1 1 1 1 0] 5   [1 0 0 1 1 1 0] 6   [1 0 0 0 0 1 0] 7   [1 0 0 0 0 1 0] 8   [1 0 0 0 0 1 0] 9   [1 0 1 1 0 1 0] 10  [1 0 1 1 0 1 0] 11  [1 0 1 1 0 1 0] 12  [1 0 1 1 0 1 0] 13  [1 0 1 1 0 1 0] 14  [1 0 1 1 0 1 0] 15  [1 0 1 1 0 1 0] 16  [1 0 0 0 0 1 0] 17  [1 0 0 0 0 1 0] 18  [1 0 0 0 0 1 0] 19  [1 1 1 0 0 1 0] 20  [1 1 1 1 1 1 0] 21  [1 1 1 1 1 1 0] 22  [0 0 1 1 1 1 0] 23  [0 0 0 0 1 1 0] 24  [0 0 0 0 0 0 0] The period is $24$. It looks like the series of periods follows A046092 (0, 4, 12, 24, 40, 60, 84, 112, 144, 180, 220, 264,… ) How can I prove this? (If you want to look into more longer cases, refer here ) (Any modification of my English will be appreciated. English is not my mother tongue.)","Suppose an array of length $n$(odd number) which is composed with only $0$. We start to ‘flip’( or ‘change’) numbers with following rules. [1, 1] → [0, 0] [0, 0] → [1, 1] [1, 0] or [0, 1] : do not change. Change elements sequentially and rotationally(when you reach at the end of the array), and repeat until the array becomes its initial state. For example, if the length of the array is 3, 0   [0 0 0] #start 1   [1 1 0] #first and second element is [0, 0], by rule 2, it became [1, 1] 2   [1 1 0] #third and first element = [0, 1], by rule 3, just pass. 3   [1 1 0] #second and third = [1, 0], pass 4   [0 0 0] #first and second = [1, 1], by rule 1, change it to [0, 0]. After 4 steps, the array repeats its configuration, so, the period is $4$. Another example, $n = 5$ 0   [0 0 0 0 0] 1   [1 1 0 0 0] 2   [1 1 1 1 0] 3   [1 1 1 1 0] 4   [1 0 0 1 0] 5   [1 0 0 1 0] 6   [1 0 0 1 0] 7   [1 0 0 1 0] 8   [1 0 0 1 0] 9   [1 1 1 1 0] 10  [1 1 1 1 0] 11  [0 0 1 1 0] 12  [0 0 0 0 0] The period is $12$. And when $n=7$, 0   [0 0 0 0 0 0 0] 1   [1 1 0 0 0 0 0] 2   [1 1 1 1 0 0 0] 3   [1 1 1 1 1 1 0] 4   [1 1 1 1 1 1 0] 5   [1 0 0 1 1 1 0] 6   [1 0 0 0 0 1 0] 7   [1 0 0 0 0 1 0] 8   [1 0 0 0 0 1 0] 9   [1 0 1 1 0 1 0] 10  [1 0 1 1 0 1 0] 11  [1 0 1 1 0 1 0] 12  [1 0 1 1 0 1 0] 13  [1 0 1 1 0 1 0] 14  [1 0 1 1 0 1 0] 15  [1 0 1 1 0 1 0] 16  [1 0 0 0 0 1 0] 17  [1 0 0 0 0 1 0] 18  [1 0 0 0 0 1 0] 19  [1 1 1 0 0 1 0] 20  [1 1 1 1 1 1 0] 21  [1 1 1 1 1 1 0] 22  [0 0 1 1 1 1 0] 23  [0 0 0 0 1 1 0] 24  [0 0 0 0 0 0 0] The period is $24$. It looks like the series of periods follows A046092 (0, 4, 12, 24, 40, 60, 84, 112, 144, 180, 220, 264,… ) How can I prove this? (If you want to look into more longer cases, refer here ) (Any modification of my English will be appreciated. English is not my mother tongue.)",,"['sequences-and-series', 'permutations', 'puzzle']"
80,Closed Form for this Taylor Series?,Closed Form for this Taylor Series?,,"Does anybody know whether or not this sum has a closed form? $$f(x)=\sum_{n=0}^\infty \frac{x^n}{n!(2^n+1)}$$ I can't get WA to even understand it when I type it in. For context, the reason I want to know is that I calculated it as the solution to the functional equation $$f(x)+f(2x)=e^x$$","Does anybody know whether or not this sum has a closed form? $$f(x)=\sum_{n=0}^\infty \frac{x^n}{n!(2^n+1)}$$ I can't get WA to even understand it when I type it in. For context, the reason I want to know is that I calculated it as the solution to the functional equation $$f(x)+f(2x)=e^x$$",,"['sequences-and-series', 'summation', 'taylor-expansion', 'closed-form']"
81,"Finding a quadruplet of ""cow-equivalent"" integers","Finding a quadruplet of ""cow-equivalent"" integers",,"This a follow up question/puzzle from an earlier question here How does rounding affect Fibonacci-ish sequences? Explanation For this new question, one needs only to understand a particular transformation $$ f\big( \begin{bmatrix} a\\b\\c\\d \end{bmatrix}\big) = \begin{bmatrix} a+\text{floor}(\frac{d}{2})\\a\\b\\c \end{bmatrix} $$ So for example, this sequence is generated by repeatedly applying the transformation $$ \begin{bmatrix}5\\0\\0\\0\end{bmatrix}\rightarrow \begin{bmatrix}5\\5\\0\\0\end{bmatrix}\rightarrow \begin{bmatrix}5\\5\\5\\0\end{bmatrix}\rightarrow \begin{bmatrix}5\\5\\5\\5\end{bmatrix}\rightarrow \begin{bmatrix}7\\5\\5\\5\end{bmatrix}\rightarrow \begin{bmatrix}9\\7\\5\\5\end{bmatrix}\rightarrow \begin{bmatrix}11\\9\\7\\5\end{bmatrix}\rightarrow \begin{bmatrix}13\\11\\9\\7\end{bmatrix}\rightarrow \begin{bmatrix}16\\13\\11\\9\end{bmatrix}\rightarrow \ ... $$ Because the function rounds down $d$, it's very hard to predict the exact values after many iterations. Interestingly though -- certain initial values eventually converge to the same sequence For example if we continue the sequence above $$ \cdots\  \rightarrow \begin{bmatrix}16\\13\\11\\9\end{bmatrix}\rightarrow \begin{bmatrix}20\\16\\13\\11\end{bmatrix}\rightarrow \begin{bmatrix}25\\20\\16\\13\end{bmatrix}\rightarrow \begin{bmatrix}31\\25\\20\\16\end{bmatrix}\rightarrow \begin{bmatrix}39\\31\\25\\20\end{bmatrix}\rightarrow \begin{bmatrix}49\\39\\31\\25\end{bmatrix}\rightarrow \ \cdots $$ And compare it to the sequence of another initial value $$ \begin{bmatrix}9\\0\\0\\0\end{bmatrix}\rightarrow \begin{bmatrix}9\\9\\0\\0\end{bmatrix}\rightarrow \ \cdots \ \rightarrow \begin{bmatrix}25\\21\\17\\13\end{bmatrix}\rightarrow \begin{bmatrix}31\\25\\21\\17\end{bmatrix}\rightarrow \begin{bmatrix}39\\31\\25\\21\end{bmatrix}\rightarrow \begin{bmatrix}49\\39\\31\\25\end{bmatrix}\rightarrow \ \cdots $$ The sequences hit the same point. More specifically, we will say that $$ f^{13}\big(\begin{bmatrix}5\\0\\0\\0\end{bmatrix}\big) = f^{10}\big(\begin{bmatrix}9\\0\\0\\0\end{bmatrix}\big) $$ This means the sequence for $5$ and the sequence for $9$ will be the same as each other if continued further. I've been calling numbers like this ""cow-equivalent"" because this iteration models the population growth of animals in Minecraft – when bred every 5 minutes by the player. A related-but-simpler transformation is also discussed here Exponential growth of cow populations in Minecraft Here we'll use the ""$\equiv$"" symbol to denote cow-equivalency. So $$a\equiv b \quad\text{if and only if there exists}\quad m, n \in \mathbb{N}$$ $$\text{ such that}$$ $$f^m(a\cdot\vec{e_1})=f^n(b\cdot\vec{e_1})$$ Questions A quick computer search shows that there are triplets of cow-equivalent numbers like $$34\equiv 259\equiv 406$$ because $$f^{35}(\begin{bmatrix}34\\0\\0\\0\end{bmatrix})= f^{26}(\begin{bmatrix}259\\0\\0\\0\end{bmatrix})= f^{24}(\begin{bmatrix}406\\0\\0\\0\end{bmatrix})= \begin{bmatrix}113171\\90268\\72000\\57429\end{bmatrix}$$ Thus the primary question here is Does a quadruplet of cow-equivalent numbers exist? Other interesting/related questions Are all numbers potentially cow-equivalent? Is the triplet above – or any other cow-equivalence set – complete? Is there a deterministic test one can apply for cow-equivalence?","This a follow up question/puzzle from an earlier question here How does rounding affect Fibonacci-ish sequences? Explanation For this new question, one needs only to understand a particular transformation $$ f\big( \begin{bmatrix} a\\b\\c\\d \end{bmatrix}\big) = \begin{bmatrix} a+\text{floor}(\frac{d}{2})\\a\\b\\c \end{bmatrix} $$ So for example, this sequence is generated by repeatedly applying the transformation $$ \begin{bmatrix}5\\0\\0\\0\end{bmatrix}\rightarrow \begin{bmatrix}5\\5\\0\\0\end{bmatrix}\rightarrow \begin{bmatrix}5\\5\\5\\0\end{bmatrix}\rightarrow \begin{bmatrix}5\\5\\5\\5\end{bmatrix}\rightarrow \begin{bmatrix}7\\5\\5\\5\end{bmatrix}\rightarrow \begin{bmatrix}9\\7\\5\\5\end{bmatrix}\rightarrow \begin{bmatrix}11\\9\\7\\5\end{bmatrix}\rightarrow \begin{bmatrix}13\\11\\9\\7\end{bmatrix}\rightarrow \begin{bmatrix}16\\13\\11\\9\end{bmatrix}\rightarrow \ ... $$ Because the function rounds down $d$, it's very hard to predict the exact values after many iterations. Interestingly though -- certain initial values eventually converge to the same sequence For example if we continue the sequence above $$ \cdots\  \rightarrow \begin{bmatrix}16\\13\\11\\9\end{bmatrix}\rightarrow \begin{bmatrix}20\\16\\13\\11\end{bmatrix}\rightarrow \begin{bmatrix}25\\20\\16\\13\end{bmatrix}\rightarrow \begin{bmatrix}31\\25\\20\\16\end{bmatrix}\rightarrow \begin{bmatrix}39\\31\\25\\20\end{bmatrix}\rightarrow \begin{bmatrix}49\\39\\31\\25\end{bmatrix}\rightarrow \ \cdots $$ And compare it to the sequence of another initial value $$ \begin{bmatrix}9\\0\\0\\0\end{bmatrix}\rightarrow \begin{bmatrix}9\\9\\0\\0\end{bmatrix}\rightarrow \ \cdots \ \rightarrow \begin{bmatrix}25\\21\\17\\13\end{bmatrix}\rightarrow \begin{bmatrix}31\\25\\21\\17\end{bmatrix}\rightarrow \begin{bmatrix}39\\31\\25\\21\end{bmatrix}\rightarrow \begin{bmatrix}49\\39\\31\\25\end{bmatrix}\rightarrow \ \cdots $$ The sequences hit the same point. More specifically, we will say that $$ f^{13}\big(\begin{bmatrix}5\\0\\0\\0\end{bmatrix}\big) = f^{10}\big(\begin{bmatrix}9\\0\\0\\0\end{bmatrix}\big) $$ This means the sequence for $5$ and the sequence for $9$ will be the same as each other if continued further. I've been calling numbers like this ""cow-equivalent"" because this iteration models the population growth of animals in Minecraft – when bred every 5 minutes by the player. A related-but-simpler transformation is also discussed here Exponential growth of cow populations in Minecraft Here we'll use the ""$\equiv$"" symbol to denote cow-equivalency. So $$a\equiv b \quad\text{if and only if there exists}\quad m, n \in \mathbb{N}$$ $$\text{ such that}$$ $$f^m(a\cdot\vec{e_1})=f^n(b\cdot\vec{e_1})$$ Questions A quick computer search shows that there are triplets of cow-equivalent numbers like $$34\equiv 259\equiv 406$$ because $$f^{35}(\begin{bmatrix}34\\0\\0\\0\end{bmatrix})= f^{26}(\begin{bmatrix}259\\0\\0\\0\end{bmatrix})= f^{24}(\begin{bmatrix}406\\0\\0\\0\end{bmatrix})= \begin{bmatrix}113171\\90268\\72000\\57429\end{bmatrix}$$ Thus the primary question here is Does a quadruplet of cow-equivalent numbers exist? Other interesting/related questions Are all numbers potentially cow-equivalent? Is the triplet above – or any other cow-equivalence set – complete? Is there a deterministic test one can apply for cow-equivalence?",,['sequences-and-series']
82,Explain approximate lines in graph of this function,Explain approximate lines in graph of this function,,"Sorry that this is a long question; the crux of it is that I want to know why lines appear in the graph of the function ($\varphi^\infty(x)$) I've defined. Define $\varphi(x)$ as follows: If the decimal representation of $x\in \mathbb{R}$ is $x=\sum\limits_{n=-\infty}^\infty a_n 10^n$ where $a_n\in\{0,1,2,...,9\}$ and $|\{a_n\;|\;n>0\}|$ is finite let: $$\varphi(x)=\sum_{n=-\infty}^\infty a_n\left(\max{\{a_k\;|\;k\in\mathbb{N}\}}+1\right)^n$$ (i.e. read $x$'s base $10$ expansion as if it is written in base $1+\max{\{a_k\}}$). Then let $\varphi^\infty(x)$ be the value obtained by repeated applications of $\varphi(x)$ until a stable value is reached (if it exists), i.e. $\varphi^\infty(x)=\varphi(\varphi(...(\varphi(x))...))$. To illustrate, $\varphi(57)=57_8=47_{10}$, so $\varphi(57)=47$, and $\varphi(47)=47_8=39_{10}$ so $\varphi(47)=39$, and $\varphi(39)=39_{10}$, so no further applications of $\varphi(x)$ will change it, so $\varphi^\infty(57)=39$. Similarly $\varphi(\frac{1}{3})=0.333..._4=1$ and $\varphi(1)=1$ so $\varphi^\infty(\frac{1}{3})=1$. For any number $y$ with $9$ in its decimal expansion we will obviously have $\varphi(y)=\varphi^\infty(y)=y$; $\varphi^\infty(x)$ seems mathematically irrelevant, but it interests me; when graphed for integer $x$, we get linear patterns. Graphs of $\varphi^\infty(x)$ at integer $x$ over increasing domains (full size versions here and here and here and here ): The top line (slope $1$) is numbers containing a $9$; but there are lines of other slopes below (one in red); the following zooms show they are made up of smaller line segments of different slopes. Graphs of $\varphi^\infty(x)$ at integer $x$; the first shows the boxed area above, the second is a zoom for large $x$, and the third is a zoom into one of the line segments in the previous graph (full size versions here and here and here ): $\hskip1.7in$ At the smallest scale line segments with slope $1$ will occur; this can be seen in $\varphi(x)$ which displays the same pattern (I have only focused on $\varphi^\infty(x)$ because the lines are more obvious). Graphs of $\varphi(x)$ at integer $x$ over increasing domains (full size versions here and here and here ): $\hskip1.7in$ I cannot explain why the points (which on the small scale form short lines of slope $1$) on the large scale arrange themselves approximately into lines of varying slopes passing through the origin. Why do the values of $\varphi^\infty(x)$ and $\varphi(x)$ approximately fit onto clear lines like the ones highlighted above? I don't know if similar lines occur for non-integer $x$; points where $\varphi^\infty(x)$ is continuous are obviously dense in $\mathbb{R}$; I can't see a good way of plotting $\varphi(x)$ for real $x$ ($\varphi(\frac{2}{3})=0.666..._7=1$ but a computer might give $\varphi(\frac{2}{3})=0.666...7_8\overset{!}{=}0.857..._{10}$). It exists for all integer $x$, but I can't prove $\varphi^\infty(x)$ exists for all $x$ (for some $x$, we might never get a number with $9$ in the decimal expansion). But my main question is the following: Can anyone explain why the approximations to lines passing through the origin occur in the above graphs? What determines the slope of the lines? The above graphs were generated by the following python script: from __future__ import division from pylab import * from fractions import Fraction  def phi(number):     number=float(number); number=str(number); digits=[]     for dig in number:         digits.append(dig)     digitstest=digits; digitstest.remove('.'); m=int(max(digitstest))+1     firstdigs=[]     for dig in number:         if dig=='.':             break         firstdigs.append(int(dig))     y=0; k=size(firstdigs)-1; n=k     while n-k<size(digitstest):         y=y+(int(digitstest[n-k]))*(m**(size(firstdigs)-n+k-1)); k=k-1     if y-int(y)==0:         y=int(y)     return(y)  def phi_infinity(number):     prev=-1     while number!=prev:         prev=number; number=phi(number)     return(number)  a=int(input(""\nLower bound?\n"")); b=int(input(""\nUpper bound?\n"")) i=linspace(a,b,b-a+1); k=[] for n in i:     k.append(phi_infinity(int(n))) plot(i,k,'.',markersize=3); show()","Sorry that this is a long question; the crux of it is that I want to know why lines appear in the graph of the function ($\varphi^\infty(x)$) I've defined. Define $\varphi(x)$ as follows: If the decimal representation of $x\in \mathbb{R}$ is $x=\sum\limits_{n=-\infty}^\infty a_n 10^n$ where $a_n\in\{0,1,2,...,9\}$ and $|\{a_n\;|\;n>0\}|$ is finite let: $$\varphi(x)=\sum_{n=-\infty}^\infty a_n\left(\max{\{a_k\;|\;k\in\mathbb{N}\}}+1\right)^n$$ (i.e. read $x$'s base $10$ expansion as if it is written in base $1+\max{\{a_k\}}$). Then let $\varphi^\infty(x)$ be the value obtained by repeated applications of $\varphi(x)$ until a stable value is reached (if it exists), i.e. $\varphi^\infty(x)=\varphi(\varphi(...(\varphi(x))...))$. To illustrate, $\varphi(57)=57_8=47_{10}$, so $\varphi(57)=47$, and $\varphi(47)=47_8=39_{10}$ so $\varphi(47)=39$, and $\varphi(39)=39_{10}$, so no further applications of $\varphi(x)$ will change it, so $\varphi^\infty(57)=39$. Similarly $\varphi(\frac{1}{3})=0.333..._4=1$ and $\varphi(1)=1$ so $\varphi^\infty(\frac{1}{3})=1$. For any number $y$ with $9$ in its decimal expansion we will obviously have $\varphi(y)=\varphi^\infty(y)=y$; $\varphi^\infty(x)$ seems mathematically irrelevant, but it interests me; when graphed for integer $x$, we get linear patterns. Graphs of $\varphi^\infty(x)$ at integer $x$ over increasing domains (full size versions here and here and here and here ): The top line (slope $1$) is numbers containing a $9$; but there are lines of other slopes below (one in red); the following zooms show they are made up of smaller line segments of different slopes. Graphs of $\varphi^\infty(x)$ at integer $x$; the first shows the boxed area above, the second is a zoom for large $x$, and the third is a zoom into one of the line segments in the previous graph (full size versions here and here and here ): $\hskip1.7in$ At the smallest scale line segments with slope $1$ will occur; this can be seen in $\varphi(x)$ which displays the same pattern (I have only focused on $\varphi^\infty(x)$ because the lines are more obvious). Graphs of $\varphi(x)$ at integer $x$ over increasing domains (full size versions here and here and here ): $\hskip1.7in$ I cannot explain why the points (which on the small scale form short lines of slope $1$) on the large scale arrange themselves approximately into lines of varying slopes passing through the origin. Why do the values of $\varphi^\infty(x)$ and $\varphi(x)$ approximately fit onto clear lines like the ones highlighted above? I don't know if similar lines occur for non-integer $x$; points where $\varphi^\infty(x)$ is continuous are obviously dense in $\mathbb{R}$; I can't see a good way of plotting $\varphi(x)$ for real $x$ ($\varphi(\frac{2}{3})=0.666..._7=1$ but a computer might give $\varphi(\frac{2}{3})=0.666...7_8\overset{!}{=}0.857..._{10}$). It exists for all integer $x$, but I can't prove $\varphi^\infty(x)$ exists for all $x$ (for some $x$, we might never get a number with $9$ in the decimal expansion). But my main question is the following: Can anyone explain why the approximations to lines passing through the origin occur in the above graphs? What determines the slope of the lines? The above graphs were generated by the following python script: from __future__ import division from pylab import * from fractions import Fraction  def phi(number):     number=float(number); number=str(number); digits=[]     for dig in number:         digits.append(dig)     digitstest=digits; digitstest.remove('.'); m=int(max(digitstest))+1     firstdigs=[]     for dig in number:         if dig=='.':             break         firstdigs.append(int(dig))     y=0; k=size(firstdigs)-1; n=k     while n-k<size(digitstest):         y=y+(int(digitstest[n-k]))*(m**(size(firstdigs)-n+k-1)); k=k-1     if y-int(y)==0:         y=int(y)     return(y)  def phi_infinity(number):     prev=-1     while number!=prev:         prev=number; number=phi(number)     return(number)  a=int(input(""\nLower bound?\n"")); b=int(input(""\nUpper bound?\n"")) i=linspace(a,b,b-a+1); k=[] for n in i:     k.append(phi_infinity(int(n))) plot(i,k,'.',markersize=3); show()",,"['sequences-and-series', 'functions', 'graphing-functions', 'approximation', 'decimal-expansion']"
