,title_raw,title_text,title_latex,body_raw,body_text,body_latex,tags
44,Understanding $n\choose k$ in terms of sum and product rules,Understanding  in terms of sum and product rules,n\choose k,"This is a follow up on my earlier question. To put some values and context, let me say I am trying to justify the number of possibilities of choosing 2 chapters out of 10 in a book i,e $10 \choose 2$. At this point this is just notation. One way to enumerate the possibilities: $$\underbrace{\underbrace{(1,2),(1,3)\cdots,(1,10)}_{9}\underbrace{(2,1),(2,3)\cdots,(2,10)}_{9}\cdots\underbrace{(10,1),(10,2)\cdots,(10,9)}_{9}}_{10}$$ So we have $10\cdot 9$ possibilities but we've double counted pairs such as $(n,m)$ and $(m,n)$ so we have $\frac{10\cdot 9}{2}$. Now I try to reason with the sum and product rules I've learnt and once again Im confused, which might become detrimental if I go further. Say I select chapter $1$. I can select chapter $2$ OR $3$ etc. Once I have selected one chapter, the selection of the other chapter is independent w.r.t one another,  so using the sum rule I can make total $9$ possible selections once I have selected the first chapter. But then, I can make $10$ different choices of the first chapter. Now it is clear in my mind that each one of these ten possible selections come bundled with 9 possibilities, so multiply the two. But when I read the definition many times and try to bring in a ""product-rule argument"" and I just cannot. It should come as easily as the thought that I should multiply it, so I've only understood the product rule in words. Please enlighten me. Another thing I noticed, was that this could be achieved using a purely sum rule argument. Consider the enumeration scheme where we avoid repetition altogether $$\underbrace{(1,2),(1,3),\cdots,(1,10)}_{9},\underbrace{(2,3),(2,4),\cdots,(2,10)}_{8}\underbrace{(3,4),(3,5),\cdots,(3,10)}_{7},\cdots\underbrace{(9,10)}_1$$ $$=9+8+\cdots+1=\frac{10\cdot 9}{2}$$ Only the sum rule has been used in this argument. And it is much easier for me to understand. So, a parenthetical query: can a purely product rule argument be used for selections? It does not seem so for me. It appears the sum rule is fundamental and product rule is a special case of it. Which might seem like saying that multiplication is a special case of addition in discrete case. Once again, this last paragraph is just a parenthetical query and not my immediate concern at the moment.","This is a follow up on my earlier question. To put some values and context, let me say I am trying to justify the number of possibilities of choosing 2 chapters out of 10 in a book i,e $10 \choose 2$. At this point this is just notation. One way to enumerate the possibilities: $$\underbrace{\underbrace{(1,2),(1,3)\cdots,(1,10)}_{9}\underbrace{(2,1),(2,3)\cdots,(2,10)}_{9}\cdots\underbrace{(10,1),(10,2)\cdots,(10,9)}_{9}}_{10}$$ So we have $10\cdot 9$ possibilities but we've double counted pairs such as $(n,m)$ and $(m,n)$ so we have $\frac{10\cdot 9}{2}$. Now I try to reason with the sum and product rules I've learnt and once again Im confused, which might become detrimental if I go further. Say I select chapter $1$. I can select chapter $2$ OR $3$ etc. Once I have selected one chapter, the selection of the other chapter is independent w.r.t one another,  so using the sum rule I can make total $9$ possible selections once I have selected the first chapter. But then, I can make $10$ different choices of the first chapter. Now it is clear in my mind that each one of these ten possible selections come bundled with 9 possibilities, so multiply the two. But when I read the definition many times and try to bring in a ""product-rule argument"" and I just cannot. It should come as easily as the thought that I should multiply it, so I've only understood the product rule in words. Please enlighten me. Another thing I noticed, was that this could be achieved using a purely sum rule argument. Consider the enumeration scheme where we avoid repetition altogether $$\underbrace{(1,2),(1,3),\cdots,(1,10)}_{9},\underbrace{(2,3),(2,4),\cdots,(2,10)}_{8}\underbrace{(3,4),(3,5),\cdots,(3,10)}_{7},\cdots\underbrace{(9,10)}_1$$ $$=9+8+\cdots+1=\frac{10\cdot 9}{2}$$ Only the sum rule has been used in this argument. And it is much easier for me to understand. So, a parenthetical query: can a purely product rule argument be used for selections? It does not seem so for me. It appears the sum rule is fundamental and product rule is a special case of it. Which might seem like saying that multiplication is a special case of addition in discrete case. Once again, this last paragraph is just a parenthetical query and not my immediate concern at the moment.",,"['combinatorics', 'binomial-coefficients']"
45,"The number of three element sets of positive distinct integers {a, b, c} such that the product abc = 15015 is?","The number of three element sets of positive distinct integers {a, b, c} such that the product abc = 15015 is?",,"Q. The number of three element sets of positive distinct integers {a, b, c} such that the product abc = 15015 is ? My approach:- 15015 = 1 * 3 * 5 * 7 * 11 * 13 Now I thought of this problem as 6 distinct balls (1, 3, 5, 7, 11, 13) to be distributed in 3 distinct boxes (a, b, c), such that each box at least have 1 ball in them. So, I made the following possibilities:- Case 1:- 3  2  1  ---> $6C3 * 3C2 * 1C1 * 3!$ = 180 Case 2:- 2  2  2 -----> $6C2 * 4C2 * 2C2 $ = 90 Case 3:- 4  1  1 -----> {6C4 * (2C1 * 2C1)/2!} * 3!} = 90 Giving a total of 360 cases, but the answer given is 40, please help me to identify mistake and how to proceed ?","Q. The number of three element sets of positive distinct integers {a, b, c} such that the product abc = 15015 is ? My approach:- 15015 = 1 * 3 * 5 * 7 * 11 * 13 Now I thought of this problem as 6 distinct balls (1, 3, 5, 7, 11, 13) to be distributed in 3 distinct boxes (a, b, c), such that each box at least have 1 ball in them. So, I made the following possibilities:- Case 1:- 3  2  1  ---> = 180 Case 2:- 2  2  2 -----> = 90 Case 3:- 4  1  1 -----> {6C4 * (2C1 * 2C1)/2!} * 3!} = 90 Giving a total of 360 cases, but the answer given is 40, please help me to identify mistake and how to proceed ?",6C3 * 3C2 * 1C1 * 3! 6C2 * 4C2 * 2C2 ,"['combinatorics', 'elementary-number-theory']"
46,Number of pairs of subsets that have no elements in common,Number of pairs of subsets that have no elements in common,,"A set $M$ consists of $n$ elements. Determine the number of pairs of subsets of $M$ which have no elements in common ( don't forget to account for the empty set ). If we choose a subset of one element, then there are $(n-1)+1$ corresponding different subsets of the same size, hence the total is ${n\choose1}+\frac12{{n-1}\choose 1}{n\choose1}$ when we shuffle through each subset and repeat the same operation. Then, if we choose one with two elements, then there are $1+{{n-2}\choose1}+{{n-2}\choose2}$ corresponding different subsets of the same size and of size = 2-1, which gives us a total of ${n\choose2}+{{n-2}\choose1}{{n}\choose2}+\frac12{{n-2}\choose2}{n\choose2}$ . With three, we get for the one selection ${n\choose3}+{{n-3}\choose1}{n\choose3}+{{n-3}\choose2}{n\choose3}+\frac12{{n-3}\choose3}{n\choose3}$ for the same size, size-1 and size-2. If I am to do this for a subset with $k$ elements, then the total is $s_k={n\choose k}+\frac12{{n-k}\choose k}{n\choose k}+\sum_{i=1}^{k-1}{{n-k}\choose i}{n\choose k}$ . The big total is when I shuffle through all possible values of $k$ , so $\sum_{k=1}^{n-1}s_k$ . Is there any flaw in my reasoning? Thank you for your time!","A set consists of elements. Determine the number of pairs of subsets of which have no elements in common ( don't forget to account for the empty set ). If we choose a subset of one element, then there are corresponding different subsets of the same size, hence the total is when we shuffle through each subset and repeat the same operation. Then, if we choose one with two elements, then there are corresponding different subsets of the same size and of size = 2-1, which gives us a total of . With three, we get for the one selection for the same size, size-1 and size-2. If I am to do this for a subset with elements, then the total is . The big total is when I shuffle through all possible values of , so . Is there any flaw in my reasoning? Thank you for your time!",M n M (n-1)+1 {n\choose1}+\frac12{{n-1}\choose 1}{n\choose1} 1+{{n-2}\choose1}+{{n-2}\choose2} {n\choose2}+{{n-2}\choose1}{{n}\choose2}+\frac12{{n-2}\choose2}{n\choose2} {n\choose3}+{{n-3}\choose1}{n\choose3}+{{n-3}\choose2}{n\choose3}+\frac12{{n-3}\choose3}{n\choose3} k s_k={n\choose k}+\frac12{{n-k}\choose k}{n\choose k}+\sum_{i=1}^{k-1}{{n-k}\choose i}{n\choose k} k \sum_{k=1}^{n-1}s_k,['combinatorics']
47,In how many ways can a team of $4$ boys and $4$ girls be selected out of $6$ boys and $5$ girls if a particular boy and girl refuse to work together?,In how many ways can a team of  boys and  girls be selected out of  boys and  girls if a particular boy and girl refuse to work together?,4 4 6 5,"In how many ways can a team of $4$ boys and $4$ girls be selected out of $6$ boys and $5$ girls if a particular boy and a particular girl refuse to work together. My attempt: Case 1: That particular boy is not considered. So, 4 boys to be selected out of 5 boys. 4 girls to be selected out of 5 girls. So, $\dbinom{5}{4} \cdot \dbinom{5}{4}=25$ Case 2: That particular girl is not considered. So, 4 boys to be selected out of 6 boys. And 4 girls to be selected out of 4 girls. So, $\dbinom{6}{4}\cdot\dbinom{4}{4}=15$ Case 3: That particular boy and girl are not considered. So, 4 boys out of 5 and 4 girls out of 4. So, $\dbinom{5}{4}\cdot\dbinom{4}{4}=5$ So, total cases: $45$ . Answer is given as $35$ . What's my mistake?","In how many ways can a team of boys and girls be selected out of boys and girls if a particular boy and a particular girl refuse to work together. My attempt: Case 1: That particular boy is not considered. So, 4 boys to be selected out of 5 boys. 4 girls to be selected out of 5 girls. So, Case 2: That particular girl is not considered. So, 4 boys to be selected out of 6 boys. And 4 girls to be selected out of 4 girls. So, Case 3: That particular boy and girl are not considered. So, 4 boys out of 5 and 4 girls out of 4. So, So, total cases: . Answer is given as . What's my mistake?",4 4 6 5 \dbinom{5}{4} \cdot \dbinom{5}{4}=25 \dbinom{6}{4}\cdot\dbinom{4}{4}=15 \dbinom{5}{4}\cdot\dbinom{4}{4}=5 45 35,"['combinatorics', 'combinations']"
48,Sticks and stones but with distinct objects,Sticks and stones but with distinct objects,,"The total number of ways which 5 balls of different colors can be distributed among 3 persons so that each person gets at least one ball is..? My attempt: So, first we can choose any three balls to allocate to any person, so $\binom{5}{3}$ and, then distribute them then in 3! ways. And, so we have, $\binom{5}{3} \cdot 3! $ . Now I have two remaining balls and this I can give randomly to any of the three people. For the first ball I have three choices and so do I for the second ball. Hence,  The net number of cases is $ \binom{5}{3} \cdot 3! \cdot 3^2$ Now, I know that like the thing can happen in reverse. For example distributing three then distributing two, I could have some overlapping cases where the items which are distributed in the distributing two case is actually distributed in the distributing three step. How do I account for the overlapping case? Ans: 150 Sticks and stones attempt: We have five objects and introduce two objects as dividers, subtract cases where one guy gets nothing (3 x 6!) and add cases where two people get nothing and third guy everything (3) What I am looking for : A fix to this method such that it gives me the correct answer, in the other stack post linked to this one, it has ample amount of methods based on other ways to solve it but my question here is how to fix this method.","The total number of ways which 5 balls of different colors can be distributed among 3 persons so that each person gets at least one ball is..? My attempt: So, first we can choose any three balls to allocate to any person, so and, then distribute them then in 3! ways. And, so we have, . Now I have two remaining balls and this I can give randomly to any of the three people. For the first ball I have three choices and so do I for the second ball. Hence,  The net number of cases is Now, I know that like the thing can happen in reverse. For example distributing three then distributing two, I could have some overlapping cases where the items which are distributed in the distributing two case is actually distributed in the distributing three step. How do I account for the overlapping case? Ans: 150 Sticks and stones attempt: We have five objects and introduce two objects as dividers, subtract cases where one guy gets nothing (3 x 6!) and add cases where two people get nothing and third guy everything (3) What I am looking for : A fix to this method such that it gives me the correct answer, in the other stack post linked to this one, it has ample amount of methods based on other ways to solve it but my question here is how to fix this method.",\binom{5}{3} \binom{5}{3} \cdot 3!   \binom{5}{3} \cdot 3! \cdot 3^2,['combinatorics']
49,Proof for the general formula for $a^n+b^n$.,Proof for the general formula for .,a^n+b^n,"Based on the following observations. That is $$a+b = (a+b)^1  \\  a^2+b^2 = (a+b)^2-2ab \\ a^3+b^3 = (a+b)^3-3ab(a+b) \\ a^4+b^4= (a+b)^4-4ab(a+b)^2+2(ab)^2\\ a^5+b^5  = (a+b)^5 -5ab(a+b)^3+5(ab)^2(a+b)\\\vdots$$ I came to  make the following conjecture as  general formula. $$ a^n +b^n =\sum_{k=0}^{n-1}(-1)^k \frac{n\Gamma(n-k)}{\Gamma(k+1)\Gamma(n-2k+1)}(a+b)^{n-2k}(ab)^k $$ where $\Gamma(.) $ is gamma function. I tried up proving the result using binomial theorem $\displaystyle (a+b)^n=\sum_{r=0}^n a^{n-r}b^r$ for positive integers $a,b$ however, I didn't find  any elegance in the work.  So in the expect of some beautiful proofs,  I wish to share  general formula here. Thank you","Based on the following observations. That is I came to  make the following conjecture as  general formula. where is gamma function. I tried up proving the result using binomial theorem for positive integers however, I didn't find  any elegance in the work.  So in the expect of some beautiful proofs,  I wish to share  general formula here. Thank you","a+b = (a+b)^1  \\  a^2+b^2 = (a+b)^2-2ab \\ a^3+b^3 = (a+b)^3-3ab(a+b) \\ a^4+b^4= (a+b)^4-4ab(a+b)^2+2(ab)^2\\ a^5+b^5 
= (a+b)^5 -5ab(a+b)^3+5(ab)^2(a+b)\\\vdots  a^n +b^n =\sum_{k=0}^{n-1}(-1)^k \frac{n\Gamma(n-k)}{\Gamma(k+1)\Gamma(n-2k+1)}(a+b)^{n-2k}(ab)^k  \Gamma(.)  \displaystyle (a+b)^n=\sum_{r=0}^n a^{n-r}b^r a,b","['combinatorics', 'summation', 'binomial-coefficients']"
50,How big is $\{n\in\Bbb N\mid 1\leq n\leq 2000\text{ and the digital sum of }n^2=21\}$?,How big is ?,\{n\in\Bbb N\mid 1\leq n\leq 2000\text{ and the digital sum of }n^2=21\},"well,the title of the question makes it clear, The question is :find the number of natural numbers between 1 to 2000 such that the sum of digits of their squares is equal to 21. my approach: just to make the question more clear I want to illustrate with help of an example . $$89^2 = 7921$$ and sum of digits of $7921$ is $7+9+2+1=19$ now since the squares of numbers from $1$ to $2000$ can be from $1$ to $7$ digits ,I could not find any way except calculating the squares by hand and adding their digits .so,is there a better method for solving this question? any help is greatly appreciated.","well,the title of the question makes it clear, The question is :find the number of natural numbers between 1 to 2000 such that the sum of digits of their squares is equal to 21. my approach: just to make the question more clear I want to illustrate with help of an example . and sum of digits of is now since the squares of numbers from to can be from to digits ,I could not find any way except calculating the squares by hand and adding their digits .so,is there a better method for solving this question? any help is greatly appreciated.",89^2 = 7921 7921 7+9+2+1=19 1 2000 1 7,"['combinatorics', 'recreational-mathematics']"
51,Is a closed form for quaternary sequences avoiding some patterns known?,Is a closed form for quaternary sequences avoiding some patterns known?,,"Let $a_n$ be the number of quaternary strings over $\{0,1,2,3\}$ of length $n\geq 1$ not containing the substrings $02,03,12,20,21,$ and $30.$ Is there a known closed form for $a_n$ which has appeared in the literature?",Let be the number of quaternary strings over of length not containing the substrings and Is there a known closed form for which has appeared in the literature?,"a_n \{0,1,2,3\} n\geq 1 02,03,12,20,21, 30. a_n","['combinatorics', 'reference-request', 'fibonacci-numbers']"
52,"What is the number of pairs of $(a,b)$ of positive real numbers satisfying $a^4+b^4<1$ and $a^2+b^2>1$?",What is the number of pairs of  of positive real numbers satisfying  and ?,"(a,b) a^4+b^4<1 a^2+b^2>1","The number of pairs of $(a,b)$ of positive real numbers satisfying $a^4+b^4<1$ and $a^2+b^2>1$ is - $(i)$ 0 $(ii)$ 1 $(iii)$ 2 $(iv)$ more than 2 Solution:We have $a,b>0$ , According to the given situation, $0<a^4+b^4<1<a^2+b^2\implies a^4+b^4<a^2+b^2\implies 0<a^2(a^2-1)<b^2(1-b^2)\implies b^2(1-b)(1+b)<0 ;a^2(a-1)(a+1)>0\implies a\in(-\infty,-1)\cup (0,1);b\in(-1,0)\cup(1,\infty)$ But, in particular, if we choose $a=-1/2,b=1/2$ ,then $a^4+b^4=1/16+1/16=1/8<1$ and $a^2+b^2=1/4+1/4=1/2<1$ .Which contradicts the given condition $a^2+b^2>1$ Where is the mistake in my approach? How should I approach this problem(means how to think ?). Can Triangle inequality be used here? Please provide some hint...","The number of pairs of of positive real numbers satisfying and is - 0 1 2 more than 2 Solution:We have , According to the given situation, But, in particular, if we choose ,then and .Which contradicts the given condition Where is the mistake in my approach? How should I approach this problem(means how to think ?). Can Triangle inequality be used here? Please provide some hint...","(a,b) a^4+b^4<1 a^2+b^2>1 (i) (ii) (iii) (iv) a,b>0 0<a^4+b^4<1<a^2+b^2\implies a^4+b^4<a^2+b^2\implies 0<a^2(a^2-1)<b^2(1-b^2)\implies b^2(1-b)(1+b)<0 ;a^2(a-1)(a+1)>0\implies a\in(-\infty,-1)\cup (0,1);b\in(-1,0)\cup(1,\infty) a=-1/2,b=1/2 a^4+b^4=1/16+1/16=1/8<1 a^2+b^2=1/4+1/4=1/2<1 a^2+b^2>1","['combinatorics', 'inequality', 'triangles', 'real-numbers']"
53,How to calculate the number of possible combinations with repetitions?,How to calculate the number of possible combinations with repetitions?,,"I would like to know the difference between ""permutations with repetition"" and ""ways to choose $k$ elements from a set of $n$ elements if repetitions are allowed"". For instance: In a set $S$ of $k$ elements, the number of $n$-tuples over $S$ (words with repetition) is: $$k^n$$ The number of ways to choose $k$ elements from a set of $n$ elements if repetitions are allowed is: $$\binom{n+k-1}{k}$$ Which is the difference among these two? If I want to calculate the number of possible passwords of exactly 8 characters (uppercase 26 letters, lowercase 26 letters, and digits 10 numbers) which of the two formulas should I use and why?","I would like to know the difference between ""permutations with repetition"" and ""ways to choose $k$ elements from a set of $n$ elements if repetitions are allowed"". For instance: In a set $S$ of $k$ elements, the number of $n$-tuples over $S$ (words with repetition) is: $$k^n$$ The number of ways to choose $k$ elements from a set of $n$ elements if repetitions are allowed is: $$\binom{n+k-1}{k}$$ Which is the difference among these two? If I want to calculate the number of possible passwords of exactly 8 characters (uppercase 26 letters, lowercase 26 letters, and digits 10 numbers) which of the two formulas should I use and why?",,"['combinatorics', 'binomial-coefficients', 'combinations']"
54,How many strings of five decimal digits contain exactly three distinct digits?,How many strings of five decimal digits contain exactly three distinct digits?,,"Here is my thought process so far: There are $10$ options for the first number, $9$ for the second, and $8$ for the third. According to this current structure, the fourth and fifth digits would have to be one or two of the three already selected digits in some order. If the first three digits were $1, 2, 3$ , then the possible permutations for the fourth and fifth spots are: $11, 22, 33, 12, 21, 13, 31, 23,$ and $32$ . So the answer so far would be $(10 \times 9 \times 8) \times (9) $ Therefore: Per three distinct digits, there are already $9$ options for a string. Additionally, the fourth and fifth spots which contain $1$ or more of the distinct digits for the first repeated occurrence don't have to be at the end. I thought that I should multiply the present answer by $(5$ choose $3) = 10$ to account for this additional variation in order, but I can tell that there must be some number of strings which are counted twice by this method, so $(10 \times 9 \times 8) \times (9) \times (10) = 64800$ is probably too great. Any suggestions? Thank you","Here is my thought process so far: There are options for the first number, for the second, and for the third. According to this current structure, the fourth and fifth digits would have to be one or two of the three already selected digits in some order. If the first three digits were , then the possible permutations for the fourth and fifth spots are: and . So the answer so far would be Therefore: Per three distinct digits, there are already options for a string. Additionally, the fourth and fifth spots which contain or more of the distinct digits for the first repeated occurrence don't have to be at the end. I thought that I should multiply the present answer by choose to account for this additional variation in order, but I can tell that there must be some number of strings which are counted twice by this method, so is probably too great. Any suggestions? Thank you","10 9 8 1, 2, 3 11, 22, 33, 12, 21, 13, 31, 23, 32 (10 \times 9 \times 8) \times (9)  9 1 (5 3) = 10 (10 \times 9 \times 8) \times (9) \times (10) = 64800","['combinatorics', 'discrete-mathematics', 'combinations']"
55,Chromatic number of complement of cycle graph,Chromatic number of complement of cycle graph,,"What is the chromatic number of the complement of the cycle graph , $\chi(\overline{C_n})$?","What is the chromatic number of the complement of the cycle graph , $\chi(\overline{C_n})$?",,"['combinatorics', 'graph-theory', 'coloring']"
56,Proof of the generating function of $1 -2x +3x^2 -4x^3+5x^4-6x^5+\cdots$,Proof of the generating function of,1 -2x +3x^2 -4x^3+5x^4-6x^5+\cdots,"The ordinary generating function for the sequence $\{a_n\}_{n\geq0}$ where $a_n = (-1)^n\,n$ is $$1 -2x +3x^2 -4x^3+5x^4-6x^5+\cdots = \frac{1}{(x+1)^2}$$ I can see from the geometric formula, and even from long division that $$1 -x +x^2 -x^3+x^4-x^5+\cdots = \frac{1}{1+x}$$ but I'm not seeing the coefficients to explain $\frac{1}{(x+1)^2}.$","The ordinary generating function for the sequence $\{a_n\}_{n\geq0}$ where $a_n = (-1)^n\,n$ is $$1 -2x +3x^2 -4x^3+5x^4-6x^5+\cdots = \frac{1}{(x+1)^2}$$ I can see from the geometric formula, and even from long division that $$1 -x +x^2 -x^3+x^4-x^5+\cdots = \frac{1}{1+x}$$ but I'm not seeing the coefficients to explain $\frac{1}{(x+1)^2}.$",,"['combinatorics', 'discrete-mathematics', 'power-series']"
57,$\sum_{i<j}x_i x_j=1$ implies $\sum_{i\ne k}x_i<\sqrt{2}$ for some index $k$?,implies  for some index ?,\sum_{i<j}x_i x_j=1 \sum_{i\ne k}x_i<\sqrt{2} k,"A friend of mine asked me the following olympiad-style problem, and I couldn't solve it. I post it here to get some hints or advice on it. Let $x_1,\ldots,x_n$ be $n$ distinct positive real numbers, where $n\geq2$. Suppose that the sum of products of 2 numbers among them, equals 1. That is; $$\sum_{i<j}x_i x_j=1.$$ Prove that there exist some index $k$ such that $\sum_{i\ne k}x_i<\sqrt{2}$.","A friend of mine asked me the following olympiad-style problem, and I couldn't solve it. I post it here to get some hints or advice on it. Let $x_1,\ldots,x_n$ be $n$ distinct positive real numbers, where $n\geq2$. Suppose that the sum of products of 2 numbers among them, equals 1. That is; $$\sum_{i<j}x_i x_j=1.$$ Prove that there exist some index $k$ such that $\sum_{i\ne k}x_i<\sqrt{2}$.",,"['combinatorics', 'inequality', 'contest-math']"
58,Explain how $\binom{n}{0}-\binom{n}{1}+\binom{n}{2}+...+(-1)^{n}\binom{n}{n} = 0$ [duplicate],Explain how  [duplicate],\binom{n}{0}-\binom{n}{1}+\binom{n}{2}+...+(-1)^{n}\binom{n}{n} = 0,"This question already has answers here : Alternating sum of binomial coefficients: given $n \in \mathbb N$, prove $\sum^n_{k=0}(-1)^k {n \choose k} = 0$ [duplicate] (7 answers) Closed 7 years ago . I understand how the sum of the bottom row of Pascal's triangle is equal to $2^n$, but how is this formula equal to zero?  Shouldn't it be 1? $\binom{n}{0}-\binom{n}{1}+\binom{n}{2}+...+(-1)^{n}\binom{n}{n} = 0$","This question already has answers here : Alternating sum of binomial coefficients: given $n \in \mathbb N$, prove $\sum^n_{k=0}(-1)^k {n \choose k} = 0$ [duplicate] (7 answers) Closed 7 years ago . I understand how the sum of the bottom row of Pascal's triangle is equal to $2^n$, but how is this formula equal to zero?  Shouldn't it be 1? $\binom{n}{0}-\binom{n}{1}+\binom{n}{2}+...+(-1)^{n}\binom{n}{n} = 0$",,"['combinatorics', 'combinatorial-proofs']"
