,title_raw,title_text,title_latex,body_raw,body_text,body_latex,tags
19,How many functions $f: A\rightarrow A$ exist without (?) any $f(x)=x$,How many functions  exist without (?) any,f: A\rightarrow A f(x)=x,"The definition: $\mathcal A = \{1\cdots12\}$ $\mathcal f: A \rightarrow A$ for each $\mathcal x \in A$, $\mathcal f$ is defined $\mathcal f(f(x)) \neq x$ and $\mathcal f(f(f(x))) = x$ How many functions exist? My thoughts: => (1) $\mathcal f$ is an bijective function => (2) $\mathcal f(x) \neq x$ (that's right?) Then, I have thought using inclusion-exclusion principle, by taking all bijective functions of $f: A\rightarrow A$ ($12!$, right?) minus all ""bad"" function with $f(x)=x$. However, I'm not sure about how doing it (there would be duplication etc). The answer is $246,400$","The definition: $\mathcal A = \{1\cdots12\}$ $\mathcal f: A \rightarrow A$ for each $\mathcal x \in A$, $\mathcal f$ is defined $\mathcal f(f(x)) \neq x$ and $\mathcal f(f(f(x))) = x$ How many functions exist? My thoughts: => (1) $\mathcal f$ is an bijective function => (2) $\mathcal f(x) \neq x$ (that's right?) Then, I have thought using inclusion-exclusion principle, by taking all bijective functions of $f: A\rightarrow A$ ($12!$, right?) minus all ""bad"" function with $f(x)=x$. However, I'm not sure about how doing it (there would be duplication etc). The answer is $246,400$",,"['combinatorics', 'functions']"
20,Place maximum Rooks on a chessboard,Place maximum Rooks on a chessboard,,"I am given a chessboard of size $8*8$. In this chessboard there are two holes at positions $(X1,Y1)$ and $(X2,Y2)$. Now I need to find the maximum number of rooks that can be placed on this chessboard such that no rook threatens another. Also no two rooks can threaten each other if there is hole between them. How can I tackle this problem? Please help NOTE : A hole can occupy only a single cell on the chess board.","I am given a chessboard of size $8*8$. In this chessboard there are two holes at positions $(X1,Y1)$ and $(X2,Y2)$. Now I need to find the maximum number of rooks that can be placed on this chessboard such that no rook threatens another. Also no two rooks can threaten each other if there is hole between them. How can I tackle this problem? Please help NOTE : A hole can occupy only a single cell on the chess board.",,"['combinatorics', 'puzzle']"
21,"How many four-digit odd numbers, all of digits different, can be formed from the digits 0 to 9, if there must be a 5 in the number?","How many four-digit odd numbers, all of digits different, can be formed from the digits 0 to 9, if there must be a 5 in the number?",,"How many four-digit odd numbers, all of digits different, can be formed from the digits 0 to 9, if there must be a 5 in the number? I know that there are 4 different cases where 5 is in the number: 5 _ _ _ _ 5 _ _ _ _ 5 _ _ _ _ 5 The first digit cannot be 0, since it has to be a 4-digit number.","How many four-digit odd numbers, all of digits different, can be formed from the digits 0 to 9, if there must be a 5 in the number? I know that there are 4 different cases where 5 is in the number: 5 _ _ _ _ 5 _ _ _ _ 5 _ _ _ _ 5 The first digit cannot be 0, since it has to be a 4-digit number.",,"['combinatorics', 'permutations', 'combinations']"
22,Is there a closed formula for $\sum_{k=0}^{n}\frac{1}{(k+1)(k+2)}\binom{n}{k}$?,Is there a closed formula for ?,\sum_{k=0}^{n}\frac{1}{(k+1)(k+2)}\binom{n}{k},I was asked to find a closed formula for the sum $$\sum_{k=0}^{n}\frac{1}{(k+1)(k+2)}\binom{n}{k}$$ could anyone give me an advice on how to get started?,I was asked to find a closed formula for the sum $$\sum_{k=0}^{n}\frac{1}{(k+1)(k+2)}\binom{n}{k}$$ could anyone give me an advice on how to get started?,,"['combinatorics', 'summation', 'binomial-coefficients']"
23,Translating matrix fibonacci into c++ (how can we determine if a number is fibonacci?),Translating matrix fibonacci into c++ (how can we determine if a number is fibonacci?),,Is it possible to determine if a number is a fibonacci number in less than N time (where N is the Nth fibonacci number) using the matrix method?  I'm trying to exclude external libraries like cmath or math.h which include square roots and powers for simpler operations. If anyone has any ideas I'd greatly appreciate it. Thanks.,Is it possible to determine if a number is a fibonacci number in less than N time (where N is the Nth fibonacci number) using the matrix method?  I'm trying to exclude external libraries like cmath or math.h which include square roots and powers for simpler operations. If anyone has any ideas I'd greatly appreciate it. Thanks.,,"['combinatorics', 'matrices', 'algorithms', 'intuition', 'fibonacci-numbers']"
24,"Permutation question on arrangement of 6 objects, grouped in pairs of 2, in 2 rows with 3 spaces in each row.","Permutation question on arrangement of 6 objects, grouped in pairs of 2, in 2 rows with 3 spaces in each row.",,"Q. Three couples sit for a photograph in 2 rows of three people each such that no couple is sitting in the same row next to each other or in the same column one behind the order. How many arrangements are possible? _ _ _ _ _ _ I used inclusion-exclusion for this. Let couples be $A_1B_1$ , $A_2B_2$ , $A_3B_3$ . Let the sets be defined as - $S_1$ = Cases in which at least 1 couple is in the same row, directly adjacent each other. $S_2$ = Cases in which at least 1 couple is in the same column. Total cases = $6!$ $n(S_1)$ = $4 \times 3 \times 2 \times 4!$ . Here 4 = Choosing of 2 horizontally-adjacent places, 3 = Three pairs of couples, 2 = Permutations of the horizontally-adjacent couple, 4! = No. of ways to arrange remaining 2 couples. $n(S_2)$ = $3 \times 3 \times 2 \times 4!$ . Here 3 = Choosing of 2 vertically-adjacent places, 3 = Three pairs of couples, 2 = Permutations of the vertically-adjacent couple, 4! = No. of ways to arrange remaining 2 couples. $n(S_1 ∩ S_2)$ = $3C2 \times 4 \times 1 \times 2! \times 2! \times 2!$ . Here $3C2$ = Choosing of two pairs of couples, 4 = Choosing of 2 horizontally-adjacent places, 1 = Forced selection of vertically-adjacent place, $2!,2!,2!$ = Permutations of horizontally-adjacent, vertically-adjacent, remaining two respectively. However it seems like $S_1∪ S_2$ is coming out to be greater than the universal set(total cases). I'm guessing I made some error in counting, or maybe in taking the sets. Help.","Q. Three couples sit for a photograph in 2 rows of three people each such that no couple is sitting in the same row next to each other or in the same column one behind the order. How many arrangements are possible? _ _ _ _ _ _ I used inclusion-exclusion for this. Let couples be , , . Let the sets be defined as - = Cases in which at least 1 couple is in the same row, directly adjacent each other. = Cases in which at least 1 couple is in the same column. Total cases = = . Here 4 = Choosing of 2 horizontally-adjacent places, 3 = Three pairs of couples, 2 = Permutations of the horizontally-adjacent couple, 4! = No. of ways to arrange remaining 2 couples. = . Here 3 = Choosing of 2 vertically-adjacent places, 3 = Three pairs of couples, 2 = Permutations of the vertically-adjacent couple, 4! = No. of ways to arrange remaining 2 couples. = . Here = Choosing of two pairs of couples, 4 = Choosing of 2 horizontally-adjacent places, 1 = Forced selection of vertically-adjacent place, = Permutations of horizontally-adjacent, vertically-adjacent, remaining two respectively. However it seems like is coming out to be greater than the universal set(total cases). I'm guessing I made some error in counting, or maybe in taking the sets. Help.","A_1B_1 A_2B_2 A_3B_3 S_1 S_2 6! n(S_1) 4 \times 3 \times 2 \times 4! n(S_2) 3 \times 3 \times 2 \times 4! n(S_1 ∩ S_2) 3C2 \times 4 \times 1 \times 2! \times 2! \times 2! 3C2 2!,2!,2! S_1∪ S_2","['combinatorics', 'permutations', 'inclusion-exclusion']"
25,How to prove $\sum_{k=0}^n {n\choose k} \frac{(-1)^{k-1}}{2k-1} = 1+ \sum_{k=0}^{n-1} \frac{4^k (k!)^2}{(2k+1)!} = \frac{4^n (n!)^2}{(2n)!}$?,How to prove ?,\sum_{k=0}^n {n\choose k} \frac{(-1)^{k-1}}{2k-1} = 1+ \sum_{k=0}^{n-1} \frac{4^k (k!)^2}{(2k+1)!} = \frac{4^n (n!)^2}{(2n)!},"In doing a calculation for my research I need a simple formula for the integral: $$ I = 1 + \int_0^1 \frac{1-(1-x^2)^n}{x^2} dx$$ for natural $n$ . Expanding the factor $(1-x^2)^n$ using the binomial theorem and integrating gives: $$ I = \sum_{k=0}^n {n\choose k} \frac{(-1)^{k-1}}{2k-1}.$$ Alternatively, the integrand can be rewritten as a geometric sum: $$ \frac{1-(1-x^2)^n}{x^2} = \sum_{k=0}^{n-1} (1-x^2)^k $$ and then each term in this sum can be integrated (and manipulated to give a beta function). The result gives: $$ I =  1+ \sum_{k=0}^{n-1} \frac{4^k (k!)^2}{(2k+1)!}. $$ In order to match to the result I expected from this calculation I need it to be true that: $$ I = \frac{4^n (n!)^2}{(2n)!} $$ and checking for values of $n < 100$ numerically these formulae do match and so I think this is correct. However, I don't know how to prove that either of my sum expressions or my initial integral expression for $I$ are equal to this final simple result. How can I show that $I$ is given by this final formula?","In doing a calculation for my research I need a simple formula for the integral: for natural . Expanding the factor using the binomial theorem and integrating gives: Alternatively, the integrand can be rewritten as a geometric sum: and then each term in this sum can be integrated (and manipulated to give a beta function). The result gives: In order to match to the result I expected from this calculation I need it to be true that: and checking for values of numerically these formulae do match and so I think this is correct. However, I don't know how to prove that either of my sum expressions or my initial integral expression for are equal to this final simple result. How can I show that is given by this final formula?", I = 1 + \int_0^1 \frac{1-(1-x^2)^n}{x^2} dx n (1-x^2)^n  I = \sum_{k=0}^n {n\choose k} \frac{(-1)^{k-1}}{2k-1}.  \frac{1-(1-x^2)^n}{x^2} = \sum_{k=0}^{n-1} (1-x^2)^k   I =  1+ \sum_{k=0}^{n-1} \frac{4^k (k!)^2}{(2k+1)!}.   I = \frac{4^n (n!)^2}{(2n)!}  n < 100 I I,"['combinatorics', 'discrete-mathematics', 'summation', 'induction']"
26,Find $\sum_{j=0}^{n}\sum_{i=j}^{n} {n \choose i}{i \choose j}$.,Find .,\sum_{j=0}^{n}\sum_{i=j}^{n} {n \choose i}{i \choose j},Find $\sum_{j=0}^{n}\sum_{i=j}^{n} {n \choose i}{i \choose j}$ . I don't know how to double summations like this very well. Can someone expand this to show how the $i=j$ thing works? I tried the following: ${n \choose i}{i \choose j}={n \choose j}{n-j \choose i-j}$ $\sum_{j=0}^{n}\sum_{i=j}^{n} {n \choose i}{i \choose j}=\sum_{j=0}^{n}\sum_{i=j}^{n} {n \choose j}{n-j \choose i-j}=\sum_{j=0}^{n} {n \choose j}{n-j \choose 0}=2^n$ Where am I going wrong?,Find . I don't know how to double summations like this very well. Can someone expand this to show how the thing works? I tried the following: Where am I going wrong?,\sum_{j=0}^{n}\sum_{i=j}^{n} {n \choose i}{i \choose j} i=j {n \choose i}{i \choose j}={n \choose j}{n-j \choose i-j} \sum_{j=0}^{n}\sum_{i=j}^{n} {n \choose i}{i \choose j}=\sum_{j=0}^{n}\sum_{i=j}^{n} {n \choose j}{n-j \choose i-j}=\sum_{j=0}^{n} {n \choose j}{n-j \choose 0}=2^n,"['combinatorics', 'summation', 'binomial-coefficients']"
27,Intuitive/combinatorial explanation of Delannoy summand,Intuitive/combinatorial explanation of Delannoy summand,,"The $n$ th central Delannoy number $D_n$ is the number of lattice walks from $(0,0)$ to $(n,n)$ taking only steps up, right, and northeast, to neighbor lattice points. From Wikipedia: $$D_n=\sum_{k=0}^n{n \choose k}{{n+k} \choose k}.$$ I am wondering if there is an intuitive/combinatorial explanation as to why we are summing ${n \choose k}{{n+k} \choose k}$ . That is, is there an intuition behind what it is counting?","The th central Delannoy number is the number of lattice walks from to taking only steps up, right, and northeast, to neighbor lattice points. From Wikipedia: I am wondering if there is an intuitive/combinatorial explanation as to why we are summing . That is, is there an intuition behind what it is counting?","n D_n (0,0) (n,n) D_n=\sum_{k=0}^n{n \choose k}{{n+k} \choose k}. {n \choose k}{{n+k} \choose k}","['combinatorics', 'binomial-coefficients', 'intuition']"
28,"How many non-negative solutions for $x_{1} + x_{2} + x_{3} + x_{4} = 40$ where $2 \leq x_{1} \leq 8, x_{2} \leq 4, x_{3} \geq 4, x_{4} \leq 5$?",How many non-negative solutions for  where ?,"x_{1} + x_{2} + x_{3} + x_{4} = 40 2 \leq x_{1} \leq 8, x_{2} \leq 4, x_{3} \geq 4, x_{4} \leq 5","My solution: We have: $x_{1} + x_{2} + x_{3} + x_{4} = 40$ where $2 \leq x_{1} \leq 8, x_{2} \leq 4, x_{3} \geq 4, x_{4} \leq 5$ $\Leftrightarrow  x_{2} + x_{3} + x_{4} = 40 - x_{1} \quad (*)$ Consider: $x_{2} + x_{3} + x_{4} = 40 - x_{1}$ where $x_{2} \geq 0, x_{3} \geq 4, x_{4} \geq 0 \quad (**)$ $x_{2} + x_{3} + x_{4} = 40 - x_{1}$ where $x_{2} \geq 5, x_{3} \geq 4, x_{4} \geq 6 \quad (***)$ Let $f$ is the function that compute the number of non-negative solutions of an equation. $\implies f(*) = f(**) - f(***)$ Thus, the number of non-negative solutions of (*) is $\sum_{x_{1} = 2}^{8}( {40 - x_{1} + 3 - 1  \choose 3 - 1} - {25-x_{1}+3 - 1 \choose 3 - 1}) = 3045$ I found that the right answer is 210 by trying some programming script. But I don't know what was wrong with my solution. Please help me. Thank you!","My solution: We have: where Consider: where where Let is the function that compute the number of non-negative solutions of an equation. Thus, the number of non-negative solutions of (*) is I found that the right answer is 210 by trying some programming script. But I don't know what was wrong with my solution. Please help me. Thank you!","x_{1} + x_{2} + x_{3} + x_{4} = 40 2 \leq x_{1} \leq 8, x_{2} \leq 4, x_{3} \geq 4, x_{4} \leq 5 \Leftrightarrow  x_{2} + x_{3} + x_{4} = 40 - x_{1} \quad (*) x_{2} + x_{3} + x_{4} = 40 - x_{1} x_{2} \geq 0, x_{3} \geq 4, x_{4} \geq 0 \quad (**) x_{2} + x_{3} + x_{4} = 40 - x_{1} x_{2} \geq 5, x_{3} \geq 4, x_{4} \geq 6 \quad (***) f \implies f(*) = f(**) - f(***) \sum_{x_{1} = 2}^{8}( {40 - x_{1} + 3 - 1  \choose 3 - 1} - {25-x_{1}+3 - 1 \choose 3 - 1}) = 3045",['combinatorics']
29,is there a formula for this binomial sum?,is there a formula for this binomial sum?,,"Are there any formulas to calculate the below sum? $$\sum_{n=1}^{1918}n\binom{2017-n}{99}$$ Or, more generally, $$\sum_{n=1}^{1918}n\binom{2017-n}{k}$$","Are there any formulas to calculate the below sum? $$\sum_{n=1}^{1918}n\binom{2017-n}{99}$$ Or, more generally, $$\sum_{n=1}^{1918}n\binom{2017-n}{k}$$",,"['combinatorics', 'summation', 'binomial-coefficients']"
30,the sum of elements of all possible subset $B$ is,the sum of elements of all possible subset  is,B,"Let $A = \{1,2,3,4,\cdots \cdots ,22\}$ and $B$ is a subset of $A$ having exactly $11$ elements. Then the sum of elements of all possible subset $B$ is $\bf{Attempt}$ Number of subset of $A$ having excatly $11$ elements is $\displaystyle \binom{22}{11}$ Now how can i find sum of elements of all subset of $B$ , could some help me , thanks","Let and is a subset of having exactly elements. Then the sum of elements of all possible subset is Number of subset of having excatly elements is Now how can i find sum of elements of all subset of , could some help me , thanks","A = \{1,2,3,4,\cdots \cdots ,22\} B A 11 B \bf{Attempt} A 11 \displaystyle \binom{22}{11} B",['combinatorics']
31,Summation of binomial with factor squared $\sum_{k=0}^n k^2 \binom nk^2 = n^2 {2n-2 \choose n-1}$,Summation of binomial with factor squared,\sum_{k=0}^n k^2 \binom nk^2 = n^2 {2n-2 \choose n-1},How to prove that $$ \sum_{k=0}^n k^2 {n \choose k}^2 = n^2 {2n-2 \choose n-1} $$ in combinatorial way?,How to prove that in combinatorial way?,"
\sum_{k=0}^n k^2 {n \choose k}^2 = n^2 {2n-2 \choose n-1}
","['combinatorics', 'summation', 'binomial-coefficients', 'combinatorial-proofs']"
32,Simplifying $\big(\sum_{i=0}^n\binom{k}{i}\binom{M-k}{n-i}\frac{k-i}{M-n}\big)/{\binom{M}{n}}$,Simplifying,\big(\sum_{i=0}^n\binom{k}{i}\binom{M-k}{n-i}\frac{k-i}{M-n}\big)/{\binom{M}{n}},"Show that    $$\frac{\sum_{i=0}^n\binom{k}{i}\binom{M-k}{n-i}\frac{k-i}{M-n}}{\binom{M}{n}}=\frac{k}{M},$$ where $M-k>n$ and $k>n$ From Vandermonde's identity, I get $\sum_{i=0}^n\binom{k}{i}\binom{M-k}{n-i}=\binom{M}{n}$. But what about the sum of the product in the numerator? Any hint will be helpful.","Show that    $$\frac{\sum_{i=0}^n\binom{k}{i}\binom{M-k}{n-i}\frac{k-i}{M-n}}{\binom{M}{n}}=\frac{k}{M},$$ where $M-k>n$ and $k>n$ From Vandermonde's identity, I get $\sum_{i=0}^n\binom{k}{i}\binom{M-k}{n-i}=\binom{M}{n}$. But what about the sum of the product in the numerator? Any hint will be helpful.",,"['combinatorics', 'probability-distributions', 'binomial-coefficients']"
33,inclusion-exclusion principle - challenging problem [closed],inclusion-exclusion principle - challenging problem [closed],,"Closed. This question is off-topic . It is not currently accepting answers. This question is missing context or other details : Please improve the question by providing additional context, which ideally includes your thoughts on the problem and any attempts you have made to solve it. This information helps others identify where you have difficulties and helps them write answers appropriate to your experience level. Closed 8 years ago . Improve this question I wonder how to write proper solution to the following problem given below: Let $\mathbb{N}$ be the set of all positive integers. Let a map $f:\mathbb{N}\to \mathbb{N}$ be defined in the following way: $f(n)$ is the number of positive integers $i$ that are relatively prime to given $n$ and satisfy $i \leq n$ . By the use of inclusion-exclusion principle, derive formula for the function $f(n)$ . Any help very appreciated! I know that $f$ is called Euler's totient function.","Closed. This question is off-topic . It is not currently accepting answers. This question is missing context or other details : Please improve the question by providing additional context, which ideally includes your thoughts on the problem and any attempts you have made to solve it. This information helps others identify where you have difficulties and helps them write answers appropriate to your experience level. Closed 8 years ago . Improve this question I wonder how to write proper solution to the following problem given below: Let be the set of all positive integers. Let a map be defined in the following way: is the number of positive integers that are relatively prime to given and satisfy . By the use of inclusion-exclusion principle, derive formula for the function . Any help very appreciated! I know that is called Euler's totient function.",\mathbb{N} f:\mathbb{N}\to \mathbb{N} f(n) i n i \leq n f(n) f,"['combinatorics', 'elementary-number-theory', 'inclusion-exclusion', 'totient-function']"
34,combinatorics - why my reasoning is wrong?,combinatorics - why my reasoning is wrong?,,"we have 22 balls (5 red, 7 green and 10 blue). i wrote this as an anwser to the question : what is the probability to get 3 colors when picking 8 balls at once ? $$\frac{C_5^1 * C_7^1 * C_{10}^1*C_{19}^5}{C_{22}^8} $$ it appears that this is wrong. anyone help understand why? for me i can choose a ball from each color and then choose the rest. I also tried : $$1-\frac{C_{12}^8 + C_{15}^8 + C_{17}^8}{C_{22}^8}$$ thinking that we can take the event having one or two colors. Also this appears not to be true. Anyone can help?","we have 22 balls (5 red, 7 green and 10 blue). i wrote this as an anwser to the question : what is the probability to get 3 colors when picking 8 balls at once ? $$\frac{C_5^1 * C_7^1 * C_{10}^1*C_{19}^5}{C_{22}^8} $$ it appears that this is wrong. anyone help understand why? for me i can choose a ball from each color and then choose the rest. I also tried : $$1-\frac{C_{12}^8 + C_{15}^8 + C_{17}^8}{C_{22}^8}$$ thinking that we can take the event having one or two colors. Also this appears not to be true. Anyone can help?",,"['combinatorics', 'inclusion-exclusion']"
35,number of such numbers,number of such numbers,,"the number $$916238457$$ is an example of a nine-digit number which contains each of the digit 1 to 9 exactly once. it also has the property that the digits 1 to 5 occur in natural order, while the digits 1 to 6 do not.find the number of such numbers. i have no idea how to go about it!! someone please help","the number $$916238457$$ is an example of a nine-digit number which contains each of the digit 1 to 9 exactly once. it also has the property that the digits 1 to 5 occur in natural order, while the digits 1 to 6 do not.find the number of such numbers. i have no idea how to go about it!! someone please help",,['combinatorics']
36,Counting binary strings of length n with no two adjacent 1's,Counting binary strings of length n with no two adjacent 1's,,"I need to calculate the total number of possible binary strings of length $n$ with no two adjacent 1's. Eg. for n = 3 f(n) = 5 000,001,010,100,101 How do I solve it?","I need to calculate the total number of possible binary strings of length $n$ with no two adjacent 1's. Eg. for n = 3 f(n) = 5 000,001,010,100,101 How do I solve it?",,['combinatorics']
37,Summation proof (with binomial coefficents),Summation proof (with binomial coefficents),,"I am trying to prove that $\sum_{k=2}^n$ $k(k-1) {n \choose k}$=$n(n-1)2^{n-2}$. I was initially trying to use induction, but I think a more simple proof can be done using the fact that $\sum_{k=0}^n {n \choose k}$=$2^n$. This is how I begin to proceed: $\sum_{k=2}^n$ $k(k-1) {n \choose k}$= $\sum_{k=0}^{n-2}$ $(k+2)(k+1) {n \choose k+2}$= $2^{n-2} *\sum_{k=0}^{n-2}$ $(k+2)(k+1)$. First of all, is this correct so far? And second, how would I proceed from here.","I am trying to prove that $\sum_{k=2}^n$ $k(k-1) {n \choose k}$=$n(n-1)2^{n-2}$. I was initially trying to use induction, but I think a more simple proof can be done using the fact that $\sum_{k=0}^n {n \choose k}$=$2^n$. This is how I begin to proceed: $\sum_{k=2}^n$ $k(k-1) {n \choose k}$= $\sum_{k=0}^{n-2}$ $(k+2)(k+1) {n \choose k+2}$= $2^{n-2} *\sum_{k=0}^{n-2}$ $(k+2)(k+1)$. First of all, is this correct so far? And second, how would I proceed from here.",,['combinatorics']
38,geometric problem solved with Pigeon Hole Principle,geometric problem solved with Pigeon Hole Principle,,"The problem is: Show that among any 5 points in a equilateral triangle of unit side length, there are 2 whose distance is at most 1/2 units apart.","The problem is: Show that among any 5 points in a equilateral triangle of unit side length, there are 2 whose distance is at most 1/2 units apart.",,"['combinatorics', 'pigeonhole-principle']"
39,Binomial Sum: An In-Depth Analysis into the Relatedness of Two Equivalences,Binomial Sum: An In-Depth Analysis into the Relatedness of Two Equivalences,,"How is it that $$n(1+x)^{n-1}=\sum_{k=1}^n C(n,k)kx^{k-1}?$$ How can this be used to show that $$n2^{n-1}=\sum_{k=1}^nkC(n,k)?$$","How is it that $$n(1+x)^{n-1}=\sum_{k=1}^n C(n,k)kx^{k-1}?$$ How can this be used to show that $$n2^{n-1}=\sum_{k=1}^nkC(n,k)?$$",,"['combinatorics', 'summation']"
40,Chess Board and Knights,Chess Board and Knights,,I can't solve this question. Anyone knows how I must solve? You have a 6x3 chess board. How many forms exist to put a Knight in a square and with valid moviments pass in all squares but only one time in each one? And with in a LxC chess board?,I can't solve this question. Anyone knows how I must solve? You have a 6x3 chess board. How many forms exist to put a Knight in a square and with valid moviments pass in all squares but only one time in each one? And with in a LxC chess board?,,"['combinatorics', 'combinatorial-game-theory', 'extremal-combinatorics']"
41,How to prove if function is increasing,How to prove if function is increasing,,"Need to prove that function $$P(n,k)=\binom{n}{k}= \frac{n!}{k!(n-k)!}$$ is increasing when $\displaystyle k\leq\frac{n}{2}$. Is this inductive maths topic?","Need to prove that function $$P(n,k)=\binom{n}{k}= \frac{n!}{k!(n-k)!}$$ is increasing when $\displaystyle k\leq\frac{n}{2}$. Is this inductive maths topic?",,"['combinatorics', 'induction']"
42,"put 4 red, blue and green triangles in a row","put 4 red, blue and green triangles in a row",,"How many ways are there to put 4 red, 4 blue and 4 green triangles in a row so that no blue triangles would lie next to each other. I got an answer, there are 126*56=7056 combinations. Could you check please, if the answer is right/wrong?","How many ways are there to put 4 red, 4 blue and 4 green triangles in a row so that no blue triangles would lie next to each other. I got an answer, there are 126*56=7056 combinations. Could you check please, if the answer is right/wrong?",,['combinatorics']
43,Closed form for a sum involving binomial coefficient $\sum_{j=0}^n \binom{n}{j} \frac1{j+1} = \frac{2^{n+1}-1}{n+1}$ [duplicate],Closed form for a sum involving binomial coefficient  [duplicate],\sum_{j=0}^n \binom{n}{j} \frac1{j+1} = \frac{2^{n+1}-1}{n+1},This question already has answers here : Closed 12 years ago . Possible Duplicate: How can I compute $\sum\limits_{k = 1}^n \frac{1} {k + 1}\binom{n}{k} $? How to derive the following equality? $$\sum_{j=0}^n \binom{n}{j} \frac1{j+1} = \frac{2^{n+1}-1}{n+1}$$,This question already has answers here : Closed 12 years ago . Possible Duplicate: How can I compute $\sum\limits_{k = 1}^n \frac{1} {k + 1}\binom{n}{k} $? How to derive the following equality? $$\sum_{j=0}^n \binom{n}{j} \frac1{j+1} = \frac{2^{n+1}-1}{n+1}$$,,"['combinatorics', 'summation', 'binomial-coefficients']"
