,title_raw,title_text,title_latex,body_raw,body_text,body_latex,tags
0,Prove the identity $\sum_{k=0}^{n}\sum_{r=0}^{k} \binom{k}{r} \binom{n}{k} = 3^n$,Prove the identity,\sum_{k=0}^{n}\sum_{r=0}^{k} \binom{k}{r} \binom{n}{k} = 3^n,"Prove the identity $\sum_{k=0}^{n}\sum_{r=0}^{k} \binom{k}{r} \binom{n}{k} = 3^n$ . I believe I need to use the binomial theorem here, but I don't know how to deal with the double summations.","Prove the identity . I believe I need to use the binomial theorem here, but I don't know how to deal with the double summations.",\sum_{k=0}^{n}\sum_{r=0}^{k} \binom{k}{r} \binom{n}{k} = 3^n,"['combinatorics', 'discrete-mathematics', 'summation', 'binomial-coefficients']"
1,Find number of functions [duplicate],Find number of functions [duplicate],,"This question already has answers here : Determine the number of functions $f: \{1,2,3....,1999\}\to \{2000,2001,2002,2003\}$satisfying the condition that $f(1)+f(2)+...f(1999)$ is odd. (4 answers) Closed 6 years ago . Find the number of functions $f: \{1,2,3,\dots,1999\}\to\{2000,2001,2002,2003\}$ satisfying the condition that $f(1)+f(2)+f(3)+\dots+f(1999)$ is odd. Upon first thought my try was that for any function $2000p+2001q+2002r+2003s$ is odd where $p, q, r, s$ are natural numbers  which also satisfy $p+q+r+s=1999$ and hence $q, s$ must be odd. Using generating functions I found the answer but then the thought stuck me that I am asked to find the number of functions possible. So I would like to know how would one do such questions using the mapping technique or any other combinatorial method.","This question already has answers here : Determine the number of functions $f: \{1,2,3....,1999\}\to \{2000,2001,2002,2003\}$satisfying the condition that $f(1)+f(2)+...f(1999)$ is odd. (4 answers) Closed 6 years ago . Find the number of functions $f: \{1,2,3,\dots,1999\}\to\{2000,2001,2002,2003\}$ satisfying the condition that $f(1)+f(2)+f(3)+\dots+f(1999)$ is odd. Upon first thought my try was that for any function $2000p+2001q+2002r+2003s$ is odd where $p, q, r, s$ are natural numbers  which also satisfy $p+q+r+s=1999$ and hence $q, s$ must be odd. Using generating functions I found the answer but then the thought stuck me that I am asked to find the number of functions possible. So I would like to know how would one do such questions using the mapping technique or any other combinatorial method.",,"['combinatorics', 'functions', 'contest-math']"
2,How many distinct ways are there to $2$-color the $8$ vertices of a cube?,How many distinct ways are there to -color the  vertices of a cube?,2 8,"How many distinct ways are there to $2$-color the $8$ vertices of a cube, with colorings only considered distinct up to rotation?","How many distinct ways are there to $2$-color the $8$ vertices of a cube, with colorings only considered distinct up to rotation?",,"['abstract-algebra', 'combinatorics']"
3,Coefficient of $x^{41}$ in $(x^5 + x^6 + x^7 + x^8 + x^9)^5$,Coefficient of  in,x^{41} (x^5 + x^6 + x^7 + x^8 + x^9)^5,"What is the coefficient of coefficient of $x^{41}$ in $(x^5 + x^6 + x^7 + x^8 + x^9)^5$? Using summation of G.P. , this is equivalent to finding the coefficient of $x^{41}$ in $$\left(x^5 \left(\frac{1-x^5}{1-x}\right)\right)^5$$ and thus finding coefficient of $x^{16}$ in $(\frac{1-x^5}{1-x})^5$. How to proceed after this?","What is the coefficient of coefficient of $x^{41}$ in $(x^5 + x^6 + x^7 + x^8 + x^9)^5$? Using summation of G.P. , this is equivalent to finding the coefficient of $x^{41}$ in $$\left(x^5 \left(\frac{1-x^5}{1-x}\right)\right)^5$$ and thus finding coefficient of $x^{16}$ in $(\frac{1-x^5}{1-x})^5$. How to proceed after this?",,"['combinatorics', 'binomial-coefficients']"
4,Arranging numbers around a square,Arranging numbers around a square,,In how many ways numbers 1 to 12 can be arranged on a sides of squares (5 places on each sides i.e 20 places total) leaving 8 places empty? I am getting answer as 12c5(selecting 5 numbers)*7c5(selecting another 5 numbers)*2(remaining 2)*5!(arranging the 5 numbers amongst themselves) But the answer given is 5*19P11.. Can someone please help me.,In how many ways numbers 1 to 12 can be arranged on a sides of squares (5 places on each sides i.e 20 places total) leaving 8 places empty? I am getting answer as 12c5(selecting 5 numbers)*7c5(selecting another 5 numbers)*2(remaining 2)*5!(arranging the 5 numbers amongst themselves) But the answer given is 5*19P11.. Can someone please help me.,,"['combinatorics', 'permutations', 'combinations']"
5,How can the sniffer dog find the bag of drugs?,How can the sniffer dog find the bag of drugs?,,"There are $n$ bags. In one of the bags are drugs. There is a dog that when given a group of bags, can tell whether there are drugs in the group or not. Each sniff counts as a ""turn"". What is the best strategy, the strategy that find the bag with drugs in the smallest amount of turns? So for example, say there are $60$ bags and the drugs are in bag $5$. The dog sniffs bags $17, 6, 2$ and determines that there are no drugs in them. If the dog sniffs in bags $30, 35,5$ then the dog confirms that the drugs are in that group of bags. I think that the best strategy is to sniff half of the bags at a time. So when $n=60$, the dog would sniff thirty bags in the first turn, 15 bags in the second turn, 8 bags in the third turn and so on, eventually finding the one bag with drugs in it. But how can I prove that it is the best strategy? Thanks.","There are $n$ bags. In one of the bags are drugs. There is a dog that when given a group of bags, can tell whether there are drugs in the group or not. Each sniff counts as a ""turn"". What is the best strategy, the strategy that find the bag with drugs in the smallest amount of turns? So for example, say there are $60$ bags and the drugs are in bag $5$. The dog sniffs bags $17, 6, 2$ and determines that there are no drugs in them. If the dog sniffs in bags $30, 35,5$ then the dog confirms that the drugs are in that group of bags. I think that the best strategy is to sniff half of the bags at a time. So when $n=60$, the dog would sniff thirty bags in the first turn, 15 bags in the second turn, 8 bags in the third turn and so on, eventually finding the one bag with drugs in it. But how can I prove that it is the best strategy? Thanks.",,"['combinatorics', 'discrete-mathematics', 'algorithms', 'recreational-mathematics']"
6,Prove $\chi(G)\chi(\bar{G}) \geq n$ for chromatic number of graph and its complement,Prove  for chromatic number of graph and its complement,\chi(G)\chi(\bar{G}) \geq n,"Let us denote by $\chi(G)$ the chromatic number, which is the smallest number of colours needed to colour the graph $G$ with $n$ vertices. Let $\bar{G}$ be the complement of $G$. Show that (a) $\chi(G)+\chi(\bar{G}) \leq n+1$ (b) $\chi(G)\chi(\bar{G}) \geq n$ I was able to prove (a) using induction. Any hints on proving (b)?","Let us denote by $\chi(G)$ the chromatic number, which is the smallest number of colours needed to colour the graph $G$ with $n$ vertices. Let $\bar{G}$ be the complement of $G$. Show that (a) $\chi(G)+\chi(\bar{G}) \leq n+1$ (b) $\chi(G)\chi(\bar{G}) \geq n$ I was able to prove (a) using induction. Any hints on proving (b)?",,"['combinatorics', 'graph-theory', 'coloring']"
7,"How many integers from $1$ through $999,999$ contains digit $1$?",How many integers from  through  contains digit ?,"1 999,999 1","How many integers from $1$ through $999,999$ contains digit $1$? I have no idea to solve this problem. Have anyone give me some advice? Thanks in advance!!","How many integers from $1$ through $999,999$ contains digit $1$? I have no idea to solve this problem. Have anyone give me some advice? Thanks in advance!!",,['combinatorics']
8,How is this a property of Pascal's triangle?,How is this a property of Pascal's triangle?,,"For all non-negative integers $k$ and $n$, $$ \dbinom{k}{k} + \dbinom{k+1}{k} + \dbinom{k+2}{k} + \ldots + \dbinom{n}{k} = \dbinom{n +1}{k+1} $$ How is this a property of Pascal's triangle? I do not see at all how it relates. I'm looking for an explanation, as opposed to some calculation with algebraic manipulations.","For all non-negative integers $k$ and $n$, $$ \dbinom{k}{k} + \dbinom{k+1}{k} + \dbinom{k+2}{k} + \ldots + \dbinom{n}{k} = \dbinom{n +1}{k+1} $$ How is this a property of Pascal's triangle? I do not see at all how it relates. I'm looking for an explanation, as opposed to some calculation with algebraic manipulations.",,"['combinatorics', 'binomial-coefficients']"
9,Coefficient of $x^{21}$ in $(1+x+x^2+\dots+x^{10})^4$,Coefficient of  in,x^{21} (1+x+x^2+\dots+x^{10})^4,"Find the coefficient of $x^{21}$ in $(1+x+x^2+\dots+x^{10})^4$ I tried splitting the terms inside the bracket into two parts $1+x+\dots+x^9$ and $x^{10}$ , and then tried binomial theorem, but that got unreasonably hard to deal with. Another idea that came is to write the expression inside bracket as $\smash{\dfrac{x^{11}-1}{x-1}}$ , but I don't know how to proceed. Help","Find the coefficient of in I tried splitting the terms inside the bracket into two parts and , and then tried binomial theorem, but that got unreasonably hard to deal with. Another idea that came is to write the expression inside bracket as , but I don't know how to proceed. Help",x^{21} (1+x+x^2+\dots+x^{10})^4 1+x+\dots+x^9 x^{10} \smash{\dfrac{x^{11}-1}{x-1}},"['combinatorics', 'algebra-precalculus', 'polynomials', 'binomial-coefficients']"
10,"Prove that if $2n$ points are colored red or blue, then we can always connect the red points to the blue points with non-intersecting line segments.","Prove that if  points are colored red or blue, then we can always connect the red points to the blue points with non-intersecting line segments.",2n,"Take any set of 2n points in the plane with no three collinear, and then arbitrarily color each point red or blue. Prove that it is always possible to pair up the red points with the blue points by drawing line segments connecting them so that no two of the line segments intersect. This problem is provided in Richard A. Brauldi's book on Introductory Combinatorics. I believe it is implied that the number of red points is equal to the number of blue points. I tried to reason as follows: it seems like it's always possible to divide the plane into two regions, such that each region contains an equal number of red and blue points. Further, subdivide those regions into subregions with equal numbers of red and blue points; and continue the process until all the regions contain exactly one red and one blue point. Then we can simply connect the two points of every region with a line; and since all pairs lie in distinct regions, it seems obvious that no lines will intersect. However, I don't know how exactly to prove this. That is, how do I gaurantee that it is in fact possible to divide any region of red and blue points into subregions of equal numbers of red and blue points? Or how would the problem be approached by a more professional. Thank you in advance.","Take any set of 2n points in the plane with no three collinear, and then arbitrarily color each point red or blue. Prove that it is always possible to pair up the red points with the blue points by drawing line segments connecting them so that no two of the line segments intersect. This problem is provided in Richard A. Brauldi's book on Introductory Combinatorics. I believe it is implied that the number of red points is equal to the number of blue points. I tried to reason as follows: it seems like it's always possible to divide the plane into two regions, such that each region contains an equal number of red and blue points. Further, subdivide those regions into subregions with equal numbers of red and blue points; and continue the process until all the regions contain exactly one red and one blue point. Then we can simply connect the two points of every region with a line; and since all pairs lie in distinct regions, it seems obvious that no lines will intersect. However, I don't know how exactly to prove this. That is, how do I gaurantee that it is in fact possible to divide any region of red and blue points into subregions of equal numbers of red and blue points? Or how would the problem be approached by a more professional. Thank you in advance.",,"['combinatorics', 'geometry', 'euclidean-geometry', 'combinatorial-proofs']"
11,"How many different sets of positive integers $(a, b, c, d)$ are there such that $a \lt b \lt c \lt d$ and $a + b + c + d = 41$?",How many different sets of positive integers  are there such that  and ?,"(a, b, c, d) a \lt b \lt c \lt d a + b + c + d = 41","Is there a general formula which I can use to calculate this and if it's with proof or reasoning would be great as well. Even if you could please solve this $4$ -variable ordered set of positive integers case would be a great help indeed. Sorry I am weak in this topic. Thanks Robert for your pointers in modifying it to $(4\times1) + (3\times2) + (2\times3) + (1\times4) = 41$ , where there are no additional constraints on $x_i$ To solve this must do it manually by cases or is there a short way of calculating it using ""Bars and Stars"" (of which I am aware of the method)? The answer given is $321$ . But when I calculate it like this it doesn't seem to match the answer: imagine the new given equation as containing $(4+3+2+1) = 10$$x_i$ 's individually so as equivalent to finding the number of positive integer solutions for $b_1 + b_2 + ... + b_{10} = 41$ which is $C(41 - 1, 10 - 1) = C(40, 9)$ . Now since we have $4x_1$ 's that are identical, we need to divide this by $4!$ (for its permutations of ""overcounting"") and similarly divide next by $3!$ (for $3x_2$ 's that are equal), and $2!$ for the $2x_3$ 's that are equal. How is my approach wrong here? anybody, please help me? Thanks again As per Robert's transformation with Anil's suggestion of the generating functions method, here's my work on it: I actually used an online calculator called ""Sage Math"" to do this via this website: https://www.whitman.edu/mathematics/cgt_online/book/section03.01.html With these modifications $f(x)=(1-x^4)^{-1}\times(1-x^3)^{-1}\times(1-x^2)^{-1}\times(1-x)^{-1}$ show(taylor( $f,x,0,33$ )) And have gotten the verification  that $321$ is indeed the answer after some tedious algebra (please note that since we are looking for the coefficient of $x^41$ in the expansion Anil wrote which has $x^(4+3+2+1) = x^10$ factored outside meaning in the remaining Newton's Binomial Expansions with negative exponent, we only need to determine the coefficient of $x^(41-10)= x^31$ in it which is "" $321$ "" as the answer suggested (please see image below):","Is there a general formula which I can use to calculate this and if it's with proof or reasoning would be great as well. Even if you could please solve this -variable ordered set of positive integers case would be a great help indeed. Sorry I am weak in this topic. Thanks Robert for your pointers in modifying it to , where there are no additional constraints on To solve this must do it manually by cases or is there a short way of calculating it using ""Bars and Stars"" (of which I am aware of the method)? The answer given is . But when I calculate it like this it doesn't seem to match the answer: imagine the new given equation as containing 's individually so as equivalent to finding the number of positive integer solutions for which is . Now since we have 's that are identical, we need to divide this by (for its permutations of ""overcounting"") and similarly divide next by (for 's that are equal), and for the 's that are equal. How is my approach wrong here? anybody, please help me? Thanks again As per Robert's transformation with Anil's suggestion of the generating functions method, here's my work on it: I actually used an online calculator called ""Sage Math"" to do this via this website: https://www.whitman.edu/mathematics/cgt_online/book/section03.01.html With these modifications show(taylor( )) And have gotten the verification  that is indeed the answer after some tedious algebra (please note that since we are looking for the coefficient of in the expansion Anil wrote which has factored outside meaning in the remaining Newton's Binomial Expansions with negative exponent, we only need to determine the coefficient of in it which is "" "" as the answer suggested (please see image below):","4 (4\times1) + (3\times2) + (2\times3) + (1\times4) = 41 x_i 321 (4+3+2+1) = 10x_i b_1 + b_2 + ... + b_{10} = 41 C(41 - 1, 10 - 1) = C(40, 9) 4x_1 4! 3! 3x_2 2! 2x_3 f(x)=(1-x^4)^{-1}\times(1-x^3)^{-1}\times(1-x^2)^{-1}\times(1-x)^{-1} f,x,0,33 321 x^41 x^(4+3+2+1) = x^10 x^(41-10)= x^31 321","['combinatorics', 'elementary-number-theory', 'combinatorial-proofs', 'linear-diophantine-equations']"
12,"Combinatorics exercise about sets of forks, knives, spoons.","Combinatorics exercise about sets of forks, knives, spoons.",,"Problem statement: At various yard sales, a woman has acquired five forks, of which no two are alike. The same applies to her four knives and seven spoons. In how many different ways can three place settings be chosen if each place setting consists of exactly one fork, one knife, and one spoon? Assume that the arrangement of the place settings on the table is unimportant. So far I figured the following thing out: Since we have to serve 3 sets, having the sets already, we would have $3!=6$ different ways of arranging the already created sets. What would be the next thing to calculate to count how many times ONE set could be arranged? The part I am struggling with is that each fork (and knive, spoon respectively) is distinct from one another, so I can't just use this theorem: It would be nice if somebody would only give me a hint so I can still figure it myself (Dont just handwaive). Thank you!","Problem statement: At various yard sales, a woman has acquired five forks, of which no two are alike. The same applies to her four knives and seven spoons. In how many different ways can three place settings be chosen if each place setting consists of exactly one fork, one knife, and one spoon? Assume that the arrangement of the place settings on the table is unimportant. So far I figured the following thing out: Since we have to serve 3 sets, having the sets already, we would have different ways of arranging the already created sets. What would be the next thing to calculate to count how many times ONE set could be arranged? The part I am struggling with is that each fork (and knive, spoon respectively) is distinct from one another, so I can't just use this theorem: It would be nice if somebody would only give me a hint so I can still figure it myself (Dont just handwaive). Thank you!",3!=6,['combinatorics']
13,Number of compositions with sum N [duplicate],Number of compositions with sum N [duplicate],,"This question already has answers here : number of ordered partitions of integer (4 answers) Closed 2 years ago . I was wondering if any of you folks could help me with this combinatorial problem. I need to show the exact number of compositions (c1, c2 , c3, ...) that have a sum of N is $2^{N-1}$ . For example, for $n=4$ we have $C_N = \{(4) , (3,1), (2,2), (1,3), (2,1,1), (1,2,1), (1,1,2), (1,1,1,1)\}$ with $|C_N| = 2^{4-1} = 8$","This question already has answers here : number of ordered partitions of integer (4 answers) Closed 2 years ago . I was wondering if any of you folks could help me with this combinatorial problem. I need to show the exact number of compositions (c1, c2 , c3, ...) that have a sum of N is . For example, for we have with","2^{N-1} n=4 C_N = \{(4) , (3,1), (2,2), (1,3), (2,1,1), (1,2,1), (1,1,2), (1,1,1,1)\} |C_N| = 2^{4-1} = 8",['combinatorics']
14,Looking for a proof for this counting problem,Looking for a proof for this counting problem,,"Consider all the coefficients in the expansion of $$(x^a+x^b)^n$$ where $a,b,n$ are non negative integers. Claim: The $\color{Red}{\textit{exponent}}$ with the $\color{blue}{\textit {maximum coefficient value}}$ in the expansion is $\color{red}{\lfloor\frac{n(a+b)}2\rfloor}$ Example : $(x^1+x^3)^4 = \sum\limits_{k=0}^4\binom{4}{k}x^{n-k}x^{3k} = x^{4} +4x^{6}+\color{blue}{6}x^{\color{red}{8}}+4x^{10}+x^{12}$ $\color{red}{\dfrac{4(1+3)}{2} = 8}$ . I feel this is a special case of central limit theorem in probability, but that theorem seems way more complicated to understand than my special case. So I'm trying to make sense of this result w/o using CLT. Any help ?","Consider all the coefficients in the expansion of where are non negative integers. Claim: The with the in the expansion is Example : . I feel this is a special case of central limit theorem in probability, but that theorem seems way more complicated to understand than my special case. So I'm trying to make sense of this result w/o using CLT. Any help ?","(x^a+x^b)^n a,b,n \color{Red}{\textit{exponent}} \color{blue}{\textit {maximum coefficient value}} \color{red}{\lfloor\frac{n(a+b)}2\rfloor} (x^1+x^3)^4 = \sum\limits_{k=0}^4\binom{4}{k}x^{n-k}x^{3k} = x^{4} +4x^{6}+\color{blue}{6}x^{\color{red}{8}}+4x^{10}+x^{12} \color{red}{\dfrac{4(1+3)}{2} = 8}",['combinatorics']
15,Binomial theorem relating proof,Binomial theorem relating proof,,There is this identity $$1 -\frac{1}{2}\binom{n}{1}+\frac{1}{3} \binom{n}{2}- \frac{1}{4}\binom{n}{3}+....+(-1)^n \frac{1}{n+1}\binom{n}{n}$$ And we are supposed to prove it using these two identities $$k\binom{n}{k} = n\binom{n-1}{k-1}$$ and $$\binom{n}{0} + \binom{n}{1} + \binom{n}{2} +....+ \binom{n}{n} = 2^n$$ I have been working on this problem for a long time.  Can you guys help me?,There is this identity $$1 -\frac{1}{2}\binom{n}{1}+\frac{1}{3} \binom{n}{2}- \frac{1}{4}\binom{n}{3}+....+(-1)^n \frac{1}{n+1}\binom{n}{n}$$ And we are supposed to prove it using these two identities $$k\binom{n}{k} = n\binom{n-1}{k-1}$$ and $$\binom{n}{0} + \binom{n}{1} + \binom{n}{2} +....+ \binom{n}{n} = 2^n$$ I have been working on this problem for a long time.  Can you guys help me?,,"['combinatorics', 'discrete-mathematics']"
16,Calculate $\lim\limits_{n\to\infty}\dfrac{\sum\limits_{k=0}^n\log\binom{n}{k}}{n^2}$,Calculate,\lim\limits_{n\to\infty}\dfrac{\sum\limits_{k=0}^n\log\binom{n}{k}}{n^2},"How to prove if the following limit exists? If it exists, what's the value? $$\lim\limits_{n\to\infty}\dfrac{\sum\limits_{k=0}^n\log\binom{n}{k}}{n^2}$$ Thanks!","How to prove if the following limit exists? If it exists, what's the value? $$\lim\limits_{n\to\infty}\dfrac{\sum\limits_{k=0}^n\log\binom{n}{k}}{n^2}$$ Thanks!",,['combinatorics']
17,How many ways are there to arrange $12$ (distinct) people in a row so that Dr. Tucker is $3$ positions away from Dr. Stanley?,How many ways are there to arrange  (distinct) people in a row so that Dr. Tucker is  positions away from Dr. Stanley?,12 3,"How many ways are there to arrange $12$ (distinct) people in a row so that Dr. Tucker is $3$ positions away from Dr. Stanley (i.e., $2$ people are in between Dr. Tucker and Dr. Stanley), e.g., _ _ _ _ T _ _ S _ _ _ _ ? There are $10$ other people besides Dr. Tucker and Dr. Stanley. Their spots would be determined by $10!$. I am not sure how to incorporate the two spaces in between Dr. Tucker and Dr. Stanley.","How many ways are there to arrange $12$ (distinct) people in a row so that Dr. Tucker is $3$ positions away from Dr. Stanley (i.e., $2$ people are in between Dr. Tucker and Dr. Stanley), e.g., _ _ _ _ T _ _ S _ _ _ _ ? There are $10$ other people besides Dr. Tucker and Dr. Stanley. Their spots would be determined by $10!$. I am not sure how to incorporate the two spaces in between Dr. Tucker and Dr. Stanley.",,['combinatorics']
18,Is the limit $ \lim_{n\to \infty}\left(\sum^{n}_{r=0} \binom{n}{r}\big/{n^{r}(r+3)}\right)$ rational or irrational? [duplicate],Is the limit  rational or irrational? [duplicate], \lim_{n\to \infty}\left(\sum^{n}_{r=0} \binom{n}{r}\big/{n^{r}(r+3)}\right),"This question already has answers here : Evalute $ \lim_{n\rightarrow \infty}\sum^{n}_{k=0}\frac{\binom{n}{k}}{n^k(k+3)} $ (5 answers) Closed 4 years ago . How can I prove that the result of the following limit is rational/irrational?$$ \lim_{n\to \infty}\left(\sum^{n}_{r=0} \frac{\binom{n}{r}}{n^{r}(r+3)}\right)$$ Would solving this limit satisfy? How would I solve this? So, if the result came out to be say $\pi$, can we conclude that it is irrational? Meaning, is it a complete proof?","This question already has answers here : Evalute $ \lim_{n\rightarrow \infty}\sum^{n}_{k=0}\frac{\binom{n}{k}}{n^k(k+3)} $ (5 answers) Closed 4 years ago . How can I prove that the result of the following limit is rational/irrational?$$ \lim_{n\to \infty}\left(\sum^{n}_{r=0} \frac{\binom{n}{r}}{n^{r}(r+3)}\right)$$ Would solving this limit satisfy? How would I solve this? So, if the result came out to be say $\pi$, can we conclude that it is irrational? Meaning, is it a complete proof?",,"['calculus', 'combinatorics', 'number-theory', 'summation', 'rationality-testing']"
