,title_raw,title_text,title_latex,body_raw,body_text,body_latex,tags
60,"Characterization for compact sets in $\mathbb{R} $ with the topology generated by rays of the form $\left(-\infty,a\right) $",Characterization for compact sets in  with the topology generated by rays of the form,"\mathbb{R}  \left(-\infty,a\right) ","I'm trying to find a sufficient and necessary condition for a subset to be compact in  $\mathbb{R} $  when the topology is generated by the basis $\left\{ \left(-\infty,a\right)\,|\, a\in\mathbb{R}\right\} $. I thought it might be something similar to the standard characterization for compact sets in $\mathbb{R}$ with the standard topology like perhaps ""closed and upper bounded"" but that hasn't really led anywhere. Help would be appreciated.","I'm trying to find a sufficient and necessary condition for a subset to be compact in  $\mathbb{R} $  when the topology is generated by the basis $\left\{ \left(-\infty,a\right)\,|\, a\in\mathbb{R}\right\} $. I thought it might be something similar to the standard characterization for compact sets in $\mathbb{R}$ with the standard topology like perhaps ""closed and upper bounded"" but that hasn't really led anywhere. Help would be appreciated.",,"['general-topology', 'compactness']"
61,Convex analysis: relative interior in finite and infinite dimension,Convex analysis: relative interior in finite and infinite dimension,,"Let $X$ be a normed space. Given a nonempty convex set $C \subset X$, the relative interior of $C$, denoted by $\text{ri} C$, is the set of the interior points of $C$, considered as a subset of $\text{aff} C$ (this is the smallest affine set which contains $C$). In other words,  $$ \text{ri} C = \left\{x \in X: \,  \exists \varepsilon > 0 \text{ s.t. } B(x; \varepsilon ) \cap \text{aff} C \subseteq C\right\}. $$ Question n.1. How can I show that $\text{ri} C \ne \emptyset$? I have no idea on how to start, sincerely. The book gives some hint: for example, up to translations (which are allowed, since $\text{ri}(x+C)=x+\text{ri}C$ as one can easily verify), we can suppose $0 \in \text{aff} C$, i.e. the affine of $C$ is a subspace. Now we can consider a basis of this subspace, $(e_1, \ldots ,e_k)$: now how can I conclude? Question n.2. Secondly, my book says that the concept of relative interior is important in finite dimension, since in infinite dimensions it can happen that a convex nonempty set has empty relative interior. Could you please provide an example of this? My book suggest considering a dense hyperplane with no interior points, but this is clearly a mistake (at least, it is a misleading counterexample, I cannot understand it). Thanks.","Let $X$ be a normed space. Given a nonempty convex set $C \subset X$, the relative interior of $C$, denoted by $\text{ri} C$, is the set of the interior points of $C$, considered as a subset of $\text{aff} C$ (this is the smallest affine set which contains $C$). In other words,  $$ \text{ri} C = \left\{x \in X: \,  \exists \varepsilon > 0 \text{ s.t. } B(x; \varepsilon ) \cap \text{aff} C \subseteq C\right\}. $$ Question n.1. How can I show that $\text{ri} C \ne \emptyset$? I have no idea on how to start, sincerely. The book gives some hint: for example, up to translations (which are allowed, since $\text{ri}(x+C)=x+\text{ri}C$ as one can easily verify), we can suppose $0 \in \text{aff} C$, i.e. the affine of $C$ is a subspace. Now we can consider a basis of this subspace, $(e_1, \ldots ,e_k)$: now how can I conclude? Question n.2. Secondly, my book says that the concept of relative interior is important in finite dimension, since in infinite dimensions it can happen that a convex nonempty set has empty relative interior. Could you please provide an example of this? My book suggest considering a dense hyperplane with no interior points, but this is clearly a mistake (at least, it is a misleading counterexample, I cannot understand it). Thanks.",,"['general-topology', 'convex-analysis']"
62,Question regarding connected subspaces,Question regarding connected subspaces,,"Let $X$ be a topological space and let $A,B\subseteq X$ be closed in $X$ such that $A\cap B$ and $A\cup B$ are connected (in subspace topology) show that $A,B$ are connected (in subspace topology). I would appreciate a hint towards the solution :)","Let $X$ be a topological space and let $A,B\subseteq X$ be closed in $X$ such that $A\cap B$ and $A\cup B$ are connected (in subspace topology) show that $A,B$ are connected (in subspace topology). I would appreciate a hint towards the solution :)",,['general-topology']
63,A question on open mappings,A question on open mappings,,Let $X$ be a metric space. $f: X \to Y=f(X)$ is open and continuous mapping. Must $Y$ be a metric space? Thanks for your help.,Let $X$ be a metric space. $f: X \to Y=f(X)$ is open and continuous mapping. Must $Y$ be a metric space? Thanks for your help.,,"['general-topology', 'metric-spaces']"
64,"$\kappa\psi (x,X)\leq \psi (x,X)$",,"\kappa\psi (x,X)\leq \psi (x,X)","The $\kappa$-pseudocharacter $\kappa\psi (x,X)$ of a space $X$ at a point $x\in X$ is the smallest infinite cardinal number $\tau$ such that there exists a family $\gamma$  of $\kappa$-sets in $X$ such that $\{x\} = \bigcap\gamma$. For every topological group we have following inequality: $$\kappa\psi (x,X)\leq \psi (x,X)$$ But how about topological spaces, Is it true for every topological spaces? Closure of any open set is called $\kappa$-set.","The $\kappa$-pseudocharacter $\kappa\psi (x,X)$ of a space $X$ at a point $x\in X$ is the smallest infinite cardinal number $\tau$ such that there exists a family $\gamma$  of $\kappa$-sets in $X$ such that $\{x\} = \bigcap\gamma$. For every topological group we have following inequality: $$\kappa\psi (x,X)\leq \psi (x,X)$$ But how about topological spaces, Is it true for every topological spaces? Closure of any open set is called $\kappa$-set.",,"['general-topology', 'inequality', 'cardinals']"
65,Is the image of a path or arc locally path/arc connected?,Is the image of a path or arc locally path/arc connected?,,"My intuition is that the image $P$ of a path is locally path-connected because if neighborhood of some $p \in P$ that is open in $P$ is disconnected, then $P$ must oscillate quite wildly and become like the topologist's sine curve. On the other hand, would it be correct to say that the image of an arc must be locally arc connected because it is the homeomorphic image of an interval, which is itself locally arc connected?","My intuition is that the image $P$ of a path is locally path-connected because if neighborhood of some $p \in P$ that is open in $P$ is disconnected, then $P$ must oscillate quite wildly and become like the topologist's sine curve. On the other hand, would it be correct to say that the image of an arc must be locally arc connected because it is the homeomorphic image of an interval, which is itself locally arc connected?",,"['general-topology', 'examples-counterexamples', 'connectedness']"
66,Is a minimal Hausdorff uniformity compact?,Is a minimal Hausdorff uniformity compact?,,"Let $(X,\mathcal D)$ be a Hausdorff uniform space and for each Hausdorff uniformity $\mathcal U$ on $X$, $$\mathcal U \subseteq\mathcal D\to \mathcal U =\mathcal D$$ Is $(X,\mathcal D)$ compact?","Let $(X,\mathcal D)$ be a Hausdorff uniform space and for each Hausdorff uniformity $\mathcal U$ on $X$, $$\mathcal U \subseteq\mathcal D\to \mathcal U =\mathcal D$$ Is $(X,\mathcal D)$ compact?",,['general-topology']
67,Can convergence be seen as a form of continuity?,Can convergence be seen as a form of continuity?,,"I will abbreviate ""it holds that"" to ""iht"" and ""such that"" to ""sth."" The following questions are motivated by curiosity. Question 1. Does there exist a topology on $\mathbb{N}$ such that for all topological spaces $Y$ and all sequences $a : \mathbb{N} \rightarrow Y$ iht $a$ is continuous iff $a$ is convergent? Now suppose we adjoin a maximum element, thereby obtaining $\mathbb{N}' = \mathbb{N} \cup \{\infty\}$. Question 2. Does there exist a topology on $\mathbb{N}'$ sth for all Hausdorff topological spaces $Y$ and all sequences $b : \mathbb{N}' \rightarrow Y$ iht $b$ is continuous iff the restriction $a : \mathbb{N} \rightarrow Y$ is convergent and has limit equal to $b_\infty$? Question 3. Suppose the answers are both ""yes."" Viewing $\mathbb{N}$ as a subset of $\mathbb{N}',$ is the topology induced on $\mathbb{N}$ the same as the topology in Question 1?","I will abbreviate ""it holds that"" to ""iht"" and ""such that"" to ""sth."" The following questions are motivated by curiosity. Question 1. Does there exist a topology on $\mathbb{N}$ such that for all topological spaces $Y$ and all sequences $a : \mathbb{N} \rightarrow Y$ iht $a$ is continuous iff $a$ is convergent? Now suppose we adjoin a maximum element, thereby obtaining $\mathbb{N}' = \mathbb{N} \cup \{\infty\}$. Question 2. Does there exist a topology on $\mathbb{N}'$ sth for all Hausdorff topological spaces $Y$ and all sequences $b : \mathbb{N}' \rightarrow Y$ iht $b$ is continuous iff the restriction $a : \mathbb{N} \rightarrow Y$ is convergent and has limit equal to $b_\infty$? Question 3. Suppose the answers are both ""yes."" Viewing $\mathbb{N}$ as a subset of $\mathbb{N}',$ is the topology induced on $\mathbb{N}$ the same as the topology in Question 1?",,['general-topology']
68,Cardinality of cofinite topology,Cardinality of cofinite topology,,"Does it make sense to ask about cardinality of closed finite topology defined on the set of Natural Numbers? Is it countable or uncountable? Is it possible to prove that it is countable? Further, if it countable, is every closed finite topology (cofinite topology) defined on countable set again countable?","Does it make sense to ask about cardinality of closed finite topology defined on the set of Natural Numbers? Is it countable or uncountable? Is it possible to prove that it is countable? Further, if it countable, is every closed finite topology (cofinite topology) defined on countable set again countable?",,['general-topology']
69,Artinian topological space are compact,Artinian topological space are compact,,Call a topological space $X$ Artinian if every nested sequence of closed sets $$C_1 \supset C_2 \supset C_3 \supset \cdots$$ is eventually constant. Prove that if $X$ is Artinian then it is also compact. I don't have a concrete strategy for attacking this. I am assuming (maybe wrongly so) that appealing to the finite intersection property might be of some help. Is this the case? Should I employ a different strategy? Thank you very much in advance!,Call a topological space $X$ Artinian if every nested sequence of closed sets $$C_1 \supset C_2 \supset C_3 \supset \cdots$$ is eventually constant. Prove that if $X$ is Artinian then it is also compact. I don't have a concrete strategy for attacking this. I am assuming (maybe wrongly so) that appealing to the finite intersection property might be of some help. Is this the case? Should I employ a different strategy? Thank you very much in advance!,,['general-topology']
70,"How does one show that $K_1 \cap K_2 $ is compact, when $K_1 , K_2$ are compact?","How does one show that  is compact, when  are compact?","K_1 \cap K_2  K_1 , K_2","Let $(X,d_X) $ be a metric space and $K_1 , K_2 $ be compact subspaces of $X$. Question: how does one show that $K = K_1 \cap K_2$ is compact? I tried proving this by noting the following theorem: Let $Y \subseteq X$. If $X$ is compact and $Y$ is closed in $X$, then $Y$ is compact. We know, that compact spaces are closed. So in particular, we know that $K_1$ and $K_2$ are closed. We also know, that intersections of closed subspaces are closed, so $K$ is closed in $\Omega$. We also know, that $K \subseteq K_1$. We can apply this theorem, if we can show that $K$ is closed in $K_1$. Question: how do we do this? Can we do this at all, given the information above? Furthermore, I was wondering whether I'm on the right track, or if there's some other, perhaps ""easier"" way to show that $K$ is compact?","Let $(X,d_X) $ be a metric space and $K_1 , K_2 $ be compact subspaces of $X$. Question: how does one show that $K = K_1 \cap K_2$ is compact? I tried proving this by noting the following theorem: Let $Y \subseteq X$. If $X$ is compact and $Y$ is closed in $X$, then $Y$ is compact. We know, that compact spaces are closed. So in particular, we know that $K_1$ and $K_2$ are closed. We also know, that intersections of closed subspaces are closed, so $K$ is closed in $\Omega$. We also know, that $K \subseteq K_1$. We can apply this theorem, if we can show that $K$ is closed in $K_1$. Question: how do we do this? Can we do this at all, given the information above? Furthermore, I was wondering whether I'm on the right track, or if there's some other, perhaps ""easier"" way to show that $K$ is compact?",,"['general-topology', 'metric-spaces']"
71,example of a totally bounded but not bounded,example of a totally bounded but not bounded,,I have got an question:- is there any counter-example of totally bounded but not bounded space can anyone help me please.thanks for your help,I have got an question:- is there any counter-example of totally bounded but not bounded space can anyone help me please.thanks for your help,,['general-topology']
72,"$f: \mathbb{Q} \rightarrow \mathbb{R} \ \ \lim _{q \rightarrow t, \ q\in \mathbb{Q}} f(q) =g$",,"f: \mathbb{Q} \rightarrow \mathbb{R} \ \ \lim _{q \rightarrow t, \ q\in \mathbb{Q}} f(q) =g","There's a continuous function $f: \mathbb{Q} \rightarrow \mathbb{R}$ Prove that  $ \exists t \in \mathbb{R} \setminus \mathbb{Q} \ \ \exists g \in \mathbb{R} :\ \ \lim _{q \rightarrow t, \ q\in \mathbb{Q}}f(q)=g$. Prove that there are $2^{\aleph _0}$ such numbers $t$. I know that if a function is continuous on rational points, then it's continuous on whole $ \mathbb{R}$, but that isn't relevant to the problem, is it? I would appreciate all your help. Thanks.","There's a continuous function $f: \mathbb{Q} \rightarrow \mathbb{R}$ Prove that  $ \exists t \in \mathbb{R} \setminus \mathbb{Q} \ \ \exists g \in \mathbb{R} :\ \ \lim _{q \rightarrow t, \ q\in \mathbb{Q}}f(q)=g$. Prove that there are $2^{\aleph _0}$ such numbers $t$. I know that if a function is continuous on rational points, then it's continuous on whole $ \mathbb{R}$, but that isn't relevant to the problem, is it? I would appreciate all your help. Thanks.",,"['general-topology', 'continuity']"
73,A question on $\omega_1$,A question on,\omega_1,"For the liner order space $\omega_1$, does it have countable chain condition? (I kown it is not separable, because for any countable subset $A$ of $\omega_1$, there exists an ordinal $\kappa$ such that it is bigger for any element of $A$, so the open set $(\kappa, \omega_1)$ satisfying that $(\kappa, \omega_1)\cap A=\emptyset$.) Thanks for help!","For the liner order space $\omega_1$, does it have countable chain condition? (I kown it is not separable, because for any countable subset $A$ of $\omega_1$, there exists an ordinal $\kappa$ such that it is bigger for any element of $A$, so the open set $(\kappa, \omega_1)$ satisfying that $(\kappa, \omega_1)\cap A=\emptyset$.) Thanks for help!",,"['general-topology', 'set-theory', 'ordinals']"
74,Every first countable space is a moscow space.,Every first countable space is a moscow space.,,First countable space $X$ is an example of moscow spaces . Let $U$ is an open subset of $X$ and $x\in \overline{U}$. If $\overline{U}$ is open or even a nbhood of $x$ this proposition is immediately proved by definition of first countability of space $X$. But now how can I prove this? Thanks.,First countable space $X$ is an example of moscow spaces . Let $U$ is an open subset of $X$ and $x\in \overline{U}$. If $\overline{U}$ is open or even a nbhood of $x$ this proposition is immediately proved by definition of first countability of space $X$. But now how can I prove this? Thanks.,,"['general-topology', 'proof-writing']"
75,Are these subsets of $\mathbb{R}$ homeomorphic?,Are these subsets of  homeomorphic?,\mathbb{R},"Consider the following subspaces of $\mathbb{R}$ with the usual topology: $$X = (0, 1) \cup \{2\} \cup (3, 4) \cup \{5\} \cup \cdots \cup (3n, 3n + 1) \cup \{3n + 2\} \cup\cdots$$ $$Y = (0, 1] \cup (3, 4) \cup \{5\} \cup\cdots\cup (3n, 3n + 1) \cup \{3n + 2\} \cup\cdots$$ Is $X$ homeomorphic to $Y$ ? For $X$ to be homeomorphic to $Y$, we need to specify a bijective function from $X$ to $Y$ and inverse function from $Y$ to $X$ are continuous. From $(3,4)$ onwards, we can map by identity function. How can I map $(0,1) \cup \{2\}$ to $Y$? $(0,1]$, in usual topology is not open and closed. Can I write $(0,1]$ as $(0,1)\cup\{1\}$, and then map $\{0,1\}$ by identity map and $\{1\}$ to $\{2\}$. Please forgive me if any of what I think is stupid.","Consider the following subspaces of $\mathbb{R}$ with the usual topology: $$X = (0, 1) \cup \{2\} \cup (3, 4) \cup \{5\} \cup \cdots \cup (3n, 3n + 1) \cup \{3n + 2\} \cup\cdots$$ $$Y = (0, 1] \cup (3, 4) \cup \{5\} \cup\cdots\cup (3n, 3n + 1) \cup \{3n + 2\} \cup\cdots$$ Is $X$ homeomorphic to $Y$ ? For $X$ to be homeomorphic to $Y$, we need to specify a bijective function from $X$ to $Y$ and inverse function from $Y$ to $X$ are continuous. From $(3,4)$ onwards, we can map by identity function. How can I map $(0,1) \cup \{2\}$ to $Y$? $(0,1]$, in usual topology is not open and closed. Can I write $(0,1]$ as $(0,1)\cup\{1\}$, and then map $\{0,1\}$ by identity map and $\{1\}$ to $\{2\}$. Please forgive me if any of what I think is stupid.",,"['general-topology', 'metric-spaces']"
76,Question on closure in the product and box topologies,Question on closure in the product and box topologies,,"Hi everyone this is my first post so apologies in advance if I do anything wrong... I'm working through an unmarked assignment sheet and am struggling on this question: Let $X = \prod^{\infty}_{i=1} X_i$ where $X_i = \mathbb{R}$ for all $i$. Let $A=\{x=(x_i) \in X$: there exists $N \geq 1$ such that $x_i =0$ for all $i\geq N \}$. Compute the closure of A in the product topology and the box topology. (Hint: A is closed in one of the topologies. In the other topology, every nonempty basis element intersects A.) My thinking is that the closure of A in the product topology is $X$ and in the box topology it is A. However I am uncertain on the validity of how I got to this, if it is even right. For the product topology I have a basis, (with $(a,b)_i $ the open interval in $X_i$) $ B=\{\prod^\infty_{i=1}(a,b)_i : (a,b)_i = (-\infty , \infty) \text{ for all but finitely many } i \} $. I think this satisfies the hint that one of the topologies has the property that every nonempty basis element intersects A but then with $(a,b)_i \neq (-\infty , \infty)_i \forall i$ the product does not necessarily intersect with A? For the box topology I'm not sure what the best approach is, I just cheated and assumed the other topology was closed and thus =A. I would really appreciate some help understanding this. Thanks.","Hi everyone this is my first post so apologies in advance if I do anything wrong... I'm working through an unmarked assignment sheet and am struggling on this question: Let $X = \prod^{\infty}_{i=1} X_i$ where $X_i = \mathbb{R}$ for all $i$. Let $A=\{x=(x_i) \in X$: there exists $N \geq 1$ such that $x_i =0$ for all $i\geq N \}$. Compute the closure of A in the product topology and the box topology. (Hint: A is closed in one of the topologies. In the other topology, every nonempty basis element intersects A.) My thinking is that the closure of A in the product topology is $X$ and in the box topology it is A. However I am uncertain on the validity of how I got to this, if it is even right. For the product topology I have a basis, (with $(a,b)_i $ the open interval in $X_i$) $ B=\{\prod^\infty_{i=1}(a,b)_i : (a,b)_i = (-\infty , \infty) \text{ for all but finitely many } i \} $. I think this satisfies the hint that one of the topologies has the property that every nonempty basis element intersects A but then with $(a,b)_i \neq (-\infty , \infty)_i \forall i$ the product does not necessarily intersect with A? For the box topology I'm not sure what the best approach is, I just cheated and assumed the other topology was closed and thus =A. I would really appreciate some help understanding this. Thanks.",,['general-topology']
77,The Line with Uncountably Many Origins: Second Countable?,The Line with Uncountably Many Origins: Second Countable?,,"Motivation: The line with two origins can be constructed via taking two copies of ${\mathbb R}$ and identifying $x$ on the first copy with $x$ on the second copy for each $x\neq 0$.  We note that because this space is separable and first countable, it is also second countable.  What if, instead of two origins, we have uncountably many?  I read a claim that this space was not second countable, but I can't see why. Problem: Define the line with uncountably many origins in the following way: take a disjoint union of uncountably many copies of ${\mathbb R}$; we may index them as ${\mathbb R}\times \{\alpha\}$ for $\alpha\in A$, an uncountable indexing set.  We then define the equivalence class $\sim$ by $(x,\alpha)\sim (x,\beta)$ for $\alpha,\beta\in A$ and for all $x\neq 0$.  Is the resulting quotient space second countable? What I've Done: I know that the somewhat related problem of showing the disjoint union of an uncountable number of ${\mathbb R}$'s are not second countable relies on the fact that (after making it a metric space) one cannot find a countable dense subset --- but in this problem, I think, each open set covering $0\times \{\alpha\}$ will cover all of the other $0\times \{\beta\}$'s as well.  In particular, I don't see why just taking all rational-centered balls with rational radii.","Motivation: The line with two origins can be constructed via taking two copies of ${\mathbb R}$ and identifying $x$ on the first copy with $x$ on the second copy for each $x\neq 0$.  We note that because this space is separable and first countable, it is also second countable.  What if, instead of two origins, we have uncountably many?  I read a claim that this space was not second countable, but I can't see why. Problem: Define the line with uncountably many origins in the following way: take a disjoint union of uncountably many copies of ${\mathbb R}$; we may index them as ${\mathbb R}\times \{\alpha\}$ for $\alpha\in A$, an uncountable indexing set.  We then define the equivalence class $\sim$ by $(x,\alpha)\sim (x,\beta)$ for $\alpha,\beta\in A$ and for all $x\neq 0$.  Is the resulting quotient space second countable? What I've Done: I know that the somewhat related problem of showing the disjoint union of an uncountable number of ${\mathbb R}$'s are not second countable relies on the fact that (after making it a metric space) one cannot find a countable dense subset --- but in this problem, I think, each open set covering $0\times \{\alpha\}$ will cover all of the other $0\times \{\beta\}$'s as well.  In particular, I don't see why just taking all rational-centered balls with rational radii.",,[]
78,Can a closed subset of an affine scheme have empty interior?,Can a closed subset of an affine scheme have empty interior?,,I have an inclusion of closed subsets $V(J) \subset V(I)$ in an affine scheme $Spec(R)$ with the property that $V(I) = V(J) \cup \partial V(I)$. I would like to conclude that $V(J)=V(I)$.  (Here $\partial$ denotes the boundary of a set.) Note that the interior of $V(I)$ is contained in $V(J)$ and hence the closure of the interior of $V(I)$ is contained in $V(J)$. But recall from basic topology that the closure of the interior of a closed set need not be the closed set. (The closed set could have empty interior for example.) The most important special case for me is when $V(J) = \emptyset$. In this case I have a closed subset $V(I)$ of an affine scheme with the property that $V(I) = \partial V(I)$ and I would like to claim that $V(I) = \emptyset$. Is there any hope for me? I'm willing to assume that the ring $R$ is Noetherian if that will help. Does an affine scheme always have non-empty interior? Is $V(I) = \partial V(I)$ only possible if $V(I)$ is empty? I may be grasping at phantoms but if there is something about the topology of affine schemes that could make this work I would be elated. Thanks for your attention.,I have an inclusion of closed subsets $V(J) \subset V(I)$ in an affine scheme $Spec(R)$ with the property that $V(I) = V(J) \cup \partial V(I)$. I would like to conclude that $V(J)=V(I)$.  (Here $\partial$ denotes the boundary of a set.) Note that the interior of $V(I)$ is contained in $V(J)$ and hence the closure of the interior of $V(I)$ is contained in $V(J)$. But recall from basic topology that the closure of the interior of a closed set need not be the closed set. (The closed set could have empty interior for example.) The most important special case for me is when $V(J) = \emptyset$. In this case I have a closed subset $V(I)$ of an affine scheme with the property that $V(I) = \partial V(I)$ and I would like to claim that $V(I) = \emptyset$. Is there any hope for me? I'm willing to assume that the ring $R$ is Noetherian if that will help. Does an affine scheme always have non-empty interior? Is $V(I) = \partial V(I)$ only possible if $V(I)$ is empty? I may be grasping at phantoms but if there is something about the topology of affine schemes that could make this work I would be elated. Thanks for your attention.,,"['general-topology', 'algebraic-geometry']"
