,title_raw,title_text,title_latex,body_raw,body_text,body_latex,tags
44,Lie Group and Universal Covering Groups,Lie Group and Universal Covering Groups,,"Is every Lie group realized as the quotient of its universal covering group by a discrete group of isometries? Basically, a Lie group analog for the uniformization theorem. It seems reasonable but I'm rather ignorant to the theory of Lie groups and can't seem to find a reference. Edit: I should have mentioned when the Lie group has a universal cover (i.e. path connected, locally path-connected, and semi-locally path connected)","Is every Lie group realized as the quotient of its universal covering group by a discrete group of isometries? Basically, a Lie group analog for the uniformization theorem. It seems reasonable but I'm rather ignorant to the theory of Lie groups and can't seem to find a reference. Edit: I should have mentioned when the Lie group has a universal cover (i.e. path connected, locally path-connected, and semi-locally path connected)",,"['general-topology', 'lie-groups']"
45,Prove or disprove the continuity of the Identity function on the topological space?,Prove or disprove the continuity of the Identity function on the topological space?,,"Let $\tau_1$be the usual topology on $\mathbb R$ . Define another topology $\tau_2$ on $\mathbb R$ by $$\tau_2 = \{U \subseteq \mathbb R \ \ | \ \ U^c \ \ is \ \ either \ \ finite \ \ or \ \ empty \ \ or \ \mathbb R\ \ \}$$ If $I : (\mathbb R , \tau_1) \rightarrow (\mathbb R , \tau_2)$ is the identity map , then $I$ is continous but not $I^{-1}$ $I^{-1}$ is continous but not $I$. both $I$ and $I^{-1}$ are continous . neither $I$ nor $I^{-1}$ are continous . My attempt is : since $(0,\infty)$ is open in $\tau_1$ but not in $\tau_2$ . so $\tau_2$ is not finer than $\tau_1$ . so $I^{-1}$ is not continous because we have a result $I$ is continous iff $\tau_1$ is finer than $\tau_2$ , similarly this result hold for $I^{-1}$ I think $I$ is continous because take any closed set in $\tau_2$ which is a finite set is closed in $\tau_1$ because R is Hausdorff. Iwould be thankfull who someone give me your valuable time  to check my solution.","Let $\tau_1$be the usual topology on $\mathbb R$ . Define another topology $\tau_2$ on $\mathbb R$ by $$\tau_2 = \{U \subseteq \mathbb R \ \ | \ \ U^c \ \ is \ \ either \ \ finite \ \ or \ \ empty \ \ or \ \mathbb R\ \ \}$$ If $I : (\mathbb R , \tau_1) \rightarrow (\mathbb R , \tau_2)$ is the identity map , then $I$ is continous but not $I^{-1}$ $I^{-1}$ is continous but not $I$. both $I$ and $I^{-1}$ are continous . neither $I$ nor $I^{-1}$ are continous . My attempt is : since $(0,\infty)$ is open in $\tau_1$ but not in $\tau_2$ . so $\tau_2$ is not finer than $\tau_1$ . so $I^{-1}$ is not continous because we have a result $I$ is continous iff $\tau_1$ is finer than $\tau_2$ , similarly this result hold for $I^{-1}$ I think $I$ is continous because take any closed set in $\tau_2$ which is a finite set is closed in $\tau_1$ because R is Hausdorff. Iwould be thankfull who someone give me your valuable time  to check my solution.",,['general-topology']
46,Exercises on nets,Exercises on nets,,"well I'm learning nets  with Munkres, but I'd like to do more exercises than those in this book. Any web site or reference would be welcome. Thanks in advance","well I'm learning nets  with Munkres, but I'd like to do more exercises than those in this book. Any web site or reference would be welcome. Thanks in advance",,"['general-topology', 'nets']"
47,Baire Category Theorem proof in Gamelin Greene - how do they shrink the closure of open ball,Baire Category Theorem proof in Gamelin Greene - how do they shrink the closure of open ball,,"I am confused by a step in the Gamelin and Greene proof of the Baire Category Theorem. Here is the start of the proof. Theorem: Let $\{U_n\}_{n=1}^{\infty}$ be a sequence of dense open subsets of a complete metric space $X$.   Then $\cap_{n=1}^{\infty}U_n$ is also dense in $X$. Proof: Let $x \in X$ and let $\epsilon > 0$. It suffices to find $y \in B(x;\epsilon)$ that belongs to $\cap_{n=1}^{\infty} U_n$. Indeed, then every open ball in $X$ meets $\cap U_n$, so that $\cap U_n$ is dense in $X$. Since $U_1$ is dense in X, there exists $y_1 \in U_1$ such that $d(x,y_1) < \epsilon$. Since $U_1$ is open, there exists $r_1 > 0$ such that $B(y_1;r_1) \subset U_1$. ... so far so good, I get it this far. They continue... By shrinking $r_1$, we can arrange $r_1 < 1$, and $\overline{B(y_1;r_1)} \subset U_1 \cap B(x,\epsilon)$. This is where I am confused. I don't like this fuzzy use of ""shrink"" here but get what they mean I think.  I see that we could shrink $B(y_1;r_1)$ as they indicate but I don't see how  the closure $\overline{B(y_1;r_1)}$ can be shrunk. Could there be an unusual metric space where the open ball is dense in $X$ or something similar that we just cant think of offhand which would make this impossible? How can we be sure this is true in general in a rigorous way? Thanks for your help.","I am confused by a step in the Gamelin and Greene proof of the Baire Category Theorem. Here is the start of the proof. Theorem: Let $\{U_n\}_{n=1}^{\infty}$ be a sequence of dense open subsets of a complete metric space $X$.   Then $\cap_{n=1}^{\infty}U_n$ is also dense in $X$. Proof: Let $x \in X$ and let $\epsilon > 0$. It suffices to find $y \in B(x;\epsilon)$ that belongs to $\cap_{n=1}^{\infty} U_n$. Indeed, then every open ball in $X$ meets $\cap U_n$, so that $\cap U_n$ is dense in $X$. Since $U_1$ is dense in X, there exists $y_1 \in U_1$ such that $d(x,y_1) < \epsilon$. Since $U_1$ is open, there exists $r_1 > 0$ such that $B(y_1;r_1) \subset U_1$. ... so far so good, I get it this far. They continue... By shrinking $r_1$, we can arrange $r_1 < 1$, and $\overline{B(y_1;r_1)} \subset U_1 \cap B(x,\epsilon)$. This is where I am confused. I don't like this fuzzy use of ""shrink"" here but get what they mean I think.  I see that we could shrink $B(y_1;r_1)$ as they indicate but I don't see how  the closure $\overline{B(y_1;r_1)}$ can be shrunk. Could there be an unusual metric space where the open ball is dense in $X$ or something similar that we just cant think of offhand which would make this impossible? How can we be sure this is true in general in a rigorous way? Thanks for your help.",,"['general-topology', 'baire-category']"
48,"""Proof"" that $g(t) = (t,t,t,...)$ is not continuous with uniform topology","""Proof"" that  is not continuous with uniform topology","g(t) = (t,t,t,...)","Let $g : \mathbb R \to \mathbb R^{\omega}$ be the function $$  g(t) := (t, t, t, \ldots). $$ If $\mathbb R^{\omega}$ is equipped with the uniform topology, and $\mathbb R$ with the standard topology, then is $g$ continuous? According to this post it is. I have a different proof which yields another conclusion, but I cannot see whats wrong with the proof? Let $Y = \prod_{i=1}^{\infty} Y_i \subseteq R^{\omega}$, then $$  g^{-1}(Y) = \bigcap_{i=1}^{\infty} Y_i. $$ Proof: Let $x \in g^{-1}(Y)$, then $g(x) = (x,x,x,\ldots) \in Y$ and so $x \in Y_i$ for all $i$, thus $x \in \bigcap_{i=1}^{\infty} Y_i$. Conversely let $x \in \bigcap_{i=1}^{\infty} Y_i$, then $g(x) = (x,x,x,\ldots) \in \prod Y_i = Y$, and so $x \in g^{-1}(Y)$. $\square$ A basis set $B(x,r)$ in the uniform topoloy on $\mathbb R^{\omega}$ has the form $$  B(x,r) = \{ y = (y_i) : |x_i - y_i| < r \mbox{ for all }i \}         = \prod_{i=1}^{\infty} B(x_i, r) = \prod_{i=1}^{\infty} (x_i - r, x_i + r) $$ so in particular for $x = (1,1/2,1/3,\ldots)$ the set $$  B(x, 1) = \prod_{i=1}^{\infty} \left( \frac{1}{n} - 1, \frac{1}{n} + 1 \right) $$ is open in the uniform topology. But $$  g^{-1}(B(x,1)) = \bigcap_{i=1}^{\infty} \left( \frac{1}{n} - 1, \frac{1}{n} + 1 \right) = (0,1] $$ is not open, so $g$ is not continuous? What goes wrong here....","Let $g : \mathbb R \to \mathbb R^{\omega}$ be the function $$  g(t) := (t, t, t, \ldots). $$ If $\mathbb R^{\omega}$ is equipped with the uniform topology, and $\mathbb R$ with the standard topology, then is $g$ continuous? According to this post it is. I have a different proof which yields another conclusion, but I cannot see whats wrong with the proof? Let $Y = \prod_{i=1}^{\infty} Y_i \subseteq R^{\omega}$, then $$  g^{-1}(Y) = \bigcap_{i=1}^{\infty} Y_i. $$ Proof: Let $x \in g^{-1}(Y)$, then $g(x) = (x,x,x,\ldots) \in Y$ and so $x \in Y_i$ for all $i$, thus $x \in \bigcap_{i=1}^{\infty} Y_i$. Conversely let $x \in \bigcap_{i=1}^{\infty} Y_i$, then $g(x) = (x,x,x,\ldots) \in \prod Y_i = Y$, and so $x \in g^{-1}(Y)$. $\square$ A basis set $B(x,r)$ in the uniform topoloy on $\mathbb R^{\omega}$ has the form $$  B(x,r) = \{ y = (y_i) : |x_i - y_i| < r \mbox{ for all }i \}         = \prod_{i=1}^{\infty} B(x_i, r) = \prod_{i=1}^{\infty} (x_i - r, x_i + r) $$ so in particular for $x = (1,1/2,1/3,\ldots)$ the set $$  B(x, 1) = \prod_{i=1}^{\infty} \left( \frac{1}{n} - 1, \frac{1}{n} + 1 \right) $$ is open in the uniform topology. But $$  g^{-1}(B(x,1)) = \bigcap_{i=1}^{\infty} \left( \frac{1}{n} - 1, \frac{1}{n} + 1 \right) = (0,1] $$ is not open, so $g$ is not continuous? What goes wrong here....",,"['general-topology', 'analysis', 'metric-spaces']"
49,Can the ultrafilters in the poset of open subsets be made into a topological space?,Can the ultrafilters in the poset of open subsets be made into a topological space?,,"Let $X$ denote a topological space and $O$ denote its poset of open subsets. Intuitively, $O$'s ultrafilters are kind of like generalized points of $X$. Is there a way to make these ultrafilters into a topological space $Y$ in their own right? In a natural way, of course, so that the natural injection $f : X \rightarrow Y$ that maps a point of $X$ to its set of open neighbourhoods is continuous etc.","Let $X$ denote a topological space and $O$ denote its poset of open subsets. Intuitively, $O$'s ultrafilters are kind of like generalized points of $X$. Is there a way to make these ultrafilters into a topological space $Y$ in their own right? In a natural way, of course, so that the natural injection $f : X \rightarrow Y$ that maps a point of $X$ to its set of open neighbourhoods is continuous etc.",,"['general-topology', 'filters']"
50,Do pushouts of compactly generated Hausdorff spaces exist?,Do pushouts of compactly generated Hausdorff spaces exist?,,"Let $A\to X$ and $A\to Y$ be maps of compactly generated Hausdorff spaces. Does the pushout $X\coprod_A Y$ in the category of compactly generated Hausdorff spaces exist? If necessary, one can assume that both these maps are cofibrations.","Let $A\to X$ and $A\to Y$ be maps of compactly generated Hausdorff spaces. Does the pushout $X\coprod_A Y$ in the category of compactly generated Hausdorff spaces exist? If necessary, one can assume that both these maps are cofibrations.",,['general-topology']
51,Is image of boundary a boundary of image?,Is image of boundary a boundary of image?,,"I have a question which appers in problems concerning Mbius transformation, for example Let $A=\{ z\in \mathbb{C} : \|z\| <1, \Re(z)>0\}$ and $f(z)=\frac{z+i}{z-1}$ Determine $f(A)$. Often it is quite simple to find $f( \partial A)$ (image of boundary of $A$). If I knew that $f(\partial A)=\partial (f(A))$, I would only have to check whether $f(A)$ is inside  or outside the $\partial f(A)$. What is sufficient condition on $f$ for having $f(\partial A)=\partial (f(A))$ ?","I have a question which appers in problems concerning Mbius transformation, for example Let $A=\{ z\in \mathbb{C} : \|z\| <1, \Re(z)>0\}$ and $f(z)=\frac{z+i}{z-1}$ Determine $f(A)$. Often it is quite simple to find $f( \partial A)$ (image of boundary of $A$). If I knew that $f(\partial A)=\partial (f(A))$, I would only have to check whether $f(A)$ is inside  or outside the $\partial f(A)$. What is sufficient condition on $f$ for having $f(\partial A)=\partial (f(A))$ ?",,"['general-topology', 'complex-analysis']"
52,$T_2$ spaces and isolated points,spaces and isolated points,T_2,Is there a topological Hausdorff space with an infinite number of isolated points such that any infinite set of isolated points have an infinite number of limit points !? (Of course it would be impossible if a limit point is a limit of a sequence.),Is there a topological Hausdorff space with an infinite number of isolated points such that any infinite set of isolated points have an infinite number of limit points !? (Of course it would be impossible if a limit point is a limit of a sequence.),,['general-topology']
53,Any Subset of a Set Containing No Accumulation Point is Closed,Any Subset of a Set Containing No Accumulation Point is Closed,,"Let $(X,\tau)$ be a topological space. Suppose that $B\subseteq X$ has no accumulation point. That is, for any $x\in X$ there exists some $U\subseteq X$ such that $x$ is in the interior of $U$ and $B\cap U\cap\{x\}^c$ is empty. Claim: If $C\subseteq B$, then $C$ is closed. Proof : If $C\subseteq B$, then, since $B$ does not have an accumulation point, $C$ does not have any, either. But any set that contains the set of its own accumulation points (which is the empty set in the case of $C$) must be closed. $\blacksquare$ Corollary If $(Y,\nu)$ is any topological space, then any function $f:B\to Y$ is continuous (in the relative topology). Proof : If $V$ is any closed set in $Y$, then $f^{-1}(V)\subseteq B$. Therefore, $f^{-1}(V)$ is closed in the topology $\tau$ and thus must be closed in the relative topology (generated by $B$) as well. $\blacksquare$ This set of results (especially the corollary) is so surprising to me that I thought I would seek some feedback. Thank you very much for sharing your thoughts.","Let $(X,\tau)$ be a topological space. Suppose that $B\subseteq X$ has no accumulation point. That is, for any $x\in X$ there exists some $U\subseteq X$ such that $x$ is in the interior of $U$ and $B\cap U\cap\{x\}^c$ is empty. Claim: If $C\subseteq B$, then $C$ is closed. Proof : If $C\subseteq B$, then, since $B$ does not have an accumulation point, $C$ does not have any, either. But any set that contains the set of its own accumulation points (which is the empty set in the case of $C$) must be closed. $\blacksquare$ Corollary If $(Y,\nu)$ is any topological space, then any function $f:B\to Y$ is continuous (in the relative topology). Proof : If $V$ is any closed set in $Y$, then $f^{-1}(V)\subseteq B$. Therefore, $f^{-1}(V)$ is closed in the topology $\tau$ and thus must be closed in the relative topology (generated by $B$) as well. $\blacksquare$ This set of results (especially the corollary) is so surprising to me that I thought I would seek some feedback. Thank you very much for sharing your thoughts.",,['general-topology']
54,topologically equivalent spaces,topologically equivalent spaces,,"I was wondering if there exist a metric $d:X\times X\longrightarrow\mathbb{R}$ (with $X:=(-1,1)$) such that $(-1,1)$ is complete and that $(d,X)$, $(d_{usual},X)$ are topologically equivalent? I know for example that $(-1,1)\longrightarrow\mathbb{R}$ is a homeomorphism, because we can find a one-to-one function $f$ such that $f$ and $f^{-1}$ is continuous. So we can conclude that $(-1,1)$ and $\mathbb{R}$ are homeomorphic. But what about $(d,X)$ and $(d_{usual},X)$?","I was wondering if there exist a metric $d:X\times X\longrightarrow\mathbb{R}$ (with $X:=(-1,1)$) such that $(-1,1)$ is complete and that $(d,X)$, $(d_{usual},X)$ are topologically equivalent? I know for example that $(-1,1)\longrightarrow\mathbb{R}$ is a homeomorphism, because we can find a one-to-one function $f$ such that $f$ and $f^{-1}$ is continuous. So we can conclude that $(-1,1)$ and $\mathbb{R}$ are homeomorphic. But what about $(d,X)$ and $(d_{usual},X)$?",,"['general-topology', 'metric-spaces']"
55,Finding limit points of subsets of the cofinite topology on $\mathbb{Z}$,Finding limit points of subsets of the cofinite topology on,\mathbb{Z},"Is my reasoning correct? Problem: Let $(Z,\tau)$ be the cofinite topology on $Z$. Find the limit points of the sets: $A = \{1,2,\dots,10\}$ $E$, the even integers My solution: $A$ is closed (finite), so it contains its limit points. Let $x$ in $A$, then $\{x\} \cup (Z-A)$ is a neighborhood of $x$ containing no points of $A$ other than $x$, so $A$ has no limit points. Every open neighborhood of a point $x$ in $Z$ must contain infinitely many points of $E$ for the complement to be finite. So every point in $Z$ is a limit point of $E$ (i.e., $E$ is dense in $Z$).","Is my reasoning correct? Problem: Let $(Z,\tau)$ be the cofinite topology on $Z$. Find the limit points of the sets: $A = \{1,2,\dots,10\}$ $E$, the even integers My solution: $A$ is closed (finite), so it contains its limit points. Let $x$ in $A$, then $\{x\} \cup (Z-A)$ is a neighborhood of $x$ containing no points of $A$ other than $x$, so $A$ has no limit points. Every open neighborhood of a point $x$ in $Z$ must contain infinitely many points of $E$ for the complement to be finite. So every point in $Z$ is a limit point of $E$ (i.e., $E$ is dense in $Z$).",,['general-topology']
56,Is Bruhat cell dense in p-adic topology?,Is Bruhat cell dense in p-adic topology?,,"I've seen in literature a statement like 'there exists an open and dense Bruhat cell'. In $GL(2,F)$ for example, where $F$ is a p-adic field, let $\omega=\begin{pmatrix} & 1 \\ 1 & \end{pmatrix}$, then $A_2N_2\omega N_2$ is the big cell, here $A_2$ is the diagonal matrices, $N_2$ is the upper triangular unipotents. Question: Is $A_2N_2\omega N_2$ an open and dense subset of $GL(2)$ in p-adic topology, or in Zariski topology? I asked this because, if we want to find a sequence of elements in this cell approaching the identity, compute $$\begin{pmatrix} a & \\  & b\end{pmatrix}\begin{pmatrix} 1 & x \\  & 1 \end{pmatrix}\begin{pmatrix} & 1 \\ 1 & \end{pmatrix}\begin{pmatrix} 1 & y \\  & 1 \end{pmatrix}=\begin{pmatrix} ax & a+axy \\ b & by \end{pmatrix}$$ If this product goes to the identity matrix in the p-adic topology, we will get $b\to 0$, $ax\to 1$, $by\to 1$, and $a+axy\to 0$, from which we will have a contradiction. Does this mean the big cell is not dense in the p-adic topology? Or I'm misunderstanding things. Thank you very much for any comment.","I've seen in literature a statement like 'there exists an open and dense Bruhat cell'. In $GL(2,F)$ for example, where $F$ is a p-adic field, let $\omega=\begin{pmatrix} & 1 \\ 1 & \end{pmatrix}$, then $A_2N_2\omega N_2$ is the big cell, here $A_2$ is the diagonal matrices, $N_2$ is the upper triangular unipotents. Question: Is $A_2N_2\omega N_2$ an open and dense subset of $GL(2)$ in p-adic topology, or in Zariski topology? I asked this because, if we want to find a sequence of elements in this cell approaching the identity, compute $$\begin{pmatrix} a & \\  & b\end{pmatrix}\begin{pmatrix} 1 & x \\  & 1 \end{pmatrix}\begin{pmatrix} & 1 \\ 1 & \end{pmatrix}\begin{pmatrix} 1 & y \\  & 1 \end{pmatrix}=\begin{pmatrix} ax & a+axy \\ b & by \end{pmatrix}$$ If this product goes to the identity matrix in the p-adic topology, we will get $b\to 0$, $ax\to 1$, $by\to 1$, and $a+axy\to 0$, from which we will have a contradiction. Does this mean the big cell is not dense in the p-adic topology? Or I'm misunderstanding things. Thank you very much for any comment.",,"['general-topology', 'lie-groups', 'algebraic-groups']"
57,On a proposition of Engelking's General Topology,On a proposition of Engelking's General Topology,,"Let $\mathcal{F}$ and $\mathcal{F'}$ be filters on a set. We say that $\mathcal{F'}$ is finer than $\mathcal{F}$ if $\mathcal{F'} \supset \mathcal{F}$. A point $x$ of a topological space $X$ is called a cluster point of a filter $\mathcal{F}$ if $x$ belongs to the closure of every member of $\mathcal{F}$. Is the following assertion in Engelking's book General Topology (1989) p.52 true? (Part of)Proposition 1.6.8 If $x$ is a cluster point of a filter $\mathcal{F}$, then $x$ is a limit of a filter $\mathcal{F'}$ that is finer than $\mathcal{F}$.","Let $\mathcal{F}$ and $\mathcal{F'}$ be filters on a set. We say that $\mathcal{F'}$ is finer than $\mathcal{F}$ if $\mathcal{F'} \supset \mathcal{F}$. A point $x$ of a topological space $X$ is called a cluster point of a filter $\mathcal{F}$ if $x$ belongs to the closure of every member of $\mathcal{F}$. Is the following assertion in Engelking's book General Topology (1989) p.52 true? (Part of)Proposition 1.6.8 If $x$ is a cluster point of a filter $\mathcal{F}$, then $x$ is a limit of a filter $\mathcal{F'}$ that is finer than $\mathcal{F}$.",,"['general-topology', 'filters']"
58,Can a set of non self-intersection points of a space-filling curve contain an arc?,Can a set of non self-intersection points of a space-filling curve contain an arc?,,"Consider a continuous surjection $f:[0,1]\to[0,1]\times[0,1]$. It can be proved that set of self-intersection points must be dense. In the Hilbert curve, the set of self-intersections are points (a,b) such that either a or b can be written as $\frac{m}{2^k}$ for some integers $k1$ and $1m<2^k$ (see this explanation ). So the set of self-intersections is dense and of measure $0$, but you cannot draw any vertical or horizontal line without intersecting it. This leads me to the question: can there exist, for some space-filling curve, an arc (homeomorphic to a non-degenerate closed interval)  $\tau\subset [0,1]\times[0,1]$ such that $\forall_{t_1,t_2\in [0,1]} f(t_1) = f(t_2) \in \tau \implies t_1 = t_2$? That is, such that $\tau$ includes only non-self-intersection points?","Consider a continuous surjection $f:[0,1]\to[0,1]\times[0,1]$. It can be proved that set of self-intersection points must be dense. In the Hilbert curve, the set of self-intersections are points (a,b) such that either a or b can be written as $\frac{m}{2^k}$ for some integers $k1$ and $1m<2^k$ (see this explanation ). So the set of self-intersections is dense and of measure $0$, but you cannot draw any vertical or horizontal line without intersecting it. This leads me to the question: can there exist, for some space-filling curve, an arc (homeomorphic to a non-degenerate closed interval)  $\tau\subset [0,1]\times[0,1]$ such that $\forall_{t_1,t_2\in [0,1]} f(t_1) = f(t_2) \in \tau \implies t_1 = t_2$? That is, such that $\tau$ includes only non-self-intersection points?",,"['general-topology', 'plane-curves']"
59,Prove that the tangent space has the same dimension as the manifold,Prove that the tangent space has the same dimension as the manifold,,"I asked this question a couple of days ago. And I thought that I totally understood the question. However it turned out that I didn't, since the argument I constructed was proved to be wrong just now: Diffeomorphism preserves dimension The original text from Guillemin and Pollack's book was: ""The dimension of the vector space $T_x(X)$ is, as you expect, the dimension $k$ of $X$. To prove this, we use the smoothness of he inverse $\phi^{-1}$. Choose an open set $W$ in $\mathbf{R}^N$ and a smooth map $\Phi': \mathbf{R}^N \rightarrow \mathbf{R}^k$ that extends $\phi^{-1}$. Then $\Phi'\circ\phi$ is the identity map of U, so the chain rule implies that the sequence of linear transformations $\mathbf{R}^k\xrightarrow{d\phi_0}T_x(X)\xrightarrow{d\Phi_x'}\mathbf{R}^k$ is the identity map of $\mathbf{R}^k$. It follows that $d\phi_0 :\mathbf{R}^k \rightarrow T_x(X)$ is an isomorphism, so $\dim T_x(X)=k$."" Just for everyone's information, in GP's book, the convention is that $\phi$ is a diffeomorphism from $\mathbf{R}^k$ to a k-dimensional manifold $X\subset \mathbf{R}^N$ ($\phi :\mathbf{R}^k\rightarrow X$). My question is here: How does $d\phi_0 :\mathbf{R}^k \rightarrow T_x(X)$ is an isomorphism follow from previous argument? From the link given, it was shown that the existence of one-sided inverse does not guarantee that a linear map is an isomorphism. Thus I think there is a loophole in arguing ""it follows that $d\phi_0 :\mathbf{R}^k \rightarrow T_x(X)$ is an isomorphism""... Thanks a lot for your help!","I asked this question a couple of days ago. And I thought that I totally understood the question. However it turned out that I didn't, since the argument I constructed was proved to be wrong just now: Diffeomorphism preserves dimension The original text from Guillemin and Pollack's book was: ""The dimension of the vector space $T_x(X)$ is, as you expect, the dimension $k$ of $X$. To prove this, we use the smoothness of he inverse $\phi^{-1}$. Choose an open set $W$ in $\mathbf{R}^N$ and a smooth map $\Phi': \mathbf{R}^N \rightarrow \mathbf{R}^k$ that extends $\phi^{-1}$. Then $\Phi'\circ\phi$ is the identity map of U, so the chain rule implies that the sequence of linear transformations $\mathbf{R}^k\xrightarrow{d\phi_0}T_x(X)\xrightarrow{d\Phi_x'}\mathbf{R}^k$ is the identity map of $\mathbf{R}^k$. It follows that $d\phi_0 :\mathbf{R}^k \rightarrow T_x(X)$ is an isomorphism, so $\dim T_x(X)=k$."" Just for everyone's information, in GP's book, the convention is that $\phi$ is a diffeomorphism from $\mathbf{R}^k$ to a k-dimensional manifold $X\subset \mathbf{R}^N$ ($\phi :\mathbf{R}^k\rightarrow X$). My question is here: How does $d\phi_0 :\mathbf{R}^k \rightarrow T_x(X)$ is an isomorphism follow from previous argument? From the link given, it was shown that the existence of one-sided inverse does not guarantee that a linear map is an isomorphism. Thus I think there is a loophole in arguing ""it follows that $d\phi_0 :\mathbf{R}^k \rightarrow T_x(X)$ is an isomorphism""... Thanks a lot for your help!",,"['real-analysis', 'general-topology', 'differential-geometry', 'differential-topology']"
