,title_raw,title_text,title_latex,body_raw,body_text,body_latex,tags
49,Hausdorff space if and only if subspaces are closed,Hausdorff space if and only if subspaces are closed,,"Let $X$ be a space that is the union of the subspaces $S_1,\dots,S_n$, where each $S_i$ is homeomorphic to the unit circle, and suppose that there is some $p \in X$ such that $S_i \cap S_j = \{p\}$ whenever $i \neq j$. I am trying to show that $X$ is Hausdorff if and only if each $S_i$ is closed in $X$, and also to construct an example of such a space $X$ which is not Hausdorff. If we assume that $X$ is Hausdorff, then it's easy to show that each $S_i$ is closed in $X$, since the unit circle is compact and compact subspaces of Hausdorff spaces are closed. I'm having trouble with the converse, however. Let $x_1,x_2$ be distinct points of $X$, then $x_1 \in S_i, x_2 \in S_j$ for some $i,j$. Suppose that neither point is  $p$. Then $ X - (S_i - \{p\}) = S_1 \cup \dots \cup S_{i-1} \cup S_{i+1} \cup \dots S_n $ is closed, so $S_i - \{p\}$ is open. If $i \neq j$, then $S_i - \{p\}, S_j - \{p\}$ are disjoint neighbourhoods of $x_1,x_2$. Now if $i = j$, we have $x_1,x_2 \in S_i - \{p\}$, and I'm not seeing how we could find disjoint neighbourhoods of $x_1,x_2$, given that we don't know the topology of $S_i$. Do we have to assume that the unit circle, and hence each $S_i$, has the topology induced by the Euclidean metric? The last case is when one of the points, say $x_1$, is $p$. Then $x_1 \in S_1$, which is closed, and $x_2 \notin S_1$, so we can find a neighbourhood $U_2$ of $x_2$ which does not intersect $S_1$, and therefore does not contain $x_1$. How could we produce a neighbourhood $U_1$ of $x_1$ not intersecting $U_2$, though? Finally, any help on constructing a non-Hausdorff $X$ would be appreciated; I'm guessing what we proved means that we need the $S_i$'s to not all be closed in $X$, but I can't see how to use this fact to explicitly construct such an $X$.","Let $X$ be a space that is the union of the subspaces $S_1,\dots,S_n$, where each $S_i$ is homeomorphic to the unit circle, and suppose that there is some $p \in X$ such that $S_i \cap S_j = \{p\}$ whenever $i \neq j$. I am trying to show that $X$ is Hausdorff if and only if each $S_i$ is closed in $X$, and also to construct an example of such a space $X$ which is not Hausdorff. If we assume that $X$ is Hausdorff, then it's easy to show that each $S_i$ is closed in $X$, since the unit circle is compact and compact subspaces of Hausdorff spaces are closed. I'm having trouble with the converse, however. Let $x_1,x_2$ be distinct points of $X$, then $x_1 \in S_i, x_2 \in S_j$ for some $i,j$. Suppose that neither point is  $p$. Then $ X - (S_i - \{p\}) = S_1 \cup \dots \cup S_{i-1} \cup S_{i+1} \cup \dots S_n $ is closed, so $S_i - \{p\}$ is open. If $i \neq j$, then $S_i - \{p\}, S_j - \{p\}$ are disjoint neighbourhoods of $x_1,x_2$. Now if $i = j$, we have $x_1,x_2 \in S_i - \{p\}$, and I'm not seeing how we could find disjoint neighbourhoods of $x_1,x_2$, given that we don't know the topology of $S_i$. Do we have to assume that the unit circle, and hence each $S_i$, has the topology induced by the Euclidean metric? The last case is when one of the points, say $x_1$, is $p$. Then $x_1 \in S_1$, which is closed, and $x_2 \notin S_1$, so we can find a neighbourhood $U_2$ of $x_2$ which does not intersect $S_1$, and therefore does not contain $x_1$. How could we produce a neighbourhood $U_1$ of $x_1$ not intersecting $U_2$, though? Finally, any help on constructing a non-Hausdorff $X$ would be appreciated; I'm guessing what we proved means that we need the $S_i$'s to not all be closed in $X$, but I can't see how to use this fact to explicitly construct such an $X$.",,['general-topology']
50,Simple question about finite complement topology and closed sets,Simple question about finite complement topology and closed sets,,"Book says ""In the finite complement topology on a set X, the closed sets consist of X and all finite subsets of X."" What I don't understand is why are finite subsets of X closed? I thought that $T_f$ = $\{A \subset X : A = \varnothing $ or $X - A$ is finite $\} $. If U is a subset of X that is finite, and the claim is that U is a closed set, wouldn't we have to show that its complement is open? How do we know that this is true? What if X is infinite?","Book says ""In the finite complement topology on a set X, the closed sets consist of X and all finite subsets of X."" What I don't understand is why are finite subsets of X closed? I thought that $T_f$ = $\{A \subset X : A = \varnothing $ or $X - A$ is finite $\} $. If U is a subset of X that is finite, and the claim is that U is a closed set, wouldn't we have to show that its complement is open? How do we know that this is true? What if X is infinite?",,[]
51,Unions of disjoint open sets.,Unions of disjoint open sets.,,"Let $X$ be a compact metric space (hence separable) and $\mu$ a Borel probability measure. Given an open set $A$ and $r,\epsilon>0$ $\ $does there exist a finite set of disjoint open balls $\left\{  B_{i}\right\}  $ contained in $A$ and of radius smaller than $r$ , so that $\mu(\cup B_{i})\geq\mu(A)-\epsilon.$","Let $X$ be a compact metric space (hence separable) and $\mu$ a Borel probability measure. Given an open set $A$ and $r,\epsilon>0$ $\ $does there exist a finite set of disjoint open balls $\left\{  B_{i}\right\}  $ contained in $A$ and of radius smaller than $r$ , so that $\mu(\cup B_{i})\geq\mu(A)-\epsilon.$",,"['general-topology', 'analysis', 'measure-theory']"
52,how to prove closure of unions is equal union of closures in paracompactness,how to prove closure of unions is equal union of closures in paracompactness,,Can anyone show me how to prove that: In a paracompact space: given a family of sets $A_i$ where $i \in I$ (some set of indexes) then: $\overline{\cup{A_i}} = \cup \overline{A_i}$  Thanx!,Can anyone show me how to prove that: In a paracompact space: given a family of sets $A_i$ where $i \in I$ (some set of indexes) then: $\overline{\cup{A_i}} = \cup \overline{A_i}$  Thanx!,,['general-topology']
53,Irreducibility preserved under étale maps?,Irreducibility preserved under étale maps?,,"I remember hearing about this statement once, but cannot remember where or when. If it is true i could make good use of it. Let $\pi: X \rightarrow Y$ be an étale map of (irreducible) algebraic varieties and let $Z \subset Y$ be an irreducible subvariety. Does it follow that $\pi^{-1}(Z)$ is irreducible? If so, why? If not, do you know a counterexample? If necessary $X$ and $Y$ can be surfaces over $\mathbb{C}$, the map $\pi$ of degree two, and $Z$ a hyperplane section (i.e. it defines a very ample line bundle). Thanks! Edit: I assume the varieties $X$ and $Y$ to be projective.","I remember hearing about this statement once, but cannot remember where or when. If it is true i could make good use of it. Let $\pi: X \rightarrow Y$ be an étale map of (irreducible) algebraic varieties and let $Z \subset Y$ be an irreducible subvariety. Does it follow that $\pi^{-1}(Z)$ is irreducible? If so, why? If not, do you know a counterexample? If necessary $X$ and $Y$ can be surfaces over $\mathbb{C}$, the map $\pi$ of degree two, and $Z$ a hyperplane section (i.e. it defines a very ample line bundle). Thanks! Edit: I assume the varieties $X$ and $Y$ to be projective.",,"['general-topology', 'algebraic-geometry', 'schemes']"
54,equivalence of different definitions of isotopy,equivalence of different definitions of isotopy,,"Here are two supposedly equivalent definitions of a smooth isotopy (M and N are smooth manifolds): A smooth level preserving imbedding $M \times I \rightarrow N \times I$ A smooth map $ F: M\times I \rightarrow N$ such that each $F_t$ is an imbedding For the life of me I cannot show that an $F$ satisfying 2 will induce an imbedding as in 1.  Clearly the map will be an injective immersion but why is it a homeomorphism onto its image?  I tried showing its proper but I can't see why a sequence of points escaping from compact sets in M couldn't be mapped into a single compact set in N at different times, even though the times converge to some time in the interval.  Please help!  I'm probably just being very stupid. Or perhaps there's a counter example?","Here are two supposedly equivalent definitions of a smooth isotopy (M and N are smooth manifolds): A smooth level preserving imbedding $M \times I \rightarrow N \times I$ A smooth map $ F: M\times I \rightarrow N$ such that each $F_t$ is an imbedding For the life of me I cannot show that an $F$ satisfying 2 will induce an imbedding as in 1.  Clearly the map will be an injective immersion but why is it a homeomorphism onto its image?  I tried showing its proper but I can't see why a sequence of points escaping from compact sets in M couldn't be mapped into a single compact set in N at different times, even though the times converge to some time in the interval.  Please help!  I'm probably just being very stupid. Or perhaps there's a counter example?",,"['general-topology', 'differential-geometry', 'differential-topology', 'manifolds']"
55,Problem 4 chapter 2: functional analysis (Rudin),Problem 4 chapter 2: functional analysis (Rudin),,"$L^1$ , $L^2$ : usual Lebesgue spaces on the unit interval. Show that $L^2$ is of the first category (meager) in $L^1$ , in three ways: (a) Show that $F_n:=\{f:\int|f|^2 \leq n\}$ is closed in $L^1$ but has empty interior. (b)Put $g_n=n$ on $[0,n^{-3}]$ , and show that $\int fg_n \rightarrow 0$ $\forall f \in L^2$ , but not for every $f\in L^1$ . (c) Note that the inclusion map  of $L^2$ into $L^1$ is continuous but not onto. Do the same for $L^p$ and $L^q$ if $p<q$ .",", : usual Lebesgue spaces on the unit interval. Show that is of the first category (meager) in , in three ways: (a) Show that is closed in but has empty interior. (b)Put on , and show that , but not for every . (c) Note that the inclusion map  of into is continuous but not onto. Do the same for and if .","L^1 L^2 L^2 L^1 F_n:=\{f:\int|f|^2 \leq n\} L^1 g_n=n [0,n^{-3}] \int fg_n \rightarrow 0 \forall f \in L^2 f\in L^1 L^2 L^1 L^p L^q p<q","['real-analysis', 'general-topology', 'functional-analysis', 'lp-spaces']"
56,Is my proof correct- totally disconnected set.,Is my proof correct- totally disconnected set.,,"Show that the Cantor set, C, is totally disconnected. Let $x,y\in C$ and suppose (WLOG) that $x<y$. Since $x,y\in C$, then $x,y\in C_n$ $\forall n\in$ℕ . Then, by construction of C, $\exists$ N$\in$ℕsuch that $|x-y|>\frac{1}{3^N}$ (where $\frac{1}{3^N}$ is the length of a closed interval in $C_N$. This implies that $x$ and $y$ belong to different closed intervals in $C_N$ and also, there must exist an element, $z$, where $x<z<y$, but $z\notin C_N$ and hence, $z\notin C$ (i.e. $z$ was in the open interval ""removed"" when constructing the Cantor set). Let $A$={$a|a<z, a\in C$} and $B$={$b|b>z, b\in C$}. Then $x\in A$ and $y\in B$. Note that $\bar A\cup B$=$\emptyset$ and $A\cup \bar B$=$\emptyset$, implying that $A$ and $B$ are separated sets. Then, since $A$ is the set of all elements in $C$ less than $z$ and $B$ is the set of all elements in $C$ greater than $z$ (and $z$ is not in $C$), it follows that $C=A\cup B$, and therefore $C$ is totally disconnected. Is this correctly done? I am concerned about the part where I stated that $A$ and $B$ are separated sets, do I need to prove this point further?  Feedback is appreciated. Thanks.","Show that the Cantor set, C, is totally disconnected. Let $x,y\in C$ and suppose (WLOG) that $x<y$. Since $x,y\in C$, then $x,y\in C_n$ $\forall n\in$ℕ . Then, by construction of C, $\exists$ N$\in$ℕsuch that $|x-y|>\frac{1}{3^N}$ (where $\frac{1}{3^N}$ is the length of a closed interval in $C_N$. This implies that $x$ and $y$ belong to different closed intervals in $C_N$ and also, there must exist an element, $z$, where $x<z<y$, but $z\notin C_N$ and hence, $z\notin C$ (i.e. $z$ was in the open interval ""removed"" when constructing the Cantor set). Let $A$={$a|a<z, a\in C$} and $B$={$b|b>z, b\in C$}. Then $x\in A$ and $y\in B$. Note that $\bar A\cup B$=$\emptyset$ and $A\cup \bar B$=$\emptyset$, implying that $A$ and $B$ are separated sets. Then, since $A$ is the set of all elements in $C$ less than $z$ and $B$ is the set of all elements in $C$ greater than $z$ (and $z$ is not in $C$), it follows that $C=A\cup B$, and therefore $C$ is totally disconnected. Is this correctly done? I am concerned about the part where I stated that $A$ and $B$ are separated sets, do I need to prove this point further?  Feedback is appreciated. Thanks.",,"['real-analysis', 'general-topology']"
57,Intersection of nested compact subspaces in non-Hausdorff space,Intersection of nested compact subspaces in non-Hausdorff space,,Why is it that if a space is not Hausdorff and you take the intersection of nested compact subspaces the intersection could be empty? Could you give me an example?,Why is it that if a space is not Hausdorff and you take the intersection of nested compact subspaces the intersection could be empty? Could you give me an example?,,"['general-topology', 'compactness']"
58,spaces for which every open set is a union of closed sets,spaces for which every open set is a union of closed sets,,"In the context of generalized metrizability of spaces I'm interested in the property of a topological space that every open set in it is a union of closed sets. A google search led me to: http://at.yorku.ca/cgi-bin/bbqa?forum=ask_a_topologist_2003;task=show_msg;msg=0048.0002 however, I do not have the mentioned book nor will it be likely I can get it any time soon. Specifically, it would appear the book calls such spaces $\pi_1$ spaces and it proves that a space is $\pi_1$ precisely when every principal a-ideal in the lattice of open sets is normal. I would really like to understand this theorem. Unfortunately, I don't know what a-ideal means nor what normality for an ideal in that context is. So, if anybody can contribute to deciphering the meaning of these concepts and/or point to an online available proof and/or supply a proof I will be very grateful. I am also interested in the hierarchy of $\pi_i$ properties for spaces.","In the context of generalized metrizability of spaces I'm interested in the property of a topological space that every open set in it is a union of closed sets. A google search led me to: http://at.yorku.ca/cgi-bin/bbqa?forum=ask_a_topologist_2003;task=show_msg;msg=0048.0002 however, I do not have the mentioned book nor will it be likely I can get it any time soon. Specifically, it would appear the book calls such spaces $\pi_1$ spaces and it proves that a space is $\pi_1$ precisely when every principal a-ideal in the lattice of open sets is normal. I would really like to understand this theorem. Unfortunately, I don't know what a-ideal means nor what normality for an ideal in that context is. So, if anybody can contribute to deciphering the meaning of these concepts and/or point to an online available proof and/or supply a proof I will be very grateful. I am also interested in the hierarchy of $\pi_i$ properties for spaces.",,['general-topology']
59,Function which preserves closed-boundedness and path-connectedness continuous?,Function which preserves closed-boundedness and path-connectedness continuous?,,"Let $f:\mathbb{R^n}\to\mathbb{R^m}$ be a function such that the image of any closed bounded set is closed and bounded, and the image of any path-connected set is path-connected. Must $f$ be continuous? What if we replace ""path-connected"" with ""connected""?","Let $f:\mathbb{R^n}\to\mathbb{R^m}$ be a function such that the image of any closed bounded set is closed and bounded, and the image of any path-connected set is path-connected. Must $f$ be continuous? What if we replace ""path-connected"" with ""connected""?",,"['real-analysis', 'general-topology']"
60,Help with Metric spaces,Help with Metric spaces,,"$\newcommand{\Int}{\operatorname{Int}}\newcommand{\Bdy}{\operatorname{Bdy}}$ If $A$ and $B$ are sets in a metric space, show that: (note that $\Int$ stands for interior of the set) $\Int (A) \cup \Int (B) \subset \Int (A \cup B)$. $(\overline{ A \cup B}) = (\overline A \cup \overline B )$.  (note that $\overline A = \Int (A) \cup \Bdy(A)$ ) Now for the first (1) I see why its true for instance in $R$ we can have the intervals set $A=[a,b]$ and $B=[b,c]$ we have $A \cup B=[a,c]$ so $\Int(A \cup B)=(a,c)$ now $\Int(A)=(a,b)$ and  $\Int(B)=(b,c)$ so we lose $b$ when we take union to form $\Int(A) \cup \Int(B)=(a,b) \cup (b,c)$.","$\newcommand{\Int}{\operatorname{Int}}\newcommand{\Bdy}{\operatorname{Bdy}}$ If $A$ and $B$ are sets in a metric space, show that: (note that $\Int$ stands for interior of the set) $\Int (A) \cup \Int (B) \subset \Int (A \cup B)$. $(\overline{ A \cup B}) = (\overline A \cup \overline B )$.  (note that $\overline A = \Int (A) \cup \Bdy(A)$ ) Now for the first (1) I see why its true for instance in $R$ we can have the intervals set $A=[a,b]$ and $B=[b,c]$ we have $A \cup B=[a,c]$ so $\Int(A \cup B)=(a,c)$ now $\Int(A)=(a,b)$ and  $\Int(B)=(b,c)$ so we lose $b$ when we take union to form $\Int(A) \cup \Int(B)=(a,b) \cup (b,c)$.",,"['real-analysis', 'general-topology', 'metric-spaces']"
61,Reference for topology and fiber bundle,Reference for topology and fiber bundle,,"I am looking for an introductory book that explains the relations of topology and bundles. I know a basic topology and algebraic topology. But I don't know much about bundles. I want a book that explains the definition of bundles carefully and give some intuition on bundles explains relations between topology and bundles has physics motivation (if possible) If you know a good books, please let me know. Thank you very much in advance.","I am looking for an introductory book that explains the relations of topology and bundles. I know a basic topology and algebraic topology. But I don't know much about bundles. I want a book that explains the definition of bundles carefully and give some intuition on bundles explains relations between topology and bundles has physics motivation (if possible) If you know a good books, please let me know. Thank you very much in advance.",,"['geometry', 'general-topology']"
62,Is there an extensive 'cheat sheet' for general topology questions?,Is there an extensive 'cheat sheet' for general topology questions?,,"I'm looking for a collection of results in basic topology. Often I find myself working out some small detail for i.e. continuous functions, and I know I have done the same thing before, but cannot remember if the result was $=$ or just $\subseteq$ or what exact conditions the map has to have for the result to hold. A small example: If $f\colon X\rightarrow Y$ is a continuous map and $A\subseteq Y$, then in general only $f^{-1}(\overline{A})\subseteq \overline{f^{-1}(A)}$. But if $f$ is also an open map, then $f^{-1}(\overline{A})=\overline{f^{-1}(A)}$. Do you know a good (not necessarily small) collection of results? Most topology books cover some very elementary ones, but I never find what I'm looking for, or when I eventually find something, it would have been faster if I had actually proven it myself. Thank you in advance.","I'm looking for a collection of results in basic topology. Often I find myself working out some small detail for i.e. continuous functions, and I know I have done the same thing before, but cannot remember if the result was $=$ or just $\subseteq$ or what exact conditions the map has to have for the result to hold. A small example: If $f\colon X\rightarrow Y$ is a continuous map and $A\subseteq Y$, then in general only $f^{-1}(\overline{A})\subseteq \overline{f^{-1}(A)}$. But if $f$ is also an open map, then $f^{-1}(\overline{A})=\overline{f^{-1}(A)}$. Do you know a good (not necessarily small) collection of results? Most topology books cover some very elementary ones, but I never find what I'm looking for, or when I eventually find something, it would have been faster if I had actually proven it myself. Thank you in advance.",,"['general-topology', 'reference-request']"
63,A question about finding a countable collection of open sets where intersection equal to S [duplicate],A question about finding a countable collection of open sets where intersection equal to S [duplicate],,"This question already has answers here : Closed 11 years ago . Possible Duplicate: How would one go about proving that the rationals are not the countable intersection of open sets? As the topic, prove that set $S$ of rational numbers in the interval (0,1), cannot be expressed as the intersection of a countable collection of open sets.","This question already has answers here : Closed 11 years ago . Possible Duplicate: How would one go about proving that the rationals are not the countable intersection of open sets? As the topic, prove that set $S$ of rational numbers in the interval (0,1), cannot be expressed as the intersection of a countable collection of open sets.",,['general-topology']
64,What if every function in $C(X)$ has finite spectrum?,What if every function in  has finite spectrum?,C(X),"Suppose that $X$ is a compact Hausdorf space, and that every continuous function on $X$ has finite range.  How do I conclude that $X$ is a finite set, hence with discrete topology?  So far, I have managed to use Urysohn to show that the closed maximal connected component decomposition of $X$ (as opposed to the path component decomposition) is one where every component is a 1 point set. This question arose from trying to solve the question that every C* algebra with all normal elements having finite spectra are finite dimensional.  A more direct solution to this general question would also suffice, because actually implies the special case I've reduced it to.  By taking a unitization, and then a MASA in the unitization, one gets to the case I've gotten to. Also, a topological question that is in the same setup but handles a related operator algebras question is this: if a net $u_i$ and $u$ in $X$ has the property that for all continuous $f \in C(X)$ one has that $f(u_i)$ converges to $f(u)$ then must $u_i$ converge to $u$ in topology?  This is for showing that the gelfand representation of a $C(X)$ space is itself.  I'd like this fact for $X$ locally compact Hausdorf, actually.","Suppose that $X$ is a compact Hausdorf space, and that every continuous function on $X$ has finite range.  How do I conclude that $X$ is a finite set, hence with discrete topology?  So far, I have managed to use Urysohn to show that the closed maximal connected component decomposition of $X$ (as opposed to the path component decomposition) is one where every component is a 1 point set. This question arose from trying to solve the question that every C* algebra with all normal elements having finite spectra are finite dimensional.  A more direct solution to this general question would also suffice, because actually implies the special case I've reduced it to.  By taking a unitization, and then a MASA in the unitization, one gets to the case I've gotten to. Also, a topological question that is in the same setup but handles a related operator algebras question is this: if a net $u_i$ and $u$ in $X$ has the property that for all continuous $f \in C(X)$ one has that $f(u_i)$ converges to $f(u)$ then must $u_i$ converge to $u$ in topology?  This is for showing that the gelfand representation of a $C(X)$ space is itself.  I'd like this fact for $X$ locally compact Hausdorf, actually.",,"['general-topology', 'functional-analysis', 'operator-algebras']"
65,Prove/Disprove $f$ continuous iff $f[\mathring{A}]\supseteq\mathring{f[A]}$,Prove/Disprove  continuous iff,f f[\mathring{A}]\supseteq\mathring{f[A]},"Let $X,Y$ be 2 topological spaces. $f\colon X\to Y$ be a mapping. It is known that $f$ is continuous iff $f[\bar{A}]\subseteq\overline{f[A]}$ $f^{-1}[\bar{B}]\supseteq\overline{f^{-1}[B]}$ $f^{-1}[\mathring{B}]\subseteq\overbrace{f^{-1}[B]}^\circ$ It is normally to ask that whether $f[\mathring{A}]\supseteq \overbrace{f[A]}^\circ$ can be added in this list?","Let $X,Y$ be 2 topological spaces. $f\colon X\to Y$ be a mapping. It is known that $f$ is continuous iff $f[\bar{A}]\subseteq\overline{f[A]}$ $f^{-1}[\bar{B}]\supseteq\overline{f^{-1}[B]}$ $f^{-1}[\mathring{B}]\subseteq\overbrace{f^{-1}[B]}^\circ$ It is normally to ask that whether $f[\mathring{A}]\supseteq \overbrace{f[A]}^\circ$ can be added in this list?",,['general-topology']
