,title_raw,title_text,title_latex,body_raw,body_text,body_latex,tags
66,Induced topology on the homomorphic image of a topological group,Induced topology on the homomorphic image of a topological group,,"I would like to do a small sanity check on the following situation: Let $\pi: G \rightarrow G'$ be a surjective homomorphism of topological groups. Let the topology of $G$ be given by a sequence of subgroups $\left\{G_n\right\}$, i.e. $G=G_0 \supseteq G_1 \supseteq G_2 \supseteq \cdots$ where the $G_n$ form a fundamental system of neighborhoods. Define the topology on $G'$ by letting the open subsets of $G'$ be images of open subsets of $G$ under $\pi$, i.e. for any open set $G_n$ define $G^{'}_n=\pi(G_n)$ to be open. I want to show that $\pi$ is continuous with respect to this topology. Towards this end, it is enough to show that $\pi^{-1}(G^{'}_n)$ is open in $G$. But $\pi^{-1}(G^{'}_n)=G_n+Ker(g)=\cup_{\xi \in Ker(g)} (G_n + \xi)$ which is open since $G_n + \xi$ is open, because the translation map in $G$ is continuous. Is this argument sound? Thanks.","I would like to do a small sanity check on the following situation: Let $\pi: G \rightarrow G'$ be a surjective homomorphism of topological groups. Let the topology of $G$ be given by a sequence of subgroups $\left\{G_n\right\}$, i.e. $G=G_0 \supseteq G_1 \supseteq G_2 \supseteq \cdots$ where the $G_n$ form a fundamental system of neighborhoods. Define the topology on $G'$ by letting the open subsets of $G'$ be images of open subsets of $G$ under $\pi$, i.e. for any open set $G_n$ define $G^{'}_n=\pi(G_n)$ to be open. I want to show that $\pi$ is continuous with respect to this topology. Towards this end, it is enough to show that $\pi^{-1}(G^{'}_n)$ is open in $G$. But $\pi^{-1}(G^{'}_n)=G_n+Ker(g)=\cup_{\xi \in Ker(g)} (G_n + \xi)$ which is open since $G_n + \xi$ is open, because the translation map in $G$ is continuous. Is this argument sound? Thanks.",,"['abstract-algebra', 'general-topology', 'topological-groups']"
67,Which of the following are compact sets?,Which of the following are compact sets?,,"Which of the following are compact sets? $\{\operatorname{trace}(A): A  \text{ is real orthogonal}\}$ $\{A\in M_n(\mathbb{R}):\text{ eigenvalues $|\lambda|\le 2$}\}$ Well, orthogonal matrices are compact, but the trace of them may be any $x\in\mathbb{R}$, so I guess 1 is non compact. Let $x$ be an eigenvector corresponding to the eigenvalue $\lambda$; then $Ax=\lambda x$, then $\|Ax\|= |\lambda|\cdot\|x\|\le \|A\|\cdot\|x\|$ so $\|A\|\ge 2$ so $2$ is also non compact as unbounded?","Which of the following are compact sets? $\{\operatorname{trace}(A): A  \text{ is real orthogonal}\}$ $\{A\in M_n(\mathbb{R}):\text{ eigenvalues $|\lambda|\le 2$}\}$ Well, orthogonal matrices are compact, but the trace of them may be any $x\in\mathbb{R}$, so I guess 1 is non compact. Let $x$ be an eigenvector corresponding to the eigenvalue $\lambda$; then $Ax=\lambda x$, then $\|Ax\|= |\lambda|\cdot\|x\|\le \|A\|\cdot\|x\|$ so $\|A\|\ge 2$ so $2$ is also non compact as unbounded?",,"['general-topology', 'matrices', 'compactness']"
68,Describe all the compact subsets of this space,Describe all the compact subsets of this space,,"Consider the topological space $(X,\mathscr{U})$,  where $X=\mathbb{R}^2$ and the topology $\mathscr{U}$  is generated by the collection of sets $\{(0,0)\}\cup \{I_a\}$ where $I_a$ are the open intervals on the rays departing from the origin. We then make a quotient of this space, lets call it $Y$, by identifying the points on the closed disk $D^2$ centred at the origin of radius 1. Intuitively I can see some closed subsets that are compact (essentially closed segments on the rays) and others which are not (any subset extending over a ""continuity"" of rays). But, being the question ""Describe all the compacts"", can you suggest me a way to find them all? Is there a procedure someone can follow in this or in similar cases? Are there some results achievable by finding which separation axiom hold in this space? Finally, what is the role of the identification in this particular problem? I can't find anything relevant.","Consider the topological space $(X,\mathscr{U})$,  where $X=\mathbb{R}^2$ and the topology $\mathscr{U}$  is generated by the collection of sets $\{(0,0)\}\cup \{I_a\}$ where $I_a$ are the open intervals on the rays departing from the origin. We then make a quotient of this space, lets call it $Y$, by identifying the points on the closed disk $D^2$ centred at the origin of radius 1. Intuitively I can see some closed subsets that are compact (essentially closed segments on the rays) and others which are not (any subset extending over a ""continuity"" of rays). But, being the question ""Describe all the compacts"", can you suggest me a way to find them all? Is there a procedure someone can follow in this or in similar cases? Are there some results achievable by finding which separation axiom hold in this space? Finally, what is the role of the identification in this particular problem? I can't find anything relevant.",,"['general-topology', 'compactness']"
69,connected component of $\rm{GL_n}(\mathbb{R})$ [duplicate],connected component of  [duplicate],\rm{GL_n}(\mathbb{R}),"This question already has answers here : Closed 11 years ago . Possible Duplicate: How many connected components does $\mathrm{GL}_n(\mathbb R)$ have? I know $\rm{GL_n}(\mathbb{R})$ is not connected and connected components are $C_1 =\{A:\rm{det}\ A>0\}$ and $C_2=\{A:\rm{det} \ A<0\}$. Given that $C_1= \rm{det}^{-1}(0,\infty)$ and $C_2=\rm{det}^{-1}(-\infty,0)$, $\rm{det}:M_n(\mathbb{R})\to \mathbb{R}$. But how can one prove  that $C_1$ and $C_2$ are connected in $\rm{M_n}(\mathbb{R})$? Thank you.","This question already has answers here : Closed 11 years ago . Possible Duplicate: How many connected components does $\mathrm{GL}_n(\mathbb R)$ have? I know $\rm{GL_n}(\mathbb{R})$ is not connected and connected components are $C_1 =\{A:\rm{det}\ A>0\}$ and $C_2=\{A:\rm{det} \ A<0\}$. Given that $C_1= \rm{det}^{-1}(0,\infty)$ and $C_2=\rm{det}^{-1}(-\infty,0)$, $\rm{det}:M_n(\mathbb{R})\to \mathbb{R}$. But how can one prove  that $C_1$ and $C_2$ are connected in $\rm{M_n}(\mathbb{R})$? Thank you.",,['general-topology']
70,Exercise on compact $G_\delta$ sets,Exercise on compact  sets,G_\delta,"I'm having trouble proving an exercise in Folland's book on real analysis. Problem: Consider a locally compact Hausdorff space $X$. If $K\subset X$ is a compact $G_\delta$ set, then show there exists a $f\in C_c(X, [0,1])$ with $K=f^{-1}(\{1\})$. We can write $K=\cap_1^\infty U_i$, where the $U_i$ are open. My thought was to use Urysohn's lemma to find functions $f_i$ which are 1 on $K$ and $0$ outside of $U_i$, but I don't see how to use them to get the desired function. If we take the limit, I think we just get the characteristic function of $K$. I apologize if this is something simple. It has been a while since I've done point-set topology.","I'm having trouble proving an exercise in Folland's book on real analysis. Problem: Consider a locally compact Hausdorff space $X$. If $K\subset X$ is a compact $G_\delta$ set, then show there exists a $f\in C_c(X, [0,1])$ with $K=f^{-1}(\{1\})$. We can write $K=\cap_1^\infty U_i$, where the $U_i$ are open. My thought was to use Urysohn's lemma to find functions $f_i$ which are 1 on $K$ and $0$ outside of $U_i$, but I don't see how to use them to get the desired function. If we take the limit, I think we just get the characteristic function of $K$. I apologize if this is something simple. It has been a while since I've done point-set topology.",,"['general-topology', 'compactness']"
71,A space that has a countably locally finite basis but not second countable,A space that has a countably locally finite basis but not second countable,,"[Munkres, Ch40, p252] Find a nondiscrete space that has a countably locally finite basis but does not have a countable basis. I solved this problem. My solution is $X=\mathbb{R} \cup \{0'\}$ with topology given by basis $\mathfrak{B}$ consisting of all the nonzero points and {0,0'}. This is almost discrete, except for zero points. This basis $\mathfrak{B}$ is locally finite, so countably locally finite. And this space has no countable basis, since all the nonzero points(which are uncountable) should be in the basis. But I think that this space can be regarded discrete by passing to the quotient space. Is there any more truly nondiscrete example?","[Munkres, Ch40, p252] Find a nondiscrete space that has a countably locally finite basis but does not have a countable basis. I solved this problem. My solution is $X=\mathbb{R} \cup \{0'\}$ with topology given by basis $\mathfrak{B}$ consisting of all the nonzero points and {0,0'}. This is almost discrete, except for zero points. This basis $\mathfrak{B}$ is locally finite, so countably locally finite. And this space has no countable basis, since all the nonzero points(which are uncountable) should be in the basis. But I think that this space can be regarded discrete by passing to the quotient space. Is there any more truly nondiscrete example?",,['general-topology']
72,A universal property for the subspace topology,A universal property for the subspace topology,,Let $X$ be topological space and $Y$ be a subset of $X$ with $i\colon Y\to X$ the inclusion map. Show that the induced topology of $Y$ is characterized by the following property: A function $f\colon Z \to Y$ of a topological space $Z$ into $Y$ is continuous if and only if  $i\circ f$ is continuous.,Let $X$ be topological space and $Y$ be a subset of $X$ with $i\colon Y\to X$ the inclusion map. Show that the induced topology of $Y$ is characterized by the following property: A function $f\colon Z \to Y$ of a topological space $Z$ into $Y$ is continuous if and only if  $i\circ f$ is continuous.,,['general-topology']
73,Regular covering implies transitive automorphism group action,Regular covering implies transitive automorphism group action,,"We already know the theorem Theorem Let $p: (Y,y) \rightarrow (X,x)$ be a covering, with $Y$ connected and $X$ locally path connected, and let $p(y) = x$ . If $p_*(\pi_1(Y,y))$ is a normal subgroup of $\pi_1(X,x)$ , then $\pi_1(X,x)/p_*(\pi_1(Y,y))$ is isomorphic to Aut(Y/X). Question As the situation above, T.F.A.E (a) the covering is normal (i.e., $p_*(\pi_1(Y,y))$ is a normal subgroup of $\pi_1(X,x)$ ); (b) the action of $Aut(X/Y)$ on $p^{-1}(x)$ is transitive; (c) for every loop $\sigma$ at $x$ , if one lifting of $\sigma$ is closed (i.e., still a loop at some $y \in p^{-1}(x)$ ), then all liftings are closed. My approach I already proved (b) $\implies$ (c) and (c) $\implies$ (a). So I need to prove (a) $\implies$ (b), and I know I need to use the theorem above. So, is that true that for any $y$ and $y' \in p^{-1}(x)$ , the there exists $[\sigma] \in \pi_1(X,x)$ such that $y' = [\sigma]y$ ? (If this is true, then we are done!) Thank you very much!","We already know the theorem Theorem Let be a covering, with connected and locally path connected, and let . If is a normal subgroup of , then is isomorphic to Aut(Y/X). Question As the situation above, T.F.A.E (a) the covering is normal (i.e., is a normal subgroup of ); (b) the action of on is transitive; (c) for every loop at , if one lifting of is closed (i.e., still a loop at some ), then all liftings are closed. My approach I already proved (b) (c) and (c) (a). So I need to prove (a) (b), and I know I need to use the theorem above. So, is that true that for any and , the there exists such that ? (If this is true, then we are done!) Thank you very much!","p: (Y,y) \rightarrow (X,x) Y X p(y) = x p_*(\pi_1(Y,y)) \pi_1(X,x) \pi_1(X,x)/p_*(\pi_1(Y,y)) p_*(\pi_1(Y,y)) \pi_1(X,x) Aut(X/Y) p^{-1}(x) \sigma x \sigma y \in p^{-1}(x) \implies \implies \implies y y' \in p^{-1}(x) [\sigma] \in \pi_1(X,x) y' = [\sigma]y","['general-topology', 'algebraic-topology']"
74,Let $X = \Bbb{R}$ with the discrete metric. Is $X$ connected?,Let  with the discrete metric. Is  connected?,X = \Bbb{R} X,"No. Any nonempty subset $A ≠ X$ is open, as well as its complement. So $X$ is the union of disjoint nonempty open subsets. Is there a more formal way of doing it? Thanks for your help.","No. Any nonempty subset $A ≠ X$ is open, as well as its complement. So $X$ is the union of disjoint nonempty open subsets. Is there a more formal way of doing it? Thanks for your help.",,"['real-analysis', 'general-topology']"
75,Prove one set is a convex hull of another set,Prove one set is a convex hull of another set,,"Define two sets: $A = \{x \in \{0,1\}^n : \lVert x \rVert_1 \leq k\}$ is a finite set of binary vectors; $B = \{x \in [0,1]^n : \lVert x \rVert_1 \leq k\}$ is an infinite set of real-valued vectors, whose elements are between $0$ and $1$; where $0 \leq k \leq n$, $k$ is an integer and $\lVert x \rVert_1$ denotes the $l_1$ norm: $\lVert x \rVert_1 = \sum_{i=1}^{n} \lvert x_i \rvert$. I believe $B$ is the convex hull of $A$ ($conv(A)$), but cannot prove it. It is easy to show $conv(A) \subseteq B$. I'm stuck at the reverse direction. I'm thinking of using induction proof: assume it holds for $0 \leq k < n$, prove that it also holds for $k+1$; but I haven't succeeded.","Define two sets: $A = \{x \in \{0,1\}^n : \lVert x \rVert_1 \leq k\}$ is a finite set of binary vectors; $B = \{x \in [0,1]^n : \lVert x \rVert_1 \leq k\}$ is an infinite set of real-valued vectors, whose elements are between $0$ and $1$; where $0 \leq k \leq n$, $k$ is an integer and $\lVert x \rVert_1$ denotes the $l_1$ norm: $\lVert x \rVert_1 = \sum_{i=1}^{n} \lvert x_i \rvert$. I believe $B$ is the convex hull of $A$ ($conv(A)$), but cannot prove it. It is easy to show $conv(A) \subseteq B$. I'm stuck at the reverse direction. I'm thinking of using induction proof: assume it holds for $0 \leq k < n$, prove that it also holds for $k+1$; but I haven't succeeded.",,"['linear-algebra', 'general-topology', 'convex-analysis']"
76,Question on Normal Topological Spaces,Question on Normal Topological Spaces,,"Here's a question I've been working on: Suppose that $X$ is a normal topological space, that $F\subseteq X$ is closed, and that $F\subseteq U_1 \cup U_2$ for open sets $U_1,U_2$. Prove that there exist closed sets $F_1,F_2$ with $F=F_1 \cup F_2$, $F_1 \subseteq U_1$, and $F_2 \subseteq U_2$. I wish I could put up a partial solution, but I don't have much. I'm having a hard time seeing where I could apply normality---where are my disjoint closed sets? Here's what I do know: (1) closed subspaces of normal spaces are normal; (2) $X$ is normal iff given a closed set $F$ and an open set $U$ containing $F$, there exists an open set $V$ such that $F \subseteq V\subseteq \bar{V} \subseteq U$. I'm thinking that the characterization of normality given in (2) might be more helpful than the actual definition of normality (since it gives me closed sets contained in open sets), but again, I'm having a difficult time applying it. Any hints would be appreciated.","Here's a question I've been working on: Suppose that $X$ is a normal topological space, that $F\subseteq X$ is closed, and that $F\subseteq U_1 \cup U_2$ for open sets $U_1,U_2$. Prove that there exist closed sets $F_1,F_2$ with $F=F_1 \cup F_2$, $F_1 \subseteq U_1$, and $F_2 \subseteq U_2$. I wish I could put up a partial solution, but I don't have much. I'm having a hard time seeing where I could apply normality---where are my disjoint closed sets? Here's what I do know: (1) closed subspaces of normal spaces are normal; (2) $X$ is normal iff given a closed set $F$ and an open set $U$ containing $F$, there exists an open set $V$ such that $F \subseteq V\subseteq \bar{V} \subseteq U$. I'm thinking that the characterization of normality given in (2) might be more helpful than the actual definition of normality (since it gives me closed sets contained in open sets), but again, I'm having a difficult time applying it. Any hints would be appreciated.",,"['general-topology', 'separation-axioms']"
77,Pontryagin classes of a product manifold,Pontryagin classes of a product manifold,,"I'm imagining there's a way to relate the pontryagin classes of $T(M\times N)$ to the pontryagin classes of $M$ and those of $N$, but I haven't been able to find a helpful reference. Could someone explain this or direct me to a good source? I am interested specifically in $CP^2\times CP^2$ but also in the general case. Thanks!","I'm imagining there's a way to relate the pontryagin classes of $T(M\times N)$ to the pontryagin classes of $M$ and those of $N$, but I haven't been able to find a helpful reference. Could someone explain this or direct me to a good source? I am interested specifically in $CP^2\times CP^2$ but also in the general case. Thanks!",,"['general-topology', 'vector-bundles', 'characteristic-classes']"
78,About some open covering of compact connected space,About some open covering of compact connected space,,"Let $(X,d)$ be a connected compact metric space. Does there exist a finite family $B_1,...,B_n$ of open balls in $X$ with a given radius $R>0$ such that $B_i \cap B_{i+1} \neq \emptyset$ for $i=1,\ldots ,n-1$ and $X=\bigcup_{k=1}^n B_i$. Thanks.","Let $(X,d)$ be a connected compact metric space. Does there exist a finite family $B_1,...,B_n$ of open balls in $X$ with a given radius $R>0$ such that $B_i \cap B_{i+1} \neq \emptyset$ for $i=1,\ldots ,n-1$ and $X=\bigcup_{k=1}^n B_i$. Thanks.",,['general-topology']
79,Neighborhood of a closed subset of $\mathbb{R}$,Neighborhood of a closed subset of,\mathbb{R},"I am having trouble showing the following. Let $F \subset O \subset \mathbb{R}$, where $F$ is closed and $O$ is open. Prove that there is an open set $U$ such that $F \subset U$ and $\bar{U} \subset O$. It seems so trivial, but I can't get a start on this question. Can I start with intervals?","I am having trouble showing the following. Let $F \subset O \subset \mathbb{R}$, where $F$ is closed and $O$ is open. Prove that there is an open set $U$ such that $F \subset U$ and $\bar{U} \subset O$. It seems so trivial, but I can't get a start on this question. Can I start with intervals?",,"['real-analysis', 'general-topology']"
80,Is the set of functions from a compact to complete space complete?,Is the set of functions from a compact to complete space complete?,,"I've noticed that it's often interesting to consider what types of properties of a topology are preserved or lost when mapping between different types of spaces. This led me to wonder about spaces of functions themselves. In this case, suppose I have two metric spaces, $(S,c)$ compact and $(T,d)$ complete, and I denote by $C(S,T)$ the set of all continuous functions from $S\to T$. I can put a metric on $C(S,T)$ defined by $\rho(f,g)=\sup_{s\in S}d(f(s),g(s))$. With this in place, is it true that $(C(S,T),\rho)$ is also complete?","I've noticed that it's often interesting to consider what types of properties of a topology are preserved or lost when mapping between different types of spaces. This led me to wonder about spaces of functions themselves. In this case, suppose I have two metric spaces, $(S,c)$ compact and $(T,d)$ complete, and I denote by $C(S,T)$ the set of all continuous functions from $S\to T$. I can put a metric on $C(S,T)$ defined by $\rho(f,g)=\sup_{s\in S}d(f(s),g(s))$. With this in place, is it true that $(C(S,T),\rho)$ is also complete?",,['general-topology']
81,Subspaces of Sorgenfrey line and a question about Lindelöf spaces,Subspaces of Sorgenfrey line and a question about Lindelöf spaces,,"1) This is example 5 (page 177 of Dugundji's book). Every subspace of the Sorgenfrey line is separable yet it is not second countable. I know how to prove it is not second countable. My question is: why is every subspace of the Sorgenfrey line separable? the Sorgenfrey line is separable but not metrizable, so I don't see why this follows immediately. 2) Is $\mathbb{R}^{\omega}$ a Lindelöf space? (here $\omega$ means the natural numbers). Can we simply say that $\mathbb{R}^{\omega}$ is metrizable being the countable product of a metrizable space, $\mathbb{R}$, and also separable since the countable product of separable spaces is separable so we have a separable and metrizable space, thus Lindelöf. What is another way of seeing this? Now just for fun, what if we consider $\mathbb{R}^{\mathbb{R}}$. Is this Lindelöf?","1) This is example 5 (page 177 of Dugundji's book). Every subspace of the Sorgenfrey line is separable yet it is not second countable. I know how to prove it is not second countable. My question is: why is every subspace of the Sorgenfrey line separable? the Sorgenfrey line is separable but not metrizable, so I don't see why this follows immediately. 2) Is $\mathbb{R}^{\omega}$ a Lindelöf space? (here $\omega$ means the natural numbers). Can we simply say that $\mathbb{R}^{\omega}$ is metrizable being the countable product of a metrizable space, $\mathbb{R}$, and also separable since the countable product of separable spaces is separable so we have a separable and metrizable space, thus Lindelöf. What is another way of seeing this? Now just for fun, what if we consider $\mathbb{R}^{\mathbb{R}}$. Is this Lindelöf?",,"['general-topology', 'separable-spaces', 'sorgenfrey-line']"
82,CW-Complexes Clarification: Finite Verses Infinite Cells in each Dimension,CW-Complexes Clarification: Finite Verses Infinite Cells in each Dimension,,"Question: Consider the following construction: take any uncountable set of elements and form a chain ($x < y < z <\dots$ ) of the elements (in particular, I think one can well-order the reals using the AoC, and then take this ordering) and now consider these elements to be 0-cells.  Now attach a 1-cell between two 0-cells $x, y$ if there is no $z$ between $x$ and $y$.  [Intuitively, this kind of looks like a ""really long"" real line.]  The claim is that this is not a CW-complex.  But why? Motivation: On a final, I was asked a question which sparked my interest in this finite vs infinite distinction in CW complexes.  In particular, I thought that this ""long line"" construction, though somewhat artificial, should qualify as a ""nice space"" since it is contractible.  When I asked about it, I was told that this was not a CW complex because the topology restricts us to putting a finite number of cells in each dimension.  I'm not quite sure why this is true. Can anyone shed some light on this for me?","Question: Consider the following construction: take any uncountable set of elements and form a chain ($x < y < z <\dots$ ) of the elements (in particular, I think one can well-order the reals using the AoC, and then take this ordering) and now consider these elements to be 0-cells.  Now attach a 1-cell between two 0-cells $x, y$ if there is no $z$ between $x$ and $y$.  [Intuitively, this kind of looks like a ""really long"" real line.]  The claim is that this is not a CW-complex.  But why? Motivation: On a final, I was asked a question which sparked my interest in this finite vs infinite distinction in CW complexes.  In particular, I thought that this ""long line"" construction, though somewhat artificial, should qualify as a ""nice space"" since it is contractible.  When I asked about it, I was told that this was not a CW complex because the topology restricts us to putting a finite number of cells in each dimension.  I'm not quite sure why this is true. Can anyone shed some light on this for me?",,['general-topology']
83,"In the proof of Urysohn's lemma, Why are the open sets indexed by dyadic numbers?","In the proof of Urysohn's lemma, Why are the open sets indexed by dyadic numbers?",,"I'm reading a proof of Urysohn's lemma . The author constructs a sequence of open sets indexed by dyadic numbers, i.e. numbers of the form $\frac{p}{2^n}$. The proof starts at the bottom of page 4. I don't seem to fully understand the proof, otherwise I could probably answer this question myself: Where does he use that the indices are dyadic? At my current level of understanding it appears to me that one could use rationals to index these sets. Many thanks for your help once again!","I'm reading a proof of Urysohn's lemma . The author constructs a sequence of open sets indexed by dyadic numbers, i.e. numbers of the form $\frac{p}{2^n}$. The proof starts at the bottom of page 4. I don't seem to fully understand the proof, otherwise I could probably answer this question myself: Where does he use that the indices are dyadic? At my current level of understanding it appears to me that one could use rationals to index these sets. Many thanks for your help once again!",,"['general-topology', 'algebraic-topology']"
