,title_raw,title_text,title_latex,body_raw,body_text,body_latex,tags
52,Block matrix determinant with symmetrically placed blocks,Block matrix determinant with symmetrically placed blocks,,"I am trying to solve the determinant of the following block matrix $$\begin{bmatrix}A-Ia&B\\B &A-Ib \end{bmatrix}$$ where $a$ and $b$ are integers and $I$ is an identity matrix. Matrices $A$ and $B$ are square. Unfortunately, I can't invoke the general expression since I don't want to attempt to invert any of these matrices (very complex). I see from Wikipedia that $$\det\begin{bmatrix}A&B\\B &A \end{bmatrix} = \det(A+B)\det(A-B)$$ Can anyone help me prove that this can be applied to my matrix (Such that I might get something like $\det(A-Ia+B)\det(A-Ib-B)$ )? Or alternatively, can anyone solve the determinant of my matrix without taking an inverse? Thanks!","I am trying to solve the determinant of the following block matrix where and are integers and is an identity matrix. Matrices and are square. Unfortunately, I can't invoke the general expression since I don't want to attempt to invert any of these matrices (very complex). I see from Wikipedia that Can anyone help me prove that this can be applied to my matrix (Such that I might get something like )? Or alternatively, can anyone solve the determinant of my matrix without taking an inverse? Thanks!",\begin{bmatrix}A-Ia&B\\B &A-Ib \end{bmatrix} a b I A B \det\begin{bmatrix}A&B\\B &A \end{bmatrix} = \det(A+B)\det(A-B) \det(A-Ia+B)\det(A-Ib-B),"['matrices', 'determinant', 'block-matrices']"
53,Why a tensor product of $2\times 2$ unitaries cannot implement a $3\times 3$ unitary?,Why a tensor product of  unitaries cannot implement a  unitary?,2\times 2 3\times 3,"Let $\{v_1, \dotsc, v_m\} \in \mathbb{C}^{2^n}$ be a set of orthonormal vectors. Define a map $R_m$ from $2^n \times 2^n$ to $m \times m$ matrices as follows: $$R_m(M) := \sum_{i,j=1}^m (v_i^*M v_j) E_{ij}$$ where $E_{ij} := e_i e_j^*$ is the all-zeroes matrix with entry 1 at position $(i,j)$. In other words, $R_m$ performs a unitary change of basis and then takes the top-left $3 \times 3$ block of the resulting matrix. For any $n \geq 2$, show that no matter how the vectors $\{v_i\}$ are chosen, $$\mathrm{U}(3) \not\subseteq \bigl\{ R_3(U_1 \otimes \dotsb \otimes U_n) : U_i \in \mathrm{U}(2) \bigr\}.$$ That is, as matrices $U_i$ range over all possible $2 \times 2$ unitaries, their tensor product will never contain the set of all $3 \times 3$ unitaries in some basis. More generally, this should hold even if $2 \times 2$ unitaries are replaced by $d \times d$ unitaries and $m = 3$ is replaced by any $m > d$. The motivation for this question comes from ""encoded universality"" in quantum computing.","Let $\{v_1, \dotsc, v_m\} \in \mathbb{C}^{2^n}$ be a set of orthonormal vectors. Define a map $R_m$ from $2^n \times 2^n$ to $m \times m$ matrices as follows: $$R_m(M) := \sum_{i,j=1}^m (v_i^*M v_j) E_{ij}$$ where $E_{ij} := e_i e_j^*$ is the all-zeroes matrix with entry 1 at position $(i,j)$. In other words, $R_m$ performs a unitary change of basis and then takes the top-left $3 \times 3$ block of the resulting matrix. For any $n \geq 2$, show that no matter how the vectors $\{v_i\}$ are chosen, $$\mathrm{U}(3) \not\subseteq \bigl\{ R_3(U_1 \otimes \dotsb \otimes U_n) : U_i \in \mathrm{U}(2) \bigr\}.$$ That is, as matrices $U_i$ range over all possible $2 \times 2$ unitaries, their tensor product will never contain the set of all $3 \times 3$ unitaries in some basis. More generally, this should hold even if $2 \times 2$ unitaries are replaced by $d \times d$ unitaries and $m = 3$ is replaced by any $m > d$. The motivation for this question comes from ""encoded universality"" in quantum computing.",,"['group-theory', 'matrices', 'representation-theory', 'lie-groups', 'quantum-computation']"
54,The relation between $\inf_{R\in \mathsf{U}_n} \left\Vert A - BR\right\Vert^2_F$ and $\left\Vert AA^*-BB^*\right\Vert$,The relation between  and,\inf_{R\in \mathsf{U}_n} \left\Vert A - BR\right\Vert^2_F \left\Vert AA^*-BB^*\right\Vert,"Suppose that $A$ and $B$ are two arbitrary $m\times n$ matrices with $m>n$. Let $\mathsf{U}_n$ denote the set of $n\times n$ unitary matrices. I'd like find positive constants $c_1$ and $c_2$ such that  $$ \begin{align*} c_2\left\Vert AA^*-BB^*\right\Vert &\geq\inf_{R\in \mathsf{U}_n} \left\Vert A - BR\right\Vert^2_F \geq c_1\left\Vert AA^*-BB^*\right\Vert, \end{align*} $$  holds (and the inequalities are sharp enough). I'm more interested in the upped bound. I have a partial answer that addresses some special cases. For example, if $n=1$ then I've shown that $c_2=\sqrt{2}$. Furthermore, if we assume that $A$ and $B$ have the same range, it's not difficult to find the appropriate $c_2$. My conjecture is that $c_2 = \sqrt{2n}$, but I haven't been able to prove it. The infimum above is the standard orthogonal Procrustes problem and it is relatively straightforward to show that $$ \begin{align*} \inf_{R\in \mathsf{U}_n} \left\Vert A - BR\right\Vert^2_F &=\left\Vert A\right\Vert_F ^2 +\left\Vert B\right\Vert_F ^2 -2\left\Vert A^*B\right\Vert_*,  \end{align*} $$ where $\left\Vert \cdot\right\Vert_*$ denotes the nuclear norm (or the Schatten 1-norm ).","Suppose that $A$ and $B$ are two arbitrary $m\times n$ matrices with $m>n$. Let $\mathsf{U}_n$ denote the set of $n\times n$ unitary matrices. I'd like find positive constants $c_1$ and $c_2$ such that  $$ \begin{align*} c_2\left\Vert AA^*-BB^*\right\Vert &\geq\inf_{R\in \mathsf{U}_n} \left\Vert A - BR\right\Vert^2_F \geq c_1\left\Vert AA^*-BB^*\right\Vert, \end{align*} $$  holds (and the inequalities are sharp enough). I'm more interested in the upped bound. I have a partial answer that addresses some special cases. For example, if $n=1$ then I've shown that $c_2=\sqrt{2}$. Furthermore, if we assume that $A$ and $B$ have the same range, it's not difficult to find the appropriate $c_2$. My conjecture is that $c_2 = \sqrt{2n}$, but I haven't been able to prove it. The infimum above is the standard orthogonal Procrustes problem and it is relatively straightforward to show that $$ \begin{align*} \inf_{R\in \mathsf{U}_n} \left\Vert A - BR\right\Vert^2_F &=\left\Vert A\right\Vert_F ^2 +\left\Vert B\right\Vert_F ^2 -2\left\Vert A^*B\right\Vert_*,  \end{align*} $$ where $\left\Vert \cdot\right\Vert_*$ denotes the nuclear norm (or the Schatten 1-norm ).",,"['linear-algebra', 'matrices', 'inequality', 'nuclear-norm']"
55,An inequality concerning non-negative integer matrices with constant row and column sums,An inequality concerning non-negative integer matrices with constant row and column sums,,"I'd appreciate any suggestions for how to prove (or disprove) the inequality described below. Some notation first: for positive integers $k$ and $M$, let ${\mathcal D}_{k,M}$ denote the set of all $k \times k$ non-negative integer matrices with row and column sums all equal to $M$. For $k \times k$ matrices $A = [a_{i,j}]$ and $B = [b_{i,j}]$, we write $A \le B$ if $a_{i,j} \le b_{i,j}$ for all $i,j$. Now, let $M, N$ be fixed positive integers with $M < N$. I'd like to prove that for any $B \in \mathcal{D}_{k,N}$, we have $\displaystyle \sum_{A \in \mathcal{D}_{k,M}: A \le B} \prod_{i,j} \frac{\binom{b_{i,j}}{a_{i,j}}}{\binom{N-b_{i,j}}{M-a_{i,j}}} \ge {\binom{N}{M}}^{2k-k^2}$. It is easy to check that the inequality holds with equality when $B$ is $N$ times a permutation matrix. It is also straightforward to show that the inequality holds when $B$ has at most two non-zero entries in each row. In particular, the inequality holds when $B$ is a convex combination of $B_1$ and $B_2$, where each of $B_1$ and $B_2$ is $N$ times a permutation matrix. How to proceed when $B$ is a convex combination of three or more such matrices is not clear.","I'd appreciate any suggestions for how to prove (or disprove) the inequality described below. Some notation first: for positive integers $k$ and $M$, let ${\mathcal D}_{k,M}$ denote the set of all $k \times k$ non-negative integer matrices with row and column sums all equal to $M$. For $k \times k$ matrices $A = [a_{i,j}]$ and $B = [b_{i,j}]$, we write $A \le B$ if $a_{i,j} \le b_{i,j}$ for all $i,j$. Now, let $M, N$ be fixed positive integers with $M < N$. I'd like to prove that for any $B \in \mathcal{D}_{k,N}$, we have $\displaystyle \sum_{A \in \mathcal{D}_{k,M}: A \le B} \prod_{i,j} \frac{\binom{b_{i,j}}{a_{i,j}}}{\binom{N-b_{i,j}}{M-a_{i,j}}} \ge {\binom{N}{M}}^{2k-k^2}$. It is easy to check that the inequality holds with equality when $B$ is $N$ times a permutation matrix. It is also straightforward to show that the inequality holds when $B$ has at most two non-zero entries in each row. In particular, the inequality holds when $B$ is a convex combination of $B_1$ and $B_2$, where each of $B_1$ and $B_2$ is $N$ times a permutation matrix. How to proceed when $B$ is a convex combination of three or more such matrices is not clear.",,"['matrices', 'inequality', 'binomial-coefficients']"
56,simple formula for det(AB-BA)?,simple formula for det(AB-BA)?,,"I was wondering whether there exists a simple formula for $\det(AB-BA)$ , given two square matrices $A$ and $B$ with coefficients in a commutative ring.","I was wondering whether there exists a simple formula for , given two square matrices and with coefficients in a commutative ring.",\det(AB-BA) A B,"['linear-algebra', 'matrices', 'determinant']"
57,Tools to bound the singular values of a finite sum of random matrices from below?,Tools to bound the singular values of a finite sum of random matrices from below?,,"Matrix Chernoff bounds (see also this arXiv paper ) are usually used to give upper bounds on the largest eigenvalue of a finite sum of random matrices. Sometimes it can also be used to give a lower bound on the smallest eigenvalue of a finite sum of random positive semidefinite (PSD) matrices. For PSD matrices, the eigenvalues are the same as the singular values. My question is: Is there any tool, or any other special cases (apart from the PSD case) for which there is a tool, to obtain lower bounds on the singular values of a finite sum of random matrices, or random symmetrical matrices?","Matrix Chernoff bounds (see also this arXiv paper ) are usually used to give upper bounds on the largest eigenvalue of a finite sum of random matrices. Sometimes it can also be used to give a lower bound on the smallest eigenvalue of a finite sum of random positive semidefinite (PSD) matrices. For PSD matrices, the eigenvalues are the same as the singular values. My question is: Is there any tool, or any other special cases (apart from the PSD case) for which there is a tool, to obtain lower bounds on the singular values of a finite sum of random matrices, or random symmetrical matrices?",,"['calculus', 'linear-algebra', 'matrices', 'inequality', 'concentration-of-measure']"
58,Second structural equations in lorentzian space $\Bbb L^3$.,Second structural equations in lorentzian space .,\Bbb L^3,"I'm rewriting O'Neill's ""Elementary Differential Geometry""'s section on connection forms in Lorentz-Minkowski space $\Bbb L^3$, and I'm having trouble proving the second structural equations $${\rm d}\omega_{ij} = \sum_k \omega_{ik} \wedge \omega_{\color{blue}{kj}}.$$ I'm using the signature $(+,+,-)$, that is, $$G = \begin{pmatrix} 1& 0 & 0 \\ 0 & 1 & 0 \\ 0 & 0  & -1\end{pmatrix}.$$ I know for a fact that this result is true, I've seen it in a more general form in his other book, ""The Geometry of Kerr Black Holes"". The proof there is overkill for what I'm doing here. Since these sign conventions are such a pain, I'll put the definitions I'm working with here, along with two useful results that I've proved: Definition: Given a frame field $\{{\bf E}_i\}_{i = 1}^3$, the $1$-forms defined by $$\omega_{ij}({\bf V}) = \epsilon_j \langle  \nabla_{\bf V}{\bf E}_i, {\bf E}_j \rangle$$ are called the connection    forms of the given frame field. Also, $\omega_{ij} = -\epsilon_i  \epsilon_j \omega_{ji}$, where $\epsilon_i = \langle {\bf E}_i,{\bf  E}_i\rangle$. Definition: Given a matrix $A = (a_{ij})_{1 \leq i,j \leq 3}$, where the $a_{ij}$ are functions, we define ${\rm d}A = ({\rm  d}a_{ij})_{1 \leq i,j \leq 3}$ and $A_\epsilon = (\epsilon_i  a_{ij})_{1 \leq i,j \leq 3}$. Theorem: Let $\{{\bf E}_i\}_{i = 1}^3$ be a frame field, and $A = (a_{ij})_{1 \leq i,j\leq 3}$ be its attitude matrix, that is, ${\bf E}_i = \sum_j a_{ij} \partial_j$. If $\omega = (\omega_{ij})_{1 \leq i,j \leq 3}$, then $$\omega = {\rm d}A \cdot GA_\epsilon^{ \ t},$$ where the product in    the right side is to be seen as the wedge product. Note: $A_\epsilon^{  \ t} \neq A_{\ \epsilon}^t$. Lemma: With notation as above: $$A \cdot GA_{\epsilon}^{\ t} = {\rm Id_3}.$$ With this I can go on. I have: $$\begin{align}\omega &=  {\rm d}A \cdot GA_\epsilon^{ \ t} \\ &\implies {\rm d}\omega = {\rm d}( {\rm d}A \cdot GA_\epsilon^{ \ t}) \\ &\implies {\rm d}\omega = -  {\rm d}A\cdot {\rm d}(GA_\epsilon^{\ t})  \\ &\implies {\rm d}\omega = - {\rm d}A \cdot G ({\rm d}A)_\epsilon^{\ t} \\ &\implies{\rm d}\omega = -{\rm d}A \cdot GA_{\epsilon}^{\ t} \cdot A \cdot G^t({\rm d}A)_\epsilon^{\ t} \\ &\implies {\rm d}\omega = -\omega \cdot ({\rm d}A)_\epsilon G A^t\end{align}.$$ Since I don't know how to go from here, I'll open both sides. Brace yourself, it'll be ugly. $$\begin{align} {\rm d}\omega_{ij} &= -\sum_k \omega_{ik} \wedge (({\rm d}A)_\epsilon G A^t)_{kj}\\ &= -\sum_k \omega_{ik} \wedge \left(\sum_l \epsilon_k {\rm d}a_{kl}(GA^t)_{lj}\right) \\ &= -\sum_k \epsilon_k\omega_{ik} \wedge \left(\sum_l {\rm d}a_{kl} (g_{l1}a_{j1} + g_{l2}a_{j2}+g_{l3}a_{j3})\right) \\  &= -\sum_k \epsilon_k \omega_{ik } \wedge ({\rm d}a_{k1}a_{j1}+{\rm d}a_{k2}a_{j2} - {\rm d}a_{k3}a_{j3}) \\ &= \sum_{k} \omega_{ik} \wedge (-\epsilon_k \epsilon_j \omega_{kj}) \\ &= \sum_k \omega_{ik} \wedge \omega_{\color{red}{jk}}\end{align}.$$ The indices are swapped in this last $\omega$ and I can't find the mistake. Please help.","I'm rewriting O'Neill's ""Elementary Differential Geometry""'s section on connection forms in Lorentz-Minkowski space $\Bbb L^3$, and I'm having trouble proving the second structural equations $${\rm d}\omega_{ij} = \sum_k \omega_{ik} \wedge \omega_{\color{blue}{kj}}.$$ I'm using the signature $(+,+,-)$, that is, $$G = \begin{pmatrix} 1& 0 & 0 \\ 0 & 1 & 0 \\ 0 & 0  & -1\end{pmatrix}.$$ I know for a fact that this result is true, I've seen it in a more general form in his other book, ""The Geometry of Kerr Black Holes"". The proof there is overkill for what I'm doing here. Since these sign conventions are such a pain, I'll put the definitions I'm working with here, along with two useful results that I've proved: Definition: Given a frame field $\{{\bf E}_i\}_{i = 1}^3$, the $1$-forms defined by $$\omega_{ij}({\bf V}) = \epsilon_j \langle  \nabla_{\bf V}{\bf E}_i, {\bf E}_j \rangle$$ are called the connection    forms of the given frame field. Also, $\omega_{ij} = -\epsilon_i  \epsilon_j \omega_{ji}$, where $\epsilon_i = \langle {\bf E}_i,{\bf  E}_i\rangle$. Definition: Given a matrix $A = (a_{ij})_{1 \leq i,j \leq 3}$, where the $a_{ij}$ are functions, we define ${\rm d}A = ({\rm  d}a_{ij})_{1 \leq i,j \leq 3}$ and $A_\epsilon = (\epsilon_i  a_{ij})_{1 \leq i,j \leq 3}$. Theorem: Let $\{{\bf E}_i\}_{i = 1}^3$ be a frame field, and $A = (a_{ij})_{1 \leq i,j\leq 3}$ be its attitude matrix, that is, ${\bf E}_i = \sum_j a_{ij} \partial_j$. If $\omega = (\omega_{ij})_{1 \leq i,j \leq 3}$, then $$\omega = {\rm d}A \cdot GA_\epsilon^{ \ t},$$ where the product in    the right side is to be seen as the wedge product. Note: $A_\epsilon^{  \ t} \neq A_{\ \epsilon}^t$. Lemma: With notation as above: $$A \cdot GA_{\epsilon}^{\ t} = {\rm Id_3}.$$ With this I can go on. I have: $$\begin{align}\omega &=  {\rm d}A \cdot GA_\epsilon^{ \ t} \\ &\implies {\rm d}\omega = {\rm d}( {\rm d}A \cdot GA_\epsilon^{ \ t}) \\ &\implies {\rm d}\omega = -  {\rm d}A\cdot {\rm d}(GA_\epsilon^{\ t})  \\ &\implies {\rm d}\omega = - {\rm d}A \cdot G ({\rm d}A)_\epsilon^{\ t} \\ &\implies{\rm d}\omega = -{\rm d}A \cdot GA_{\epsilon}^{\ t} \cdot A \cdot G^t({\rm d}A)_\epsilon^{\ t} \\ &\implies {\rm d}\omega = -\omega \cdot ({\rm d}A)_\epsilon G A^t\end{align}.$$ Since I don't know how to go from here, I'll open both sides. Brace yourself, it'll be ugly. $$\begin{align} {\rm d}\omega_{ij} &= -\sum_k \omega_{ik} \wedge (({\rm d}A)_\epsilon G A^t)_{kj}\\ &= -\sum_k \omega_{ik} \wedge \left(\sum_l \epsilon_k {\rm d}a_{kl}(GA^t)_{lj}\right) \\ &= -\sum_k \epsilon_k\omega_{ik} \wedge \left(\sum_l {\rm d}a_{kl} (g_{l1}a_{j1} + g_{l2}a_{j2}+g_{l3}a_{j3})\right) \\  &= -\sum_k \epsilon_k \omega_{ik } \wedge ({\rm d}a_{k1}a_{j1}+{\rm d}a_{k2}a_{j2} - {\rm d}a_{k3}a_{j3}) \\ &= \sum_{k} \omega_{ik} \wedge (-\epsilon_k \epsilon_j \omega_{kj}) \\ &= \sum_k \omega_{ik} \wedge \omega_{\color{red}{jk}}\end{align}.$$ The indices are swapped in this last $\omega$ and I can't find the mistake. Please help.",,"['matrices', 'differential-geometry', 'differential-forms', 'semi-riemannian-geometry']"
59,How does pointwise multiplication of two matrices affect their eigenvectors?,How does pointwise multiplication of two matrices affect their eigenvectors?,,"More specifically, suppose I have a known matrix $X\in\mathbb{R}^{d\times n}$ and an unkown vector $\alpha \in \mathbb{R}^n$. What can be said about the eigenvectors of $\alpha\alpha^T \odot X^T X$ in terms of the eigenvectors of $X^T X$? (The notation $\odot$ means $[A\odot B]_{ij}=A_{ij}B_{ij}$).","More specifically, suppose I have a known matrix $X\in\mathbb{R}^{d\times n}$ and an unkown vector $\alpha \in \mathbb{R}^n$. What can be said about the eigenvectors of $\alpha\alpha^T \odot X^T X$ in terms of the eigenvectors of $X^T X$? (The notation $\odot$ means $[A\odot B]_{ij}=A_{ij}B_{ij}$).",,"['linear-algebra', 'matrices', 'eigenvalues-eigenvectors']"
60,"If $n$ is even, every skew-symmetric $n\times n$ matrix $A$ can be factored as $A=SBS^T$","If  is even, every skew-symmetric  matrix  can be factored as",n n\times n A A=SBS^T,"If $n$ is even, every skew-symmetric $n\times n$ matrix $A$ can be factored as $A=SBS^T$ where $S$ is a invertible matrix and $B$ has the form $B = \left( \begin{array}{ccc} 0 & a_1 & 0 & 0 &0&0\\ -a_1 & 0 &0&0 &0&0\\ 0&0&0&a_{2}&0&0\\ 0 & 0&-a_{2}&0&0&0\\ 0&0&0&0&0&a_{n/2}\\ 0&0&0&0&-a_{n/2}&0 \end{array} \right)$ The $a_{n/2}$ is supposed to represent that $B$ can be any even $n\times n$ size (the size of $A$). So my book shows this result without proving it, and I was wondering why it's true. It doesn't seem clear to me why this specific factorization holds. How can you prove that it's true? What would $S$ or $S^T$ look like? Some useful results: If $E$ is an elementary matrix obtained from $I_n$ by carrying out one   elementary row operation on $I_n$, then $EA$ is a matrix obtained by   carrying out a single elementary row operation on $A$, and $AE$ is a   matrix obtained by carrying out a single elementary column operation   on $A$. $A$ is invertible iff it can be factored as a product of elementary   matrices: $A = E_1...E_m$.","If $n$ is even, every skew-symmetric $n\times n$ matrix $A$ can be factored as $A=SBS^T$ where $S$ is a invertible matrix and $B$ has the form $B = \left( \begin{array}{ccc} 0 & a_1 & 0 & 0 &0&0\\ -a_1 & 0 &0&0 &0&0\\ 0&0&0&a_{2}&0&0\\ 0 & 0&-a_{2}&0&0&0\\ 0&0&0&0&0&a_{n/2}\\ 0&0&0&0&-a_{n/2}&0 \end{array} \right)$ The $a_{n/2}$ is supposed to represent that $B$ can be any even $n\times n$ size (the size of $A$). So my book shows this result without proving it, and I was wondering why it's true. It doesn't seem clear to me why this specific factorization holds. How can you prove that it's true? What would $S$ or $S^T$ look like? Some useful results: If $E$ is an elementary matrix obtained from $I_n$ by carrying out one   elementary row operation on $I_n$, then $EA$ is a matrix obtained by   carrying out a single elementary row operation on $A$, and $AE$ is a   matrix obtained by carrying out a single elementary column operation   on $A$. $A$ is invertible iff it can be factored as a product of elementary   matrices: $A = E_1...E_m$.",,"['linear-algebra', 'matrices']"
61,Oscillation matrix whose $n-1$ power is totally positive,Oscillation matrix whose  power is totally positive,n-1,"Let $A$ be a $n\times n$ real matrix. If all the sub-determinant of $A$ is $\geq0$, then $A$ is called totally non-negative. If all the sub-determinant of $A$ is $>0$, then $A$ is called totally positive. If for a totally non-negative matrix $A$, there exists a positive integer $m$ such that $A^m$ is totally positive, then $A$ is called an oscillation matrix. Prove that if $A$ is an oscillation matrix, then $A^{n-1}$ is totally positive... I have no ideas...my god.","Let $A$ be a $n\times n$ real matrix. If all the sub-determinant of $A$ is $\geq0$, then $A$ is called totally non-negative. If all the sub-determinant of $A$ is $>0$, then $A$ is called totally positive. If for a totally non-negative matrix $A$, there exists a positive integer $m$ such that $A^m$ is totally positive, then $A$ is called an oscillation matrix. Prove that if $A$ is an oscillation matrix, then $A^{n-1}$ is totally positive... I have no ideas...my god.",,['matrices']
62,Seeking diagonal $D$ such that $AD^2B$ is positive definite (A and B are symmetric and p.d.),Seeking diagonal  such that  is positive definite (A and B are symmetric and p.d.),D AD^2B,"Let A,B be two real symmetric, non-commuting positive definite matrices. Then the product AB is not positive definite (in the sense that ${\bf x}^TAB{\bf x}$ may be anything). I'm trying to find conditions on a diagonal matrix D such that ${\bf x}^TAD^2B{\bf x}\geq 0$ for any nonzero real vector ${\bf x}$. I'm particularly interested in allowing $D$ to contain zeros. Then $AD^2B$ would be singular. I know that this is equivalent to proving that $AD^2B+BD^2A$ is symmetric and positive definite, but cannot get any further. Thanks for any help!","Let A,B be two real symmetric, non-commuting positive definite matrices. Then the product AB is not positive definite (in the sense that ${\bf x}^TAB{\bf x}$ may be anything). I'm trying to find conditions on a diagonal matrix D such that ${\bf x}^TAD^2B{\bf x}\geq 0$ for any nonzero real vector ${\bf x}$. I'm particularly interested in allowing $D$ to contain zeros. Then $AD^2B$ would be singular. I know that this is equivalent to proving that $AD^2B+BD^2A$ is symmetric and positive definite, but cannot get any further. Thanks for any help!",,"['linear-algebra', 'matrices']"
