,title_raw,title_text,title_latex,body_raw,body_text,body_latex,tags
63,Eigenvectors of difference of inverse matrices,Eigenvectors of difference of inverse matrices,,"I have two matrices $A$ and $B$, symmetric and positive semi-definite (in fact, they are covariance matrices), and I am interested in computing the eigenvectors of the matrix $A^{-1}-B^{-1}$. From numerical simulations, it appears that the eigenvectors of $A^{-1}-B^{-1}$ are often well approximated simply by the eigenvectors of $A-B$ . Moreover, if I regularize the matrices $A$ and $B$ before inverting them, by computing the matrix $(A+k\cdot I)^{-1} - (B+k\cdot I)^{-1} $ (where k is a positive constant, and $I$ is the identity matrix), the eigenvectors of $A-B$ provide an almost perfect approximation, especially if k is large. Is there a way to prove that the eigenvectors of $A-B$ are a good approximation of the eigenvectors of $A^{-1}-B^{-1}$ ? Edit : in light of your (very helpful) comments, I expanded my numerical tests to larger matrices, where I can see that it is not generally true that the eigenvectors of $A-B$ are close to those of $A^{-1}-B^{-1}$. However, this still works if I consider the ""regularized"" versions of $A$ and $B$, i.e. the eigenvectors of $A-B$ correspond to the eigenvectors of $(A+k\cdot I)^{-1} - (B+k\cdot I)^{-1} $ (where k is a large positive constant, and $I$ is the identity matrix). Is there any way to prove this? Edit 2 : I think I might have found the proof for this. There is a well known result that $(I-A)^{-1}= I+A+A^2+A^3+...$ (this can be shown by multiplying both sides by $I-A$). My expressions $A+k \cdot I$ can be rewritten as $\epsilon \cdot A +I$ (for small $\epsilon$), and so I can approximate $(\epsilon \cdot A +I)^{-1}$ with $I-A$ because I drop the following terms. Finally I have: $(A+k\cdot I)^{-1} - (B+k\cdot I)^{-1} = (\epsilon \cdot A+ I)^{-1} - (\epsilon \cdot B+ I)^{-1} = (I-A)-(I-B) = B-A$ Please let me know if you have any other insights about this, and thanks again for your help!","I have two matrices $A$ and $B$, symmetric and positive semi-definite (in fact, they are covariance matrices), and I am interested in computing the eigenvectors of the matrix $A^{-1}-B^{-1}$. From numerical simulations, it appears that the eigenvectors of $A^{-1}-B^{-1}$ are often well approximated simply by the eigenvectors of $A-B$ . Moreover, if I regularize the matrices $A$ and $B$ before inverting them, by computing the matrix $(A+k\cdot I)^{-1} - (B+k\cdot I)^{-1} $ (where k is a positive constant, and $I$ is the identity matrix), the eigenvectors of $A-B$ provide an almost perfect approximation, especially if k is large. Is there a way to prove that the eigenvectors of $A-B$ are a good approximation of the eigenvectors of $A^{-1}-B^{-1}$ ? Edit : in light of your (very helpful) comments, I expanded my numerical tests to larger matrices, where I can see that it is not generally true that the eigenvectors of $A-B$ are close to those of $A^{-1}-B^{-1}$. However, this still works if I consider the ""regularized"" versions of $A$ and $B$, i.e. the eigenvectors of $A-B$ correspond to the eigenvectors of $(A+k\cdot I)^{-1} - (B+k\cdot I)^{-1} $ (where k is a large positive constant, and $I$ is the identity matrix). Is there any way to prove this? Edit 2 : I think I might have found the proof for this. There is a well known result that $(I-A)^{-1}= I+A+A^2+A^3+...$ (this can be shown by multiplying both sides by $I-A$). My expressions $A+k \cdot I$ can be rewritten as $\epsilon \cdot A +I$ (for small $\epsilon$), and so I can approximate $(\epsilon \cdot A +I)^{-1}$ with $I-A$ because I drop the following terms. Finally I have: $(A+k\cdot I)^{-1} - (B+k\cdot I)^{-1} = (\epsilon \cdot A+ I)^{-1} - (\epsilon \cdot B+ I)^{-1} = (I-A)-(I-B) = B-A$ Please let me know if you have any other insights about this, and thanks again for your help!",,"['linear-algebra', 'matrices', 'eigenvalues-eigenvectors', 'inverse']"
64,"Looking for an algo to ""sorta"" diagonalize a similarity matrix.","Looking for an algo to ""sorta"" diagonalize a similarity matrix.",,"I've got a big fat similarity matrix. The rows and columns represent people, and the values represent some positive measure of their closeness (0 meaning no connection at all). The n-th row and n-th colum corresponds to the same person - thus the matrix is square. I'm looking for an algorithm to find some permutation of rows/columns such that the resulting matrix has as much ""mass"" aligned towards the diagonal as possible. The goal is find a matrix so that average closeness of neighbors (neighboring rows/columns) is maximized. The ultimate goal is to use this as a sort of clustering algorithm.","I've got a big fat similarity matrix. The rows and columns represent people, and the values represent some positive measure of their closeness (0 meaning no connection at all). The n-th row and n-th colum corresponds to the same person - thus the matrix is square. I'm looking for an algorithm to find some permutation of rows/columns such that the resulting matrix has as much ""mass"" aligned towards the diagonal as possible. The goal is find a matrix so that average closeness of neighbors (neighboring rows/columns) is maximized. The ultimate goal is to use this as a sort of clustering algorithm.",,"['matrices', 'algorithms', 'clustering']"
65,Does there exist a finite axiomatization of the quasi-algebraic theory of real matrix rings?,Does there exist a finite axiomatization of the quasi-algebraic theory of real matrix rings?,,"Some definitions. Let us take the signature of ring theory to consist of the function symbols $\{+,-,0,\cdot,1\}$ equipped with their usual airities, where the minus symbol represents a unary operation. Write $\mathrm{E}$ for the set of all equations in the language of rings. By the quasi-algebraic language of rings, let us mean the following set of formulae. $$L = E \cup \bigcup_{n \geq 1}\{\varphi_0,\ldots,\varphi_{n-1} \rightarrow \psi \mid  (\forall i < n)(\varphi_i \in E) \wedge (\psi  \in E)\}.$$ By the quasi-algebraic theory of real matrix rings, let us mean the set $T$ of all $q \in L$ such that for every natural number $n \geq 1$, every subring of the matrix ring $M_n(\mathbb{R})$ is a model for $q$. Actually, since the formulae of interest are downward-absolute, there is no need to consider subrings at all; in particular, $T$ can be described as the set of all $q \in L$ such that for every natural number $n \geq 1$, the matrix ring $M_n(\mathbb{R})$ is a model for $q$. For example, the formula $xy=1 \rightarrow yx=1$ is an element of $T$. Question. Does there exist a finite axiomatization of $T$? If so, an explicit list of axioms would be much appreciated.","Some definitions. Let us take the signature of ring theory to consist of the function symbols $\{+,-,0,\cdot,1\}$ equipped with their usual airities, where the minus symbol represents a unary operation. Write $\mathrm{E}$ for the set of all equations in the language of rings. By the quasi-algebraic language of rings, let us mean the following set of formulae. $$L = E \cup \bigcup_{n \geq 1}\{\varphi_0,\ldots,\varphi_{n-1} \rightarrow \psi \mid  (\forall i < n)(\varphi_i \in E) \wedge (\psi  \in E)\}.$$ By the quasi-algebraic theory of real matrix rings, let us mean the set $T$ of all $q \in L$ such that for every natural number $n \geq 1$, every subring of the matrix ring $M_n(\mathbb{R})$ is a model for $q$. Actually, since the formulae of interest are downward-absolute, there is no need to consider subrings at all; in particular, $T$ can be described as the set of all $q \in L$ such that for every natural number $n \geq 1$, the matrix ring $M_n(\mathbb{R})$ is a model for $q$. For example, the formula $xy=1 \rightarrow yx=1$ is an element of $T$. Question. Does there exist a finite axiomatization of $T$? If so, an explicit list of axioms would be much appreciated.",,"['matrices', 'logic', 'ring-theory']"
66,"Solving a linear equation for a symmetric,positive matrix","Solving a linear equation for a symmetric,positive matrix",,"Given the Problem $A x = b$ for some regular matrix $A \in \mathbb{R}^{n \times n}$ and $b\in\mathbb{R}^n$. One can compute $x$ with the Cholesky factorization in $O(n^3)$. If $A$ is known to be a symmetric, positive (i.e. $A_{ij} >0$) and positive definite matrix, is it possible to solve $Ax = b$ faster than $O(n^3)$?","Given the Problem $A x = b$ for some regular matrix $A \in \mathbb{R}^{n \times n}$ and $b\in\mathbb{R}^n$. One can compute $x$ with the Cholesky factorization in $O(n^3)$. If $A$ is known to be a symmetric, positive (i.e. $A_{ij} >0$) and positive definite matrix, is it possible to solve $Ax = b$ faster than $O(n^3)$?",,['matrices']
67,When does a strictly diagonally dominant matrix have dominant principal minors?,When does a strictly diagonally dominant matrix have dominant principal minors?,,"$A$ is an $N\times N$ matrix with diagonal elements $a_{ii}=1-s_{i}$, and off diagonal elements $a_{ij}=s_{i}w_{ij}$ for $i≠j$. Assume $0≤s_{i}<1/2$ and $\sum_{j≠i}w_{ij}=1$ for all $i$ and $0≤w_{ij}≤1$. As $1-s_{i}>∑_{j≠i}a_{ij}=s_{i}∑_{j≠i}w_{ij}$ for all $i$, matrix $A$ is strictly row diagonally dominant. Thus, $\det(A)>0$ and has positive principal minors, $M_{ii}$ where $ii$ is the submatrix from eliminating row $i$ and column $i$. (see Tsatsomeros 2002 ). There exists an inverse matrix $B=A^{-1}$. I want to show that the diagonal elements $b_{ii}=\frac{M_{ii}}{\det(A)} > 1$. I am able to show this for $N=3$ and $4$. For example, by expanding across the top gives $b_{11}>1$ as $M_{11}>-ω_{12}M_{12}+ω_{13}M_{13}-ω_{14}M_{14}$ , which follows from $M_{11}>‖M_{1j}‖_{j≠1}$. Here the results follows if the principal minor is dominant in the sense of being larger than the minors along the same row. I do not know how to extend this to $N>4$ and have not found the result in my imperfect search of the literature.","$A$ is an $N\times N$ matrix with diagonal elements $a_{ii}=1-s_{i}$, and off diagonal elements $a_{ij}=s_{i}w_{ij}$ for $i≠j$. Assume $0≤s_{i}<1/2$ and $\sum_{j≠i}w_{ij}=1$ for all $i$ and $0≤w_{ij}≤1$. As $1-s_{i}>∑_{j≠i}a_{ij}=s_{i}∑_{j≠i}w_{ij}$ for all $i$, matrix $A$ is strictly row diagonally dominant. Thus, $\det(A)>0$ and has positive principal minors, $M_{ii}$ where $ii$ is the submatrix from eliminating row $i$ and column $i$. (see Tsatsomeros 2002 ). There exists an inverse matrix $B=A^{-1}$. I want to show that the diagonal elements $b_{ii}=\frac{M_{ii}}{\det(A)} > 1$. I am able to show this for $N=3$ and $4$. For example, by expanding across the top gives $b_{11}>1$ as $M_{11}>-ω_{12}M_{12}+ω_{13}M_{13}-ω_{14}M_{14}$ , which follows from $M_{11}>‖M_{1j}‖_{j≠1}$. Here the results follows if the principal minor is dominant in the sense of being larger than the minors along the same row. I do not know how to extend this to $N>4$ and have not found the result in my imperfect search of the literature.",,['matrices']
68,What is the connection between $\rho$ and $\sigma$ if $\rho\rho^T=\sigma\sigma^T$?,What is the connection between  and  if ?,\rho \sigma \rho\rho^T=\sigma\sigma^T,"I want to prove that there exists a Borel function $R(\rho,\sigma)$ with values in $M^{d\times d}$ defined on $D=\lbrace(\rho,\sigma)\in M^{d\times d}\times M^{d\times d}\,: \rho\rho^T=\sigma\sigma^T\rbrace$ such that $\sigma=\rho R(\rho,\sigma)$ and $RR^T=I$. My idea is: Diagonalize $\rho\rho^T=\sigma\sigma^T=QDQ^T$ where Q is an orthogonal matrix. It's obvious that $\sigma=UQ\sqrt{D}$ with U orthogonal matrix satisfies the request but is this the only possibility? I would appreciate any possible help. Thank you in advance.","I want to prove that there exists a Borel function $R(\rho,\sigma)$ with values in $M^{d\times d}$ defined on $D=\lbrace(\rho,\sigma)\in M^{d\times d}\times M^{d\times d}\,: \rho\rho^T=\sigma\sigma^T\rbrace$ such that $\sigma=\rho R(\rho,\sigma)$ and $RR^T=I$. My idea is: Diagonalize $\rho\rho^T=\sigma\sigma^T=QDQ^T$ where Q is an orthogonal matrix. It's obvious that $\sigma=UQ\sqrt{D}$ with U orthogonal matrix satisfies the request but is this the only possibility? I would appreciate any possible help. Thank you in advance.",,"['linear-algebra', 'matrices', 'numerical-methods']"
69,How to find the rank of a Toeplitz matrix?,How to find the rank of a Toeplitz matrix?,,Is there any trick to compute or estimate the rank of a Toeplitz matrix? Or is this still unknown for a general Toeplitz matrix?,Is there any trick to compute or estimate the rank of a Toeplitz matrix? Or is this still unknown for a general Toeplitz matrix?,,"['linear-algebra', 'matrices', 'numerical-linear-algebra', 'matrix-rank', 'toeplitz-matrices']"
70,Expectation of the absolut value of the determinant of a random matrix,Expectation of the absolut value of the determinant of a random matrix,,Let $A$ be a random matrix of size $m\times m$ with integer entries $-n\ldots n$. Each value should have the same  probability. What is the expectation of the random variable $$X := |\det A|$$ Can the variance of $X$ also be calculated ?,Let $A$ be a random matrix of size $m\times m$ with integer entries $-n\ldots n$. Each value should have the same  probability. What is the expectation of the random variable $$X := |\det A|$$ Can the variance of $X$ also be calculated ?,,"['matrices', 'statistics', 'determinant']"
71,Probability that a random integer matrix is singular,Probability that a random integer matrix is singular,,"Let $A$ be a $n\times n$-matrix with integers in the range $u..v$ , where $u<v$ are arbitary   integers. Is there a formula, or at least, a good estimate, for the probability  that the matrix is singular? In the case $u=v$, the answer is obviously $1$. It is intuitively clear, that the probability very quickly tends to $0$, if the range  increases. As I tried, the probability that a $4\times4$-matrix with integers from $-100..100$  is singular is very small indeed. Of course, brute force is hopeless, a simulation  would give crude approximations. I prefer suitable bounds.","Let $A$ be a $n\times n$-matrix with integers in the range $u..v$ , where $u<v$ are arbitary   integers. Is there a formula, or at least, a good estimate, for the probability  that the matrix is singular? In the case $u=v$, the answer is obviously $1$. It is intuitively clear, that the probability very quickly tends to $0$, if the range  increases. As I tried, the probability that a $4\times4$-matrix with integers from $-100..100$  is singular is very small indeed. Of course, brute force is hopeless, a simulation  would give crude approximations. I prefer suitable bounds.",,"['matrices', 'determinant']"
72,Sum of Nonnegative Matrix and Diagonal Matrix,Sum of Nonnegative Matrix and Diagonal Matrix,,"Setup: Let $D = D^T > 0$ be a positive definite and diagonal $n\times n$ matrix, and let $A = A^T \in \mathbb{R}^{n\times n}$ be nonnegative with zero diagonals. That is, $a_{ij} \geq 0$ for $i\neq j$ and $a_{ii} = 0$. In my particular case, $A$ is an adjacency matrix of an undirected graph. Question : Give necessary and sufficient conditions under which $D - A$ positive definite. Failing that, what's a necessary condition so I can understand the possible gap between necessity and sufficiency. Partial Answer : A sufficient, but I believe not necessary, condition is that $\min_i D_{ii} > \rho(A) = \lambda_{\rm max}(A)$, where the last equality follows from the Perron theorem. From the Disc Theorem, another sufficient condition is that $D_{ii} \geq \sum_{j=1}^n a_{ij}$ with strict inequality in at least one row. Happy Thinking, -John","Setup: Let $D = D^T > 0$ be a positive definite and diagonal $n\times n$ matrix, and let $A = A^T \in \mathbb{R}^{n\times n}$ be nonnegative with zero diagonals. That is, $a_{ij} \geq 0$ for $i\neq j$ and $a_{ii} = 0$. In my particular case, $A$ is an adjacency matrix of an undirected graph. Question : Give necessary and sufficient conditions under which $D - A$ positive definite. Failing that, what's a necessary condition so I can understand the possible gap between necessity and sufficiency. Partial Answer : A sufficient, but I believe not necessary, condition is that $\min_i D_{ii} > \rho(A) = \lambda_{\rm max}(A)$, where the last equality follows from the Perron theorem. From the Disc Theorem, another sufficient condition is that $D_{ii} \geq \sum_{j=1}^n a_{ij}$ with strict inequality in at least one row. Happy Thinking, -John",,"['linear-algebra', 'matrices', 'algebraic-graph-theory', 'matrix-decomposition']"
73,"What is the maximal torus in the Lorentz group $O(m,n)$?",What is the maximal torus in the Lorentz group ?,"O(m,n)","I'm close to certain it's just the product of the maximal tori of $O(m)$ and $O(n)$, but I can't quite prove it. I've tried the following: $\newcommand{\mattwo}[4]{\left(\begin{array}{cc}#1&#2\\#3&#4\end{array}\right)}$ Any element of the Lorentz group can be decomposed into $$\mattwo{P}{0}{0}{Q}\exp\mattwo{0}{X}{X^T}{0}$$ Where $P, Q$ are orthogonal block matrices, $P\in O(m)$, $Q\in O(n)$. So we can definitely pick maximal tori in $P$ and $Q$ (call them $T_1, T_2$), and $T_1\times T_2$ will definitely be a torus in $O(m,n)$. To prove it's maximal, assume not. I try to find a contradiction using the fact that tori must be abelian. That's where things get a little ugly. Take an arbitrary element $\mattwo{P'}{0}{0}{Q'}\exp\mattwo{0}{X}{X^T}{0}\in O(m,n)$ and supposed for the sake of contradiction that it lives in a larger torus containing $T_1\times T_2$. Then it must commute with every element in $T_1\times T_2$. This means for every $P\in T_1, Q\in T_2$, we must have $$\mattwo{P}{0}{0}{Q}\mattwo{P'}{0}{0}{Q'}\exp\mattwo{0}{X}{X^T}{0}=\mattwo{P'}{0}{0}{Q'}\exp\mattwo{0}{X}{X^T}{0}\mattwo{P}{0}{0}{Q}$$ Knowing that $\exp\mattwo{0}{X}{X^T}{0}$ is symmetric, we can say $$\exp\mattwo{0}{X}{X^T}{0}=\mattwo{X_1}{X_2}{X_2^T}{X_3}$$ Which multiplies out to $$\mattwo{PP'X_1}{PP'X_2}{QQ'X_2^T}{QQ'X_3}=\mattwo{P'X_1P}{P'X_2Q}{Q'X_2^TP}{Q'X_3Q}$$ and this gives us \begin{align*} PP'X_1&=P'X_1P\\ PP'X_2&=P'X_2Q\\ QQ'X_2^T&=Q'X_2^TP\\ QQ'X_3&=Q'X_3Q\\ \end{align*} which must hold for every $P\in T_1, Q\in T_2$. This seems like it would be a strict enough set of four equations that would force $\exp\mattwo{0}{X}{X^T}{0}=\mattwo{1}{0}{0}{1}$, which would then force $P'\in T_1$, $Q'\in T_2$, but I can't for the life of me get the four equations to imply that.","I'm close to certain it's just the product of the maximal tori of $O(m)$ and $O(n)$, but I can't quite prove it. I've tried the following: $\newcommand{\mattwo}[4]{\left(\begin{array}{cc}#1&#2\\#3&#4\end{array}\right)}$ Any element of the Lorentz group can be decomposed into $$\mattwo{P}{0}{0}{Q}\exp\mattwo{0}{X}{X^T}{0}$$ Where $P, Q$ are orthogonal block matrices, $P\in O(m)$, $Q\in O(n)$. So we can definitely pick maximal tori in $P$ and $Q$ (call them $T_1, T_2$), and $T_1\times T_2$ will definitely be a torus in $O(m,n)$. To prove it's maximal, assume not. I try to find a contradiction using the fact that tori must be abelian. That's where things get a little ugly. Take an arbitrary element $\mattwo{P'}{0}{0}{Q'}\exp\mattwo{0}{X}{X^T}{0}\in O(m,n)$ and supposed for the sake of contradiction that it lives in a larger torus containing $T_1\times T_2$. Then it must commute with every element in $T_1\times T_2$. This means for every $P\in T_1, Q\in T_2$, we must have $$\mattwo{P}{0}{0}{Q}\mattwo{P'}{0}{0}{Q'}\exp\mattwo{0}{X}{X^T}{0}=\mattwo{P'}{0}{0}{Q'}\exp\mattwo{0}{X}{X^T}{0}\mattwo{P}{0}{0}{Q}$$ Knowing that $\exp\mattwo{0}{X}{X^T}{0}$ is symmetric, we can say $$\exp\mattwo{0}{X}{X^T}{0}=\mattwo{X_1}{X_2}{X_2^T}{X_3}$$ Which multiplies out to $$\mattwo{PP'X_1}{PP'X_2}{QQ'X_2^T}{QQ'X_3}=\mattwo{P'X_1P}{P'X_2Q}{Q'X_2^TP}{Q'X_3Q}$$ and this gives us \begin{align*} PP'X_1&=P'X_1P\\ PP'X_2&=P'X_2Q\\ QQ'X_2^T&=Q'X_2^TP\\ QQ'X_3&=Q'X_3Q\\ \end{align*} which must hold for every $P\in T_1, Q\in T_2$. This seems like it would be a strict enough set of four equations that would force $\exp\mattwo{0}{X}{X^T}{0}=\mattwo{1}{0}{0}{1}$, which would then force $P'\in T_1$, $Q'\in T_2$, but I can't for the life of me get the four equations to imply that.",,"['algebraic-topology', 'group-theory', 'matrices', 'lie-groups']"
74,Can these two matrices be represented as diagonal matrices with respect to an orthonormal basis?,Can these two matrices be represented as diagonal matrices with respect to an orthonormal basis?,,"I'm having difficulty understand some questions. I will highlight the terms I do not understand. Question 1: Let $A =\begin{pmatrix}  1& -2 \\   1& 3 \end{pmatrix}$ For the matrix $A$, decide whether there is an orthonormal basis $B$ for $\mathbb{C}^2$ such that the matrix of $A: \mathbb{C}^2 \rightarrow \mathbb{C}^2$ with respect to $B$ is diagonal. If so, find such a basis and write down a unitary matrix $P$ such that $\overline{P}^TAP$ is diagonal. What I think we need to do: In class, we have learnt the following theorem - ""Spectral Theorem for normal operators"" Suppose that $V$ is an $n$-dimensional inner product space over $\mathbb{C}$ and that $T: V \rightarrow V$ is a linear map and is normal. Then there is an orthonormal basis for $V$ consisting of eigenvalues of $T$. In particular, if $A \in M_{n}(\mathbb{C})$ is normal then there is an unitary matrix $P \in M_{n}(\mathbb{C})$ such that $P^{*}AP$ is diagonal. My guess is we need to apply this theorem in some way? Now some terms I am having difficulty understanding is this sentence. ""Orthonormal basis $B$ for $\mathbb{C}^2$ such that the matrix of $A: \mathbb{C}^2 \rightarrow \mathbb{C}^2$ with respect to $B$"". I understand what an orthonormal basis is but not sure about the rest of the sentence. Question 2 (looks similar). This question is in an exam past test BUT not a continuation from the last question above. Let $A =\begin{pmatrix}  0& 1 \\   1& 0 \end{pmatrix}$ For the matrix $A$, decide whether there is an orthonormal basis $B$ for $\mathbb{R}^2$ such that the matrix of $A: \mathbb{R}^2 \rightarrow \mathbb{R}^2$ with respect to $B$ is diagonal. If so, find such a basis and write down an orthogonal matrix $P$ such that $P^TAP$ is diagonal. So question two looks similar to 1) but we are asked for an orthogonal matrix instead of a unitary matrix. I understand what these two terms mean. Other than that I have no clue on how to start these questions. If anyone can help me get started that would be great.","I'm having difficulty understand some questions. I will highlight the terms I do not understand. Question 1: Let $A =\begin{pmatrix}  1& -2 \\   1& 3 \end{pmatrix}$ For the matrix $A$, decide whether there is an orthonormal basis $B$ for $\mathbb{C}^2$ such that the matrix of $A: \mathbb{C}^2 \rightarrow \mathbb{C}^2$ with respect to $B$ is diagonal. If so, find such a basis and write down a unitary matrix $P$ such that $\overline{P}^TAP$ is diagonal. What I think we need to do: In class, we have learnt the following theorem - ""Spectral Theorem for normal operators"" Suppose that $V$ is an $n$-dimensional inner product space over $\mathbb{C}$ and that $T: V \rightarrow V$ is a linear map and is normal. Then there is an orthonormal basis for $V$ consisting of eigenvalues of $T$. In particular, if $A \in M_{n}(\mathbb{C})$ is normal then there is an unitary matrix $P \in M_{n}(\mathbb{C})$ such that $P^{*}AP$ is diagonal. My guess is we need to apply this theorem in some way? Now some terms I am having difficulty understanding is this sentence. ""Orthonormal basis $B$ for $\mathbb{C}^2$ such that the matrix of $A: \mathbb{C}^2 \rightarrow \mathbb{C}^2$ with respect to $B$"". I understand what an orthonormal basis is but not sure about the rest of the sentence. Question 2 (looks similar). This question is in an exam past test BUT not a continuation from the last question above. Let $A =\begin{pmatrix}  0& 1 \\   1& 0 \end{pmatrix}$ For the matrix $A$, decide whether there is an orthonormal basis $B$ for $\mathbb{R}^2$ such that the matrix of $A: \mathbb{R}^2 \rightarrow \mathbb{R}^2$ with respect to $B$ is diagonal. If so, find such a basis and write down an orthogonal matrix $P$ such that $P^TAP$ is diagonal. So question two looks similar to 1) but we are asked for an orthogonal matrix instead of a unitary matrix. I understand what these two terms mean. Other than that I have no clue on how to start these questions. If anyone can help me get started that would be great.",,"['linear-algebra', 'matrices', 'diagonalization']"
75,Determinant of triangular matrix except for one column (atomic/Gauss/Frobenius),Determinant of triangular matrix except for one column (atomic/Gauss/Frobenius),,"Is there some ""smart"" way to calculate determinants that look like this? $\begin{vmatrix}-1&a_{1,2}&a_{1,3}&a_{1,4}&\cdots&a_{1,m-1}&a_{1,m} \\-1&a_{2,2}&a_{2,3}&a_{2,4}&\cdots&a_{2,m-1}&a_{2,m} \\-1&0&a_{3,3}&a_{3,3}&\cdots&a_{3,m-1}&a_{3,m} \\-1&0&0&a_{4,4}&\cdots&a_{4,m-1}&a_{4,m}  \\-1&0&0&0&\cdots&a_{5,m-1}&a_{5,m}  \\\vdots&\vdots&\vdots&\vdots&\ddots&\vdots&\vdots \\-1&0&0&0&0&a_{m-1,m-1}&a_{m-1,m} \\-1&0&0&0&0&0&a_{m,m} \end{vmatrix} $ It's a special case of an atomic triangular matrix / Gauss matrix / Gauss transformation matrix / Frobenius matrix.","Is there some ""smart"" way to calculate determinants that look like this? $\begin{vmatrix}-1&a_{1,2}&a_{1,3}&a_{1,4}&\cdots&a_{1,m-1}&a_{1,m} \\-1&a_{2,2}&a_{2,3}&a_{2,4}&\cdots&a_{2,m-1}&a_{2,m} \\-1&0&a_{3,3}&a_{3,3}&\cdots&a_{3,m-1}&a_{3,m} \\-1&0&0&a_{4,4}&\cdots&a_{4,m-1}&a_{4,m}  \\-1&0&0&0&\cdots&a_{5,m-1}&a_{5,m}  \\\vdots&\vdots&\vdots&\vdots&\ddots&\vdots&\vdots \\-1&0&0&0&0&a_{m-1,m-1}&a_{m-1,m} \\-1&0&0&0&0&0&a_{m,m} \end{vmatrix} $ It's a special case of an atomic triangular matrix / Gauss matrix / Gauss transformation matrix / Frobenius matrix.",,"['linear-algebra', 'matrices', 'determinant']"
