,title_raw,title_text,title_latex,body_raw,body_text,body_latex,tags
0,why does $\frac{1}{z\cdot \sin{z}} $ only have pole when clearly its undefined at $n\pi$,why does  only have pole when clearly its undefined at,\frac{1}{z\cdot \sin{z}}  n\pi,"I am having trouble with a specific problem actually. I have a function $$f(z) = \frac{1}{z\cdot \sin{z}}$$ Now I want to find the residues of this. The Laurent series expanded about $0$ shows that $0$ is a pole of order $2$. The expansion looks something like this $$\frac{1}{z^2}+\frac{1}{6} + \frac{7z^2}{360} +  \cdots $$ so since the first coefficient of $z$ is just zero, the residue of this function is $0$. BUT I want to know why zero is the ONLY pole. Clearly $2\pi$ is a singularity point. Then when you expand about $2\pi$ you get the following expansion $$\frac{1}{2\pi (z - 2\pi)} - \frac{1}{4\pi^2} + \frac{(3+2\pi^2)(z-2\pi)}{24\pi^3} + \cdots $$ Again, it looks to me that the first negative power of $z$ has the coefficient $\frac{1}{2\pi}$. So why is it that when I type in ""poles of function 1/(z*sin(z))"" wolfram only identifies 0 as the pole. If I type in ""poles of function 1/(sin(z))"" then it identifies the poles as $n\pi$. Furthermore if you type in ""residues of 1/(z*sin(z))"" it only identifies 0 as a residue when we just saw above that $\frac{1}{2\pi}$ is also a residue. Whats even more weird is that if you type in ""residues of 1/(z*sin(z)) at 2pi"" it does give the right residue. Weird.","I am having trouble with a specific problem actually. I have a function $$f(z) = \frac{1}{z\cdot \sin{z}}$$ Now I want to find the residues of this. The Laurent series expanded about $0$ shows that $0$ is a pole of order $2$. The expansion looks something like this $$\frac{1}{z^2}+\frac{1}{6} + \frac{7z^2}{360} +  \cdots $$ so since the first coefficient of $z$ is just zero, the residue of this function is $0$. BUT I want to know why zero is the ONLY pole. Clearly $2\pi$ is a singularity point. Then when you expand about $2\pi$ you get the following expansion $$\frac{1}{2\pi (z - 2\pi)} - \frac{1}{4\pi^2} + \frac{(3+2\pi^2)(z-2\pi)}{24\pi^3} + \cdots $$ Again, it looks to me that the first negative power of $z$ has the coefficient $\frac{1}{2\pi}$. So why is it that when I type in ""poles of function 1/(z*sin(z))"" wolfram only identifies 0 as the pole. If I type in ""poles of function 1/(sin(z))"" then it identifies the poles as $n\pi$. Furthermore if you type in ""residues of 1/(z*sin(z))"" it only identifies 0 as a residue when we just saw above that $\frac{1}{2\pi}$ is also a residue. Whats even more weird is that if you type in ""residues of 1/(z*sin(z)) at 2pi"" it does give the right residue. Weird.",,['complex-analysis']
1,Examples of non-Riemann surfaces?,Examples of non-Riemann surfaces?,,"While studying Complex Analysis, I have come across Riemann Surfaces: http://mathworld.wolfram.com/RiemannSurface.html Can anyone please provide some examples of non-Riemannable surfaces? Thanks a lot!","While studying Complex Analysis, I have come across Riemann Surfaces: http://mathworld.wolfram.com/RiemannSurface.html Can anyone please provide some examples of non-Riemannable surfaces? Thanks a lot!",,"['complex-analysis', 'riemann-surfaces']"
2,"How to prove that $\cos^2(z)+\sin^2(z)=1$, where $z$ is a complex variable (if it is true)?","How to prove that , where  is a complex variable (if it is true)?",\cos^2(z)+\sin^2(z)=1 z,"Can someone show me: If $x$ is a real number, then $\cos^2(x)+\sin^2(x)= 1$. Is it true that $\cos^2(z)+\sin^2(z)=1$, where $z$ is a complex variable? Note :look [this  ] in wolfram alpha showed that's true !!!! Thank you for your help","Can someone show me: If $x$ is a real number, then $\cos^2(x)+\sin^2(x)= 1$. Is it true that $\cos^2(z)+\sin^2(z)=1$, where $z$ is a complex variable? Note :look [this  ] in wolfram alpha showed that's true !!!! Thank you for your help",,"['complex-analysis', 'trigonometry', 'complex-numbers']"
3,A Möbius transformation maps circles and lines to circles and lines. What exactly does that mean?,A Möbius transformation maps circles and lines to circles and lines. What exactly does that mean?,,"The title pretty much says it all. I am also looking for a concrete example if possible. I have looked at the proof, but I'm not exactly sure what it means because I am kind of confused on what the theorem actually says. Does it mean that if g(z) is a circle and f(z) is a Möbius transformation then f(g(z)) is a circle as well?","The title pretty much says it all. I am also looking for a concrete example if possible. I have looked at the proof, but I'm not exactly sure what it means because I am kind of confused on what the theorem actually says. Does it mean that if g(z) is a circle and f(z) is a Möbius transformation then f(g(z)) is a circle as well?",,"['complex-analysis', 'analysis', 'transformation']"
4,"If $f$ is holomorphic and $\,f'' = f$, then $f(z) = A \cosh z + B \sinh z$","If  is holomorphic and , then","f \,f'' = f f(z) = A \cosh z + B \sinh z","Suppose $f$ is holomorphic in a disk centered at the origin and $f$ satisfies the differential equation $$f'' = f.$$ Show that $f$ is of the form $$f(z)=A \sinh z + B \cosh z,$$ for suitable constants $A,B\in \mathbb C$. Of course if $f$ were a function of one real variable, usual techniques to solve linear homogeneous differential equations ( characteristic equations and so on) would quickly solve the problem. But using the same train of thought here, $f$ is a function of two real variables ($z = x + iy$), and so the same techniques cannot be applied directly. This is really a complex analysis problem.","Suppose $f$ is holomorphic in a disk centered at the origin and $f$ satisfies the differential equation $$f'' = f.$$ Show that $f$ is of the form $$f(z)=A \sinh z + B \cosh z,$$ for suitable constants $A,B\in \mathbb C$. Of course if $f$ were a function of one real variable, usual techniques to solve linear homogeneous differential equations ( characteristic equations and so on) would quickly solve the problem. But using the same train of thought here, $f$ is a function of two real variables ($z = x + iy$), and so the same techniques cannot be applied directly. This is really a complex analysis problem.",,"['complex-analysis', 'analysis', 'ordinary-differential-equations', 'analyticity', 'hyperbolic-functions']"
5,Symbolic definition for $i$?,Symbolic definition for ?,i,"Please help! I am trying to find a definition for $i$ that doesn't work for $-i$ . let $j$ be either $i$ or $-i$ . saying $j^2=-1$ doesn't help since $(i)^2=-1$ and $(-i)^2 = -1$ saying $j=\sqrt{-1}$ doesn't halp since $(-1)^{\frac{1}{2}}$ is multivalued $i$ and $-i$ saying $j=e^{i\pi/2}$ doesnt help since $e^{i\pi/2}=i$ but $e^{(-i)\pi/2}=-i$ too (yeah I know I said j= $e^{i\pi/2}$ and not $j=e^{j\pi/2}$ I did that to hopefully make it more intuitive) saying $j=ln(i)/(\pi/2)$ doesn't work since $i=ln(i)/(\pi/2)$ and $-i=ln(-i)/(pi/2)$ (check with a phase plotter, ln is multivalued but includes i and -i in their respective functions shown above http://davidbau.com/conformal/#log(z)%2F(pi%2F2)-z ) saying $Im(j) > 0$ doesn't work because $Im(z)=Re(z/i)$ and $Re(i/i)>0$ but $Re((-i)/(-i))>0$ Is this parity some sort of law? And yet $i\neq-i$ since $i=(-1)\cdot(-i)$ . Unless... Post Scriptum: Irionically, it is very easy to symbolically represent $1$ vs $-1$ even though $(1)^2=1$ and $(-1)^2=1$ , we can just say $x$ such that $x=x^2$ EDIT: can quaternions help? Is $i$ a set of 2 numbers? Are they always equal?","Please help! I am trying to find a definition for that doesn't work for . let be either or . saying doesn't help since and saying doesn't halp since is multivalued and saying doesnt help since but too (yeah I know I said j= and not I did that to hopefully make it more intuitive) saying doesn't work since and (check with a phase plotter, ln is multivalued but includes i and -i in their respective functions shown above http://davidbau.com/conformal/#log(z)%2F(pi%2F2)-z ) saying doesn't work because and but Is this parity some sort of law? And yet since . Unless... Post Scriptum: Irionically, it is very easy to symbolically represent vs even though and , we can just say such that EDIT: can quaternions help? Is a set of 2 numbers? Are they always equal?",i -i j i -i j^2=-1 (i)^2=-1 (-i)^2 = -1 j=\sqrt{-1} (-1)^{\frac{1}{2}} i -i j=e^{i\pi/2} e^{i\pi/2}=i e^{(-i)\pi/2}=-i e^{i\pi/2} j=e^{j\pi/2} j=ln(i)/(\pi/2) i=ln(i)/(\pi/2) -i=ln(-i)/(pi/2) Im(j) > 0 Im(z)=Re(z/i) Re(i/i)>0 Re((-i)/(-i))>0 i\neq-i i=(-1)\cdot(-i) 1 -1 (1)^2=1 (-1)^2=1 x x=x^2 i,"['complex-analysis', 'systems-of-equations', 'quaternions', 'parity']"
6,Can a holomorphic function of several variables have just one zero?,Can a holomorphic function of several variables have just one zero?,,Of course “several” in the title means $n$ strictly greater than 1 and the function is defined on some open subset of $\mathbb{C}^n$ . I tried to use the Weierstrass preparation theorem because it’s the only result on analysis of several variables I know but I couldn’t find a contradiction (I believe the answer is “no”).,Of course “several” in the title means strictly greater than 1 and the function is defined on some open subset of . I tried to use the Weierstrass preparation theorem because it’s the only result on analysis of several variables I know but I couldn’t find a contradiction (I believe the answer is “no”).,n \mathbb{C}^n,['complex-analysis']
7,Is there a trick to establish $z = \tan \left[ \frac{1}{i} \log \left( \sqrt{ \frac{1+iz}{1-iz} } \right) \right]$?,Is there a trick to establish ?,z = \tan \left[ \frac{1}{i} \log \left( \sqrt{ \frac{1+iz}{1-iz} } \right) \right],"Im trying to show that $$ z = \tan \left[ \frac{1}{i} \log \left( \sqrt{ \frac{1+iz}{1-iz} } \right) \right] $$ My first thought is to use the fact that $\sin x = \frac{ e^{ix} - e^{-ix} }{2i } $ and $\cos x = \frac{ e^{ix} + e^{-ix} }{2} $ to write $$ \tan x = \frac{ e^{ix } - e^{-ix} }{i( e^{ix} + e^{-ix} ) } $$ But using this, it looks like it will some very nasty calculations. Is there a trick to do this?","Im trying to show that $$ z = \tan \left[ \frac{1}{i} \log \left( \sqrt{ \frac{1+iz}{1-iz} } \right) \right] $$ My first thought is to use the fact that $\sin x = \frac{ e^{ix} - e^{-ix} }{2i } $ and $\cos x = \frac{ e^{ix} + e^{-ix} }{2} $ to write $$ \tan x = \frac{ e^{ix } - e^{-ix} }{i( e^{ix} + e^{-ix} ) } $$ But using this, it looks like it will some very nasty calculations. Is there a trick to do this?",,"['complex-analysis', 'algebra-precalculus']"
8,"If $f$ is an entire function that goes to infinity, $f$ is a polynomial","If  is an entire function that goes to infinity,  is a polynomial",f f,"I am asked to show that if $f$ is entire with the property that $\lim_{z\to\infty} f(z)=\infty$ , then $f$ must be a polynomial. However, I feel as if I am missing something. $e^z$ is entire (holomorphic at all finite $z$ ), and clearly $\lim_{z\to\infty} f(z)=\infty$ holds. However, $e^z$ is not a polynomial. This seems to be a disproof via counterexample. Is there something wrong with my reasoning, or with the problem?","I am asked to show that if is entire with the property that , then must be a polynomial. However, I feel as if I am missing something. is entire (holomorphic at all finite ), and clearly holds. However, is not a polynomial. This seems to be a disproof via counterexample. Is there something wrong with my reasoning, or with the problem?",f \lim_{z\to\infty} f(z)=\infty f e^z z \lim_{z\to\infty} f(z)=\infty e^z,"['complex-analysis', 'polynomials', 'entire-functions']"
9,Residues of Gamma Function at Poles,Residues of Gamma Function at Poles,,"I am struggling to understand the result that the analytic continuation of the Gamma function, $\Gamma(z)$ has poles at $C \setminus \{0,-1,-2,.....\}$ and residues of $(-1)^k/k!$ at pole $k$ . How may this be extended through the functional relation, to give the residuals of $\Gamma(z+1)$ or $z \Gamma(z)$ ?","I am struggling to understand the result that the analytic continuation of the Gamma function, has poles at and residues of at pole . How may this be extended through the functional relation, to give the residuals of or ?","\Gamma(z) C \setminus \{0,-1,-2,.....\} (-1)^k/k! k \Gamma(z+1) z \Gamma(z)",['complex-analysis']
10,Does Cauchy's theorem's hold if we only assume boundedness?,Does Cauchy's theorem's hold if we only assume boundedness?,,"Let $f$ be a function $\mathbb  C \to \mathbb C$ . I am not assuming $f$ is analytic on $\mathbb C$ , so Cauchy-Goursat does not apply. Suppose $\gamma$ is a simple closed contour, and suppose that the region $D = {\rm int}(\gamma) \cup \gamma$ can be approximated arbitrarily by little squares of arbitrarily small size. I would like to know whether $\oint_\gamma f = 0$ , under the assumption that $f$ is continuous and bounded on $D$ . I believe the answer is yes. Since the integral around $\gamma$ is equivalent to adding up the integrals from all the small squares, it is sufficient to show that the integral around the small squares approaches zero, which trivially follows from the Cauchy ML-inequality if $f$ is bounded on $D$ . Is this correct? So there is no need to assume analyticity if a continuous function is bounded?","Let be a function . I am not assuming is analytic on , so Cauchy-Goursat does not apply. Suppose is a simple closed contour, and suppose that the region can be approximated arbitrarily by little squares of arbitrarily small size. I would like to know whether , under the assumption that is continuous and bounded on . I believe the answer is yes. Since the integral around is equivalent to adding up the integrals from all the small squares, it is sufficient to show that the integral around the small squares approaches zero, which trivially follows from the Cauchy ML-inequality if is bounded on . Is this correct? So there is no need to assume analyticity if a continuous function is bounded?",f \mathbb  C \to \mathbb C f \mathbb C \gamma D = {\rm int}(\gamma) \cup \gamma \oint_\gamma f = 0 f D \gamma f D,['complex-analysis']
11,"A question in Complex Analysis $\int_0^{2\pi}\log(1-2r\cos x +r^2)\,dx$ [duplicate]",A question in Complex Analysis  [duplicate],"\int_0^{2\pi}\log(1-2r\cos x +r^2)\,dx","This question already has answers here : Computing $\int_{0}^{\pi}\ln\left(1-2a\cos x+a^2\right) \, dx$ (7 answers) Closed 3 years ago . My problem is to integrate this expression:  $$\int_0^{2\pi}\log(1-2r\cos x +r^2)dx.$$ where $r$ is any constant in $[0,1]$. I know the answer is zero. Can you explain you idea to me or just prove that? Maybe you will use the ""Cauchy integral theorem "".","This question already has answers here : Computing $\int_{0}^{\pi}\ln\left(1-2a\cos x+a^2\right) \, dx$ (7 answers) Closed 3 years ago . My problem is to integrate this expression:  $$\int_0^{2\pi}\log(1-2r\cos x +r^2)dx.$$ where $r$ is any constant in $[0,1]$. I know the answer is zero. Can you explain you idea to me or just prove that? Maybe you will use the ""Cauchy integral theorem "".",,"['complex-analysis', 'definite-integrals', 'harmonic-functions']"
12,Why the number of points where $f$ ramifies is finite?,Why the number of points where  ramifies is finite?,f,"I know roughly that there is a theorem in complex analysis saying that if $f$ has degree $e_x>1$ at point $x$, which is $f(z)=(x-z)^{e_x}g(z)$, then $f^{-1}(y)$ has $e_x$ different preimages in a neighborhood of $y$. In a complex Riemann surface, we have the same result considering $f$ in the local coordinates. We call that $f$ ramifies at point $x$ if $e_x>1$. I was told that the number of points where $e_x>1$ is finite. Can anyone tell me why? Is this result valid only in compact Riemann surface or generally? update: I realized that $f$ has digree $e_x$ at $x$ sould be $f(z)-f(x)=(z-x)^{e_x}g(z)$ rather than what I originally posted. Sorry for trouble..","I know roughly that there is a theorem in complex analysis saying that if $f$ has degree $e_x>1$ at point $x$, which is $f(z)=(x-z)^{e_x}g(z)$, then $f^{-1}(y)$ has $e_x$ different preimages in a neighborhood of $y$. In a complex Riemann surface, we have the same result considering $f$ in the local coordinates. We call that $f$ ramifies at point $x$ if $e_x>1$. I was told that the number of points where $e_x>1$ is finite. Can anyone tell me why? Is this result valid only in compact Riemann surface or generally? update: I realized that $f$ has digree $e_x$ at $x$ sould be $f(z)-f(x)=(z-x)^{e_x}g(z)$ rather than what I originally posted. Sorry for trouble..",,['complex-analysis']
13,Complex conjugate of $z$ without knowing $z=x+i y$,Complex conjugate of  without knowing,z z=x+i y,"Is it possible to determine (and if so, how) the complex conjugate $\bar{z}$ of $z$, if you don't already know that $z = x + i y$? I think you can use $\log(z)$ to get the angle, and therefore the ratio of $y$ and $x$. But how do you get $|z|$, the radius? How then to get $r$ (so that $x = {\rm Re}(z) = r \cos(\log(z))$ and $y = {\rm Im}(z) = r \sin(\log(z))$)? (this is related to How to express in closed form? , namely you can compute Re and Im using the conjugate, but then how do you reduce the conjugate itself fully to elementary functions (if at all))","Is it possible to determine (and if so, how) the complex conjugate $\bar{z}$ of $z$, if you don't already know that $z = x + i y$? I think you can use $\log(z)$ to get the angle, and therefore the ratio of $y$ and $x$. But how do you get $|z|$, the radius? How then to get $r$ (so that $x = {\rm Re}(z) = r \cos(\log(z))$ and $y = {\rm Im}(z) = r \sin(\log(z))$)? (this is related to How to express in closed form? , namely you can compute Re and Im using the conjugate, but then how do you reduce the conjugate itself fully to elementary functions (if at all))",,"['complex-analysis', 'complex-numbers']"
14,"If $|z|=1$, $z\neq-1$, show that $z$ may be expressed in the form $ z=\frac{1+it}{1-it}$ where $t\in \mathbb{R}$.","If , , show that  may be expressed in the form  where .",|z|=1 z\neq-1 z  z=\frac{1+it}{1-it} t\in \mathbb{R},"If $|z|=1$, $z\neq-1$, show that $z$ may be expressed in the form $$ z=\frac{1+it}{1-it},$$ where $t\in \mathbb{R}$. I don't know, how to begin. I started with the given conditions. Given that $|z|=1 \text{ and } z\neq-1\implies z=e^{it}, t\in[0,2\pi]/\{\pi\}.$","If $|z|=1$, $z\neq-1$, show that $z$ may be expressed in the form $$ z=\frac{1+it}{1-it},$$ where $t\in \mathbb{R}$. I don't know, how to begin. I started with the given conditions. Given that $|z|=1 \text{ and } z\neq-1\implies z=e^{it}, t\in[0,2\pi]/\{\pi\}.$",,['complex-analysis']
15,Computing the residues of $\dfrac{1}{\sin^2 z}$.,Computing the residues of .,\dfrac{1}{\sin^2 z},"I'm having a hard time correctly computing the residues of $\dfrac{1}{\sin^2 z}$. I  know the poles occur at $k\pi$, with order $2$. By a Taylor expansion I can rewrite $\sin z=\cos k\pi(z-k\pi)+f_2(z)(z-k\pi)^2$, and so  $$ \sin^2 z=(z-k\pi)^2(\cos k\pi+f_2(z)(z-k\pi))^2. $$ I want to calculate the residue with Cauchy's Integral Theorem, so  $$ \text{Res}(f,k\pi)=\frac{1}{2\pi i}\int_{|z-k\pi|=1}\frac{dz}{(z-k\pi)^2[\cos k\pi +f_2(z)(z-k\pi)]^2}. $$ This should equal the derivative of $(\cos k\pi+f_2(z)(z-k\pi))^{-2}$ evaluated at $k  \pi$. The derivative comes out to be $$ -2(\cos k\pi+f_2(z)(z-k\pi))^{-3}(f'_2(z)(z-k\pi)+f_2(z)) $$  and evaluates to $\dfrac{-2f_2(k\pi)}{(\cos k\pi)^3}$. Apparently the residue should  just be $0$, but I don't see how to conclude this. What am I missing to know $f_2(k\pi)=0$?","I'm having a hard time correctly computing the residues of $\dfrac{1}{\sin^2 z}$. I  know the poles occur at $k\pi$, with order $2$. By a Taylor expansion I can rewrite $\sin z=\cos k\pi(z-k\pi)+f_2(z)(z-k\pi)^2$, and so  $$ \sin^2 z=(z-k\pi)^2(\cos k\pi+f_2(z)(z-k\pi))^2. $$ I want to calculate the residue with Cauchy's Integral Theorem, so  $$ \text{Res}(f,k\pi)=\frac{1}{2\pi i}\int_{|z-k\pi|=1}\frac{dz}{(z-k\pi)^2[\cos k\pi +f_2(z)(z-k\pi)]^2}. $$ This should equal the derivative of $(\cos k\pi+f_2(z)(z-k\pi))^{-2}$ evaluated at $k  \pi$. The derivative comes out to be $$ -2(\cos k\pi+f_2(z)(z-k\pi))^{-3}(f'_2(z)(z-k\pi)+f_2(z)) $$  and evaluates to $\dfrac{-2f_2(k\pi)}{(\cos k\pi)^3}$. Apparently the residue should  just be $0$, but I don't see how to conclude this. What am I missing to know $f_2(k\pi)=0$?",,"['complex-analysis', 'residue-calculus']"
16,Complex cosine and sine,Complex cosine and sine,,"I would like to know what the mapping properties of the complex sine and cosine are. To start with one can say that $\sin(z)$ and $\cos(z)$ are conformal where their derivatives are nonzero, which means $\sin(z)$ preserves angles on $\mathbb{C}$ without $\frac{\pi}{2}+k\pi$ and $\cos(z)$ preserves angles on $\mathbb{C}$ without $\pi k$ for $\cos(z)$, with $k \in \mathbb{Z}$. What else can we say about these mappings? Thx.","I would like to know what the mapping properties of the complex sine and cosine are. To start with one can say that $\sin(z)$ and $\cos(z)$ are conformal where their derivatives are nonzero, which means $\sin(z)$ preserves angles on $\mathbb{C}$ without $\frac{\pi}{2}+k\pi$ and $\cos(z)$ preserves angles on $\mathbb{C}$ without $\pi k$ for $\cos(z)$, with $k \in \mathbb{Z}$. What else can we say about these mappings? Thx.",,['complex-analysis']
17,Applications of Complex Numbers,Applications of Complex Numbers,,"For my Complex Analysis course, we are to look up applications of Complex Numbers in the real world. The semester has just started and I am still new to the complex field. I want to get a head start on my research for the course. Anything I have seen on the complex field has only been in passing from my other course like ODE, Linear Algebra, and Abstract Algebra. I was wondering if someone can lead me into the right direction about what applications of complex numbers I can look into for my research topic. Recommended books I can refer to would also help. Thank you for your time and thanks in advanced for your feedback.","For my Complex Analysis course, we are to look up applications of Complex Numbers in the real world. The semester has just started and I am still new to the complex field. I want to get a head start on my research for the course. Anything I have seen on the complex field has only been in passing from my other course like ODE, Linear Algebra, and Abstract Algebra. I was wondering if someone can lead me into the right direction about what applications of complex numbers I can look into for my research topic. Recommended books I can refer to would also help. Thank you for your time and thanks in advanced for your feedback.",,"['complex-analysis', 'complex-numbers', 'soft-question', 'applications', 'advice']"
18,How to find a Laurent Series for this function,How to find a Laurent Series for this function,,How do I give a Laurent Series on various ranges of $|z|$ ? I need to find the Laurent series expansion for $$f(z)=\frac{1}{z(z-1)(z-2)}$$ for the following ranges of $|z|$ : $0<|z|<1$ $1<|z|<2$ $2<|z|$ I've calculated the partial fractions expansion of $f(z)$ to be $$f(z)=\frac{1}{2z}+\frac{1}{z-1}+\frac{1}{2(z-2)}$$,How do I give a Laurent Series on various ranges of ? I need to find the Laurent series expansion for for the following ranges of : I've calculated the partial fractions expansion of to be,|z| f(z)=\frac{1}{z(z-1)(z-2)} |z| 0<|z|<1 1<|z|<2 2<|z| f(z) f(z)=\frac{1}{2z}+\frac{1}{z-1}+\frac{1}{2(z-2)},"['complex-analysis', 'partial-fractions', 'laurent-series']"
19,Computing $\lim_{s \to 1} \Gamma \left(\frac{1-s}{2}\right) (s-1)$,Computing,\lim_{s \to 1} \Gamma \left(\frac{1-s}{2}\right) (s-1),"I want to evaluate the following limit: $$\lim_{s \to 1}\; \Gamma \left( \frac{1-s}{2} \right) (s-1).$$ I know that the gamma function has simple poles at $-n$ for $n \in \mathbb{N}_0$ with residue $\frac{(-1)^n}{n!}$. Also, I know that if a function $f$ has a simple pole at $a$, then $\operatorname{Res}_a f= \lim_{z \to a} (z-a) f(z)$. If $\Gamma(z)$ has a simple pole at $z=0$, then $\Gamma (\frac{1-s}{2})$ has a pole at $s=1$. If it was a simple pole, the limit would be $-1$, however, wolframalpha tells me the limit must be $-2$ and in the context I am using this limit, $-2$ must be the correct result. Where did I make a mistake? Thanks for any help in advance.","I want to evaluate the following limit: $$\lim_{s \to 1}\; \Gamma \left( \frac{1-s}{2} \right) (s-1).$$ I know that the gamma function has simple poles at $-n$ for $n \in \mathbb{N}_0$ with residue $\frac{(-1)^n}{n!}$. Also, I know that if a function $f$ has a simple pole at $a$, then $\operatorname{Res}_a f= \lim_{z \to a} (z-a) f(z)$. If $\Gamma(z)$ has a simple pole at $z=0$, then $\Gamma (\frac{1-s}{2})$ has a pole at $s=1$. If it was a simple pole, the limit would be $-1$, however, wolframalpha tells me the limit must be $-2$ and in the context I am using this limit, $-2$ must be the correct result. Where did I make a mistake? Thanks for any help in advance.",,"['complex-analysis', 'limits', 'gamma-function']"
