,title_raw,title_text,title_latex,body_raw,body_text,body_latex,tags
41,"Entire function $f$ such that $f(z)=f(P(z))$, where $P$ is a polynomial of degree at least $2$.","Entire function  such that , where  is a polynomial of degree at least .",f f(z)=f(P(z)) P 2,"Let $f$ be a entire function and $P$ be a polynomial of degree at least $2$ . If $$f(z)=f(P(z)),\quad \forall z\in\mathbb C,$$ Is the entire function $f$ constant function? My thought: If $f$ is not constant, then $f$ must be transcendental entire function. If the sequence $\{z_n=P^n(z)\}$ iterated by $P$ has a limit point $w_0$ in $\mathbb C$ , then $$f(z)=f(z_1)=\cdots=f(z_n)=\cdots,\quad \lim_{n\to\infty}f(z_n)=f(w_0),$$ then $f(z)\equiv w_0$ by Identity theorem. But this is not always ture. For enample, if $P(z)=z^2+1$ , take $z=1$ , then $z_n\to\infty$ . Also if $$f(z)=f(e^z),\quad \forall z\in\mathbb C,$$ can we have $f$ is constant function? Any hints and help will welcome.","Let be a entire function and be a polynomial of degree at least . If Is the entire function constant function? My thought: If is not constant, then must be transcendental entire function. If the sequence iterated by has a limit point in , then then by Identity theorem. But this is not always ture. For enample, if , take , then . Also if can we have is constant function? Any hints and help will welcome.","f P 2 f(z)=f(P(z)),\quad \forall z\in\mathbb C, f f f \{z_n=P^n(z)\} P w_0 \mathbb C f(z)=f(z_1)=\cdots=f(z_n)=\cdots,\quad \lim_{n\to\infty}f(z_n)=f(w_0), f(z)\equiv w_0 P(z)=z^2+1 z=1 z_n\to\infty f(z)=f(e^z),\quad \forall z\in\mathbb C, f","['complex-analysis', 'limits', 'dynamical-systems']"
42,Evaluate the integral $\int_{-\infty}^{\infty} e^{-x^2} e^{ix} dx$,Evaluate the integral,\int_{-\infty}^{\infty} e^{-x^2} e^{ix} dx,I tried common techniques like integration by parts but did not succeed. The $e^{ix}$ also is causing some trouble. I'm guessing this is a Fourier transform in disguise but I'm not sure how the evaluate this. Any help will be appreciated!,I tried common techniques like integration by parts but did not succeed. The $e^{ix}$ also is causing some trouble. I'm guessing this is a Fourier transform in disguise but I'm not sure how the evaluate this. Any help will be appreciated!,,"['complex-analysis', 'analysis', 'fourier-analysis']"
43,Prove or disprove that every Holomorphic function preserving unboundedness is a polynomial.,Prove or disprove that every Holomorphic function preserving unboundedness is a polynomial.,,Roughly speaking as the title says: Prove or disprove that every holomorphic function preserving unboundedness is a polynomial. Let $f : \Bbb C \to \Bbb C$ be a holomorphic function such that for every unbounded set $ V \subset \Bbb C$ the image $f(V)$ is also unbounded. Prove or disprove that $f$ must be a polynomial.,Roughly speaking as the title says: Prove or disprove that every holomorphic function preserving unboundedness is a polynomial. Let $f : \Bbb C \to \Bbb C$ be a holomorphic function such that for every unbounded set $ V \subset \Bbb C$ the image $f(V)$ is also unbounded. Prove or disprove that $f$ must be a polynomial.,,"['complex-analysis', 'holomorphic-functions', 'analytic-functions']"
44,Suppose that for each $a\in \mathbb{C}$ at least one coefficient of the Taylor's series $f$ about $a$ is zero. Show that $f$ is a polynomial.,Suppose that for each  at least one coefficient of the Taylor's series  about  is zero. Show that  is a polynomial.,a\in \mathbb{C} f a f,Let $f:\mathbb{C}\rightarrow\mathbb{C}$ be a holomorphic function. Suppose that for each $a\in \mathbb{C}$ at least one coefficient of the Taylor's series $f$ about $a$ is zero. Show that $f$ is  a polynomial.,Let $f:\mathbb{C}\rightarrow\mathbb{C}$ be a holomorphic function. Suppose that for each $a\in \mathbb{C}$ at least one coefficient of the Taylor's series $f$ about $a$ is zero. Show that $f$ is  a polynomial.,,"['complex-analysis', 'complex-integration']"
45,Finding number of zero of $z^{10}+10z+9$ in the unit disc.,Finding number of zero of  in the unit disc.,z^{10}+10z+9,"I am trying to find the number of zero of the polynomial $f(z)=z^{10}+10z+9$ in the disc $D(0,1)$. So far I used Rouché's theorem with $g(z)=z^{10}$ to find that there are 10 zeroes in $D(0,2)$. However, as $-1$ is a zero of $f$ and is in $D(0,1)$, I think Rouché cannot be used directly. Could anyone give me a advice on how to proceed ? Thanks.","I am trying to find the number of zero of the polynomial $f(z)=z^{10}+10z+9$ in the disc $D(0,1)$. So far I used Rouché's theorem with $g(z)=z^{10}$ to find that there are 10 zeroes in $D(0,2)$. However, as $-1$ is a zero of $f$ and is in $D(0,1)$, I think Rouché cannot be used directly. Could anyone give me a advice on how to proceed ? Thanks.",,['complex-analysis']
46,How do I prove that $f'(z)=0$ implies $f$ is constant?,How do I prove that  implies  is constant?,f'(z)=0 f,"Let $V$ be an open connected subset of $\mathbb{C}$. Let $f:V\rightarrow\mathbb{C}$ be a function whose derivative is $0$ on $V$. How do I prove that $f$ is a constant on $V$? I know that $V$ is path-connected, but I don't know whether this helps.","Let $V$ be an open connected subset of $\mathbb{C}$. Let $f:V\rightarrow\mathbb{C}$ be a function whose derivative is $0$ on $V$. How do I prove that $f$ is a constant on $V$? I know that $V$ is path-connected, but I don't know whether this helps.",,['complex-analysis']
47,Are there two conventional definitions of “holomorphic”?,Are there two conventional definitions of “holomorphic”?,,"In Walter Rudin's Real and Complex Analysis , second edition, on page 213, two definitions are stated.  One of them says the derivative of $f$ at $z_0$ is $$f'(z_0)=\lim_{z\to z_0}\frac{f(z)-f(z_0)}{z-z_0}.\tag 1$$ The other says $f$ is holomorphic in an open set if $f'(z_0)$ exists at every value of $z_0$ in that set. By that definition, holomorphic doesn't just mean differentiable; it means differentiable at every point in some open set. He never defines “holomorphic at” a point, but only “holomorphic in” an open set. Before opening the book this afternoon, just remembering from years ago, I thought what it said was $f$ is differentiable at $z_0$ if $(1)$ holds; and $f$ is holomorphic at $z_0$ if the derivative exists at every point in some open neighborhood of $z_0$ . By that definition $f(z)=|z|^2$ would be differentiable at $0$ but not holomorphic at $0$ . Thus differentiability at an isolated point would be weaker than holomorphy at that point. QUESTION: Do both conventions exist? I take “ $f$ is analytic at $z_0$ ” to mean $f$ has a convergent power series expansion at $z_0$ , which actually converges to the right thing, the value of $f$ , in the interior of its circle of convergence. Differentiability at every point in some open neighborhood of $z_0$ is enough to prove analyticity, but differentiability at $z_0$ is not. By one of the conventions above, one can say a function holomorphic at a point is analytic at that point; by the other one cannot.","In Walter Rudin's Real and Complex Analysis , second edition, on page 213, two definitions are stated.  One of them says the derivative of at is The other says is holomorphic in an open set if exists at every value of in that set. By that definition, holomorphic doesn't just mean differentiable; it means differentiable at every point in some open set. He never defines “holomorphic at” a point, but only “holomorphic in” an open set. Before opening the book this afternoon, just remembering from years ago, I thought what it said was is differentiable at if holds; and is holomorphic at if the derivative exists at every point in some open neighborhood of . By that definition would be differentiable at but not holomorphic at . Thus differentiability at an isolated point would be weaker than holomorphy at that point. QUESTION: Do both conventions exist? I take “ is analytic at ” to mean has a convergent power series expansion at , which actually converges to the right thing, the value of , in the interior of its circle of convergence. Differentiability at every point in some open neighborhood of is enough to prove analyticity, but differentiability at is not. By one of the conventions above, one can say a function holomorphic at a point is analytic at that point; by the other one cannot.",f z_0 f'(z_0)=\lim_{z\to z_0}\frac{f(z)-f(z_0)}{z-z_0}.\tag 1 f f'(z_0) z_0 f z_0 (1) f z_0 z_0 f(z)=|z|^2 0 0 f z_0 f z_0 f z_0 z_0,"['complex-analysis', 'terminology', 'convention']"
48,"A complex map with ""bounded"" derivative is injective","A complex map with ""bounded"" derivative is injective",,"The exercise I try to solve states: ""Let $\,f\,$ be analytic in $\,D:=\{z\in\mathbb{C}\;|\;|z|<1\}\,$ , and such that $$|f'(z)-1|<\frac{1}{2}\,\,\,\forall\,z\in D$$ Prove that $\,f\,$ is $\,1-1\,$ in $\,D\,$. My thoughts: The condition $$|f'(z)-1|<\frac{1}{2}\,\,\,\forall\,z\in D$$ means the range of the analytic function $\,f'\,$ misses lots of points on the complex plane, so applying Picard's Theorem (or some extension of Liouville's) we get that $\,f'(z)=w=\,$ constant, from which it follows that $\,f\,$ is linear on $\,D\,$ and thus $\,1-1\,$ there. Doubts: $\,\,(i)\,\,$ This exercise is meant to be from an introductory first course in complex functions, so Picard's theorem seems overkill here...yet I can't see how to avoid it. $\,\,(ii)\,\,$ Even assuming we must use Picard's Theorem, the versions of it I know always talk of ""entire functions"", yet our function $\,f\,$ above is analytic only in the open unit disk. Is this a problem? Perhaps it is and thus something else must be used...? Any help will be much appreciated.","The exercise I try to solve states: ""Let $\,f\,$ be analytic in $\,D:=\{z\in\mathbb{C}\;|\;|z|<1\}\,$ , and such that $$|f'(z)-1|<\frac{1}{2}\,\,\,\forall\,z\in D$$ Prove that $\,f\,$ is $\,1-1\,$ in $\,D\,$. My thoughts: The condition $$|f'(z)-1|<\frac{1}{2}\,\,\,\forall\,z\in D$$ means the range of the analytic function $\,f'\,$ misses lots of points on the complex plane, so applying Picard's Theorem (or some extension of Liouville's) we get that $\,f'(z)=w=\,$ constant, from which it follows that $\,f\,$ is linear on $\,D\,$ and thus $\,1-1\,$ there. Doubts: $\,\,(i)\,\,$ This exercise is meant to be from an introductory first course in complex functions, so Picard's theorem seems overkill here...yet I can't see how to avoid it. $\,\,(ii)\,\,$ Even assuming we must use Picard's Theorem, the versions of it I know always talk of ""entire functions"", yet our function $\,f\,$ above is analytic only in the open unit disk. Is this a problem? Perhaps it is and thus something else must be used...? Any help will be much appreciated.",,['complex-analysis']
49,How to find all the solutions to cos$(z)=0$,How to find all the solutions to cos,(z)=0,"How would you go about finding all the solutions to $\cos(z)=0$, where $z\in \mathbb{C}$? I have $$\cos(z)=0 \implies (e^{iz})^2=-1 \implies \text{Log}(e^{iz})=\text{Log}(e^{i\pi(1/2+2k)})\qquad\text{ where }k\in \mathbb{Z}$$ $$\implies ie^{-y}x=i\pi(1/2+2k)$$ $$\implies z= e^{y}\pi(1/2+2k)+iy \qquad\forall k\in \mathbb{Z}\;\text{ and }\;\forall y\in \mathbb{R}$$ Is this correct? Thanks! EDIT: $e^{2iz}=e^{i\pi(1+2k)} \Rightarrow z=\pi/2+k\pi$ where $k\in \mathbb{Z}$","How would you go about finding all the solutions to $\cos(z)=0$, where $z\in \mathbb{C}$? I have $$\cos(z)=0 \implies (e^{iz})^2=-1 \implies \text{Log}(e^{iz})=\text{Log}(e^{i\pi(1/2+2k)})\qquad\text{ where }k\in \mathbb{Z}$$ $$\implies ie^{-y}x=i\pi(1/2+2k)$$ $$\implies z= e^{y}\pi(1/2+2k)+iy \qquad\forall k\in \mathbb{Z}\;\text{ and }\;\forall y\in \mathbb{R}$$ Is this correct? Thanks! EDIT: $e^{2iz}=e^{i\pi(1+2k)} \Rightarrow z=\pi/2+k\pi$ where $k\in \mathbb{Z}$",,"['complex-analysis', 'trigonometry']"
50,Why does the inverse of a mobius transform not get divided by the determinant?,Why does the inverse of a mobius transform not get divided by the determinant?,,for a mobius transform $\frac{az+b}{cz+d}$ it's inverse is given by $\frac{dw-b}{-cw+a}$ since this can be put into a matrix form why is there not a requirement for the inverse to be divided by the determinant?,for a mobius transform $\frac{az+b}{cz+d}$ it's inverse is given by $\frac{dw-b}{-cw+a}$ since this can be put into a matrix form why is there not a requirement for the inverse to be divided by the determinant?,,"['complex-analysis', 'mobius-transformation']"
51,Intuitive explanation why complex differentiation is not linear over real and imaginary part,Intuitive explanation why complex differentiation is not linear over real and imaginary part,,"Suppose we have a complex valued function $f = u + iv \colon U \to \mathbb C$ defined on an open subset $U$ of $\mathbb C$, which is holomorphic. I was asked why it is wrong to use the linearity of the differentiation operator to write $$ \frac{d}{dz} f(z) = \frac{d}{dz} (u(z) + iv(z)) = \frac{d}{dz} u(z) + i \frac{d}{dz} v(z). $$ I explained this by proving that a real - valued function that is holomorphic must be constant, and so for $\frac{d}{dz} u$ and $\frac{d}{dz} v$ to exist $u$ and $v$ must be constant in $z$. However $f$ is not necessarily constant so applying the linearity in this way is invalid. I also showed that the real - and imaginary part functions $\Re()$ and $\Im()$ are not holomorphic. Intuitively I think that real - valued and complex - valued functions are a different 'thing' and the $\frac{d}{dz}$ operator lives in the 'complex analysis world', so even though it is linear over complex functions it does not make sense to use it in the context of real - valued functions. However I was wondering whether there is a clearer or perhaps deeper explanation to this.","Suppose we have a complex valued function $f = u + iv \colon U \to \mathbb C$ defined on an open subset $U$ of $\mathbb C$, which is holomorphic. I was asked why it is wrong to use the linearity of the differentiation operator to write $$ \frac{d}{dz} f(z) = \frac{d}{dz} (u(z) + iv(z)) = \frac{d}{dz} u(z) + i \frac{d}{dz} v(z). $$ I explained this by proving that a real - valued function that is holomorphic must be constant, and so for $\frac{d}{dz} u$ and $\frac{d}{dz} v$ to exist $u$ and $v$ must be constant in $z$. However $f$ is not necessarily constant so applying the linearity in this way is invalid. I also showed that the real - and imaginary part functions $\Re()$ and $\Im()$ are not holomorphic. Intuitively I think that real - valued and complex - valued functions are a different 'thing' and the $\frac{d}{dz}$ operator lives in the 'complex analysis world', so even though it is linear over complex functions it does not make sense to use it in the context of real - valued functions. However I was wondering whether there is a clearer or perhaps deeper explanation to this.",,['complex-analysis']
52,Determine the complex function $f\left ( z \right )$,Determine the complex function,f\left ( z \right ),"The details provided are that the function is analytic and that its real part along the line $y=c x$ is constant. What conclusions can I draw from here? I think that this imposes $\frac{\partial u}{\partial x}=0 $ and $\frac{\partial u}{\partial y}=0 $ along the line, however I am unsure how to take it from here.","The details provided are that the function is analytic and that its real part along the line $y=c x$ is constant. What conclusions can I draw from here? I think that this imposes $\frac{\partial u}{\partial x}=0 $ and $\frac{\partial u}{\partial y}=0 $ along the line, however I am unsure how to take it from here.",,"['complex-analysis', 'analyticity']"
53,"Is it true that $ |\sin^2z+\cos^2z|=1, \forall z \in\Bbb C$?",Is it true that ?," |\sin^2z+\cos^2z|=1, \forall z \in\Bbb C","We know that equation $ \sin^2z+ \cos^2z=1$ which holds  $ \forall z \in\Bbb R$, actually holds $ \forall z \in\Bbb C$. Is it true that $ |\sin^2z+\cos^2z|=1, \forall z \in\Bbb C$? Thanks in advance.","We know that equation $ \sin^2z+ \cos^2z=1$ which holds  $ \forall z \in\Bbb R$, actually holds $ \forall z \in\Bbb C$. Is it true that $ |\sin^2z+\cos^2z|=1, \forall z \in\Bbb C$? Thanks in advance.",,"['complex-analysis', 'trigonometry', 'complex-numbers']"
54,"Proof that $g(z) = \int_0^1 f(t)e^{tz} \, dt$ is entire",Proof that  is entire,"g(z) = \int_0^1 f(t)e^{tz} \, dt","Let $f(z)$ be a complex and continuous function on $[0,1]$. We'll define $g(z) = \int_0^1 f(t)e^{tz} \, dt $. Prove that $g(z)$ is an entire function.","Let $f(z)$ be a complex and continuous function on $[0,1]$. We'll define $g(z) = \int_0^1 f(t)e^{tz} \, dt $. Prove that $g(z)$ is an entire function.",,['complex-analysis']
55,Why this determinant is conformally invariant?,Why this determinant is conformally invariant?,,"While I was reading a paper about random analytic function I found a statement that I was not able to prove and after try brute force and search for some references I decided to ask for a help here. The statement is the following: Denote by $\mathbb{D}$ the unit dic on the complex plane, and consider the function $p:\mathbb{D}^n\to\mathbb{C}$ given by $$ p(z_1,\dots,z_n)\, =\, 4^{-n}\, \det\left(\frac{(1-|z_i|^2)(1-|z_j|^2)}{|1-z_i\overline{z}_j|^2}\right)_{i,j=1}^{n}\, $$  then for any fixed $u\in\mathbb{D}$ the function $p$ is invariant for the Möbius transformation $$ \phi(u,z)=\frac{u+z}{1+\overline{u}z}, $$ in the sense that $$ p(z_1,\dots,z_n)\, = p(\phi(u,z_1),\ldots,\phi(u,z_n)). $$ I appreciate any reference or hint to prove this fact. Edition: The denominator was modified as point out for David and Anon.","While I was reading a paper about random analytic function I found a statement that I was not able to prove and after try brute force and search for some references I decided to ask for a help here. The statement is the following: Denote by $\mathbb{D}$ the unit dic on the complex plane, and consider the function $p:\mathbb{D}^n\to\mathbb{C}$ given by $$ p(z_1,\dots,z_n)\, =\, 4^{-n}\, \det\left(\frac{(1-|z_i|^2)(1-|z_j|^2)}{|1-z_i\overline{z}_j|^2}\right)_{i,j=1}^{n}\, $$  then for any fixed $u\in\mathbb{D}$ the function $p$ is invariant for the Möbius transformation $$ \phi(u,z)=\frac{u+z}{1+\overline{u}z}, $$ in the sense that $$ p(z_1,\dots,z_n)\, = p(\phi(u,z_1),\ldots,\phi(u,z_n)). $$ I appreciate any reference or hint to prove this fact. Edition: The denominator was modified as point out for David and Anon.",,"['complex-analysis', 'determinant']"
56,Approximating functions on compact sets by holomorphic or polynomial functions,Approximating functions on compact sets by holomorphic or polynomial functions,,"I'm studying for an exam and I'm stuck on the following problem: Does there exist a sequence of holomorphic functions $\{f_n(z)\}_{n=1}^{\infty}$ on the unit disc such that $f_n(z)\to1/z$ uniformly on $\{z\in\mathbb{C}\colon|z|=1/2\}$ as $n\to\infty$? What tools would I use if $1/z$ were replaced with another functions, or say the $f_n$'s were replaced by polynomials instead?","I'm studying for an exam and I'm stuck on the following problem: Does there exist a sequence of holomorphic functions $\{f_n(z)\}_{n=1}^{\infty}$ on the unit disc such that $f_n(z)\to1/z$ uniformly on $\{z\in\mathbb{C}\colon|z|=1/2\}$ as $n\to\infty$? What tools would I use if $1/z$ were replaced with another functions, or say the $f_n$'s were replaced by polynomials instead?",,['complex-analysis']
57,Can the limit of a complex number have multiple values?,Can the limit of a complex number have multiple values?,,"I have been studying ""Complex analysis"" for a while. In this ""limit of complex function"" question, I get an answer that's a $4$ th root of $-1.$ I change  that form to polar coordinate form and then see that there's more than one value. This is the work that I have done so far: So, Can the limit of a complex function has more than one value? If not, do I need to change an answer that's a fractional exponent to polar form?","I have been studying ""Complex analysis"" for a while. In this ""limit of complex function"" question, I get an answer that's a th root of I change  that form to polar coordinate form and then see that there's more than one value. This is the work that I have done so far: So, Can the limit of a complex function has more than one value? If not, do I need to change an answer that's a fractional exponent to polar form?",4 -1.,"['complex-analysis', 'limits']"
58,Complex Analysis: Showing analytic function is zero,Complex Analysis: Showing analytic function is zero,,"How I can solve this problem: Let $f: D \to D$ be an analytic function where $D$ is the unit open disc in $\mathbb C$ . Suppose there is a positive number $\delta > 0$ such that , $$\lim_{z \to e^{iθ}} ⁡f(z)= 0; \qquad \forall \ |\theta| < \delta.$$ Show that $f \equiv 0$ on $D$ . Thanks Note: An easier version of this Privalov's Theorem is an exercise problem from Stein and Shakarchi's Complex Analysis textbook which additionally assumes the holomorphic function converges uniformly to $0$ on the portion of the arc. See [1] , [2] , [3] . The absence of this 'uniform' non-tangential limit on the portion of the arc makes it a slightly more difficult problem.","How I can solve this problem: Let be an analytic function where is the unit open disc in . Suppose there is a positive number such that , Show that on . Thanks Note: An easier version of this Privalov's Theorem is an exercise problem from Stein and Shakarchi's Complex Analysis textbook which additionally assumes the holomorphic function converges uniformly to on the portion of the arc. See [1] , [2] , [3] . The absence of this 'uniform' non-tangential limit on the portion of the arc makes it a slightly more difficult problem.",f: D \to D D \mathbb C \delta > 0 \lim_{z \to e^{iθ}} ⁡f(z)= 0; \qquad \forall \ |\theta| < \delta. f \equiv 0 D 0,['complex-analysis']
59,Analytic continuation of Riemann zeta $\zeta(s)$ from the complex $\mathbb{C}$ to quaternion $\mathbb{H}$?,Analytic continuation of Riemann zeta  from the complex  to quaternion ?,\zeta(s) \mathbb{C} \mathbb{H},"One way to define  Riemann zeta function is by the analytic continuation of $$\zeta(s) = \sum_{n=1}^\infty \frac{1}{n^s} = \frac{1}{1^s} + \frac{1}{2^s} + \frac{1}{3^s} + \cdots$$ for the domain $Re(s)>1$ to the full complex plane in $\mathbb{C}$ . Thus, Riemann zeta function is defined for $s \in \mathbb{C}$ and $\zeta(s)  \in  \mathbb{C}$ My question is that do we gain anything new to do analytic continuation of Riemann zeta function such that a ""modified Riemann zeta function"" so $s  \in  \mathbb{H}$ is in quaternion? and $\zeta(s)  \in  \mathbb{H}?$ Does this lead to any interesting result in the math literature? Edit: more precisely, according to the comment, we seek for an analytic continuation of $\zeta(s)$ from the complex $\mathbb{C}/\{1\}$ to quaternion $\mathbb{H}/\{1\}$ ?","One way to define  Riemann zeta function is by the analytic continuation of for the domain to the full complex plane in . Thus, Riemann zeta function is defined for and My question is that do we gain anything new to do analytic continuation of Riemann zeta function such that a ""modified Riemann zeta function"" so is in quaternion? and Does this lead to any interesting result in the math literature? Edit: more precisely, according to the comment, we seek for an analytic continuation of from the complex to quaternion ?",\zeta(s) = \sum_{n=1}^\infty \frac{1}{n^s} = \frac{1}{1^s} + \frac{1}{2^s} + \frac{1}{3^s} + \cdots Re(s)>1 \mathbb{C} s \in \mathbb{C} \zeta(s)  \in  \mathbb{C} s  \in  \mathbb{H} \zeta(s)  \in  \mathbb{H}? \zeta(s) \mathbb{C}/\{1\} \mathbb{H}/\{1\},"['complex-analysis', 'riemann-zeta', 'quaternions']"
