,title_raw,title_text,title_latex,body_raw,body_text,body_latex,tags
20,Cauchy's Residue Theorem on a Singularity Outside a Contour,Cauchy's Residue Theorem on a Singularity Outside a Contour,,"I recently ran into the following exercise: Evaluate   $$\oint_\Gamma\frac{\cos z}{(z-\pi)^2}dz,$$where $\Gamma$ is a complete circuit of the circle $|z|=1$. Clearly, the singularity lies outside the contour: However, recall Cauchy's Residue Theorem : If $\Gamma$ is a simple closed positively oriented contour and $f$ is analytic inside and on $\Gamma$ except at the points $z_1$, $z_2$, ..., $z_n$, then   $$\int_\Gamma f(z)dz=2\pi i\sum_{j=1}^{n}\text{Res}(z_j),$$   where   $$\text{Res}(f;z_0)=\lim_{z\to z_0}\frac{1}{(m-1)!}\frac{d^{m-1}}{dz^{m-1}}[(z-z_0)^mf(z)].$$ If I use this to evaluate the integral, I will have that $$\text{Res}(f;\pi)=\lim_{z\to\pi}\frac{d}{dz}[\cos z]=0,$$and hence the value of the integral will evaluate to $0$, which is the correct answer. Is this purely coincidental? Because, as I understand it, for Cauchy's theorem to hold, the singularities must lie within the contour (or perhaps not?). Thanks in advance!","I recently ran into the following exercise: Evaluate   $$\oint_\Gamma\frac{\cos z}{(z-\pi)^2}dz,$$where $\Gamma$ is a complete circuit of the circle $|z|=1$. Clearly, the singularity lies outside the contour: However, recall Cauchy's Residue Theorem : If $\Gamma$ is a simple closed positively oriented contour and $f$ is analytic inside and on $\Gamma$ except at the points $z_1$, $z_2$, ..., $z_n$, then   $$\int_\Gamma f(z)dz=2\pi i\sum_{j=1}^{n}\text{Res}(z_j),$$   where   $$\text{Res}(f;z_0)=\lim_{z\to z_0}\frac{1}{(m-1)!}\frac{d^{m-1}}{dz^{m-1}}[(z-z_0)^mf(z)].$$ If I use this to evaluate the integral, I will have that $$\text{Res}(f;\pi)=\lim_{z\to\pi}\frac{d}{dz}[\cos z]=0,$$and hence the value of the integral will evaluate to $0$, which is the correct answer. Is this purely coincidental? Because, as I understand it, for Cauchy's theorem to hold, the singularities must lie within the contour (or perhaps not?). Thanks in advance!",,['complex-analysis']
21,When is composition of meromorphic functions meromorphic,When is composition of meromorphic functions meromorphic,,"When I compose a meromorphic and a holomorphic function, I get a meromorphic function. Are there other cases when a composition of two meromorphic functions is meromorphic? For example, if I compose a holomorphic and a meromorphic function? Or does it hold that the composition is meromorphic in general?","When I compose a meromorphic and a holomorphic function, I get a meromorphic function. Are there other cases when a composition of two meromorphic functions is meromorphic? For example, if I compose a holomorphic and a meromorphic function? Or does it hold that the composition is meromorphic in general?",,"['complex-analysis', 'function-and-relation-composition', 'holomorphic-functions', 'meromorphic-functions']"
22,Is this complex function differentiable at 0?,Is this complex function differentiable at 0?,,"I'm moving my first steps in Complex Analysis. I can't tell whether the function $$f(x+iy) = 2|xy|+i(y^2-x^2)$$ is differentiable at $0$ or not. I tried using the limit of the difference quotient : $$\lim_{z\to 0}\frac{2|xy|+i(y^2-x^2)}{x+iy}$$ The limit is $0$ when $xy>0$ because $x=-iy$ is a root of the numerator, but I can't compute the limit in general...","I'm moving my first steps in Complex Analysis. I can't tell whether the function $$f(x+iy) = 2|xy|+i(y^2-x^2)$$ is differentiable at $0$ or not. I tried using the limit of the difference quotient : $$\lim_{z\to 0}\frac{2|xy|+i(y^2-x^2)}{x+iy}$$ The limit is $0$ when $xy>0$ because $x=-iy$ is a root of the numerator, but I can't compute the limit in general...",,['complex-analysis']
23,Bolzano-Weierstrass theorem (complex case),Bolzano-Weierstrass theorem (complex case),,"I'm trying to prove Bolzano-Weierstrass Theorem to the complex case, i.e., if $(z_n)$ a complex sequence is bounded, then there is a subsequence of $z_n$ which converges. I'm trying to use the real case of the Bolzano-Weierstrass theorem to prove the complex case without success. I need help. Thanks","I'm trying to prove Bolzano-Weierstrass Theorem to the complex case, i.e., if $(z_n)$ a complex sequence is bounded, then there is a subsequence of $z_n$ which converges. I'm trying to use the real case of the Bolzano-Weierstrass theorem to prove the complex case without success. I need help. Thanks",,['complex-analysis']
24,What does the symbol $\subset\subset$ mean? [duplicate],What does the symbol  mean? [duplicate],\subset\subset,"This question already has an answer here : The meaning of notation $\subset\subset$ in complex analysis (1 answer) Closed 10 years ago . In some texts (mainly complex analysis or harmonic analysis) I sometimes see the following double subset symbol $\subset\subset$ for inclusion relation of two regions, e.g., $\Omega$ and $\Omega'$ are two regions in $\mathbb{C}$ such that $\Omega \subset\subset \Omega'$ . I never figured out what it means exactly; I always interpreted it as the closure $\overline{\Omega}$ is contained in $\Omega'$ (so that some nasty boundary effects can be avoided). Is that right? Or does $\subset\subset$ mean some other kind of inclusion? Thanks.","This question already has an answer here : The meaning of notation $\subset\subset$ in complex analysis (1 answer) Closed 10 years ago . In some texts (mainly complex analysis or harmonic analysis) I sometimes see the following double subset symbol for inclusion relation of two regions, e.g., and are two regions in such that . I never figured out what it means exactly; I always interpreted it as the closure is contained in (so that some nasty boundary effects can be avoided). Is that right? Or does mean some other kind of inclusion? Thanks.",\subset\subset \Omega \Omega' \mathbb{C} \Omega \subset\subset \Omega' \overline{\Omega} \Omega' \subset\subset,"['complex-analysis', 'notation', 'harmonic-analysis']"
25,Any linear fractional transformation transforming the real axis to itself can be written in terms of reals?,Any linear fractional transformation transforming the real axis to itself can be written in terms of reals?,,"I'm trying to teach myself complex analysis, and was reading about linear transformations. I would like to understand why any linear fractional transformation which transforms the real axis into itself can be written with real coefficients. I assume I have some linear fractional transformation $z\mapsto \frac{az+b}{cz+d}$, where $z\in\mathbb{C}$ and $a,b,c,d\in\mathbb{C}$ are the coefficients, and I think I would like to conclude $a,b,c,d\in\mathbb{R}$ actually. Choosing various reals, I get $$ 0\mapsto\frac{b}{d},\quad 1\mapsto\frac{a+b}{c+d},\quad -1\mapsto\frac{-a+b}{-c+d} $$ so I know all those images are again real. Is there someway to conclude that $a,b,c,d$ are individually real? Thank you.","I'm trying to teach myself complex analysis, and was reading about linear transformations. I would like to understand why any linear fractional transformation which transforms the real axis into itself can be written with real coefficients. I assume I have some linear fractional transformation $z\mapsto \frac{az+b}{cz+d}$, where $z\in\mathbb{C}$ and $a,b,c,d\in\mathbb{C}$ are the coefficients, and I think I would like to conclude $a,b,c,d\in\mathbb{R}$ actually. Choosing various reals, I get $$ 0\mapsto\frac{b}{d},\quad 1\mapsto\frac{a+b}{c+d},\quad -1\mapsto\frac{-a+b}{-c+d} $$ so I know all those images are again real. Is there someway to conclude that $a,b,c,d$ are individually real? Thank you.",,"['complex-analysis', 'transformation']"
26,"If $|z| < 1$, prove that $\Re \left(\frac{1}{1 - z} \right) > \frac{1}{2}$.","If , prove that .",|z| < 1 \Re \left(\frac{1}{1 - z} \right) > \frac{1}{2},"If $|z| < 1$ , prove that $\Re \left(\frac{1}{1 - z} \right) > \frac{1}{2}$ . My attempt: Consider $\frac{1}{1 - z}$ . Let $z = x + iy$ , we know that $|z| < 1 \implies x, y < 1$ . $$\frac{1}{1 - z} = \frac{1}{1 - x - iy} = \frac{1 - x + iy}{(1 - x)^2 + y^2}.$$ $$\Re \left(\frac{1}{1 - z} \right) = \frac{1 - x}{(1 - x)^2 + y^2}.$$ I got $$\frac{1}{(x-1)^2 + y^2} > \frac{1}{2}.$$ How do I manage the numerator? Can you help me? I welcome the alternative approaches.","If , prove that . My attempt: Consider . Let , we know that . I got How do I manage the numerator? Can you help me? I welcome the alternative approaches.","|z| < 1 \Re \left(\frac{1}{1 - z} \right) > \frac{1}{2} \frac{1}{1 - z} z = x + iy |z| < 1 \implies x, y < 1 \frac{1}{1 - z} = \frac{1}{1 - x - iy} = \frac{1 - x + iy}{(1 - x)^2 + y^2}. \Re \left(\frac{1}{1 - z} \right) = \frac{1 - x}{(1 - x)^2 + y^2}. \frac{1}{(x-1)^2 + y^2} > \frac{1}{2}.","['complex-analysis', 'algebra-precalculus']"
27,The complex version of the chain rule,The complex version of the chain rule,,"I want to prove the following equality: \begin{eqnarray} \frac{\partial}{\partial z} (g \circ f) = (\frac{\partial g}{\partial z} \frac{\partial f}{\partial z}) + (\frac{\partial g}{\partial \bar{z}} \frac{\partial \bar{f}}{\partial z}) \end{eqnarray} So I decide to do the following: \begin{eqnarray} \frac{\partial}{\partial z} (g \circ f) = \frac{1}{2}[(\frac{\partial g}{\partial x} \circ f)(\frac{\partial f}{\partial x}) + \frac{1}{i}(\frac{\partial g}{\partial y} \circ f)(\frac{\partial f}{\partial y})] \end{eqnarray} but the thing is that I am doing something wrong here since I don't get any conjugate function and any derivative with respect to $\bar{z}$ so Can someone help me to see where I am wrong and fix it please? In fact I don't see what to do next, so I appreciate your help. Thanks a lot in advance. Edition: What I've got so far is the following: $$\frac{1}{2}[(\frac{\partial g}{\partial x} \circ f + \frac{\partial g}{\partial y} \circ f)\frac{\partial f}{\partial z} ]$$ but I'm still stuck.","I want to prove the following equality: \begin{eqnarray} \frac{\partial}{\partial z} (g \circ f) = (\frac{\partial g}{\partial z} \frac{\partial f}{\partial z}) + (\frac{\partial g}{\partial \bar{z}} \frac{\partial \bar{f}}{\partial z}) \end{eqnarray} So I decide to do the following: \begin{eqnarray} \frac{\partial}{\partial z} (g \circ f) = \frac{1}{2}[(\frac{\partial g}{\partial x} \circ f)(\frac{\partial f}{\partial x}) + \frac{1}{i}(\frac{\partial g}{\partial y} \circ f)(\frac{\partial f}{\partial y})] \end{eqnarray} but the thing is that I am doing something wrong here since I don't get any conjugate function and any derivative with respect to $\bar{z}$ so Can someone help me to see where I am wrong and fix it please? In fact I don't see what to do next, so I appreciate your help. Thanks a lot in advance. Edition: What I've got so far is the following: $$\frac{1}{2}[(\frac{\partial g}{\partial x} \circ f + \frac{\partial g}{\partial y} \circ f)\frac{\partial f}{\partial z} ]$$ but I'm still stuck.",,['complex-analysis']
28,stein and shakarchi complex analysis exercise 3.15 (b),stein and shakarchi complex analysis exercise 3.15 (b),,"I can't solve this exercise from the book, can anyone give me a hint? Show that if $f$ is holomorphic in the unit disc, is bounded, and converges   uniformly to zero in the sector $\theta < \arg z < \varphi$ as $|z| \to 1$, then $f = 0$. (Use the Cauchy inequalities or the maximum modulus principle) My idea was to extend $f$ continuously to the border of the domain : $θ < \arg z < \varphi$ as $|z| = 1$ then since $f=0$ on the border, $f=0$ in the whole domain. However I can't show that $f$ is continuously extendable. thank you!","I can't solve this exercise from the book, can anyone give me a hint? Show that if $f$ is holomorphic in the unit disc, is bounded, and converges   uniformly to zero in the sector $\theta < \arg z < \varphi$ as $|z| \to 1$, then $f = 0$. (Use the Cauchy inequalities or the maximum modulus principle) My idea was to extend $f$ continuously to the border of the domain : $θ < \arg z < \varphi$ as $|z| = 1$ then since $f=0$ on the border, $f=0$ in the whole domain. However I can't show that $f$ is continuously extendable. thank you!",,['complex-analysis']
29,Do the polynomials $(1+z/n)^n$ converge compactly to $e^z$ on $\mathbb{C}$?,Do the polynomials  converge compactly to  on ?,(1+z/n)^n e^z \mathbb{C},"The question is Do the polynomials $p_n(x)=(1+z/n)^n$ converge compactly (or uniformly on compact subsets) to $e^z$ on $\mathbb{C}$? I thought about expanding $$p_n(z)=\sum_{k=0}^n a_k^{(n)}z^k$$ where $$a_k^{(n)}=\binom{n}{k}\frac{1}{n^k}=\frac{1}{k!}\prod_{j=0}^{k-1}\left(1-\frac{j}{n}\right)$$ and trying to show that $\frac{1}{k!}-a_k^{(n)}$ decreases sufficiently fast on any closed ball. That is, I tried to show $$\lim_{n\rightarrow\infty}\max_{z\in\overline{B_0(A)}}\left|\sum_{k=0}^n\frac{z^k}{k!}-p_n(z)\right|=0$$ for any fixed $A>0$, but I had difficulty with this approach. Any help is appreciated.","The question is Do the polynomials $p_n(x)=(1+z/n)^n$ converge compactly (or uniformly on compact subsets) to $e^z$ on $\mathbb{C}$? I thought about expanding $$p_n(z)=\sum_{k=0}^n a_k^{(n)}z^k$$ where $$a_k^{(n)}=\binom{n}{k}\frac{1}{n^k}=\frac{1}{k!}\prod_{j=0}^{k-1}\left(1-\frac{j}{n}\right)$$ and trying to show that $\frac{1}{k!}-a_k^{(n)}$ decreases sufficiently fast on any closed ball. That is, I tried to show $$\lim_{n\rightarrow\infty}\max_{z\in\overline{B_0(A)}}\left|\sum_{k=0}^n\frac{z^k}{k!}-p_n(z)\right|=0$$ for any fixed $A>0$, but I had difficulty with this approach. Any help is appreciated.",,"['complex-analysis', 'complex-numbers']"
30,Complex Analysis: Show that $Arg(z)$ is discontinuous at each point on the nonpositive real axis.,Complex Analysis: Show that  is discontinuous at each point on the nonpositive real axis.,Arg(z),"That's the question. I'm not entirely how to prove, per se, that $Arg(z)$ is discontinuous at every point on the nonpositive real axis. By definition, $- \pi < Arg(z) \leq \pi$, so I'm not sure what there is to show?","That's the question. I'm not entirely how to prove, per se, that $Arg(z)$ is discontinuous at every point on the nonpositive real axis. By definition, $- \pi < Arg(z) \leq \pi$, so I'm not sure what there is to show?",,['complex-analysis']
31,Showing that $f$ has exactly one fixed point,Showing that  has exactly one fixed point,f,"Let $\gamma$ be the circle $\{z \in \mathbb{C}: \lvert z\rvert=1  \}$. Suppose $f$ is a function analytic on an open set containing $\gamma$ and its interior and that $\lvert\, f(z)\rvert<1$ for each $z$ on $\gamma$. Show that $f$ has exactly one fixed point inside $\gamma$ That is, there is exactly one $z$ in the open unit disk with $f(z)=z$. Is this a result of Louville's theorem? I don't know how to approach it.","Let $\gamma$ be the circle $\{z \in \mathbb{C}: \lvert z\rvert=1  \}$. Suppose $f$ is a function analytic on an open set containing $\gamma$ and its interior and that $\lvert\, f(z)\rvert<1$ for each $z$ on $\gamma$. Show that $f$ has exactly one fixed point inside $\gamma$ That is, there is exactly one $z$ in the open unit disk with $f(z)=z$. Is this a result of Louville's theorem? I don't know how to approach it.",,"['complex-analysis', 'analysis', 'fixed-point-theorems']"
32,Where does complex exponential come from?,Where does complex exponential come from?,,The complex exponential function is defined as : $$e^{ix} = \cos x + i\sin x$$ It shares most of its properties with real exponential and it allows a lot of trigonometric calculations such as de Moivre's formula : $$(\cos x+i\sin x)^n = \cos{nx}+i\sin{nx}$$ But where does this definition come from and why does it work ?,The complex exponential function is defined as : $$e^{ix} = \cos x + i\sin x$$ It shares most of its properties with real exponential and it allows a lot of trigonometric calculations such as de Moivre's formula : $$(\cos x+i\sin x)^n = \cos{nx}+i\sin{nx}$$ But where does this definition come from and why does it work ?,,['complex-analysis']
33,Branch cut and $\log(z)$ derivative,Branch cut and  derivative,\log(z),"I'm a little confused about the branch cut thing. Given an entire functions $f(z),g(z),h(z)$, $z\in \mathbb C$, such that $f(x)=g(x)+h(x)$ for all $x\in \mathbb R$, $f$ and $g+h$ doesn't vanish on $\mathbb  R$ . I take the $\log$ for both sides then differentiate and get: $$\log f(x)=\log(g(x)+h(x))$$ $$\frac{f'(x)}{f(x)}=\frac{g'(x)+h'(x)}{g(x)+h(x)}$$ I thought this is correct, but I was asked about ""what is the branch cut I used here?"", and I don't know what does this mean, and what is the answer for this question! Any help!? Edit: I also have the same problem with the following case: If $f(x)=e^{g(x)}$ then $\log f(x)=g(x)$, and $\frac{f'(x)}{f(x)}=g'(x)$, also a branch cut issue!","I'm a little confused about the branch cut thing. Given an entire functions $f(z),g(z),h(z)$, $z\in \mathbb C$, such that $f(x)=g(x)+h(x)$ for all $x\in \mathbb R$, $f$ and $g+h$ doesn't vanish on $\mathbb  R$ . I take the $\log$ for both sides then differentiate and get: $$\log f(x)=\log(g(x)+h(x))$$ $$\frac{f'(x)}{f(x)}=\frac{g'(x)+h'(x)}{g(x)+h(x)}$$ I thought this is correct, but I was asked about ""what is the branch cut I used here?"", and I don't know what does this mean, and what is the answer for this question! Any help!? Edit: I also have the same problem with the following case: If $f(x)=e^{g(x)}$ then $\log f(x)=g(x)$, and $\frac{f'(x)}{f(x)}=g'(x)$, also a branch cut issue!",,['complex-analysis']
34,"For holomorphic $f$, $f(\frac{z}{2})= \frac{1}{2}f(z) \Longrightarrow f(z) = z$","For holomorphic ,",f f(\frac{z}{2})= \frac{1}{2}f(z) \Longrightarrow f(z) = z,"Let $f$ be a holomorphic function on the open unitary disk $\mathbb{D}$ and continuous on $\mathbb{\overline{D}}$. If $f(\frac{z}{2})= \frac{1}{2}f(z)$ for all $z\in \mathbb{\overline{D}}$ and $f(1)=1$, then $f(z)=z$ for all $z\in \mathbb{\overline{D}}$. Got this as homework. Any hints would be highly appreciated.","Let $f$ be a holomorphic function on the open unitary disk $\mathbb{D}$ and continuous on $\mathbb{\overline{D}}$. If $f(\frac{z}{2})= \frac{1}{2}f(z)$ for all $z\in \mathbb{\overline{D}}$ and $f(1)=1$, then $f(z)=z$ for all $z\in \mathbb{\overline{D}}$. Got this as homework. Any hints would be highly appreciated.",,['complex-analysis']
35,Integral using residue theorem complex analysis [closed],Integral using residue theorem complex analysis [closed],,"Closed. This question is off-topic . It is not currently accepting answers. This question is missing context or other details : Please improve the question by providing additional context, which ideally includes your thoughts on the problem and any attempts you have made to solve it. This information helps others identify where you have difficulties and helps them write answers appropriate to your experience level. Closed 7 years ago . Improve this question How to solve this integral using residue theorem? $$\int_0^∞ \frac{x^{(a-1)}}{(x+b)(x+c)} \, dx $$ $0 < a < 1, \ \ \ b > 0, \ \ \ c > 0$","Closed. This question is off-topic . It is not currently accepting answers. This question is missing context or other details : Please improve the question by providing additional context, which ideally includes your thoughts on the problem and any attempts you have made to solve it. This information helps others identify where you have difficulties and helps them write answers appropriate to your experience level. Closed 7 years ago . Improve this question How to solve this integral using residue theorem? $$\int_0^∞ \frac{x^{(a-1)}}{(x+b)(x+c)} \, dx $$ $0 < a < 1, \ \ \ b > 0, \ \ \ c > 0$",,"['complex-analysis', 'residue-calculus']"
36,why can't we define a branch of $\log f(z)$ in the whole complex plane?,why can't we define a branch of  in the whole complex plane?,\log f(z),My question is really simple. The only problem to define a branch of $\log f(z)$ in the whole complex plane is because we can have $f(z)=0$ for some $z\in \mathbb C$? In fact I think I don't understand well what's the problem to define $\log f(z)$ in the whole complex plane. Could someone clarifies this for me?,My question is really simple. The only problem to define a branch of $\log f(z)$ in the whole complex plane is because we can have $f(z)=0$ for some $z\in \mathbb C$? In fact I think I don't understand well what's the problem to define $\log f(z)$ in the whole complex plane. Could someone clarifies this for me?,,['complex-analysis']
37,How to derive the value of $\log(-1)$?,How to derive the value of ?,\log(-1),"My book gives the following relation which I cannot derive myself. How to approach it? $$\log(-1)=(2n+1)\pi i, n=0,\pm1,... $$ The definition of logarithm I am using is, $\log z$ is any complex number  $ w$ such that $e^w=z$.","My book gives the following relation which I cannot derive myself. How to approach it? $$\log(-1)=(2n+1)\pi i, n=0,\pm1,... $$ The definition of logarithm I am using is, $\log z$ is any complex number  $ w$ such that $e^w=z$.",,"['complex-analysis', 'complex-numbers', 'logarithms']"
38,"$f(x)=x^3+ax^2+bx+c$ where $1\ge a\ge b\ge c\ge 0$. If $\lambda$ is any root of the polynomial, show that $|\lambda|\le 1$","where . If  is any root of the polynomial, show that",f(x)=x^3+ax^2+bx+c 1\ge a\ge b\ge c\ge 0 \lambda |\lambda|\le 1,"$f(x)=x^3+ax^2+bx+c$ where $1\ge a\ge b\ge c\ge 0$. If $\lambda$ is any root of the polynomial, show that $|\lambda|\le 1$. My attempt: As the polynomial is a cubic, it must have atleast one real root. So, I consider the $\mid\lambda\mid>1$ and $\lambda$ to be real and show that there arises a contradiction. Now, I differentiated the polynomial to see that $f'(x)>0$ from which I could conclude that if the roots are equal then I am done, but if roots are distinct then the other roots are imaginery. But, after several attempts, I could not show that $\mid\lambda\mid\le 1$. I considered using $\lambda\lambda'=\mid\lambda\mid^2$ where $\lambda'$ is the conjugate of the imaginery root, but that didn't seem to help. Please help. EDIT: Rouche's theorem is too advanced for me, please consider giving a more elementary solution. My level of knowledge should be near the undergraduate level.","$f(x)=x^3+ax^2+bx+c$ where $1\ge a\ge b\ge c\ge 0$. If $\lambda$ is any root of the polynomial, show that $|\lambda|\le 1$. My attempt: As the polynomial is a cubic, it must have atleast one real root. So, I consider the $\mid\lambda\mid>1$ and $\lambda$ to be real and show that there arises a contradiction. Now, I differentiated the polynomial to see that $f'(x)>0$ from which I could conclude that if the roots are equal then I am done, but if roots are distinct then the other roots are imaginery. But, after several attempts, I could not show that $\mid\lambda\mid\le 1$. I considered using $\lambda\lambda'=\mid\lambda\mid^2$ where $\lambda'$ is the conjugate of the imaginery root, but that didn't seem to help. Please help. EDIT: Rouche's theorem is too advanced for me, please consider giving a more elementary solution. My level of knowledge should be near the undergraduate level.",,"['complex-analysis', 'polynomials', 'complex-numbers', 'roots']"
39,Essential singularities of $\frac 1{e^z-1}$,Essential singularities of,\frac 1{e^z-1},"How do I show that $\frac 1{e^z-1}$ has essential singularities (instead of say, poles) at $z=2n\pi i(n\in \mathbb Z)$? I can't figure out how to show that the function does not go to infinity near $0$, or that it assumes every possible value near $0$. Exhibiting the laurent series around $0$ isn't general enough to show that essential singularities occur at all the stated points.","How do I show that $\frac 1{e^z-1}$ has essential singularities (instead of say, poles) at $z=2n\pi i(n\in \mathbb Z)$? I can't figure out how to show that the function does not go to infinity near $0$, or that it assumes every possible value near $0$. Exhibiting the laurent series around $0$ isn't general enough to show that essential singularities occur at all the stated points.",,"['complex-analysis', 'power-series']"
40,Computing the odd terms of the Taylor series of $\frac{z}{e^z-1}$,Computing the odd terms of the Taylor series of,\frac{z}{e^z-1},"I know that the terms are $0$ for odd $n > 1$, but I haven't had any luck proving this.  Computing them directly verifies this for small $n$; the function is also analytic, so I've tried taking the integrals $$f^{(n)}(0) = \frac{n!}{2\pi i}\oint_C \frac{f(t)\,\mathrm dt}{t^{n+1}},$$ but I haven't found a way to show that the answer is $0$ for odd $n$.","I know that the terms are $0$ for odd $n > 1$, but I haven't had any luck proving this.  Computing them directly verifies this for small $n$; the function is also analytic, so I've tried taking the integrals $$f^{(n)}(0) = \frac{n!}{2\pi i}\oint_C \frac{f(t)\,\mathrm dt}{t^{n+1}},$$ but I haven't found a way to show that the answer is $0$ for odd $n$.",,"['complex-analysis', 'taylor-expansion']"
