,title_raw,title_text,title_latex,body_raw,body_text,body_latex,tags
59,Contour integration and the central binomial coefficients,Contour integration and the central binomial coefficients,,"I am trying to compute the integral $$\int_{-\infty}^\infty \frac{x^{2n}}{(x^2 + 1)^{n + 1}}\ dx.$$ From computational evidence, it's very obvious that $$\int_{-\infty}^\infty \frac{x^{2n}}{(x^2 + 1)^{n + 1}}\ dx = \frac{\pi}{4^n} {2n \choose n}.$$ Indeed, I can prove this via the generating function for the central binomial coefficients. However, I want to prove this via contour integration. With $f(z) = z^{2n} / (z^2 + 1)^{n + 1}$ , we can integrate over the semicircle of radius $R$ in the upper half-plane. Call this contour $\gamma_R$ . The integral over the arc of $\gamma_R$ goes to zero as $R \to \infty$ , which leaves $$\int_{-\infty}^\infty \frac{x^{2n}}{(x^2 + 1)^{n + 1}}\ dx = 2\pi i \operatorname{res}_i f.$$ The residue of $f$ at $i$ is $g^{(n)}(i) / n!$ , where $$g(z) = \frac{z^{2n}}{(z + i)^{n + 1}}.$$ Thus, we should have $$g^{(n)}(i) = \frac{-i n! {2n \choose n}}{2^{2n + 1}}.$$ How can I show that this equality holds? Or, more generally, How can I compute the residue of $f$ at $i$ ? I tried using the series $$\frac{1}{(1 - z)^{n + 1}} = \sum_{k \geq 0} {k + n \choose k} z^k,$$ but couldn't really make it work. Edit: I was asked to explain why my evaluation is ""obvious."" This is from using a computer algebra system to directly evaluate $g^{(n)}(i)$ for a few dozen $n$ . This gives some rational expressions which, when looked up in the OEIS , suggest the closed form I have given here. Then it is a trivial matter to estimate the integral numerically and compare it for hundreds of terms.","I am trying to compute the integral From computational evidence, it's very obvious that Indeed, I can prove this via the generating function for the central binomial coefficients. However, I want to prove this via contour integration. With , we can integrate over the semicircle of radius in the upper half-plane. Call this contour . The integral over the arc of goes to zero as , which leaves The residue of at is , where Thus, we should have How can I show that this equality holds? Or, more generally, How can I compute the residue of at ? I tried using the series but couldn't really make it work. Edit: I was asked to explain why my evaluation is ""obvious."" This is from using a computer algebra system to directly evaluate for a few dozen . This gives some rational expressions which, when looked up in the OEIS , suggest the closed form I have given here. Then it is a trivial matter to estimate the integral numerically and compare it for hundreds of terms.","\int_{-\infty}^\infty \frac{x^{2n}}{(x^2 + 1)^{n + 1}}\ dx. \int_{-\infty}^\infty \frac{x^{2n}}{(x^2 + 1)^{n + 1}}\ dx = \frac{\pi}{4^n} {2n \choose n}. f(z) = z^{2n} / (z^2 + 1)^{n + 1} R \gamma_R \gamma_R R \to \infty \int_{-\infty}^\infty \frac{x^{2n}}{(x^2 + 1)^{n + 1}}\ dx = 2\pi i \operatorname{res}_i f. f i g^{(n)}(i) / n! g(z) = \frac{z^{2n}}{(z + i)^{n + 1}}. g^{(n)}(i) = \frac{-i n! {2n \choose n}}{2^{2n + 1}}. f i \frac{1}{(1 - z)^{n + 1}} = \sum_{k \geq 0} {k + n \choose k} z^k, g^{(n)}(i) n","['complex-analysis', 'derivatives', 'contour-integration']"
60,Differentiability of $\frac{xy^2(x+iy)}{x^2+y^4}$ at 0,Differentiability of  at 0,\frac{xy^2(x+iy)}{x^2+y^4},"This function is defined to be 0 at z=0  and the value at the rest of the points is given by that formula I tried to use the Cauchy Riemann equations. Here, $u=\frac{x^2y^2}{x^2+y^4}$ $u_x=\frac{2y^6x}{(x^2+y^4)^2}$ I'm getting $u_x=\frac{0}{0}$ at x=0, y=0. Similarly, I calculated $v_y$ and that's also 0/0 at z=0. I think I'm not doing it right. Please give me some hint.","This function is defined to be 0 at z=0  and the value at the rest of the points is given by that formula I tried to use the Cauchy Riemann equations. Here, I'm getting at x=0, y=0. Similarly, I calculated and that's also 0/0 at z=0. I think I'm not doing it right. Please give me some hint.",u=\frac{x^2y^2}{x^2+y^4} u_x=\frac{2y^6x}{(x^2+y^4)^2} u_x=\frac{0}{0} v_y,['complex-analysis']
61,Real part of complex integral,Real part of complex integral,,"Let $x:\Omega \subset  %TCIMACRO{\U{2102} }% %BeginExpansion \mathbb{R}^2 %EndExpansion \rightarrow  %TCIMACRO{\U{211d} }% %BeginExpansion \mathbb{R} %EndExpansion $ harmonic (I do not know if you need) and $\frac{\partial x}{\partial u_{1}},\frac{\partial x}{% \partial u_{2}}:\Omega \subset  %TCIMACRO{\U{2102} }% %BeginExpansion \mathbb{R}^2 %EndExpansion \rightarrow  %TCIMACRO{\U{211d} }% %BeginExpansion \mathbb{R} %EndExpansion $ their partial derivatives, with $\Omega $ simply connected open. Show that  $$  x\left( z\right) =\Re \int_{0}^{z}\left( \frac{\partial x}{% \partial u_{1}}\left( z\right) -i\frac{\partial x}{\partial u_{2}}\left( z\right) \right) dz. $$ I have looked in books of complex analysis, but I can not find the property that allows me this equality.","Let $x:\Omega \subset  %TCIMACRO{\U{2102} }% %BeginExpansion \mathbb{R}^2 %EndExpansion \rightarrow  %TCIMACRO{\U{211d} }% %BeginExpansion \mathbb{R} %EndExpansion $ harmonic (I do not know if you need) and $\frac{\partial x}{\partial u_{1}},\frac{\partial x}{% \partial u_{2}}:\Omega \subset  %TCIMACRO{\U{2102} }% %BeginExpansion \mathbb{R}^2 %EndExpansion \rightarrow  %TCIMACRO{\U{211d} }% %BeginExpansion \mathbb{R} %EndExpansion $ their partial derivatives, with $\Omega $ simply connected open. Show that  $$  x\left( z\right) =\Re \int_{0}^{z}\left( \frac{\partial x}{% \partial u_{1}}\left( z\right) -i\frac{\partial x}{\partial u_{2}}\left( z\right) \right) dz. $$ I have looked in books of complex analysis, but I can not find the property that allows me this equality.",,"['real-analysis', 'complex-analysis', 'differential-geometry', 'riemannian-geometry']"
62,Confusion about Nelson's proof of Liouville's theorem,Confusion about Nelson's proof of Liouville's theorem,,"Nelson's proof of Liouville's theorem (in the case $n=2$) is as follows: Consider a bounded harmonic function on Euclidean space. Since   it is harmonic, its value at any point is its average over any sphere,   and hence over any ball, with the point as center. Given two points,   choose two balls with the given points as centers and of equal radius.   If the radius is large enough, the two balls will coincide except for an   arbitrarily small proportion of their volume. Since the function is   bounded, the averages of it over the two balls are arbitrarily close,   and so the function assumes the same value at any two points. Thus   a bounded harmonic function on Euclidean space is a constant. I tried to formalize it. Let $f:\mathbb{C}\to\mathbb{C}$ be a holomorphic bounded function. If $z,w\in\mathbb{C}$ we have that \begin{align*}         |f(z)-f(w)| &= \frac{1}{\pi r^2}\left|\int_{D(z,r)}f(x+iy)\:\mathrm{d}x\:\mathrm{d}y - \int_{D(w,r)}f(x+iy)\:\mathrm{d}x\:\mathrm{d}y\right|\\ &= \frac{1}{\pi r^2}\left|\int_{A}f(x+iy)\:\mathrm{d}x\:\mathrm{d}y - \int_{B}f(x+iy)\:\mathrm{d}x\:\mathrm{d}y\right| \\         &\leq \frac{2}{\pi r^2}(\sup |f|)\int_A 1\:\mathrm{d}x\:\mathrm{d}y \\         &= \frac{2}{\pi r^2}(\sup |f|) \left(2r^2\cos^{-1}\left(\frac{d}{2r}\right)-\frac{d}{2}\sqrt{4r^2-d^2}, \right)     \end{align*} where $d=|z-w|$. Observe what are $A$ and $B$ in the following drawing: I would expect that the right hand side tends to $0$ when $r\to\infty$. However, that is not the case. How should I formalize Nelson's proof?","Nelson's proof of Liouville's theorem (in the case $n=2$) is as follows: Consider a bounded harmonic function on Euclidean space. Since   it is harmonic, its value at any point is its average over any sphere,   and hence over any ball, with the point as center. Given two points,   choose two balls with the given points as centers and of equal radius.   If the radius is large enough, the two balls will coincide except for an   arbitrarily small proportion of their volume. Since the function is   bounded, the averages of it over the two balls are arbitrarily close,   and so the function assumes the same value at any two points. Thus   a bounded harmonic function on Euclidean space is a constant. I tried to formalize it. Let $f:\mathbb{C}\to\mathbb{C}$ be a holomorphic bounded function. If $z,w\in\mathbb{C}$ we have that \begin{align*}         |f(z)-f(w)| &= \frac{1}{\pi r^2}\left|\int_{D(z,r)}f(x+iy)\:\mathrm{d}x\:\mathrm{d}y - \int_{D(w,r)}f(x+iy)\:\mathrm{d}x\:\mathrm{d}y\right|\\ &= \frac{1}{\pi r^2}\left|\int_{A}f(x+iy)\:\mathrm{d}x\:\mathrm{d}y - \int_{B}f(x+iy)\:\mathrm{d}x\:\mathrm{d}y\right| \\         &\leq \frac{2}{\pi r^2}(\sup |f|)\int_A 1\:\mathrm{d}x\:\mathrm{d}y \\         &= \frac{2}{\pi r^2}(\sup |f|) \left(2r^2\cos^{-1}\left(\frac{d}{2r}\right)-\frac{d}{2}\sqrt{4r^2-d^2}, \right)     \end{align*} where $d=|z-w|$. Observe what are $A$ and $B$ in the following drawing: I would expect that the right hand side tends to $0$ when $r\to\infty$. However, that is not the case. How should I formalize Nelson's proof?",,['complex-analysis']
63,Doubts Regarding Proof Of Cauchy Integral Formula,Doubts Regarding Proof Of Cauchy Integral Formula,,"I was trying to understand the proof of Cauchy Integral formula from the book ""Complex Analysis"" By Stein and Shakarchi. I understand most steps of that proof, but I have one doubt: I understand that due to Cauchy Integral Theorem, the integral of the domain bounded by the curve $C$ is 0, and this irrespectively of the value around the $|\zeta|=\epsilon$ part. However in book they state that in the limit $\delta \to0$ the integral of $f(\zeta)/{(\zeta -z)}$ equals the one around the exterior circle part of $C$ plus the integral around the circle $|\zeta|=\epsilon$, and I do not get this part . Any Help will be appreciated","I was trying to understand the proof of Cauchy Integral formula from the book ""Complex Analysis"" By Stein and Shakarchi. I understand most steps of that proof, but I have one doubt: I understand that due to Cauchy Integral Theorem, the integral of the domain bounded by the curve $C$ is 0, and this irrespectively of the value around the $|\zeta|=\epsilon$ part. However in book they state that in the limit $\delta \to0$ the integral of $f(\zeta)/{(\zeta -z)}$ equals the one around the exterior circle part of $C$ plus the integral around the circle $|\zeta|=\epsilon$, and I do not get this part . Any Help will be appreciated",,"['complex-analysis', 'analysis', 'holomorphic-functions', 'cauchy-integral-formula']"
64,Sequence of polynomials converging to $\frac{1}{z}$ [duplicate],Sequence of polynomials converging to  [duplicate],\frac{1}{z},"This question already has answers here : Sequence of polynomials which converge uniformaly to 1/z (2 answers) Closed 5 years ago . Is there a sequence of polynomials converging uniformly to $\frac{1}{z}$ in $K:=\{z\in\mathbb{C}\mid 1<|z|<2\}$? My first attempt was to use the theorem of Runge which would apply if $K$ would be compact and $\mathbb{C}\setminus K$ connected. As $K$ is not closed, it is not compact. But if I consider the closure $\bar{K}$, then $\mathbb{C}\setminus\bar{K}$ is not connected? So the Theorem can not be applied here? Any other hints?","This question already has answers here : Sequence of polynomials which converge uniformaly to 1/z (2 answers) Closed 5 years ago . Is there a sequence of polynomials converging uniformly to $\frac{1}{z}$ in $K:=\{z\in\mathbb{C}\mid 1<|z|<2\}$? My first attempt was to use the theorem of Runge which would apply if $K$ would be compact and $\mathbb{C}\setminus K$ connected. As $K$ is not closed, it is not compact. But if I consider the closure $\bar{K}$, then $\mathbb{C}\setminus\bar{K}$ is not connected? So the Theorem can not be applied here? Any other hints?",,"['complex-analysis', 'polynomials', 'uniform-convergence']"
65,Question about compactness of the zero set of an analytic function of several variables,Question about compactness of the zero set of an analytic function of several variables,,"Hartogs's Theorem Let $f$ be a  holomorphic function on a set $G \setminus K$, where $G$ is an open subset of $\mathbb{C}^n$ ($n \ge  2$) and $K$ is a compact subset of $G$. If the complement $G\setminus  K$ is connected, then $f$ can be extended to a unique to a unique   holomorphic function on $G$. This theorem can be used to show the following result about the zeros of analytic functions of several variables. Suppose that $f$ is an analytic function on some open set $U$ and that   $f$ is not identically zero on $U \subset \mathbb{C}^n$ with $n \ge 2$.   Then, the set of zeros of $f$ (i.e. $\Lambda(f)=\{ z: f(z)=0\}$) is not compact. Since  $\Lambda(f)$ is not compact we can have the following three possibilities: $\Lambda(f)$ is closed but is not bound $\Lambda(f)$ is not closed but  bounded $\Lambda(f)$ is not closed and not bounded My question is the following: Can we come up with examples of $f$ for each of the three cases? Here is an example of the function that satisfies the first case.  Let  $f_1(z_1,z_2)=z_1 \cdot z_2$ then \begin{align} \Lambda(f_1)= \{  (z_1,z_2) : z_1=0 \} \cup \{  (z_1,z_2) : z_2=0 \}.  \end{align} where  $\Lambda(f_1)$ is closed but not bounded.","Hartogs's Theorem Let $f$ be a  holomorphic function on a set $G \setminus K$, where $G$ is an open subset of $\mathbb{C}^n$ ($n \ge  2$) and $K$ is a compact subset of $G$. If the complement $G\setminus  K$ is connected, then $f$ can be extended to a unique to a unique   holomorphic function on $G$. This theorem can be used to show the following result about the zeros of analytic functions of several variables. Suppose that $f$ is an analytic function on some open set $U$ and that   $f$ is not identically zero on $U \subset \mathbb{C}^n$ with $n \ge 2$.   Then, the set of zeros of $f$ (i.e. $\Lambda(f)=\{ z: f(z)=0\}$) is not compact. Since  $\Lambda(f)$ is not compact we can have the following three possibilities: $\Lambda(f)$ is closed but is not bound $\Lambda(f)$ is not closed but  bounded $\Lambda(f)$ is not closed and not bounded My question is the following: Can we come up with examples of $f$ for each of the three cases? Here is an example of the function that satisfies the first case.  Let  $f_1(z_1,z_2)=z_1 \cdot z_2$ then \begin{align} \Lambda(f_1)= \{  (z_1,z_2) : z_1=0 \} \cup \{  (z_1,z_2) : z_2=0 \}.  \end{align} where  $\Lambda(f_1)$ is closed but not bounded.",,"['complex-analysis', 'multivariable-calculus']"
66,characteristic function determines the distribution,characteristic function determines the distribution,,"I noticed that some probability and stats books talk about the characteristic function of a probability distribution of $\mathbb{R}^n$ and make the claim that the characteristic function uniquely determines the distribution even if the distribution does not have a density wrt to lebesgue measure (else this follows from injectivity of the fourier transform).  I assume this is not true for all Borel probability measures?  What are the correct general conditions on the measure?  And can I somehow use the proof I already know that the fourier transform is injective (namely by convolving $f$ with a sequence of $\phi_k$ so that $$f\ast \phi_k \rightarrow f$$ in $L^1$ and using properties of the Fourier transform to write $f\ast \phi_k$ in terms of $\hat{f}$) to prove the statement about characteristic functions? I notice, in trying to adapt the proof, for instance, that i would at least need translation to be continuous with respect to the $L^1_P$ norm, where $P$ is the probability distribution. I'm not sure whether or not this in itself implies $dP$ is absolutely continuous with respect to Lebesgue measure...","I noticed that some probability and stats books talk about the characteristic function of a probability distribution of $\mathbb{R}^n$ and make the claim that the characteristic function uniquely determines the distribution even if the distribution does not have a density wrt to lebesgue measure (else this follows from injectivity of the fourier transform).  I assume this is not true for all Borel probability measures?  What are the correct general conditions on the measure?  And can I somehow use the proof I already know that the fourier transform is injective (namely by convolving $f$ with a sequence of $\phi_k$ so that $$f\ast \phi_k \rightarrow f$$ in $L^1$ and using properties of the Fourier transform to write $f\ast \phi_k$ in terms of $\hat{f}$) to prove the statement about characteristic functions? I notice, in trying to adapt the proof, for instance, that i would at least need translation to be continuous with respect to the $L^1_P$ norm, where $P$ is the probability distribution. I'm not sure whether or not this in itself implies $dP$ is absolutely continuous with respect to Lebesgue measure...",,"['real-analysis', 'probability', 'complex-analysis', 'analysis', 'statistics']"
67,Convergence radius for Taylor series $f(z)=e^{z^3}\sin^3(z)-\frac{1}{2}\cos^2(z)+5\sin(z)$,Convergence radius for Taylor series,f(z)=e^{z^3}\sin^3(z)-\frac{1}{2}\cos^2(z)+5\sin(z),"Find the convergence radius for the Taylor series of $f(z)=e^{z^3}\sin^3(z)-\frac{1}{2}\cos^2(z)+5\sin(z)$. Since I have no singularities, does the Taylor series converges over all of $\mathbb{C}$, i.e. $R=\infty$?","Find the convergence radius for the Taylor series of $f(z)=e^{z^3}\sin^3(z)-\frac{1}{2}\cos^2(z)+5\sin(z)$. Since I have no singularities, does the Taylor series converges over all of $\mathbb{C}$, i.e. $R=\infty$?",,"['complex-analysis', 'convergence-divergence', 'taylor-expansion']"
68,"Use contour integral to show $\int_0^{2\pi}\frac{\mathrm dt}{(1+\cos(u)\cos(t))^2}=\frac{2\pi}{\sin^3(u)}$ for $u\in(0,\frac{\pi}{2})$",Use contour integral to show  for,"\int_0^{2\pi}\frac{\mathrm dt}{(1+\cos(u)\cos(t))^2}=\frac{2\pi}{\sin^3(u)} u\in(0,\frac{\pi}{2})","I would like to show using contour integrals that $\int_0^{2\pi}\dfrac{\mathrm dt}{(1+\cos(u)\cos(t))^2}=\dfrac{2\pi}{\sin^3(u)}$ for any $u\in(0,\frac{\pi}{2})$ . I first notice that $\cos(u)\in(0,1)$ , so that $\cos(u)\cos(t)\neq -1$ . If I introduce the complex variable $z=\cos(t)+i\sin(t)$ , then $z^{-1}=\cos(t)-i\sin(t)$ and $\cos(t)=\dfrac{z+z^{-1}}{2}$ . Now, $\dfrac{\mathrm dz}{\mathrm dt}=-\sin(t)+i\cos(t)=iz$ , so $\mathrm dt=\dfrac{\mathrm dz}{iz}$ . Now, I want to use the definition of a integral over a curve, i.e. $\displaystyle\int_\gamma f(z)\,\mathrm dz=\int_{a}^{b}f(\gamma(t))\gamma'(t)\,\mathrm dt$ , where $\gamma\colon[a,b]\to U\subset\mathbb{C}$ is a closed curve. But I have difficulites to match the expressions and to continue calculating the integral.","I would like to show using contour integrals that for any . I first notice that , so that . If I introduce the complex variable , then and . Now, , so . Now, I want to use the definition of a integral over a curve, i.e. , where is a closed curve. But I have difficulites to match the expressions and to continue calculating the integral.","\int_0^{2\pi}\dfrac{\mathrm dt}{(1+\cos(u)\cos(t))^2}=\dfrac{2\pi}{\sin^3(u)} u\in(0,\frac{\pi}{2}) \cos(u)\in(0,1) \cos(u)\cos(t)\neq -1 z=\cos(t)+i\sin(t) z^{-1}=\cos(t)-i\sin(t) \cos(t)=\dfrac{z+z^{-1}}{2} \dfrac{\mathrm dz}{\mathrm dt}=-\sin(t)+i\cos(t)=iz \mathrm dt=\dfrac{\mathrm dz}{iz} \displaystyle\int_\gamma f(z)\,\mathrm dz=\int_{a}^{b}f(\gamma(t))\gamma'(t)\,\mathrm dt \gamma\colon[a,b]\to U\subset\mathbb{C}","['integration', 'complex-analysis', 'definite-integrals', 'contour-integration']"
69,Intuition contradicts fact: $\frac{z}{1+z^2}$ has a pole at $\infty$?,Intuition contradicts fact:  has a pole at ?,\frac{z}{1+z^2} \infty,"Consider the function $$f(z)=\frac{z}{1+z^2}$$ Clearly, $$\lim_{z\to\infty}f(z)=0$$ from any directions. However, it still has a pole at infinity as the residue there is non zero: $$\operatorname*{Res}_{z=0}\frac1{z^2}\frac{1/z}{1+1/z^2}\ne 0$$ The function does not blow up to infinity but still has a pole there: how to reconcile? Is there an intuitive explanation for this phenomenon?","Consider the function $$f(z)=\frac{z}{1+z^2}$$ Clearly, $$\lim_{z\to\infty}f(z)=0$$ from any directions. However, it still has a pole at infinity as the residue there is non zero: $$\operatorname*{Res}_{z=0}\frac1{z^2}\frac{1/z}{1+1/z^2}\ne 0$$ The function does not blow up to infinity but still has a pole there: how to reconcile? Is there an intuitive explanation for this phenomenon?",,['complex-analysis']
70,"Evaluating $\int _0^\infty\,\frac{\ln x}{(1+x^2)^2}\,\text{d}x$ using the Residue Theorem",Evaluating  using the Residue Theorem,"\int _0^\infty\,\frac{\ln x}{(1+x^2)^2}\,\text{d}x","To evaluate this integral $$\int\limits_0^\infty\frac{\ln x}{(1+x^2)^2} \text{d}x\,,$$ Let us consider the following function. $$f(z)=\frac{\ln^2 z}{(1+z^2)^2}=\frac{\ln^2 z}{(z+i)^2(z-i)^2}\,.$$ The integral over $C_R$ and $C_\epsilon$ vanish as $R$ approaches $\infty$ and $\epsilon$ approaches $0$. So we only need to evaluate the residues $$\oint\limits_C f(z)dz = 2\pi i \sum \text{Res}\big(f(z)\big)\,.$$ The poles are $\pm i$ and of second order. Here is our chosen contour . Let us recall the residue of an $m$-th order of pole is $$\text{Res}[f(z);z_0]=\frac{1}{(m-1)!}\lim_{z\to z_0} \frac{\text{d}^{m-1}}{\text{d}z^{m-1}}\,(z-z_0)^m\,f(z)\,.$$ Consequently the residues are $$\text{Res}[f(z);i]=\lim_{z \to i}\Bigg(\frac{2\ln z}{z(z+i)^2}-\frac{2\ln^2 z}{(z+i)^3}\Bigg)=\frac{2\cdot \left(\frac{i\pi}{2}\right)}{-4i}-\frac{2\cdot (-\frac{\pi^2}{4})}{-8i}=-\frac{\pi}{4}+i\frac{\pi^2}{16}$$ As for the other pole $$\text{Res}[f(z);-i]=\lim_{z \to -i}\Bigg(\frac{2\ln z}{z(z-i)^2}-\frac{2\ln^2 z}{(z-i)^3}\Bigg)=\frac{2\cdot \left(\frac{i3\pi}{2}\right)}{4i}-\frac{2\cdot \left(-\frac{9\pi^2}{4}\right)}{8i}=\frac{3\pi}{4}-i\frac{9\pi^2}{16}\,.$$ Adding these two together and remembering the residue theorem, we have $$\oint\limits_C f(z)\,\text{d}z = 2\pi i \cdot \left(\frac{\pi}{2}-i\frac{\pi^2}{2}\right)=i\pi^2+\pi^3$$ On the other hand, for the integrals over $C_+$ and $C_-$, $z=x$ and $z=xe^{2\pi i}$ respectively. Hence, we can write $$\int\limits_\epsilon^R\frac{\ln^2 x}{(1+x^2)^2} \,\text{d}x + \int\limits_R^\epsilon \frac{(\ln x +2\pi i)^2}{(1+x^2)^2} \,\text{d}x=i\pi^2+\pi^3\,.$$ If we let $R \to \infty$ and $\epsilon \to 0$ and change the direction of the second integral, we get $$-4\pi i\int\limits_0^\infty\frac{\ln x}{(1+x^2)^2}\,\text{d}x + 4\pi^2\int\limits_0^\infty\frac{\text{d}x}{(1+x^2)^2}=i\pi^2+\pi^3\,.$$ Comparing the real and the imaginary parts $$\int\limits_0^\infty\frac{\ln x}{(1+x^2)^2}\,\text{d}x = -\frac{\pi}{4}$$ $$\int\limits_0^\infty\frac{\text{d}x}{(1+x^2)^2} = \frac{\pi}{4}$$","To evaluate this integral $$\int\limits_0^\infty\frac{\ln x}{(1+x^2)^2} \text{d}x\,,$$ Let us consider the following function. $$f(z)=\frac{\ln^2 z}{(1+z^2)^2}=\frac{\ln^2 z}{(z+i)^2(z-i)^2}\,.$$ The integral over $C_R$ and $C_\epsilon$ vanish as $R$ approaches $\infty$ and $\epsilon$ approaches $0$. So we only need to evaluate the residues $$\oint\limits_C f(z)dz = 2\pi i \sum \text{Res}\big(f(z)\big)\,.$$ The poles are $\pm i$ and of second order. Here is our chosen contour . Let us recall the residue of an $m$-th order of pole is $$\text{Res}[f(z);z_0]=\frac{1}{(m-1)!}\lim_{z\to z_0} \frac{\text{d}^{m-1}}{\text{d}z^{m-1}}\,(z-z_0)^m\,f(z)\,.$$ Consequently the residues are $$\text{Res}[f(z);i]=\lim_{z \to i}\Bigg(\frac{2\ln z}{z(z+i)^2}-\frac{2\ln^2 z}{(z+i)^3}\Bigg)=\frac{2\cdot \left(\frac{i\pi}{2}\right)}{-4i}-\frac{2\cdot (-\frac{\pi^2}{4})}{-8i}=-\frac{\pi}{4}+i\frac{\pi^2}{16}$$ As for the other pole $$\text{Res}[f(z);-i]=\lim_{z \to -i}\Bigg(\frac{2\ln z}{z(z-i)^2}-\frac{2\ln^2 z}{(z-i)^3}\Bigg)=\frac{2\cdot \left(\frac{i3\pi}{2}\right)}{4i}-\frac{2\cdot \left(-\frac{9\pi^2}{4}\right)}{8i}=\frac{3\pi}{4}-i\frac{9\pi^2}{16}\,.$$ Adding these two together and remembering the residue theorem, we have $$\oint\limits_C f(z)\,\text{d}z = 2\pi i \cdot \left(\frac{\pi}{2}-i\frac{\pi^2}{2}\right)=i\pi^2+\pi^3$$ On the other hand, for the integrals over $C_+$ and $C_-$, $z=x$ and $z=xe^{2\pi i}$ respectively. Hence, we can write $$\int\limits_\epsilon^R\frac{\ln^2 x}{(1+x^2)^2} \,\text{d}x + \int\limits_R^\epsilon \frac{(\ln x +2\pi i)^2}{(1+x^2)^2} \,\text{d}x=i\pi^2+\pi^3\,.$$ If we let $R \to \infty$ and $\epsilon \to 0$ and change the direction of the second integral, we get $$-4\pi i\int\limits_0^\infty\frac{\ln x}{(1+x^2)^2}\,\text{d}x + 4\pi^2\int\limits_0^\infty\frac{\text{d}x}{(1+x^2)^2}=i\pi^2+\pi^3\,.$$ Comparing the real and the imaginary parts $$\int\limits_0^\infty\frac{\ln x}{(1+x^2)^2}\,\text{d}x = -\frac{\pi}{4}$$ $$\int\limits_0^\infty\frac{\text{d}x}{(1+x^2)^2} = \frac{\pi}{4}$$",,"['integration', 'complex-analysis', 'definite-integrals', 'improper-integrals', 'contour-integration']"
71,How to estimate the following integral?,How to estimate the following integral?,,"I would like to estimate the integral $I_{s,t}$ by a constant $C$ independent of $s, t \in \mathbb S^1$: $$I_{s,t}=\int_{|r-s|\geq 2|t-s|} \frac{|t-s|}{|r-s|^2} \, dr,$$ where $r, s \, \mbox{and}\, t$ are in the unit circle $\mathbb S^1=\{\zeta\in \mathbb C: \, |\zeta|=1\}$. More precisely, I want to prove that, there exist a constant $C$ independent of $s, t \in \mathbb S^1$ such that  $$I_{s,t}=\int_{|r-s|\geq 2|t-s|} \frac{|t-s|}{|r-s|^2} \, dr< C.$$ Thank you in advance","I would like to estimate the integral $I_{s,t}$ by a constant $C$ independent of $s, t \in \mathbb S^1$: $$I_{s,t}=\int_{|r-s|\geq 2|t-s|} \frac{|t-s|}{|r-s|^2} \, dr,$$ where $r, s \, \mbox{and}\, t$ are in the unit circle $\mathbb S^1=\{\zeta\in \mathbb C: \, |\zeta|=1\}$. More precisely, I want to prove that, there exist a constant $C$ independent of $s, t \in \mathbb S^1$ such that  $$I_{s,t}=\int_{|r-s|\geq 2|t-s|} \frac{|t-s|}{|r-s|^2} \, dr< C.$$ Thank you in advance",,"['calculus', 'real-analysis', 'integration', 'complex-analysis', 'inequality']"
