question_id,title,body,tags
1802925,Difficult probability of choosing ball from bag with $7$ balls labelled from $1-7$,"This is a very interesting word problem that I came across in an old textbook of mine. So I know its got something to do with probability, which perhaps yields the shortest, simplest proofs, but other than that, the textbook gave no hints really and I'm really not sure about how to approach it. Any guidance hints or help would be truly greatly appreciated. Thanks in advance :) So anyway, here the problem goes: A bag contains seven balls numbered from $1$ to $7$. A ball is chosen at random
  and its number is noted. The ball is then returned to the bag. This is done a total of seven times. $(a)$ What is the probability that each ball is selected exactly once? $(b)$ What is the probability that at least one ball is not selected? $(c)$ What is the probability that exactly one of the balls is not selected? My thoughts: $(a)\, \left(\frac 17\right)^7=\frac{1}{823543}$ $(b) \, 1 - \frac{1}{823543}?$ $(c)$ No idea on this one. My head aches after just thinking about it.",['probability']
1802930,Constructing bijection from set of equivalence classes to another set,"Suppose $f:A \to B$ is surjective. Define a relation on $A$ by setting $x\sim y$ if $f(x) = f(y)$ . It is clear that $\sim$ is an equivalence relation on $A$ . Let $\mathcal{E}$ be the set of equivalence classes of $\sim$ . Prove that there is a bijection from $\mathcal{E} $ to $B$ . Attempt: We know $[e] = \{ x : f(e) = f(x) \} $ and $\mathcal{E} = \{ [e] : e \in A \} $ . Define $\varphi: \mathcal{E} \to B$ by $\varphi( [e] ) = f(e) $ . First, notice that if $[e] = [e']$ , then $\varphi( [e] ) = f(e) = f(e') = \varphi( [e']))$ so $\varphi$ is well defined. Next, if $f(e) \neq f(e')$ then $(e,e') \notin\; \sim$ . So $[e] \neq [e']$ so we have injectivity Finally, since $f$ is already surjective, we know that for every $b \in B$ , there is some $a \in A$ so that $f(a) = b$ . So, for every $b \in A$ , there is some $e \in A$ (so some $[e] \in \mathcal{E}$ ) such that $\varphi( [e] ) = f(e) \in B $ . so we have surjectivity Is this an enough argument? thanks","['real-analysis', 'equivalence-relations', 'functions', 'proof-verification']"
1802939,What is the significance of reversing the polarity of the negative eigenvalues of a symmetric matrix?,"Consider a full rank $n\times n$ symmetric matrix $A$ (coming from a set of physical measurements). I do an eigendecomposition of this matrix as $$A = E V E^T$$ Most of the eigenvalues are positive, while a few are negative but with much smaller magnitude compared to the maximum eigenvalue. I want to convert this matrix into a positive definite one but with minimal damage, for the purpose of my experiments. So I naively invert the polarity of the negative eigenvalues and construct a PSD matrix $$B = E |V| E'$$ Later, I realized there is a whole lot of research and algorithms available to find the nearest PSD matrix to a given symmetric matrix and what I am doing is not the right way. So I got hold of a few of those algorithms (with code) and tried out. These algorithms give nearest PSD matrix $C$ to $A$ than $B$ in terms of $2$-norm and Frobenius norm. Surprising part is when I use them in my experiments, I get far better results with $B$ than any of those algorithms. My understanding is that those algorithms usually end up in a low rank matrix (semi definite) and they do $C+\lambda I$ to make it make it a PSD where we get to choose $\lambda$. I am not able to understand fully why $B$ is giving good results than $C$ and what is the significance of $B$. I'd like to understand this as i want better solution than naively going for $B$ albeit it gives results.","['matrices', 'eigenvalues-eigenvectors', 'numerical-linear-algebra', 'linear-algebra']"
1802954,"How to evaluate $\frac{1}{2\pi}\int_0^{2\pi}\log\left\lvert re^{it}-\zeta\right\rvert\,dt$?","Prove that if $\zeta \in \mathbb{C}$ and $r>0$ then 
  $$
\frac{1}{2\pi}\int_0^{2\pi}\log\left\lvert re^{it}-\zeta\right\rvert\,dt = \log \left\lvert\zeta\right\rvert\,
$$ if $\,r\leq \left\lvert\zeta\right\rvert$, and it is $\,\log r\,$ if $\,r> \left\lvert\zeta\right\rvert$. My Try: First I consider the case where $\zeta=0$. Then we have only the case where $r>\left\lvert\zeta\right\rvert$. Then the result is obvious. Now suppose $\zeta\neq 0$. Then $\left\lvert\zeta\right\rvert>0$. Suppose $0<r'<\left\lvert\zeta\right\rvert$. 
Let $u\left(z\right)=\log\left\lvert z\right\rvert$ for $z\in \mathbb{C}$.
Then $u\left(-\zeta\right)>-\infty$. So $u\left(z\right)$ is harmonic near $-\zeta$. So there is $\rho>0$ $(\rho$ depends on $-\zeta)$ such that $u\left(-\zeta\right)=\log\left\lvert\zeta\right\rvert=\frac{1}{2\pi}\int_0^{2\pi}\log\left\lvert re^{it}-\zeta\right\rvert \, dt\,$ for all $0\leq r<\rho$. Now if $r'<\rho$ then we are done. But what if $r'>\rho$? That is the place where I stuck. Can somebody please help me to solve it? Moreover, I don't know how to handle the case where $r'=\left\lvert\zeta\right\rvert$ for the original problem.",['complex-analysis']
1802983,Prove that Triangle ABC is an equilateral triangle iff $\tan{A}+\tan{B}+\tan{C} = 3^\frac32$.,"This question is picked from AM GM HM inequalities, so this is to be proved form that concept only, I think it isn't possible because there is no inequality, but if it is please tell me how.","['inequality', 'trigonometry', 'triangles', 'geometry', 'contest-math']"
1802984,Does $\int_{0}^1\frac{\ln(1+x+x^2)}{x}\mathrm dx$ have a closed form?,"$$\int_0^1 \frac{\ln(1+x+x^2)}{x} \mathrm{d}x = 1.09662$$ I am trying to find a closed form of this integral. I think one might exist, this integral looks like it might be related to $\pi$, but I don't know.","['integration', 'definite-integrals']"
1803021,Intersection of any set of ideals is an ideal,"Prove that the intersection of any set of Ideals of a ring is an Ideal. I'm looking for hints . Let A, B both be Ideals of a ring R. Suppose $I \equiv A\cap B$ . Since A and B are both Ideals of a ring R, A and B are both Subrings of a ring R. In particular, we have that $\left ( A,+ \right ),\left ( A\setminus \left \{ 0 \right \} ,\cdot \right ),\left ( B,+ \right ),\left ( B\setminus \left \{ 0 \right \},\cdot  \right )$ are Abelian. Now, Suppose $x_{1},x_{2} \in I$ . I'm not entirely sure how I can justify $x_{1}+\left ( -x_{2} \right ) \in I.$ Might be overthinking this but I might have to use the fact that I is the intersection.","['abstract-algebra', 'ring-theory', 'ideals']"
1803030,Is it Possible to Show that the Determinant of a Symplectic Matrix is 1 Using Induction?,"We have for a $2 \times 2$ matrix $A$ that $A$ is symplectic if and only if $\det A =1$. Is there any way to use this fact as the base for an inductive proof of the fact that the determinant of any symplectic matrix is $1$? I tried writing it out in block matrix form but realized quickly that it was not as simple as I had thought, since: $a_{1,2} \dots a_{1,2n}$, and $a_{2,1}, \dots , a_{2n,1}$ don't have to be zero (although maybe this is possible to achieve via some similarity transformation that preserves the symplectic property?) The block matrix formed by deleting the first row and column doesn't have the correct dimensions to even be a symplectic matrix. It is unclear what the $2n-2 \times 2n-2$ matrix would be to use the inductive hypothesis for $n-1$ would be. Even just showing that it is possible to extend the result from $2 \times 2$ symplectic matrices to $4 \times 4$ symplectic matrices seems like it would be an accomplishment (to me).","['symplectic-linear-algebra', 'linear-algebra']"
1803080,"If the left Riemann sum of a function converges, is the function integrable?","If the left Riemann sum of a function over uniform partition converges, is the function integrable? To put the question more precisely, let me borrow a few definitions first. Pardon my use of potentially non-canon definitions of convergence. Given a bounded function $f:\left[a,b\right]\to\mathbb{R}$, A partition $P$ is a set $\{x_i\}_{i=0}^{n}\subset\left[a,b\right]$ satisfying $a=x_0\leq x_1\leq\cdots\leq x_n=b$. The norm of a partition $\newcommand\norm[1]{\left\lVert#1\right\rVert}\norm{P}:=\max_{0\leq i\leq n}|x_i-x_{i-1}|$ The left Riemann sum of $f$ over partition $P$ is $l(f,P):=\sum_{i=1}^nf(x_{i-1})(x_i-x_{i-1})$ The left Riemann sum of $f$ is said to converge to $L$ iff $\newcommand\norm[1]{\left\lVert#1\right\rVert}\forall\epsilon>0, \exists\delta>0:\norm{P}<\delta$ implies $\left|l(f,P)-L\right|<\epsilon$ A uniform partition $P_n$ of $n$ divisions is defined by $x_i=a+\frac{b-a}{n}i$ The left Riemann sum of $f$ over uniform partitions is said to converge to $L$ iff $\forall\epsilon>0, \exists N\in\mathbb{N}: n\geq N\implies \left|l(f,P_n)-L\right|<\epsilon$ Now, is the following statement true? If the left Riemann sum of $f$ converges to $L$, $f$ is Riemann integrable and its Riemann integral $\int_a^b f$ equals $L$ . In particular, I am curious whether the following limited case is true. If the left Riemann sum of $f$ over uniform partitions converges to $L$, $f$ is Riemann integrable and its Riemann integral $\int_a^b f$ equals $L$. My hunch is that the statements above are not true. But I can't come up with a counter example. Can someone give me some help here please?","['integration', 'riemann-integration', 'riemann-sum']"
1803105,Why is the index $i(\mathcal{L})$ of an ample line bundle on an abelian variety equal to $0$?,"I've seen that here https://www.math.uchicago.edu/~ngo/Shimura.pdf there's a theorem called Mumford's Vanishing Theorem (Theorem 2.2.2) which says: Let $\mathcal{L}$ be a line bundle on $X$ (abelian variety) such that $K(\mathcal{L})$ is finite. There exists a unique integer $i=i(\mathcal{L})$, $0\leq i(\mathcal{L})\leq g=\dim X$, such that $H^p(X,\mathcal{L})=(0)$ for $p\neq i$ and $H^i(X,\mathcal{L})\neq (0)$. Moreover, $\mathcal{L}$ is ample if and only if $i(\mathcal{L})=0$. This theorem has no proof here, and I'm intersted in understanding the last claim because, in the book ""Abelian Varieties"" of Mumford, the Vanishing Theorem doesn't say this result but it actually uses it implicity in the beginning of proof of the theorem at page 163 (old edition). So my question is: why is it true that $\mathcal{L}$ is ample if and only if $i(\mathcal{L})=0$? In particular I'm intersted in the implication $\mathcal{L}$ ample implies $i(\mathcal{L})=0$. Thank you!","['abelian-varieties', 'algebraic-geometry']"
1803153,"Is there a simple, intuitive way to see that $f(x)=x-\sqrt{x^2-1}<1$ if $x>1$","Is there a simple intuitive way to show that $f(x)=x-\sqrt{x^2-1}<1$ if $x>1$? I sense it could be done more simple than this: 1 - take the derivative $f'(x)=1-\frac{x}{\sqrt{x^2-1}}<0$ if $x>1$ so the slope of $f(x)$ in $(1,\infty)$ is negative. 2 - conclude Since $f(1)=1$ and the derivative is negative we have showed that $f(x)=x-\sqrt{x^2-1}<1$ if $x>1$ Question: is there a simple, intuitive way to see that $f(x)=x-\sqrt{x^2-1}<1$ if $x>1$?","['algebra-precalculus', 'calculus']"
1803165,Volume enclosed by $(x^2+y^2+z^2)^2=x$,"I need to calculate the volume of solid enclosed by the surface $(x^2+y^2+z^2)^2=x$, using only spherical coordinates. My attempt: by changing coordinates to spherical: $x=r\sin\phi\cos\theta~,~y=r\sin\phi\sin\theta~,~z=r\cos\phi$ we obtain the Jacobian $J=r^2\sin\phi$. When $\phi$ and $\theta$ are fixed, $r$ varies from $0$ to $\sqrt[3]{\sin\phi\cos\theta}$ (because $r^4=r\sin\phi\cos\theta$). Keeping $\theta$ fixed, we let $\phi$ vary from $0$ to $\pi$. Thus the volume equals: $$V=\int\limits_{0}^{\pi}\int\limits_{0}^{\pi}\int\limits_{0}^{\sqrt[3]{\sin\phi\cos\theta}}r^2\sin\phi ~dr ~d\phi ~d\theta=0$$
Which is obviously wrong. What am I doing wrong?","['volume', 'calculus', 'multivariable-calculus', 'integration', 'definite-integrals']"
1803182,Alice and Bob make all numbers to zero game,"Alice and Bob are playing a number game in which they write $N$ positive integers. Then the players take turns, Alice took first turn. In a turn : A player selects one of the integers, divides it by $2, 3, 4, 5$ or $6$, and then takes the floor to make it an integer again. If the integer becomes 0, it is erased from the board. The player who makes the last move wins. Assuming both play optimally, we need to predict who wins the game. Example : Let N=2 and numbers are [3,4] then alice is going to win this one. Explanation : Alice can win by selecting 4 and then dividing it by 2. The integers on the board are now [3,2]. 
Bob can make any choice, but Alice will always win. Bob can divide 2 by 3, 4, 5 or 6, making it 0 and removing it. Now only one integer remains on the board, 3, and Alice can just divide it by 6 to finish, and win, the game. Bob can divide 3 by 4, 5 or 6, making it 0 and removing it. Now only one integer remains on the board, 2, and Alice can just divide it by 6 to finish, and win, the game. Bob can divide 2 by 2. Now the integers are [1,3]. Alice can respond by dividing 3 by 3. The integers are now [1,1]. Now Bob has no choice but to divide 1 by 2, 3, 4, 5 or 6 and remove it (because it becomes 0). Alice can respond by dividing the remaining 1 by 2 to finish, and win, the game. Bob can divide 3 by 2 or 3. Now the integers are [1,2]. Alice can respond by dividing 2 by 2. The integers are now [1,1]. This leads to a situation as in the previous case and Alice wins.","['number-theory', 'game-theory', 'algorithms', 'combinatorics', 'combinatorial-game-theory']"
1803183,"Recurrence relation $a_r+6a_{r-1}+9a_{r-2}=3$, then find $a_{20}$","Consider the recurrence relation $a_r+6a_{r-1}+9a_{r-2}=3$, given that $a_0=0, a_1=1$. Let $a_{20}=x\times10^9$, then the value of $x$ is______ . My attempt: $a_r=3-6a_{r-1}-9a_{r-2}$ I calculated manually, I get $a_{20}=-6465079410=-6.46\times10^9$, so $x=-6.46$ Can you explain in formal way, please?","['combinatorics', 'recurrence-relations', 'discrete-mathematics']"
1803231,Best way to go about solving specific tricky 2.ODE,"I've been working on this equation for a while now. Find the particular solution of: $$y''-4y'+y=te^t+t$$ My first instinct was to use the method of undetermined coefficients, solving for $te^t$ and $t$ separately. So I tried this:$$y_{p1}=ate^t+be^t,  y_{p2}=at+b$$
I then worked out what these would be for $y''$ and $y'$ and put them back in the original equation $y''-4y+y$. This resulted in:$$y_{p1}:-2a-2at-2b=t,y_{p2}:a=t(1+3a)$$
So normally I'd be rid of the $t$'s and found a value for the $a$'s. Am I just doing this wrong, or can I not use undetermined coefficients here? Anyways, I also tried variation of parameters and ended up with this abomination: $$y_h=c_1e^{2t+\sqrt{3}t}+c_2e^{2t-\sqrt{3}t}$$
Which gives: $$V_1'=-V_2'e^{2\sqrt{3}}$$
and $$V_2'(-e^{2\sqrt{3}t}+(2+\sqrt{3})e^{2t+\sqrt{3}t})=te^t+t$$ So how would you solve this task? Have I been doing it wrong?
Question has been answered: WORK: $$y_{p1}=ate^t+be^t,  y_{p2}=at+b$$ $$y_{p1}:-2a-2at-2b=t,y_{p2}:a=t(1+3a)$$ For $y_{p1}$:$$(-2a)t+(-2a-2b)=t$$$$-2at=t,-2a-2b=0$$$$a=-1/2,b=1/2$$ For $y_{p2}$:$$-4a+at+b=t$$$$at=t,-4a+b=0$$$$a=1,b=4$$ Making $$y_p=y_{p1}+y_{p2} = -1/2te^t+1/2e^t+t+4$$
Thank you very much for your help.",['ordinary-differential-equations']
1803257,Series of integrable functions converges pointwise almost everywhere,"I need some help, solving the following problem I found in my textbook. QUESTIONS APPEAR IN BOLD CAPITALS . Let $(X,\Sigma,\mu)$ be a measure space and $f_n \colon X \to \mathbb{C}$ ($n \in \mathbb{N}$) be a sequence of integrable functions such that
  $$\sum_{n=1}^\infty \int_X |f_n| \mathrm{d}\mu < \infty.$$ Then $\sum_{n=1}^\infty f_n$ converges almost everywhere to an integrable function $f \colon X \to \mathbb{C}$ and 
  $$ \int_X f \mathrm{d}\mu = \sum_{n = 1}^\infty \int_X f_n \mathrm{d}\mu.$$ I know that monotonous convergence gives me
$$\sum_{n=1}^\infty \int_X |f_n| \mathrm{d}\mu =\int_X  \sum_{n=1}^\infty  |f_n| \mathrm{d}\mu,$$
i.e. $\sum_{n=1}^\infty  |f_n|$ is integrable.
Integrability of $\sum_{n=1}^\infty  |f_n|$ gives me that this series converges almost everywhere.
Hence, if $\sum_{n=1}^\infty |f_n(x)|$ converges, also $\sum_{n=1}^\infty f_n(x)$ converges. This implies that $\sum_{n=1}^\infty f_n$ converges almost everywhere to some $f$. Furthermore, $\sum_{n=1}^\infty |f_n|$ a majorant for $|\sum_{n=1}^\infty  f_n|$ and since $\sum_{n=1}^\infty f_n$ is measurable as the limit of measurable functions this gives the integrability of $\sum_{n=1}^\infty f_n$. WHY IS $f$ MEASURABLE? ( I think, this won't be the case if the measure space is not assumed to be complete. Am I right? But in case the measure space IS complete, I am good to go on. ) If I have this, then $f$ would be integrable as well, because it almost everywhere equals an integrable function. This implies
$$\int_X f\mathrm{d}\mu = \int_X \sum_{n=1}^\infty f_n \mathrm{d}\mu.$$ BUT WHY IS THIS EQUAL TO $\sum_{n=1}^\infty\int_X  f_n \mathrm{d}\mu$?","['measure-theory', 'proof-verification']"
1803262,Solving a functional equation ( $ f(x-y) = f(x)/f(y)$ ),"Consider the functional equation $$f(x-y)=f(x)/f(y)$$
  If $f'(0)= p$ and $f'(5)=q$, then what is the value of $f'(-5)$ ? My attempt. Using the equation written above I was able to determine the value $f(0)$, which is $1$. Now to find out the value of $f'(-5)$ I need to find the value of $f(5)$: then I believe I should use the chain rule of differentiation in order to get my final answer. Any hints on how to go about that?","['functional-analysis', 'functions']"
1803284,mathematics was recreated on a foundation of number concepts rather than geometrical ones,"In Richard  Courant and Fritz  John's book Introduction  to  Calculus  and  Analysis Volume  I , says In modern times mathematics was recreated and vastly expanded on a
foundation of number concepts rather than geometrical ones. Why such recreation happened ? For getting rid of the limitations of geometrical methods ?","['analytic-geometry', 'math-history', 'calculus', 'elementary-number-theory']"
1803293,A question about a route of a point that travels in a particular way through the plane,"I don't know exactly how to classify this question. It is not from any homeworks, just something I've been wondering about. Let's say that in the beginning of an experiment ( the beginning is $t=0$ secs) we have two points on the plane: one on $(0,0)$ and one on $(0, 1)$. They start moving by the following rules: The point that was on $(0,0)$ moves right, on the $x$-axis, in a constant speed of $1~\text{m}/\text{s}$. The point that was on $(0,1)$ also moves in a constant speed of $1~\text{m}/\text{s}$, but its direction changes, so that the direction of its speed is always directed to the first point (like a missile that follows a moving object). I hope I made myself clear. 
My question is: Is there a nice formula for the location of the second point on the plane for a given time $t$? How can it be derived? And what if we change the ratio between the constant speeds? Thank you for your time reading my question...","['ordinary-differential-equations', 'calculus']"
1803303,Why does the coordinate transformation from Cartesian coordinates leads to an additional term in the biharmonic operator in spherical coordinates,"I am trying to solve a problem in physics where the biharmonic operator is involved. I think that the bihahmonic operator can be obtained by taking twice the Laplace operator, such that $\nabla^4 f = \nabla^2 (\nabla^2 f)$. 
Here $f$ is a function of the polar angle $\phi$ only (i.e. in the axisymmetric case for the sake of simplicity.)
In this way, the Laplace operator reads
$$
\nabla^2 f(\phi) = \frac{1}{a^2 \sin\phi} \frac{\partial}{\partial \phi} \left( \sin\phi \frac{\partial f}{\partial \phi} \right) \, ,
$$
where $a$ being the sphere radius.
In principle, the biharmonic operator is obtained after applying twice the above operation, to obtain
$$
\nabla^4 f(\phi) = \frac{1}{a^4} 
\left( 
\frac{\partial^4 f}{\partial \phi^4} 
+ 2\cot\phi \frac{\partial^3 f}{\partial \phi^3}
-(2+\cot^2 \phi) \frac{\partial^2 f}{\partial \phi^2}
+\cot\phi (1+\cot^2\phi) \frac{\partial f}{\partial \phi}
\right) \, .
$$
However, if we start from the biharmonic equation in Cartesian coordinates, namely
$$
\nabla^4 f(x,y,z) = \frac{\partial^4 f}{\partial x^4} 
+ \frac{\partial^4 f}{\partial y^4} 
+ \frac{\partial^4 f}{\partial z^4}
+ 2 \left( 
\frac{\partial^4 f}{\partial x^2 \partial y^2}
+ \frac{\partial^4 f}{\partial y^2 \partial z^2}
+ \frac{\partial^4 f}{\partial x^2 \partial z^2}
\right) \, ,
$$
and apply the coordinate transformation to spherical, e.g. using Maple PDEchangecoords and of course drop the dependence on $r$ and $\theta$, I get the following biharmonic
$$
\nabla^4 f(\phi) = \frac{1}{a^4} 
\left( 
\frac{\partial^4 f}{\partial \phi^4} 
+ 2\cot\phi \frac{\partial^3 f}{\partial \phi^3}
-\cot^2 \phi\frac{\partial^2 f}{\partial \phi^2}
+\cot\phi (3+\cot^2\phi) \frac{\partial f}{\partial \phi}
\right) \, ,
$$
i.e. the following additional terms appear
$$
\frac{2}{a^4} \left( \frac{\partial^2 f}{\partial \phi^2} + \frac{\partial f}{\partial \phi} \cot \phi \right) \, , 
$$ My question is which resulting biharmonic operator is correct? What is the reason behind the discrepancy between the two results.
Thank you, a","['harmonic-analysis', 'ordinary-differential-equations', 'differential-geometry', 'partial-differential-equations']"
1803334,open and closed sets in discrete space,"I am confusing how to determine the set is clopen, neither open or closed, open but not closed and closed but not open. I read an example from ""Topology without Tears"". Let $X=\{a,b,c,d,e,f\}$ and $\tau=\{X,\emptyset,\{a\},\{c,d\},\{a,c,d\},\{b,c,d,e,f\}\}$. $\tau$ is a topology on $X$. Then The set $\{a\}$ is both open and closed. The set $\{b,c\}$ neither open nor closed. The set $\{c,d\}$ is open but not closed. The set $\{a,b,e,f\}$ is closed but not open. I still cant figure how it will be open,closed,both or neither. Can anyone explain to me? Thank you.",['general-topology']
1803352,why can't we define a branch of $\log f(z)$ in the whole complex plane?,My question is really simple. The only problem to define a branch of $\log f(z)$ in the whole complex plane is because we can have $f(z)=0$ for some $z\in \mathbb C$? In fact I think I don't understand well what's the problem to define $\log f(z)$ in the whole complex plane. Could someone clarifies this for me?,['complex-analysis']
1803416,"Does the function $d(x,y)= \frac{\lvert x-y\rvert} {1+{\lvert x-y\rvert}}$ define a metric on $\mathbb{R}^n?$","Does the function $d: \mathbb{R}^n \times \mathbb{R}^n \to \mathbb{R}$ given by: 
$$d(x,y)= \frac{\lvert x-y\rvert} {1+{\lvert x-y\rvert}}$$ define a metric on $\mathbb{R}^n?$ How do you go about proving this? Do I need to just show that it satisfies the three conditions to be a metric? If so how do I show them?","['multivariable-calculus', 'real-analysis', 'metric-spaces']"
1803419,How to solve probability when sample space is infinite?,"I came up with a random problem yesterday: Suppose that in a random trial, each point $(x,y)$ where $x,y \in \mathbb{R}$ and $0 \leq x,y \leq 1$ is assigned a value of $0$ with 50% chance and a value of $1$ with 50% chance. What is a chance that there is a 'continuous path' that joins the point (0,0) and the point (1,1), such that along the path every single point has the same assigned value? My intuition sort of says that the probability should be zero, but I don't really have a good reason why. For one thing, any particular path from (0,0) to (1,1) should have a 0% chance of occurring, but there are also an infinite number of possible paths from the point (0,0) to (1,1). In my head, the probability should depend on whether the ""zero"" was smaller than the ""infinity"" $$P \simeq \text{num paths} * P(\text{chance a path happens})$$ To evaluate the number of total paths, I sort of imagined constructing paths with straight lines. To construct an arbitrary path between (0,0) and (1,1), I would pick some number of intermediate points inbetween the two corners, and specify their $x$ coordinate and $y$ coordinate. Something like: $$\text{num paths} \simeq \aleph_1^2 + \aleph_1^4 + \cdot\cdot\cdot + \aleph_1^{\aleph_0} \simeq \aleph_1^{\aleph_0}$$ (First term is like I have to pick 2 real numbers for a single intermediate point, second term is if I pick 4 real numbers for two intermediate points, and so on) To evaluate the chance that any particular path happens, it's sort of like saying that for every point along the line, it must be assigned the same value. Hence, its sort of like: $$P(\text{chance a path happens}) \simeq \frac{1}{2}^{\aleph_1}$$ So combining the two, we have (very unrigorously): $$P \simeq \aleph_1^{\aleph_0} * \frac{1}{2}^{\aleph_1}$$ This seems not only super unrigorous, but I'm not even sure if you can even do this kind of thing. My friend's words keep echoing in my head, ""something something probability only means something when the sample space is actually defined properly something something"" 
Is the problem (as I have posed it) even meaningful in any sense? And does my poor attempt at a solution have any grain of meaningfulness in it?","['cardinals', 'probability', 'elementary-set-theory']"
1803437,"A polynomial of degree 3 that has three real zeros, only one of which is rational.","Find a polynomial of degree 3 that has three real zeros, only one of which is rational. My answer: $(x - \sqrt{2})(x - 3)(x - \pi)$. Is this correct? It does have two irrational zeros, but I'm not sure if I'm 100% right. P.S. Can I use a similar technique to come with an expression for the following question: A polynomial of degree 4 that has four real zeros, none of which is rational?","['algebra-precalculus', 'polynomials', 'functions']"
