question_id,title,body,tags
2161522,Sequence of non-zero holomorphic functions in the unit disk converges locally to 0,"I could not solve the following problem: Let $\{f_n\}_n$ be a sequence holomorphic functions in the unit disk $\mathbb{D}$ such that all $f_n$ are zero-free in $\mathbb{D}$, $|f_n|<1$ for all $n\geq1$ and $lim_{n\rightarrow\infty}f_n(0)=0$. Prove that the sequence converges uniformly on compacts of $\mathbb{D}$ to 0. This is what I tried: Since $|f_n|<1$, the sequence $\{f_n\}_n$ is uniformly bounded in any compact of $\mathbb{D}$ and hence by Montel theorem, $\{f_n\}_n$ is a normal family. Then, there is a subsequence $\{f_{n_k}\}_k$ that converges to a function $f$ uniformly over compact subsets of $\mathbb{D}$. Now, the sequence $\{f_{n_k}\}_k$ has no zeros and has limit $0$ in $z=0$ by the hypothesis, so $f(0)=0$. By Hurwitz theorem, $f$ is identically zero. But I cannot prove that $\{f_n\}_n$ converges to $f$ uniformly over compact sets. In fact, if I prove the uniform convergence for $\{f_n\}_n$ instead of a subsequence, then we are done. Can someone help me? PD: I looked for the same question but I did not find it. If it is duplicated, I apologize.","['complex-analysis', 'holomorphic-functions']"
2161545,The projection of a point onto a convex set is unique with respect to any norm,"Given a convex set $C$, the projection of a point $z$ onto $C$ is a point $x$ in $C$ that minimizes $\|z- x\|$. Say the minimum is achieved at $x^*\in C$. My textbook shows such $x^*$ is unique under the euclidean norm, as shown below. My guess is the uniqueness should hold regardless what norm is chosen, but I have trouble proving it. Thanks!","['optimization', 'linear-algebra']"
2161607,"Continuous function on a closed, bounded set","I am having some trouble dealing with the following Let $\Omega \subseteq \mathbb{R}^m$ be closed and bounded, and $f:\Omega \to \mathbb{R}^n$ continuous in $\Omega$. Without using Heine-Borel theorem, show that $f(\Omega)$ is closed. Can I find some sequence $(f(\mathbf{x}_k))$ such that $f(\mathbf{x}_k) \to f(\mathbf{x})$, with $f(\mathbf{x}) \in f(\Omega)$? Is it the right approach? If so, how do I build it or show it exists? Thanks!","['continuity', 'proof-writing', 'analysis']"
2161660,Let $R$ be the binary relation on $\mathbb{N}$ defined by $xRy$ ($x$ is in relation to $y$) defined by: $xRy$ if $xy=49$,"Let $R$ be the binary relation on $\mathbb{N}$ defined by $xRy$ ($x$ is in relation to $y$) defined by: $xRy$ if $xy=49$ A) $R$ is reflexive and $R$ is symmetric B) $R$ is reflexive and $R$ is not symmetric C) $R$ is not reflexive and $R$ is symmetric D) $R$ is not reflexive and $R$ is not symmetric The answer is C. I understand why it is symmetric, but why it is not reflexive? For example, if I have $xy=7\times7=49$ (which is reflexive relation, isn't it?). Anyone explain please? Thank You",['discrete-mathematics']
2161683,Divorced Couples Problems Combinatorics,"5 couples are sitting in a line but no one wants to sit next to their partner.
How many ways can this be done? Here's my solution. Is this correct?
$$10!-{5 \choose 1}2! \cdot 9!+{5 \choose 2}2!^2 \cdot 8!-{5 \choose 3}2!^3 \cdot 7!+{5 \choose 4}2!^4 \cdot 6!-{5 \choose 5}2!^5 \cdot 5!$$","['inclusion-exclusion', 'combinatorics', 'problem-solving', 'discrete-mathematics']"
2161699,Prove that the union of two ideals is an ideal only if one of the ideals is contained within the other.,"Here's my proof: Let the ideal $I = \{i_1, i_2,...\}$ and $J=\{j_1, j_2,...\}$ Then $I \cup J$ is an ideal only if for all $\nu, \mu$, $i_{\nu}+{j_\mu} \in I \cup J$. Let us assume that there exists an element $i_{\nu}$ of $I$ that does not belong to $J$. Then, for any $j_{\mu}$, either $i_{\nu}+{j_\mu} \in J$, which is a contradiction since it would imply that $i_{\nu} \in J$, or $i_{\nu}+{j_\mu} \in I$, which implies that $j_{\mu} \in I$. Letting $\mu$ run through the index of $J$, we get that $J \subset I$. Thus, our proof is complete. However, here are some things bothering me: There seems something fishy about this proof, but I can't point it out. Is my proof correct? Is this a constructive proof or a proof by contradiction? Does this proof use the Axiom of Choice? Thanks in advance for any help!","['abstract-algebra', 'ring-theory', 'proof-explanation', 'axiom-of-choice', 'ideals']"
2161719,"Two right triangles of equal perimeter share a side. Given an acute angle of one triangle, find the acute angles of the other.","Two right triangles shown below have equal perimeters. The hypotenuse of the orange triangle is one leg of the green triangle stacked on top of it. If the smallest angle of the orange triangle is $20^\circ $, what are the angles of the green triangle? Please help me. I didn't get any idea.","['trigonometry', 'triangles', 'geometry']"
2161769,Compute $\lim_{k\to\infty}E[T_k]$ of this CTMC.,"Consider a CTMC with state space on $\{3,4,5,..\}\times\{3,4,5,...\}$. The exponential rate $\gamma_{(i,j)}$ in state $(i,j)$ equals $i$. $P_{(i,j)\to(3i,j)}=\frac{1}{\sqrt{i}}$ and $P_{(i,j)\to(i,j+1)}=1-\frac{1}{\sqrt{i}}$. Let $T_k$ denote the time of the kth transition in the CTMC. If the CTMC is initialized to state (3,3) at time 0. Compute $\lim_{k\to\infty}E[T_k]$. In my opinion, it seems as $i$ grows, it is more likely that DTMC goes up. But I have no idea how it relates to the result.","['stochastic-processes', 'probability-theory']"
2161830,How to prove that any line contain at least three points?,"Hi i was reading a book called Symmetry and Pattern in Projective Geometry by Eric Lord, in his book the author give these axioms: Any two distinct points are contained in a unique line. In any plane, any two distinct lines contain a unique common point. Three points that do not lie on one line are contained in a unique plane. Three planes that do not contain a common line contain a unique common point. My question is if with these axioms can i prove the statement that any line contains at least three points?","['axioms', 'projective-geometry', 'geometry']"
2161894,Does the equation $a^{2} + b^{7} + c^{13} + d^{14} = e^{15}$ have a solution in positive integers,Does the equation $a^{2} + b^{7} + c^{13} + d^{14} = e^{15}$ have a solution in positive integers Like FLT -- cannot see how to attack this one :(,"['number-theory', 'diophantine-equations']"
