question_id,title,body,tags
3011614,The product of locally compact spaces is locally compact,"My definition of local compactness is as follows: A topological space $(X, \mathcal{T})$ is locally compact if, for every $x \in X$ , there is a $U \in \mathcal{T}$ with $x \in U$ such that $\overline{U}$ is compact. I am then asked to prove that, if $X$ and $Y$ are locally compact and Hausdorff , then $X \times Y$ equipped with the product topology is also locally compact. Trouble is, I don't believe I use Hausdorff in my proof! And I don't see where it breaks down. Here it is: Let $(X, \mathcal{T}_X)$ and $(Y, \mathcal{T}_Y)$ be locally compact. Consider a point $(x, y) \in X \times Y$ . Then there exist $U \in \mathcal{T}_X$ with $x \in U$ and $V \in \mathcal{T}_Y$ with $y \in V$ such that $\overline{U}$ is compact in $X$ and $\overline{V}$ is compact in $Y$ . Firstly, $U \times V$ is open in $X \times Y$ , and $(x,y) \in U \times V$ . Furthermore, $\overline{U}$ is compact as a subset of $X$ , so considered as a topological space with the subspace topology, it is also compact. Similarly for $\overline{V}$ . Then the space $\overline{U} \times \overline{V}$ equipped with the product topology is also compact. Now I believe that the product topology induced by the topologies on $\overline{U}$ and $\overline{V}$ is the same as the subspace topology induced by considering $\overline{U} \times \overline{V}$ as a subspace of $X \times Y$ . So $\overline{U} \times \overline{V}$ is also compact with respect to the subspace topology, and so it is a compact subset of $X \times Y$ . But $\overline{U} \times \overline{V} = \overline{U \times V}$ , so we're done.",['general-topology']
3011622,"Why are we using ""Euler's Number"" constantly? [duplicate]",This question already has answers here : Why is the number $e$ so important in mathematics? (8 answers) Closed 5 years ago . I am a student at technical university.We are currently studying Calculus and I am really curious about why we are using Euler's Number.,"['exponentiation', 'logarithms', 'functions', 'trigonometry', 'exponential-function']"
3011637,"Does $\lim_{(a, b) \to (0, 0)} \sqrt{\frac{a^2b^2}{a^2 + b^2}} = 0$?","Does $$\lim_{(a, b) \to (0, 0)} \ \sqrt{\frac{a^2b^2}{a^2 + b^2}} = 0 \ ?$$ I'm trying to show that $$\lim_{(a, b) \to (0, 0)} \ \sqrt{\frac{a^2b^2}{a^2 + b^2}} = 0 $$ but I am getting stuck. I was thinking that as a starting point I could show that $$\lim_{(a, b) \to (0, 0)} \ \frac{a^2b^2}{a^2 + b^2} = 0 $$ and then conclude that since $$\lim_{x \to 0} \sqrt{x} = 0$$ and $\frac{a^2b^2}{a^2 + b^2} \to 0$ as $(a, b) \to (0, 0)$ we arrive at $$\lim_{(a, b) \to (0, 0)} \ \sqrt{\frac{a^2b^2}{a^2 + b^2}} = 0.$$ Firstly is my approach above a correct one. Secondly how can show that $$\lim_{(a, b) \to (0, 0)} \ \frac{a^2b^2}{a^2 + b^2} = 0. $$ Because I don't see any way to show the above (apart from perhaps proving it from the definition directly, which I would like to avoid if there is an easier way to do it). Also it could be the case that the initial limit doesn't even exist.","['limits', 'multivariable-calculus']"
3011673,Different way of solving $\frac{d^2u}{dx^2}=1$?,"I'm a third year physics student, not a math student.
The conventional way to solve this would be: $$\frac{d^2u}{dx^2}=\frac{d}{dx}(\frac{du}{dx})=1 \Rightarrow d(\frac{du}{dx})= dx\Rightarrow \int d(\frac{du}{dx})=\int dx\Rightarrow \frac{du}{dx}=x+A \Rightarrow 
du=(x+A)dx \Rightarrow u=\frac{x^2}{2}+Ax+B$$ So I'm wondering if what follows is correct: $$\frac{d^2u}{dx^2}=1 \Rightarrow d^2u=(dx)^2 \Rightarrow d(du)=dxdx \Rightarrow \int d(du)=\int dxdx \Rightarrow du=\int dxdx$$ At this point, I don't know if there are other ways to proceed, but I use integration by parts $$\int vdw=vw-\int wdv$$ by considering $v=dx$ and $dw=dx$ , so that $w=x$ and $dv=d(dx)$ : $$du=\int dxdx=xdx-\int x·d(dx)$$ If I assume that $-\int x·d(dx)=C$ is a constant, we get $$du=xdx+C \Rightarrow u=\frac{x^2}{2}+Cx+D$$ which is what we had originally.
However, how would I go about proving that $\int x·d(dx)=constant$ ? Is it because $d(dx)=0$ ? And how do I prove that? Are there any other interesting ways to solve this differential equation?","['integration', 'indefinite-integrals', 'calculus', 'ordinary-differential-equations']"
3011692,How to show that $p(1)\ \text{is real} \iff \ p(-1)\ \text{is real}$,I have been working on this problem and I cannot figure it out! I spent hours of time on it with no use. Can anybody help? The question is: Suppose $p(x)$ is a polynomial with complex coefficients and even degree( $n=2k$ ). All zeros of $p$ are non-real and with length equal to $1$ . prove $$p(1)\in\mathbb{R} \;\;\Longleftrightarrow\;\; p(-1)\in\mathbb{R} $$,"['functions', 'linear-algebra', 'polynomials']"
3011739,If $\operatorname{Sym}_X \simeq \operatorname{Sym}_Y$ then there is bijection from $X \to Y$,"If $\operatorname{Sym}_X \simeq \operatorname{Sym}_Y$ then there is bijection from $X \to Y$ ? , I proved the other way around, i think i need to build $f$ from $\psi : \operatorname{Sym}_X \to\operatorname{Sym}_Y$ .","['symmetric-groups', 'group-theory', 'abstract-algebra']"
3011775,Geometric understanding of subtracting lambda from diagonals,"Given the definition of eigenvalues/eigenvectors: $Av = \lambda v $ you could rearrange the terms to be: $(A - \lambda I)v = 0$ Geometrically, the first equation says that multiplying by $A$ is the same as scaling the vector $v$ by $\lambda$ . However, in the second equation, how do you visualize the effect of subtracting the matrix $\lambda I$ from matrix $A$ and how does that induce a linearly dependent set of basis vectors? TL;DR: I understand that the new matrix $(A-\lambda I)$ collapses the span of $v$ into a lower dimension but I don't understand how $A$ relates to $(A-\lambda I)$ geometrically.","['visualization', 'linear-algebra', 'geometry', 'eigenvalues-eigenvectors']"
3011846,Limits for sine and cosine functions,"Recently I took a test where I was given these two limits to evaluate: $\lim_\limits{h \to 0}\frac{\sin(x+h)-\sin{(x)}}{h}$ and $\lim_\limits{h \to 0}\frac{\cos(x+h)-\cos{(x)}}{h}.$ I used sine and cosine addition formulas and found the value of each limit individually, eventually canceling out $\sin x\cdot \frac1h$ and $\cos x\cdot \frac1h$ because I learned that we can evaluate limits piece by piece. As a result, I got $\cos x $ and $-\sin x$ as my two answers. However, my teacher marked it wrong saying that we cannot cancel $\sin{x}\cdot\frac1h$ or $\cos{x}\cdot\frac1h$ because those limits do not exist. Can someone please explain why this doesn't work? I thought that we can cancel those limits out since we never look at $0,$ just around $0,$ when evaluating these two limits. Sine: $$\frac{\sin(x+h)-\sin(x)}h=\frac{\sin(x)\cos(h)+\sin(h)\cos(x)}h-\frac{\sin(x)}h$$ $$=\sin(x)\frac1h+\cos(x)-\sin(x)\frac1h=\cos(x)$$ Cosine: $$\frac{\cos(x+h)-\cos(x)}h=\frac{\cos(x)\cos(h)-\sin(x)\sin(h)}h-\cos(x)\frac1h$$ $$=\cos(x)\frac1h-\sin(x)\cdot1-\cos(x)\frac1h=-\sin(x)$$ Note: I am allowed to assume $\lim_\limits{x\to 0} \frac{\sin(h)}h=1,\lim_\limits{x\to 0} \frac{\cos(h)-1}h=0.$","['limits', 'calculus', 'trigonometry']"
3011870,mean vs median geometric interpretation?,"I'm looking at this picture on wikipedia, comparing the median and mean of an arbitrary distribution. But what does it mean exactly? From the figure, it looks like the mean is the center of mass of the distribution (in the sense that you could balance the distribution on that point). However, since the median has $50\%$ to its left and right, it seems a more reasonable candidate for the center of mass. Which one is it? And what is the geometric interpretation of the other metric?","['statistics', 'median', 'means']"
3011888,$\lim_{x\to -\infty} x+\sqrt{x^2-3x}$,"Hey so I'm having a bit of a hard time understanding this one. $\lim_{x\to -\infty} x+\sqrt{x^2-3x}$ 1) $x+\sqrt{x^2-3x}$ * $(\frac{x-\sqrt{x^2-3x}}{x-\sqrt{x^2-3x}})$ 2) $\frac{x^2-(x^2-3x)}{x-\sqrt{x^2-3x}}$ 3) $\frac{3x}{x-\sqrt{x^2(1-\frac{3}{x}})}$ 4) $\frac{3x}{x-\sqrt{x^2}*\sqrt{1-\frac{3}{x}}}$ 5) $\frac{3x}{x-x(\sqrt{1-\frac{3}{x}})}$ 6) $\frac{3}{1-(\sqrt{1-\frac{3}{x}})}$ Now I would just take the limit, it would result in $\frac{3}{1-1}$ which would be undefined. For some reason, the $x$ in the denominator of step 5 should turn into $-(-x)$ which in turn would be positive and therefore be $\frac{3}{1+\sqrt{1=\frac{3}{x}}}$ which would equal $\frac{3}{2}$ . I really don't get it. Apparently the $-\infty$ would mean that $\sqrt{x^2}$ = $-x$ . We didn't even evaluate the limit yet.. how does that turn into $-x$ , just because we know the limit is negative does not mean we evaluated it yet..., why not simplify until there is no more simplification to be done, which is what I did in my steps, which would evaluate to undefined? Would love some help, thanks!","['limits', 'calculus']"
3011980,Example for Etale Morphism,"I'm want to understand the concept of etale morphism of schemes using following definition: A morphism $f: X \to Y$ is etale iff it is * flat * (1), locally of finite type (2) and has the separable field condition (3): Here (1), (2) and (3) mean: (1) For every $x \in X$ the induced morphism $f_x ^{\#}:\mathcal{O}_{Y, f(x)} \to \mathcal{O}_X$ is flat (2) There exist an open affine neighbourhood $U_x =Spec(R)$ of $x$ and an o. a. n. $V_{f(x)}= Spec(S)$ of $f(x)$ with $f(U_x) \subset V_{f(x)}$ such that the induced ring map $S \to R$ is of finite presentation (3) Let $m_x \subset \mathcal{O}_{X,x}$ the unique maximal ideal of local ring $\mathcal{O}_{X,x}$ and respectively $m_{f(x)} \subset \mathcal{O}_{X,x}$ the unique maximal ideal of $\mathcal{O}_{Y,f(x)}$ : Then the induced finite field extension $\mathcal{O}_{Y,f(x)}/m_{f(x)} \to \mathcal{O}_{X,x}/m_x$ is separable I'm trying to acquire the intuition for etaleness by considering following four examples (a) $Spec(\mathbb{C}[T, T^{-1}]) \to Spec(\mathbb{C}[T])$ (b) $Spec(\mathbb{C}[T] /(T^d - 2))\to Spec(\mathbb{C}[T])$ (c) $Spec(\mathbb{C}[T, Y]/(Y^d - T)) \to Spec(\mathbb{C}[T])$ (d) $Spec(\mathbb{C}[T, T^{-1},Y]/(Y^d - T)) \to \mathbb{C}[T]$ My attempts: (a) Is is flat since it just a localization of $\mathbb{C}[T] $ on $T$ . Or a secound argument: Open embeddings are etale. But what about (b), (c) and (d)? All induced ring maps $\mathbb{C}[T] \to ...$ in (b),(c), (d)$ are quotient maps, therefore of finite presentaions. Since beeing from finite presentations behaves well under base changes / localisations, condition (2) holds. What about conditions (1) and (3)? Why it suffice to consider in all cases only the localisation on $p= (T)$ ? The main problem here for me is to analyze what hapens on stalks, therefore what happens with the localisations of the ring map $\mathbb{C}[T] \to ...$ with respect an arbitrary point /prime ideal $p =(T - \lambda)$ for $\lambda \in \mathbb{C}$ . I guess that one can distinguish two relevant cases 1. $\lambda=0$ and 2. $\lambda \neq 0$ arbitrary. Could anybody explain how to argue exactly for (1) and (3)?","['algebraic-geometry', 'schemes']"
3011998,Why am i getting two real roots of the cubic $x^3+x+5=0$,I was going through the solution of depressed cubic equation $$x^3+x+5=0$$ By Cardano's Method we assume $$x=u+v$$ Then we have $$(u+v)^3-3uv(u+v)-(u^3+v^3)=0$$ Comparing with given cubic we get $$u^3+v^3=-5 \tag{1}$$ $$uv=\frac{-1}{3}\tag{2}$$ Solving $(1)$ and $(2)$ we get $$u^3-\frac{1}{27u^3}=-5$$ Letting $u^3=p$ we get $$27p^2+135p-1=0$$ which gives two real distinct roots of $p$ which $\implies$ two real distinct roots of $u$ and hence two real distinct roots of $v$ Hence two distinct real roots of $x$ what went wrong here?,"['cubics', 'algebra-precalculus', 'polynomials']"
3012008,Evaluating double sums with related indices,"I am having trouble finding any techniques that allow people to solve double sums where the indices rely on each other. For example, suppose I have the following sum: $$\sum_{i=1}^{n-1}\sum_{j=i+1}^n i + j$$ What techniques can I use to eliminate the sums, and arrive at a simple algebraic expression in terms of only n?","['summation', 'discrete-mathematics']"
3012014,Permutation of array.,"Let $E$ be the set of the first $x$ even numbers and $O$ the set of the first $y$ odd numbers. (1) How many permutations are there of the set $E \cup O$ ? I think that's just $(x+y)!$ . (2) How many permutations are there such that the last element of $E$ appears at an odd position? Examples. $[1,2,3,4,5]$ doesn't count since $4$ occurs at position $4$ . $[4,1,2]$ counts since $2$ is at position $3$ . $[2,1,5,3]$ counts since $2$ is at position $1$ . Original post: Suppose we have an array of length z. Which consists of x different even numbers and y different odd numbers. So $x \in [2_1,4_2,6_3 \dots (2n)_x]$ and $y \in [1_1,3_2,5_3 \dots (2n+1)_y]$ So z = x+y. We also know that x => 1 always applies. 1st question: How many different arrays of length z there are. That should be exactly $z!$ many or? 2nd question: How many different arrays are there so that the last even number in the array is on an odd index. (The array in this example starts with index 1) Examples: 1) [1,2,3,4,5] This array has length 5. The last even number in the array is 4 and has index 4 in the array, so we don't count such an array. 2) [52,3,14]. The last even number in this array is 14 and has index 3. So such an array counts towards it. 3) [52,3,5,7]. The last even number in this array is 52 and has index 1. So such an array counts towards it.","['combinations', 'combinatorics']"
3012050,"Given second and first derivatives at 2 points, prove that some point in between them has third derivative greater than or equal to 24.","Let $f$ be a function that is $C^3$ on an open interval containing $[0,1]$ - that is,  the third derivative $f'''$ exists and is continuous on an open interval containing $[0,1]$ . Assume that $f(0) = f'(0) = f''(0) = 0$ and that $f'(1) = f''(1) = 0$ . If $f(1) = 1$ , prove that there is some $c\in\left(0,1\right)$ such that $f'''(c) \geq 24$ . Not sure how to approach this problem, been stuck on it for a while. Any help would be nice. I tried using the Mean Value Theorem, and got that at some point $c_1\in\left[0,1\right], f'(c_1) = \frac{f(1)-f(0)}{1-0}=1$ and there is some point $c_2 \in [c_1,1]$ such that $f''(c_2) = \frac{f'(1)-f'(c_1)}{1-c_1}=\frac{-1}{1-c_1}<-1$ and there is some point $c_3\in[c_2,1]$ such that $f'''(c_3) = \frac{f''(1)-f''(c_2)}{1-c_2}>1$ . I'm not sure how to extend this to $24$ though, or even if this method will work. Is there a way to use Taylor Polynomials perhaps?",['derivatives']
3012070,Tensor product of finitely generated algebras,I am trying to compute tensor product of finitely generated algebras over a field. I was able to compute few special tensor products. Is there a general technique which allows one to compute the tensor product for any two finitely generated algebras over a field. I'm looking for this because im interested in computing fibre product of schemes.,"['algebraic-geometry', 'tensor-products', 'commutative-algebra']"
3012078,An attractor for blow-up solutions to a cubic oscillator,"(Related to this MathOverflow question ). Consider the nonlinear ODE $$\tag{1}
\frac{d^2u}{dt^2}+u=u^3, \qquad t\in\mathbb R,$$ which has the conserved quantity $$\tag{2}
E=\frac12 u'^2+\frac12 u^2 -\frac14u^4.$$ Consider only these solutions that satisfy $u>0$ and $u'>0$ . I am interested in solutions that blow-up at time $T$ , in the sense that $$
\lim_{t \nearrow T} u(t)=+\infty.$$ The following family describes all solutions with $E=0$ , parametrized by the blow-up time; $$
u_{0, T}(t):=\frac{\sqrt{2}}{\sin(T-t)}.$$ The phase portrait suggests that the trajectories of these solutions are an attractor for (1); and this is reasonable, because (2) yields $$
u'=\sqrt{2E -u^2 + \frac12u^4} = \frac{u^2}{\sqrt2} + O(1), $$ so when $u$ is very big I expect $u$ to be indistinguishable from the unique solution to $v'=\frac{v^2}{\sqrt 2} $ that blows up at $T$ , that is, $$v_T(t)=\frac{\sqrt2}{T-t}, $$ and $v_T$ is asymptotically equivalent to $u_{0, T}$ as $t\nearrow T$ . I would like to obtain a more precise, quantitative version of this attraction. Question . Let $u$ be a solution to (1) such that $u(t)\to +\infty$ as $t\nearrow T$ . Is it true that $$|u(t)-u_{0, T}(t)|\to 0,\qquad \text{as }t\nearrow T?$$ Is it true that $$\frac{u(t)}{u_{0,T}(t)}\to 1,\qquad \text{as }t\nearrow T?$$ Remark . The equation (1) is a special case of Duffing equation .","['analysis', 'ordinary-differential-equations']"
3012090,How to evaluate this nonelementary integral?,"Let $x>0$ . I have to prove that $$
\int_{0}^{\infty}\frac{\cos x}{x^p}dx=\frac{\pi}{2\Gamma(p)\cos(p\frac{\pi}{2})}\tag{1}
$$ by converting the integral on the left side to a double integral using the expression below: $$
\frac{1}{x^p}=\frac{1}{\Gamma(p)}\int_{0}^{\infty}e^{-xt}t^{p-1}dt\tag{2}
$$ By plugging $(2)$ into $(1)$ I get the following double integral: $$
\frac{1}{\Gamma(p)}\int_{0}^{\infty}\int_{0}^{\infty}e^{-xt}t^{p-1}\cos xdtdx\tag{3}
$$ However, I unable to proceed any further as I am unclear as to what method should I use in order to compute this integral. I thought that an appropriate change of variables could transform it into a product of two gamma functions but I cannot see how that would work. Any help would be greatly appreciated.","['gamma-function', 'multivariable-calculus']"
3012183,"$n$ lines in a plane, proper coloring of intersection points with just 3 colors","Draw $n$ lines in a plane so that there are no parallel lines and there are no three lines passing through the same point. Each intersection point is colored red, green or blue. Prove that it is possible to color all intersection points in a “proper” way, so that any two adjacent points (like $A_i, A_j$ ) have different colors. This also means that if you ""travel"" along an arbitrary line, you will cross $n-1$ intersection points, constantly changing colors from one intersection point to another. My first (and last) try was to use induction. Obviously for two or three lines, we have one or three intersection points and with three colors available we have the base of induction proved. However, the induction step is more difficult. I was able to prove the induction step if in every possible arrangement of lines it was possible to find a line that divides the plane into two halves with one half having no intersection points. However, I was able to construct counter-examples where such line does not exist. The last time I tried to solve a similar red-green-blue problem I discovered Ramsey theory. I wonder what I will discover this time :)","['graph-theory', 'combinatorics', 'coloring', 'plane-geometry']"
3012200,Getting Canonical Coordinates in differential equations from Lie Group,"I've been trying to understand how Lie Groups can help solve differential equations ( this 12-page pdf is the most straightforward explanation I've seen). My understanding is that when a first-order differential equation $\frac{dy}{dx}=h(x,y)$ has a continuous ""translation symmetry"" $(x,y)\mapsto(x,y+\lambda)$ , it becomes very easy to solve the equation using basic integration of one variable. The problem is that most differential equations in standard $(x,y)$ coordinates don't have this nice translation symmetry, and so we need to change to a set of ""canonical coordinates"" $(X,Y)$ which do have the desired translation symmetry $(X,Y)\mapsto(X,Y+\lambda)$ . The main condition that these new canonical coordinates need to satisfy, is that the $Y$ coordinate should be aligned with the $\lambda$ variable ( $\frac{dY}{d\lambda}=1,\frac{dX}{d\lambda}=0$ ), so that we get the nice translation symmetry we want: $$\frac{dY}{d\lambda}=\frac{dY}{dx}\frac{dx}{d\lambda}+\frac{dY}{dy}\frac{dy}{d\lambda}=Y_x\xi+Y_y\eta=1$$ $$\frac{dX}{d\lambda}=\frac{dX}{dx}\frac{dx}{d\lambda}+\frac{dX}{dy}\frac{dy}{d\lambda}=X_x\xi+X_y\eta=0$$ We also require that the symmetry condition be satisfied: $$\frac{dY}{dX}=\frac{D_xY}{D_xX}=\frac{Y_x+Y_y y'}{X_x+X_y y'}=h(X,Y)$$ Here's where I'm stuck. Basically all the terms in the above equations are unknowns, and it seems incredibly difficult to solve for the new coordinates $(X,Y)$ . I've also seen the ""linearized symmetry condition"" below, but it still results in a difficult-to-solve equation: $$\eta_x-\xi_y h^2 +(\eta_y -\xi_x)h - (\xi h_x + \eta h_y) = 0$$ Is there a nice, algorithmic approach for deducing a set of canonical coordinates? Or does it ultimately come down to ""guess and check"" with the above equation?","['lie-groups', 'ordinary-differential-equations']"
3012229,Show that $\lim_{x\to0}f(x) = \lim_{x\to0}f(x^3)$ (Real Analysis),"I'm trying to prove  that $$\lim_{x\to0}f(x) = \lim_{x\to0}f(x^3)$$ (The domain is not specified and neither the continuity, so it really is only about the limit of an arbitrary function).. I'm guessing I need to simply use the definition. However I'm not sure where to start. Here is what I had in mind, however I feel like it's not at all how it should be proved. Proof Let $\lim_{x\to0}f(x) = L$ . Then, we have that $$ \forall \epsilon > 0, \exists \delta>0
 \text{ such that whenever } 0<|x|< \delta \Rightarrow |f(x) - L| < \epsilon$$ Let $y = x^3$ , then we want to show that $$|f(y) - L| < \epsilon \text{ whenever } 0<|x| = |y^{\frac{1}{3}}| < \delta$$ And here is where I get stuck. Is there any more efficient way to prove this? Thank you!","['limits', 'proof-verification', 'real-analysis']"
3012259,"Necessary, but not sufficient for showing $f$ is measurable.","I am trying show that if $\{ x\in [a, b] | f(x) =c\} $ is measurable for all $ c\in \mathbb{R} $ is not sufficient to show that $f$ is measurable on $[a, b] $ . \
Possible approach : I thought If I defined a non measurable set and define $ f$ to evaluate whether or not $ x $ is in the set.","['general-topology', 'measure-theory', 'real-analysis']"
3012277,Counting question on bit strings - problem with using cases,"How many bit strings of length 10 either begin with three 0s or end with two 0s? I solved this question using cases but I do not seem to be getting the answer of $352$ . My attempt:
Consider two cases: Case 1: The string begins with three $0$ s and does not end with two $0$ s. There is only $1$ way to choose the first three bits, $2^5$ ways for the middle bits, and $3$ ways for the last two bits ( $4$ ways to construct a string of two bits, minus $1$ way to make three $0$ s). There are $2^5 \cdot 3$ ways to construct strings of this type. Case 2: The string does not begin with three $0$ s but ends with two $0$ s. There are $2^3 - 1 = 7$ ways to choose the first three bits without three $0$ s, $2^5$ ways for the middle bits, and $1$ way for the last two bits. There are $7 \cdot 2^5$ ways to construct strings of this type. By the rule of sum, there are $2^5 \cdot 3 + 2^5 \cdot 7 = 320$ ways to construct bit strings of length 10 either begin with three $0$ s or end with two $0$ s.","['combinatorics', 'discrete-mathematics']"
3012298,F test vs T test. What is the real diference?,"As I've learnt, a T - test is used to compare 2 populations’ means, whereas an F-test (ANOVA) is used to compare 2/> populations’ variances. At the end is this doing the same thing? My background is from biology and no strong math/stat background. I wonder because whenever I used ANOVA (comparing >2 groups) followed by postHOC Tukey and not observing sig. differences, supervisor asking to use multiple t-test every time. Is this acceptable way of doing statistics. I see there are many publications in biology where they do not follow statistics taught in the Textbooks.","['statistical-inference', 'statistics', 'variance', 'normal-distribution']"
3012312,"Why are the fundamental and anti-fundamental representation in $\text{SL}(2,\mathbb{C})$ not equivalent?","I am currently learning group theory and I learnt that the fundamental representation and the anti-fundamental representation of $\text{SL}(2,\mathbb{C})$ , $2 \times 2$ matrix with determinant of $1$ , are not equivalent.  This means that no similarity transformation can map one of them to the other. My professor gave an explanation (on the 2nd last paragraph on page 75 of the following document http://www-pnp.physics.ox.ac.uk/~tseng/teaching/b2/b2-lectures-2018.pdf ) but I don't see how the difference in the signs in the exponent imply that the representations are inequivalent. Can anyone please explain the explanation of my professor, or perhaps give another explanation?","['group-theory', 'representation-theory', 'lie-groups']"
3012316,Positive semidefiniteness of symmetric matrix with diagonal = 1 and non-diagonal elements less than 1,Does anyone know any useful results with respect to symmetric matrices with constant diagonals (specifically with respect to whether all eigenvalues are greater than $0$ )? I am working on a set of general $n \times n$ matrices with diagonal entries all equal to $1$ and non-diagonal entries between $0$ and $1$ and I am attempting to figure out whether or not this is a subset of positive semidefinite matrices,"['matrices', 'linear-algebra', 'positive-semidefinite', 'symmetric-matrices']"
