question_id,title,body,tags
3009733,"Proof: There is no function $f \in C^2(\mathbb{R^3})$ with gradient $\nabla f(x,y,z) = (yz, xz, xy^2)$","How can one show that there is no function, which is a continuously partially derivable function $f \in C^2(\mathbb{R^3})$ with this gradient $$\nabla f(x,y,z) = (yz, xz, xy^2)$$ I thought about using the Hessian matrix since one has to calculate all second partial derivatives of $f$ there. Since only the gradient is given, can I calculate the antiderivatives first: $yz = xyz$ $xz = xyz$ $xy^2 = xy^2z$ Now I want to calculate the antiderivatives of the antiderivatives: $xyz = \frac{yzx^2}{2}$ $xyz = \frac{yzx^2}{2}$ $xy^2z = \dfrac{y^2zx^2}{2}$ I didn't calculate the antiderivatives of the partial derivatives and I don't even know if that way is correct...","['analysis', 'continuity', 'functions', 'partial-derivative', 'derivatives']"
3009749,Over Silverman’s differential forms on curves,"I’m reading Silverman’s Arithmetic of Ellipctic curves. In II.4 he gives an definition of differential form as the set of $dx$ for $x$ in $\overline{K}(C)$ . Taking the complex circle $x^2+y^2=1$ in $\mathbb{P}^2$ . By 4.2(a), $xdy$ is a differential form. By definition there exists $t\in\overline{K}(C)$ such that $dt=xdy$ . If we integrate $\sqrt{1-y^2}dy$ , it yields an $arcsin$ , which suggests that such a function $t$ wouldn’t be algebraic... What I’m I missing here? What is the function $t$ such that $dt=xdy$ ?","['algebraic-geometry', 'elliptic-curves']"
3009808,Finding the Green Function,"I'm having some trouble finding the Green function of the following differential equation: $$
\frac{d[x y'(x)]}{dx} = f(x)\\
0 \leq x \leq 1\\ 
y(1) = 0
$$ $y(0)$ is finite.","['boundary-value-problem', 'greens-function', 'ordinary-differential-equations']"
3009852,Table tennis win probability,"This problem is from my teacher and I think their answer is wrong. The problem is in the context of table tennis. The players in the tournament final are Ani and Bertha. The score in the game is drawn at 20-20. The final game will continue until one player has scored two more points than the other. It is known from previous games between Ani and Bertha that the probability of Ani winning each point is 0.6. Find the probability that Ani will win the game after exactly 8 more points. I think that this means that, over the next 6 games on the 2nd, 4th and 6th game Ani and Bertha need to have a draw. For each draw there are two possible paths. Ani wins then Bertha or Bertha then Ani. After the 6th game Ani just needs to win twice to win after exactly 8 points. However my teacher says that: If Bertha wins the first game, it is not possible for Ani to win after exactly 8 points. and also asserts that there is only one path to the desired outcome. Using this they find the probability of Ani winning after exactly 8 points to be 0.005. ( Here is the linked image: I found an alternate answer using multiple paths. $P(\text{Ani winning a game})=0.6$ $P(\text{Bertha winning a game})=0.4$ $P(\text{Ani win after 8 points})=2\dot(0.4 \cdot 0.6)\cdot2\dot(0.4 \cdot 0.6)\cdot2\dot(0.4 \cdot 0.6)\cdot(0.6\cdot0.6)=0.040\ (2sf)$ After I found this answer I asked my teacher if the proposed answer was correct. My teacher replied saying that there was nothing wrong with it. Am I missing something painfully obvious and if so what? or is the teacher's answer incorrect?","['decision-trees', 'probability']"
3009864,Babylonian Method Limit Question,"The Babylonian Method for finding square roots is a method that takes a guess, say $x$ , and averages $x$ and $\frac{a}{x}$ , where $a$ is the number you want to find the square root of. It then uses the average as a guess, and does the algorithm again. The value outputted will converge towards $\sqrt{a}$ . Translating this into algebraic terms, we get that $$\lim_{n\to\infty}f^n(2)=\sqrt{2},$$ where $f(x)=\frac{x+\frac{2}{x}}{2}$ . I wondered what would happen if we changed the initial input value. So, this is my question. Let $f(x)=\frac{x+\frac{2}{x}}{2}$ . What is $$\lim_{n\to\infty} f^n(2^n)?$$ Plugging this into my calculator, I got an answer that was about $1.591891656$ . I have no idea what is special about this number. If anyone could figure this out, I would appreciate it.","['limits', 'radicals']"
3009865,Maclaurin series for $\arctan^{2}(x)$,"I have a question here that requires me to find the Maclaurin series expansion of $\arctan^{2}(x)$ . Now I know how to find it for $\arctan(x)$ , by taking the derivative, expanding it into a series, and integrating back (given x is in the interval of uniform convergence), But applying that here leaves me with $$\frac{df}{dx}=2\arctan(x)\frac{1}{(x^2+1)}$$ I am not sure If I can pick out parts of the product (like $\arctan(x)$ ) and differentiate, expand , then integrate them. Even if I did, how would I go about multiplying two series? Is there an easier way to do this? Thanks.","['power-series', 'taylor-expansion', 'sequences-and-series']"
3009900,Folland Exercise 3.17,"Let $(X, \mathcal M, \mu)$ be a finite measure space, $\mathcal N$ a sub- $\sigma$ -algebra of $\mathcal M$ , and $\nu = \mu|\mathcal N$ .  If $f \in L^1(\mu)$ , there exists $g \in L^1(\nu)$ (thus $g$ is $\mathcal N$ -measurable) such that $\int_E f d\mu = \int_E g d\nu$ for all $E \in \mathcal N$ ; if $g'$ is another such function then $g = g'$ $\nu$ -a.e.  (In probability theory, $g$ is called the conditional expectation of $f$ on $\scr{N}$ .) I have managed to prove this statement to be true by defining a measure $\lambda$ such that $d\lambda = gd\nu$ and then using Lebesgue-Radon-Nikodym theorem. Now as an extension of the problem, I want to characterize $g$ in terms of $f$ when $\mathcal N = \{\emptyset, X\}$ , and when $\mathcal N=\{\emptyset, X, E, E^c\}$ for some $E\in\mathcal M$ . Now I'm not sure how to do the last bit, and completely stuck here. I would like to get some help on how to tackle the last part.","['measure-theory', 'real-analysis']"
3009914,$f$ is an entire function s.t $|f(z)|=1$ $\forall z \in \Bbb R$. prove that $f$ has no zeros in $\Bbb C$,My attempt: I was trying to apply identity theorem that if the zeros of the function do have any limit point and it will be a zero function but setting $g(z)=f(z)-1$ will not help me. Can anyone help me in that!!,"['analysis', 'complex-analysis', 'holomorphic-functions', 'entire-functions', 'analytic-functions']"
3009920,Find the sum: $\sum_{n=2}^\infty \frac{1}{n^2-1}$,"Evaluate : $$\sum_{n=2}^\infty \frac{1}{n^2-1}$$ I've tried to rewrite the questions as $$\sum _{n=2}^{\infty \:\:}\left(-\frac{1}{2\left(n+1\right)}+\frac{1}{2\left(n-1\right)}\right)$$ but still couldnt't get any answer as when I substitute numbers $(n)$ into the $Sn \left(-\frac{1}{6}+\frac{1}{2}-\frac{1}{8}+\frac{1}{4}-\frac{1}{10}\right)$ , $Sn$ just keeps going on and on.  So how do I solve this problem and what does this series converge to?","['limits', 'convergence-divergence', 'sequences-and-series']"
3009931,"Given an n by n matrix of 0s and 1s, find the maximum number of 1s you can remove if you can only remove 1s with another 1 in the same row or column","This is a computer science interview question I heard from a friend and we can't seem to figure it out. Basically, given a square matrix of 0s and 1s, you can remove any 1 one at a time, but only if at the current time there is another 1 in the same row or column as the 1 to be removed. What is an algorithm to calculate the maximum number of 1s that can be removed for any such matrix? I suspect this has something to do with graph theory (treating the matrix as an adjacency matrix) or possibly linear algebra, but I'm not certain. Any advice is appreciated. We did figure out the following: treating the matrix as a directed graph, where a 1 at (i,j) indicates an edge from i to j, then we can remove an edge from the graph iff after removing the edge there would still be an edge from i to another vertex OR there would still be a vertex from j to another vertex. So we want to remove the greatest number of edges (where we count a bidirectional edge as two different edges, one in each direction).","['graph-theory', 'matrices', 'linear-algebra', 'algorithms', 'computer-science']"
3009998,Show that the Mobius bundle is a smooth real line bundle and it is non-trivial.,"I'm reading John Lee's Introduction to Smooth manifolds 2nd edition. Consider the problem 10-1: Define an equivalence relation on $\mathbb{R}^2$ by $(x,y) \sim (x',y')$ if and only if $(x',y')=(x+n,(-1)^n y)$ for some $n \in \mathbb{Z}$ . Let $E=\mathbb{R}^2 / \sim$ and $q:\mathbb{R}^2 \rightarrow E$ be the quotient map. Let $\pi_1:\mathbb{R}^2 \rightarrow \mathbb{R}$ be the projection onto the first factor and $\epsilon:\mathbb{R} \rightarrow S^1,x \mapsto e^{2\pi i x}$ be the smooth covering map. Then there exists a map $\pi:E \rightarrow S^1$ such that $\pi \circ q=\epsilon \circ \pi_1$ since $\epsilon \circ \pi_1$ is constant on each equivalence class. (a) Show that $E$ has a unique smooth structure such that the quotient map $q:\mathbb{R}^2 \rightarrow E$ is a smooth covering map. (b) Show that $\pi:E \rightarrow S^1$ is a smooth rank-1 vector bundle. (c) Show that it is not trivial. My attempted solution: proposition 4.40 in the book says Suppose $M$ is a connected smooth $n$ -manifold and $f:E \rightarrow M$ is a topological covering map. Then $E$ is a topological $n$ -manifold and has a unique smooth structure such that $f$ is a smooth covering map. This proposition is similar to part(a), however, the map $q$ is from $\mathbb{R^2}$ to $E$ not the other way around. How should I manipulate $q$ to satisfy this proposition? For part(b), the only thing I know is that part (a) gives $E$ is smooth but I have no clue about the rest. For part(c), Lee defines a trivial bundle to be a bundle with a global trivialization. Suppose $E$ has a global trivialization $\Phi:\pi^{-1}(S^1) \rightarrow S^1 \times \mathbb{R}$ . If I can show $\pi^{-1}(S^1)=E$ , then since $\Phi$ is a homeomorphism we have $E \cong S^1 \times \mathbb{R}$ . Then if I can show they can't be homeomorphic to each other, the result follows. But is it true that $\pi^{-1}(S^1)=E$ and mobius strip can't be homeomorphic to the unit cylinder?","['vector-bundles', 'differential-topology', 'smooth-manifolds', 'differential-geometry']"
3010046,Analytic function must be free from $\bar{z}.$,"How can i say that analytic function must be free from $\bar{z}?$ I verified it for many examples like $\bar{z}, z^2+\bar{z} $ etc and found that the results seems to be true according to me . I am thinking  like as if any complex function contains $\bar{z}$ term in any form(obviously in nontrivial form  unlike $\bar{z}-\bar{z}$ ) then that terms is never analytic and hence whole function is also never analytic. Please suggest . Thanks .",['complex-analysis']
3010081,Why doesn't integrating over a sphere with $\phi$ between $0$ and $2\pi$ and $\theta$ between $0$ and $\pi$ work?,"One way of integrating over a sphere with $p = 1$ is by integrating over $p$ from $0$ to $1$ , $\phi$ from $0$ to $\pi$ , and $\theta$ from $0$ to $2 \pi$ Here is a link that can graph parametric surfaces in spherical coordinates: http://www.math.uri.edu/~bkaskosz/flashmo/sphplot/ If you enter in what is above, then you will find that the graph is indeed, a sphere. Furthermore, if you integrate $p^2\sin (\phi)$ over these ranges, you will get $\frac {4\pi}{3}$ which is the expected value. I noticed that $p$ from $0$ to $1$ , $\phi$ from $0$ to $2\pi$ , and $\theta$ from $0$ to $\pi$ also seems to create a sphere. Note the subtle change: $\phi$ is from $0$ to $2\pi$ and $\theta$ is from $0$ to $1\pi$ . If you plug this in to the grapher, you find that what you get resembles a sphere. However, when you integrate $p^2\sin (\phi)$ over $p$ from $0$ to $1$ , $\phi$ from $0$ to $2\pi$ , and $\theta$ from $0$ to $\pi$ , you get $0$ .   Why is that?","['integration', 'multivariable-calculus', 'spherical-coordinates', 'multiple-integral']"
3010121,Existence of a vector $v$ in $V$ such that the $T$-annihilator of $v$ is the minimal polynomial for $T$.,"Definition: $T$ -annihilator of a vector $\alpha$ (denoted as $p_\alpha$ ) is the unique monic polynomial which generates the ideal
such that $g(T)\alpha = 0$ for all $g$ in this ideal. I'm trying to prove the below statement without invoking the Cyclic Decomposition Theorem. Let $T$ be a linear operator on a finite-dimensional vector space $V$ .
Then there exists a vector $v$ in $V$ such that the $T$ -annihilator of $v$ is the minimal polynomial for $T$ . Attempt: Assume that there is no such $v$ . Then every vector has a $T$ -annihilator of degree less than that of the minimal polynomial. Define a monic polynomial $h$ which is the sum of $T$ -annihilators of given basis elements. Then $h(T)v=0$ for all $v\in V$ . But this contradicts the definition of minimal polynomial since the degree of $h\lt$ the degree of the minimal polynomial. Can someone verify my argument?","['minimal-polynomials', 'solution-verification', 'linear-algebra', 'linear-transformations']"
3010218,Deriving the Chi-squared distribution using characteristic functions,"I would like to directly derive the probability density function (PDF) for a Chi-squared distribution with $k$ degrees of freedom using characteristic functions. If $X_{1}, X_{2}, \dots, X_{k}$ are independent, standard normal random variables, then $$ Y = \sum_{i=1}^{k} X_{i}^{2} $$ and $Y$ is chi-squared distributed with $k$ degrees of freedom. The PDF for $Y$ when $k = 1$ is given by $$ f(x, 1) = \frac{1}{\sqrt{2 \pi x}} e^{-\frac{1}{2} x} $$ and its respective characteristic function is $$ \varphi_{Y_{1}} (\omega) = \int_{-\infty}^{\infty}  f(x, 1) e^{iwx} dx = (1 - i2 \omega)^{-\frac{1}{2}} \text{,}$$ where $i$ is the imaginary number. For a general $k$ degrees of freedom, $Y$ 's characteristic function is given by $$\varphi_{Y} (\omega) = (1 - i2 \omega)^{-\frac{k}{2}} \text{.}$$ Is it possible to explicitly derive $f(x, k)$ using the inverse Fourier transform, where $$ f(x, k) = \frac{1}{2 \pi} \int_{-\infty}^{\infty} (1 - i2 \omega)^{-\frac{k}{2}} e^{-iwx} d\omega ?$$ I have had no success with this approach, but I'm probably missing something very obvious. Failing that, is it possible to derive a formula for $k=2$ , where $$f(x, 2) = \frac{1}{2 \pi} \int_{-\infty}^{\infty} (1 - i2 \omega)^{-1} e^{-iwx} d\omega ?$$ This would at least allow me derive the PDF inductively. In addition, I am aware that $f(x, 1)$ can be represented as the Gamma distribution $\text{Gamma}(x, \frac{1}{2}, \frac{1}{2})$ and the sum of independent Gamma random variables is known to be Gamma distributed, therefore, for this example, $$ Y \sim \text{Gamma} ( \cdot, \frac{k}{2}, \frac{1}{2}) \text{.} $$","['integration', 'probability-distributions', 'fourier-transform', 'chi-squared', 'probability-theory']"
3010276,Mathematics solution for Gerrymandering problem? [closed],"Closed . This question needs to be more focused . It is not currently accepting answers. Want to improve this question? Update the question so it focuses on one problem only by editing this post . Closed last month . Improve this question Gerrymandering is a practice intended to establish a political advantage for a particular party or group by manipulating district boundaries, and can create large disproportions in voting results as we recently often hear in media. I have recently heard very nice podcast about mathematican (Jonathan Mattingly) finally providing hard evidence for Gerrymandering: which is finally able to start convincing regulators, "" recognizing what is too far "". Specifically , they define score of given division of state into districts, then (Monte Carlo) sample 24000 divisions, getting some distribution of elected democrats (e.g. 3 to 7 out of 13) - and it has turned out that elected 3 was below 1% of the sample - what can be seen as a strong evidence of Gerrymandering. It is great that mathematics can now point hard evidence there, but from one side it is after the fact, from the other it can only point extreme Gerrymandering - like 3 seats for 3-7 distribution. In contrast, we would rather expect that the number of seats just agrees with vote proportions on the state level . So the question is if mathematics could also offer a solution to prevent such problems in the first place. Mathematicians might be a better than politicians group for finding such solution, so I would like to ask for such possibilities, for example: Proportionality on state level - we calculate the number of democrats that should represent given state from vote proportion on state level, then choose them from districts with the largest proportions. However, some districts would have minority representative. Open competition for choosing the division : regulators define restrictions for ""proper"" map and concrete evaluation function (e.g. compactness + uniform population + some geographical score) using shared common data, and deadline for the competition - then e.g. everybody can send own proposal and the one having the highest score in the deadline moment wins - this map will be used. While finding the best one is a hard problem, this way many would be motivated to use computational power for this search, and finally there would be one objective winner. The main question here is existence of objective criteria for map which is ""proper""? They might differ between states, but evaluation score could be chosen on federal level. Requirement of proportion agreement of chosen map - a map to be accepted requires that the number of its elected seats, according to the last election data, has to agree with state-level proportions. The 3. option seems safe, but still might leave a place for some bad behavior, so the best would be just having a clear definition of a ""proper"" map and some evaluation score - which should be maximized, hence just choosing the best one accordingly to this score would leave no place for political fight. This evaluation score should contain some compactness - e.g. if preferred shape is circle, we can find the smallest circle district fits in, largest circle which fits in district - and put their proportion into the score: 1 corresponds to perfect circle district (analogously for square as perfect shape). We can also put proportion of district circumference and circle there. Its another term should be uniform population distribution, what can be also easily evaluated. This kind of evaluation is party-neutral and could be chosen on federal level - ending the problem of Gerrymandering once for all: there is just chosen proposed ""proper"" map having the highest evaluation score. What are other possible solutions? Could one of them be implemented? Can the Gerrymandering problem be ended once for all? Ps. Parallel Reddit discussion .","['game-theory', 'optimization', 'voting-theory', 'geometry']"
3010283,Find all prime number $p$ such that $2^p+p^2$ is prime number,"Find all prime number $p$ such that $2^p+p^2$ is prime number First I try with $p=2$ , that is not true because I get $8$ and that is not prime number. Then I try with $p=3$ that is true, I get $17$ . Now I need to see all prime number that is bigger then $3$ . Every prime number $p>3$ can write as $p=6k+1$ or $p=6k-1$ , $k\in \mathbb N$ . I try to put $p=6k+1$ then I get $p^{6k+1}+(6k+1)^2=2(2^{3k})^2+36k^2+12k+1$ then I try to factorization this like that $a=2^{3k}$ and $b=6k$ then I get $2a^2+b^2+2b+1$ I change because I think it is easy to see how to factorization, but there I stop I do not how to continue, I do not have idea how to factorization to get something like this $x\cdot y=n$ , where $n$ is prime number, and then since every prime number is $n=1\cdot n$ so one of them x or y must be 1 that is my idea for the task. Can you help me?","['elementary-number-theory', 'divisibility', 'discrete-mathematics', 'prime-numbers']"
3010305,Multivariate function to univariate function,"I'm currently trying to understand the proof of the directional derivative of a multivariate function $f(x,y)$ at the point $(x_0,y_0)$ along the vector $\vec u \langle a,b \rangle $ . $$D_\vec u f(x_0,y_0) = \lim_{h\to0} \dfrac{f(x_0 + ah, y_0 + bh) - f(x_0, y_0)}{h}$$ Then, it says let's put: $$ g(h) = f(x_0 + ah, y_0 + bh) $$ How can we change a function of 2 variables to a function of only one variable, which is a totally different one. Is it really valid? How is this process called, I couldn't find the exact name to search for more details. Thank you.","['multivariable-calculus', 'calculus']"
3010307,"Explanation for that for a particle, $v^2 = (dl / dt)^2 = (dl)^2 / (dt)^2,$ $l$ is the arch that the particle traces out","In the book of Mechanics by Landau, at page 8, it is claimed that $$v^2 = (dl / dt)^2 = (dl)^2 / (dt)^2,$$ where $v$ is a the velocity of the particle in the cartesian
  coordinates, $l$ is the arch that the particle traces out. I know that this is completely a abus d’ notation ; however, is there any intuitive way of seeing this ?","['classical-mechanics', 'analysis', 'euler-lagrange-equation', 'physics', 'mathematical-physics']"
3010327,Find residues of $f(z)=\frac{1}{(e^{z}-1)^{2}}$,"How to find the residues of $f(z)=\dfrac{1}{(e^{z}-1)^{2}}$ I have found that the poles $z=2\pi i n$ . But when I apply the formula $\dfrac{1}{(m-1)!}\lim\limits_{z\rightarrow z_{0}}\dfrac{d^{m-1}}{dz^{m-1}}\left((z-z_{0})^{m}f(z)\right)$ , I got $\lim\limits_{z\rightarrow z_{0}}\dfrac{d}{dz}(z-z_{0})^{2}\dfrac{1}{(e^{z}-1)^{2}}$ , which is so complicated that I cannot get the limit value.","['complex-analysis', 'residue-calculus']"
3010409,Mutually commuting matrix with $A_i^2=0$,"Let $A_1,\dots,A_n$ be mutually commuting $m\times m$ matrices such that $A_i^2=0$ for all $1\le i \le n$ . If $m<2^n$ , prove that $A_1 A_2\cdots A_n=0$ Since $A_i^2=0$ So $\operatorname{Im}(A)\subset \ker(A) \implies \dim(\ker(A))\ge \frac m 2$ I think we have to use it to prove ..but don't know how go through ...","['matrices', 'nilpotence', 'linear-algebra']"
3010441,Rosenfeld's $7 \times 7$ square puzzle,"A $7 \times 7$ square puzzle may be described as following. Start with a $7 \times 7$ square divided into $7 \cdot 7$ unit squares. First select a unit square and mark it. And then, in each subsequent step duplicate the current marked squares by translating them onto a set of unmarked squares; mark the new squares so that the number of squares marked is doubled at each step. Determine the maximum number of squares marked repeating this process. The answer is, amazingly, $32$ . I do not include the solution for users pleasure. This puzzle is due to M. Rosenfeld. He wrote in his paper titled 'A ""simple"" rectangular puzzle'(2007), that Many mathematicians tried to solve the $7 \times 7$ square puzzle. Some succeeded others did not. Stan Wagon showed Raphael Robinson the puzzle. Raphael contacted me and told me that he solved it while taking a bath. He was wondering why some people had difficulties solving the puzzle. He discovered that if you make a wrong selection in the initial step
  then it will be impossible to mark 32 squares on the 7×7 square. He sent me
  a sketch of a very nice proof showing that the final shape of the 32 marked
  squares is unique (modulo rotations by 90, 180, 270 degrees). The pattern is ( $\cdots$ ommited $\cdots$ ). I hope to publish the proof in the near future. And as far as I know, he never published the proof. I have tried to prove the uniqueness of the final configuration for several hours in vain. So my question is the following. The Question Prove that the final configuration of the $7\times 7$ square puzzle with maximum number of marked squares is unique up to rotations and reflections. Edit: As pointed by @hardmath, the problem has introduced Rosenfeld's article titled 'a dynamic puzzle.'(1991) For the links to the paper quoted and mentioned, see the comment below by hardmath.","['puzzle', 'discrete-geometry', 'combinatorics', 'discrete-mathematics', 'tiling']"
3010470,Showing that $\lim\limits_{x→0}\frac{x\sin(1/x)-\cos(1/x)}x$ does not exist without sequence,"Show that $$\lim_{x→0}\frac{x\sin(1/x)-\cos(1/x)}x$$ does not exist. I understand that at $0$ , the $\dfrac{\cos(1/x)}x$ term varies between $(-\infty , + \infty)$ . But I want a complete formal proof that use the definition of limit ( $ε, δ$ ) and not using sequences like ( $2k\pi n$ ) or other techniques like l'Hopital, etc… How to write a formal proof for that? Also I want to show that $\lim\limits_{x\to0} (x\sin(1/x) - \cos(1/x))$ does not exist without using any sequences and only using the definition of limit.","['limits', 'calculus', 'trigonometry']"
