question_id,title,body,tags
3234509,A Lipschitz function is $C^1$?,"I am wondering if a Lipschitz function $f:[a,b]\to\mathbb{R}$ is $C^1$ , that is its derivative is also continuous? I have seen that in a text however I could not prove it and does not seem so obvious for me! Any suggestion?","['lipschitz-functions', 'real-analysis', 'continuity', 'calculus', 'derivatives']"
3234526,Proof that $f$ is differentiable,"Let $$f(x) = \sum_{n=1}^{\infty} \frac{x^n}{2^n} \cos{nx}$$ Proof that $f$ is differentiable on $(-2,2)$ my approach let $ m := \frac{x}{2} $ so $m<1$ $$ \left| \frac{x^n}{2^n} \cos{nx}   \right| \le m^n \rightarrow 0 $$ So by comparison we have point convergence. But I don't know how to deal with diffentiable..","['convergence-divergence', 'derivatives', 'summation', 'real-analysis']"
3234527,Generalized Laplacian?,"I was wondering if any of you had ever encountered operators on $L^2(\mathbb{R}^d)$ of the form $$
- \nabla \cdot A(x)\nabla
$$ where $A(x)$ is some matrix field (viewed as $L^2(\mathbb{R}^{d^2}$ )), and if so where can I find some literature about it ? More precisely, I'm trying to get a lower bound, $i.e$ hopefully some function $h(x)$ such that $- \nabla \cdot A(x)\nabla \geq h(x)$ (in the sense of quadratic forms), when $A(x) = (2|x| - |x|^{-1})xx^T$ . Thanks a lot!","['multivariable-calculus', 'operator-theory']"
3234606,Partial derivative of the real part of a function,"I'm trying to understand the mathematical reasoning behind the example provided in this question. If we have $$z = Ae^{i(\omega _{o}t+\phi )}$$ and define $$x = Re (z),$$ then why is it that $$\frac{\partial x}{\partial t} = Re  \frac{\partial z}{\partial t},$$ instead of $$\frac{\partial x}{\partial t} =  \frac{\partial [Re(z)]}{\partial t}$$ In other words, why is it that the partial derivative of the real part of a function is equal to the real part of the partial derivative of the function, rather than being equal to the partial derivative of the real part of the function? I'm just trying to understand the mathematical reasoning behind this, rather than why it is nonsensical from a physical standpoint.","['complex-analysis', 'partial-derivative', 'complex-numbers', 'real-analysis']"
3234648,How to solve exponential equations like $2^x+x=5$?,"I tried the following: Let $y=5-x$ . Then, $2^{5-y}=y \implies y \cdot 2^y=32$ Taking the log of both sides yields $$\log_2 y + y = 5$$ And that's where I'm stuck.","['algebra-precalculus', 'transcendental-equations']"
3234729,"Representation theory of SO(p,q)","For a long time now, I have tried to look for the representation theory of $SO(p,q)$ . I am in particular interested in the unitary irreducible representations and the bilinear Hermitian form on the space of (homogeneous) functions. I know that for certain degrees, the representations are unitary, but I want to know the associated bilinear form. Any reference (other then Vilenkin for $SL(2,\mathbf{R})$ ) would be welcome :)","['group-theory', 'representation-theory', 'lie-groups']"
3234898,Characterization of weak compactness in a Banach space,"While studying the textbook of Fernando Albiac and Nigel J. Kalton (Topics in Banach Space Theory), I came across the following result: A subset $A$ of a Banach space $X$ is relatively weakly compact if and only if it is norm-bounded and the $\sigma(X^{**},X^*)$ -closure of $A$ in $X^{**}$ is contained in $A$ . I am relatively unexperienced with weak topologies, so I would appreciate help in comprehending how that result might be proven. I am especially interested in the ""if""-direction. A first idea to prove the ""if"" direction is, to apply the Banach-Alaoglu theorem in $X^{**}$ and use that the canonical map $i:X\to i(X) $ given by $i(x):=(X^*\ni f\mapsto f(x))$ is actually a homeomorphism with respect to $(X,\sigma(X,X^*))$ and $(X^{**},\sigma(X^{**},X^*))$ . If that might work, I would appreciate getting ideas on how to prove the $(X,\sigma(X,X^*))$ , $(X^{**},\sigma(X^{**},X^*))$ - continuity of $i$ .","['weak-topology', 'functional-analysis', 'compactness']"
3234914,Why is it possible to calculate multivariable limits using polar coordinates?,"Why is it possible to calculate multivariable limits using polar coordinates? Let's say I'm looking for some $\lim_{(x,y) \to (0,0)}$ and I'm substituting $x = r cos\theta$ and $y = rsin\theta$ so that I can look at $\lim_{r \to 0}$ .
Why can I do this? Am I not just looking at ""straight lines"" going to $(0,0)$ now? What about all the other possible sequences that converging in straight lines to (0,0)?","['multivariable-calculus', 'calculus', 'real-analysis']"
3234925,Understanding projection of vector field in homgeneous spaces,"I'm studying homogeneous spaces from the book of A.Arvanitoyeorgos, ""An introduction to Lie groups and the geometry of homogeneous spaces"".
Consider $G/H$ be a homogeneous space, and let $\pi:G\rightarrow G/H$ be the canonical projection. We can consider the differential $d\pi_e:T_eG\rightarrow T_o(G/H)$ (and remember that $\mathfrak{g}\cong T_eG)$ . Now we can compute what is the projection of a $X\in\mathfrak{g}$ . The author says that, for any $g\in G$ $$X^{\star}_{gH}=\frac{d}{dt}(\exp{tX})gH\Bigr\rvert_{t=0}$$ where $\exp{tX}$ is the corresponing 1-parameter subgroup. Now my doubt is: The author notice that $[X^{\star},Y^{\star}]=-[X,Y]^{\star}$ ; Unfortunately I tried lots of computation for proving this identity but this result keeps arising as a magic trick; moreover my gut feeling is that this identity is not true, since if we reduce to the case $gH=o$ we should en up with an identity without the minus sign. And this is a problem, because this identity is strongly used to obtain the Riemannian connection for a reductive homogeneous space. So i'd like to understand whhy this result should be true, and in the other case why the computation of the Riemannian connection are correct (or, if they're not, what is the known formula). Thanks in advance to anyone who will help me trying to understand this a little bit.","['homogeneous-spaces', 'lie-groups', 'differential-geometry']"
3234939,Forming equations for damped Simple Harmonic Motion,"I have a question that says ""A Particle $P$ of mass $m$ kg is attached to one end of a spring. When the displacement of $P$ from its equilibrium poisition is $x$ metres, the magnitude of tension in the spring is $4nx N$ and the resistance force on P is $5c\frac{dx}{dt}$ Write a differential equation which models the motion of the particle. My answer: $$m\frac{d^2x}{dt^2}=4nx-5c\frac{dx}{dt}$$ $$m\frac{d^2x}{dt^2}+5c\frac{dx}{dt}-4nx$$ The textbook answer: $$m\frac{d^2x}{dt^2}+5c\frac{dx}{dt}+4nx$$ I don't get why $4nx$ is positive? Wouldn't that require the resistant force to act in the same direction as the tension?","['classical-mechanics', 'ordinary-differential-equations']"
3234972,Using $|r|$ versus using $r$ for double integration,"Suppose that I have a double integral where the integrand has variables $x$ and $y$ , and I am using the polar substitution $x=r\cos(\theta)$ and $y=r\sin(\theta)$ . Suppose the region of integration is $x^2 + y^2 \leq 1$ . By calculating the Jacobian $J = |r|$ I can replace the $dxdy$ by $|r|drd\theta$ . I understand why the limits for $\theta$ will be $0$ to $2\pi$ . Here is where I am a bit confused. I know that $x^2 + y^2 = r^2 \leq 1 \implies -1 \leq r \leq 1$ , and so this suggests $-1$ and $1$ will be the limits for $r$ . But if I say that $r$ is always positive (thinking of it as the 'radius'), then it ranges from $0$ to $1$ , and I can also say that the Jacobian $J = r$ instead of using the modulus. This is the approach I see people take when they do these kinds of integrals. So, does the value of the integral change depending on whether I use $J = r$ and limits $0 \leq r \leq 1$ , or use $J = |r|$ and limits $-1 \leq r \leq 1$ ? If it does change (and I am guessing that the non-modulus way is correct) then why is this so? Whilst I get that if I think about it intuitively, the 'radius' is always positive, I still don't see what is mathematically wrong about using $|r|$ and the $-1 \leq r \leq 1$ limits instead.","['integration', 'multivariable-calculus', 'polar-coordinates']"
3234998,"Under Poincaré-Bendixson hypothesis, can a $\omega(p)$-limit set be like this picture?","Last class we were proving Poincaré-Bendixson theorem in $\mathbb R^2$ which states that: Assume that the positive orbit $\mathcal O^+(p)$ is contained in a compact subset $K$ of the planar domain $D$ of the differential equation $x'=X(x)$ . Assume further that $X$ has only finitely many fixed points in $K$ . Then one of the following is satisfied: a) $\omega(p)$ is a periodic orbit; b) $\omega(p)$ is a single fixed point c) $\omega(p)$ consists of a finite number of fixed points, together with a finite set of orbits such that for each orbit its $\alpha$ -limit set is a single fixed point and its $\omega$ -limit set is also a single fixed point. During the proof, he stopped the class and drew the following picture in the blackboard: and asked, can $\omega(p)$ be like that? So I assume that he asked that in the context given by the hypothesis of Poincaré-Bendixson theorem. Also he intended to picture with those dots the singularities of the field. I want to say that the answer is no, because I think that every singularity must be connected by an orbit, which does not happen in this picture. But the problem is: I can't justify that. I've read the poincaré-bendixson demonstration quite a few times, but I can't find this justificative there. Any insight would be very helpful. Thank you","['ordinary-differential-equations', 'dynamical-systems']"
3235037,Derivative of $f(x)=\int_{x}^{\sqrt {x^2+1}} \sin (t^2) dt$,Derivative of $f(x)=\int_{x}^{\sqrt {x^2+1}} \sin (t^2) dt$ Firstly I wanted to calculate $\int \sin (t^2) dt$ and then use $x$ and $\sqrt {x^2+1}$ . But this antiderivative not exist so how can I do this? Is this function at all possible to count?,"['calculus', 'derivatives', 'real-analysis']"
3235060,What is the formalism that allows Random Variables to be treated algebraically like real or complex numbers?,"We all know that if we have a variable x, then there is a meaning to - for example - $$y=e^x$$ . And we all know how to manipulate that algebraically and to do calculus.  For example, if $$y_1=e^{x_1}$$ and $$y_2=e^{x_2}$$ then $$y_1y_2 = e^{x_1+x_2}$$ But random variables are a very different beast. Ultimately we all know intuitively what we mean when we draw a PDF or, more accurately, the CDF which is itself an algebraic function mapping $[-\infty, \infty]$ to $[0,1]$ as part of that defines a random variable. But what is the actual math that makes that definition of an RV actually act algebraically, so that, as above, we can happily write things like $$Y_1=e^{X_1}$$ and $$Y_2=e^{X_2}$$ then $$Y_1Y_2 = e^{X_1+X_2}$$ where $X_1$ and $X_2$ are random variables - and get away with it???","['measure-theory', 'probability-theory', 'probability', 'random-variables']"
3235070,1st Yr Statistics Question: Create an approximate $\alpha$ level test of $H_0 : p_1 = p_2$,"Let $X_1$ and $X_2$ be binomial random variables with respective parameters $n_1, p_1$ and $n_2, p_2$ . Show that when $n_1$ and $n_2$ are large, an approximate level $\alpha$ test of $H_0 : p_1 = p_2$ versus $H_1 : p_1 \neq p_2$ is as follows, reject $H_0$ if $$ \frac{|X_1/n_1-X_2/n_2|}{\sqrt{\frac{X_1+X_2}{n_1+n_2} \left( 1 - \frac{X_1+X_2}{n_1+n_2}\right) \left(\frac{1}{n_1}+\frac{1}{n_2}\right)}} > z_{\alpha/2} $$ Hint below in screenshot. My attempt Given $H_0$ is true I can say that $p = p_1 = p_2$ and since $n_1$ and $n_2$ are large, I can use the normal approximation to the binomial to say that $$ V = \frac{X_1 - n_1 p}{\sqrt{n_1 p q}} = \frac{ \frac{X_1}{n_1} - p}{\sqrt{\frac{p q}{n_1}}} \, \dot\sim \, N(0,1)$$ $$ W = \frac{X_2 - n_2 p}{\sqrt{n_2 p q}} = \frac{ \frac{X_2}{n_2} - p}{\sqrt{\frac{p q}{n_2}}} \, \dot\sim \, N(0,1)$$ Then we have $\frac{V-W}{\sqrt{2}} \dot\sim N(0,1)$ and we can build a two sided hypothesis using the fact that $$P \left( -z_{\alpha/2} \le \frac{V-W}{\sqrt{2}} \le z_{\alpha/2} \right) = 1-\alpha  $$ The book answer seems superior because you don't need to know $p_1$ or $p_2$ . However I'm having difficulty getting rid of those two values. Thanks for your help and patience! Book problem with hint","['statistics', 'binomial-distribution', 'probability', 'hypothesis-testing']"
3235090,Let $x_{n+1} = \frac{1}{2}(x_n + \frac{a}{x_n})$. Prove that $x_{n+1} < x_{n}$,"Let $$x_{n+1} = \frac{1}{2}(x_{n} + \frac{a}{x_{n}})$$ Prove that $x_{n+1} < x_{n}$ for $a \geq 0$ . Hint: Let the initial guess satisfy $x_{1} > \sqrt{a}$ I am stuck at how to begin this. I would like to use an induction proof, but there is no simple way for me to relate the base case and begin. That is I can't even establish: $$x_{2} < x_{1}$$ How would I do this since there is no given initial term? Or is that a mistake and an initial term should be present?","['sequences-and-series', 'real-analysis']"
3235110,What Does a Set Represent?,"In Linear Algebra Done Right, Axler says that order and repetiton don't matter in a set. For example, the set {4} = {4,4} = {4,4,4} or {1,3} = {3,1}. My question is then what do these sets mean. What could {4,4} possibly represent in real life and why would that be equal to what {4,4,4} represents? And the same question for what {3,1} could possibly represent and why that would be equal to what {1,3} represents.",['elementary-set-theory']
3235111,Inequivalent Sequences of Positive Integers,"Let $A$ and $B$ be two sequences of positive integers.  We say $A$ and $B$ are inequivalent if whenever a finite initial sequence is removed from $A$ and whenever a finite initial sequence is removed from $B$ , the resulting two sequences $A'$ and $B'$ are not identical.  I want to show that the set consisting of all sequences which are pairwise inequivalent is uncountable.  I thought the Cantor approach of assuming we have a sequence of such sequences and changing the diagonal would work, but adding the condition of pairwise inequivalence seems to throw that off.  I'm sure this is pretty obvious but I'm just not seeing it right now.  Can anyone offer a hint?",['elementary-set-theory']
3235137,Remove even elements of partition of integration set,"Suppose I am integrating a continuous $f:\mathbb{R}\rightarrow\mathbb{R}$ in a measurable set $A\subseteq I$ , where $I$ is an interval: $$
\int_{A}f(x)dx
$$ Now suppose I partition the set $I$ in $N$ intervals $I_{i}$ of
equal length: $I=\cup_{n=1}^{N}I_{n}$ . Let $A_{n}=A\cap I_{n}$ ,
so that $\{A_{n}:n\in\{1,..,N\}\}$ is a partition of $A$ . Let $E_N=\cup_{n=1}^{N/2}A_{2n}$ (it considers only the even elements of the partition of $A$ ). I
am trying to show that $$
\lim_{N\rightarrow\infty}\int_{E_N}f(x)dx=\frac{1}{2}\int_{A}f(x)dx
$$ But no success. I figured this may be a known result, is it?","['integration', 'measure-theory', 'definite-integrals']"
3235160,Spanning forests of bipartite graphs and distinct row/column sums of binary matrices,"Let $F_{m,n}$ be the set of spanning forests on the complete bipartite graph $K_{m,n}$ .  Let $$S_{m,n} = \{(r(M), c(M)), M \in B_{m,n} \}$$ where $B_{m,n}$ is the set of $m \times n$ binary matrices and $r(M), c(M)$ are the vectors of row sums and column sums of $M$ , respecitvely.  That is, $S_{m,n}$ is the set of the distinct row-sum, column-sum pairs of binary matrices. (The term spanning forest here refers to a forest that spans all of the vertices of the given graph; it doesn't have to be a maximal acyclic subgraph.) Q: Is it true that $|F_{m,n}| = |S_{m,n}|$ ?  It is true for $m,n \leq 4$ .  For $m=n$ this is OEIS A297077 . There is an obvious mapping from $F_{m,n} \rightarrow B_{m,n}$ given by taking the reduced adjacency matrix, so if $U = \{u_1, \ldots, u_m\}$ , $V = \{v_1, \ldots, v_m\}$ are the color categories we set $M_{ij} = 1$ if $v_i \sim u_j$ in a forest $F$ , else $M_{ij} = 0$ .  However, this does not help because multiple forests may have the same row and column sums - and not every row-sum, column-sum pair is represented by a forest under this mapping. The numbers $|F_{m,n}|$ are given here: $$\begin{array}{|c|c|}\hline
m\backslash n & 1 & 2 & 3 & 4 & 5 \\ \hline
1 & 2 &  \\\hline
2 & 4 & 15 \\\hline
3 & 8 & 54 & 328  \\\hline
4 & 16 & 189 & 1856 & 16145 \\\hline
5 & 32 & 648 & 9984 & 129000 & 1475856 \\\hline\end{array}$$ For more see this answer (sum each row.)","['graph-theory', 'adjacency-matrix', 'matrices', 'combinatorics', 'bipartite-graphs']"
3235168,Put trivariate PDF in terms of bivariate PDFs,"Let there be the random variables $X$ , $Y$ , and $Z$ . Let all the bivariate PDFs $f_{X, Y}$ , $f_{X, Z}$ , and $f_{Y, Z}$ be known. Can we write the unknown trivariate PDF $f_{X, Y, Z}$ in terms of the known bivariate PDFs?","['statistics', 'probability-distributions', 'probability']"
3235288,"If $\space$ $\forall$ $x \in \Bbb R$, $\space$ $f(f(x))=x^2-x+1$. Find the value of $f(0)$. [duplicate]","This question already has answers here : If $f(f(x))=x^2-x+1$, what is $f(0)$? (4 answers) Closed 5 years ago . If $\space$ $\forall$ $x \in \Bbb R$ , $\space$ $f(f(x))=x^2-x+1$ . Find the value of $f(0)$ . I thought that making $f(x)=0$ implies that $f(0)= 0^2 - 0 + 1 = 1$ , but i think that this isn't correct, because the $x$ in $f(f(x))$ isn't equal to $f(x)$ . Any hints?",['functions']
3235330,"Show $ f(x) = \sum_{n=1}^{\infty} \frac{nx}{n^3 + x^3}$ ,$\ g(x) = \sum_{n=1}^{\infty} \frac{x^4n}{(n^3 + x^3)^2}$ are bounded on $[0, \infty)$.","If $f(x), g(x)$ are defined as following on $[0 , \infty)$ , $$\tag 1 f(x) = \sum_{n=1}^{\infty} \frac{nx}{n^3 + x^3}$$ $$\tag 2 g(x) = \sum_{n=1}^{\infty} \frac{x^4n}{(n^3 + x^3)^2}.$$ . Then how to show that $f,g$ are bounded function on $[0 , \infty)$ ? I found this problem on this Is $f(x)=\sum_{n=1}^\infty\frac{nx^2}{n^3+x^3}$ uniformly continuous on $[0,\infty)$? . In solution's last steps, i don't know why this is correct answer. Could you explain for me to elaborate? Thank you.","['sequences-and-series', 'real-analysis']"
3235339,Why probability of picking a random prime is 0? [duplicate],"This question already has answers here : Why does ""the probability of a random natural number being prime"" make no sense? (5 answers) Closed 5 years ago . ""It's well known that there are infinitely many prime numbers, but
  they become rare, even by the time you get to the 100s,"" Ono explains.
  ""In fact, out of the first 100,000 numbers, only 9,592 are prime
  numbers, or roughly 9.5 percent. And they rapidly become rarer from
  there. The probability of picking a number at random and having it
  be prime is zero. It almost never happens."" --Source: phys.org I feel really skeptical about the statement in bold above. I think the probability tends to approach zero but can never be zero. Please explain how the probability is being calculated mathematically?","['analytic-number-theory', 'number-theory', 'probability', 'prime-numbers']"
3235356,How can i Prove that the gray area is the same as white area? [duplicate],"This question already has an answer here : Prove the equality of circle's areas (1 answer) Closed 5 years ago . A circle is cut into 8 parts, each part has the angle 45 degrees from an arbitrary point. how to prove that the white area is the same as the Gray area? I just want any hint for solving this question. how can I prove this?","['algebra-precalculus', 'area', 'circles', 'geometry']"
3235359,Puzzling random number property,"For a series of values $A_{\text{peak}}\geqslant 0$ , I generated a large number ( $n$ ) of random values $A_{\text{noise}}$ (using the Mersenne Twister algorithm in PHP) within $[-A_{\text{peak}},+A_{\text{peak}}]$ , and from these calculated the average root-mean-square value : $\displaystyle\overline{\text{RMS}}_{\text{noise}}=\sqrt{\frac{1}{n}\cdot\sum_{1}^{n}A_{\text{noise}}^{2}}$ . Using regression analysis it then turns out that, with high accuracy : $A_{\text{peak}}=\sqrt{3}\cdot\overline{\text{RMS}}_{\text{noise}}$ . How can this $\sqrt{3}$ constant be derived mathematically ?","['random', 'statistics']"
3235384,Use the t-test to test below find its t-statistic,"Use the t-test to test $H_0 : \beta_1 = 0$ $H_1 : \beta_1 \neq 0$ at level significance $5 \%$ . Give test statistic and conclude within the context of the study Given $SSREG = 36460$ $s = 365$ $\hat\beta_1 = -5.98$ $n = 49$ attempt: $t^* = \frac{\hat\beta_1}{s(\hat\beta_1)}$ $s(\hat\beta_1) = \sqrt{\frac{s^2}{\sum_{i=1}^{n} (X_i - \bar{X})^2}}$ $\sum_{i=1}^{n} (X_i - \bar{X})^2 = \frac{SSREG}{\hat\beta_1^2} = 1019.5$ so then $s(\hat\beta_1) = \sqrt{\frac{s^2}{\sum_{i=1}^{n} (X_i - \bar{X})^2}} = \sqrt{\frac{365^2}{1019.5}} = 11.4$ and finally $t^* = \frac{(-5.98)}{11.4} = -0.52$ I have to show $|t^*| < t_{1 - \frac{\alpha}{2}, n - 2}$ or $|t^*| \geq t_{1 - \frac{\alpha}{2}, n - 2}$ but what is $\alpha$ equal to?","['regression', 'statistics']"
3235419,Parabola - Definition as a locus of points,"On Wikipedia, a parabola is defined as follows: A parabola is a set of points such that, for any point $P$ of the parabola, the distance $|\overline{PF}|$ to a fixed point $F$ , the focus, is equal to the distance $|\overline{Pl}|$ to a fixed line $l$ Isn't this definition wrong since an empty set is a parabola according to it? Is the following definition correct? For any set of points $S$ , $S$ is a parabola if and only if
  there exists a point $F$ and a line $l$ such that $F$ isn't on $l$ and for any point $P$ , $P$ is in $S$ if and only if $|\overline{PF}|=|\overline{Pl}|$ .","['locus', 'definition', 'conic-sections', 'geometry']"
3235428,Relationship between distances on homogeneous spaces and their Lie groups,"Consider the (round) sphere $M=\mathbb{S}^{n-1}$ as a homogeneous $O(n)$ -space. Then for $x,y\in\mathbb{S}^{n-1}$ there is $g\in O(n)$ such that $y=g\cdot x$ .
Denote the Riemannian distance on $\mathbb{S}^{n-1}$ by $d_{\mathbb{S}^{n-1}}$ . Intuitively, if $y$ and $x$ are not far apart then $g$ should be almost the identity (because the $O(n)$ -action is smooth).
I am able to explicitly construct such a rotation $g$ so that \begin{align}
  \|g-\operatorname{Id_{\mathbb{R}^n}}\|
    \leq 2\; d_{\mathbb{S}^{n-1}}(y,x)
\end{align} where $\|\cdot\|$ is the operator norm for matrices. Analoguously, if $M=\mathrm{Gr}_m(\mathbb{R}^n)$ is the Grassmannian, then by a similar construction using principle angles I can find a rotation $g$ such that $F=g\cdot E$ for $m$ -planes $E,F$ and \begin{align}
  \|g-\operatorname{Id_{\mathbb{R}^n}}\|
    \leq 2m\; d_{\mathrm{Gr}_m(\mathbb{R}^n)}(F,E)
\end{align} where $d_{\mathrm{Gr}_m(\mathbb{R}^n)}$ is the angle metric on $\mathrm{Gr}_m(\mathbb{R}^n)$ ( e.g. here ). However, I find these constructions rather unsatisfying and would like to understand if there is a more abstract underlying principle at play. Here is my question:
  Given a homogeneous $G$ -space $M$ , are there always ( $G$ -invariant ?) metrics on $M$ and $G$ such that for all $x,y\in M$ there is $g\in G$ such that $y=g\cdot x$ and which fulfils the quantitative estimate \begin{align}
  d_G(g,e)
    \leq C \; d_M(y, x) ?
\end{align} Feel free to add any hypotheses (such as compactness etc) that apply to $\mathbb{S}^{n-1}$ , $\mathrm{Gr}_m(\mathbb{R}^n)$ and $O(n)$ . EDIT: As proposed in the comments by levap and Moishe Kohan, I have edited my question.","['symmetric-spaces', 'homogeneous-spaces', 'lie-groups', 'differential-geometry']"
3235465,Entire function of finite order with infinitely many zeros,"Let $f(z)$ be an entire function of finite order of the form $$f(z)=\sum_{n=0}^\infty a_nz^{k_n}$$ where $a_n\neq0$ for all $n$ and $(k_n)_{n\geq0}$ is an increasing sequence of integers satisfying $$\limsup_n\;(k_{n+1}-k_n)=\infty.$$ Show that $f(z)$ has infinitely many zeros. I know that if $f(z)$ has only finitely many zeros then by Hadamard's theorem $f(z)$ is of the form $P(z)e^{Q(z)}$ for some polynomials $P$ and $Q$ , so a possible approach is to show that for such functions the condition $\limsup_n\;(k_{n+1}-k_n)=\infty$ is not possible, but I gave up after some time. Another possible way may be trying to prove that $f(z)$ has non-integer order, since in such a case it follows easily that $f(z)$ cannot have finitely many zeros. Any ideas?","['complex-analysis', 'entire-functions']"
3235529,Is composition of surjective continuous function with discontinuous function discontinuous?,"Let $I_1,I_2,I_3$ be intervals $\subset \mathbb{R}$ . Suppose $f:I_1 \to I_2$ is a surjective continuous function and $g: I_2 \to I_3$ is a discontinuous function. Must the composition $g \circ f$ be discontinuous? There are some easy counter-examples if $f$ is not assumed to be surjective, e.g. taking $f$ to be a constant function, or in a way that ""dodges"" the discontinuous point(s) of $g$ . However if such ""dodging"" is prohibited, I fail to construct such functions nor find an answer from many similar questions on this site. So I am interested to know whether counter-examples exist? If not, is there a proof? Does it have something to do with intermediate value theorem?","['continuity', 'calculus', 'functions']"
3235648,Subgroup of finitely-generated subgroup,"Is there a standard name for this concept: Let $H \leq G$ be groups. Say $H$ is ?? if there is a finitely-generated group $K \leq G$ such that $H \leq K$ . What should one use in place of ""??""? I'm also interested in this notion up to isomorphism. I've used ""finitely subgenerated"", though I have realized that ""finitely supergenerated"" probably makes a bit more sense. If you know a reference/situation where such a thing plays a key role, that may also be useful even if no name is given.","['finitely-generated', 'group-theory', 'terminology']"
