question_id,title,body,tags
3741419,Conditions for a intersection of connected sets to be connected.,"This is the original statement I want to prove: Conjecture: Let $A$ and $B$ be open connected sets in $\mathbb R^2$ with the usual metric such that $A \cap B \neq \emptyset$ . Then $ \partial A \cap \partial B = \emptyset \Longrightarrow$ $ A \cap B $ is connected. It is a simple statement, but I cannot find a proof neither a counter example. Any ideas are welcome! Update 0: Some comments about this being a general topological result made me realize that an example of space where this doesn't hold is important as motivation. Here is a simple example of such space: Consider the circle $S^1 = \mathbb R / \mathbb Z$ and the intervals $A = (\frac{2}{8}, \frac{7}{8})/ \sim$ and $B = (\frac{-3}{8}, \frac{3}{8})/ \sim$ ( $\sim$ is the equivalence relation defining the circle). Note that they satisfy the conditions but their intersection is not connected: $A \cap B =( (\frac{2}{8}, \frac{7}{8}) \cup (\frac{5}{8}, \frac{7}{8}))/ \sim$ . This is illustrated below. Update 1: I came with a weaker version of this statement that is sufficient for the application I need. Weak Conjecture: Let $A,B$ be open connected sets in $\mathbb R^2$ such that $A \cap B \neq \emptyset$ and each connected component of $\partial A$ and $\partial B$ is the image of a proper embedding from $\mathbb R$ to $\mathbb R^2$ . Then $ \partial A \cap \partial B = \emptyset \Longrightarrow$ $ A \cap B $ is connected. $\ \ \ $ Proof: $\quad$ First, we will refer to images of proper embeddings from $\mathbb R$ to $\mathbb R^2$ as lines. Note that lines splits the plane into two connected components. In the case that a line $\phi$ is a connected component of the boundary of some connected set $U$ , we can define $D(\phi)$ as the connected component of $\mathbb R^2 \setminus \phi$ which contains $U$ . The other c.c. is denoted $E(\phi)$ . If we denote $\Phi_U$ the collection of all c.c. of $\partial U$ , we can write $$ U = \bigcap_{\phi_i \in \Phi_U} D(\phi_i) \qquad \ \ \ \ \ U^c = \bigsqcup_{\phi_i \in \Phi_U} E(\phi_i)\;. $$ It is important to note that the union above is disjoint. Otherwise, we would get $i_1 \neq i_2$ such that $\phi_{i_1} \cap \phi_{i_2} \neq \emptyset$ , absurd since they are different c.c. components of $\partial U$ . $\quad$ Now we begin the proof. Let $C : = A \cap B$ and suppose $C$ has at least two nonempty connected components $C_1$ and $C_2$ . Note that $ C_2 \subset C_1^c = \bigsqcup_{\phi_{i} \in \Phi_{C_1}} E(\phi_i)$ , therefore $\exists ! \  i_n$ s.t. $C_2 \in E(\phi_{i_n})$ . Since $\partial A \cap \partial B = \emptyset $ , we can suppose without loss of generality that $\phi_{i_n} \subset \partial A$ . However, $C_1 \subset A$ and $C_2 \subset A$ are contained on different c.c. of $\mathbb R^2 \setminus \phi_{i_n}$ , which would imply that $A$ is not connected, absurd. $\qquad $ Q.E.D. The main question remains open for discussion. The understanding of the topology of $\partial U$ is all that we should need to conclude it.","['general-topology', 'metric-spaces', 'connectedness']"
3741458,Smoothest possible path interpolation given 2-D positions and directions?,"Assume I have a set of $n$ points $\{x_1,...,x_n \} \in \mathbb{R^2}$ and a set of corresponding directions (or angles) $\{d_1,...,d_n \}$ . It is my goal to find the smoothest, continuous path (edit: I define smoothness as the smallest overall curvature) which passes through all $n$ points while honoring all $n$ directions. The solution may be provided in increments, for example through splines between a pairs of successive points. I have illustrated what I mean below. Do you have any suggestions on how to tackle this issue?","['interpolation', 'geometry', 'differential-geometry']"
3741471,Reducing ordinary differential equation into clairaut's form,Given equation is $$x^{2}p^{2}+py\left ( 2x+y \right )+y^{2}=0$$ Where $p=\frac{\mathrm{d} y}{\mathrm{d} x}$ I know about clairaut's form and if we put $y=u$ and $xy=v$ then we will get clairaut's form. I want to learn how to guess that we need to put $y$ and $xy$ .,['ordinary-differential-equations']
3741476,Problem with Summation of series,"Question: What is the value of $$\frac{1}{3^2+1}+\frac{1}{4^2+2}+\frac{1}{5^2+3} ...$$ up to infinite terms? Answer: $\frac{13}{36}$ My Approach: I first find out the general term ( $T_n$ ) $${T_n}=\frac{1}{(n+2)^2+n}=\frac{1}{n^2+5n+4}=\frac{1}{(n+4)(n+1)}=\frac{1}{3}\left(\frac{1}{n+1}-\frac{1}{n+4}\right)$$ Using this, I get, $$T_1=\frac{1}{3}\left(\frac{1}{2}-\frac{1}{5}\right)$$ $$T_2=\frac{1}{3}\left(\frac{1}{3}-\frac{1}{6}\right)$$ $$T_3=\frac{1}{3}\left(\frac{1}{4}-\frac{1}{7}\right)$$ I notice right away that the series does not condense into a telescopic series. How do I proceed further?",['sequences-and-series']
3741514,"Composition of entire functions is identity, then functions are linear","A question from a previous qualifying exam at my university reads: ""Suppose that f and g are entire functions such that $f \circ g(x) = x$ when $x \in \mathbb{R}$ . Show that $f$ and $g$ are linear functions."" One can conclude that the composition of $f$ and $g$ is the identity on all of $\mathbb{C}$ , by the uniqueness principle. I know how to solve the problem if one assumes that $f$ is injective. However, there are examples of functions that have a right inverse but are not injective. However, entire functions have many properties, so is there a way of showing $f$ must be injective from the information above, or should I approach the problem differently?","['complex-analysis', 'entire-functions']"
3741530,Spivak's Calculus on Manifolds theorem 2-9 why is continuous differentiable needed,"In the third last line, it is said that because each $g_i$ is continuously differentiable at $a$ then the constructed function $g$ is also differentiable at $a$ . I do not see why ""continuously"" differentiable is need cuz I think a function is differentiable if and only if each of its components is differentiable (theorem 2-3(3)). It seems that I am missing something very obvious Edit: theorem 2-8 is","['multivariable-calculus', 'calculus']"
3741532,Convergence in probability implies mean squared convergence,"Let $(\Omega, \mathcal{F}, \mathbb{P})$ be a probability space. Let $(X_n)_{n \in \mathbb{N}}$ be a sequence of $\mathcal{F}$ measurable random variables. Let $X$ be another $\mathcal{F}$ measurable random variable. I have $X_n \rightarrow X $ in probability. Additionally, $\mathbb{P}(|X_n|<L) = 1 \hspace{3mm} \forall \hspace{2mm}n \in \mathbb{N}$ , where $L$ is a constant independent of $n$ . I have to show that $X_n \rightarrow X$ in mean squared sense, i.e. as $n \rightarrow \infty$ , $\mathbb{E}(X_n - X)^2 \rightarrow 0$ . How do I go about this? Thanks.","['convergence-divergence', 'probability-theory']"
3741536,implicit differentiation and taking limit on derivative,"I have this equation $x^3-xy^2+y^3=0$ and I want to know the value of the derivative at $(0,0)$ . Through implicit differentiation I find $y'=\frac{y^2-3x^2}{3y^2-2xy}$ . Now for $x=0,y=0$ this fraction becomes an indeterminate form. Upon graphical inspection I think if I were to draw a tangent at the Origin, it will have a slope very close to $-0.75$ , but what is an easy method to find out the actual value? Note, when you graph the original function it LOOKS like a line, but it ISN'T. Thank you for your input.","['multivariable-calculus', 'calculus']"
3741551,"Correct logical equivalent of ""Every real number except zero has multiplicative inverse.""","My Discrete Mathematics textbook translates the statement ""Every real number except zero has multiplicative inverse"" to $$\forall{x}{({(x\neq0)} \rightarrow{\exists{y}{(xy=1)}})}.\tag1$$ I noticed that the above translation is correct if and only if you interpret the original English statement as not specifying whether zero has multiplicative inverse. That is, all numbers have inverses except zero for which zero may or may not have an inverse. (This is evident from the truth table in which if $x$ was equal to zero then whether $x$ has an inverse or not the statement evaluates to true in both cases.) In the same vein, I can say that ""Every real number greater than 7 has a multiplicative inverse"" translates to $$\forall{x}{({(x>7)} \rightarrow{\exists{y}{(xy=1)}})};$$ this statement doesn't mean that only real numbers greater than $7$ have a multiplicative inverse. However, if you interpret the original English statement as ""Every real number except zero has multiplicative inverse while zero does not have a multiplicative inverse"", then this translates to $$\forall{x}{({(x\neq0)} \leftrightarrow{\exists{y}{(xy=1)}})}.\tag2$$ My professor translated the original sentence the same way the book did. So, I asked whether he assumed that zero has multiplicative inverse, and he answered with a yes because we know that zero does not have a multiplicative inverse. I then explained what I wrote above, but I couldn't get my point across, and he insisted that his translation was correct. Is what I wrote above correct, or is the first translation indeed the only correct one? Is ""Every real number except zero has multiplicative inverse"" ambiguous or is $(1)$ or $(2)$ its correct logical equivalent?","['predicate-logic', 'first-order-logic', 'logic', 'discrete-mathematics', 'logic-translation']"
3741552,Why do partitions correspond to irreps in $S_n$?,"As stated for example in these notes ( Link to pdf ), top of page 8, irreps of the symmetric group $S_n$ correspond to partitions of $n$ . This is justified with the following statement: Irreps of $S_n$ correspond to partitions of $n$ . We've seen that conjugacy classes of $S_n$ are defined by cycle type, and cycle types correspond to partitions. Therefore partitions correspond to conjugacy classes, which correspond to irreps. I understand the equivalence between partitions, cycle types, and conjugacy classes, but I do not fully get the connection with irreps: I can associate to a partition $\lambda\vdash n$ the conjugacy class of permutations of the form $$\pi=(a_1,...,a_{\lambda_1})(b_1,...,b_{\lambda_2})\cdots (c_1,...,c_{\lambda_k}).$$ The fact that conjugacy classes are defined by cycle types comes from the fact that $\sigma\pi\sigma^{-1}$ has the same cycle type structure as $\pi$ . However, in what sense do conjugacy classes correspond to irreps? I can understand this if we restrict to one-dimensional representations, as then $\rho(\pi)=\rho(\sigma\pi\sigma^{-1})$ for all $\sigma$ , but this is not the case for higher dimensional representations I think, being $S_n$ non-abelian.","['integer-partitions', 'representation-theory', 'finite-groups', 'symmetric-groups', 'group-theory']"
3741563,"Is $f(x)=\sum_{n=1}^{\infty}\frac{x}{1+n^2x^2}$, $x\in[0,1]$ continuous on $[0,1]$","Let $f(x)=\sum_{n=1}^{\infty}\frac{x}{1+n^2x^2}$ , $x\in[0,1]$ . Question: Show that $f$ is Lebesgue integrable and determine whether $f$ is continuous on $[0,1]$ . For the first part, I have no problem, I showed that it is Lebesgue integrable. But for the second part, I could not reach any result by using the definition. Also, I'm not sure if I should use the first part.  Can you give me a hint for this part?","['continuity', 'lebesgue-integral', 'real-analysis']"
3741623,Doubt in the framing of a question on Venn diagram,"In a group of $265$ people, $200$ like singing, $110$ like dancing and $55$ like painting. If $60$ people like both singing and dancing, $30$ like both singing and painting and $10$ like all the three activities, then the number of people who like only dancing and painting are? Now I know that this question has been asked before. But the problem I am facing is in the framing of the question. In all the solutions that I have seen, in all of them, we are considering that all these $265$ people like some activity. My question is why isn't it possible that out of $265$ people, some of them don't like any of the three activities?",['elementary-set-theory']
3741746,Generators of the ideal correspond to $d$-uple embedding,"I am trying to mimic the interesting proof from Hartshorne Problem 1.2.14 on Segre Embedding to give a generating set of the ideal correspond to the $d$ -uple embedding: We fix the notation $\Delta = \big\{ (\nu_0, \dots, \nu_n) \in {\mathbb{N}}^{n+1}_0 ~:~ \nu_0 + \dots + \nu_n = d \big\}$ . The polynomial map is $\theta : k[y_\nu : \nu \in \Delta] \rightarrow k[x_0, \dotsc, x_n]$ given by $$
\theta ( y_\nu ) := x^{\nu_0}_0 \cdots x^{\nu_n}_n
$$ and we know that ${\mathrm{ker}}~\theta$ is the ideal of the $d$ -uple embedding, i.e., $\rho_d({\mathbb{P}}^n) = Z({\mathrm{ker}}~\theta)$ (cf. Exercise I.2.12 Hartshorne). Now let $W \leq k[y_\nu : \nu \in \Delta]$ denote the ideal $$
W := \Big\langle y_{\tau_1} y_{\tau_2} - y_{\tau^{\prime}_1} y_{\tau^{\prime}_2} ~:~ \tau_1, \tau_2, \tau^{\prime}_1, \tau^{\prime}_2 \in \Delta, \tau_1 + \tau_2 = \tau^{\prime}_1 + \tau^{\prime}_2 \Big\rangle
$$ Clearly, $W \subseteq {\mathrm{ker}}~\theta$ . Using the lemma in the above link, we need to produce a $k$ -subspace $T \subseteq k[y_\nu : \nu \in \Delta]$ with the conditions $$
T + W = k[y_\nu : \nu \in \Delta], \hspace{.2in} \theta \lvert_{T} = {\mathrm{injective}}
$$ After a few thoughts it seems reasonable to think of the following subspace as a candidate for $T$ : First define the equivalence relation on $\Delta \times \Delta$ given by $(\tau_1, \tau_2) \sim (\tau^{\prime}_1, \tau^{\prime}_2)$ if $\tau_1 + \tau_2 = \tau^{\prime}_1 + \tau^{\prime}_2$ . Let $\Omega \subseteq \Delta \times \Delta$ be a subset with a unique representative from each class of $\sim$ . Now let $T$ be the $k$ -span of the monomials $y^{\alpha_1}_{\tau_1} \dotsc y^{\alpha_r}_{\tau_r}$ (with the distinct elements $\tau_1, \dotsc, \tau_r \in \Delta$ and $\alpha_1, \dotsc, \alpha_r \geq 1$ ) such that $(\tau_i, \tau_j) \in \Omega$ for each $i \neq j$ . Clearly, $\theta$ is injective if restricted to $T$ . I got lost in the step : Each monomial $M$ of $k[y_\nu : \nu \in \Delta]$ satisfy $M \equiv b$ mod $W$ for some $b \in T$ . Did I do anything wrong?","['algebraic-geometry', 'commutative-algebra']"
3741802,Solve the equation $\frac{1}{x^2+11x-8} + \frac{1}{x^2+2x-8} + \frac{1}{x^2-13x-8} = 0$,Problem Solve the equation $$\frac{1}{x^2+11x-8} + \frac{1}{x^2+2x-8} + \frac{1}{x^2-13x-8} = 0$$ What I've tried First I tried factoring the denominators but only the second one can be factored as $(x+4)(x-2)$ . Then I tried substituting $y = x^2 - 8$ but that didn't lead me anywhere. Where I'm stuck I don't know how to start this problem. Any hints? P.S. I would really appreciate it if you give me hints or at least hide the solution. Thanks for all your help in advance!,['algebra-precalculus']
3741843,How can i evaluate $\int _0^{\infty }\frac{\ln \left(x\right)\sin \left(x\right)}{x^2+1}\:dx\:$ using real methods,"I've been trying to evaluate this integral for a while now. My friend used complex analysis to evaluate this but he got a wrong result. I tried using real methods but I've been stuck. One can probably use differentiating under the integral sign in the following ways, $$I\left(a\right)=\int _0^{\infty }\frac{\ln \left(x\right)\sin \left(ax\right)}{x^2+1}\:dx$$ or $$I\left(a\right)=\int _0^{\infty \:}\frac{x^a\sin \left(x\right)}{x^2+1}\:dx$$ But that seems complicated, I have no idea how to proceed, please help me.","['integration', 'improper-integrals', 'definite-integrals']"
3741855,How to solve $\int \frac{dx}{\sqrt{1+x}-\sqrt{1-x}}$?,"How can I evaluate the following integral $$\int \frac{dx}{\sqrt{1+x}-\sqrt{1-x}}$$ This is taken from a definite integral where $x$ varies from $0$ to $1$ . My attempt: Multiplied by conjugate $$\int \frac{dx}{\sqrt{1+x}-\sqrt{1-x}}\\=\int \frac{(\sqrt{1+x}+\sqrt{1-x})dx}{(\sqrt{1+x}-\sqrt{1-x})(\sqrt{1+x}+\sqrt{1-x})}$$ $$=\int \frac{\sqrt{1+x}+\sqrt{1-x})dx}{1+x-1+x}$$ $$=\int \frac{\sqrt{1+x}+\sqrt{1-x})dx}{2x}$$ If I use $x=\sin^2\theta$ $$\int \frac{\left(\sqrt{1+\sin^2\theta}+\cos\theta\right)}{2\sin^2\theta}\sin2\theta\ d\theta\\
=\int \left(\sqrt{1+\sin^2\theta}+\cos\theta\right)\cot\theta d\theta$$ If I use $x=\tan^2\theta$ $$\int \frac{\left(\sec\theta-\sqrt{1-\tan^2\theta}\right)}{2\tan^2\theta}2\tan\theta\sec^2\theta d\theta\ d\theta\\
=\int \frac{\left(\sec\theta-\sqrt{1-\tan^2\theta}\right)}{\sin\theta\cos\theta} d\theta$$ Should I use substitution $x=\sin^2\theta$ or $x=\tan^2\theta$ ?. I can't decide which substitution will work further. Please help me solve this integration. Thanks","['integration', 'indefinite-integrals', 'calculus']"
3741857,$L^2$ norm of inverse differential operator,"This has come up in Lemma 1 of Mandache's 2001 paper on exponential instability for the inverse problem of the Schrodinger operator. Let $\Omega = B(0,1)$ in $\mathbb{R}^d$ . Suppose $r_0\in (0,1)$ and $q$ is a function in $L^{\infty}$ supported on $B(0,r_0)$ . Suppose also that $0$ is not a Dirichlet eigenvalue of $-\Delta+ q$ , so that the boundary value problem $(-\Delta + q)u = F$ in $\Omega$ , $u = f$ on $\partial\Omega$ has a unique solution $u\in H^1(\Omega)$ for any $F\in H^{-1}(\Omega)$ , $f\in H^{1/2}(\partial\Omega)$ . I have two questions: In the paper, the author uses the notation $(-\Delta + q)^{-1}$ , which I would assume the operator that takes some $F\in H^{1/2}(\partial \Omega)$ and maps it to the unique $u\in H^1$ such that $(-\Delta + f)u = F$ ; is this correct? He also uses the norm $||(-\Delta + q)^{-1}||_{L^2}$ ; how am I to interpret this?","['inverse-problems', 'lp-spaces', 'functional-analysis', 'partial-differential-equations']"
3741881,Generic linear projection with $\text{Codim}\ge 2$ is birational (geometric proof),"Let $X\subseteq \mathbb P^N$ be a smooth variety and $p$ a general point $\mathbb P^N\setminus X$ . Consider the map $$\pi:X\to \mathbb P^{N-1}$$ as the restriction of linear projection $\mathbb P^N\setminus \{p\}\to \mathbb P^{N-1}$ . Then $\pi$ is a finite morphism (proper and quasi-finite) onto its image. Let's assume $\dim X\le N-2$ , in other words, $\pi(X)$ is not the whole space, then is $\pi:X\to \pi(X)$ a birational map? Edited: As KReiser pointed it out, it is an exercise in Hartshorne (which I didn't realize), and the standard proof is to show $X$ and $\pi(X)$ have the same function field using the standard tool in commutative algebra. There are already complete solutions linked in KReiser's comment. However, as a complex geometer, I'm used to thinking this problem geometrically, for example, I can relax the condition to $X\subset \mathbb C^N$ an analytic subvariety and ask if a generic linear projection is bimeromorphic. In other words, to me this problem is equivalent to show that for a  generic point $q\in \pi(X)$ , the line through $\overline{pq}$ intersect $X$ at only one point . Is there a geometric proof of this fact?","['complex-geometry', 'algebraic-geometry']"
3741886,How do two conjugate elements of a group have the same order?,"I'm reading group action in textbook Algebra by Saunders MacLane and Garrett Birkhoff. I have a problem of understanding the last sentence: Since conjugation is an automorphism, any two conjugate elements have the same order. Assume $x,y \in G$ are conjugate, then they are equivalent. As such, $gxg^{-1} = y$ for some $g \in G$ . This means $gx = yg$ . From here, I could not get how $x,y$ have the same order. Could you please elaborate on this point?","['group-theory', 'abstract-algebra']"
3741921,"(RESOLVED) Given $z = f (x, y)$ and $x = r \cos \theta $, $ y = r \sin \theta$ prove the following","Question: Let $z = f (x, y)$ and $x = r \cos \theta $ , $ y = r \sin \theta$ Show that $$\frac{\partial^2z}{\partial x^2} + \frac{\partial^2z}{\partial y^2} = \frac{\partial^2z}{\partial r^2} + \frac{1}{r^2} \frac{\partial^2z}{\partial \theta^2} + \frac{1}{r} \frac{\partial z}{\partial r} $$ My attempt is to show that LS=RS, but I am stuck on how to eliminate the $\frac{1}{r} \frac{\partial z}{\partial r} $ term . See below $$LS: \frac{\partial^2z}{\partial x^2} + \frac{\partial^2z}{\partial y^2}$$ For the RS, first find its given partial derivatives/expressions First term: $$===>\frac{\partial^2z}{\partial r^2} = \frac{\partial^2z}{\partial x^2}cos^2\theta + \frac{\partial^2z}{\partial y^2}sin^2\theta + 2(\frac{\partial^2z}{\partial x\partial y}sin\theta cos\theta)$$ This is the part where I get stuck $$ \frac{1}{r^2} \frac{\partial^2z}{\partial \theta^2}=\frac{1}{r^2}[\frac{\partial}{\partial \theta}(-\frac{\partial z}{\partial x}rsin\theta+\frac{\partial z}{\partial y}rcos\theta)]$$ Now treat $(-\frac{\partial z}{\partial x}rsin\theta+\frac{\partial z}{\partial y}rcos\theta)$ as a function of $z$ hence $(-\frac{\partial z}{\partial x}rsin\theta+\frac{\partial z}{\partial y}rcos\theta)$ can be seen as $\frac{\partial z}{\partial \theta}$ $$= \frac{1}{r^2}[\frac{\partial}{\partial x}(-\frac{\partial z}{\partial x}rsin\theta+\frac{\partial z}{\partial y}rcos\theta)\frac{\partial x}{\partial \theta} + \frac{\partial}{\partial y}(-\frac{\partial z}{\partial x}rsin\theta+\frac{\partial z}{\partial y}rcos\theta)\frac{\partial y}{\partial \theta}]$$ We know $\frac{\partial x}{\partial \theta} = -rsin\theta$ and $\frac{\partial y}{\partial \theta}=rcos\theta$ , so substitute them in $$= \frac{1}{r^2}[\frac{\partial}{\partial x}(-\frac{\partial z}{\partial x}rsin\theta+\frac{\partial z}{\partial y}rcos\theta)(-rsin\theta) + \frac{\partial}{\partial y}(-\frac{\partial z}{\partial x}rsin\theta+\frac{\partial z}{\partial y}rcos\theta)(rcos\theta)]$$ $$= \frac{1}{r^2}[(\frac{\partial ^2z}{\partial x^2}r^2sin^2\theta-\frac{\partial ^2z}{\partial x\partial y}r^2cos\theta sin\theta) + (-\frac{\partial ^2z}{\partial x\partial y}r^2cos\theta sin\theta+\frac{\partial ^2z}{\partial y^2}r^2cos^2\theta)]$$ Second term: $$===>\frac{1}{r^2} \frac{\partial^2z}{\partial \theta^2} = \frac{\partial ^2z}{\partial x^2}sin^2\theta-2(\frac{\partial ^2z}{\partial x\partial y}cos\theta sin\theta) +\frac{\partial ^2z}{\partial y^2}cos^2\theta$$ Now for the last term on the right side, Third term: $$===>\frac{1}{r} \frac{\partial z}{\partial r}= \frac{1}{r}[\frac{\partial z}{\partial x}cos\theta + \frac{\partial z}{\partial y}sin\theta]$$ Combining all terms of the right side, we have the following $$\frac{\partial^2z}{\partial x^2}cos^2\theta + \frac{\partial^2z}{\partial y^2}sin^2\theta + \frac{\partial^2z}{\partial x^2}sin^2\theta + \frac{\partial^2z}{\partial y^2}cos^2\theta + \frac{1}{r}[\frac{\partial z}{\partial x}cos\theta + \frac{\partial z}{\partial y}sin\theta]$$ $$===>RS: \frac{\partial^2z}{\partial x^2} + \frac{\partial^2z}{\partial y^2} + \frac{1}{r}[\frac{\partial z}{\partial x}cos\theta + \frac{\partial z}{\partial y}sin\theta]$$ which, $$≠LS=\frac{\partial^2z}{\partial x^2} + \frac{\partial^2z}{\partial y^2}$$ My QUESTION: There is supposed to be an extra term for the second term of the right side that cancels the third term, but I can't see it. Anyways, what did I do wrong? I believe my error is evaluating the second term of the right side, but it seems correct to me.","['multivariable-calculus', 'calculus']"
3741982,Can any continuous function be re-parameterized into a differentiable function?,"$|x|$ is not differentiable at zero. However, if we compose it with another function that ""eases up"" very gently to zero, for example, $x=t^3$ , we can obtain a function $|t^3|$ which is differentiable everywhere. I imagine this as ""stretching out"" $|x|$ to make it smooth. It seems like any continuous function could be turned in to a differentiable function by composing it with another function, that momentarily comes down to a derivative of 0 everywhere the continuous function is not differentiable. As I have posed it, this question has a trivial solution: $f\circ 0$ is always differentiable (even if $f$ is not continuous!). So, an additional requirement should be imposed, to fit the intuition of ""stretching $f$ ."" The function being composed should be monotonically increasing and should cover the entire domain of $f$ . Given a continuous $f(x)$ , can such a $g(t)$ always be found so that $f(g(t))$ is differentiable everywhere?","['continuity', 'calculus']"
3742016,Fréchet manifold structure on space of sections,"I know that the space $\mathsf{C}^\infty(M;N)$ of smooth maps from a closed (smooth) manifold $M$ to a (smooth) manifold $N$ is a Fréchet manifold. I have been looking for a more general version of this statement along the following lines: Let $p: E \to B$ be a smooth fiber bundle, where $E$ and $B$ are manifolds with corners (with some additional assumptions on $p:E \to B$ ?) . Then $\Gamma^\infty(B;E) := \{ s: B \to E \mid s $ smooth, $ p \circ s = \mathsf{id}_B \}$ is a Fréchet manifold (with corners?) but I can't seem to find a precise statement or proof of something like this anywhere. I've tried looking in ""A Convenient Setting for Global Analysis,"" but that book seems to work in a very large amount of generality that is a bit beyond what I would need. The only generalizations I am looking for are: instead of functions $f: M \to N$ , we consider sections $s: B \to E$ of a fiber bundle $p: E \to B$ , the manifolds in question can have boundary (or maybe even corners). Then the original result for $\mathsf{C}^\infty(M;N)$ would then be recovered by taking $M$ and $N$ without corners and considering the trivial bundle $M \times N \to M$ . I would really appreciate it if anyone could suggest a reference where a result like this is stated/proven, or if someone could explain how I could formulate/prove this (namely, what are the charts on $\Gamma^\infty(B;E)$ , what assumptions would we need on $p: E \to B$ , and do we need a notion of ""Fréchet manifold with corners""?). Thanks very much!","['fiber-bundles', 'manifolds-with-boundary', 'manifolds', 'global-analysis', 'differential-geometry']"
