question_id,title,body,tags
3739291,Properties of the solutions of the ODE $y'' + p(x)y' + q(x)y = 0$,"Let $u(x)$ and $v(x)$ be solutions of $y'' + p(x)y' + q(x)y = 0$ , $p$ and $q$ continuous in $\mathbb{R}$ , such that $u(0) = 1$ , $u'(0) = 0$ , $v(0) = 0$ and $v'(0) = 1$ . Prove that, if $x_{1} < x_{2}$ are such that $u(x_1) = u(x_2) = 0$ and $u(x) \neq 0$ for all $x \in (x_1, x_2)$ , then there exists a point $c \in (x_1, x_2)$ such that $v(c) = 0$ . What's more, prove that such a point is unique. I don't really know how to start tackling this problem. I know that the Wronskian of $u$ and $v$ is greater than $0$ in the entire interval, and that $v(x_1) \neq 0$ and $v(x_2) \neq 0$ , but I couldn't go much farther than that... Does anyone have a tip to get me going in the right direction? Thanks in advance!","['wronskian', 'ordinary-differential-equations']"
3739319,$\ell_1$ is a schur space,"I want to prove that, in $l_1$ , if $x_n\to x$ weakly then $x_n\to x$ . i tried to use proprieties of $l_1$ . If $x_n\to x$ weakly, then for all $f\in {\ell^1}'$ , $f(x_n)\to f(x)$ . Considering $T\in {\ell^1}'$ : \begin{align}T&:\ell^1\to \mathbb{K} \\ x&\to T(x)=\sum_{n=1}^{\infty}x_n \end{align} , then if $x_n=\{\xi_{j}^{n}\}$ and $x={\xi_j}$ : Computing $|T(x_n)-T(x)|=|\sum_{j=1}^{\infty}\xi_j^n-\sum_{j=1}^{\infty}\xi_j|\geq |\|x_n\|_1-\|x\|_1|\to 0$ then $\|x_n\|_1\to \|x\|_1$ . For the other hand, trying \begin{align}G&:\ell^1\to \mathbb{K} \\ x&\to G(x)=x_n\end{align} , n fixed. I computed to $|G(x_n)-G(x)|$ to get some inequality to $\|x_n-x\|_1$ . Someone can help?","['measure-theory', 'functional-analysis', 'real-analysis']"
3739355,Likelihood ratio test question,"If $X_i$ , $i=1,\ldots,n$ , are observations from the normal distribution with known variance $\sigma_i^2$ , respectively, and $X_i$ 's are mutually independent, construct a test for testing that their means are all equal. My approach: $\lambda=\frac{L(\omega)}{L(\Omega)}$ where $\omega$ comes from the space where all means are equal and hence in likelihood means are replaced $\mu$ and $\sigma_i^2$ stay the same.
In, $L(\Omega)$ , all means are staying as they were as $\mu_i$ and variances $\sigma_i^2$ .
Do, we need to replace means and variances by their maximum likelihood somewhere.
I am confused about that.","['statistical-inference', 'statistics', 'normal-distribution', 'hypothesis-testing']"
3739365,Intuitive meaning of Diffeomorphism,"Let $U\subset\mathbb{R}^n$ , $V\subset\mathbb{R}^m$ and a bijection $f:U\to V$ is a diffeomorphism if $f$ and $f^{-1}$ are differentiable. I would like to know the intuitive meaning of two open sets being diffeomorphic. For example , if two spaces are homeomorphic , these spaces share the same topological properties. And we have a clear intuitive idea of two spaces being homeomorphs, like the classic relationship between a donut and a mug. Is there a similar intuitive idea for diffeomorphism? Edit: The proprieties that homeomorphism preserves is, for example, if one of them is compact, then the other is as well; if one of them is connected, then the other is as well; if one of them is Hausdorff, then the other is as well; their homotopy and homology groups will coincide. So, what are the properties preserved by diffeomorphism? I quoted homeomorphism, to indicate what I meant by an intuitive idea.","['multivariable-calculus', 'diffeomorphism', 'intuition', 'differential-geometry']"
3739394,Showing $−1 − r^2 \leq \cos^3\theta + r^2 \cos^5\theta \leq 1 + r^2$,"I was studying my textbook in advanced calculus when I encountered an inequality I can't seem to justify: Now $−1 \leq \cos\theta \leq 1$ , which implies that $$−1 − r^2 \leq \cos^3\theta + r^2 \cos^5\theta \leq 1 + r^2$$ I first cubed the inequality to get $$−1 \leq \cos^3\theta \leq 1 \tag{1}$$ Followed by adding $r^2 \cos^5 \theta$ : $$−1 + r^2 \cos^5\theta \leq \cos^3\theta + r^2 \cos^5\theta \leq 1 + r^2 \cos^5 \theta \tag{2}$$ This is where I am stuck.  I want to remove the $\cos^5\theta$ from either sides, as well as having the left hand side contain only negative terms. Or maybe I need to think of this inequality's justification differently? Thank you, trig never was my strong suit.","['trigonometry', 'inequality']"
3739448,"Describe the set $A = \{ 7a +3b: a,b \in \mathbb{Z}\}$","So in Hammack's ""Book of Proof"" there is the following example when he introduces the concept of set-builder notation in chapter 1.1. Describe the set $A = \{ 7a +3b: a,b \in \mathbb{Z}\}$ In which he then proceeds to state the following: If n is any integer, then $n = 7n +3(−2n)$ , so $n = 7a+3b$ where $a = n$ and $b = −2n$ . Therefore $n \in A$ . We’ve now shown that $A$ contains only integers, and also that every integer is an element of $A$ .
Consequently $A = \mathbb{Z}$ . My question is: are the values $a=n$ and $b=-2n$ arbitrary? If not, where did they come from?",['elementary-set-theory']
3739458,$p(x).y''+p'(x).y'+\frac{1}{p(x)}.y=0$,Is there a general solution I can give to the differential equation $\; p(x).y''+p'(x).y'+\frac{1}{p(x)}.y=0\;$ (the function $p(x)$ wasn't given) ?,['ordinary-differential-equations']
3739467,"In an isosceles triangle with base $AB$ and $\angle CAB=80^\circ$ taken $D$ on $CA$, $E$ on $CB$ such that ...","For the well-known problem In an isosceles triangle with base $AB$ and $\angle CAB=80^\circ$ taken $D$ on the segment $CA$ , $E$ on the segment $CB$ such that $\angle BAE=60^\circ$ , $\angle ABD=50^\circ$ , find $\angle EDB$ . The question is what is a canonical or otherwise simple without being too artificial way of solving it? Or what was the solution you heard/seen/found first? Btw, simple angle chasing does not help. The first way I can think of is considering difference of heights $DH_d$ and $EH_e$ of triangles $ABD$ and $ABE$ respectively along with $H_dH_e$ which together give the inclination angle of $DE$ relative to $AB$ and thus the desired angle. Needed for that lengths of $AD,\,BD,\,AE,\,BE$ can be expressed in terms of $AB$ and known angles by the sine rule. Almost like putting the thing into Cartesian coordinates. Another approach could be vectors, then taking $A$ or $B$ as the origin makes things more simple, than taking $CA,\,CB$ as basis vectors, IMHO. By ""too artificial"" I mean things like this: constructing a regular $18$ -gon with side $AB$ , proving lines $AE,\,BD,\,DE$ contain some diagonals and then finding the angle very easy by angle chasing. Update : The solutions are not as trivial as one would expect from the statement. It's called Langley's problem of adventitious angles first posed in The Mathematical Gazette in 1922. Check out An Intriguing Geometry Problem by Tom Rike . (from this answer ).","['euclidean-geometry', 'trigonometry', 'geometry']"
3739515,Is there a deeper reason for the classification of moduli in which a primitive root exists?,"The primitive root theorem classifies the set of moduli for which a primitive root exists as $$1,2,4,p^k,2p^k$$ where $p$ is an odd prime and $k$ is a positive integer. I have worked through a proof of this assertion which can be broken down as follows: It is clear that $1,2,4$ each have a primitive root. Higher powers of $2$ do not have a primitive root by induction. If the modulus has an odd prime factor and the modulus has a primitive root, then the modulus is either a power of that prime or twice a power of that prime. Every odd prime has a primitive root (using polynomials in modular arithmetic). Primitive roots modulo a prime can be ""lifted"" to moduli that are higher powers of the prime. Primitive roots in a modulus can be lifted to twice that modulus. This is all well and good, but this proof just works towards the expected result using standard elementary techniques without providing much insight. I was wondering: Is there a deep reason for why the classification of suitable moduli is so strange? It's a natural question to wonder when a reduced residue system has a multiplicative generator, yet the set we end up with carves out an unexpected subset of the positive integers. I don't entirely know what would qualify as a satisfactory answer, but some possibilities are: The set of integers $1,2,4,p^k,2p^k$ appears in other parts of mathematics. There is a more general theorem of which this is merely a shadow. There is a different proof that is less reminiscent of mechanical verification. EDIT: I came across a couple of quotes that sum up my feelings. What the standard proof is like, if I may exaggerate: Well, I have slightly mixed feelings about [the classification of finite simple groups]. First of all, it takes so many pages to prove; it seems to me the degree of understanding must be pretty limited if that is the only way it can be done. - Michael Atiyah, The Mathematical Intelligencer What I'm looking for: Not only is the above combinatorial proof much shorter than our previous proof, but it also makes the reason for the simple answer completely transparent. It is often the case, as occurred here, that the first proof to come to mind turns out to be laborious and inelegant, but that the final answer suggests a simpler combinatorial proof. - Richard Stanley, Enumerative Combinatorics I","['modular-arithmetic', 'number-theory', 'elementary-number-theory', 'primitive-roots', 'abstract-algebra']"
3739516,The condition and proof about the integral test for convergence,"The proof about the integral test: Suppose $f (x) $ is nonnegative monotone decreasing over $[1,\infty)$ , then the positive series $\sum_{n=1}^{\infty}f(n)$ is convergent if and only if $\lim_{A\rightarrow +\infty}f(x)dx$ exists. Proof:
Since $f(x)$ is monotone decreasing, we can get $f(n+1)<\int_{n}^{n+1}f(x)\Bbb{dx}< f(n)$ , sum them up and get $\sum_{k=1}^{n+1}f(x)-f(1)<\int_{1}^{n+1}f(x)\Bbb{dx}<\sum_{k=1}^{n}f(k)$ , when the series is convergent, the integral is bounded, since $f(x)$ is nonnegative, the integral is monotone increasing, the $\lim_{A\rightarrow +\infty}f(x)dx$ exists. When $\lim_{A\rightarrow +\infty}f(x)dx$ exists, the positive series is bounded, so it is convergent. When reading the integral test for positive series, I confused about the condition ""Monotone decreasing"": this condition is used to get $f(n+1)<\int_{n}^{n+1}f(x)\Bbb{dx}< f(n)$ and following that $\sum_{k=1}^{n+1}f(x)-f(1)<\int_{1}^{n+1}f(x)\Bbb{dx}<\sum_{k=1}^{n}f(k)$ , but I am confused because when the condition is monotone increasing we can just change the direction of the sign of the inequality like $f(n+1)>\int_{n}^{n+1}f(x)\Bbb{dx}> f(n)$ , so why the condition ""monotone decreasing"" is necessary? ""Continuous"": the condition says that $f (x) $ is continuous. But when proves it seems that the condition that be used is the integrable. Is the condition continuous not necessary? I think there is something wrong with my understanding. Could you find and point it? Thank you!","['integration', 'convergence-divergence', 'analysis']"
3739569,Drawing from a deck without replacement (Checking my answer),"From Carol Ash's The Probability Tutoring Book , Draw from a deck without replacement. Find the probability that a) the $10^{th}$ draw is a king and the $11^{th}$ draw is a non-king b) the first king occurs on the $10^{th}$ draw c) it takes $10$ draws to get $3$ kings My attempts: a) $$P(10^{th}\text{ is king and }11^{th}\text { is non king}) = P(1^{st}\text{ is king and }2^{nd}\text { is non king}) \\ = \frac{4}{52} \frac{48}{51}$$ b) To get the probability that the first king is on the $10^{th}$ we want $9$ non-kings first. Here is where my confusion begins. I first try a combinations approach: Of $48$ non-kings, pick 9 of them and then of $4$ kings pick $1$ of them. This results in: $$\frac{{48 \choose 9}{4 \choose 1}} {52 \choose 10}$$ Using a different approach: Draw 9 non-kings one at a time, and then draw a king $$\frac{(48)(47)(46)...(40)}{(52)(51)(51)...(44)} \frac{4}{43}$$ I feel as though these two should produce the same numerical answer, yet the first method produces an answer(0.424) that's a factor of 10 away from the latter method(.0424) c) $$P(10 \text{ draws to get } 3 \text{ Kings}) = P(10^{th} = \text{King}|2 \text{Kings before})P(2 \text{ Kings before}) = \frac{2}{43} \frac{{4 \choose 2}{48 \choose 7}}{52 \choose 10}$$","['discrete-mathematics', 'solution-verification', 'combinatorics', 'probability']"
3739570,Show that a sequence $a_n$ is a solution of the given recurrence relation,"Show that the sequence $a_n=3^{n+4}$ is a solution of the recurrence relation $a_n=4a_{n-1}-3a_{n-2}$ . I'm stuck on this question as I'm having trouble figuring it out when $a_n=3^{n+4}$ . After substituting $3^{n+3}$ for both n's in $4a_{n-1}$ and $3a_{n-2}$ , I have no idea where to go from there.","['recurrence-relations', 'discrete-mathematics']"
3739696,What is the most general context in which the limit laws hold?,"By limit laws I mean properties like $\lim (f+g) = \lim f + \lim g$ $\lim af = a \lim f$ $\lim fg = (\lim f) (\lim g)$ $\lim f/g = (\lim f)/(\lim g)$ if $\lim g \neq 0$ . What is most general setting for these to occur? For example, it seems true of $\mathbb{R}$ and $\mathbb{Q}$ , among others. Is it true in any metric space? Or other spaces? Also, what if we only require it true for sequences? Does that change anything? Or if we only require linearity (i.e. the first 2 properties) and not necessarily the product and quotient rules?","['limits', 'general-topology', 'functions', 'real-analysis']"
3739702,2 questions on Page 6 of Hoffman Kunze ( Linear Algebra),"While studying Linear Algebra from Hoffman Kunze I have following two questions : I.3. Matrices and Elementary Row Operations One cannot fail to notice that in forming linear combinations of linear equations there is no need to continue writing the ""unknowns' $x_{1}, \ldots, x_{n},$ since one actually computes only with the coefficients $A_{i j}$ and the scalars $y_{i} .$ We shall now abbreviate the system (1-1) by $$AX=Y$$ where $$A=\begin{bmatrix}A_{11}&\cdots&A_{1n}\\\vdots&&\vdots\\A_{m1}&\cdots&A_{mn}\end{bmatrix}\\X=\begin{bmatrix}x_1\\\vdots \\x_n\end{bmatrix}\text { and }Y=\begin{bmatrix}y_1\\\vdots\\y_m\end{bmatrix}$$ We call $A$ the matrix of coefficients of the system. Strictly speaking, the rectangular array displayed above is not a matrix, but is a representation of a matrix. An $m \times n$ matrix over the field $F$ is a function $A$ from the set of pairs of integers $(i, j), 1 \leq i \leq m, 1 \leq j \leq n,$ into the field $F$ . The entries of the matrix $A$ are the scalars $A(i, j)=A_{i j},$ and quite often it is most convenient to describe the matrix by displaying its entries in a rectangular array having $m$ rows and $n$ columns, as above. Thus $X$ (above) is, or defines, an $n \times 1$ matrix and $Y$ is an $m \times 1$ matrix. For the time being, $A X=Y$ is nothing more than a shorthand notation for our system of linear equations. Later, when we have defined a multiplication for matrices, it will mean that $Y$ is the product of $A$ and $X$ Questions-> (1) Why in 2nd paragraph author wrote that the rectangular array displayed above is not a matrix? (2) In 2nd line of 2nd paragraph author wrote the definition of matrix. How is a matrix a function from set of pair of integers into the field?
To me this definition given contradicts the definition given on Wikipedia and I can't understand it. Definition on Wikipedia: https://en.m.wikipedia.org/wiki/Matrix_(mathematics) Can kindly anyone explain why I am confused .","['matrices', 'linear-algebra']"
3739718,Positive integer $m≤n$ such that $m$ has the largest number of distinct prime factors among all positive integers $\le n$,"How do I interpret the following mathematically: Consider a positive integer $n$ such that $n=p_1^{\alpha_1}p_2^{\alpha_2}\cdots p_m^{\alpha_m}$ where $p_i$ are primes and $\alpha_i$ are positive integers. I want to consider the positive integer $m\le n$ such that $m$ has the largest number of distinct prime factors among all positive integers less than or equal to $n$ . I explain it with the following example: Consider $n=36$ . Here my $m$ will be $30$ since $30=2\times 3\times 5$ and it has the largest number of distinct prime factors among all positive integers which are less than or equal to $n=36$ . But I cant express my view mathematically.
How do I present my mathematical idea?
Can someone please help me to write the above fact in a more precise and concise manner which can be easily understood by mathematicians. Please help.","['elementary-number-theory', 'discrete-mathematics']"
3739763,How is this proposition false?,"I have a proposition: ((x v y) <=> (~x => ~y)) When I solve this, I end up getting True but the answer is False . Here's how I solved it: when we have a <=> b , we can write it as ~a.~b + a.b and a => b becomes ~a+b So the above equation becomes: => ~(x + y).~(~x => ~y) + (x + y).(~x => ~y) => ~(x+y).~(x+~y) + (x+y).(x+~y) Using De Morgan's law ( ~(a+b) = ~a.~b and ~(a.b) = ~a+~b ) => (~x.~y).(~x.y) + (x+y).(x+~y) => (~x.~x + ~x.y + ~y.~x + ~y.y) + (x.x + x.~y + y.x + y.~y) => (~x + ~x(y+~y) + 0) + (x + x(~y + y) + 0) => (~x + ~x) + (x + x) => ~x + x which is always True But, according to another solution, <=> is only True when both sides result in the same solution, So, if we go by this: => LHS = x+y and RHS is (x + ~y) , which can never be equal and hence, False . So what am I doing wrong? EDIT: PS: This is where I got the question from.",['discrete-mathematics']
3739772,Evaluating $2x^3-9x^2-10x+13$ for $x=3+\sqrt{5}$. Is there an efficient way to tell that this reduces to $1$?,"I was helping my sibling with a math problem from a past year paper for a competitive exam. It requires us to evaluate this cubic expression for a given value of $x$ which has an $a+b$ form where $b$ is a square root, as shown: I essentially plugged in $x=a+b$ in the expression and expanded each term and finally got the answer as $1$ . But this does not seem like the fastest way to do this, especially because there is only 1 minute given to solve each multiple choice question. Is there a better way to reduce the original expression that gives the answer as $1$ or suggests that the square root term is going to evaluate to $0$ ? Thanks!","['algebra-precalculus', 'radicals']"
3739776,Proving $\sum_{n=0}^\infty\frac{(-1)^n\Gamma(2n+a+1)}{\Gamma(2n+2)}=2^{-a/2}\Gamma(a)\sin(\frac{\pi}{4}a)$,"Mathematica gives $$\sum_{n=0}^\infty\frac{(-1)^n\Gamma(2n+a+1)}{\Gamma(2n+2)}=2^{-a/2}\Gamma(a)\sin(\frac{\pi}{4}a),\quad 0<a<1$$ All I did is reindexing then using the series property $\sum_{n=1}^\infty (-1)^n f(2n)=\Re \sum_{n=1}^\infty i^n f(n)$ ; $$\sum_{n=0}^\infty\frac{(-1)^n\Gamma(2n+a+1)}{\Gamma(2n+2)}=\sum_{n=1}^\infty\frac{(-1)^{n-1}\Gamma(2n+a-1)}{\Gamma(2n)}=-\Re\sum_{n=1}^\infty\frac{i^{n}\Gamma(n+a-1)}{\Gamma(n)}$$ and I dont know how to continue, any idea? Thanks","['gamma-function', 'closed-form', 'sequences-and-series']"
3739843,Does $\Phi_n(\alpha)=0$ in $\Bbb{F}_p$ for some $\alpha\in\mathbb{F}_p$ imply that $\mathrm{ord}_p(\alpha) = n$?,"Let $\Phi_n(x)$ denote the $n^\text{th}$ cyclotomic polynomial. Suppose it has a root $\alpha$ in the finite field $\Bbb{F}_p$ and $p \nmid n$ . Does it follow that $\mathrm{ord}_p(\alpha) = n$ ? In the case where we're working with $\Bbb{C}$ , then this is more or less a trivial result by definition of cyclotomic polynomials. However, it is no longer clear when working with finite fields. We clearly have $\mathrm{ord}_p(\alpha) \mid n$ , but must equality hold? Also, what if we generalise it to $\Bbb{F}_{p^n}$ ?","['number-theory', 'finite-fields', 'elementary-number-theory', 'cyclotomic-polynomials', 'prime-numbers']"
3739926,How to evaluate the Gauss sum using Mordell's Trick?,"I have been working on this problem: I have shown that the integral equals $G_n$ using the residue theorem. I have proved that the integral over the horizontal paths $B,D,F,H$ vanish. I have found the functional equation $f(z+n) - f(z) = g(z) := \exp(2 \pi i z^2 / n)(\exp(2 \pi i z) + 1)$ . This allows me to merge the integrals over $A$ and $C$ into one. And I can merge $E$ and $G$ into one. Let $P^-$ denote the path $P$ reversed. $$\begin{align}
& \int_A f(z) dz + \int_C f(z) dz\\
=& \int_{C^{-}} f(z+n) dz - \int_C^- f(z) dz\\
=& \int_{C^{-}} g(z) dz\\
=& \int_{-R}^{R} a g(a z) dz\\
=& \int_{-R}^{R} a \exp(-z^2)(\exp(2 \pi i a z) + 1) dz\\
=& \int_{-R}^{R} a \exp(-z^2)(\exp(- \sqrt{\pi} \sqrt{n} (1 - i) z) + 1) dz
\end{align}$$ and $$\begin{align}
& \int_E f(z) dz + \int_G f(z) dz\\
=& \int_{G^{-}} g(z) dz\\
=& \int_{-R}^{R} i g(i z) dz\\
=& \int_{-R}^{R} i \exp(- 2 \pi i z^2 / n)(\exp(- 2 \pi z) + 1) dz\\
\end{align}$$ Now I do not know what to do with these two resulting integrals, I think I should equate them and their values equal $G_n$ and I somehow want to form the boxed expression from them but I am very lost with this. I have evaluated the Gaussian integral as $\sqrt{\pi}$ but I don't know how to apply this here. Any advice would be appreciated!",['complex-analysis']
3739978,Determining the closed form of $\sum\limits_{r = 2}^n \binom{n}{r} \binom{r}{2}$ [closed],"Closed. This question does not meet Mathematics Stack Exchange guidelines . It is not currently accepting answers. Please provide additional context , which ideally explains why the question is relevant to you and our  community. Some forms of context include: background and motivation, relevant definitions, source, possible strategies, your current progress, why the question is interesting or important, etc. Closed 3 years ago . Improve this question Here is a sum in combinatorics, $\sum\limits_{r = 2}^n \binom{n}{r} \binom{r}{2}$ where $n>2$ , does this have a closed form?","['summation', 'binomial-coefficients', 'combinatorics']"
3739980,When does the Picard group embeds inside the divisor class group?,"Let $(X, \mathcal O_X)$ be a Noetherian, separated, integral scheme that is locally regular in codimension $1$ (i.e. if $\dim \mathcal O_{X,x}=1$ then $\mathcal O_{X,x}$ is regular). Then, is it true that $Pic(X)$ embeds inside $Cl(X)$ (the Weil divisor class group) ? Is it at least true if we also assume $X$ is normal ? I know that if I assumed $X$ is locally factorial, then $Pic(X)\cong Cl(X)$ . But otherwise, I'm not sure.","['divisors-algebraic-geometry', 'algebraic-geometry', 'schemes', 'line-bundles']"
3739992,How do I integrate the Boltzmann equation for neutrinos?,"In Sterile Neutrinos as Dark Matter we are given the Boltzmann equation for neutrinos $$\left( \frac{\partial}{\partial t} - HE \frac{\partial}{\partial E}\right) f_s (E,t) = \left[ \frac{1}{2} \sin ^2 2\theta (E,t)  \Gamma (E,t) \right] f_a (E,t) \tag{2}$$ $f_s$ and $f_a$ are the distribution functions of sterile and active neutrinos. $f_a = \left( e^{E/T}+ 1\right)^{-1} \approx \left( e^{p/T}+1\right)^{-1}$ $\Gamma (E,t)$ is the rate of scattering production of $\nu_s$ through a particular channel and it's stated that, by changing the time variable from $t$ to $a$ ( the Robertson-Walker scale factor) and integrating $(2)$ over momenta we find that: $$\frac{dr}{d \ln(a)}= \frac{\gamma}{H}+ r \frac{d \ln(g*)}{d \ln(a)} \tag{4}$$ $\gamma = \displaystyle \frac{1}{n_a} \int \frac{d^3 p}{(2\pi)^3} \sin^2 2\theta (p,T) \Gamma (p,T) \frac{1}{e^{p/T}+1}$ $ \displaystyle n_i ≡ 2 \int \frac{d ^3p}{(2π) ^3}f_i$ is the number density of sterile (active) neutrinos with $i = s,a  $ $g^∗a^3T^3= constant$ $H = \displaystyle \frac{\dot{a}}{a}$ and $r= \displaystyle\frac{n_s}{n_a}$ How do I integrate $(2)$ to get $(4)$ ? I know that $g^*$ comes from the entropy conservation law but I don't understand why it is brought up in the article or how it helps with this integration and this isn't explained in the article. I think that in this case, I can consider $E\approx p$ as the mass is negligible (as done in the distribution function for the active neutrinos, above) and so I think I can rewrite $(2)$ as $$\left( \frac{\partial}{\partial t} - Hp \frac{\partial}{\partial p}\right) f_s (E,t) = \left[ \frac{1}{2} \sin ^2 2\theta (p,t)  \Gamma (p,t) \right] f_a (p,t) \tag{2}$$ Dodelson-Widrow production of sterile neutrino Dark Matter with non-trivial initial abundance does something similar, but with the equation written slightly differently. But I still do not understand how the integration is done.","['integration', 'physics', 'calculus']"
3740053,Showing triangulation of equilateral triangle is non-regular,"I am trying to show that this triangulation is non-regular (sometimes called non-convex I think). By regular I mean there exists a convex function from the triangulation to $\mathbb{R}$ such that the faces of the lower convex hull of the lifted points correspond to the triangles of the triangulation. Another definition I have seen is that the domains of linearity of the function coincide with the faces of the triangulation. I know that the way to do this would be to attempt to construct such a function and probably find inequalities going around the triangle, thus reaching a contradiction. However, I can't seem to figure out the way to do this. To start, I think it is possible to assume that the three inner vertices lie below the three outer vertices but I am not sure why. If this is the case then I can picture in my head how lifting up the outer vertices would cause one of the faces to not be linear but I'm struggling to see how to make this mathematical. Any help would be appreciated.","['convex-hulls', 'convex-geometry', 'triangulation', 'geometry', 'triangles']"
