question_id,title,body,tags
20677,Cauchy's integral formula for Cayley-Hamilton Theorem,"I'm just working through Conway's book on complex analysis and I stumbled across this lovely exercise: Use Cauchy's Integral Formula to prove the Cayley-Hamilton Theorem: If $A$ is an $n \times n$ matrix over $\mathbb C$ and $f(z)  = \det(z-A)$ is the characteristic polynomial of $A$ then $f(A) = 0$. (This exercise was taken from a paper by C. A. McCarthy, Amer. Math. Monthly , 82 (1975), 390-391) Unfortunately, I was not able to find said paper. I'm completely lost with this exercise. I can't even start to imagine how one could possibly make use of Cauchy here... Thanks for any hints. Regards, S.L.","['cayley-hamilton', 'functional-calculus', 'cauchy-integral-formula', 'linear-algebra', 'complex-analysis']"
20680,Minimum of $x^2+\frac{a}{x}$ without Calculus,How can I find the minimum of $x^2+\frac{a}{x}$ on $\mathbb{R}_+$ without calculus?,['analysis']
20685,"In differential calculus, why is dy/dx written as d/dx ( y)?","In differential calculus, We know that dy/dx is the ratio between the change in y and the change in x. In other words, the rate of change in y with respect to x. Then, why is dy/dx written as d/dx ( y)? That is, why and how d/dx is considered as an operator?","['notation', 'calculus']"
20694,Vector derivative w.r.t its transpose $\frac{d(Ax)}{d(x^T)}$,"Given a matrix $A$ and column vector $x$ , what is the derivative of $Ax$ with respect to $x^T$ i.e. $\frac{d(Ax)}{d(x^T)}$ , where $x^T$ is the transpose of $x$ ? Side note - my goal is to get the known derivative formula $\frac{d(x^TAx)}{dx} = x^T(A^T + A)$ from the above rule and the chain rule.","['matrices', 'matrix-calculus', 'calculus', 'multivariable-calculus']"
20721,Why is the prime spectrum of a domain irreducible in the Zariski topology,How does one show that the prime spectrum of a domain is irreducible in the Zariski topology?,"['commutative-algebra', 'algebraic-geometry']"
20730,$ \mathbb{C} $ is not isomorphic to the endomorphism ring of its additive group,"Let $M$ denote the additive group of $ \mathbb{C} $. Why is $ \mathbb{C}$, as a ring, not isomorphic to $\mathrm{End}(M)$, where addition is defined pointwise, and multiplication as endomorphisms composition? Thanks!","['ring-theory', 'abstract-algebra']"
20749,The Hexagonal Property of Pascal's Triangle,"Any hexagon in Pascal's triangle, whose vertices are 6 binomial coefficients surrounding any entry, has the property that: the product of non-adjacent vertices is constant. the greatest common divisor of non-adjacent vertices is constant. Below is one such hexagon. As an example, here we have that $4 \cdot 10  \cdot 15 = 6 \cdot 20  \cdot 5$ , as well as $\gcd(4, 10, 15) = \gcd(6,20,5)$ . $$ 1 \\
1 \qquad  1\\
1\qquad 2\qquad 1\\
1\qquad3\qquad3\qquad1\\
1\qquad\mathbf{4}\qquad\mathbf{6}\qquad4\qquad1\\
1\qquad\mathbf{5}\qquad10\qquad\mathbf{10}\qquad5\qquad1
\\
1\qquad6\qquad\mathbf{15}\qquad\mathbf{20}\qquad15\qquad6\qquad1$$ There is a quick proof here (pdf). The original proof should be in V. E. Hoggatt, Jr., & W. Hansell. ""The Hidden Hexagon Squares."" The Fibonacci Quarterly 9(1971):120, 133. but I cannot access it. I am, however, intereseted in a purely combinatorial proof. I do not know how to approach this at all: I cannot see what the non-adjacent vertices represent and/or I do not know how to remodel their meaning. Can anyone help? EDIT: To specify my question more closely, what I am looking for is some natural bijection between the two sets of triads that create the hexagon. Thanks.","['alternative-proof', 'combinatorial-proofs', 'binomial-coefficients', 'combinatorics']"
20751,"Proof of bound on $\int t\,f(t)\ dt$ given well-behaved $f$","I got the following question by mail from someone I don't know from Adam. (Quoted in part.) if $f(t)$ continuously diff. on $[0,1]$ and a) $\int_0^1f(t)\ dt=0$ b) $m\le f\,'\le M$ on $[0,1]$ Prove $\frac m{12}\le\int_0^1t\cdot f(t)\ dt\le\frac M{12}$ I suspect it might be an error I assumed immediately that it's an error, but my first two thoughts as counterexamples were $f(t)=\frac12-t$ and $f(t)=\sin(2\pi t)$, both of which satisfy the result. Anyone with a proof or counterexample?","['inequality', 'integration', 'real-analysis', 'integral-inequality']"
20752,"Recursive Sequence ""3, 5, -2, 7, -9, 16, -25, 41""","How would I start in solving this recursive sequence?  Thanks! Sequence: 3, 5, -2, 7, -9, 16, -25, 41, ...",['discrete-mathematics']
20765,I need an interpretation of this formula using concrete example,"Take
$$   \frac{x-a}{b-a}(b) + \frac{b-x}{b-a}(a) = x.$$ I need an interpretation of this, using concrete example. well i don't have difficulty doing it and is not HW. I'm ust drawing a blank right now trying to interpret this. example would be on a number like 2-9 i want 6 then applying this $(4/7)(9)+(3/7)2 =6$. I'm TRYING to see what's going on in , not making sense to me but it works",['algebra-precalculus']
20781,Probability and Distribution,"Consider a random sample from a distribution with the p.d.f. (for some $c > 0$) \begin{equation} f(x) = cx^2 (1 − x), \text{if } 0 < x < 1; \end{equation} \begin{equation} 0, \text{ elsewhere}. \end{equation} What is an approximate distribution of $\bar{X}_n$ ? For a sample of size 45, find approximate mean and variance for $\bar{X}_n$ ? Find an approximate distribution of $\bar{X}^3_n$. How should I go about solving this problem ? More importantly, I'd like to have an intuition of this question. I'm new to statistics so more details would help me more. This may be naive/dumb but we know that we are taking a sample from uniform distribution and why would we want to find its distribution again and how is it leading to an another distribution ? I'm very confused.","['statistics', 'probability']"
20784,Connected components of a fiber product of schemes,"The underlying set of the product $X \times Y$ of two schemes is by no means the set-theoretic product of the underlying sets of $X$ and $Y$. Although I am happy with the abstract definition of fiber products of schemes, I'm not confident with some very basic questions one might ask. One I am specifically thinking about has to do with the connected components of a fiber product. Say $X$ and $Y$ are schemes over $S$ and let's suppose that $Y$ is connected and that $X = \coprod_{i \in I} X_i$ is the decomposition of $X$ into connected components. Is the connected component decomposition of $X \times_S Y$ simply $\coprod_{i \in I} X_i \times_S Y$? If so, how can we see this? What about if we replace ""connected"" with ""irreducible"". Thank you for your consideration.","['algebraic-geometry', 'schemes']"
20791,Is a presheaf which is a direct summand of a sheaf necessarily a sheaf?,"Let's say $X$ is a topological space and let's consider the categories of sheaves and presheaves of abelian groups on $X$. Suppose we have a presheaf that is a direct summand (in the category of presheaves) of a sheaf. Can we conclude that the presheaf is also a sheaf? What if we assume further that the complementary direct summand is a sheaf too--does that help us? I know that in general colimits in the category of sheaves differs than those in the category of presheaves, and in general the quotient of two sheaves (in the category of presheaves) need not be a sheaf (I think). But maybe the fact that things are split helps us? What about in the general context of sheaves and presheaves on a site?","['sheaf-theory', 'algebraic-geometry']"
20796,Proof of Statements involving Sets,1) $(P \vee Q) \Rightarrow R$ 2) $(P \Rightarrow R) \wedge (Q \Rightarrow R)$ Explain why 1 and 2 are equivalent statements. Attempt at solution: I converted 1 and 2 to these statements which are equivalent: 1) $(P \cup Q) \subseteq R$ 2) $(P \subseteq R) \cap (Q \subseteq R)$ This now seems logical but I don't know how to prove it? EDIT: I should have said truth tables are not necessary.,"['logic', 'elementary-set-theory']"
20806,Explanation/Intuition behind why $C_n$ counts the number of triangulations of a convex $n+2$-gon?,"I was reading about the Catalan numbers on wikipedia, because it seems like they show up quite a bit. I'm reading some of the examples in the applications to combinatorics section. Some of them make sense fairly easily for me. For example, I see that the number of ways to parenthesize a product of $n+1$ terms $x_0,x_1,\dots, x_n$ is $C_n$, since the final multiplication $\cdot$ based on the parentheses must show up between two factors $x_k$ and $x_{k+1}$, and the way to parenthesize those terms $x_0,\dots,x_k$ and $x_{k+1},\dots,x_n$ are $C_k$ and $C_{n-k-1}$, respectively . Since this final $\cdot$ could show up anywhere, I get the recurrence
$$
C_n=C_0C_{n-1}+C_1C_{n-2}+\cdots +C_{n-1}C_0
$$
which is the same as the Catalan numbers, given that the initial conditions are the same. In the same way, I see that the number of binary rooted trees with $n+1$ leaves is also given by $C_n$, since a binary tree essentially determines a parenthesization of a product of $n+1$ leaves if two leaves are enclosed in parentheses if they have the same parent node, and you follow the tree from the leaves up. I also understand the way it counts monotonic paths not passing the diagonal, as the first time a path touches the diagonal is like the position of the final multiplication on a product of $n$ terms, and splits the product into two smaller, but essentially similar subcases. But how does triangulating an $n+2$-gon give the same counting situation? I figured if you choose a vertex and draw a triangle with it as one of the vertices, it should give two other polygons that should suggest a recurrence relation like the one above, just like the Catalan numbers. Could someone point it out, or possibly show a way to relate it to one of the other identical counting situations which I understood? I don't quite see how this situation is the same. Thanks.","['catalan-numbers', 'combinatorics']"
20829,Dimension of a simple algebra over its center,Let $A$ be a finite dimensional simple algebra over a field $k$. Denote by $K$ the center of $A$. Why the dimension of $A$ over $K$ is a square?,['abstract-algebra']
20835,Probability and uniform distribution,"How to calculate the probability that one random sample say $X_1$ will be greater than the other random sample say $X_2$ if they are from a uniform distribution with $[0,1]$ ? This is not a homework. I'm trying to solve some exercise problem and this is a part of the problem.",['probability']
20843,A direct proof of the properties of the matrix of minors,"Let $A$ be an invertible $n\times n$ matrix.  Define the matrix of minors $\Delta(A)$ of $A$ to be the matrix whose $(i,j)$ entry is the determinant of the minor of $A$ with the $i$ th row and $j$ column omitted. Certainly, the most important property of $\Delta(A)$ is that it is instrumental in computing the inverse of $A$ : $$ A^{-1}= \frac{1}{\operatorname{det}(A)}\sigma\cdot \Delta(A)^T\cdot \sigma$$ where here, $\sigma$ is the diagonal matrix whose diagonal entries alternate $1$ and $-1$ . From this fact and elementary properties of the inverse, it is easy to prove the following Taking the matrix of minors is an involution up to scaling; that is, $\Delta(\Delta(A))=\operatorname{det}(A)^{n-2}\cdot A$ Taking the matrix of minors is an group homomorphism; that is, $\Delta(AB)=\Delta(A)\Delta(B)$ . If you actually write out either of these identities in terms of minors, you get a series of non-trivial-looking identities on the minors of an invertible matrix. Is this the easiest way to obtain these identities on minors?  It would bother me if it was, for a couple of reasons.  First, it seems extremely likely that the second identity above holds for non-invertible matrices.  Second, if $A$ is totally positive or non-negative (that is, every minor of every size is positive or non-negative), then so is $\Delta(A)$ .  However, the inverse of a totally positive matrix will almost never be totally positive, and so the above proof of the identities will stray off the totally positive path. Therefore, Can the identities on minors implied by the above relations on $\Delta$ be proven in a more direct way? Ideally, this proof would be 'subtraction-free', to make it more natural in the totally-positive setting. Edit: I should be a little bit more clear about what sort of thing I am looking for.  I am interested in spaces of totally-positive matrices and the corresponding algebras generated by minors on them (specifically, they are cluster algebras).  An important involution of these spaces and algebras is the matrix of minors defined above.  Note that taking inverses or cofactors does not preserve totally positivity, and so it doesn't act on this space. Mainly, I asked this question because I was annoyed at using a map whose properties couldn't be proven without passing to a different, bigger space (not that this doesn't happen all the time in math).  I was curious if there was a proof along algebraic lines, following only from the simplest relations on minors (the 3-term Plucker relations).","['matrices', 'linear-algebra', 'determinant']"
20848,A connected space which is neither locally connected nor path connected,"This is Problem 3.19.3 of Dieudonné's Foundations of Modern Analysis (in my words). For $x$ a rational number, let $E_x=\{x\}\times\left[-1,0\right[$, and for $x$ an irrational number, let $E_x=\{x\}\times[0,1]$. Let $E=\bigcup_{x\in\mathbf{R}}E_x$ with the subspace topology. Show that $E$ is connected. There is the following hint: ""Use (3.19.1) and (3.19.6) to study the structure of a subset of $E$ which is both open and closed."" (3.19.1) is the fact that the connected subspaces of $\mathbf{R}$ are intervals and that intervals are connected.
(3.19.6) is the fact that any open set of $\mathbf{R}$ is a countable disjoint union of open intervals. My thoughts: Let $A$ be a clopen subset of $E$. It is fairly obvious that, for any $x\in\mathbf{R}$, $A$ contains either all elements or no element of $E_x$. So we define a subset $B$ of the real line by $B=\{x\in\mathbf{R}:E_x\subset A\}$. Now I thought that $B$ has to be clopen as well (in $\mathbf{R}$). But I can't prove it. I have no problems showing that any irrational point of $B$ is an interior point, and that any irrational point of $\overline{B}$ is in $B$, but nothing about rational points. I was pretty sure that this is the way to go, since the hint is exclusively about subsets of $\mathbf{R}$. Any (further) hint or comment is much appreciated.",['general-topology']
20853,Tangent Bundle and its (Isomorphic?) Dual Bundle,In general it is not true that a vector bundle $E$ is isomorphic to its dual bundle $E^*$. But it is true when the vector bundle is the tangnet space of a manifold (at least I think it's true). How does one prove this?,['differential-geometry']
20858,Graph for $f(x)=\sin x\cos x$,"Okay, so in my math homework I'm supposed to draw a graph of the following function:
$$f(x)=\sin x \cos x.$$
I have the solution in the textbook, but I just can't figure out how they got to that. So, if someone could please post (a slightly more detailed) explanation for this, it would be really appreciated. I have to turn the homework this Wednesday, but since I already have the solution the answer doesn't have to be really swift. Bonus points if it is, tohugh","['trigonometry', 'graphing-functions']"
20862,Finding polynomial roots by attempts,"I barely remember that I could identify them by attempts. I would get the coefficient, see what numbers can divide it and put them into the Ruffini's rule. But I don't even know what such method is called.","['algebra-precalculus', 'roots', 'polynomials']"
20865,Positive symmetric matrices and positive-definiteness,Is a symmetric real matrix with diagonal entries strictly greater than $1$ and off-diagonal entries positive but strictly less than $1$ necessarily positive-semidefinite?,"['optimization', 'matrices', 'quadratic-forms', 'linear-algebra']"
20873,What's the fastest way to take powers of a square matrix?,"So I know that you can use the Strassen Algorithm to multiply two matrices in seven operations, but what about multiplying two matrices that are exactly the same. Is there a faster way to go about doing that (ie. by reducing the number of multiplications per iteration to something less than 7) ?","['matrices', 'linear-algebra', 'algorithms']"
20881,Applications of Helly's theorem to problem solving,"Helly's Theorem states the following: Suppose that $X_1,X_2,...,X_n$ are convex sets in $\mathbb{R}^d$, such that for any $|I|\leq d+1$, $\cap_{i\in I}X_i \neq \emptyset$.  Then $\cap_{i=1}^{n}X_i \neq \emptyset$. I'm looking for interesting problems, the solutions of which use this theorem. Here is one example:
Let $K_1,K_2,...,K_n$ be closed intervals parallel to the $y$ axis. Assume that for any $|I|\leq d+2$ there exists a polynomial of degree at most $d$, the graph of which intersects all $K_i$ where $i\in I$. Show that there exists a polynomial of degree at most $d$, the graph of which intersects all the intervals $K_1,K_2,...,K_n$.","['convex-analysis', 'big-list', 'combinatorics']"
20884,polar coordinates and derivatives,"Using the standard notation $(x,y)$ for cartesian coordinates, and $(r, \theta)$ for polar coordinates, it is true that $$ x = r \cos \theta$$ and so we can infer that 
$$ \frac{\partial x}{\partial r} = \cos \theta.$$ This means that if we perturb $r$ to $r+\Delta r$, $x$ gets perturbed to approximately $x+ \cos(\theta) \Delta r$. This is equivalent to saying that if we perturb $x$ to $x+\Delta x$, then we perturb $r$ to approximately $r+ (1/\cos \theta) \Delta x$. Correspondingly, we expect that $$ \frac{\partial r}{\partial x} = \frac{1}{\cos \theta}.$$ In fact, 
$$ \frac{ \partial r}{\partial x} = \frac{\partial}{\partial x} \sqrt{x^2+y^2}= \frac{2x}{2 \sqrt{x^2+y^2}} = \frac{x}{r} = \cos \theta.$$ What gives?","['polar-coordinates', 'calculus']"
20888,rotation matrix for particle track,"Struggling with some equations here. I've got a particle I need to track in an absolute reference frame, but each step I move/rotate it relative to its own reference frame. I need to track it's absolute position while moving it relatively. I'm trying to figure out the proper set of rotation matrices. It propagates along the x-axis and I can describe its current direction with [ux, uy, uz], now I need to rotate it about it's own reference frame by the deflection $\theta$ (deflection from incident direction) and azimuthal rotation $\phi$ (rotation about incident direction), and then find its new position, [ux', uy', uz']. Should I multiply by the rotation matrix, ROT[y,$\theta$], then ROT[x,$\phi$] or the opposite order? I'm just getting myself confused. By way of reference, I'm trying to derive the set of equations on (pdf) page 20 of this document . It's a) not derived very well and b) derived for propagation along the z-axis, not the x-axis. TL;DR - I have a vector in space pointing in an arbitrary direction, described by its projections on the world x,y,z-axis. I need to rotate the vector, in relation to its own reference frame, and find the world axis projections. Essentially this is a ray-tracing problem. Incoming ray needs to point in a new direction - what is that direction?",['matrices']
20907,"Proof that Ext$^n_\mathbb{Z}(M, \mathbb{Q})=0$ and Baer's Criterion","That (1) Ext$^n_\mathbb{Z}(M, \mathbb{Q})=0$ for every module $M$ follows easily from the fact that (2) $\mathbb{Q}$ is injective. However, the only proof I have seen of the injectivity of $\mathbb{Q}$ relies on Baer's Criterion.  While the proof of Baer's Criterion is not difficult, it seems stronger than the injectivity of $\mathbb{Q}$ (for example, the proof uses Zorn's Lemma).  Is there a different (and preferably simpler) proof of (1) or (2)?","['homological-algebra', 'abstract-algebra']"
20909,Uniform Boundedness/Hahn-Banach Question,"Let $X=C(S)$ where $S$ is compact. Suppose $T\subset S$ is a closed
subset such that for every $g\in C(T),$ there is an $f\in C(S)$
such that: $f\mid_{T}=g$. Show that there exists a constant $C>0$
such that every $g\in C(T)$ can be continuously extended to $f\in C(S)$
such that: $\sup_{x\in S}\left|f(x)\right|\leq C\sup_{y\in T}\left|g(y)\right|$","['functional-analysis', 'banach-spaces']"
20913,Are continuous self-bijections of connected spaces homeomorphisms?,"I hope this doesn't turn out to be a silly question. There are lots of nice examples of continuous bijections $X\to Y$ between topological spaces that are not homeomorphisms.  But in the examples I know, either $X$ and $Y$ are not homeomorphic to one another, or they are (homeomorphic) disconnected spaces. My Question: Is there a connected topological space $X$ and a continuous bijection $X\to X$ that is not a homeomorphism? For the record, my example of a continuous bijection $X\to X$ that is not a homeomorphism is the following.  Roughly, the idea is to find an ordered family of topologies $\tau_i$ (
$i\in \mathbb Z$) on a set $S$ and use the shift map to create a continuous bijection from $\coprod_{i\in \mathbb Z} (S, \tau_i)$ to itself.  Let $S = \mathbb{Z} \coprod \mathbb Z$.  The topology $\tau_i$ is as follows: if $i<0$, then the left-hand copy of $\mathbb Z$ is topologized as the disjoint union of the discrete topology on $[-n, n]$ and the indiscrete topology on its complement, while the right-hand copy of $\mathbb Z$ is indiscrete.  The space $(S, \tau_0)$ is then indiscrete.  For $i>0$, the left-hand copy of $\mathbb Z$ is indiscrete, while the right-hand copy is the disjoint union of the indiscrete topology on $[-n, n]$ with the discrete topology on its complement.  Now the map $\coprod_{i\in \mathbb Z} (S, \tau_i)\to \coprod_{i\in \mathbb Z} (S, \tau_i)$ sending $(S, \tau_i) \to (S, \tau_{i+1})$ by the identity map of $S$ is a continuous bijection, but not a homeomorphism.",['general-topology']
20914,Confused about Cantor function and measure of Cantor set,"OK, so I know that the Lebesgue measure of the ternary Cantor set is $0$. However, in class the prof briefly mentioned that if we build a Lebesgue-Stieltjes measure $\mu$ out of the Cantor function, then $\mu(C) = 1$. I don't understand why this is true, can someone please explain?",['measure-theory']
20931,"How to prove that convergence is equivalent to pointwise convergence in $C[0,1]$ with the integral norm?","I'm trying to prove (or disprove) that in the set $C[0,1]$ of continuous (bounded) functions on the real interval [0,1] with the integral norm $\|f(x)\|_1 = \int_0^1|f(x)|dx$ that a sequence of functions $f_n$ is convergent to $f$ if and only if $f_n$ is pointwise-convergent to $f$. My intuition tells me that this is true, but I'm having trouble formulating an attack (particularly for the convergence => pointwise convergence case).
Given $\forall \epsilon > 0 \; \exists N \in \mathbb{N} \;$
$\forall n \geq N \; \int_0^1 |f_n(x) - f(x)|dx < \epsilon $,
I'm trying to prove that for an arbitrary $x \in [0,1]$, $\forall \epsilon_0 > 0$ there is an $N_0$ such that for $n_0 \geq N_0 |f_{n_0}(x) - f(x)| < \epsilon_0$. I think I want to make $N_0$ somehow depend on the that integral (or a 'slice' of it), but I don't see it yet. Any pointers/advice/hints are welcome.","['metric-spaces', 'convergence-divergence', 'analysis']"
20942,Deriving formulas for recursive functions,"If I had a recursive function ( f(n) = f(n-1) + 2*f(n-2) for example), how would I derive a formula to solve this? For example, with the Fibonacci sequence, Binet's Formula can be used to find the nth term.","['fibonacci-numbers', 'recurrence-relations', 'functions']"
20945,Field Extension,"Let $F$ be an extension field of $K$. let $L$ and $M$ be intermediate fields,  with both finite algebraic extensions of $K$. 
 Suppose {$a_1,...,a_n$} is a basis for $L$ over $K$ and {$b_1, ...,b_m$} is a basis for $M$ over $K$. Show that {$a_ib_j$} is a spanning set for the field $LM$ ($LM$ is the smallest field between $K$ and $F$ containing both $L$ and $M$) as a vector space over $K$. What I have done so far is this:
Let $x$ $\in$ $L$. Then $x$ can be written as a linear combination of $a_i$. Also $y$ $\in$ $M$ implies that $y$ can be written as a linear combination of $b_j$. This is where I'm stuck.",['abstract-algebra']
