question_id,title,body,tags
20946,Application de Stone-Weierstrass,"Bonjour, J'ai rencontré le problème suivant dans le livre ""Real and Functional Analysis"" de Lang, au chapitre $3$. J'explique d'abord le contexte, puis j'en viendrai à la question précise. Il faut démontrer que les fonctions de la forme $e^{-x}p(x)$, où $p$ est un polynôme, sont denses dans l'ensemble des fonctions continues sur $[0, +\infty[$ qui tendent vers zéro en $+\infty$, muni de la norme sup. Pour cela, on applique Stone-Weierstrass au complété $[0,+\infty]$, en considérant l'algèbre des fonctions de la forme $\sum_{n=1}^{N}{e^{-nx}p_n(x)}$ définies sur le complété (auxquelles on doit rajouter aussi des constantes). Ensuite, il faut montrer qu'on peut approcher uniformément les fonctions $e^{-nx}p(x)$ par des fonctions de la forme $e^{-x}q(x)$. Lang suggère d'approcher d'abord $e^{-2x}$ par des fonctions $e^{-x}q(x)$ à l'aide de la formule de Taylor avec reste, puis $e^{-nx}p(x)$ en général. Je crois avoir réussi la première partie, et la deuxième partie en découle assez facilement pour $n \geq 3$. Par contre, je n'arrive pas à traiter le cas $n = 2$. Alors ma question est la suivante: Pour $m \in \mathbf{N}$, peut-on approcher uniformément $x^m e^{-2x}$ sur $[0,+\infty[$ par des fonctions de la forme $e^{-x}q(x)$, où $q$ est un polynôme? J'apprécierais beaucoup une référence ou une démonstration (ou les deux). (Vous pouvez répondre dans une autre langue.) [Mod: attempt at translation below] Hello, I've encountered the following problem in the book ""Real and Functional Analysis"" by Lang, in chapter 3. I'll first explain the context, after which I'll pose my precise question. We want to prove that the functions of the form $e^{-x}p(x)$, where $p$ is a polynomial, are dense in the set of continuous functions defined on $[0,\infty)$ which tends to 0 at $+\infty$, equipped with the sup norm. For this, we apply Stone-Weierstrass on the completion $[0,+\infty]$, and consider the algebra generated from the functions of the form $\sum_{n=1}^N e^{-nx}p_n(x)$ (to which we add also the constant functions). Next, we need to show that we can uniformly approximate the functions $e^{-nx}p(x)$ by functions of the form $e^{-x}q(x)$. Lang suggests to first approximate $e^{-2x}$ by functions of the form $e^{-x}q(x)$ using Taylor's theorem with remainders. Then consider $e^{-nx}p(x)$ in general. I think I know how to do the first step. For the second step, the $n\geq 3$ cases are easy. On the other hand, I don't know how to treat the case $n=2$. So here's my question: can we approximate a function of the form $x^me^{-2x}$, where $m\in\mathbb{N}$, uniformly over $[0,\infty)$, by functions of the form $e^{-x}q(x)$, where $q$ is a polynomial? I would appreciate a reference or a proof (or both). (You can post your answer in another language.)","['approximation', 'analysis']"
20949,A number theoretic function to characterize midpoint free subsets,"Recently, I was going over a curious recreational math paper titled ""On the Diagonal Queens Domination Problem"". The main result of the paper is establishing the minimum value $diag(n)$ of number of queens needed to be kept on the diagonal of a $n \times n$ chessboard so that they attack all the squares on the board. The authors make use of some clever lemma and make an observation that $diag(n) = n + 1 - r_3(\lceil \frac{n}{2} \rceil)$. Here, $r_3(.)$ denotes the minimum value $k$ such that any $k$-element subset of $[n]$ contains a $k$ term arithmetic progression (a la Roth's theorem statement). In order to prove this statement, authors make use of a number theoretic statement which they do not prove. I also cannot prove i by myself because of my limited number theory background (and maybe because I am dense). The statement says the following A collection of $k$ even numbers or $k$ odd numbers (the numbers in the collection have same parity, this will keep their sum even) is midpoint free even sum subset of $[n]$ $\mathit{if\ and\ only\ if}$ all the half of the numbers in the collection (rounded down if not integer) is a midpoint-free subset of $\lceil \frac{n}{2} \rceil$. A few definitions to clarify the question. A subset $X$ of $[n]$ is midpoint free if for any two elements $i,j \in X$ $(i+j)/2 \not\in X$. A subset is even sum if $i+j$ is even for any $2$ elements $i,j \in X$. I hope the question is clear. In case, its not, I apologize and would request you to kindly let me know whats not clear.","['combinatorics', 'number-theory']"
20952,"Integration by parts: $\int e^{ax}\cos(bx)\,dx$","I need to evaluate the following function and then check my answer by taking the derivative:
$$\int e^{ax}\cos(bx)\,dx$$
where $a$ is any real number and $b$ is any positive real number. I know that you set $u=\cos(bx)$  and $dv=e^{ax} dx$,
and the second time you need to integrate again you set $u=\sin(bx)$ and $dv=e^{ax}dx$ again. It eventually simplifies down to
$$\int e^{ax}\cos(bx)dx = \frac{1}{a}e^{ax}\cos(bx) + \frac{b}{a}\left(\frac{1}{a}e^{ax}\sin(bx) - \frac{b}{a}\int e^{ax}\cos(bx)\,dx\right).$$ Now I know to move the integral on the left side to the right side so that I can just divide by the constant to solve. Here is my problem: I know I need to solve the right side to be: 
$$\frac{e^{ax}\left(a\cos(bx) + b\sin(bx)\right)}{a^2+b^2} + C.$$ To divide by the constant, I multiplied everything on the right side by 
$$\frac{a^2}{b^2+1}.$$
but this leads me to get $b^2 + 1$ on the bottom instead of $a^2 + b^2$. I will show what I am doing in detail: After setting the initial integral equal to:
$$\frac{1}{a}e^{ax}\cos(bx) + \frac{b}{a}\left(\frac{1}{a}e^{ax}\sin(bx) - \frac{b}{a}\int e^{ax}\cos(bx)\,dx\right) + C$$
I simplify:
$$\int e^{ax}\cos(bx)\,dx = \frac{a^2}{b^2+1}\left(\frac{1}{a}e^{ax}\cos(bx) + \frac{b}{a}\left(\frac{1}{a}e^{ax}\sin(bx)\right)\right) + C$$ If this is already wrong, can someone point be in the right direction? If I have not gone wrong yet, I can edit to show the rest of my work.","['trigonometry', 'exponential-function', 'calculus', 'integration']"
20960,Simplifying a Trigonometric Expression,"I have to prove that: $$x \sec x - \ln |\sec x + \tan x| + C$$ is the indefinite integral of: $$x \sec x \tan x $$ by taking the derivative. I've got far enough to get: $$x\sec x\tan x + \sec x -\dfrac{|\sec x+\tan x|(\sec^2 x + \sec x \tan x)}{|\sec x + \tan x|}.$$ Kind of stuck here.  Am I able to cancel out the $|\sec x + \tan x|$ on top and bottom and then set $-\sec x$ equal to $\sec^2 x + \sec x \tan x$?  I'm guessing that's not right though. Sorry for the crummy way I have it setup, feel free to edit it.","['trigonometry', 'calculus', 'algebra-precalculus']"
20961,In what situations is the integral equal to infinity?,"In the following integral, p(x) and q(x) are probability distributions. Can you help me to determine in what situation this integral is equal to infinity. For example, I think that such a situations is when only p(x) has an infinite peak. $$\int_{-\infty}^{\infty}\{\log\frac{p(x)}{q(x)}\}p(x)dx$$ Thank you very much!",['integration']
20963,Integration by partial fractions; how and why does it work?,"Could someone take me through the steps of decomposing 
$$\frac{2x^2+11x}{x^2+11x+30}$$
into partial fractions? More generally, how does one use partial fractions to compute integrals
$$\int\frac{P(x)}{Q(x)}\,dx$$
of rational functions ($P(x)$ and $Q(x)$ are polynomials) ? This question is asked in an effort to cut down on duplicates. See Coping with *abstract* duplicate questions . Also see List of Generalizations of Common Questions .","['faq', 'algebra-precalculus', 'partial-fractions']"
20969,Prove $0! = 1$ from first principles,How can I prove  from first principles that $0!$ is equal to $1$?,"['factorial', 'algebra-precalculus', 'faq']"
20984,Topology and axiom of choice,"It it an easy exercise to show that if $X$ is first-countable then for every point $x$ and every subset $A$ we have $x \in \text{cl}A$ iff there exists a sequence $(x_n)_n$ that converges to $x$. Well, this uses the axiom of choice to create the sequence (I think). What would happen if we don't have that? (I know that in topology it is much better to have AC but I want to figure out what happens).","['general-topology', 'axiom-of-choice']"
20986,Complex differentiabilty,"I know that: 1) A function $f:\mathbb{R}^2\to \mathbb{R}^2$, when differentiable at a point, has a $2\times 2$ matrix as a derivative, which is a linear transformation from $\mathbb{R}^2\to \mathbb{R}^2$ best approximating the function linearly in some neighbourhood. 2) There is a ring homomorphism $\mathbb{C} \to Mat_{2x2}(\mathbb{R})$ as $a+ib \longmapsto \left[\begin{array}{11}a & -b\\b & a \end{array}\right]$ 3) For a function $f:\mathbb{C} \to \mathbb{C}$, I can define complex differentiabilty as the best $\mathbb{C}$-linear approximation of the function locally at a point, i.e., $f'(z_0):h \mapsto f'(z_0)h$ Now, I want to combine these three observations, so that the Cauchy-Riemann equation falls out by considering a complex differentiable function as a function from $\mathbb{R}^2\to \mathbb{R}^2$ and connect the jacobian with the $\mathbb{C}$-linear transformation via the homomorphism. I am having trouble even formulating a proposition that I can prove. Do I define something called 'Complexfying an $\mathbb{R}^2$-operator'? Any help will be appreciated. The upshot will be that I can then 'shift' the proofs of some of the basic results of holomorphic functions (such as the fact that if the partial derivatives of the co-ordinate functions exist and are continuous then the function will be holomorphic, etc) to that of multivariable calculus.",['complex-analysis']
20989,Finding four numbers,Find four weights such that given four weights and weighing pan (balance scale) you can measure all weights between $1$ to $80$. I found this one here .Any idea how to solve?,"['arithmetic', 'number-theory']"
21003,The elementary coordinate geometry of polynomials? Of rational expressions? Of radicals?,"With a few colleagues, we're trying to design an (intermediate) algebra course (US terminology) where we stress the interplay between algebra and geometry. The algebraic topics we would like to cover are (1) linear equation in two variables, (2) quadratic equations in two variables, (3) polynomials in one variable, (4) rational functions in one variable (though we're not sure we want to introduce functions), (5) radicals. For (1) and (2) there are obvious geometric counterparts: lines and conic sections. Question : Are there natural geometric counterparts for (3), (4) and (5)?  Are there elementary geometric constructions that naturally lead to these algebraic objects? Side question : Are there (affordable) textbooks or lecture notes out there which have this kind of approach?","['analytic-geometry', 'education', 'algebraic-geometry', 'abstract-algebra']"
21010,Order relation between Ordinals,"Need guidance on this problem. Given the following ordinals, determine the order relation (and equalities) - ($\Omega = 2^{\aleph_0}$) $\omega_1$, $\Omega \cdot  3$, $\omega \cdot \omega_1$, $3^{\Omega}$, $\Omega^{\omega_1}$ My solution (partial): $\Omega\cdot 3 \gt \Omega\cdot 2 \gt \Omega$, $3^{\Omega} = \lim_{n \lt \Omega}3^{n} = \Omega$ ($\Omega$ is a limit ordinal) I'm not certain about how to deal with $\omega \cdot \omega_1$ and $\Omega^{\omega_1}$ The inequalities: $\Omega\cdot 3 \gt 3^{\Omega} \gt \omega_1$ Thanks!",['elementary-set-theory']
21014,New size of a rotated-then-cropped rectangle,"Imagine a rectangle ( x 1 by y 1 ) always has to be drawn with horizontal and vertical lines (so it can't have lines at 45 degrees). If the rectangle is rotated by angle θ , it needs to have a rectangle drawn inside it so that this new rectangle still follows the rules. In the diagram, the black rectangle is the original, the red one is the rotated rectangle, and the green ones are three possible options (the two extremes, and one which maintains the aspect ratio). How can I work out (in terms of x 1 , y 1 and θ ): the dimensions ( x 2 and y 2 ) of the rectangle which maintains the aspect ratio of the original? the dimensions ( x 2 and y 2 ) of the rectangle which has the largest possible area within the given boundaries? x 2 for a given y 2 (and vice-versa) within a valid range? Answers to only one part are quite welcome. I've tried to work this out myself by looking at what I know about the resulting triangles, and can't seem to get anywhere (it's been a while since I studied Maths), so an answer to one of these might point me in the right direction.","['geometry', 'trigonometry']"
21017,What is the kernel of the summation map from the direct sum to the sum?,"Let $R$ be a ring, and let $I_1,\ldots,I_n$ be ideals in $R$ (or submodules of some $R$-module). Consider the sequence
$$
\bigoplus_{1\leq j < k\leq n} I_j\cap I_k\quad\xrightarrow{f}\quad\bigoplus_{l=1}^n I_l\quad\xrightarrow{g}\quad\sum_{k=1}^n I_k,
$$
where $g$ is given by addition, and $f$ maps $x\in I_j\cap I_k$ to $x\in I_j$ and to $-x\in I_k$ (and to zero in all other components). Clearly, $g$ is surjective and the composition $g\circ f$ vanishes. Question: Is the above sequence exact in the middle? (This seems to be easy for $n=2$.) (Concerning the title: I am aware of the fact that $f$ won't be injective in general.)","['homological-algebra', 'abstract-algebra']"
21041,Order statistic,"I've two questions
(1) How do I determine the distribution of the first order and the highest order statistic for sample of random size N is taken from the continuous uniform(0, $\theta$) and \begin{equation} \rm{P} (N = n) = \frac{1}{n! (e − 1)} \text{for n = 1, 2, 3, . . . .} \end{equation} (2) In general without any distribution of any random variables given, the distribution of highest order statistic is $F_{X(n)}(a) = [F_{X}(a)]^n$ and the distribution of the lowest order statistic is $F_{X(1)}(a) = 1 - [1 - F_X(a)]^n$. I understand this derivation. But what does these values say about the distribution ?","['statistics', 'probability-distributions']"
21055,"A ""geometric'' infinite sum of matrices","The sum $$ I + A + A^2 + A^3 + \cdots $$ equals $$(I-A)^{-1}$$ under the assumption $\rho(A)<1$, which is necessary to make the sum converge. My question: what does the sum 
$$ I + A^T A + (A^2)^T A^2 + (A^3)^T A^3 + \cdots$$ equal under the same assumption? Is there a similarly neat expression? It is true that this last sum converges under the assumption $\rho(A)<1$. The ``obvious'' guess $(I-A^T A)^{-1}$ for the sum is not true because $ (A^2)^T A^2 \neq (A^T A)^2$; in fact, this guess does not even make sense because $\rho(A)<1$ does not rule out $\rho(A^T A)=1$.",['linear-algebra']
21063,Difference between logarithm of an expectation value and expectation value of a logarithm,"Assuming I have a always positive random variable $X$, $X \in \mathbb{R}$, $X > 0$. Then  I am now interested in the difference between the following two expectation values: $E \left[ \ln X \right]$ $\ln E \left[ X \right]$ Is one maybe always a lower/upper bound of the other? Many thanks in advance...","['parameter-estimation', 'probability', 'random']"
21068,Why prove that multiplicative functions are a group with Dirichlet convolution?,"Everyone likes to prove that Dirichlet convolution is a group operation on the multiplicative arithmetic functions, but what consequence does this have? Does any important theorem use this fact? Can general group theory lead to results about these functions (or even better, about numbers) from the this theorem? Furthermore there are two ring structures on this set, the usual pointwise ring as well as the ring with convolution. I would like to extend the same question for these.","['group-theory', 'number-theory']"
21076,Choice of $q$ in Baby Rudin's Example 1.1,"First, my apologies if this has already been asked/answered.  I wasn't able to find this question via search. My question comes from Rudin's ""Principles of Mathematical Analysis,"" or ""Baby Rudin,"" Ch 1, Example 1.1 on p. 2.  In the second version of the proof, showing that sets A and B do not have greatest or lowest elements respectively, he presents a seemingly arbitrary assignment of a number $q$ that satisfies equations (3) and (4), plus other conditions needed to show that $q$ is the right number for the proof.  As an exercise, I tried to derive his choice of $q$ so that I may learn more about the problem. If we write equations (3) as $q = p - (p^2 - 2)x$ , we can write (4) as $$
q^2 - 2 = (p^2 - 2)[1 - 2px + (p^2 - 2)x^2].
$$ Here, we need a rational $x > 0$ , chosen such that the expression in $[...]$ is positive.  Using the quadratic formula and the sign of $(p^2 - 2)$ , it can be shown that we need $$
x \in \left(0, \frac{1}{p + \sqrt{2}}\right) \mbox{ for } p \in A,
$$ or, for $p \in B$ , $x < 1/\left(p + \sqrt{2}\right)$ or $x > 1/\left(p - \sqrt{2}\right)$ . Notice that there are MANY solutions to these equations! The easiest to see, perhaps, is letting $x = 1/(p + n)$ for $n \geq 2$ .  Notice that Rudin chooses $n = 2$ for his answer, but it checks out easily for other $n$ . The Question: Why does Rudin choose $x = 1/(p + 2)$ specifically?  Is it just to make the expressions work out clearly algebraically?  Why doesn't he comment on his particular choice or the nature of the set of solutions that will work for the proof?  Is there a simpler derivation for the number $q$ that I am missing?","['self-learning', 'real-analysis', 'analysis']"
21094,Is there a compact subset of the irrationals with positive Lebesgue measure?,"Does there exist $K \subseteq \mathbb{R} \backslash \mathbb{Q}$ such that $K$ is compact, and has Lebesgue measure greater than $0$? As I have been trying to think of examples, I suspect that any subset of $\mathbb{R} \backslash \mathbb{Q}$ that is closed can be at most countable, since the closure of an uncountable subset of irrationals should contain some rationals. And, the Lebesgue measure of a countable set is $0$. If there are any examples of such a set, I would be very interested to know how it is constructed.","['measure-theory', 'real-analysis']"
21099,Prove that an odd integer $n>1$ is prime if and only if it is not expressible as a sum of three or more consecutive integers.,"Prove that an odd integer $n>1$ is prime if and only if it is not expressible as a sum of three or more consecutive integers. I can see how this works with various examples of the sum of three or more consecutive integers being prime, but I can't seem to prove it for all odd integers $n>1$. Any help would be great.","['prime-numbers', 'number-theory']"
21100,Importance of matrix rank,"What is the importance of the rank of a matrix? I know that the rank of a matrix is the number of linearly independent rows or columns (whichever is smaller). Why is it a problem if a matrix is rank deficient? Also, why is the smaller value between row and column the rank? An intuitive or descriptive answer (also in terms of geometry) would help a lot.","['matrices', 'linear-algebra', 'matrix-rank']"
21104,$\lim\limits_{x \to \infty}\frac{2^x}{3^{x^2}}$,"Find
$$\lim\limits_{x \to \infty}\frac{2^x}{3^{x^2}}$$
I can only reason with this intuitively. since $3^{x^2}$ grows much faster than $2^x$ the limit as $x \to \infty$ of $f$ must be 0. Is there a more rigorous way to show this?",['limits']
21120,Integral of the cantor function,"Consider the ternary Cantor set $C$ , the associated Cantor function $f$ , and the associated Lebesgue-Stieltjes measure $u$ . What is the integral of $f$ over all of $\mathbb{R}$ with respect to $u$ ? My attempt: Under the Lebesgue measure, the integral of the Cantor function is 1/2 using a symmetry argument, but under the Lebesgue-Stieltjes measure $u$ is the integral still the same? I was thinking about breaking up the integral into three parts: $(-\infty, 0)$ , $(0, 1)$ , and $(1, \infty)$ . Since the Cantor function is constant on $(-\infty, 0)$ and $(1, \infty)$ , it follows that the integral is $0$ on those intervals... Now I'm kind of stuck here because I'm not sure how to handle $(0, 1)$ . Help would be appreciated.",['measure-theory']
21121,Orthogonal Decomposition of A Matrix,"I'm trying to follow/understand a research paper that I have, and well, it's been a while since I've done this kind of math. At this point I have an nxn matrix H and from that construct an (n-1)xn matrix H' = $[\textbf{h}_1-\textbf{h}_n$, ..., $\textbf{h}_{1-n}-\textbf{h}_n]^T$. Now ""using orthogonal decomposition"" I'm to obtain H' =$\textbf{QU}$, where $\textbf{Q}$ is an (n-1)x(n-1) orthogonal matrix and $\textbf{U}$, which is an (n-1)xn upper diagonal matrix. I guess I'm hoping someone can better explain orthogonal decomposition and help me write the elements of $\textbf{Q}$ and $\textbf{U}$ in terms of the elements of H' .","['matrices', 'linear-algebra']"
21128,When to learn category theory?,"I'm a undergraduate who wishes to learn category theory but I only have basic knowledge of linear algebra and set theory, I've also had a short course on number theory which used some basic concepts about groups and modular arithmetic. Is it too early to start learning category theory? should I wait to take a course on abstract algebra? Is it very important to use category theory facts in a first course in group theory, ring theory, fields and Galois theory, modules and tensor products (each of those is a one semester course), would that make it a 'better' course? I was unsure to learn category theory early but this post Mathematical subjects you wish you learned earlier inspired me to ask you given my background.","['education', 'category-theory', 'learning', 'abstract-algebra']"
21131,Physical meaning of the null space of a matrix,"What is an intuitive meaning of the null space of a matrix? Why is it useful? I'm not looking for textbook definitions. My textbook gives me the definition, but I just don't ""get"" it. E.g.: I think of the rank $r$ of a matrix as the minimum number of dimensions that a linear combination of its columns would have; it tells me that, if I combined the vectors in its columns in some order, I'd get a set of coordinates for an $r$-dimensional space, where $r$ is minimum (please correct me if I'm wrong). So that means I can relate rank (and also dimension) to actual coordinate systems, and so it makes sense to me. But I can't think of any physical meaning for a null space... could someone explain what its meaning would be, for example, in a coordinate system? Thanks!","['vector-spaces', 'matrices', 'linear-algebra']"
21142,Help understanding game version of Baire category theorem,"I got this from Thomson et al.'s freely available "" Elementary Real Analysis "" p.356. They introduce Baire's category theorem through a game where, given two players (A) and (B) Player (A) is given a subset $A$ of $\mathbb{R}$, and player (B) is given the complementary set $B = \mathbb{R} \backslash A$. Player (A) first selects a closed interval $I_1 \subset \mathbb{R}$; then player (B) chooses a closed interval $I_2 \subset I_1$. The players alternate moves, a move consisting of selecting a closed interval inside the previously chosen interval. The play of the game thus determines a descending sequence of closed intervals
  \begin{align} 
  I_1 \supset I_2 \supset \ldots I_n \supset 
  \ldots\end{align}
  where player (A) chooses those with odd index and player (B) those with even index. If
  \begin{align}
  A \: \bigcap_n^{\infty} I_n \neq \emptyset
  \end{align}
  then player (A) wins; otherwise player (B) wins. Then they argue that if player (A) is dealt the irrational set and (B) is dealt the rational set, (A) always has a strategy to win. I'm confused in several ways by this argument. One confusion is about the term ""closed interval"". Does, for example, the closed interval [1,1] count as an interval? Because if that's the case, can't whoever has the first turn just end the game then and there without regard to whether he has the rationals or irrationals? Say, if (A) received the rationals, he can just pick [0.5,0.5]. Game over. (But I'm guessing probably not, because the game wouldn't happen) If that is not the case, and an interval has to be defined $[a,b]$ s.t. $a < b$, isn't it always true that for any $I_{2n+1} = [a_{2n+1}, b_{2n+1}]$ for the odd numbered turns of (A), and where (A) has the irrationals, there exists some $q \in [a_{2n+1},b_{2n+1}]$ s.t. $q$ is rational? Because $\mathbb{Q}$ is also dense on the real line. Or is this argument relying on the fact that a countable intersection of closed sets is always closed? And that it can converge to a single point. But if it converges to a single point, it might be a closed set, but is it still a closed interval? And does that still count as winning? And can't (A) still play this same game even if he were dealt the rationals if all that is needed is that his choice of intervals converge to a single point? I've been thinking about this for a few days now and none of the ways I've approached it convince me that their discussion of the game is true (though I do trust that it is true, since the authors are mathematicians and I'm not), so any help would be appreciated.","['baire-category', 'real-analysis']"
21144,Intuitive explanation of the Fundamental Theorem of Linear Algebra,"Can someone explain intuitively what the Fundamental Theorem of Linear Algebra states? and why specifically it is called the above? Specifically, what makes it 'Fundamental' in the broad scope of the theory.","['linear-algebra', 'intuition']"
