question_id,title,body,tags
20475,Proving Pascal's Rule : ${{n} \choose {r}}={{n-1} \choose {r-1}}+{{n-1} \choose r}$ when $1\leq r\leq n$,"I'm trying to prove that ${n \choose r}$ is equal to ${{n-1} \choose {r-1}}+{{n-1} \choose r}$ when $1\leq r\leq n$. I suppose I could use the counting rules in probability, perhaps combination= ${{n} \choose {r}}=\frac{n!}{r!(n-r!)}$. I want to see an actual proof behind this equation.  Does anyone have any ideas?","['binomial-coefficients', 'probability', 'combinatorics']"
20488,A question on the proof of the De Bruijn-Erdos theorem,"I just read a very short paper on the De Bruijn-Erdos theorem. It essentially states that if we have $n$ points and $m$ lines, where any two points lie on a line, and each line has at least two points, then there are at least as many lines as points. The proof is in this short paper . It is stated at the very top, and the proof I'm curious about begins in the middle of page 2 and ends at the top of page 3. I don't quite follow the inequalities 
$$
s_j\leq k_n\ \text{for}\ j>\nu
$$
that are found at the very top of page 3. Why would that fact that an index $j$ being greater than the minimum number of lines passing through a given point require that the number of points on that indexed line is at most the number of lines passing through that point? Apart from that I follow the rest. Does it violate one of the assumptions about the space? Thanks.",['geometry']
20503,Ahlfors's proof of analytic functions reducing to a constant,"I'm reading the beginning of chapter 3 of Ahlfors where he starts to introduce analytic functions in regions, and I had a question on a part of Theorem 11: Let $f=u+iv$ be an analytic function in a region $\Omega$. If the modulus of $f$ is constant, then $f$ must reduce to a constant. His proof starts out as follows: If $|f|=u^2+v^2$ is constant, then $ u\frac{\partial u}{\partial x} + v \frac{\partial v}{\partial x} = 0$, and $ u \frac{\partial u}{\partial y} + v \frac{\partial v}{\partial y} = -u \frac{\partial v}{\partial x} + v \frac{\partial u}{\partial x} = 0$. My question is why does this imply that either $ \frac{\partial u}{\partial x} = \frac{\partial v}{\partial x} = 0$ or that the determinant $u^2+v^2$ vanishes?",['complex-analysis']
20507,Why is a smooth connected scheme irreducible?,"Why is a smooth connected scheme (say over a field) necessarily irreducible? Intuitively it makes sense because we might very well expect points in the intersection of two irreducible components to be singular points. But what is a proof? Feel free to add any extra hypotheses if needed (e.g., separated if that is required).",['algebraic-geometry']
20514,"The set of all sets of two elements does not exist, but the set of sets of two elements of a given set does?","I'm trying to wrap my head around this concept of extracting sets from a given set to show that a subset is indeed a subset. Suppose I want to show that the set of all sets of two elements does not exist. I approach it like this. Suppose such a set $V$ exists of all elements containing exactly the sets of two elements. Then for any nonempty set $X$, the set $\{X,\emptyset\}$ is a set, by the pairing axiom, and since $X\neq\emptyset$, $\{X,\emptyset\}$ has two elements, so $\{X,\emptyset\}\in V$ for all sets $X$. Then by the power set axiom, $\bigcup V$ is the set of all sets, since $\emptyset\in\bigcup V$, and any nonempty set $X\in\bigcup V$ as well. But the set of all sets does not exist, a contradiction, so such a set $V$ does not exist. Does this approach work? However, if I'm given a nonempty set $A$, is the following a proper formulation that shows that the set of all sets of the form $\{a,b\}$ for $a,b\in A$ is a set? If $a,b\in A$, then $\{a,b\}\subset A$, and $\{a,b\}\in\mathscr{P}(A)$. Assuming that $a$ and $b$ need not be distinct, consider
$$
\{t\in\mathscr{P}(A)\ |\ \exists x\exists y(x\in A\land y\in A\land t=\{x,y\}\}.
$$
This is a set by the subset schema. Have I correctly specified the type of sets I want, or do I need to include something about if $z\in t\implies z=x\vee z=y$?, or is that unnecessary? Thanks.",['elementary-set-theory']
20519,Question regarding Weierstrass M-test,"The Weierstrass M-test tells that given a function sequence $(u_{n}(x))$ where $x \in I$, if there exists a convergent series $\sum a_{n}$ such that $|u_{n}(x)|\leq a_{n}$ for all $n$ and $x\in I$, then $\sum u_{n}(x)$ converges uniformly in $I$. What about the opposite of it? If $\sum u_{n}(x)$ converges uniformly in $I$, then there exists a convergent series $\sum g_{n}$ such that $|u_{n}(x)|\leq g_{n}$ for all $n$ and $x \in I$. Since the theorem isn't in the form of 'if and only if', I'm trying to think of an example to counter the above: My attempt was to define a function sequence such as this: Then taking $u_{1}(x)=f_{1}(x),\ u_{n}(x)=f_{n}(x)-f_{n-1}(x)$. It can be shown that $f_{n}(x)$ converges uniformly in $[1, \infty)$, therefore $u_{n}(x)$ does as well. But $|u_{n}(1)|=|f_{n}(1)|$ which is the constant sequence: $1, 1, 1, ...$. If we assume by contradiction that there exists such a sequence $1\leq g_{n}$ that $\sum g_{n}$ converges then by the comparison test $\sum 1$ converges which is obviously not true. First, I'd like to know if the above is true. It took me quite a while to come up with something and I'm not even sure it's true. Also, It's very difficult for me to visualize these complicated functions (like the one above) where both $x$ and $n$ play a role. Is there an easier way to deal with these questions?","['sequences-and-series', 'real-analysis']"
20522,For which $P$ can one claim the existence of the set of all sets that satisfy $P$?,"Given a property $P$, is there some rules that are sufficient or necessary to determine if there exists a set of all sets with property $P$?","['logic', 'elementary-set-theory']"
20529,Fast method for Nth Squarefree number (using mathematica),"I am trying to compute Nth Squarefree numbers using Mathematica. What I am trying to utilize is the SquareFreeQ[i] function. Here is my solution : NSqFree[N_] := 
 For[n = 1; i = 1, n <=  N + 1, 
  If[SquareFreeQ[i], If[n == N, Print[i] ] n++] i++] But I am supposed to compute NSqFree[1000000000] but seems like my approach is taking for ever. Any faster method ? Thanks, ADDED : Here an exactly identical topcoder question and the corresponding editorial for the same.","['mathematica', 'contest-math', 'number-theory']"
20531,Find $\lim_{n\to \infty}\frac{(1^n+2^n+...+n^n)^{1/n}}{n}$,Tried the squeeze theorem but it didn't get me anywhere since: $$0 \leftarrow \frac{1}{n^{1-1/n}}=\frac{n^{1/n}}{n}\leq\frac{(1^n+2^n+...+n^n)^{1/n}}{n}\leq \ n^{1/n}\to 1$$ None of the other tools we studied seem to work. Any tips? Thanks.,"['calculus', 'limits']"
20548,"Solve $\cos(\theta) + \sin(\theta) = x$ for known $x$, unknown $\theta$?","After looking at the list of trigonometric identities, I can't seem to find a way to solve this. Is it solvable? $$\cos(\theta) + \sin(\theta) = x.$$ What if I added another equation to the problem: $$-\sin(\theta) + \cos(\theta) = y,$$
where $\theta$ is the same and $y$ is also known? Thanks. EDIT: OK, so using the linear combinations I was able to whip out: $$a \sin(\theta) + b \cos(\theta) = x = \sqrt{a^2 + b^2} \sin(\theta + \phi),$$
where $\phi = \arcsin \left( \frac{b}{\sqrt{a^2 + b^2}} \right) = \frac{\pi}{4}$ (as long as $a\geq 0$) Giving me: $$x = \sin(\theta + \frac{\pi}{4}) \text{ and } \arcsin(x) - \frac{\pi}{4} = \theta.$$ All set! Thanks!",['trigonometry']
20555,Are there any series whose convergence is unknown?,"Are there any infinite series about which we don't know whether it converges or not? Or are the convergence tests exhaustive, so that in the hands of a competent mathematician any series will eventually be shown to converge or diverge? EDIT: People were kind enough to point out that without imposing restrictions on the terms it's trivial to find such ""open problem"" sequences. So, to clarify, what I had in mind were sequences whose terms are composed of ""simple"" functions, the kind you would find in an introductory calculus text: exponential, factorial, etc.","['infinity', 'soft-question', 'sequences-and-series', 'real-analysis']"
20563,Does $\mathbb{Q}_p \cap \overline{\mathbb{Q}}$ depend on the embedding of $\overline{\mathbb{Q}}$ into $\overline{\mathbb{Q}_p}$?,"I think the title pretty much says it all. I'm getting confused in the subtle parts of a proof, and would appreciate some help.","['p-adic-number-theory', 'number-theory']"
20564,"sums of square free numbers , is this conjecture equivalent to goldbach's conjecture?","As one can notice every integer greater than $1$ is a sum of two squarefree numbers.(numbers that are not divided by some prime square  power). Can we prove that? Edit: Can we have bounds for the length of these numbers? (meaning the number of the primes that divide it) Chen's theorem asserts that for large enough even  numbers the length (2,1) is enough Goldbach's conjecture says that (1,1) would be enough too. And one conjecture: every odd number can be written as a sum of two squarefree numbers of length at most (2,1) (meaning as a sum of a prime and a double of a prime or a sum of a prime plus 2 or as a sum of 1 plus a double of a prime) Questions do i really need the prime plus 2 or the 1 plus the double of a prime in oredr to have all the odd numbers?I think i do not need them but can we prove that?? What is the relation of this conjecture to Goldbach's conjecture? does the one implies the other? EDIT Searching wikipedia i realised that this is a well-known conjecture, for more details see http://en.wikipedia.org/wiki/Lemoine%27s_conjecture","['prime-numbers', 'number-theory']"
20566,Prove there are no hidden messages in Pi,"Assume that a proof that pi is normal existed. Is it then possible that starting at some finite position x in pi, from there on every p(n)'th digit is 0, where p(n) is the n'th prime? I know probability arguments say no, but do they also prove that it is impossible? Is there a way to disprove the statement? Also, the digits of Pi can tell us certain mathematical truths, for instance that the circumference of a circle is less then any other shape with same area. The question is, is there a limit to the information one can extract from the digits of Pi?
Is it possible to reconstruct all theorems from the digits of Pi?
What sort of truths can be extracted from the digits of Pi?
Is entire math and all truths somehow encoded within the digits of Pi ?","['pi', 'logic', 'decimal-expansion', 'probability']"
20574,What sort of ring is the integral closure of $\mathbb{Z}$ in $\overline{\mathbb{Q}}$?,"I begin losing intuition when I start dealing with infinitely generated fields over $\mathbb{Q}$... The naive guess is that it is noetherian of krull dimension 1. Is this correct? A related question is what sort of morphism is $Spec($the integral closure of $\mathbb{Z}$ in $\overline{\mathbb{Q}}) \rightarrow Spec(O_K)$ for some number field $K$? For example, is it a flat morphism?","['algebraic-number-theory', 'number-theory']"
20578,Why is integration so much harder than differentiation?,"If a function is a combination of other functions whose derivatives are known via composition, addition, etc., the derivative can be calculated using the chain rule and the like. But even the product of integrals can't be expressed in general in terms of the integral of the products, and forget about composition! Why is this?","['calculus', 'integration']"
20579,What is the difference between linear space and a subspace?,"If W is a subspace, is it also a linear space? If V is a linear space, is it also a subspace? I am having trouble wrapping my head around the difference between the two, as it seems that the way the book defines them is the following: both have to have a zero (neutral) element, both are closed under addition and scalar multiplication. Thanks!",['linear-algebra']
20583,How to simplify $\frac{\sqrt{4+h}-2}{h}$,The following expression: $$\frac{\sqrt{4+h}-2}{h}$$ should be simplified to: $$\frac{1}{\sqrt{4+h}+2}$$ (even if I don't agree that this second is more simple than the first). The problem is that I have no idea of the first step to simplify that.. any help?,"['fractions', 'algebra-precalculus']"
20593,Calculate variance from a stream of sample values,"I'd like to calculate a standard deviation for a very large (but known) number of sample values, with the highest accuracy possible.  The number of samples is larger than can be efficiently stored in memory. The basic variance formula is: $\sigma^2 = \frac{1}{N}\sum (x - \mu)^2$ ... but this formulation depends on knowing the value of $\mu$ already. $\mu$ can be calculated cumulatively -- that is, you can calculate the mean without storing every sample value.  You just have to store their sum. But to calculate the variance, is it necessary to store every sample value?  Given a stream of samples, can I accumulate a calculation of the variance, without a need for memory of each sample?  Put another way, is there a formulation of the variance which doesn't depend on foreknowledge of the exact value of $\mu$ before the whole sample set has been seen?","['statistics', 'algorithms']"
20597,"How to ""Re-write completing the square"": $x^2+x+1$","The exercise asks to ""Re-write completing the square"": $$x^2+x+1$$ The answer is: $$\left(x+\frac{1}{2}\right)^2+\frac{3}{4}$$ I don't even understand what it means with ""Re-write completing the square"".. What's the steps to solve this?","['quadratics', 'completing-the-square', 'algebra-precalculus', 'polynomials']"
20605,Updating eigen-decomposition of symmetric matrix $A$ to eigendecomposition of $A+D$ where $D$ is low-rank diagonal,"Given a symmetric positive definite matrix $A$ and a mostly-zeros non-negative diagonal matrix $D$, is there a way to cheaply update the eigenvalues and/or eigenvectors of $A$ to that of $A+D$? Ideally I'm looking for something akin to the Woodbury matrix identity.","['matrices', 'linear-algebra', 'eigenvalues-eigenvectors']"
20606,Olympiad linear algebra problem,"This is a problem from an olympiad I took today. I tried but couldn't solve it. Let $A$ and $B$ rectangular matrices with real entries, of dimensions $k\times n$ and $m\times n$ respectively. Prove that if for every $n\times l$ matrix $X$ ($l\in \mathbb{Z}^+$) the equality $AX=0$ implies $BX=0$, then there exists a matrix $C$ such that $B=CA$. I tried to define a commutative diagram, but failed. Anyhow, I'd prefer a solution that works with the matrices explicitly. But I'll welcome and appreciate any solutions.",['matrices']
20615,Limits and Measure Theory,"How would I evaluate these limits?
$$ \lim_{n \to \infty} \int_0^\infty \frac{n}{1+(nx)^2} \ dx$$
and
$$ \lim_{n \to \infty} \int_0^\infty \frac{(1+(nx)^2)}{(1+nx^2)^n} \ dx$$",['measure-theory']
20618,Algebras that are free modules over a subalgebra,"This has been annoying me for the past two days. Suppose we have an algebra $A$ over some field and a subalgebra $B \subseteq A$ . Suppose we also have that $A$ is a finitely-generated free module over $B$ , so as a $B$ -module $A =Bx_1 \oplus\dots\oplus Bx_n$ for some $x_1,...,x_n \in A$ . Can I assume $x_1=1$ ? Or is it possible there is some sort of example where although $A$ is just $n$ copies of $B$ as a module , the only way it contains $B$ as a subalgebra is a different one where the structure is more complicated and it doesn't decompose into that direct sum?","['commutative-algebra', 'ring-theory', 'abstract-algebra']"
20619,Motivating differentiable manifolds,"I'm reading lectures for the first time starting next week ^_^ The subject is calculus on manifolds I was told that the students I'll be lecturing are not motivated (at all), so I need to kick off the series with an impressive demonstration of what an cool subject it will be that I'll be able to periodically return to later on when I'll need to motivate specific concepts. So far I came up with: 1) Projective plane, I'll demonstrate how conics morph into each other on different models, should be cool enough and motivate general-topological manifolds. 2) Plücker coordinates and their applications to line geometry and computer graphics (not sure if it will be easy to demonstrate), should motivate forms. 3) Expanding Universe, motion in relativity and perception of time, should motivate tangent vectors. I'm not sure they will work, and I could always use more ideas. I would greatly appreciate examples and general advice too. P.S.: Please, wiki-hammer this question.","['differential-geometry', 'big-list', 'soft-question']"
20631,For any even function $f$ there is infinite number of functions $g$ such that $f(x) = g(|x|)$,"This is question from Spivak's Calculus.
Question statement (paraphrased): For any even function $f$ there is infinite number of functions $g$ such that $f(x) = g(|x|)$ I have made attempt at proof, here is my work. My main concern is whether my proof that there are infinite such functions is correct. Let $g$ be a function such that for any positive $x$, $f(x) = g(x)$ and let $f$ be some even function. We will show that above equality then holds even when $x$ is negative: $f(-x) = g(|-x|) \Leftrightarrow f(x) = g(x)$, which is true by definition of these functions. It now remains to show that there is infinite number of those functions. I understand that is so because $g$ can be defined as one whishes for negative numbers and it won't change equality. But I cannot think of formal proof. I'm thinking about assigning values to functions $g$ in a way that I define $g_{1}(-1) = k$ and then making infinite number of them by induction: for any function $g_{n}(x) = k$, if x is negative, we define $g_{n+1}(x-1) = k$. Then by the fact that there is infinite natural numbers, and for every natural number there is going to be unique function, we can conclude there is infinite number of functions. Is the concept of induction applicable here or is it not?","['calculus', 'functions']"
20634,Comb space has no simply connected cover,"I'm having trouble solving the following exercise in Hatcher's Algebraic Topology(1.3 #5): ""Let $X$ be the subspace of $R^2$ consisting of the four sides of the square $[0,1] \times [0,1]$ together with the segments of the vertical lines $x=\frac{1}{2},\frac{1}{3},\frac{1}{4},\ldots$ inside the square. Show that for every covering space $\tilde{X}\to X$ there is some neighbourhood of the left edge of $X$ that lifts homeomorphically to $\tilde{X}$. Deduce that $X$ has no simply-connected cover."" I tried piecing together open sets in $\tilde{X}$ which were homeomorphic to open square shaped $\epsilon$-neighbourhoods of points in the left edge of $X$, but I couldn't glue them together coherently. My second idea was to use the path lifting property to lift the left edge, but I couldn't extend it to a lift of an open neighbourhood of the left edge. Edit : Some more detail on my first attempt: Suppose I have two open squares $U_1$ and $U_2$ in $X$ (containing the left edge) with nonempty intersection, and that have preimages $\coprod_i U_{1,i}$ and $\coprod_j U_{2,j}$ with each piece of that mapping homeomorphically onto $U_1$ and $U_2$ respectively. Suppose I've chosen a specific $U_{1,i}$, and I want to choose a specific $U_{2,j}$ so that their union maps homeomorphically to $U_1$ union $U_2$. Such a choice can be specified by a point in the chosen $U_{1,i}$ that maps into $U_2$, but for each such point, there could be a different choice of $j$. My intution tells me that to make this choice, one needs to appeal to the bad local nature of the left edge of $X$, (so that you're certain to get some of the vertical lines inside of the desired open set) but I'm not sure how to proceed with that.","['general-topology', 'algebraic-topology']"
20638,Is the dual covector field of a nonzero vector field closed?,"Given a nowhere vanishing vector field, say $E_1$, on a manifold $M^n$, it should be possible to extend this locally to a basis of vector fields $E_1,\ldots , E_n$ so that $E_i = \frac{\partial}{\partial x_i}$ for some coordinates $x_i$. (For example, locally we can choose a chart where $E_1$ looks like $\frac{\partial}{\partial x_1}$ and then just define $E_i = \frac{\partial}{\partial x_i}$). For such a frame there we may define a co-frame on $T^*M$, $\varphi^i$ so that $\varphi^i(E_j) = \delta_{ij}$. By the intrinsic definition of the exterior derivative,
\begin{equation} d\varphi^1(E_i,E_j) = E_i(\varphi^1(E_i)) - E_j(\varphi^1(E_j) - \varphi^1([E_i,E_j]) . \end{equation}
The first two terms will be zero as they are the derivative of either the constant function 0 or 1. Similarly, $[E_i,E_j] = [\frac{\partial}{\partial x_i},\frac{\partial}{\partial x_j}] \equiv 0$. Finally, since $d\varphi^1$ is a two form, we see by linearity that $d\varphi^1 \equiv 0$ . In fact, any nonvanishing 1-form $\omega$ can (locally) be expressed as the dual of a nonvanishing vector in some coordinate framing. This would seem to imply that any nowhere zero 1-form has zero exterior derivative. Since I do not believe this is true, there must be some flaw to my reasoning, but I cannot see it.","['geometry', 'differential-geometry']"
20658,expected number of shuffles to sort the cards,"Initially the deck is randomly ordered. The aim is to sort the deck in order. Now in each turn the deck is shuffled randomly. If any of the initial or last cards are in sorted order then they are kept aside, and the process is followed with rest of the cards. The question now is what is the expected number of shuffles for the entire deck to get sorted in this manner. e.g. let's say initially the deck is $(3,5,6,2,7,1,4)$. After the first shuffle it becomes $(1,2,6,4,5,3,7)$, then the next shuffle will be done with $(6,4,5,3)$ as $(1,2)$ and $(7)$ are already in proper order. Check that even if $5$ in also at right place, but not in continuous order hence considered for shuffle. What I know is that the expected number of shuffles to sort the deck in one attempt is $n!$. (Something known as bogo-sort). But can't think any further. Any help will be appreciated.","['permutations', 'probability', 'sorting']"
20661,The sum of an uncountable number of positive numbers,"Claim: If $(x_\alpha)_{\alpha\in A}$ is a collection of real numbers $x_\alpha\in [0,\infty]$ such that $\sum_{\alpha\in A}x_\alpha<\infty$ , then $x_\alpha=0$ for all but at most countably many $\alpha\in A$ ( $A$ need not be countable). Proof: Let $\sum_{\alpha\in A}x_\alpha=M<\infty$ . Consider $S_n=\{\alpha\in A \mid x_\alpha>1/n\}$ . Then $M\geq\sum_{\alpha\in S_n}x_\alpha>\sum_{\alpha\in S_n}1/n=\frac{N}{n}$ , where $N\in\mathbb{N}\cup\{\infty\}$ is the number of elements in $S_n$ . Thus $S_n$ has at most $Mn$ elements. Hence $\{\alpha\in A \mid x_\alpha>0\}=\bigcup_{n\in\mathbb{N}}S_n$ is countable as the countable union of finite sets. $\square$ First, is my proof correct? Second, are there more concise/elegant proofs?","['measure-theory', 'summation', 'real-analysis']"
20663,Computing a Direct Limit,"Motivation: In Spanier's Algebraic Topology we are introduced to direct and indirect limits in the first few pages.  I partially understand the idea behind it but since I am an example-driven learner I'd actually like to compute some direct limits. Question: Where can I find explicit examples of a direct (or even indirect) limit being calculated? What I've done so far: So far, I've computed the direct limit for some finite directed sets.  On the wikipedia page, there are a number of examples which I've been trying to work out.  In particular, the third example (which is the infinite chain of ${\mathbb Z}/p^{n}{\mathbb Z}\rightarrow {\mathbb Z}/p^{n+1}{\mathbb Z}$ with multiplication by $p$ is the map) I'm unsure of how they come up with the roots of unity for some power of $p$.  Any help on this one would also be greatly appreciated.","['examples-counterexamples', 'abstract-algebra']"
20664,Finitely generated modules over PID,"Let $A$, $B$, $C$, and $D$ be finitely generated modules over a PID  such that $A\oplus B\cong C\oplus D$ and $A\oplus D\cong C\oplus B$. Prove that $A\cong C$ and $B\cong D$. The only tool I have is the theorem about finitely generated modules, but I don't quite see the connection. Please Help. Thanks.","['modules', 'principal-ideal-domains', 'abstract-algebra']"
20665,Convergent or divergent series,"I have the following series: 
$\sum_{n=1}^{\infty} \frac{n}{\sqrt{n(n + 1)(n + 2)}}$ I must investigate if it is divergent or convergent. I have tried different approaches like the root test, but it didn't help me:(. Could someone point me in the right direction? Best regards, Petar","['convergence-divergence', 'sequences-and-series']"
20670,Theorem of Arzelà-Ascoli,"The more general version of this theorem in Munkres' 'Topology' (p. 290 - 2nd edition) states that Given a locally compact Hausdorff space $X$ and a metric space $(Y,d)$; a family $\mathcal F$ of continuous functions has compact closure in $\mathcal C (X,Y)$ (topology of compact convergence) if and only if it is equicontinuous under $d$ and the sets $$ \mathcal F _a = \{f(a) | f \in \mathcal F\} \qquad a \in X$$ have compact closure in $Y$. Now I do not see why the Hausdorff condition on $X$ should be necessary? Why include it then? Am I maybe even missing something here (and there are counterexamples)? btw if you are looking up the proof: Hausdorffness is needed for the evaluation map $e: X \times \mathcal C(X,Y) \to Y, \, e(x,f) = f(x)$ to be continuous. But the only thing really used in the proof is the continuity of $e_a: \mathcal C(X,Y) \to Y, \, e_a(f) = f(a)$ for fixed $a \in X$. Cheers, S.L.","['general-topology', 'compactness']"
