question_id,title,body,tags
284562,Interior Sphere Condition,"Let $\Omega\subset\mathbb{R}^N$ be a bounded open set. We say that $\Omega$ satisfies the interior sphere condition (ISC), if for all $y\in\partial\Omega$ there is $x\in\Omega$ and a open ball $B_r(x)$ such that $B_r(x)\subset\Omega$ and $y\in\partial B_r(x)$. If $\partial\Omega$ is of class $C^2$, then $\Omega$ satisfies (ISC).
Does anyone knows an example of $\Omega$ such that $\partial\Omega\in C^{1,1}$, but $\Omega$ does not satisfy this condition? Update: By a comment of Lopsy seems that there is no $C^{1,1}$ set that not satisfies (ISC). I found a $C^1$ example in Gilbard-Trudinger, but I cannot understand it: Define $u(x,y)=\Re(\frac{x+iy}{\log{x+iy}})$ and $\Omega=\{(x,y)\in\mathbb{R}^2:\ x\geq 0,\ u(x,y)<0\}$. He then concludes that $\Omega$ is $C^1$ near the origin but does not satisfy the (ISC). Can anyone help me to understand it. How can the boundary of $\Omega$ be the graph on a $C^1$ function near the origin?","['geometry', 'analysis']"
284564,The k-th difference of the sequence $n^{k}$ is constant and equal to $k!$,"Define the k-th difference of a sequence $\{a_n\}$ inductively as follows: The $1$-th difference is the sequence $\{b_n\}$ given by $b_n=a_{n+1}-a_n$ The ""$k+1$""-th difference is the sequence $\{b_n\}$ given by $b_n=c_{n+1}-c_n$, where $\{c_n\}$ is the $k$-th difference of the sequence $\{a_n\}$. Prove that, given the sequence $\{a_n\}$ such that $a_n=n^k$, for a fixed $k \in \mathbb{N}$, the $k$-th difference of this $\{a_n\}$ is a constant sequence and equal to $k!$","['finite-differences', 'recurrence-relations', 'sequences-and-series', 'real-analysis']"
284572,"Relative CW approximation, Hurewicz fibrations and Serre fibrations","Let $B$ be a finite CW complex and $p:E\to B$ a Hurewicz fibration. I know that every topological space $E$ has the weak(!) homotopy type of a CW complex $D$ realized by a weak equivalence $f:D\to E$. (I apologize for asking two things in one question but they are so related that splitting them up seems a little exaggerated.) Is it possible to find a CW complex $D'$, a Hurewicz fibration $p':D'\to B$ and a weak equivalence $f':D'\to E$ such that $p'=p\circ f'$? Is it possible to find a Serre fibration $q:C\to B$ and a weak equivalence $g:C\to E$ such that $q=p\circ g$? Can I choose $C$ to be a CW complex? ADDENDUM: Due to Henry T. Horton's great answer, the whole question reduces to the following question. Let $E$ be a topological space. Is it possible to find a CW complex $D$ and a weak equivalence $f:D\to E$ such that $f$ is also a Serre fibration?","['general-topology', 'algebraic-topology']"
284577,"Integration by parts of $\int_0^\infty \! n^2 \ln(1-e^{-an}) \, \mathrm{d} n$","Im trying to do the following integration by hand, $\int_0^\infty \! n^2 \ln(1-e^{-an}) \, \mathrm{d} n$ I have tried to use integration by parts and substitution, but each time it gets to complicated and messy (polylog terms etc...), is there any straight forward way to solve this?","['calculus', 'integration']"
284600,Trigonometric Substitution - Arc Length,"Good day to everyone, I'm not so good in maths as I wish. But, I'm doing my job to improve it . So , be patience and thanks in advance for any detailed clue. Description of the problem: The arc is described by this parabola: $\ x=y^2$.
Having the integral of the length of the arc, in Leibniz notation. The term ""$\ dx/dy$"" is $\ 2y$. (in this case $\ x=g(y)$ ) In the integral, there is a step I cannot understand. They make the following substitution: ""$\ y=(1/2)*Tan(\theta)$ "" Question: Why $\ Tan(\theta) $ ? I still cannot understand how to choose ""the right trigonometric substitution"" .","['trigonometry', 'integration']"
284606,Area of the intersection of a cone and a sphere,"Calculate the area of the surface $x^2+y^2 = z^2 $ with $z \geq 0$, limited by $x^2 +y^2+z^2=2ax$.
I think the method to solve it is to calculate the parametric equation of the curve and then calculate the area of the enclosed curve using $ \frac{1}{2} \int_c x\,dy - y\,dx $. I'm having trouble finding the equation of the parametric curve.
Thanks.","['geometry', 'calculus']"
284612,Approximate a function using another function,"Problem Find the best approximation of $f(t)=t^2$ with $h(t)=ae^t+be^{2t}+c$ everywhere on the interval $[0,4]$. Attempt I know how to solve this problem given sample points, by using least squares, but I am having a hard time figuring out how to setup this problem. I know that I need to use the inner product, $\int_0^4f(t)h(t)dt$. The issue I'm having is with putting this problem in the form of $Ax=b$. Normally I would construct the Gram matrix using the inner product and basis vectors, but no basis vectors were given. How do I proceed with setting this up?",['linear-algebra']
284621,Is the set of points in $\mathbb R^n$ with $\sum_{j=1}^n x_j^k = 0$ a submanifold?,"Consider the set $$A:= \{x\in \mathbb R^n :\sum_{j=1}^n x_j^k = 0\}$$ for $k$ an odd integer. Is this a submanifold of $\mathbb R^n$ for every $n$? For $n=1$, it is just 0; for $n = 2$, it is the anti-diagonal $\{(x_1 , -x_1) : x_1 \in \mathbb R\}$, which is a submanifold. However, I cannot find a way to determine this in higher dimensions. Any suggestions?",['differential-geometry']
284622,How do you call functions that fulfill $f(x)=\pm f(\pm 1/x)$?,"A function $f(x)$ that fulfills $f(x)=\pm f(-x)$ is called (a)symmetric even/odd. How do you call functions that fulfill $f(x)=\color{blue}\pm f(\color{red}\pm 1/x)$? ""$\color{red}{\text{Positive/Negative}}$ Reciprocal $\color{blue}{\text{(anti)symmetric}}$""..? edited according to the comments...","['graphing-functions', 'symmetry', 'terminology', 'functions']"
284637,"Prove transitivity of $\forall X( X\subseteq A\setminus\{a, b\}\rightarrow(X\cup \{a\}\in\mathcal{F}\rightarrow X\cup\{b\}\in\mathcal{F}))$","This one is from Velleman's ""How to Prove It, 2nd Ed."", exercise 4.3.23. Suppose $A$ is set, and $\mathcal{F}\subseteq\mathcal{P}(A)$. Let $$R=\{(a,b)\in A\times A : \text{for every } X\subseteq A\setminus\{a, b\}\text{, if } X\cup \{a\}\in\mathcal{F}\text{ then } X\cup\{b\}\in\mathcal{F}))\}$$ Show that $R$ is transitive. First of all, I'm not sure if I read this correctly and if my notation is correct: $$R=\{(a,b)\in A\times A : \forall X( X\subseteq A\setminus\{a, b\}\rightarrow(X\cup \{a\}\in\mathcal{F}\rightarrow X\cup\{b\}\in\mathcal{F}))\}$$ To prove that $R$ is transitive, we need to prove that $$\forall a\in A\;\forall b\in A\;\forall c\in A\;((aRb\wedge bRc) \rightarrow aRc),$$ so for starters we suppose and let all the usual stuff: let $a,b,c\in A$ suppose $aRb \wedge bRc$ expand $aRc$ to $\forall X( X\subseteq A\setminus\{a, c\}\rightarrow(X\cup \{a\}\in\mathcal{F}\rightarrow X\cup\{c\}\in\mathcal{F}))$ let $X$ be arbitrary and suppose $X\subseteq A\setminus\{a,c\}$ suppose $X\cup\{a\}\in\mathcal{F}$ show that $X\cup\{c\}\in\mathcal{F}$ Now Velleman suggests splitting proof to cases: $b\not\in X$ and $b\in X$. Showing that $R$ is transitive for $b\not\in X$ is rather straightforward. All we need to do is to show from $b\not\in X \wedge X\subseteq A\setminus\{a,c\}$ that $X$ is also subset of both $A\setminus\{a,b\}$ and $A\setminus\{b,c\}$, and we just follow assumptions $aRb$ and $bRc$ to conclude $X\cup\{c\}\in\mathcal{F}$. Now we must show transitivity when $b\in X$. For this case Velleman suggests working with $X'=(X\cup\{a\})\setminus\{b\}$ and $X''=(X\cup\{c\})\setminus\{b\}$, and this is the part I totally don't get. Why would using $X'$ and $X''$ work for this proof, and how do actually connect them with all the givens/assumptions? I can see how all this connects after expanding $aRb$ and $bRc$, but I fail to see how this makes a correct proof. So my questions are: is the 1. correct notation for given relation $R$ and how does 4. connect to givens. If there is some other approach, I would be most thankful for any pointers.","['relations', 'proof-writing', 'elementary-set-theory']"
284645,Describing the algebra of functions on $S^2$,"Chapter 2 of the book ""Elements of Noncommutative Geometry"" claims that the $C^*$-algebra of functions on $S^2$ can be described as an algebra with 3 generators a,b,c all with norm 1, where $a,b$ are positive and $c^*c = 4ab.$ However it never explicitly tells you which functions on the sphere these are. What are they?","['noncommutative-algebra', 'noncommutative-geometry', 'differential-geometry']"
284649,Why are K3 surfaces minimal?,"I need to prove that all K3 surfaces are minimal surfaces, so that every birational map between K3 surfaces is an isomorphism. I've started to read Beauville's book on complex algebraic surfaces: there it says that the fact that K3 surfaces are minimal comes from the definition ($K=0$ and $H^{1,0}(X)=0$), but I can't see why. Do you know the proof or where I can find it?","['algebraic-geometry', 'k3-surfaces', 'complex-geometry']"
284661,Product of probability density functions,"I was going through a problem in Geoffrey Grimmett and David Stirzaker's book ( Probability and Random Processes ). The problem is as follows: If $f$ and $g$ are probability density functions, then prove that for $ 0 \leq \lambda \leq 1$ the function $\lambda f + (1-\lambda)g$ is a density function. Is the product $fg$ a density function as well? It is straightforward to prove $\lambda f + (1-\lambda)g$ is a density function. For the second question as well, one can construct trivial functions for $f$ and $g$ as $f(x)=g(x)=1$ for $ 0 \leq x \leq 1$. Are there any other non-trivial examples of a family or class of distributions for which one can find $\int_{-\infty}^{\infty} f(x)g(x) dx=1$?",['probability']
284663,Why is $e^{x}$ not uniformly continuous on $\mathbb{R}$?,"It seems intuitively very clear that $e^{x}$ is not uniformly continuous on $\mathbb{R}$. I'm looking to 'prove' it using $\epsilon$-$\delta$ analysis though. I reason as follows: Suppose $\epsilon > 0$; in fact, fix it to be $\epsilon=1$. For contradiction, suppose that $\exists \delta >0$ s.t. $$ (\star) \ |x-y|<\delta \Rightarrow |e^{x}-e^{y}|<\epsilon=1 \text{  for  } x,y \in \mathbb{R}.$$
Note that $e^{x+\delta}-e^{x}=e^{x}(e^{\delta}-1)$. So, for $x$ large enough (so that RHS $>1$), the relation $(\star)$ does not hold. This is our contradiction, and so the exponential function is not uniformly continuous on $\mathbb{R}$. Is this reasoning correct and sufficient? Thanks.","['exponential-function', 'real-analysis']"
284667,Matrix calculation,"The matrix is $ M= \frac{d}{d\theta} e^{A+\theta B} \mid _{\theta = 0} $ where $A$ and $B$ are both $n\times n$ matrices. I was thinking solving it by introducing the equations: $\dot x = (A + \theta B)x,\ x(0) = I$ with solution $x = X(t,\theta) $, where $M = \frac{dX(1,0)}{d\theta}$, I was stuck then, thanks for any suggestions : )","['matrices', 'ordinary-differential-equations']"
284684,an application of implicit function theorem?,"I need to proof the following, could any one help me to proof step by step?
$(t,\epsilon)\mapsto F(t,\epsilon):\mathbb{R}\times\mathbb{R}\rightarrow\mathbb{R}$ be a twice continuously differentiable function, assume that $F(0,0)=0$, $F_t'(0,0)=F_{\epsilon}'(0,0)=0$, then there exist $\epsilon_0>0$ such that for any $\epsilon\in(0,\epsilon_0)$ and any positive $0$ of the polynom $$p(d)=2F_{tt}''(0,0)d^3+2F_{t\epsilon}''(0,0)d^2+(F_{\epsilon\epsilon}''(0,0)-F_{tt}''(0,0))d-F_{t\epsilon}''(0,0)$$ such that $$J:=\frac{1}{2d}F_{t\epsilon}''(0,0)+\frac{1}{2}F_{tt}''(0,0)\neq 0$$ the equation $$F(t,\epsilon)=0$$ has a unique solution $t(\epsilon)$ in the interval $[\epsilon\sqrt{d^2-\epsilon M},\epsilon\sqrt{d^2+\epsilon M}]$
I have not geometrically understood the picture of the statement, I also want to know what are the tools(theorem,results, books) I need to understand clearly the above result.please help,ths is very important for me. thank you.","['functional-analysis', 'partial-differential-equations']"
284686,equilibrium of a flow,"Flow $ \phi : \mathbb R \times X \rightarrow X $ on metric space $ (X, d) $, we know there is a sequence of points $ x_n \in X $ s.t. the orbit through $ x_n $ is a periodic orbit with period $T_n > 0$, also $ \lim_{n \to \infty} x_n = x_*, \lim_{n \to \infty} T_n = 0 $ for some $ x_* \in X $. How to prove that $ x_* $ is an equilibrium of the flow?","['dynamical-systems', 'ordinary-differential-equations']"
284687,how many subgroups of order 3 are there in symmetric group $S_6$,"Assuming $S_6$ is a symmetric group, determine how many subgroups of order $3$ are there in $S_6$? What are the subgroups of order $3$ like? Is it like $\{(12)(34)(56)\}$?","['symmetric-groups', 'group-theory', 'abstract-algebra']"
284699,Are coordinate projections in the Skorokhod space continuous?,"I was wondering whether coordinate projections in the Skorokhod space $D[0,1]$ are actually continuous (and, if so, how can this be proven)? many thanks for any comments/ideas. cheers!","['statistics', 'stochastic-processes', 'stochastic-calculus']"
284700,Maximum number of path for acyclic graph with start and end node,"Say given an acyclic graph with n nodes,
which includes a starting node s0 and ending node e0,
what is the maximum number of path from s0 to e0?","['graph-theory', 'combinatorics']"
284711,Three properties of the Lebesgue measure on $\mathbb{R}^n$,"I'm writing notes for my upcoming class in Game Theory and I realized some time ago that I only need three properties of the Lebesgue measure $\lambda$ on $\mathbb{R^n}$. It is a non-negative measure on Borel subset of $\mathbb{R}^n$ that is strictly positive on open non-empty sets. Every proper hyperplane  in $\mathbb{R}^n$ has measure zero. There is a polynomial function $P: (\mathbb{R}^n)^{n+1}\to \mathbb{R}$ such that: For all $(x_1,x_2,\ldots,x_{n+1})\in (\mathbb{R}^n)^{n+1}$ there is a one to one onto function $\ell: \{1,2,\ldots, n+1\}\to \{1,2,\ldots, n+1\}$ satisfying
$$
\lambda(conv\{x_1,x_2,\ldots,x_{n+1}\}) =P(x_{\ell(1)},x_{\ell(2)},\ldots,x_{\ell(n+1)})
$$
where $conv$ stands for convex hull. The Lebesgue measure $\lambda$ satisfies (3) by identifying the volume of a positively oriented simplex with determinant of vertices times a constant. Q1. I am only interested however in the existence of a measure satisfying (1), (2), (3). Do I have to fully construct the cumbersome Lebesgue measure to do this? Q2. Can I construct a measure satisfying (1) and (2),  which measures bounded sets finitely, in a manner that is less cumbersome than the Lebesgue measure? (Thanks @5PM: Added this question in Edit) Q3. Suppose instead of polynomial P I require that P be real analytic. Will a measure satisfying (1) (2) (3) always be Lebesgue absolutely continuous with an analytic density function (like the normal distribution on $\mathbb{R^n}$)? In other words, if I show the existence of a measure satisfying (1) (2) (3) have I simply developed the Lebesgue measure.","['geometry', 'measure-theory', 'euclidean-geometry', 'lebesgue-integral', 'geometric-measure-theory']"
284728,"Why $\sigma$-algebras represent information, and what information does $\sigma(X)$ represent?","I am confused about the notion of $\sigma$-algebras representing information and what information is contained in $\sigma(X)$ for a random variable $X$. Suppose $(\Omega, \mathcal{F}, \mathbb{P})$ is a probability triple, and $(Y_\gamma : \gamma \in C)$ is a collection of random variables. I am reading that $\sigma(Y_\gamma : \gamma \in C)$ consists of all the events $F \in \mathcal{F}$ such that for all $\omega \in \Omega$ it is possible to determine whether or not $\omega \in F$ given $(Y_\gamma(\omega) : \gamma \in C)$. I don't even see how this makes sense if we restrict ourselves to a single random variable $X$. Suppose I know $X(\omega)$. I can only be sure $F$ occurred if $F\supseteq X^{-1}(\{X(\omega)\})$ and I can only be sure that $F$ didn't occur if $X(\omega) \notin X(F)$. But we know that $\sigma(X) = \sigma(\{X^{-1}(B) : B \in \mathcal{B}\})$. Where are all the other sets coming from?","['probability-theory', 'measure-theory']"
284753,Triangle with $\sin^2 A +\sin^2 B =\sin C$,"I want to know the triangles which satisfies the following equation : $\sin^2 A + \sin^2 B = \sin C$. Here $A$, $B$, $C$ are angles of a triangle. If we let $a$, $b$, $c$ to be the lengths of edges corresponded to angles, then we multiply $(abc)^2$ in the above equation. So we can conclude that $C$ is not larger strictly than $\pi/2$ So problem is divided into two cases without a loss of generality Case 1 : $A$, $B < \pi/2$. This case is easy. Simple computation shows that $C = \pi/2$ Case 2 : $A > \pi/2$ and $B < \pi/2$ In this case I got one solution : $B=C$ so that sin(C) is a root of the equation $4t^2
+4t-1=0$ So I have a question : Can we solve this case in general ?",['trigonometry']
