question_id,title,body,tags
657039,Is the span of rationally independent real numbers dense in $\mathbb{R}$,"Define the subset $S\subset\mathbb{R}$ to be equal to $\{a_1\mathbb{Z} + a_2\mathbb{Z} +\cdots+ a_n\mathbb{Z} \}$, where $a_1,a_2\cdots,a_n\in\mathbb{R}$ are rationally independent and $2\leq n<\infty$ is an arbitrary index. Is $S$ dense in $\mathbb{R}$?","['functional-analysis', 'real-analysis']"
657064,"Solution of the IVP: $\,y'=\mathrm{e}^{-y^2}-1,\, y(0)=0$","Consider the initial value problem
$$ 
\frac{dy}{dx} = \mathrm{e}^{-y^2} - 1,\quad y(0)=0.
$$ The Method of Separation of Variables provides that:
$$
\int \frac{dy}{e^{-y^2} - 1}  = x+c.
$$
I would be thankful who somone can give me hint.","['ordinary-differential-equations', 'calculus', 'exponential-function', 'indefinite-integrals', 'analysis']"
657070,"If $U\to X$ is a closed immersion, $U$ is dense in $X$ and $X$ is reduced, why is the closed immersion an isomorphism?","This came up in the Reduced-to-separated theorem. If $U\to X$ is a closed immersion, $U$ is dense in $X$ and $X$ is reduced, why is the closed immersion an isomorphism?","['algebraic-geometry', 'reference-request']"
657079,"Given a Banach space $X$, are weak$^*$ bounded subsets of the dual space $X '$ also strongly bounded (with respect to the usual norm in $X '$)?","Some related facts I already know: 1) In a Banach space $X$, weakly bounded sets are strongly bounded and vice-versa (Thm 3.18 - "" Functional Analysis "", Rudin); 2) From 1, it follows that my question is equivalent to proving that weak$^*$ bounded sets are bounded with respect to the weak topology of the dual $X'$. 3) If X is reflexive, then 2 is easy to show and then my question is true. But reflexiveness is really necessary?","['topological-vector-spaces', 'functional-analysis', 'banach-spaces']"
657100,Show that an integral of an entire function is an entire function,"Given $f:\Bbb C\times \Bbb R \rightarrow \Bbb C$ is a continous function,
and for each $t\in \Bbb R, f(t,z)$ is an entire function. We'll define
$$
A(z) = \int_0^1f(t,z)\,dt.
$$
Show that $A(z)$ is an entire function.","['integration', 'complex-analysis']"
657118,Prove that graph has at least one cycle of length at least $\delta+1$,"I have to answer the question : ""Is it true that in all finite graphs (connected graphs) wchich $\delta \ge 2$ ($\delta$ is the smallest degree of vertices in a graph) exists the cycle of length equal to $\delta+1$ or longer"". I believe this statement is true. I drew some graphs and it seems to be true. I do not know how to prove this in mathematical way. I will glad for help and advice.","['graph-theory', 'discrete-mathematics']"
657148,Locally-compact function spaces?,"I ask this question out of curiosity, not a specific need.
Euclidean spaces and manifolds.  Are there examples of locally compact function spaces? Could (some?) Sobolev spaces be locally compact?","['general-topology', 'compactness', 'functional-analysis']"
657155,Preimage of zero measure sets,"Let $A\subset\mathbb{R}$ be a set of Lebesgue measure zero and $f:\mathbb{R}^n\to\mathbb{R}$ is a function. Under what conditions does $f^{-1}(A)$ have Lebesgue measure zero? I  found a possible answer here but I cannot fully understand the proof. The claim is that $f\in C^1$ and the set $\{x:\ \nabla f(x)=0\}$ having measure zero suffices. Now the proof given starts with: ""To prove this, note that this is true locally, in a neighborhood of each point where $\nabla f(x)\neq 0$, due to the implicit function theorem."" Take a point $x=(x_1,\ldots,x_n)\in\mathbb{R}^n$ such that $\nabla f(x)\neq 0$ and $f(x)=c$ for some $c\in A$. By the implicit function theorem one can find neighborhoods $U$ and $V$ of $(x_1,\ldots,x_{n-1})$ and $x_n$ respectively such that $f^{-1}(\{c\})\cap (U\times V)=\{(y,g(y)):y\in U\}$ for some function $g$ on $U$ and $\nabla f(x)\neq 0$ for all $x\in U\times V$. But what about all the other elments of $A$? A reference on this or similar theorem would be greatly appreciated.","['measure-theory', 'reference-request']"
657159,Pullback of a form using the Hopf fibration,"I embed the 2-sphere and the 3-sphere in $\mathbb{R}^3$ and $\mathbb{R}^4$ respectively. Then denote by $\{x_1,x_2,x_3,x_4\}$ the coordinates on the 3-sphere and $\{y_1,y_2,y_3\}$ on the 2-sphere. So $\sum_{i=1}^4 x_i^2 = 1 = \sum_{i=1}^3 y_i^2$ . Now consider the 2-forms $$\omega=dx_1\wedge dx_2+dx_3\wedge dx_4$$ on $S^3$ and $$\alpha=y_1\, dy_2\wedge dy_3+y_2\, dy_3\wedge dy_1 + y_3\, dy_1\wedge dy_2$$ on $S^2$ . I wish to show that when pulling back $\alpha$ to $S^3$ using the Hopf map $H:S^3\rightarrow S^2$ given by $$(x_1,x_2,x_3,x_4)\mapsto \left(x_1^2+x_2^2-x_3^2-x_4^2, 2(x_2x_3 - x_1 x_4), 2(x_2x_4+x_1x_3)\right)\,,$$ the result is proportional to $\omega$ , so: $H^*\alpha=c\omega$ for some $c\in\mathbb{R}$ . I tried starting from the left hand side, so by definition of the pullback I just wrote down the form $\alpha$ with the $y_i$ replaced by the $i^{th}$ component of $H(x_1,x_2,x_3,x_4)$ , and then I used $\sum_{i=1}^4 x_i^2 = 1$ and $\sum_{i=1}^4 x_idx_i = 0$ . This however became a huge mess and nearly impossible to do by hand... Is there an easier way? Is there a way to take $H$ to the right hand side, using some properties of the pull back? Then I could start from the right hand side, which might be easier.","['differential-forms', 'manifolds', 'differential-geometry', 'hopf-fibration']"
657166,nth derivative of a finite amount of composite functions,"I was curious to see whether or not there is a formula for the $n$th derivative of $k$ composite functions. If $F(x)=(f_1\circ f_2\circ...\circ f_k(x))$ then is there a formula for $$\frac{d^n} {dx^n}(F(x)).$$ For the $n$th derivative of two composite functions we use Faa di Bruno's rule, or $$\frac{d^n} {dx^n}(f(g(x)) =\sum \frac {n!} {m_1! 1!^{m_1} ... m_n! n!^{m_n}} \cdot f^{(m_1 + ... + m_n)} (g(x)) \prod_{i=1}^{n}(g^{(i)}(x))^{m_i}, $$ where the sum is over all the values of $m_1,...,m_n$ such that $m_1+2m_2+...+nm_n=n$. Also, for the first derivative of $k$ composite functions, user Yangzhe Lau gave me the formula $$F'(x)=\prod_{i=1}^{k}f'_i(f_{i+1}\circ f_{i+2} \circ \cdot \cdot\cdot\circ f_k(x)).$$ Therefore, is there a formula for that essentially combines these two, I suppose.",['calculus']
657170,Biholomorphism between 2 non simply connected domains [duplicate],This question already has an answer here : Is my proof correct? (Conformal equivalence of two circular annuli) (1 answer) Closed 10 years ago . Is the annulus of centre $0$ and radii $1$ and $2$ biholomorphic to the punctured disc $$\{ z \in \mathbb{C} \ | \ 0<|z| <1\}$$ ? Why ? I know the Riemann mapping theorem but here we have  non simply connected domains.,"['complex-analysis', 'analysis']"
657177,"Combinatorics question - count how many ways to write $1,2,...,n$ with a certain order","A valid sequence is a sequence of length $n$ from the numbers $1,2,...,n$ such that: 1) every number appears once 2) apart from the first number in the sequence, every number $k$ has either a $k-1$ or a $k+1$ on its left (not necesarily adjacent). For example: the sequences $324156$ and $546321$ are valid. The sequence $435126$ is not (because there is no $2$ on the left side of $1$). Show that the number of valid sequences of length $n$ is $2^{n-1}$ Would love if someone could give me a tip. Not the answer, just a direction. I tried solving it with recurrence relation and induction but it didn't work.","['sequences-and-series', 'combinatorics']"
657187,Prove Intersection of $\sigma$-algebras is a $\sigma$-algebra and the powerset is a $\sigma$-algebra,"Fix a set $\Omega$. A $\sigma$-algebra on $\Omega$ is a non-empty collection of subsets of $\Omega$ closed under taking complements and countable unions. I'd like to prove that (1) for finite $\Omega$, $2^\Omega$ is a $\sigma$-algebra and that (2) the intersection of a family of $\sigma$-algebras is a $\sigma$-algebra. Are these proofs correct? The def. says ""non-empty collection"" so the collection contains something and the complement of that something hence the whole things $\Omega$. Since it contains the whole things, it contains its complement, hence the empty set $\emptyset$. This guarantees that $2^\Omega$ and $\bigcap \mathcal{A_i}$ of $\sigma$-algebras $\mathcal{A_i}$ are non-empty. (Stmt 1) Pf . $2^\Omega$ contains all subsets of $\Omega$. So it's closed under taking complements and countable unions. (Stmt 2) Pf . Let $\{\mathcal{A_i}\}$ be a family of $\sigma$-algebras. $A\in \bigcap \mathcal{A_i}\implies A\in \mathcal{A_i} \forall i\implies A^c \in\mathcal{A_i}\forall i\implies A^c\in \bigcap \mathcal{A_i}$ Let $A_j\in \bigcap \mathcal{A_i}$ for $j\in J$. Then $A_j\in \mathcal{A_i} \forall i \forall j$. Therefore $\bigcup A_j\in \mathcal{A_i} \forall i$. Hence $\bigcup A_j\in\bigcap\mathcal{A_i}$","['measure-theory', 'probability', 'solution-verification']"
657234,Bonferroni inequality proof,"Is this proof for $P(\bigcup_{i=1}^n A_i)\le\sum_{i=1}^nP(A_i)$ correct? Pf . By induction. For $n=2$, $$P(A\cup B)=P(A)+P(B)-P(A\cap B)\le P(A)+P(B)$$
Assume that the statement is true for $n-1$, that is: $$P(\bigcup_{1}^{n-1}A_i)\le\sum_{i=1}^{n-1}P(A_i)$$ Let $B=\bigcup_{1}^{n-1}A_i$, $$P(B\cup A_n)\le P(B)+P(A_n)\le \sum_{i=1}^{n-1}P(A_i) + P(A_n)=\sum_{i=1}^{n}P(A_i)$$","['probability-theory', 'measure-theory', 'proof-verification']"
657241,Infinite Series $1+\frac12-\frac23+\frac14+\frac15-\frac26+\cdots$,"Was given the following infinite sum in class as a question, while we were talking about Taylor series expansions of $\ln(1+x)$ and $\arctan(x)$:
$$1+\frac12-\frac23+\frac14+\frac15-\frac26+\cdots$$ The question isn't homework or anything, just a thought tease.
I tried for a long while but couldn't find anything remotely close.
Thanks in advance for the help.","['closed-form', 'sequences-and-series', 'calculus', 'real-analysis', 'summation']"
657252,When is the automorphism group $\text{Aut }G$ cyclic?,"Let $G$ be a finite group. Under which conditions on $G$ is the automorphism group $\text{Aut }G$ cyclic? More precisely, does ""$G$ is abelian"" or ""$G$ is cyclic"" imply ""$\text{Aut }G$ is cyclic""?","['abelian-groups', 'cyclic-groups', 'automorphism-group', 'finite-groups', 'group-theory']"
657257,Cogroup structures on the profinite completion of the integers,"Let $\mathsf{ProFinGrp}$ be the category of profinite groups (with continuous homomorphisms). This is equivalent to the Pro-category of $\mathsf{FinGrp}$. Notice that $\widehat{\mathbb{Z}} = \lim_{n>0} \mathbb{Z}/n\mathbb{Z}$ is a cogroup object, since it represents the forgetful functor $U : \mathsf{ProFinGrp} \to \mathsf{Set}$. Although $\mathsf{ProFinGrp}$ has no coproducts (?), the coproduct $\widehat{\mathbb{Z}} \sqcup \widehat{\mathbb{Z}}$ exists, it coincides by formal nonsense with $\widehat{F_2}$, where $F_2$ is the free group on two generators $x,y$. Let us denote the generator of $\mathbb{Z}=F_1$ by $x$. Then the comultiplication of $\widehat{F_1}$ is given by $\widehat{F_1} \to \widehat{F_2}$, $x \mapsto x * y$. There is another cogroup structure on $\widehat{F_1}$, corresponding to the opposite group. The corresponding comultiplication is $\widehat{F_1} \to \widehat{F_2}$, $x \mapsto y * x$. Question. Are these two the only cogroup structures on $\widehat{\mathbb{Z}}$? Here is a down-to-earth description what a cogroup structure on $\widehat{\mathbb{Z}}$ is: It is an element $m(x,y) \in \widehat{F_2}$ (a sort of ""profinite word"" in $x$ and $y$) such that $m(x,1)=m(1,x)=x$ in $\widehat{F_1}$ $m(x,m(y,z))=m(m(x,y),z)$ in $\widehat{F_3}$ There is some $i \in \widehat{F_1}$ such that $m(x,i(x))=m(i(x),x)=1$. This is very similar to the definition of a one-dimensional formal group law (which is a cogroup structure on $R[[t]]$ in the category of complete topological $R$-algebras). Background: An affirmative answer would answer math.SE/656279 . It is known that $\mathbb{Z} \in \mathsf{Grp}$ has only two cogroup structures.","['profinite-groups', 'formal-groups', 'abstract-algebra', 'category-theory', 'group-theory']"
657282,Closed invariant subspace problem,"Why does the invariant subspace problem only ask about closed invariant subpaces? I understand that if $W$ is an invariant subspace then the closure of $W$ is also invariant but if $W$ is dense in the space, the closure of $W$ is trivial.","['linear-algebra', 'functional-analysis']"
657284,"If an IVP does not enjoy uniqueness, then it possesses infinitely many solutions","I am trying to prove that when an IVP in ODEs does not enjoy uniqueness, then it has infinitely many different solutions. I know that when the Lipschitz condition is satisfied, then there is a unique solution. I guess, I am trying to show that if the IVP possesses two solutions, then we can create infinitely many solutions using these two. However, I am slightly lost as where to start the proof.","['lipschitz-functions', 'ordinary-differential-equations', 'real-analysis', 'analysis']"
657302,Divergence as a surface integral,"I had a shot at the final problem of section 16.4 in 'Calculus a Complete Course' by Adams, I knew full well that I wasn't even going to come close to a correct answer so my question relates to the answer provided in the solution manual. Note: I can't get the surface integral to show up as a closed surface integral, so where ever you see a double integral please assume that i'm referring to the integral over a closed surface. Problem statement: Let $P_{0}$ be a fixed point and for each $\epsilon>0$ let $D_\epsilon$ and $S_\epsilon$ define the the domain and boundary respectively. (such that the conditions of the Divergence Theorem are satisfied) Suppose that the maximum distance from $P_0$ to some other point $P\in D_\epsilon$ approach zero as $\epsilon\rightarrow 0^+$. If $D_\epsilon$ has volume $vol(D_\epsilon)$, show that
$$\lim_{\epsilon\rightarrow 0^+} \frac{1}{vol(D_\epsilon)} \iint_{S_\epsilon} \boldsymbol{F\cdot\hat{N}} dS = \nabla\cdot\boldsymbol{F}(P_0)$$ My Problem: So the proof given by Adams starts out by stating the divergence theorem and dividing both sides of the equation by the volume of the domain. Some algebraic manipulation brings me to this point. $$\begin{array}{lcr} \left|\frac{1}{vol(D_\epsilon)} \iint_{S_\epsilon}\boldsymbol{F\cdot\hat{N}}\, dS - \nabla\cdot\boldsymbol{F}(P_0)\right| & \leq &\frac{1}{vol(D_\epsilon)} \iiint_{D_\epsilon}\left|\nabla\cdot\boldsymbol{F}-\nabla\cdot\boldsymbol{F}(P_0)\right|dV \\& \leq & \max\limits_{P\in D_\epsilon} \left|\nabla\cdot\boldsymbol{F}-\nabla\cdot\boldsymbol{F}(P_0)\right|\end{array}$$ Now the first line seems to result from some algebraic manipulation and application of the triangle inequality, but the jump to the second line baffles me. (Hopefully i'm not overlooking something that's painfully obvious) Ps. cannot figure out how to get the expression on the second line to align properly.",['multivariable-calculus']
657305,Is it a peculiar solution?,"Given the differential equation : $y'=\sin(x+y)$ I found for $x+y \neq 2k\pi-\frac{\pi}{2},k\in \mathbb{Z}$: $\frac{-2}{\tan\left(\frac{x+y}{2}\right)+1}=x+c$..But...what's with $y=-x+ 2k\pi-\frac{\pi}{2},k\in \mathbb{Z}$ Is it a peculiar solution?",['ordinary-differential-equations']
657312,What is your favorite group? [closed],"Closed . This question is opinion-based . It is not currently accepting answers. Want to improve this question? Update the question so it can be answered with facts and citations by editing this post . Closed 10 years ago . Improve this question I would like to know about your favorite group(s). Since groups do appear everywhere in mathematics and there are plenty of them, which ones have drawn your attention the most or surprised you? Please not just name the group, but also provide some facts about it why you find this one particularly interesting. I'll start by mentioning Grigorchuks group . 
Because is was the first group i encountered, wich is finitely generated but not finitely presented. Also it was the first group discovered with intermediate growth. It has a lot of ""strange"" properties like: it's infinite but residually finite it's amenable but not elementary amenable every proper quotient group is finite every maximal subgroup has finite index Also Grigorchuks group acts as a key-counterexample in infinite group theory. My professor once told me: ""If you have a conjecture about infinite groups, try it one Grigorchuks group. If it holds, it might be worth trying to prove it."" edit: flagged for community wiki.","['examples-counterexamples', 'group-theory', 'big-list']"
657322,Ideal of variety in polynomial ring,"Let $k$ be a field, let $A$ be an ideal of $k[x_1,\ldots,x_n]$, and let $B$ be an ideal of elements $f\in k[x_1,\ldots,x_n]$ such that $f^n\in A$ for some $n$. I want to show that $B\subseteq I(V(A))$. This means showing that for any polynomial $f\in B$, we have $f(a_1,a_2,\ldots,a_n)=0$ for all $(a_1,\ldots,a_n)\in V(A)$. How to show this?","['ideals', 'algebraic-geometry']"
657380,Application of maximum modulus principle,"Let $f$ be a non-constant holomorphic(analytic) function in the unit disc$\{|z|<1\}$ such that $f(0)=1$
then it is necessary that $(1)$ there are infinitely many points $z$ in the unit disc such that $|f(z)|=1 $ $(2)\  f$ is bounded $(3)$ there are at most finitely many points in the unit disc such that $|f(z)|=1$ $(4)$ $f$ is rational function. I tried the if (2)is true then and it is given that $f$ analytic then it will be constant.Am I right? How to disprove of prove other option($\textbf{ Here answer is unique}$).please help me.thanks in advance.","['complex-numbers', 'complex-analysis']"
657389,"is there a nicer way to $\int e^{2x} \sin x\, dx$?","I have to solve this: $\int e^{2x} \sin x\, dx$ I managed to do it like this: let $\space u_1 = \sin x \space$ and let $\space \dfrac{dv}{dx}_1 = e^{2x}$ $\therefore \dfrac{du}{dx}_1 = \cos x \space $ and $\space v_1 = \frac{1}{2}e^{2x}$ If I substitute these values into the general equation: $\int u\dfrac{dv}{dx}dx = uv - \int v \dfrac{du}{dx}dx$ I get: $\int e^{2x} \sin x dx =  \frac{1}{2}e^{2x}\sin x - \frac{1}{2}\int e^{2x}\cos x\, dx$ Now I once again do integration by parts and say: let $u_2 = \cos x$ and let $\dfrac{dv}{dx}_2 = e^{2x}$ $\therefore \dfrac{du}{dx}_2 = -\sin x$ and $v_2 = \frac{1}{2}e^{2x}$ If I once again substitute these values into the general equation I get: $\int e^{2x}\sin x dx =\frac{1}{2}e^{2x}\sin x - \frac{1}{4}e^{2x}\cos x - \frac{1}{4}\int e^{2x}\sin x dx$ $\therefore \int e^{2x}\sin x dx = \frac{4}{5}(\frac{1}{2}e^{2x}\sin x - 
\frac{1}{4}e^{2x}\cos x) + C$ $\therefore \int e^{2x}\sin x\, dx = \frac{2}{5}e^{2x}\sin x - \frac{1}{5}e^{2x}\cos x + C$ I was just wondering whether there was a nicer and more efficient way to solve this? Thank you :)","['calculus', 'integration', 'indefinite-integrals']"
657472,Help to clarify proof of Euler's Theorem on homogenous equations,"Why is the last step (setting $\lambda = 1$ allowed? I have trouble accepting this because if I set $\lambda =1 $ at the very start, then: $f(\lambda x , \lambda y)=\lambda^r f(x,y)$ becomes $f(x,y) = f(x,y)$ and so I can't prove the theorem. Why does setting $\lambda = 1$ at the end of the proof work? EDIT For example, let $f(x,y)=x^2y^2$ Therefore, $f(x,y)$ is homogeneous of degree 4. Therefore, the second to last step will be: $4x^2y^2=4\lambda^3x^2y^2$ The above equation is only true if $\lambda=1$ Why doesn't the theorem make a qualification that $\lambda$ must be equal to 1? It seems to me that this theorem is saying that there is a special relationship between the derivatives of a homogenous function and its degree but this relationship holds only when $\lambda=1$. Please correct me if my observation is wrong.","['calculus', 'proof-writing']"
657474,Categorical viewpoint of $k[x]^\ast\cong k[[x]]$,"An exam question which I have found on the internet asks for a ""categorical"" explanation of $k[x]^\ast\cong k[[x]]$. Could someone help me here? Maybe we have some functorial isomorphism but I don't see how, after all the dual space functor is contravariant.","['category-theory', 'abstract-algebra']"
657496,Curve Selection Conjecture,"I have the following conjecture which I cannot seem to settle either way: Let $f:[0,1]\to\mathbb R^2$ be a differentiable function such that $f(0)=(0,0)$.
Then there exists a continuous function $g:[0,1]\to\mathbb R^2$ such that: 1) $g(0)=(0,0)$ 2) $g([0,1])\cap f([0,1])=\{(0,0)\}$. 3) $g$ is not a constant function. (Thanks to user68061 for pointing this out.) Basically what I am trying to prove is that if we have a differentiable curve in $\mathbb R^2$ which passes through origin then we can find a continuous curve in $\mathbb R^2$ which intersects the given curve only at origin. Does anybody know if this is an already known result or if there exists a counterexample? Thanks in advance for your help.",['real-analysis']
657504,How would I calculate the better performance based on percentages?,"I've been looking at how the characteristics of web content relate to the number of views it receives. I looked at the percentage of content with that characteristic, and then the percentage of views on that content. For example - 16% of pages are in format X - but receive 12% of pageviews 1% of pages are in format Y - but receive 2% of pageviews ...and so on. So in simple terms we can see that Y is better than X, despite having a lower number of pageviews overall. But I'm struggling with best way to present that - can I say that Y is _% better than X and how would I make that calculation? Thanks,",['statistics']
657506,Has anyone noticed this pattern?,"I've been messing around a bit and I noticed a curious pattern when it comes to progressions of powers. Let's take the progression of consecutive integers: $1,2,3,4,5,6,7,...$ Obviously it's an arithmetic progression with a common distance of 1. And obviously 1 = 1! So what if we take the progression of the squares of the above sequence? $1^2,2^2,3^2,4^2,5^2,6^2,7^2,.. =  1, 4, 9, 16, 25, 36, 49,...
$ we notice that the distances between the numbers are $3,5,7,9,11,13,...$ which is an arithmetic progression with a common distance of 2. Take note that 2 = 2! Now if we do the following for the cubes: $1^3,2^3,3^3,4^3,5^3,6^3,7^3,...=1, 8, 27, 64, 125, 216, 343,...$ we notice that the distances between the numbers are $7, 19, 37, 61, 91, 127,...$ At the first look there doesn't seem to be a pattern here however if we take
the distances of the distances we get: $12, 18, 24, 30, 36,...$ which as before we notice that it is an arithmetic progression with a common distance of 6. Take note that 6 = 3! Now let's take the progression of the numbers raised in the power of 4: $1^4,2^4,3^4,4^4,5^4,6^4,7^4,...=1, 16, 81, 256, 625, 1296, 2401,...$ As before we take the distances: $ 15, 65, 175, 369, 671, 1105,...$ then the distances of the distances: $  50, 110, 194, 302, 434,... $ and finally the distances of the distances of the distances: $ 60, 84, 108, 132,...$ We notice again that it's an arithmetic progression with a common distance of 24. Take note that 24 = 4! I am not sure if this pattern has been observed but it looks promising, especially for series formulas.","['elementary-number-theory', 'sequences-and-series', 'pattern-recognition']"
657515,How many solution of a equations?,"I have the following question: Let $n$ and $k$ be integers with $n \geq k$. How many solutions are 
there to the equation 
$$ x_1 + x_2 + \cdots + x_k = n $$
where $x_1, x_2, x_k$ are 
integers $\geq 1$? Now I know the total number of solutions is $\binom{n+k-1}{k-1}$ but thats when $x_1 \geq 0$, $x_2 \geq 0$, $\ldots$, $x_k \geq 0$ How do I find it with the restriction?","['discrete-mathematics', 'combinatorics']"
