question_id,title,body,tags
837521,Jutifying: irrational + rational = irrational,I am not sure how to show this. This is what I tried. Proposition: If x is rational number and y is an irrational number then x+y is an irrational number. Logically speaking this is P=x is rational Q= Y is irrational R= x+y is irrational $P\wedge Q \rightarrow R$ Explanation: What I did $x=\frac{p}{q}$ P and Q integer Y cannot be written as the a rational by definition So therefore $x+y=\frac{p}{q}+y$ Will not be a rational number as there cannot be a common denominator.,"['elementary-number-theory', 'algebra-precalculus']"
837543,Independence of Random Variables and Distribution Functions,"Let $X_1, X_2,\ldots$ be random variables on $(\Omega, \mathcal{A}, \mathbb{P})$. If $\mathbb{P}(X_1 \leq x, X_2 \leq y)=\mathbb{P}(X_1 \leq x)\mathbb{P}(X_2 \leq y)$ for all $x,y \in \mathbb{R}$. Show that $X_1$ and $X_2$ are independent. Really struggling as how to do this inclusion. This may help:","['probability-theory', 'measure-theory', 'probability']"
837544,Proof of trigonometric identity $\frac{\cos x+i\sin x+1}{\cos x+i\sin x-1}= -\frac{i}{\tan \frac{x}{2}}$,"I was given a task of proving the following identity: $$\frac{\cos x+i\sin x+1}{\cos x+i\sin x-1}= -\frac{i}{\tan \frac{x}{2}}$$ I am not looking for a solution, just some kind of a hint to start off. Thanks.","['trigonometry', 'complex-numbers']"
837562,Why is the multiplicative group of a finite field cyclic? [duplicate],"This question already has answers here : Finite subgroups of the multiplicative group of a field are cyclic (7 answers) Closed 10 years ago . Why is the multiplicative group $(K\smallsetminus\{0\},\cdot)$ of a finite field $(K,+,\cdot)$ always cyclic?","['finite-fields', 'abstract-algebra']"
837565,Prove $\frac{a}{a+bc}+\frac{b}{b+cd}+\frac{c}{c+da}+\frac{d}{d+ab}\ge 2$ for positives $\sum a = 4$,"Question: Let $$a,b,c,d>0,a+b+c+d=4$$ show that $$\dfrac{a}{a+bc}+\dfrac{b}{b+cd}+\dfrac{c}{c+da}+\dfrac{d}{d+ab}\ge 2$$ when I solved this problem, I have see following three variables inequality: Assumming that $a,b,c>0,a+b+c=3$ , show that : $$f(a,b,c)=\dfrac{a}{a+bc}+\dfrac{b}{b+ca}+\dfrac{c}{c+ab}\ge\dfrac{3}{2}$$ solution can see: inequality I found this three answer all is not true , 1、such as  dear @Macavity, in fact $$\sum_{cyc}\dfrac{a^2}{a^2+abc}\ge\dfrac{16}{\sum_{cyc}(a^2+abc)}$$ the Right not $\dfrac{16}{4+\sum_{cyc}abc}$ 2、and the @ante.ceperic is also not true.in fact $$a^2+b^2+c^2+d^2+abc+bcd+cda+dab\le 8$$ is not true with $a+b+c+d=4$ such let $a=3$","['inequality', 'buffalo-way', 'algebra-precalculus', 'substitution']"
837568,f is measurable iff its coordinate functions are measurable,I am really struggling to connect the sets in $\mathcal{B}(\mathbb{R^n})$ and $\mathcal{B}(\mathbb{R})$. Both inclusions are causing me problems. This questions seems a lot harder than it looks.,"['measure-theory', 'functions']"
837588,Infinite Perfect power of numbers in a certain form,"A question I found very interesting , which I found written on a blackboard while visiting a near by community science center is as follows. Prove that there exist infinitely many $m,n,k$ for which $1^k+2^k+3^k \cdots +n^k$ is a perfect $m$ power. I have been trying this from many days but I am unable to make out how to do it . I got one thing that $1^k+2^k+3^k \cdots +n^k | \; n+1$ but I don't thing this would help.","['exponentiation', 'perfect-powers', 'sequences-and-series', 'number-theory']"
837593,Solve trigonometric equation $\sin14x - \sin12x + 8\sin x - \cos13x= 4$,"I am trying to solve the trigonometric equation $$ \sin14x - \sin12x + 8\sin x - \cos13x= 4 $$ The exact task is to find the number of real solutions for this equation on the range $[0, 2\pi]$. Thanks.",['trigonometry']
837594,Find a closed expression for a formula including summation,"Let: $$\sum\limits_{k = 0}^n {k\left( {\matrix{
   n  \cr 
   k  \cr 
 } } \right)}  \cdot {4^{k - 1}} \cdot {3^{n - k}}$$ Find a closed formula (without summation). I think I should define this as a ""series"" which generated by $F(x)$. I don't really have a lead here. Any ideas? Thanks.","['closed-form', 'sequences-and-series', 'calculus', 'algebra-precalculus', 'discrete-mathematics']"
837634,calculate $\int_{0}^{\pi} \int_{0}^{x}\log(\sin(x-y))dydx$,"I was asked to find the integral $\iint_A \log(\sin(x-y))dxdy$ where $A$ is the triangle $y=0, x=\pi, y=x$ in the first quadrant. I was given a hint: evaluate $\int_{0}^{\pi}\log(\sin(t))dt$ using symmetry. What I did: I inferred from the hint that the variable change $t=x-y$ is the way to go, so $t=x-y$, 
and since we integrate by $y$ first, then $x$ is a ""constant"" and $dt=-dy$, and since $y$ transitions from $0$ to $x$, then $t$ transitions from $x$ to $0$, so we can rewrite the integral: $$\int_{0}^{\pi} \int_{0}^{x}\log(\sin(x-y))dydx=\int_{0}^{\pi}\int_{x}^{0}-\log(\sin( t))dtdx=\int_{0}^{\pi}\int_{0}^{x}\log(\sin( t))dtdx$$ And here I am stuck. Firstly, I don't know how $\int_{0}^{\pi}\log(\sin(t))dt$ is related to the question, since in the question the limits are $0$ and $x$. not $0$ and $\pi$. They are not the same thing (even though $x$ transitions from $0$ to $\pi$). But even if I did, how would I evaluate $\int_{0}^{\pi}\log(\sin(t))dt$??","['definite-integrals', 'multivariable-calculus', 'logarithms', 'integration']"
837688,"Estimate the arc length of the graph of a particular $\mathcal{C}^1$ function from $[0,1]\to [0,1]$.","Let $f:[0,1]\to[0,1]$ be $\mathcal{C}^1$ such that $f(0) = f(1) = 0$ and $f'$ is nonincreasing ( $f$ concave). Show that the arc length of the graph is smaller than 3. I have a rather geometric proof. For any $P$ be any (finite) partition of $[0,1]$ , then $$\Lambda(P,(x,f(x)))$$ is nothing but the sum of length of finitely many polygon arcs. Using mean value theorem we can show that these arcs are convex. By certain argument we can show that sum of the lengths of these polygon arcs are always smaller than sum of the boundary three sides, which is 3. Since this is true for any $P$ and $$\Gamma((x,f(x)) = \sup_P\Gamma(P,(x,f(x)))\le 3.$$ We are done. I want to know a purely analytic proof, which just estimates $$\Gamma((x,f(x)) = \int_0^1 \sqrt{1+f'(x)^2}dx$$ using the information given.","['integration', 'real-analysis', 'analysis']"
837702,Artin-Schreier Question from Corps Locaux,"I have a question from Serre's book ""Corps Locaux"", namely question 5a in section 2 of chapter IV. It is as follows: ""Let $e_K$ be the absolute ramification index of K, and let n be a positive integer prime to p and (strictly) less than $pe_K/(p-1)$; let y be an element of valuation -n. Show that the Artin-Schreier equation $x^p - x =y$ is irreducible over K, and defines an extension L/K which is cyclic of degree p. (Show that if x is a root of this equation, then the other roots have the form $x + z_i$ $(0 \leq i < p$, with $z_i \in A_K$, and $z_i \equiv i \mod{\mathbb{p_L}}$."" Here $K$ is characteristic 0, its residue field has positive characteristic p, and $K$ is a complete local field. I'm struggling with the last part, namely showing the roots have the given form. Right now, as $(n,p)=1$, if $x$ is any root then $val(x^p) = -n$, which forces any root to not be within $K$. If I can show that in the extension of $K$ generated by $x$ I can write all other roots in the desired form, this will mean $K(x)$ is the splitting field and the Galois group will act transitively on the roots, whence the result. Could I be pointed in the right direction? Thanks, Garnet","['local-field', 'number-theory']"
837727,"Check my proof $\int_{-\infty}^{\infty} \int_{-\infty}^{\infty} \sin(x^2+y^2) \, dx \, dy$ diverges","I am trying to prove that $\int_{-\infty}^{\infty} \int_{-\infty}^{\infty} \sin(x^2+y^2)\, dx\,dy$ diverges and I did it like this: $x=r\cos \theta$, $y=r\sin\theta$, $\theta \in [0,2\pi]$, $r\in [0,\infty]$, and the jacobian is $r$: $$\int_{-\infty}^\infty \int_{-\infty}^\infty \sin(x^2+y^2) \, dx \, dy=\int_0^{2\pi}\int_{0}^\infty r\sin(r^2) \, dr \, d\theta = 2\pi \int_0^\infty r\sin(r^2) \, dr$$ Use the variable change $v=r^2$, $dv=2r \, dr$ and so: $$2\pi \int_0^\infty r\sin(r^2)\,dr = 2\pi \int_{0}^{\infty}r\sin(v)\,\frac{dv}{2r}=\pi \int_0^\infty \sin(v) \, dv $$ I checked wolfram, and it says that $\int_0^\infty \sin(x) \, dx$ diverges, so I must conclude that the original integral diverges as well. But how do I actually prove that $\int_0^\infty \sin(x)\,dx$ diverges?","['multivariable-calculus', 'improper-integrals', 'calculus', 'integration']"
837736,Proof behind $S^n\cong SO(n+1)/SO(n)$,"I have been trying to understand the fact that $S^n \cong SO(n+1)/SO(n)$. I believe I have the intuition correct at this point; consider the case when $n=2$ as we have $S^2 \cong SO(3)/SO(2)$.: We are trying to find the correspondence between rotations in $\mathbb{R}^3$ and points on $S^2$. At first I incorrectly thought that these spaces were isomorphic, however one then realizes that there are more rotations than points on a sphere, in the following sense: Consider the point $p$ at the ""north pole"" of the sphere $S^2$. We can correspond $p$ with any point on the sphere by rotating the sphere, that is, by applying elements on $SO(3)$ so that $p$ ends up at any place upon it. However, we can first apply any rotation around the $z$-axis (through $p$). So, by ""modding out"" these rotations, which are exactly the elements of $SO(2)$, we have our isomorphism. I am looking for someone to help me formalize this into a proof. Thank you!","['differential-geometry', 'linear-algebra', 'abstract-algebra']"
837748,What's wrong $\sin(2\theta) = \cos\theta$,"When solving $\sin(2\theta) = \cos\theta$ for $\theta$ for all values in the range $[0,2\pi]$ I only get half of the solutions when I reduce $\sin(2\theta) = \cos\theta$ to $\sin\theta = \frac{1}{2}$. So before reducing the equation the solutions are $\frac{\pi}{6}, \frac{\pi}{2}, \frac{5\pi}{6}, \frac{3\pi}{2}$ and after reducing the equation the solutions are only $\frac{\pi}{6}, \frac{5\pi}{6}$ I can see how it reduces the solution set, but I want to know 'why' it happens. How can you know exactly when you're reducing the solution set of an equation when you're reducing the equation itself to a simpler form, especially when it's a big complicated equation when you can't easily see that you're reducing the solution set as in this case? Is there some information regarding that or am I asking the wrong question?","['trigonometry', 'solution-verification']"
837768,"Bayes, two tests in a row","I came up with a standard Bayesian example as to point out my confusion. There is an epidemic. A person has a probability $\frac{1}{100}$ to have the disease. The authorities decide to test the population, but the test is not completely reliable: the test generally gives $\frac{1}{110}$ people a positive result but given that you have the disease the probability of getting a positive result is $\frac{80}{100}$. I am interested in what happens after a person takes another test, specifically how much more information we would gain. Probability after one test Let $D$ denote the event of having the disease, let $T$ denote event of a positive outcome of a test. If we are interested in finding $P(D|T)$ then we can just go and apply Bayes rule: $$ P(D|T) = \frac{P(T|D)P(D)}{P(T)} = \frac{0.8 \times 0.01}{0.009} = 0.88 $$ This feels about right. Probability after two tests This is where I think I misunderstand Bayes rule somewhat. Let $TT$ denote the outcome of two positive tests. We are now interested in calculating; $$ P(D|TT) = \frac{P(TT|D)P(D)}{P(TT)} $$ The prior $P(D)$ is still $\frac{1}{100}$. $P(TT|D)$ would now be $0.8 \times 0.8$ because the two test can be assumed to be independent. But I seem to not know how to deal with $P(TT)$ ... it cannot be $\frac{1}{110} \times \frac{1}{110}$ because then; $$ \frac{P(TT|D)P(D)}{P(TT)} = \frac{0.64 \times 0.01}{0.009^2} > 1 $$ What is the right approach to the two-test Bayesian case?","['bayesian', 'probability']"
837791,Derived Subgroup and Factor Groups,"Let $N \unlhd G$, does it holds that $(G/N)' = G'N /N$, or more generally for any subgroup $H \le G$ we have $(HN/N)' = H'N/N$? Does anyone has a proof of this fact? PS: Side-Question: Is it wrong to write $(G/N)' = G'/N$?","['finite-groups', 'group-theory', 'abstract-algebra']"
837797,Volume of a cone in an $n$-dimensional ball,"Assume that $B$ is an $n$-dimensional ball of radius $R$ centered at the origin, i.e., $B=\{x\in\mathbb{R}^n : \|x\|\leq R\}$. Fix a point $x_0$ in $B$ and $\delta \in (0,\pi)$, and let $C$ be the following set $C=\{x\in B : $ The angle between the vectors $ \vec{x_0} $ and $ \vec{x} $ is less than or euqal to $ \delta.\}$ My question is, how can we compute the $n$-dimensional measure of the set $C$ in terms of $R$ and $\delta$. Is it simply going to be $K\delta R^n$ for some constant $K$? Or is it more complicated than that? The answer for the case $n=2$ is clearly $ \delta R^2 $.","['geometry', 'measure-theory', 'vector-analysis']"
837803,A confusing vector field differential,"In my notes on theoretical mechanics, I wrote that my professor stated this vector identity: $$\mathrm{d}\mathbf{P}(\mathbf{r})=[\nabla\cdot\mathbf{P}(\mathbf{r})] \mathbf{dr} + [\nabla\times\mathbf{P}(\mathbf{r})]\times\mathbf{dr}$$ Here, $\mathbf{P}(\mathbf{r})$ stands for the vector field depending only on the position vector $\mathbf{r}$. In other words, it's a vector-valued function of a vector in $\mathbb{R}^3$. The thing is, I didn't manage to write down what the importance was, although I think it had something to do with separating parallel and perpendicular differential vectors. I tried to find something like this on the Internet and I also tried to show it, but I'm afraid I can't find an elegant way to show this and I don't think I'll gain anything by mechanically grinding it out. What is the significance of this identity? Is there a simple way to prove it?","['multivariable-calculus', 'vector-analysis']"
837821,Unique fixed point of a contraction defined on a closed ball which maps the boundary back into the ball,"Let $X$ be a Banach space, $r > 0$, $A: K_r(X) \rightarrow X$ a contraction (where $K_r(X)$ is the closed ball of radius $r$ and center $0$ in $X$), with contraction constant $0<q<1$, which also fulfills $A(S_r(X)) \subseteq K_r(X)$ (where $S_r(X)$ is the boundary of $K_r(X)$). Then there exists a unique fixed point of $A$ in $K_r(X)$.","['fixed-point-theorems', 'functional-analysis']"
837832,Is the norm of the Hilbert matrix equal to $\pi$?,"Let $A$ be a Hilbert matrix, $$a_{ij}=\frac{1}{1+i+j}$$ We have the result $\| A \| \leq \pi$. I am using the subordinate norm of the Euclidean norm, i.e., $$\| A \| = \sup\{\langle Ax,y\rangle:\quad x,y\in\mathbb{R}^n,\quad\Vert x\Vert_2\leq 1,\quad\Vert y\Vert_2\leq 1\}$$ This inequality can be proved using Hilbert's Inequality . Look here . Question: Do we have an equality? I found nothing on the Internet about such equality.","['matrices', 'normed-spaces', 'linear-algebra', 'hilbert-matrices']"
837839,"simple way to show $|| \partial_x \int_{B(x,\epsilon)} \frac{x-y}{|x-y|^3} f(y) dy||_{\infty} = O(||f||_{\infty})$ in $\mathbb{R}^3$","We are set in $\mathbb{R}^3$. Let $f: \mathbb{R}^3 \rightarrow \mathbb{R}$ be a $C^1_0$ function, i.e. continuously differentiable with compact support. Let $\epsilon > 0$ be small. I need to show that the derivative 
$$ || \partial_x [\int_{B(x,\epsilon)} \frac{x-y}{|x-y|^3}  f(y)dy] ||_{\infty}$$ 
of this integral function exists and can be bounded from above by a constant times $||f||_{\infty}$ for $\epsilon \rightarrow 0$. We can take any $\infty$ norm we want for the derivative, we're differentiating a function $\mathbb{R}^3 \rightarrow \mathbb{R}^3$ so the derivative is a matrix, but we can take for example supremum over its entries, so 
$$ \max_{i \in \{1,2,3\}} | \partial_{x_i} [\int_{B(x,\epsilon)} \frac{x_1 - y_1}{|x-y|^3}  f(y)dy] |$$
for example (or something else if it's easier, but I guess it shouldn't differ much). I want to show that this quantity can be bounded from above by $C ||f||_{\infty}$ with $\epsilon \rightarrow 0$. I can't just push the derivative in and say that $\partial_x \frac{x-y}{|x-y|^3} \approx |x-y|^{-3}$ because that won't let me conclude - $|x-y|^{-3}$ is not integrable around $0$ in $\mathbb{R}^3$. I was thinking about pushing the derivative inside and computing explicitly using spherical coordiantes but there are two issues: first it seems really cumbersome and I'd rather avoid it and use simpler arguments if possible and second - I'd still have to argue why I can push the derivative inside. Any suggestions are welcome. edit: when I think about it I imagine an actual difference quotient when I consider two sphere centered at $x$ and $x +h$ and I guess that I could take care of the overlapping part by 'pairing up' the points with factors $f(y)$ and $f(y+h)$, taking supremum of $\nabla f$ and integrating - that would go to $0$ with $\epsilon \rightarrow 0$ and I expect that the parts that I wouldn't get to pair up with anything will have measure suffiently small (so that the integrals are comparable with $|h|$) so that I can use the  $||f||_{\infty}$ bound there but I'm having a hard time writing it down Edit : my more precise although still incomplete try. I show how to bound the derivative assuming it exists: ok, after all it seems to be not that difficult, which gets me a bit worried so it would be great if someone could point out a mistake I might've made. I guess the only tricky part is showing that the function is indeed differentiable - if we knew that it would suffice to show that 
$$ \frac{1}{|h|} | \int_{B(x,\epsilon)} \frac{x-y}{|x-y|^3} f(y) dy - \int_{B(x + h,\epsilon)} \frac{x+h-y}{|x+h-y|^3} f(y) dy| \leq C \epsilon$$
for some constant $C$. a change of variables $y = y-h$ in the second integral gives
$$ \frac{1}{|h|} | \int_{B(x,\epsilon)} \frac{x-y}{|x-y|^3} f(y) dy - \int_{B(x,\epsilon)} \frac{x-y}{|x-y|^3} f(y+h) dy|$$
i.e.
$$  | \int_{B(x,\epsilon)} \frac{x-y}{|x-y|^3} \frac{f(y) - f(y+h)}{|h|} dy | \leq \int_{B(x,\epsilon)} \frac{1}{|x-y|^2} ||\nabla f||_{\infty} dy \leq C ||\nabla f||_{\infty} \epsilon$$ 
because $\int_{B(x,\epsilon)} \frac{1}{|x-y|^2} = C \epsilon$, hence the whole thing goes to $0$ with $\epsilon$. Nevertheless we still need to know that it is differentiable however, the paper I'm reading clearly states that we bound it by a constant times $||f||_{\infty}$ which confuses me since if I knew it was differentiable I could say it tends to $0$ with $\epsilon$ and if I don't know whether it's differentiable then I can't really talk about bounding the derivative edit2 : ok, I see where I went wrong - I got the wrong area of integration after my change of variables. I still believe though that if I knew the derivative exists I could replace the second (wrong) integral 
$$
\int_{B(x,\epsilon)} \frac{x-y}{|x-y|^3} f(y+h) dy| $$
with $$ \int_{B(x,\epsilon - 2|h|)} \frac{x-y}{|x-y|^3} f(y+h) dy|$$ plus some remainder which would then lead to a bound involving $||f||_{\infty}$ but we need differentiability to do that anyway.","['derivatives', 'integration', 'real-analysis', 'analysis']"
837849,Torsion-free but not free,"The question is asking me to give an example of a finitely generated $R$-module that is torsion-free but not free. I remember in lecture, lecturer say something about the ideal $(2,X)$ in $\mathbb{Z}[X]$considered as a $\mathbb{Z}[X]$-module is torsion-free but not free. But I don't know why, what I know about these guys are: $(2,X)$ is the ideal that contain all polynomial with even constant $(2,X)$ is not principle ideal, so $\mathbb{Z}[X]$ is not a PID I am not sure will these facts help to answer to question.","['modules', 'abstract-algebra']"
837853,Serre's Modularity Conjecture -- Weight,"I was reading Serre's paper ""Sur les Représentations Modulaires de Degré $2$ de Gal($\bar{\mathbb{Q}}/\mathbb{Q}$)"" where he states his modularity conjecture (which is now a theorem). Following his notation, let $G_p$ be the absolute Galois group of $\mathbb{Q}_p$, $I$ the (absolute) inertia group and $I_p$ the wild inertia group. In order to define the weight $k$ attached to a Galois representation it is only needed to look locally at $p$, so consider a continuous representation 
\begin{equation*}
\rho_p:G_p\longrightarrow \mathbf{GL}_2(\bar{\mathbb{F}}_p)
\end{equation*} Now the paper splits into several cases. The one I am looking at is in page $186$ (of the Duke Mathematical Journal where it appeared) and corresponds to the case where $I_p$ does not act trivially and the restriction of the representation to $I$ is given by
\begin{equation*}
\rho_p|I=\begin{pmatrix}\chi^{\alpha+1} & *\\ 0 & \chi^{\alpha}\end{pmatrix}
\end{equation*}
for some $\alpha\in\{0,\ldots,p-2\}$, where $\chi$ is the cyclotomic character. It is clear that $\rho_p(I)$ is the Galois group of some totally ramified extension $K$ of $\mathbb{Q}_p^{nr}$ and that $\rho_p(I_p)$ is the Galois group of $K/K^{tr}$, where $K^{tr}$ is the maximal tamely ramified extension of $\mathbb{Q}_p^{nr}$ contained in $K$. My question is the following: a few lines down he asserts that by Kummer theory we can deduce that $K=K^{tr}(x_1^{1/p},\ldots,x_m^{1/p})$, with $x_i\in\mathbb{Q}_p^{nr}$. I can see, by Kummer theory, that $K$ is of this form for $x_i\in K^{tr}$. Why is it true that we can place these $x_i$ in $\mathbb{Q}_p^{nr}$? Thank you for your answers!","['number-theory', 'kummer-theory', 'algebraic-number-theory', 'modular-forms', 'galois-representations']"
837912,Geometry problem (Iran Olympiad),"Let $\triangle ABC$ be any triangle. Suppose the angle bisector of $\angle BAC$ intersects $BC$ at $D$. Let $\Gamma$ be a circle tangent to $BC$ at $D$ and so that $A$ belongs to the circumference of $\Gamma$. If $M$ is the (second) intersection point of $AC$ and $\Gamma$, and if $BM$ intersects $\Gamma$ at $P$, then prove that $AP$ must be a median of $\triangle ABD$. I need some help with this problem. It was taken from an Iran Math Olympiad (from 1999 I believe). I've mainly tried proving that $BD \over JD$$=2$ (here $J$ is $AP \cap BC$), by various methods. First, using power of points and the angle bisector theorem, no success. Then I've tried some angle chasing to find some similar triangles, just to find the same relations I had found using power of points...
Finally I went full trigonometry over it, but then again I was never quite good at trigonometry anyway, so I couldn't get very far. I would love some hints, because I'm pretty much stuck. Thanks in advance.","['geometry', 'contest-math']"
837948,Proving that a polynomial is not solvable by radicals.,"I'm trying to prove that the following polynomial is not solvable by radicals: $$p(x) = x^5 - 4x + 2 $$ First, by Eisenstein is irreducible. (It is not difficult to see that this polynomial has exactly 3 real roots) How can I proceed? Thank you!","['galois-theory', 'field-theory', 'abstract-algebra', 'polynomials']"
837986,Solving the Hamilton-Jacobi equation (Evans),"I can comprehend some but not all of the proofs. I do not understand how the limit definition of a derivative is derived in this context, and those are highlighted in $\color{#009900}{\text{green}}$. This is from PDE Evans, 2nd edition, pages 127-128. Theorem 5 (Solving the Hamilton-Jacobi equation). Suppose $x \in \mathbb{R}^n$, $t > 0$, and $u$ defined by the Hopf-Lax formula $$u(x,t)=\min_{y\in\mathbb{R}^n} \left\{tL\left(\frac{x-y}{t} \right) + g(y) \right\}$$ is differentiable at a point $(x,t) \in \mathbb{R}^n \times (0,\infty)$. Then $$u_t(x,t)+H(Du(x,t))=0.$$ Proof. 1.) Fix $v \in \mathbb{R}^n, h > 0$. Owing to Lemma 1, 
  \begin{align}
u(x+hv,t+h)&=\min_{y \in \mathbb{R}^n} \left\{ hL\left(\frac{x+hv-y} 
{h}\right)+u(y,t)\right\} \\
&\le hL(v)+u(x,t).
\end{align}
  Hence, $$\frac{u(x+hv,t+h)-u(x,t)}{h} \le L(v).$$
  Let $h \rightarrow 0^+$, to compute $$\underbrace{v \cdot Du(x,t)+u_t(x,t)}_{\color{#009900}{\text{How is this expression obtained?}}} \le L(v).$$
  This inequality is valid for all $v \in \mathbb{R}^n$, and so $$u_t(x,t)+H(Du(x,t))=u_t(x,t)+\max_{v \in \mathbb{R}^n} \{v \cdot Du(x,t)-L(v) \} \le 0. \tag{31}$$
  The first equality holds since $H = L^*:=\max_{v \in \mathbb{R}^n} \{v \cdot Du(x,t)-L(v) \}$, by convex duality of Hamiltonian and Lagrangian (page 121 of the book). 2.) Now chose $z$ such that $u(x,t)=tL(\frac{x-z}{t})+g(z)$. Fix $h > 0$ and set $s=t-h,y=\frac st x+(1- \frac st)z$. Then $\frac{x-z}{t}=\frac{y-z}{s}$, and thus
  \begin{align}
u(x,t)-u(y,s) &\ge tL\left(\frac{y-z}{s}  \right) + g(z) - \left[sL\left(\frac{y-z}{s} \right)+g(z) \right] \\ &= (t-s)L\left(\frac{y-z}{s} \right) \\ &=hL\left(\frac{y-z}{s} \right).
\end{align} 
  That is, $$\frac{u(x,t)-u((1-\frac ht)x+\frac htz,t-h)}{h} \ge L\left(\frac{x-z}{t} \right).$$ 
  Let $h \rightarrow 0^+$, to see that $$\underbrace{\frac{x-z}{t} \cdot Du(x,t)+u_t(x,t)}_{\color{#009900}{\text{How is the limit definition of derivative applied here exactly?}}} \ge L\left(\frac{x-z}{t} \right).$$ 
  Consequently, \begin{align}
u_t(x,t)+H(Du(x,t))&=u_t(x,t)+\max_{v\in\mathbb{R}^n} \{v \cdot Du(x,t)-L(v) \} \\
&\ge u_t(x,t)+\frac{x-z}{t} \cdot Du(x,t)-L\left(\frac{x-z}{t} \right) \\ &\ge 0
\end{align}
  This inequality and $\text{(31)}$ complete the proof.","['hamilton-jacobi-equation', 'partial-differential-equations', 'limits']"
