question_id,title,body,tags
837994,How to do this Sum? Poisson Resummation?,"In the paper hep-th/0812.2909 page 34-35, there's a sum that I've been trying to do explicitly but I can't find a way. The sum is $$
\frac{2l}{\pi l! (l-1)!} \sum_{k\in\mathbb{Z}} \sum_{n=0}^{\infty} e^{-i (2n+l+1)t+i k (\phi-t) } \frac{\Gamma(n+|k|+l+1)\Gamma(n+l+1)}{\Gamma(n+|k|+1)\Gamma(n+1)}=\frac{l^{2}/(2^{l}\pi)}{[\cos(t-i\epsilon)-\cos(\phi))]^{l+1}}
$$ In page 54 the authors need again to do a similar sum(it's actually the same), where they say you have to use something called ""Poisson Ressumation"" and ""sum over the images"". I tried to use what i found about Poisson ressumation, but I don't know how to Fourier transform a quotient between gammas, and even if I did, I understand it would turn the left hand side into another sum over integers. Thanks for your help! PS: I'm not a native speaker so forgive me if my English is a bit rusty.","['fourier-series', 'fourier-analysis', 'sequences-and-series']"
838006,Why do we consider measurable function when dealing with abstract integration?,"Let $[0,\infty]$ be equipped with the order topology. (That is, it is a subspace of the standard topology on the extended real) Let $(X,\mathfrak{M},\mu)$ be a measure space. Let $f:X\rightarrow [0,\infty]$ be a measurable function, which means that the inverse of each borel set of $[0,\infty]$ under $f$ is an element of $\mathfrak{M}$. In measure theory, we define it's integration as the supremum of $\sum_{x\in s(X)} x\mu(s^{-1}(x))$ where $s$ is a simple measurable fuction such that $s≦f$. The point is, the role of $\mu$ only acts on those simple functions $s$, not $f$ directly. What would go wrong if one defines integration for an arbitrary function $f$? That is, what's wrong with defining an integration of an arbitrary function $f$ as the supremum of $\sum_{x\in s(X)} x\mu(s^{-1}(x))$ over simple meadurable functions $s≦f$?","['measure-theory', 'real-analysis']"
838015,Definition of Percentile (undefined notation)?,"From Loss Models , 4th ed., by Klugman et al.: Definition 3.6 The $100p^{\text{th}}$ percentile of a random variable is any value $\pi_p$ such that $F\left(\pi_{p^{-}}\right) \leq p \leq F\left(\pi_{p}\right)$. I have no idea what $\pi_{p^{-}}$ is, and cannot find it defined earlier in the text. Does anyone know what this notation is? Note : I would prefer a rigorous definition, if available.","['statistics', 'probability', 'actuarial-science']"
838024,What is a Hyper-Sphere?,"I am interesting about the geometric properties of 3-D spheres and I know nothing about hyper-spheres. Please can you describe me, what is a hyper-sphere?",['multivariable-calculus']
838044,Measurable set indicator functions - need clarification on a book's statement,"A book I'm reading says the following about indicator functions $\chi_A$ : But unless I'm missing something, how can that that be? If $B$ is for example the set $(-2,2)$, $1 \in B$, but since $B$ contains both $0$ and $1$, $\chi_A^{-1}(B) = \{x \in A\} \cup \{x \not \in A\} = S \neq A$.  Similarly, if $B$ is, say, the set $(-1, 0.5)$, then even though $1 \not \in B$, $\chi_A^{-1}(B)= \{x \not \in A\} \neq \{\emptyset\}$.","['measure-theory', 'elementary-set-theory']"
838052,Evaluate $\int_{0}^1 \prod_{k=2}^n \lfloor kx \rfloor dx$,"Let $n\ge2$ be an integer , then $$\int_{0}^1 \prod_{k=2}^n \lfloor kx \rfloor dx=\text{ ?}, $$  where $\lfloor \space \rfloor$ is the ""floor-function""","['elementary-number-theory', 'closed-form', 'calculus', 'definite-integrals']"
838062,Application of Christoffel symbol in differential geometry,"When self-studying differential geometry, I find my book involves some clumsy, troublesome calculation about Christoffel symbol when proving theorem, which in fact doesn't have the symbols. I wonder if the symbol is actually useful when for doing calculation stuff of understand concept. Can someone explain to me the role of Christoffel symbol? Is it really important? Do I really need to go through all of them?",['differential-geometry']
838064,Proof of $n^{th}$ derivative Test,"Proof needn't be a rigourous , but should give an insight of how $n^{th}$ derivative test (higher order derivative test) works as i know how to use it in application but i don't much understand it ,especially the inflexion point thing.",['derivatives']
838103,$ F(x) = \int_0^2 \sin(x+l)^2\ dl$,"Consider the function : $ F(x) =  \int_0^2 \sin(x+l)^2\ dl$, calculate $ \frac{dF(x)}{dx}|_{x=0}$ the derivative of $F(x)$ with respect to $x$ in zero. Let $g(x) = \sin (x)$ and $h(x) = (x+l)^2$ then $F(x) = \int_0^2 g(h(x))\ dl$, so $F´(x) = g(h(x)) h´(x)$  then I can evaluate this in $x=0$ , so $F´(0) = \sin{l^2} 2l $ is that correct? Some help to calculate this please.","['calculus', 'derivatives', 'real-analysis']"
838106,Resolution of Singularities: Base Point,"Consider the curve $y^2=4x^3-ax-b$, where $a$ is a fixed constant and $b$ is a free constant. For each value of $b$ we get a family of curves. Part 1: Show that the family of curves intersect at infinity (the base-point). My Solution: Using projective geometry (homogeneous coordinates), we have $x=u/w$, $y=v/w$, where $[x,y,1]=[u,v,w]\in\mathbb{CP}^2$. The equation of the level curves is $$\frac{v^2}{w^2}=4\frac{u^3}{w^3}-a\frac{u}{w}-b\qquad\Rightarrow\qquad v^2w=4u^3-auw^2-bw^3$$ For line at infinity, we let $w=0$ such that $0=4u^3\quad\Rightarrow\quad u=0$ Thus the base-point is $[0,1,0]$. Is this correct? Part 2: Resolve the base point through blow-ups. I do not know how to go about answering this question. Any help with Part 2 will be highly appreciated. I am relatively new to concepts such as homogeneous coordinates and blow-ups. Are there any recommended books for beginners on these concepts? Thanks.","['projective-space', 'blowup', 'algebraic-geometry', 'projective-geometry', 'reference-request']"
838107,What is the difference and relationship between the binomial and Bernoulli distributions?,How should I understand the difference or relationship between binomial and Bernoulli distribution?,"['statistics', 'probability', 'random-variables']"
838142,Markov chains by hand,"If I have a starting point: $A_T=[0,1]$ at $T=1$ and a one step transition matrix of:
$B=\left[ \begin{align} &\frac34 & \frac14& \\& \frac1{20}& \frac {19}{20} &\end{align} \right]$ I can compute $A_nB=A_{n+1}$
And keep reiterating this, but it is slow by hand, I assume there is a faster way? Would diagonalizing the matrix help somehow?","['statistics', 'matrices', 'markov-chains', 'probability']"
838208,Inequality in matroid theory,"Working on a proof in matroid theory I found there is a smooth map from an open set of $(\mathbb{C}^{\ast})^{(d−1)(n−d−1)}$ to a disjoint union of tori $(S^{1})^{\binom{n}{d}-n}.$ As a direct consequence of Borsuk-Ulam theorem, this leds to inequality: $$
\binom{n}{d}-n\geq2(d-1)(n-d-1)
$$ In order to apply Morse-Sard theorem (and deduce that the map I've built is not surjective), I'm interested in the proof of the strict inequality. Does someone help me? Here's the complete statement: Let $n\in\mathbb{N},$ $n\geq5$ and let $d\in\mathbb{N},$ $1<d<n-1.$ Then $$
 \binom{n}{d}-n>2(d-1)(n-d-1)
$$ $\textit{Note:}$ if you think also the (weak) inequality does not hold, please let me know. Perhaps there is a bad mistake in my work.","['inequality', 'discrete-mathematics', 'matroids', 'binomial-coefficients', 'combinatorics']"
838295,Limit of $\frac1n \sum\limits_{j=1}^n a_j$ if the series $\sum\limits_n \frac{a_n}{n}$ converges,"Suppose that $(a_n)$ is a sequence of real numbers such that 
series: $\sum_{n=1}^\infty \frac{a_n}{n}$ is convergent. 
 Show that the sequence: 
$$b_n=\frac{
\sum_{j=1}^n a_j}{n}$$ 
is convergent and find its limit. I try to solve it by Stolz theorem, but no  success. Source ( http://vjimc.osu.cz/hist/j16problems1.pdf )","['sequences-and-series', 'limits']"
838309,Truncated alternating binomial sum,"It is easily checked that
$\displaystyle\sum_{i\ =\ 0}^{n}\left(\, -1\,\right)^{i} \binom{n}{i} = 0$, for example by appealing to the binomial theorem. I'm trying to figure out what happens with the truncated sum
$\displaystyle\sum_{i\ =\ 0}^{D}\left(\, -1\,\right)^{i}\binom{n}{i}$. How far away from $0$ can this get, as a function of $D$ ?. I'm mostly interested in the case of when $D \ll n$, such as
$D \sim \,\sqrt{\,n\,}\,$. Thanks !","['summation', 'binomial-coefficients', 'combinatorics']"
838320,derivative with respect to a vector/matrix [duplicate],"This question already has answers here : Derivative of Quadratic Form (5 answers) Closed 12 months ago . please excuse the stupid question but I cant find anything online.. If $$f(\vec{x}) = \vec{x}^TA\vec{x}$$ with $A$ being a matrix, then 
$$ \frac{df}{d\vec{x}} = \vec{x}^T(A+A^T)$$
Can someone tell me why this is?
And I am also interested in knowing what the derivatives of the following termes are:
$$ \frac{d}{d\vec{x}}\vec{x}^T A, \qquad \frac{d}{d\vec{x}}A \vec{x}$$ as well as the derivatives with respect to a matrix H
$$ 
\frac{d}{dH}H A , \qquad \frac{d}{dH}A H^T$$ Many thanks for your help.","['matrix-calculus', 'vectors', 'derivatives']"
838326,3 random numbers to describe point on a sphere [duplicate],"This question already has answers here : How can I pick a random point on the surface of a sphere with equal distribution? (2 answers) Closed 10 years ago . I'm currently working on a problem involving computer graphics and got into a discussion about whatever or not constructing a 3d vector out of 3 random points uniformly distributed points between -1 and 1 (and then normalize the vector) to get points uniformly distributed over the surface of the sphere? Note that I'm a computer science student not a math student and as such might not be able to follow the really complex stuff. The other student said it would be better to instead pick 2 random points on a 2d plane and then warp those onto a sphere, however this to me seemed needlessly complex which one of us is right?","['geometry', 'random']"
838337,Understanding of the Regularity Condition in the definition of regular surfaces,"I am having some difficulty in understanding the meaning/motivation of the regularity condition in the definition of regular surfaces. The definition (restricted to $\mathbb{R}^2$ and $\mathbb{R}^3$): A subset $S \subset \mathbb{R}^3$ is a regular surface if for all $p \in S$, there exists a neighborhood $V$ in  $\mathbb{R}^3$ and a map ${\textbf x}: U \to V \cap S$ of an open set $U \subset \mathbb{R}^2$ onto $V \cap S \subset \mathbb{R}^3$  such that: ${\textbf x}$ is smooth. ${\textbf x}$ is a homemorphism. (Regularity Condition): for each $q \in U$, the differential $d{\textbf x}_q : \mathbb{R}^2 \to \mathbb{R}^3$ is one-to-one. Would appreciate any kind of assistance with it. Thanks.","['surfaces', 'smooth-manifolds', 'differential-geometry']"
838351,Identification of (Centers of) Cycles in a Discrete Time Dynamical System,"I am studying dynamics on nonlinear Discrete Time Dynamical System of the form $$
\vec{X}_{t+1} = D(\vec{X}_t),
$$ where D is some nonlinear function. I was looking for a (relatively) quick algorithm for numerically identifying fixed points and their stability, and found a helpful pdf that claims a system of equations with $F(\vec{X})=\vec{0}$ can be solved by minimizing $\sum_i F^2_i(\vec{X})$ using a Steepest Decent technique. So I set $F(\vec{X}^*)=D(\vec{X}^*)-\vec{X}^*$ and implemented an algorithm for minimization, and it seems to work well at finding fixed points. Stability analysis is as simple as checking that all the eigenvalues are within the unit circle. However, in some cases the system in question produces limit cycles. Since I am mostly experienced with Continuous Time Dynamical Systems I guessed by analogy that the minimum found by the steepest decent algorithm found the 'center' of the cycle. In retrospect, this seems exceedingly unlikely. My questions: 1.Is this intuition correct at least in some cases, i.e. can I expect some fixed point $\vec{X}_c$ that is the 'center' of the cycle? If so, in which cases? 2.If this is the case, can I identify it as a center (as opposed to some other stable or unstable fixed point) by the eigenvalues or by some other method? 3.If this is not the case, how can I identify cases in which the system cycles? Note that these cycles are way too large to permit checking for fixed points of iterations of the function. If theorems, books or other resources can be cited in the process, it would be doubly appreciated!","['dynamical-systems', 'fixed-point-theorems', 'discrete-mathematics']"
838363,Expectation of Geometic distribution,"I have the following question : It costs $30$ cents per day to keep pigeons. Let $N$ be the number of pigeons kept and suppose that $N$ has the geometric distribution $Pr(N=n) = \frac1{10} (\frac9{10})^n (n=0,1,\dots).$ Which yields $30*\frac{0.9}{0.1} = 270=\$2.7$ That is fine. Now I have the one I don't know how to solve : Now suppose that they cost $35$ cents per head except for the first three which remain at $30$ cents per head. What is the expected cost per day. I have tried numerous things but I can't get their answer, I don't want to type all of these up because my table pc is slow. I have tried taking the difference between the first three against expected for the new price $35 * 9$ and calculating them all. I have their solution but do not understand it: $=5(9-3 + \frac3{10} + \frac2{10}(\frac9{10}) + \frac1{10}(\frac9{10})^2) = \frac{6561}{200} = 32.805$","['statistics', 'probability']"
838369,Borel set approximation,"Suppose $\mu$ is a regular Borel measure on a space $X$. From regularity of $\mu$, every Borel set can be approximated from above by an open set. Can we approximate every Borel set from below by an open set (not a closed set). Any idea or comment .....","['measure-theory', 'lebesgue-measure']"
838400,How to show a group is cyclic?,One question asking if $\mathbb{Z}^*_{21}$ is cyclic. I know that the cyclic group must have a generator which can generate all of the elements within the group. But does this kind of question requires me to exhaustively find out a generator? Or is there any more efficient method to quickly determine if a group is a cyclic group?,"['group-theory', 'number-theory']"
838408,Proving Combinatorical Summation: $n!=\sum_{k=0}^n(-1)^k\binom{n}{k}(n-k)^n$ [duplicate],"This question already has answers here : Expressing a factorial as difference of powers: $\sum_{r=0}^{n}\binom{n}{r}(-1)^r(l-r)^n=n!$? (6 answers) Closed 10 years ago . been stuck with this question for the last few hours, any help would be appreciated. $$
{\large n! = \sum_{k = 0}^{n}\left(-1\right)^{k}{\,n\, \choose \,k\,}
\left(\,n - k\,\right)^{n}}
$$ what I did: $\sum_{k=0}^n(-1)^k\binom{n}{k}(n-k)^n=n!\sum_{k=0}^n\frac{(-1)^k(n-k)^n}{k!(n-k)!}.$ So we are left to prove $\sum_{k=0}^n\frac{(-1)^k(n-k)^n}{k!(n-k)!}=1$. tried doing so using induction, or treating the sum as geometric sequence (which turned out poorly) Suggestions?","['factorial', 'summation', 'binomial-coefficients', 'combinatorics']"
838426,Computing the spherical mean and showing it satisfies PDE,"Compute the spherical mean of the function $h : \mathbb R^3 \to \mathbb R$ with
$$
 h(x,y,z) = x
$$
and show that it satisfies the differential equation
$$
 u_{rr} + \frac{2}{r} u_r = u_{xx} + u_{yy} + u_{zz}
$$
(note that the spherical mean of a function is a function of some fixed point and a radius).","['ordinary-differential-equations', 'partial-differential-equations', 'analysis']"
838434,Proof of rigidity lemma,"I am trying to understand in full details the proof of rigidity lemma as proved here http://staff.science.uva.nl/~bmoonen/boek/DefBasEx.pdf [Lemma 1.11, Pag. 12]. The statement in this reference is Lemma Let $X$, $Y$ and $Z$ be algebraic varieties over a field $k$. Suppose that $X$
is complete. If $f : X × Y \rightarrow Z$ is a morphism with the property that, for some $y \in Y (k)$, the fibre $X \times_k \{y\}$ is mapped to a point $z \in Z(k)$ then $f$ factors through the projection $pr_Y : X \times_k Y → Y$. I will express what I am not understanding of the proof in the following questions. (Please, read the proof as in the link to understand the notation). Why we can reduce to the case $k=\bar{k}$? Why can we choose $x_0\in X(k)$, that is, why $X(k)$ is non-empty? What does it mean ""since $X\times_k Y$ is reduced it sufficies to prove it for $k$-rational points""? Why is this possible? Why $f$ is constant on $X\times_k \{P\}$? At the end they say: $f=g \circ pr_Y$ on the non-empy open set $X\times_k (Y-V)$. So $f=g \circ pr_Y$ everywhere because $X\times_k Y$ is irreducible. Why? For question (5) I would argue like this: since $X\times_k Y$ is irreducible, $X\times_k (Y-V)$ is a dense subset. Then by continuity $f=g \circ pr_Y$ everywhere. Is this argument correct? Any help is appreciated, thank you.",['algebraic-geometry']
838440,Explain the Birthday Paradox,"I recently read about the Birthday Paradox which states that in a group of 23 people, there's a probability of 50% that 2 people share their birthday, probability wise. I calculated and don't think it's possible that it's true in any case (unless my math is wrong). So, can anyone please tell me how to prove or disprove it mathematically ?","['birthday', 'probability', 'paradoxes']"
838497,Proof of Pasting Lemma,"I am trying to understand the proof of the Pasting Lemma. I have found several proofs but I am missing something from all of them. Wikipedia has: Statement : Let $X,Y$ be both closed (or both open) subsets of a topological space $A$ such that $A = X \cup Y$ , and let $B$ also be a topological space. If $f: A \to B$ is continuous when restricted to both $X$ and $Y$ , then $f$ is continuous. This result allows one to take two continuous functions defined on closed (or open) subsets of a topological space and create a new one. Proof : if U is a closed subset of B, then $f^{-1}(U )\cap X$ and $f^{-1}(U )\cap Y$ are both closed since the intersection of two closed sets is closed, and f restricted to both X and Y is continuous. Therefore, their union, f^{-1}(U) is also closed. A similar argument applies when X and Y are both open. \Box My main objection to this proof is that they say "" $f^{-1}(U )\cap X$ and $f^{-1}(U )\cap Y$ are both closed since the intersection of two closed sets is closed."" Which two closed sets are they referring to? It seems they have assumed that $f^{-1}(U )$ is closed to begin with. I have attempted the proof myself but I can't convince myself that that line is true for other reasons. If someone could simply present a detailed proof of the Pasting Lemma for a beginner to general topology I would be grateful. Thanks.",['general-topology']
838509,Linear combination of normally distributed variables,"We know that if $X \sim N_p(\mu, \Sigma)$ then $a'X \sim N(a'\mu,a'\Sigma a)$ for and $a \in \mathbb{R}_p$. What I need to know is if the converse of this is also true. Can this be proved? Would appreciate any assistance. Thanks Edit: Now I know this is true from what I have copied from Johnson's and Wichern's Applied multivariate statistical analysis. Only thing required now is the proof. Result 4.2 If $X$ is distributed normally as $N_p(\mu, \Sigma)$ then any linear combination of variables $a'X = a_1X_1 + a_2X_2 + \cdots + a_pX_p$ is distributed as $N(a'\mu, a'\Sigma a)$. Also, if $a'X$ is distributed as $N(a'\mu, a'\Sigma a)$ for every $a$, then $X$ must be $N_p(\mu, \Sigma)$.","['statistics', 'normal-distribution']"
838511,Question about English sentences in statistics?,"Can somebody help me interpreting the red circled sentences in planer English? I understand ""We view $y_i$ as a realization of a random variable $Y_i$ that can take the values of one and zero"" but the next following words, ""with probabilities $\pi_i$ and $1-\pi_i$"" , make me confused in interpreting the whole sentence.","['statistics', 'descriptive-statistics', 'statistical-inference', 'order-statistics']"
838514,Good book on advanced trig,"Is there a good book on trig that covers the geometry of the trig functions and how they relate to waves and SHM.  I've already taken calculus, so I'm looking for more of a Trig 2 type book -- if such a thing exists. Another interesting topic a Trig 2 book might cover (and that I'd be interested in) is trigonometry in non-Euclidean spaces: spherical trig, hyperbolic trig, etc.","['trigonometry', 'reference-request']"
838520,Is the Hardy Littlewood maximal function non- integrable ？,"Some books said that the Hardy Littlewood maximal function of f, denoted by $$Hf(x)=sup_{r>0} \frac{1}{m(B(x,r))}\int_{B(x,r)} |f(y)| dy $$ is bounded by a function $C|x|^{-n}$when the norm of $x$ is very large, namely $\exists$ constants $C$ and $R$, st$Hf\geq C|x|^{-n}, \forall |x|\geq R$. How to prove this inequality? I have no idea. 
Then from this inequality, can we say that $Hf$ is non-integrable?","['integration', 'real-analysis']"
838597,Prove that a function is differentiable if...,"I'm trying to prove that given a differentiable function $f: \mathbb{R}^2 \to \mathbb{R}^m$ in $p =(p_1, p_2) \in \mathbb{R}^2$, the function
$$ 
g(x, y) = f(x, y) - \frac{\partial f}{\partial x}(p)(x - p_1) - \frac{\partial f}{\partial y}(p)(y - p_2) 
$$
is also differentiable in $(x, y) = p$? Suppose that the partial derivatives in $p$ are $\neq 0$ and $f$ is once-differentiable. What is the easiest and fastest way to prove it (using composition or linearity maybe)? If works even if the domain of that function is $\mathbb{R}^n$ and
$$ g(\vec{x}) = f(\vec{x}) - \sum^n_{i = 1} \frac{\partial f}{\partial x_i}(p)(x_i - p_i)$$?","['multivariable-calculus', 'calculus', 'derivatives']"
838600,Splitting of the tangent bundle of a vector bundle and connections,"Let $\pi:E\to M$ be a smooth vector bundle. Then we have the following exact sequence of vector bundles over $E$: $$
0\to VE\xrightarrow{} TE\xrightarrow{\mathrm{d}\pi}\pi^*TM\to 0
$$ Here $VE$ is the vertical bundle, that is kernel of the bunble map $\mathrm{d}\pi$. This sequence splits, so there is a bundle morphism $\sigma:\pi^*TM\to TE$ such that $\mathrm{d}\pi\circ\sigma=\mathrm{Id}$. It can be shown that the data of such a $\sigma$ is equivalent to a connection (covariant derivative) $\nabla$ on $E\to M$ (see for instance the volume 2 of Greub-Halperin-Vanstone). Also we know that $VE\cong\pi^*E$ so that we can write the following decomposition: $$
TE\cong\pi^*E\oplus\pi^*TM
$$ My question is the following: considering $E$ as a manifold, I would like to consider differential forms on $E$, that is $\Gamma(\Lambda T^*E)$; is the De Rham differential linked to $\nabla$ in some way? Thank you for your help. Any reference would be very useful.","['exact-sequence', 'connections', 'vector-bundles', 'differential-geometry']"
838612,For what positive integers $p$ and $q$: $(p+1)!+(q+1)!=(pq)^2$,"I tried this problem using brute force and got the answers as $(3,4)$ and $(4,3)$,but is there a way to solve this question?","['elementary-number-theory', 'algebra-precalculus', 'diophantine-equations']"
838632,A problem relating to Schwarz' lemma,"Question. Let $f:D\rightarrow D$ holomorphic s.t. $f(1/2)+f(-1/2)=0$. Show that $|f(0)|\leq1/4$ My attempt at a solution: This seems like a Schwartz-lemmma type question (as discussed here ). If we could find a holomorphic function $\varphi:D \rightarrow D$ s.t.
$$\varphi(0)=1/2 \\ \varphi(1/4) = 0$$
Then we could define
$$g(z)=\frac{1}{2}\left[f(\varphi(z))+f(-\varphi(z))\right].$$
Since $g:D\rightarrow D$ is also holomorphic, and $g(0)=0$ we would have (by Swartz lemma)
$$|g(z)|\leq |z|,$$
and in particular,
$$|f(0)|=|g(1/4)|\leq 1/4.$$ I tried to find a Möbius map $\varphi$ that would satisfy the required conditions, but I'm pretty such $\varphi$ does not exist. Any thoughts? Thanks!",['complex-analysis']
838644,line integral: anticlockwise parametrisation in $\mathbb R^3$,"Consider $\gamma$ given by the sides of the triangle with vertices $(0,0,1)^t$, $(0,1,0)^t$ and $(1,0,0)^t$. So $\gamma$ runs through the sides of the triangle. Let $f(x,y,z)=(y,xz,x^2)$. I want to calculate $\int_\gamma f(\gamma(t))\cdot\dot\gamma(t)\,\mathrm{d}t$. So I have to calculate this integral for every side of the triangle. I know I have to go anticlockwise. So do we get $\gamma_1(s)=(1,0,0)^ts+(0,1,0)^t(1-s)$ or $\gamma_1(s)=(0,1,0)^ts+(1,0,0)^t(1-s)$ for $s\in[0,1]$? From where do you consider the ""anticlockwise direction""? I would guess we are looking from $(0,0,0)^t$. But if you're looking from outside the triangle we get the other way around. I am a bit confussed. In one or two dimensions it's easy to see but in higher dimensions not. So from where are you looking at the triangle?","['calculus', 'integration', 'vector-analysis', 'real-analysis', 'analysis']"
